26726035,郝鄰居企業社,臺北市大同區環河北路2段95號,五金批發業
14717624,紳騏企業行,臺北市大同區承德路2段100號1樓,五金批發業
01519621,以馬內利行銷企業社,臺北市中正區漢口街1段110號5樓之7,五金批發業
31873612,力虹電動車行,臺北市信義區中坡南路142號144號,五金批發業
48698245,恆億水電材料行,臺北市文山區恆光街14巷16號1樓,五金批發業
38582224,馨馨服飾店,臺北市大同區民生西路47號捷運中山地下街B66號店鋪,五金批發業
38575482,日連百貨文具行,臺北市中山區中山北路2段96巷52號1樓,五金批發業
48857117,東大工坊,臺北市南港區興南街60巷23號4樓,五金批發業
31154731,宇進企業社,臺北市士林區通河西街2段175號1樓,五金批發業
26252521,金鼎工程行,臺北市大同區昌吉街121號,五金批發業
26366355,升星儀隊配件企業社,臺北市信義區嘉興街309號5樓,五金批發業
42270693,利群實業社,臺北市士林區重慶北路4段41號1樓,五金批發業
14317107,亞森行,臺北市中山區長安東路1段28號,五金批發業
02152426,新代植筋社,臺北市信義區基隆路1段155號13樓之5,五金批發業
25549265,奇芳工作室,臺北市大安區延吉街126巷14號,五金批發業
98884032,三宇企業社,臺北市中正區西藏路114號1樓,五金批發業
83940134,盛頂建材行,臺北市士林區社中街330號1樓,五金批發業
