31873676,露天廣告企業社,臺北市中正區同安街69巷1號3樓,五金批發業
25657030,大佳玻璃工程行,臺北市中山區龍江路377巷1號5樓,五金批發業
21704194,源進洋行,臺北市大同區太原路47號〈1樓〉,五金批發業
01130298,順達汽車材料行,臺北市大同區南京西路64巷24弄5號,五金批發業
38559455,石尚石材行,臺北市南港區八德路4段891號3樓,五金批發業
31955424,享咖啡企業社,臺北市大安區仁愛路4段71巷9號(1樓),五金批發業
25512648,凱程企業社,臺北市文山區景福街230巷14號1樓,五金批發業
26210500,義張椅子專賣店,臺北市大安區文昌街188號,五金批發業
73918400,世業企業社,臺北市士林區通河西街2段205之1號3樓,五金批發業
31860932,民文企業社,臺北市萬華區武成街11巷11號1樓,五金批發業
41366283,正德興業,臺北市大同區承德路2段83之2號,五金批發業
49986510,宏記洋行,臺北市大同區重慶北路1段67號8樓之2,五金批發業
14337069,宏昇國際機械企業社,臺北市信義區基隆路2段131之5號12樓,五金批發業
31877482,國順塑膠企業社,臺北市中正區忠孝西路1段72號11樓之18,五金批發業
38473056,聚鑫工程行,臺北市中正區北平東路20號3樓,五金批發業
31870805,米哇企業社,臺北市信義區永吉路170號12樓,五金批發業
25577803,分享工房,臺北市內湖區星雲街168巷43號3樓之1,五金批發業
38508739,宇鑫工程行,臺北市大同區承德路2段155巷7號,五金批發業
10315296,豐樺企業社,臺北市萬華區東園街28巷50號地下1樓之1,五金批發業
48823285,友鼎機電行,臺北市松山區南京東路5段230號15樓之8,五金批發業
38564648,長業企業社,臺北市大同區華陰街227巷7號,五金批發業
31954826,東津甫企業社,臺北市內湖區大湖街137號,五金批發業
42268660,柱姐工坊,臺北市中正區臨沂街44巷3號1樓,五金批發業
13827216,奕捷企業社,臺北市中山區新生北路3段10號7樓之4,五金批發業
03263006,昇源水電行,臺北市中正區金山南路1段110巷20號1樓,五金批發業
31552941,鈺山企業社,臺北市內湖區民權東路6段47巷10弄6號,五金批發業
25537704,瓏成企業社,臺北市士林區社子街126巷20號3樓,五金批發業
66994438,玖鑫工程行,臺北市北投區榮華一路1之6號地下一層,五金批發業
31870024,上德石材工程行,臺北市內湖區康樂街204之1號,五金批發業
01398669,六陞企業社,臺北市北投區知行路2巷2號1樓,五金批發業
17084165,佳譽商行,臺北市大同區鄭州路23號1樓,五金批發業
48725003,聯璨商行,臺北市松山區民生東路5段79號1樓,五金批發業
31874422,闊喜工房,臺北市信義區基隆路2段22號6樓之6,五金批發業
14310441,冠?企業社,臺北市內湖區內湖路1段411巷92號1樓,五金批發業
01817311,翊育企業社,臺北市士林區延平北路5段316號4樓,五金批發業
31853469,有鈞國際貿易企業社,臺北市中山區林森北路85巷39號6樓,五金批發業
31951807,洋成建材行,臺北市文山區木柵路4段18號,五金批發業
26347689,年勝企業社,臺北市內湖區康樂街155號5樓,五金批發業
21753271,文呈企業社,臺北市士林區社中街210巷21弄26號1樓,五金批發業
13475893,德龍車業行,臺北市士林區故宮路41巷1號1樓,五金批發業
48718191,南迴五金行,臺北市文山區新光路1段159巷5號2樓,五金批發業
25542657,亞奇數位科技商業社,臺北市南港區興華路114巷16號2樓,五金批發業
31871895,承鴻企業社,臺北市信義區光復南路495號,五金批發業
31962918,富林企業管理社,臺北市南港區興華路30巷11號,五金批發業
20964896,來來五金行,臺北市松山區基隆路1段1號,五金批發業
38459809,四月雨咖啡館,臺北市大安區忠孝東路4段216巷40弄18號1樓,五金批發業
26218860,順成木材行,臺北市萬華區長沙街2段174號,五金批發業
09959333,熙葆企業行,臺北市大安區辛亥路2段121號2樓,五金批發業
26750294,亞丁傢俱生活館,臺北市大安區忠孝東路4段148號7樓,五金批發業
38557344,好鄰居人力工程行,臺北市大同區環河北路2段95號,五金批發業
38497607,暐創工程行,臺北市內湖區康寧路3段56巷1號10樓之2,五金批發業
38502051,富堡工程行,臺北市萬華區青年路68巷3弄9號7樓,五金批發業
05194005,久林建材行,臺北市中正區泉州街43之1號,五金批發業
26351867,東洲企業社,臺北市大同區民生西路272號6樓,五金批發業
31956140,達鑽商行,臺北市中山區民生東路3段1號3樓,五金批發業
48721392,永昇五金行,臺北市大安區四維路154巷11號1樓,五金批發業
09644691,禾力實業社,臺北市信義區基隆路1段155號13樓之5,五金批發業
26354864,八路企業社,臺北市北投區中央北路4段138巷8號,五金批發業
38512446,劼磊工作室,臺北市中山區南京東路3段189號4樓,五金批發業
31954240,冠磊商行,臺北市北投區泉源路28號地下樓,五金批發業
26254106,台灣精品生活館,臺北市中山區民生東路1段25號5樓之23,五金批發業
38569828,中美五金行,臺北市信義區吳興街220巷77號1樓,五金批發業
38515149,見張工程行,臺北市信義區松山路249巷15號,五金批發業
10367961,耐震工程行,臺北市松山區八德路4段602號11樓之6,五金批發業
13848612,達霖行,臺北市士林區通河西街2段55號1樓,五金批發業
99957173,萬立工程行,臺北市信義區松信路134號1樓,五金批發業
10352334,宏洋工程行,臺北市北投區豐年路2段76號,五金批發業
38562515,翼德工程行,臺北市中山區林森北路259巷17號6樓之5,五金批發業
10648421,耀鋒企業社,臺北市中正區許昌街42之1號10樓,五金批發業
13366065,潔安特企業社,臺北市萬華區昆明街46號7樓之41,五金批發業
38473838,長和工程行,臺北市中山區長安東路1段27號9樓之1,五金批發業
26251065,巧工工程行,臺北市內湖區行善路37號8樓,五金批發業
31958766,詮瑞新企業社,臺北市文山區萬利街1號,五金批發業
30369050,予彤工程行,臺北市松山區寶清街5號,五金批發業
25663737,希也樂國際企業社,臺北市松山區塔悠路292號,五金批發業
17522854,欣佳國際企業社,臺北市北投區西安街2段251號4樓,五金批發業
04575111,三和衡器行,臺北市萬華區萬大路504號,五金批發業
94904830,上意企業行,臺北市大同區環河北路1段103號9樓,五金批發業
26371012,惠淳工程行,臺北市萬華區西昌街96號,五金批發業
38571937,順德企業行,臺北市信義區信義路6段53號1樓,五金批發業
31956388,冠宸國際企業社,臺北市士林區承德路4段198號3樓,五金批發業
38555922,丞勝工程行,臺北市中山區松江路185號6樓之2,五金批發業
14741096,蘭桂洋行,臺北市大安區安和路2段171巷19號1樓,五金批發業
38508082,勝群工程行,臺北市大同區鄭州路119號2樓之3,五金批發業
38576948,健康企業行,臺北市大同區重慶北路3段205巷32之7號4樓,五金批發業
31848537,馻肯實業社,臺北市大同區重慶北路3段223巷1弄3之3號4樓,五金批發業
31957247,福冠企業行,臺北市北投區中和街245號,五金批發業
48751108,立正企業社,臺北市文山區興隆路1段163號,五金批發業
26510909,泳灃企業社,臺北市士林區葫蘆街130號1樓,五金批發業
19874355,大昶企業社,臺北市文山區興隆路4段23號2樓,五金批發業
31848327,五峰石藝社,臺北市大同區南京西路185巷7號3樓之12,五金批發業
09892087,開源地板工程行,臺北市中正區金山南路1段97號,五金批發業
48776234,維安實業社,臺北市中山區新生北路2段76巷10號1樓,五金批發業
48815497,佑得企業社,臺北市大安區通化街39巷50弄65號,五金批發業
31578421,萬薪企業社,臺北市大安區忠孝東路4段221號10樓,五金批發業
01290371,一一大台北企業行,臺北市中山區新生北路2段72巷17號2樓之1,五金批發業
38474409,丞暘五金商行,臺北市內湖區內湖路2段339巷6號,五金批發業
38462071,達育企業社,臺北市中山區興安街51之8號1樓,五金批發業
42269627,泰泓工程行,臺北市南港區市民大道7段26號2樓,五金批發業
38513613,源榕五金行,臺北市大同區延平北路2段60巷9號1樓,五金批發業
48766799,昱融工程企業行,臺北市中正區忠孝東路2段120號4樓,五金批發業
48822808,一成工程行,臺北市大同區保安街49巷24號,五金批發業
30293860,富昇工程行,臺北市士林區通河西街2段146號3樓,五金批發業
48954906,耕圃工程行,臺北市中山區民權東路2段26號6樓之1,五金批發業
48807980,金齊企業社,臺北市大安區忠孝東路4段235號11樓,五金批發業
73901816,宜承玻璃行,臺北市萬華區雙園街60巷2號1樓,五金批發業
15635488,嘉年長鴻企業社,臺北市文山區政大二街98號3樓,五金批發業
21762341,大都會工程行,臺北市萬華區中華路2段150巷15號1樓,五金批發業
73916711,和盛企業社,臺北市信義區福德街77號,五金批發業
78493162,高欣電氣行,臺北市中山區吉林路161巷11號之1、1樓,五金批發業
38511050,金佳億家具行,臺北市中正區仁愛路1段49號,五金批發業
73910408,百晟自動化企業社,臺北市文山區指南路3段73號5樓之1,五金批發業
48797168,大仕林實業社,臺北市大同區庫倫街27號,五金批發業
31442109,酷鎷企業工作坊,臺北市中正區北平東路24號2樓之5,五金批發業
48684782,誠實商行,臺北市內湖區東湖路25號1樓,五金批發業
38564942,磊飛國際企業社,臺北市文山區萬盛街146巷1號,五金批發業
17742055,鉅聖工程行,臺北市內湖區康樂街20巷37號2樓,五金批發業
78065751,尚燁商行,臺北市大安區富陽街130號1樓,五金批發業
48717735,永力工程行,臺北市萬華區長泰街135號1樓,五金批發業
48907685,禾協企業行,臺北市中山區吉林路333號1樓,五金批發業
48755168,建元冷材行,臺北市北投區致遠一路2段50號1樓,五金批發業
38511586,指娃娃美甲工坊,臺北市中山區永安里北安路518巷14弄19號,五金批發業
31856557,銘輝鋁門窗行,臺北市南港區東新街6號,五金批發業
14740420,日益工作室,臺北市內湖區康寧路3段75巷272號2樓,五金批發業
25665720,椿之家小舖,臺北市松山區南京東路5段326號3樓,五金批發業
25666930,瑞億工程行,臺北市萬華區忠孝西路2段38號9樓之6,五金批發業
10387615,立鉅企業社,臺北市信義區吳興街90號,五金批發業
99987021,永裕昌鋁門窗工程行,臺北市文山區木新路3段310巷12弄15號1樓,五金批發業
99422925,北欣砂石企業行,臺北市士林區中正路601號7樓之2,五金批發業
26251537,加菲工程行,臺北市信義區莊敬路289巷8弄30號3樓,五金批發業
07639172,萬佳五金行,臺北市大同區敦煌路66號1樓,五金批發業
99990378,新響工程行,臺北市大安區復興南路1段107巷5弄19之1號1樓,五金批發業
48894252,鈺民廣告工程行,臺北市士林區延平北路5段63號,五金批發業
26255766,麒麟水族設計企業社,臺北市松山區民權東路5段54號1樓,五金批發業
25540829,優異安控工程行,臺北市中正區羅斯福路3段100之101號,五金批發業
17748945,陸谷行,臺北市大同區民族西路225巷38之2號1樓,五金批發業
99957259,光成實業社,臺北市文山區辛亥路7段84巷14號2樓,五金批發業
31346133,昇煜五金行,臺北市士林區通河西街2段111號1樓,五金批發業
31871348,威竑工程行,臺北市內湖區安康路434巷36號5樓,五金批發業
67798363,錴和企業社,臺北市內湖區東湖路160巷10弄37號,五金批發業
01816283,昇峰模具企業社,臺北市士林區永平街71號1樓,五金批發業
18091501,尚進五金行,臺北市內湖區麗山街328巷10號,五金批發業
38555319,飛翔裝潢工程行,臺北市信義區忠孝東路5段1之8號12樓,五金批發業
31594750,翊信企業社,臺北市中山區南京東路2段137號14樓,五金批發業
05502565,裕祥裝潢材料行,臺北市文山區羅斯福路6段149號1樓,五金批發業
38514562,青果園鮮萃飲品企業社,臺北市大安區和平東路1段159之2號,五金批發業
25570359,金泓行,臺北市松山區民族東路683之1號3樓,五金批發業
48950319,振豐精密企業社,臺北市松山區光復北路96號8樓,五金批發業
99329771,友啟企業社,臺北市士林區通河東街1段124巷6弄5號1樓,五金批發業
25659065,禾鑫企業社,臺北市松山區八德路3段225號3樓之6,五金批發業
38577566,鑫唐企業社,臺北市北投區東華街1段38號,五金批發業
26215723,芃芃玩具店,臺北市大同區太原路100號1樓,五金批發業
30287918,鈺發企業社,臺北市北投區致遠二路125巷13號2樓,五金批發業
17745454,巨翔車業行,臺北市松山區八德路4段401號,五金批發業
81637543,康鑫起重工程行,臺北市南港區研究院路3段86巷27弄1號1樓,五金批發業
42269892,千岳工程行,臺北市萬華區萬青街195號2樓,五金批發業
25574257,佳隆水電工程行,臺北市文山區辛亥路4段166巷17號,五金批發業
26228184,唐驛土木工程行,臺北市士林區和豐街8號,五金批發業
49897117,立維企業社,臺北市北投區大業路578號4樓,五金批發業
48856166,和泰五金行,臺北市南港區南港路2段258號,五金批發業
26235679,順達餐桌椅專賣店,臺北市中正區和平西路2段17號,五金批發業
48743419,威普企業社,臺北市中正區和平西路1段86號9樓,五金批發業
48854759,新建工程行,臺北市北投區大業路388號1樓,五金批發業
09701897,伍義工程行,臺北市內湖區東湖路106巷7弄5號4樓,五金批發業
26366377,天邑資源回收處理場,臺北市士林區延平北路9段259號,五金批發業
99329391,盛元香品商行,臺北市北投區公館路67號1樓,五金批發業
25577944,崴鴻科技企業社,臺北市文山區興隆路2段220巷65弄31之2號,五金批發業
49897117,立維企業社,臺北市北投區大業路578號4樓,五金批發業
18409612,啟盟科技企業社,臺北市萬華區雅江街58號,五金批發業
26341545,濮合元實業社,臺北市松山區三民路107巷10號2樓,五金批發業
48896842,世界光企業社,臺北市大安區文昌街228號,五金批發業
38497894,豪客商行,臺北市萬華區西藏路113號8樓,五金批發業
48740145,溢誠鐵材行,臺北市內湖區內湖路3段343巷1弄9號2樓,五金批發業
25573953,博士通冷氣水電工程行,臺北市大同區承德路3段55號3樓,五金批發業
07621790,宏銘行,臺北市大同區承德路2段140號1樓,五金批發業
26238731,朋友工作室,臺北市文山區福興路78巷20弄13號2樓,五金批發業
17766582,盧森堡企業社,臺北市萬華區桂林路143號11樓,五金批發業
25673138,順煒機械工程行,臺北市內湖區安泰街129巷1之1號,五金批發業
01673145,馨鈴商行,臺北市南港區研究院路3段68巷22號,五金批發業
14314621,金立企業社,臺北市士林區葫蘆街23巷3號1樓,五金批發業
14316450,諸易企業社,臺北市萬華區萬大路449巷31號1樓,五金批發業
01638083,立德機械五金行,臺北市內湖區新明路125號(1樓),五金批發業
10626658,夢想家興業社,臺北市中山區長春路202號1樓,五金批發業
31859127,丞昕企業商行,臺北市中山區南京東路1段86號10樓,五金批發業
48799412,佳鎂洋行,臺北市士林區中正路501號16樓,五金批發業
01383048,利榮五金行,臺北市北投區自強街5巷71號1樓,五金批發業
18462910,駿羿工程行,臺北市南港區市民大道7段26號2樓,五金批發業
48921672,健恆電器工程行,臺北市松山區南京東路5段23巷9弄2號,五金批發業
29200870,世紀企業社,臺北市中正區漢口街1段31號4樓,五金批發業
25551162,銀侖企業社,臺北市大同區昌吉街69號4樓,五金批發業
26209779,榆果工作室,臺北市文山區辛亥路7段82之1號,五金批發業
20754759,大進汽車材料行,臺北市信義區松隆路23號1樓,五金批發業
26365996,勝霖工程行,臺北市中山區南京東路2段20號3樓,五金批發業
48773530,承翔企業社,臺北市士林區中正路611號4樓,五金批發業
38459673,友誠起重企業社,臺北市中山區南京東路2段76號4樓,五金批發業
38463395,裕雄企業社,臺北市內湖區新明路380巷6弄7號2樓,五金批發業
26365742,邦策起重工程行,臺北市文山區景福街24號1樓,五金批發業
31952714,正禮企業社,臺北市士林區延平北路7段107巷9號,五金批發業
31580171,鑫采工程行,臺北市萬華區昆明街201巷8號1樓,五金批發業
38510897,三邑企業社,臺北市大同區延平北路3段104巷3之3號5樓,五金批發業
99981075,東英工程行,臺北市大同區承德路3段273號,五金批發業
38581323,中隆企業社,臺北市大安區新生南路3段2號10樓,五金批發業
25533290,允凍商行,臺北市北投區清江路25巷26號,五金批發業
38496706,湧盛水電工程行,臺北市中山區南京東路3段189號4樓,五金批發業
01385405,宏國砂石行,臺北市北投區中央北路2段95巷1弄42號2樓,五金批發業
30985287,幸安五金建材行,臺北市大安區忠孝東路3段217巷4弄1之1號1樓,五金批發業
31716331,微笑實業,臺北市北投區三合街2段489號,五金批發業
38577735,上譽工程行,臺北市中山區吉林路199巷17號2樓,五金批發業
26367468,凱興行,臺北市萬華區中華路2段364巷24弄28號,五金批發業
78413800,大地工程行,臺北市中山區中山北路2段128巷3之3號(1樓),五金批發業
10338967,上好廣告工程行,臺北市大同區哈密街63巷16號,五金批發業
48750641,筑霖企業社,臺北市文山區興隆路3段207巷16弄10號,五金批發業
38562487,華山裝璜修繕工程行,臺北市大安區忠孝東路4段206之1號4樓,五金批發業
25672243,臣松工程行,臺北市中山區南京西路1之1號6樓,五金批發業
21720461,富樂商行,臺北市大安區信義路2段230號8樓之2,五金批發業
13454790,晶華企業社,臺北市大安區忠孝東路4段223巷77號,五金批發業
98116384,易城工程行,臺北市信義區基隆路1段155號8樓之8,五金批發業
26337492,房子的問題工作室,臺北市松山區健康路442號,五金批發業
31960741,尼本夏達企業社,臺北市松山區南京東路4段197號9樓之1,五金批發業
48756645,松杰汽車材料行,臺北市大同區太原路11巷18號1樓,五金批發業
31858788,飛登國際商行,臺北市大同區承德路1段32號12樓之12,五金批發業
48936350,豐盛工程行,臺北市大同區大龍街45號,五金批發業
08599466,成功機械行,臺北市內湖區成功路2段256號1樓,五金批發業
99362530,東昇鋁門窗行,臺北市內湖區成功路4段61巷49號1樓,五金批發業
10352101,金萬億企業行,臺北市萬華區環河南路1段185號,五金批發業
26750219,甜美家企業社,臺北市大同區庫倫街21號,五金批發業
48843563,朗璟設計工程工作室,臺北市中山區松江路283號5樓,五金批發業
38579425,亦翔工程行,臺北市北投區中央北路4段456巷2號,五金批發業
49896567,勁勇建材五金行,臺北市南港區重陽路10號,五金批發業
30369002,芳萱企業社,臺北市文山區羅斯福路5段236巷30號3樓,五金批發業
31872141,智勝壁紙材料行,臺北市大安區溫州街12巷24弄1號1樓,五金批發業
38566688,創建企業社,臺北市北投區西安街1段281巷19號4樓,五金批發業
25538540,富裕五金行,臺北市萬華區環河南路1段42號21號攤位,五金批發業
98888847,瑞暉水電工程行,臺北市文山區景興路188號23樓之6,五金批發業
25557356,上豪五金生活百貨館,臺北市士林區華榮街79號,五金批發業
38497634,渢格眼鏡行,臺北市文山區木新路2段271號1樓,五金批發業
48694901,慶益機電工程材料行,臺北市中山區復興北路488巷1弄11號1樓,五金批發業
09808770,木林實業社,臺北市北投區立農街1段32號3樓,五金批發業
38499078,芫泰工程行,臺北市中山區南京東路1段34號7樓,五金批發業
73876794,茂迅企業社,臺北市信義區中坡南路70巷7號1樓,五金批發業
26212850,迷你工程行,臺北市信義區基隆路1段35巷7弄10號1樓,五金批發業
13465353,美天電機工程行,臺北市大同區民權西路136號7樓之11,五金批發業
31842772,雲台山工程行,臺北市文山區木新路2段79巷6弄11號3樓,五金批發業
07618970,文龍建材行,臺北市大同區延平北路4段88號,五金批發業
21717233,抱花戶手創花藝設計坊,臺北市中山區林森北路85巷2之1號3樓,五金批發業
83903807,順祥天然有機食品坊,臺北市中正區重慶南路3段15巷23號1樓,五金批發業
26373216,明峰通信企業社,臺北市南港區重陽路166巷8號,五金批發業
26307589,黑布朗咖啡專賣店,臺北市中山區長安東路2段129巷4號,五金批發業
26256224,樂我洋行,臺北市中山區農安街255號1樓,五金批發業
25570421,珩泰創意工作室,臺北市信義區忠孝東路5段236巷3弄25號3樓,五金批發業
99976734,明合企業社,臺北市南港區成福路178巷22號1樓,五金批發業
04862140,耀程建材行,臺北市文山區興隆路1段191號1樓,五金批發業
31448011,欣嬅企業社,臺北市內湖區文德路90巷34號7樓之2,五金批發業
17760193,弘巨企業社,臺北市南港區南港路3段130巷3弄8號3樓,五金批發業
38567455,全億工程行,臺北市信義區松山路256號8樓,五金批發業
25541566,滿鑫行,臺北市中山區吉林路299巷7號,五金批發業
21757213,淼鑫工程行,臺北市北投區大興街84號1樓,五金批發業
81739680,家慶企業社,臺北市南港區忠孝東路6段159巷4弄7號3樓,五金批發業
27171815,大峰利商行,臺北市士林區德行東路109巷5號1樓,五金批發業
13450746,鈺達水電冷氣材料行,臺北市士林區延平北路6段116巷15弄7號1樓,五金批發業
48880200,萬事通商行,臺北市士林區美德街74號,五金批發業
26211199,均茂企業社,臺北市萬華區環河南路2段222號3樓,五金批發業
10664723,金鈴服裝材料行,臺北市大同區延平北路2段35號5樓,五金批發業
38578283,艾森工程行,臺北市萬華區國興路68號5樓,五金批發業
31948389,葉記工程行,臺北市內湖區港墘路82巷7弄19號5樓,五金批發業
31863179,靜山手創社,臺北市大同區延平北路2段55號(1樓),五金批發業
34755596,紘庠汽車商行,臺北市中山區龍江路429巷8號3樓,五金批發業
31861778,基米實業社,臺北市內湖區內湖路3段143巷10號,五金批發業
76750495,佳鑫機械實業社,臺北市中正區汀州路2段127巷13號,五金批發業
38514079,柏彥企業社,臺北市中山區南京東路2段174號8樓,五金批發業
31966463,金平工程行,臺北市內湖區成功路2段250巷12弄3號4樓,五金批發業
25563809,祥富建材行,臺北市士林區社正路66號1樓,五金批發業
25665475,美強生工作室,臺北市南港區南港路2段36號,五金批發業
31960279,群鉅工程行,臺北市中山區中山北路3段26號3樓,五金批發業
48717995,原愷商行,臺北市內湖區內湖路3段134號,五金批發業
81741807,順昇企業社,臺北市信義區松山路541巷7號2樓,五金批發業
38472654,夏米爾企業社,臺北市南港區成福路194巷6號5樓之1,五金批發業
26254859,科炬裝潢工程行,臺北市萬華區萬大路171號5樓,五金批發業
38556598,僑通實業社,臺北市內湖區金湖路46巷6弄10號4樓,五金批發業
80982341,億世代工程企業行,臺北市文山區集英街13號,五金批發業
73913159,鴻藝企業社,臺北市松山區松河街260號1樓,五金批發業
14737327,財健企業社,臺北市中山區中山北路2段128巷6弄5號4樓,五金批發業
42271004,正展建材行,臺北市大同區華陰街167號1樓,五金批發業
25579128,寓傢企業社,臺北市中山區德惠街34號8樓之17,五金批發業
98893975,錩暉企業社,臺北市內湖區康寧路1段98號1樓,五金批發業
38500336,吉連興工程行,臺北市萬華區東園街28巷30號,五金批發業
38562064,兩岸雲端企業社,臺北市萬華區昆明街305號,五金批發業
25544352,銘雅企業社,臺北市信義區吳興街600巷49號,五金批發業
26340222,鼎曜工程行,臺北市松山區南京東路5段296號10樓,五金批發業
80984848,宏昇商行,臺北市中山區錦州街386號,五金批發業
31873015,利銓企業社,臺北市文山區木柵路2段161巷8號,五金批發業
38465458,美傑洋行,臺北市中山區農安街13之2號2樓,五金批發業
38552220,轟陽實業社,臺北市士林區社中街346巷2弄7號1樓,五金批發業
31860378,鉅正工程行,臺北市大安區敦化南路2段63巷21弄31號地下,五金批發業
13837761,廣承企業行,臺北市中正區羅斯福路3段210巷8弄7之12號,五金批發業
77136997,樹山企業行,臺北市萬華區三水街25巷5號1樓,五金批發業
15641480,騏詮商行,臺北市南港區興中路28巷4號,五金批發業
29201646,有威企業社,臺北市信義區中坡北路15巷16號1樓,五金批發業
31858648,冠睿商行,臺北市中山區林森北路472號7樓之13,五金批發業
48770442,崴通儀器行,臺北市大安區和平東路3段308巷68號,五金批發業
26239302,泉威國際商行,臺北市信義區松隆路102號19樓,五金批發業
25661652,翊筌鋁窗材料行,臺北市北投區中和街441巷1弄1號,五金批發業
26343071,新元大鑄印社,臺北市中山區民權西路35號9樓,五金批發業
