10320501,佳慧企業社,臺北市士林區延平北路6段116巷49弄6號,五金批發業
31876580,吉泰實業社,臺北市士林區大南路252號1樓,五金批發業
29239930,予宙石材行,臺北市士林區延平北路8段80巷53弄4號,五金批發業
01404677,兆勝企業社,臺北市北投區崇仁路1段28號,五金批發業
04518512,建成工具行,臺北市大同區重慶北路1段100號1樓,五金批發業
41100355,世霖實業社,臺北市大同區民權西路122號6樓之1,五金批發業
26244712,楓葉商行,臺北市北投區中和街55號2樓,五金批發業
48809158,兆翔企業社,臺北市信義區福德街151巷4號,五金批發業
41019910,富海工程行,臺北市信義區虎林街57之21號1樓,五金批發業
34773356,勝磊工程行,臺北市南港區富康街49巷3號3樓,五金批發業
38471803,程虹企業社,臺北市松山區八德路4段602號6樓之5,五金批發業
01540146,鴻逸汽車商行,臺北市信義區忠孝東路5段743巷19號1樓,五金批發業
10609497,盛穎企業社,臺北市大同區民權西路236號2樓,五金批發業
48883987,蕙玉企業社,臺北市士林區中山北路6段172巷22弄3號3樓,五金批發業
14077943,和信企業行,臺北市士林區承德路4段1巷9號,五金批發業
77515408,宏欣廣告工程行,臺北市大同區環河北路1段69號1樓,五金批發業
38502952,雯浩商號,臺北市南港區興中路12巷9號,五金批發業
31848038,祥合企業社,臺北市中正區汀州路1段149巷13號,五金批發業
80887297,松億精品行,臺北市北投區公館路292巷16號1樓,五金批發業
26209829,佳和國際社,臺北市大安區羅斯福路3段187號,五金批發業
10393031,誠鎰金屬企業社,臺北市南港區新民街100號,五金批發業
02113769,曜麒企業社,臺北市信義區松山路540巷3弄19號,五金批發業
10340112,禾昇工程行,臺北市信義區基隆路1段155號7樓,五金批發業
26757297,培基企業社,臺北市中山區民族東路60號7樓之8,五金批發業
03369009,莊昌吉文具禮品印刷社,臺北市萬華區西寧南路82巷4號,五金批發業
30362057,泳信工程行,臺北市北投區中和街502巷8弄11之1號1樓,五金批發業
25571272,奕發企業社,臺北市士林區承德路4段277巷66號,五金批發業
38575292,華麗空間設計社,臺北市松山區民生東路5段204號2樓之2,五金批發業
26367690,瑞遠工程行,臺北市文山區辛亥路7段15號,五金批發業
34514274,明鴻五金行,臺北市大同區環河北路2段271號,五金批發業
38495544,勗立工程行,臺北市文山區木柵路2段109巷100弄46號16樓,五金批發業
38468835,綵葳服飾精品店,臺北市松山區民生東路5段212巷11號1樓,五金批發業
48583433,國訓企業社,臺北市士林區社中街237號1樓,五金批發業
38474338,靖勝五金行,臺北市大同區太原路50之2號3樓,五金批發業
78413800,大地工程行,臺北市中山區中山北路2段128巷3之3號(1樓),五金批發業
93922064,高宇企業行,臺北市萬華區和平西路3段300之11號1樓,五金批發業
38570178,興紘企業社,臺北市中正區八德路1段46號9樓,五金批發業
37994064,震川創作空間規劃工作室,臺北市大同區承德路2段137號8樓之4,五金批發業
98910947,鼎昌企業社,臺北市萬華區南寧路62號6樓,五金批發業
26248359,鼎興行,臺北市文山區羅斯福路5段95號2樓,五金批發業
80996534,良易企業社,臺北市北投區東華街1段540號3樓,五金批發業
48876439,大利行,臺北市大同區太原路138號,五金批發業
26215625,盛庭工程行,臺北市中山區松江路318號13樓,五金批發業
09859931,鈦合鑫企業社,臺北市中山區南京東路3段189號4樓,五金批發業
31871641,一嘉空調工程行,臺北市南港區市民大道8段532號,五金批發業
10321184,捷創貿易行,臺北市松山區八德路3段12巷17弄21號,五金批發業
31861263,鴻頂安防實業社,臺北市大同區哈密街83巷1號3樓,五金批發業
94900779,友誠工程行,臺北市內湖區港華街30號2樓,五金批發業
25660372,乾益企業社,臺北市士林區延平北路8段2巷153弄71之1號,五金批發業
38462585,雨傘大王商行,臺北市萬華區武昌街2段56號,五金批發業
25541192,奉龍聖起裝潢工程行,臺北市中山區(南)中原街91號,五金批發業
48763723,瑞鴻工程行,臺北市士林區重慶北路4段81號7樓之5,五金批發業
38515197,美立堅快速捲門企業社,臺北市信義區忠孝東路5段743巷1弄1號3樓,五金批發業
48957299,銘城實業社,臺北市內湖區東湖路49號3樓,五金批發業
17818343,貿順工程行,臺北市萬華區萬大路550號2樓,五金批發業
15632052,舜發石材工程行,臺北市信義區基隆路1段155號8樓之8,五金批發業
78201186,龍城五金工程行,臺北市文山區木柵路4段159巷174之1號,五金批發業
31953875,尚妍企業社,臺北市士林區大南路415號3樓,五金批發業
38553972,米思特黏企業社,臺北市信義區光復南路525號8樓,五金批發業
94912297,吉裕冷氣工程行,臺北市中山區中山北路3段53之4號6樓,五金批發業
31954190,成泰興業社,臺北市中正區南海路93巷28號,五金批發業
26349960,技美汽車電機材料商行,臺北市萬華區西藏路350號1樓,五金批發業
13848818,禮合企業社,臺北市萬華區寶興街80巷47號,五金批發業
31873578,新華國企業社,臺北市文山區富山路1巷16號4樓,五金批發業
48687747,祥和企業社,臺北市大安區新生南路2段30巷35號2樓之1,五金批發業
04810447,竣祥企業行,臺北市內湖區陽光街155號1樓,五金批發業
38502518,星燁企業社,臺北市大安區臨江街104號,五金批發業
26367925,興連財企業社,臺北市信義區莊敬路178巷2號8樓,五金批發業
04206308,金祥珠寶藝品商行,臺北市中正區忠孝西路1段102號11樓,五金批發業
38570439,聖誕小姐企業社,臺北市大同區南京西路163號2樓之21,五金批發業
26246697,全成木材行,臺北市大同區興城街85號1樓,五金批發業
14341417,鉅欣企業社,臺北市士林區延平北路6段116巷29號1樓,五金批發業
26217834,永詮起重工程行,臺北市南港區舊莊街1段281號3樓,五金批發業
13467303,景久工程行,臺北市文山區三福街4巷17號,五金批發業
25564526,雅軒烤漆企業社,臺北市士林區忠誠路2段118巷15弄7號,五金批發業
17633845,永昭洋行,臺北市文山區羅斯福路5段236巷4號1樓,五金批發業
10067113,廣明水電工程行,臺北市南港區研究院路2段35巷23弄12號3樓,五金批發業
38571520,宏翊工程行,臺北市內湖區康樂街20巷10號3樓,五金批發業
37889099,漢晶企業社,臺北市士林區中山北路5段250號,五金批發業
10322016,政印企業社,臺北市中正區濟南路2段49之2號5樓之1,五金批發業
25504680,大進企業社,臺北市士林區社子街98巷14號,五金批發業
38576855,秀真誠行,臺北市中正區齊東街82巷36號1樓,五金批發業
38567498,乾鋒工程行,臺北市信義區忠孝東路5段1之10號11樓,五金批發業
38579987,北一企業社,臺北市大同區太原路79巷4號,五金批發業
04466845,宏原行,臺北市中正區齊東街82巷36號1樓,五金批發業
38559672,德陞監視科技行,臺北市萬華區中華路1段22號,五金批發業
25524588,大正油漆工程行,臺北市士林區承德路4段6巷91號,五金批發業
25667585,峻昇五金行,臺北市士林區社正路30號,五金批發業
31948331,全勝企業社,臺北市文山區興隆路4段89號,五金批發業
18085851,中翔精密企業社,臺北市松山區民權東路3段106巷1號3樓之1,五金批發業
14318886,省水器材水電行,臺北市信義區光復南路421巷121號,五金批發業
31948037,鴻源工程行,臺北市松山區三民路80巷9號,五金批發業
38556350,台灣愛梭五金行,臺北市萬華區環河南路1段248號,五金批發業
25532813,崇耀國際商行,臺北市文山區景後街95號8樓之4,五金批發業
02241856,根源企業社,臺北市內湖區東湖路113巷81號1樓,五金批發業
25572379,冠榮大商店,臺北市南港區興中路28巷4號1樓,五金批發業
15636450,上暘興國際企業社,臺北市中山區天祥路47巷16號4樓,五金批發業
25516503,海?工程行,臺北市中山區新生北路3段56巷8號,五金批發業
04342839,新發鋁材行,臺北市大同區酒泉街106號4樓,五金批發業
26363651,上利工程行,臺北市信義區基隆路1段155號7樓,五金批發業
48958327,久峰企業社,臺北市內湖區麗山街348巷19號2樓,五金批發業
26257194,常勝水電材料行,臺北市大同區大龍街58號,五金批發業
31865459,?泰餐飲設備行,臺北市萬華區環河南路1段181之2號,五金批發業
48960436,品蘶企業社,臺北市南港區重陽路470號4樓之2,五金批發業
38458323,麋鹿迷路企業社,臺北市士林區基河路118號,五金批發業
31949606,鴻鈞工程行,臺北市大安區和平東路1段183巷11弄5號1樓,五金批發業
13466368,宜倫商行,臺北市內湖區新明路304之1號,五金批發業
31948536,金贊工程行,臺北市信義區福德街101號1樓,五金批發業
14713394,日鼎地板行,臺北市信義區永吉路187巷27號,五金批發業
37942496,格凌企業社,臺北市中正區汀州路2段230號,五金批發業
29212236,開泰工程行,臺北市大安區臥龍街195巷25號1樓,五金批發業
25665539,宗軒工程行,臺北市內湖區康樂街61巷78號5樓,五金批發業
26227994,南豐企業商行,臺北市北投區知行路34巷8號,五金批發業
48908164,力建工程行,臺北市萬華區長順街7號4樓,五金批發業
21714355,?泰企業社,臺北市北投區中央北路4段320號5樓,五金批發業
31844764,熊猴創義廚房,臺北市萬華區西寧南路70號地下1層之7,五金批發業
99961351,鑫妤百貨行,臺北市中山區新生北路2段39號8樓,五金批發業
48884037,鴻劍實業社,臺北市中山區錦州街25號5樓,五金批發業
10344335,倉園企業社,臺北市信義區和平東路3段207巷12號,五金批發業
26360063,百祥建材行,臺北市中山區建國北路2段29號,五金批發業
17751407,深澤工程行,臺北市中山區民權東路1段72號11樓之2,五金批發業
38507942,祈福燈籠彩球工坊,臺北市內湖區康樂街300號,五金批發業
26237992,木匠實業社,臺北市萬華區莒光路153巷4號1樓,五金批發業
48769959,台仲企業行,臺北市中山區農安街227巷3弄20號1樓,五金批發業
48868212,弘瑋工程行,臺北市中正區水源路131之3號,五金批發業
26221801,宏昇興業社,臺北市中山區新生北路1段83號4樓,五金批發業
83944498,金泰貿易行,臺北市中山區龍江路281巷20號1樓,五金批發業
38506205,寓見設計工作室,臺北市北投區民族街10號2樓,五金批發業
38568102,安心租賃商行,臺北市萬華區西藏路510號,五金批發業
38553419,復古老爹洋行,臺北市中山區南京西路12巷12號地下,五金批發業
38513677,雨勳工程行,臺北市萬華區萬大路493巷28弄5號,五金批發業
48960301,群亨企業社,臺北市南港區研究院路2段12巷57弄68號1樓,五金批發業
15632102,東保工程行,臺北市信義區基隆路1段83巷20弄6號1樓,五金批發業
31950053,鑫宏企業社,臺北市萬華區雅江街85號1樓,五金批發業
38580653,三才企業社,臺北市大安區忠孝東路4段162號11樓之5,五金批發業
25513436,紅陽袁立誠企業社,臺北市文山區景福街226號,五金批發業
99333487,聯合派報社,臺北市中山區建國北路2段3巷13弄4號之2、1樓,五金批發業
48927036,順發園藝企業社,臺北市文山區景後街95號4樓之4,五金批發業
15665089,威誠企業行,臺北市中正區羅斯福路3段210巷8弄7之12號1樓,五金批發業
26247128,弘展工作室,臺北市松山區八德路4段389巷9號,五金批發業
38506134,金玉建材砂石行,臺北市士林區延平北路8段242巷6弄20號,五金批發業
38574358,宇伸工程行,臺北市中山區中山北路2段170號8樓,五金批發業
38503798,老蔡企業社,臺北市大同區哈密街17號,五金批發業
25667403,歡誼屋商行,臺北市大同區長安西路153號,五金批發業
18379223,健成企業社,臺北市士林區延平北路6段121號1樓,五金批發業
31863641,宅修繕工程行,臺北市大同區萬全街11號1樓,五金批發業
38500027,美功坊,臺北市士林區延平北路8段80巷53弄4號,五金批發業
38560158,宏昌水電行,臺北市內湖區永保街136號4樓,五金批發業
26206196,和勝工程行,臺北市南港區南港路2段27號,五金批發業
20909613,明益實業社,臺北市松山區八德路4段245巷52弄40號,五金批發業
26356531,傑聖服裝行,臺北市萬華區西園路1段203巷4之1號,五金批發業
30277685,宥憬工程行,臺北市中山區林森北路575號7樓之18,五金批發業
17089794,星德鋁材行,臺北市信義區和平東路3段565號,五金批發業
25513409,喜多屋國際商行,臺北市中山區林森北路306號2樓之1,五金批發業
26235489,愛莫盛國際貿易行,臺北市中山區敬業1路128巷10號1樓,五金批發業
31870158,經宇實業社,臺北市中正區西藏路114號,五金批發業
25569557,西門紅樓創意商品企業社,臺北市萬華區西寧南路82巷4號,五金批發業
31878052,鋌渥設計工作室,臺北市松山區民生東路4段53號7樓,五金批發業
38511761,尊枻空間設計,臺北市士林區社子街38號6樓,五金批發業
01432337,東立五金行,臺北市萬華區長順路7號1樓,五金批發業
26232244,禾豐工程行,臺北市松山區復興南路1段63號4樓之1,五金批發業
04518225,協和工藝材料行,臺北市大同區天水路51巷18號,五金批發業
38557885,樺立石材企業社,臺北市內湖區洲子街183號2樓,五金批發業
31881423,澕揚國際企業社,臺北市中正區汀州路3段203號1樓,五金批發業
31860588,詮興行,臺北市萬華區東園街140巷16號,五金批發業
13501766,廣旭企業社,臺北市松山區南京東路4段180號9樓,五金批發業
29280178,慶億企業社,臺北市大同區大龍街161號1樓,五金批發業
48686521,琦士美工程行,臺北市萬華區西寧南路36號2樓之105,五金批發業
38505607,宇鈦企業社,臺北市萬華區東園街28巷30號,五金批發業
26337752,典洋企業社,臺北市中山區中山北路1段83巷5號5樓之2,五金批發業
38574717,暐隆企業社,臺北市文山區秀明路1段103巷1弄6號,五金批發業
73887440,榮鴻企業社,臺北市南港區成功路1段94巷2弄5號1樓,五金批發業
27180960,振洋水電五金行,臺北市內湖區內湖路1段737巷8弄16號4樓,五金批發業
18088858,銘豐企業社,臺北市內湖區新明路428巷13號之2,五金批發業
26356883,利翔冷氣工程行,臺北市內湖區新明路451巷3號,五金批發業
25503520,迦勒行,臺北市內湖區南京東路6段461號6樓之5,五金批發業
18088800,松下數位生活館,臺北市中正區羅斯福路3段100號8樓之13,五金批發業
25665756,歡慶屋商行,臺北市大同區長安西路95號,五金批發業
26358313,上大藝品禮品社,臺北市中山區新生北路2段39號8樓,五金批發業
25513750,金懋行,臺北市大安區辛亥路2段211號2樓,五金批發業
38499653,馨饌餐坊,臺北市松山區民生東路3段130巷18弄9號,五金批發業
48733756,榮營工程行,臺北市南港區東新街118巷77號3樓,五金批發業
26223955,交朋友汽車百貨行,臺北市信義區吳興街284巷22弄28號1樓,五金批發業
26225617,安力企業社,臺北市大同區延平北路2段127號3樓之10,五金批發業
13820558,巨虹企業社,臺北市萬華區中華路1段102巷8號3樓,五金批發業
04775722,勝隆水電行,臺北市內湖區金龍路53號1樓,五金批發業
26338083,天工開物興業社,臺北市文山區溪口街31之1號,五金批發業
27163532,鉅翔企業社,臺北市中山區民權東路1段58巷8號3樓,五金批發業
13782891,比菲德國際企業社,臺北市中山區林森北路100號5樓之3,五金批發業
26766438,琬貽企業社,臺北市信義區林口街38巷19號,五金批發業
38560827,承達室內裝修工程行,臺北市大安區忠孝東路4段206之1號4樓,五金批發業
38515247,利隆工程行,臺北市中正區許昌街42之1號10樓,五金批發業
48743353,泰毅工程行,臺北市大同區酒泉街254號1樓,五金批發業
38506752,創鑫企業社,臺北市文山區景豐街39號1樓,五金批發業
81769142,富喬企業社,臺北市大同區歸綏街232號1樓,五金批發業
26344326,展揮實業社,臺北市中山區復興南路1段36之3號1樓,五金批發業
17751413,東靖企業社,臺北市南港區玉成街201巷10號1樓,五金批發業
11460000,添源工程行,臺北市中山區新生北路2段96號5樓之10,五金批發業
38512918,錩順企業社,臺北市內湖區東湖路33巷15號4樓,五金批發業
48999447,鴻泰企業社,臺北市內湖區安康路228巷1號1樓,五金批發業
80985059,禾稑工程行,臺北市內湖區民權東路6段280巷13號1樓,五金批發業
30179946,鴻墨水耗材專賣店,臺北市信義區基隆路2段185號,五金批發業
48747148,翔安商行,臺北市萬華區環河南路3段101號5樓之2,五金批發業
31850836,玉閔行,臺北市中正區同安街99之9號1樓,五金批發業
49891438,聖賀企業社,臺北市萬華區梧州街60巷11號3樓,五金批發業
14745353,廣技國際企業社,臺北市內湖區成功路4段214巷3弄15號,五金批發業
26256456,展盟國際商行,臺北市信義區松山路482巷32號8樓,五金批發業
73918675,松格企業社,臺北市中正區信義路2段81號(東門公有市場新館第1號攤位),五金批發業
21754546,新榮豐鋼鐵企業社,臺北市大同區承德路2段48號1樓,五金批發業
26218622,上禾百貨行,臺北市萬華區中華路1段122號,五金批發業
26344310,宏德興業工程行,臺北市中山區南京東路1段86號8樓之4,五金批發業
25669401,品屋企業社,臺北市萬華區西園路2段261巷20弄32號,五金批發業
26256189,瑚星創意企業社,臺北市內湖區康樂街136巷21號5樓,五金批發業
26344178,巨禾興行,臺北市大同區重慶北路3段252巷1號3樓,五金批發業
93916366,振鴻鎖匙行,臺北市松山區八德路4段837號1樓,五金批發業
29230678,新震憲企業社,臺北市士林區永平街20巷11弄5號1樓,五金批發業
31956417,廣成冷凍零件行,臺北市士林區葫蘆街70巷15號3樓,五金批發業
02484298,同樂工作室,臺北市士林區承德路4段188號1樓,五金批發業
25660680,大越工程行,臺北市士林區延平北路5段136巷27弄35號,五金批發業
30194947,芊裕器業社,臺北市萬華區環河南路1段23號10樓之3,五金批發業
99992615,新榮工程行,臺北市南港區興南街52巷24號1樓,五金批發業
26342615,景瀚實業社,臺北市士林區德行東路90巷19號,五金批發業
38569411,炎慶工程行,臺北市士林區延平北路5段136巷27弄31號3樓,五金批發業
77515603,陸福商行,臺北市大同區承德路2段75巷28號,五金批發業
15666828,悅鑫商行,臺北市中山區吉林路161巷1弄5號1樓,五金批發業
13467009,意盛企業社,臺北市信義區崇德街116號5樓,五金批發業
13503645,震霖工程行,臺北市中山區南京東路2段20號3樓,五金批發業
38455536,格蕾絲芙商行,臺北市中山區南京東路2段76號4樓,五金批發業
48922644,煥新工程行,臺北市士林區延平北路7段9號1樓,五金批發業
27165433,元泉餐飲設備行,臺北市中正區汀州路1段380號,五金批發業
38511523,震積工程行,臺北市信義區松隆路102號16樓,五金批發業
42268710,杰昇國際企業社,臺北市松山區民生東路5段235號1樓,五金批發業
38579972,嘉瑜水電工程行,臺北市萬華區寶興街140巷42號3樓,五金批發業
25565383,采圓塗裝工程行,臺北市北投區民族街11巷12號2樓,五金批發業
99624339,允丰企業社,臺北市大安區忠孝東路3段249號7樓,五金批發業
31959076,夏娃洋行,臺北市信義區松山路119巷17弄12號,五金批發業
38571747,元豐清潔用品商行,臺北市大同區民族西路223之9號6樓,五金批發業
26355738,和鑫電機社,臺北市萬華區艋舺大道74號,五金批發業
48967276,崗鐿實業社,臺北市士林區東山路120巷1號,五金批發業
18780909,東興行,臺北市文山區景福街50號,五金批發業
48501502,新典企業社,臺北市中山區民生東路2段147巷5弄19號1樓,五金批發業
15665200,尚美隔熱紙行,臺北市文山區木柵路2段24號1樓,五金批發業
73900751,冠婷服飾行,臺北市萬華區康定路239號、241號,五金批發業
37872718,嘉宏工程行,臺北市中山區南京東路3段26號7樓,五金批發業
25517860,德星企業社,臺北市松山區南京東路5段40號6樓之7,五金批發業
48707722,久利企業社,臺北市信義區莊敬路209號2樓,五金批發業
31861947,集達貿易行,臺北市大同區寧夏路22之5號1樓,五金批發業
81709004,尚順企業社,臺北市文山區木新路2段211巷6弄24號,五金批發業
10317724,仲才實業社,臺北市中山區民生東路1段48號7樓之3,五金批發業
31881508,泉榮商行,臺北市中山區復興北路178號13樓之7,五金批發業
01359531,金宏興塗裝行,臺北市北投區知行路316巷20弄3號,五金批發業
30298197,建達國際企業社,臺北市北投區石牌路1段8號1樓,五金批發業
13447671,愷元商行,臺北市北投區明德路136巷3弄1號2樓,五金批發業
30290131,蕙成企業社,臺北市中山區新生北路3段1號3樓之21,五金批發業
07267910,政光木材行,臺北市大同區庫倫街36號,五金批發業
99955800,垣久行,臺北市中山區新生北路2段68巷11之2號,五金批發業
01637520,樺達電機行,臺北市內湖區內湖路1段411巷9弄26號,五金批發業
38513022,?煌實業工程行,臺北市松山區光復南路66巷8號,五金批發業
31877618,咖樂烘豆企業社,臺北市大安區延吉街68之16號,五金批發業
26246654,久康科技工程行,臺北市大安區忠孝東路4段169號11樓之1,五金批發業
29228413,李錦回收廠,臺北市文山區恆光街17巷36號,五金批發業
05153601,信忠實業社,臺北市中正區惠安街17號1樓,五金批發業
30864376,進德金屬工程行,臺北市南港區市民大道7段242號1樓,五金批發業
18093682,御藝實業社,臺北市萬華區漢口街2段85號,五金批發業
38507020,富益實業社,臺北市中山區新生北路3段56巷1號11樓之10,五金批發業
80998266,三禾五金百貨店,臺北市松山區饒河街247號1樓,五金批發業
38562563,京站視界眼鏡量販館,臺北市信義區松山路232號,五金批發業
27158778,百利達百貨用品社,臺北市內湖區康寧路1段170號1樓,五金批發業
48950423,桐鋅企業社,臺北市文山區和興路52巷7弄11號,五金批發業
31873319,誠達電器行,臺北市內湖區金龍路85號,五金批發業
37851657,運達通企業商行,臺北市中正區衡陽路10號12樓,五金批發業
42270005,龍藤企業社,臺北市內湖區成功路2段486巷4號10樓,五金批發業
31874470,名祥百貨行,臺北市大同區重慶北路1段1號地下,五金批發業
26234947,八形雕塑企業社,臺北市北投區中央北路1段193號3樓,五金批發業
25546669,立鈞企業社,臺北市文山區光輝路134巷10弄6號3樓,五金批發業
26355527,昱通工程企業社,臺北市中正區新生南路1段50之2號5樓,五金批發業
26341209,永林汽車精品行,臺北市士林區延平北路5段136巷18號1樓,五金批發業
38474512,永捷國際洋行,臺北市信義區吳興街524巷16弄2之1號(1樓),五金批發業
38501861,政玉地板工程行,臺北市士林區中正路324號2樓,五金批發業
31920798,錦繡大地工作室,臺北市大同區涼州街2號3樓之6,五金批發業
38502411,家泉工程行,臺北市信義區永吉路200巷41弄8號,五金批發業
05260102,大名行,臺北市中山區新生北路3段68巷37號1樓,五金批發業
99961916,八鄉狸精品服飾店,臺北市萬華區武昌街2段50巷11號1樓,五金批發業
31715902,邦達創意工作坊,臺北市中山區民權東路3段57號4樓,五金批發業
78299603,龍益企業社,臺北市北投區知行路316巷22弄12號,五金批發業
30293860,富昇工程行,臺北市士林區通河西街2段146號3樓,五金批發業
31875631,合悅行,臺北市信義區嘉興街265號,五金批發業
48770689,掌生穀粒糧商號,臺北市信義區光復南路415巷182號,五金批發業
31961609,騰藝企業社,臺北市大同區南京西路185巷7號3樓之12,五金批發業
25584001,諦孚國際流通商號,臺北市大安區忠孝東路3段251巷3弄18之3號,五金批發業
30101130,廣駿企業社,臺北市中山區松江路27號6樓之3,五金批發業
38467478,振鈺工程行,臺北市萬華區福星里西寧南路11號7樓之2,五金批發業
81742221,亞美服裝號,臺北市萬華區大理街42之3號1樓,五金批發業
38572942,恆亞企業社,臺北市中山區龍江路412巷17號2樓,五金批發業
48841426,正麟企業社,臺北市文山區興隆路2段244巷10號,五金批發業
01498098,大發工程行,臺北市萬華區中華路2段504巷49號2樓,五金批發業
38571177,品浩企業社,臺北市松山區八德路4段445號7樓之6,五金批發業
48559145,福星大商店,臺北市北投區中和街258號1樓,五金批發業
81718989,凌芸實業商行,臺北市松山區光復北路85巷29號1樓,五金批發業
38581132,姿碧穎企業社,臺北市士林區德行西路40號1樓,五金批發業
09838057,好射之徒企業社,臺北市士林區劍潭路32號1樓,五金批發業
37851657,運達通企業商行,臺北市中正區衡陽路10號12樓,五金批發業
