99624345,服芝飾品企業社,臺北市大同區重慶北路2段80巷18號,五金批發業
38474581,萬固工程行,臺北市信義區忠孝東路5段786號6樓,五金批發業
17278107,品宏企業社,臺北市中山區農安街24之3號7樓,五金批發業
73882711,泰盛實業社,臺北市中正區汀州路1段242巷7號,五金批發業
26219306,穩得創意工坊,臺北市中山區長安東路2段31號7樓之5,五金批發業
31961333,金芸企業社,臺北市內湖區民權東路6段56巷15弄4號5樓,五金批發業
38572443,惠翔金屬企業社,臺北市北投區育仁路49巷5號,五金批發業
13471236,佳鴻企業社,臺北市松山區復興南路1段1號10樓之1,五金批發業
21765229,栯慈商行,臺北市中山區民生東路3段1號3樓,五金批發業
26344698,晟佑行,臺北市中山區建國北路3段113巷19弄3號,五金批發業
38557180,叡家工程行,臺北市松山區八德路3段186號3樓,五金批發業
04601899,今美裝潢行,臺北市中正區仁愛路2段60號1樓,五金批發業
31867196,瀧豐企業社,臺北市大同區重慶北路2段46巷36號,五金批發業
38465339,嘉倢工程行,臺北市北投區中央北路4段30巷12號,五金批發業
31949459,愛淘網商號,臺北市北投區立德路120巷27號2樓,五金批發業
48936909,誼樺實業社,臺北市內湖區安泰街51巷1號,五金批發業
25583328,大台北五金行,臺北市松山區八德路4段435號1樓,五金批發業
48704653,全盈峰企業社,臺北市北投區中央北路2段137號1樓,五金批發業
99972391,富糠行,臺北市大安區麗水街13巷18號1樓,五金批發業
04829184,百松教學用品社,臺北市信義區基隆路2段22號6樓之6,五金批發業
38578848,奇星玻璃工程行,臺北市大安區忠孝東路4段270號7樓之1,五金批發業
26232624,金和捲門企業社,臺北市中正區八德路1段46號9樓,五金批發業
01393138,明佑行,臺北市文山區政大二街222號4樓,五金批發業
81630464,世葆企業社,臺北市北投區明德路267巷3號,五金批發業
08603736,宏昇工程行,臺北市內湖區安泰街125巷28號1樓,五金批發業
31484705,晉榮工程行,臺北市中山區民生東路1段65號2樓,五金批發業
26359093,蒼龍寶馬國際企業社,臺北市信義區吳興街161號,五金批發業
18101212,明泰商行,臺北市士林區延平北路6段219號1樓,五金批發業
73880170,富麗行,臺北市文山區興隆路4段165巷37號1樓,五金批發業
31858990,美樂家商行,臺北市北投區中央南路1段154號,五金批發業
99765962,明新企業社,臺北市北投區石牌路1段166巷69弄22號,五金批發業
15647317,新象清潔行,臺北市內湖區民權東路6段120巷1弄7號,五金批發業
15644682,聯鑫企業社,臺北市士林區德行東路155號,五金批發業
38510138,展毅通信資訊社,臺北市松山區八德路4段44號(2樓),五金批發業
15640412,威盛鐵門窗工程行,臺北市士林區通河西街2段145號3樓,五金批發業
48943649,亞雄企業社,臺北市南港區成福路77號,五金批發業
83947559,日進水電行,臺北市中山區新生北路1段78號9樓之2,五金批發業
31856796,立豐室內裝修工程行,臺北市文山區新光路1段134號,五金批發業
38554114,永承水電工程行,臺北市南港區玉成街235巷4號,五金批發業
26371316,匹歐匹廣告社,臺北市大安區仁愛路3段106號5樓,五金批發業
04255855,元泉五金行,臺北市大同區太原路103號1樓,五金批發業
13456066,世烽交通器材行,臺北市中山區龍江路457巷15號1樓,五金批發業
38511875,慈購網實業社,臺北市士林區中山北路7段165號3樓之5,五金批發業
31513808,豬頭熊科技企業社,臺北市大安區忠孝東路3段251巷5弄2號1樓,五金批發業
14317681,偉信建材行,臺北市萬華區東園街142號1樓,五金批發業
38553662,紘暘工程行,臺北市萬華區和平西路3段109巷11號3樓,五金批發業
04911424,大宇文具影印行,臺北市文山區羅斯福路6段102號,五金批發業
17754191,大方工業社,臺北市內湖區康樂街61巷81弄10號,五金批發業
31860399,鴻錡實業社,臺北市大安區復興南路2段277號3樓,五金批發業
38552896,雨果伸縮帆布工程行,臺北市文山區保儀路109巷3弄15號,五金批發業
48890761,博盛水電工程行,臺北市內湖區內湖路1段737巷8弄6號2樓,五金批發業
31858909,百岳塑膠商行,臺北市南港區重陽路190巷12弄12號,五金批發業
26235349,佑騏企業社,臺北市中山區新生北路3段19巷59號,五金批發業
31862761,豐禾大商店,臺北市南港區興中路12巷9號1樓,五金批發業
81769924,長龍實業行,臺北市大同區重慶北路2段188號5樓,五金批發業
38424268,三省太和商舖,臺北市中正區羅斯福路3段76號12樓之1,五金批發業
26373047,星榮電料五金行,臺北市大同區承德路3段8巷18號4樓,五金批發業
38580106,及第貿易商行,臺北市中山區中山北路2段85巷15號,五金批發業
31873872,磐石工程行,臺北市內湖區東湖路106巷7弄23號4樓,五金批發業
14318823,宇昌企業社,臺北市南港區昆陽街146號4樓,五金批發業
25552063,毅達工程行,臺北市大同區昌吉街102號2樓,五金批發業
38571182,禾峰企業社,臺北市文山區指南路2段45巷4弄11號4樓,五金批發業
25672118,晨竑企業社,臺北市萬華區萬大路329巷27弄24號,五金批發業
81714442,佳晉水電材料行,臺北市南港區南港路1段79號1樓,五金批發業
14325090,友善工程行,臺北市中正區汀州路3段19號1樓,五金批發業
99945613,心成水電工程行,臺北市士林區承德路4段315號2樓,五金批發業
26233052,凱裕企業社,臺北市萬華區長泰街282巷13弄17號,五金批發業
38578328,聖嘉工程行,臺北市中山區松江路283號5樓,五金批發業
38557506,傑廷企業社,臺北市南港區研究院路2段3之7號1樓,五金批發業
48831166,永承工業社,臺北市大同區蘭州街89巷18號1樓,五金批發業
38457984,鼎紳工程行,臺北市大同區仁愛路3段9號地下1層,五金批發業
25532975,祐緯洋行,臺北市中正區金門街34巷4號,五金批發業
48943211,源準商號,臺北市內湖區康寧路1段86巷1弄6號2樓,五金批發業
04881771,建和行,臺北市文山區羅斯福路5段201號1樓,五金批發業
18390114,宏碩企業社,臺北市文山區辛亥路4段101巷74號,五金批發業
26355483,?尚五金行,臺北市大同區環河北路2段271號1樓,五金批發業
14729261,盛斌企業社,臺北市士林區承德路4段364號2樓,五金批發業
81747871,聖隆五金行,臺北市內湖區內湖路1段63號1樓,五金批發業
38576757,竣昱企業社,臺北市萬華區德昌街261巷27號1樓,五金批發業
26217449,建宏維修工作室,臺北市大同區南京西路107巷48號,五金批發業
73889833,佑鑫不袗五金材料行,臺北市北投區懷德街3號1樓,五金批發業
87773039,雅家油漆工程行,臺北市內湖區金湖路46巷15號,五金批發業
31859365,奕辰企業社,臺北市萬華區西園路2段320巷36弄6號5樓,五金批發業
38507577,極速軸承商業行,臺北市大同區重慶北路3段313巷31號1樓,五金批發業
14872688,億倡工程行,臺北市中山區南京東路1段2號6樓之5,五金批發業
25564693,翔豐水電工程行,臺北市南港區研究院路3段16巷5號1樓,五金批發業
01360615,鴻富企業行,臺北市北投區永興路1段43號,五金批發業
31862137,萊特茵精品工房,臺北市士林區後港街62巷8號2樓,五金批發業
25508406,元大油漆工程行,臺北市信義區福德街61號,五金批發業
08584978,宇盛企業社,臺北市內湖區民權東路6段120巷5弄3號4樓,五金批發業
38497677,阿畢克漢草本花園商行,臺北市北投區文林北路250號3F,五金批發業
38500645,承鑫環保企業社,臺北市中山區錦州街46號9樓之1,五金批發業
26337269,東舍工程行,臺北市大同區延平北路4段282巷19弄7號,五金批發業
38496327,兆元企業社,臺北市文山區辛亥路4段101巷85之6號1樓,五金批發業
25553794,聯煌不袗工程行,臺北市士林區德行東路402號,五金批發業
48950520,夆興餐具行,臺北市中山區長安東路2段47之4號,五金批發業
31873704,高鈰企業社,臺北市信義區忠孝東路5段1之6號10樓,五金批發業
29243955,先進企業社,臺北市信義區永吉路278巷2弄16號2樓,五金批發業
26211917,韋澄企業社,臺北市萬華區艋舺大道120巷38弄41號,五金批發業
15901289,正泰日用品百貨行,臺北市萬華區莒光路181號1樓,五金批發業
73889138,翔宏行,臺北市大安區敦化南路1段337號11樓,五金批發業
48963736,緒沅商行,臺北市大同區民權西路144巷5弄7號11樓之1,五金批發業
25664010,澄品水電企業社,臺北市信義區虎林街164巷60弄21號,五金批發業
17767153,韋樺企業社,臺北市士林區涌河西街2段47號4樓,五金批發業
26368831,承弘企業社,臺北市士林區福港街262巷1弄6號1樓,五金批發業
01700369,威泰五金行,臺北市文山區景華街128巷3弄19號1樓,五金批發業
48754457,巨?水電行,臺北市中山區農安街227巷3弄22之1號,五金批發業
31878551,好鎂服裝行,臺北市信義區和平東路3段171號,五金批發業
25660963,育昇機電工程行,臺北市北投區大業路635號,五金批發業
15637330,多林企業社,臺北市萬華區萬大路138號1樓,五金批發業
25572384,宇澄工程行,臺北市大安區杭州南路2段7號2樓,五金批發業
31878187,龍均國際企業社,臺北市萬華區長順街99巷16弄11號2樓,五金批發業
99976220,源鈞商行,臺北市北投區知行路95號5樓,五金批發業
80991550,中二水電行,臺北市大安區忠孝東路3段251巷9弄14號,五金批發業
18795240,春信工業社,臺北市中正區南昌路2段197號1樓,五金批發業
10336623,昶宣企業社,臺北市文山區景華街11號,五金批發業
38555248,誠國汽車玻璃行,臺北市文山區木新路3段80號2樓,五金批發業
14745473,中和筆莊,臺北市士林區大北路46號1樓,五金批發業
14719192,祐昇企業社,臺北市文山區興隆路3段192巷8弄42號1樓,五金批發業
26373026,利樂屋企業社,臺北市內湖區文德路22巷24號,五金批發業
10319440,首益飾品,臺北市中山區松江路133巷6號,五金批發業
38555388,育澄企業社,臺北市大安區忠孝東路4段49巷8號,五金批發業
60392037,駿溢興業社,臺北市松山區健康路208號1樓,五金批發業
01961217,全慶五金電料行,臺北市大同區環河北路2段223巷14號,五金批發業
38564035,忠宬企業社,臺北市萬華區康定路192號2樓,五金批發業
18412807,駿懋商行,臺北市信義區忠孝東路4段553巷22弄41號1樓,五金批發業
25575903,華新歐化廚具企業社,臺北市北投區中和街493巷3弄18號5樓,五金批發業
25572075,古飾洋行,臺北市大安區大安路1段31巷19號,五金批發業
01773622,怡良水電工程行,臺北市中山區民權東路2段75號3樓,五金批發業
01125393,榮崇五金行,臺北市大同區承德路3段113巷1號1樓,五金批發業
02207294,懋森企業社,臺北市北投區溫泉路30巷15號,五金批發業
77922186,建村企業社,臺北市士林區延平北路6段511巷24號2樓,五金批發業
66983072,巧思工程行,臺北市士林區文林北路72號,五金批發業
80995541,協聲水電行,臺北市士林區中山北路7段190巷6號1樓,五金批發業
27181861,定誠企業社,臺北市士林區葫蘆街40巷12號2樓,五金批發業
48982419,佳和工程行,臺北市信義區富陽街87巷42號,五金批發業
31844645,金億砂石行,臺北市士林區延平北路8段242巷6弄20號,五金批發業
18391367,展洲企業社,臺北市南港區成福路170號3樓之5,五金批發業
01437403,國達工程行,臺北市萬華區西園路2段303號1樓,五金批發業
13838760,歐亞室內裝璜企業社,臺北市士林區士東路266巷6弄11號地下樓,五金批發業
21764946,動力屋,臺北市大同區民權西路174號1樓,五金批發業
31869130,菲帆企業商行,臺北市松山區民生東路5段137巷4弄14號8樓,五金批發業
31954889,互信企業社,臺北市中山區長春路20號2樓,五金批發業
25548483,銘彥五金企業社,臺北市萬華區西藏路180號,五金批發業
01304924,吉羊服務社,臺北市信義區松德路65號11樓之1,五金批發業
26354463,英富工程行,臺北市北投區溫泉路68巷6弄15之1號2樓,五金批發業
99948153,良裕工程行,臺北市萬華區中華路2段416巷1號3樓之1,五金批發業
98914887,百韻工坊,臺北市松山區南京東路4段93號2樓,五金批發業
38473746,頤亨行,臺北市士林區忠誠路2段108號,五金批發業
25554463,紘華工程行,臺北市北投區中央北路4段142巷2之1號2樓,五金批發業
38514606,新都工程行,臺北市松山區八德路4段106巷4弄10號,五金批發業
42270758,馨茉國際實業社,臺北市內湖區文德路66巷14弄12號2樓,五金批發業
38558435,興益旺企業社,臺北市士林區文昌路14號2樓,五金批發業
10306016,金祥興環保商行,臺北市大安區建國南路1段279巷32號,五金批發業
48852197,健智企業社,臺北市北投區育仁路35號1樓,五金批發業
38563161,嶄鑫工程行,臺北市北投區溫泉路71號地下2樓之4,五金批發業
38464090,云誠工程行,臺北市中山區江山里復興北路280巷2號,五金批發業
48767559,尚圓玩具百貨商行,臺北市大同區太原路129號1樓,五金批發業
38506520,偉華企業社,臺北市士林區蘭雅里德行東路109巷73弄5號1樓,五金批發業
31842674,御亨設計工程行,臺北市北投區公館路145巷4弄6號2樓,五金批發業
09606182,造鴻工程行,臺北市內湖區內湖路1段205號,五金批發業
38501905,石神工程行,臺北市萬華區昆明街46號7樓之47,五金批發業
99972250,蔣京企業社,臺北市內湖區大湖山莊街218號8樓,五金批發業
10314661,榳擎設計工作室,臺北市松山區南京東路4段56號10樓之6,五金批發業
38571079,譽翔百貨行,臺北市大同區重慶北路3段295巷6號1樓,五金批發業
25580167,僑富工程行,臺北市中山區中原街9號,五金批發業
25556820,威信工程行,臺北市中山區復興北路68巷5號1樓,五金批發業
26207505,鉑采工程行,臺北市大同區民族西路221巷37號(1樓),五金批發業
99325326,明凰室內裝潢工程行,臺北市文山區興隆路1段119號,五金批發業
10335814,佳能企業社,臺北市中山區民生東路1段96號1樓,五金批發業
38456042,品冠工程行,臺北市中山區南京東路2段76號4樓,五金批發業
02215512,順菱企業社,臺北市松山區八德路4段602號11樓之6,五金批發業
37851657,運達通企業商行,臺北市中正區衡陽路10號12樓,五金批發業
38572204,阿杜工程行,臺北市內湖區江南街71巷65弄15號7樓,五金批發業
17264595,新嘉五金商行,臺北市士林區通河東街1段167巷30號1樓,五金批發業
17743940,王維水電冷氣工程行,臺北市大同區重慶北路3段152巷12號1樓,五金批發業
01608980,龍鳳珠寶精品行,臺北市大安區安和路1段38號,五金批發業
25556856,瑞盈企業社,臺北市中山區長安東路2段178號10樓,五金批發業
14344596,治鴻企業社,臺北市信義區和平東路3段515號(1樓),五金批發業
17737736,濟達企業社,臺北市大同區哈密街59巷78弄45號1樓,五金批發業
04775363,三協成企業行,臺北市內湖區康寧路3段16巷80號2樓,五金批發業
10376482,宏悅企業社,臺北市北投區公館路158號,五金批發業
38556020,廣威工程行,臺北市文山區忠順街1段26巷12弄1號,五金批發業
30413871,永立工程行,臺北市大安區浦城街13巷3號1樓,五金批發業
48812436,承泓機電工程行,臺北市中山區新生北路3段61號4樓之1,五金批發業
48855791,傳景水電工程行,臺北市士林區延平北路7段106巷23號1樓,五金批發業
30277685,宥憬工程行,臺北市中山區民權東路1段58巷13號1樓,五金批發業
31862093,宸揚工程行,臺北市士林區社中街297號3樓,五金批發業
29208900,安利實業社,臺北市中山區長春路3巷15號2樓,五金批發業
81793699,海富油封軸承商行,臺北市大同區迪化街2段426號2樓之2,五金批發業
14731999,元晨商行,臺北市北投區大同街349號,五金批發業
31856058,榮展工程行,臺北市中山區撫順街26號2樓之1,五金批發業
31863733,全國拆除工程行,臺北市中山區新生北路2段58巷38號2樓,五金批發業
99609956,齊山科技行,臺北市中山區民權東路2段70號3樓,五金批發業
38508246,東勳企業社,臺北市內湖區安美街123號2樓,五金批發業
17088752,虹逸工程行,臺北市信義區福德街212號1樓,五金批發業
42268401,宏正環境維護企業社,臺北市中山區建國北路3段95號2樓,五金批發業
25571370,長泰水電行,臺北市中山區松江路156巷24號1樓,五金批發業
31947277,阿欽汽車商行,臺北市大同區涼州街1之8號,五金批發業
17543128,鉅亞企業社,臺北市士林區大東路174號1樓,五金批發業
13698655,碧馥邑裝潢工程企業社,臺北市中山區長春路234號1樓,五金批發業
38505389,探子設計實驗室,臺北市大同區鄭州路55號3樓,五金批發業
26231934,小天使傢俱商行,臺北市內湖區環山路1段83號,五金批發業
38466941,登鴻國際企業社,臺北市內湖區成功路4段58號7樓,五金批發業
25574637,潤泰企業社,臺北市萬華區萬大路322巷28號,五金批發業
26222386,中太衛浴廚櫃設備行,臺北市萬華區三水街115巷4號2樓,五金批發業
48766849,柏源事業社,臺北市中山區民生東路3段1號3樓,五金批發業
25547463,嘉榮水電行,臺北市大同區迪化街2段13號1樓,五金批發業
31952257,迪文企業社,臺北市北投區石牌路2段315巷34弄21號3樓,五金批發業
15822406,永全機電行,臺北市萬華區萬大路85巷4號1樓,五金批發業
38572632,振鼎工程行,臺北市中山區林森北路259巷9號5樓之14,五金批發業
38464205,豬舍創意製作社,臺北市松山區民權東路3段170號12樓,五金批發業
99643912,宏龍工程行,臺北市中山區長安東路2段142號7樓之2,五金批發業
31959569,予峰石材行,臺北市士林區延平北路8段80巷53弄4號,五金批發業
10304896,找到了服飾工作室,臺北市大安區師大路117巷2號,五金批發業
26244564,弘翔實業社,臺北市大同區重慶北路1段15巷8號(4樓),五金批發業
25565813,享奇工程行,臺北市士林區環河北路3段171號,五金批發業
17754018,健宏企業社,臺北市士林區至善路2段445號,五金批發業
15645916,翰興五金商行,臺北市北投區中央南路1段19號,五金批發業
18398093,承泰實業社,臺北市內湖區成功路4段323巷2弄1號4樓,五金批發業
48694607,韻綮國際商行,臺北市士林區中山北路6段195巷21號3樓,五金批發業
21702111,順鑫企業社,臺北市大安區忠孝東路4段297號3樓,五金批發業
25671217,駿和企業社,臺北市大同區重慶北路3段113巷4號,五金批發業
92908640,立德工程行,臺北市內湖區康樂街48巷16號,五金批發業
25568136,元威系統家具企業社,臺北市士林區社中街346巷3弄26號1樓,五金批發業
42268465,帷新工程行,臺北市中山區民族東路410巷23弄22號5樓,五金批發業
38501617,君毅工程行,臺北市大安區羅斯福路2段79號5樓之6,五金批發業
24034177,東田工程行,臺北市松山區寶清街22之1號1樓,五金批發業
38513374,采?工作室,臺北市大安區安和路2段243號4樓,五金批發業
77162489,旭力贈品工藝社,臺北市中正區中華路1段89之5號1樓,五金批發業
31954092,侑創設計工作室,臺北市松山區南京東路4段197號9樓之1,五金批發業
30833923,良洪實業社,臺北市信義區信義路6段76巷2弄85號1樓,五金批發業
29301526,朗佑室內裝潢工程行,臺北市北投區中央北路3段148巷4弄13號4樓,五金批發業
26369819,日樣汽機車精品店,臺北市大同區西寧北路52號(1樓),五金批發業
15666799,帝城國際企業社,臺北市萬華區大理街159巷9號1樓,五金批發業
10396190,鑫瑋企業社,臺北市南港區重陽路190巷12弄15號,五金批發業
38572400,陳亞孚空間設計工作室,臺北市南港區園區街58巷3號9樓,五金批發業
31848776,彪獻門窗企業社,臺北市大同區承德路3段102號,五金批發業
17044848,廣玟印刷文具品店,臺北市中正區金門街26號,五金批發業
38558575,佑銓起重企業社,臺北市中山區南京西路1-1號6樓,五金批發業
25543353,御向工程行,臺北市文山區興隆路1段251巷3弄3號,五金批發業
38571211,天真軒商行,臺北市中正區寧波西街18號6樓之12,五金批發業
99328908,精元企業社,臺北市南港區舊庄街1段66號1樓,五金批發業
30273371,杰揚企業社,臺北市南港區研究院路1段155號,五金批發業
10359913,怡誠水電工程行,臺北市士林區延平北路5段136巷27弄29號,五金批發業
38507083,鼎記照明企業社,臺北市北投區文化三路22號3樓,五金批發業
25521251,歡樂屋商行,臺北市大同區長安西路234號,五金批發業
94915029,勝宇企業社,臺北市北投區致遠一路2段69號,五金批發業
31402253,祥鼎工程行,臺北市萬華區東園街28巷50之6號,五金批發業
10322368,翔力企業社,臺北市松山區富錦街501號,五金批發業
41070606,創升工程行,臺北市內湖區東湖路160巷10弄20號4樓,五金批發業
17264568,允湛企業行,臺北市文山區辛亥路4段99號2樓,五金批發業
25577064,佳盛清潔服務社,臺北市北投區新民路1巷8號5樓之3,五金批發業
48890278,益禎工程行,臺北市中正區延平南路61號9樓之5,五金批發業
13832169,青竣企業社,臺北市士林區社中街272號1樓,五金批發業
26362175,郁晟工程行,臺北市萬華區西園路2段155號6樓,五金批發業
25665637,萬能起重企業社,臺北市北投區尊賢街203號2樓,五金批發業
38558857,億丞企業社,臺北市士林區承德路4段58巷28弄16號5樓,五金批發業
48849460,富宏企業社,臺北市南港區中南街74巷20號1樓,五金批發業
48735591,喬登企業社,臺北市中山區中山北路2段170號,五金批發業
81709855,合眾企業社,臺北市大同區延平北路4段102巷41號,五金批發業
26374828,鋐昌工程行,臺北市中正區北平東路20號3樓,五金批發業
25552084,名凱企業社,臺北市萬華區西園路2段382號4樓,五金批發業
10302671,政大行,臺北市大同區保安街49巷30之1號2樓,五金批發業
26224504,田原種苗店,臺北市北投區中央北路2段124號,五金批發業
26224960,忠信建材行,臺北市中山區龍江路429巷1號1樓,五金批發業
83937980,企美國際事業企業社,臺北市中山區民生東路2段70號3樓,五金批發業
10314590,利國企業社,臺北市南港區昆陽街140巷19號,五金批發業
26222745,浩茗設計工作室,臺北市大同區長安西路239號7樓之1,五金批發業
29220524,元銘企業社,臺北市中山區合江街130巷15號1樓,五金批發業
31849199,譓矷工程行,臺北市信義區忠孝東路5段372巷27弄8號3樓,五金批發業
38471472,鮮綠商行,臺北市中山區南京東路2段76號4樓,五金批發業
77406295,協興五金行,臺北市士林區福港街129巷10弄4號4樓,五金批發業
38563444,錦泰國際企業社,臺北市萬華區和平西路3段384號4樓之1,五金批發業
04905020,東盟服務社,臺北市中山區新生北路1段65之3號,五金批發業
01591741,空間工作室,臺北市萬華區中華路2段16號3樓之1,五金批發業
25563723,宏富實業社,臺北市士林區延平北路5段2號,五金批發業
38566370,柏榤企業社,臺北市信義區光復南路547號6樓之3,五金批發業
13827406,立捷金屬企業社,臺北市信義區松德路25巷30號,五金批發業
25521371,友貴通企業社,臺北市松山區民生東路4段112巷5弄12號4樓,五金批發業
38557858,冠億冷凍家具行,臺北市萬華區環河南路1段63號,五金批發業
73885040,松陽汽車材料行,臺北市大同區赤峰街53巷6號1樓,五金批發業
38556794,正隆廚具行,臺北市萬華區和平西路3段384號6樓之6,五金批發業
20029498,旭鑫企業社,臺北市松山區寶清街89巷13號4樓,五金批發業
48950232,圓滿國際企業社,臺北市萬華區成都路110號10樓之6,五金批發業
48977289,統來機電五金行,臺北市萬華區環河南路1段2號公有河濱一商場1號攤位,五金批發業
48995126,日晟軸承五金商行,臺北市大同區歸綏街50號,五金批發業
21724804,亞設企業社,臺北市文山區木新路3段74巷3號1樓,五金批發業
31877429,海玄工程行,臺北市北投區崇仁路1段94號,五金批發業
02363457,駿宏企業社,臺北市信義區忠孝東路5段1之10號11樓,五金批發業
48936226,宏駿企業社,臺北市信義區林口街38巷24號,五金批發業
48936400,亨佳工程行,臺北市北投區公館路340巷6號,五金批發業
25503140,柏敘企業社,臺北市中正區中華路1段59號7樓,五金批發業
38474885,潤林商行,臺北市南港區永吉路535號1樓,五金批發業
77510059,達新清潔油漆企業社,臺北市士林區延平北路七段106巷327弄臨59號,五金批發業
12403020,龍江五金建材行,臺北市中山區龍江路200之3號,五金批發業
38469433,擎宇事業社,臺北市大安區泰順街50巷34號1樓,五金批發業
01598441,啟陽工程行,臺北市信義區吳興街386號,五金批發業
25557124,龍鈦五金行,臺北市松山區八德路4段481號,五金批發業
25571104,桔鑫企業社,臺北市松山區八德路4段602號11樓之6,五金批發業
