25562560,卡里斯麋鹿屋,臺北市萬華區成都路27巷7號,化菻~零售業
31954543,佳仕企業社,臺北市士林區延平北路5段257巷2弄8號1樓,化菻~零售業
21738363,琳蓉個人美容工作室,臺北市萬華區萬大路430號2樓,化菻~零售業
38497677,阿畢克漢草本花園商行,臺北市北投區文林北路250號3F,化菻~零售業
26224808,鈺潤造型工作室,臺北市大安區和平東路3段464巷6號3樓之2,化菻~零售業
10387354,泰越養生館,臺北市內湖區內湖路2段484號,化菻~零售業
38496327,兆元企業社,臺北市文山區辛亥路4段101巷85之6號1樓,化菻~零售業
30299512,昕彤國際資訊企業社,臺北市松山區民權東路3段102號8樓,化菻~零售業
73887650,金莎珠寶精品名店,臺北市信義區莊敬路322號1樓,化菻~零售業
25577058,傳承精品店,臺北市內湖區麗山街348巷6號,化菻~零售業
99639868,心思國際事業行,臺北市南港區中坡北路50巷10號1樓,化菻~零售業
26352438,蘿林服飾精品店,臺北市松山區長安東路2段215號9樓之1,化菻~零售業
38510480,京阪精品服飾,臺北市中山區雙城街10巷41號1樓,化菻~零售業
48838344,美少女工作室,臺北市信義區忠孝東路5段215巷25號3樓,化菻~零售業
31863987,國雲企業社,臺北市中山區林森北路121號5樓,化菻~零售業
31880661,昱東企業社,臺北市士林區文林路101巷1號,化菻~零售業
13466310,小舖子精品店,臺北市士林區安平街9號,化菻~零售業
48762631,森澤美容養生館,臺北市中山區長春路346號1、2樓,化菻~零售業
31887192,韓妮衣著坊,臺北市中正區信陽街5之1號,化菻~零售業
01770168,宏賓美妝精品名店,臺北市大安區忠孝東路4段97號2樓23室,化菻~零售業
15659164,元氣之美容材料坊,臺北市信義區永吉路278巷13號1樓,化菻~零售業
18412721,安妮威爾國際商行,臺北市內湖區金湖路46巷15號1樓,化菻~零售業
26253471,好旺髮藝名店,臺北市中山區敬業一路141號,化菻~零售業
10321516,明發商行,臺北市大同區承德路1段32號12樓之12,化菻~零售業
31845383,濎晟商行,臺北市南港區研究院路2段39之7號,化菻~零售業
48856588,圓宸百貨行,臺北市大安區安和路2段13號,化菻~零售業
38554091,奕信商行,臺北市大安區永康街34之5號,化菻~零售業
02268088,伊品企業社,臺北市松山區民生東路5段169號15樓之4,化菻~零售業
25578704,鈞堯商行,臺北市中山區民權西路20號6樓之10,化菻~零售業
38504353,曼婷服飾店,臺北市大安區和平東路3段272號,化菻~零售業
29223607,妍星美髮工作坊,臺北市中山區錦州街330號1樓,化菻~零售業
10396683,森帆養生館,臺北市中山區林森北路258號2樓,化菻~零售業
25571625,采薇美容工作室,臺北市文山區景華街172號,化菻~零售業
13849529,恬媞琳美容坊,臺北市中正區羅斯福路4段50號2樓之3,化菻~零售業
15665905,卓越商行,臺北市北投區東華街1段52號1樓,化菻~零售業
49968294,渥可斯髮廊工作室,臺北市松山區市民大道4段25號,化菻~零售業
27186824,廉化光企業行,臺北市中山區民權西路20號4樓,化菻~零售業
94901313,腳神美容坊,臺北市大安區臨江街92號1樓,化菻~零售業
13837811,菲羚美容材料行,臺北市松山區復興南路1段45號6樓,化菻~零售業
38599169,金韋服飾精品店敦南分店,臺北市大安區敦化南路1段187巷67、69號,化菻~零售業
31874936,承洋企業社,臺北市中山區南京東路2段138巷7號,化菻~零售業
01304924,吉羊服務社,臺北市信義區松德路65號11樓之1,化菻~零售業
29241915,暐晨服飾行,臺北市士林區天母西路13巷5號1樓,化菻~零售業
26360198,益蓁商行,臺北市北投區新興路8號,化菻~零售業
48709833,喜歡精品店,臺北市士林區中山北路7段64號1樓,化菻~零售業
26360330,葵寶樹貿易行,臺北市松山區民生東路5段166號1樓,化菻~零售業
99955077,啟安健康生活館商行,臺北市內湖區東湖路113巷95弄135號1樓,化菻~零售業
38456471,蜜媞貝拉坊,臺北市大安區忠孝東路4段223巷10弄2號3樓,化菻~零售業
31862609,網拓商行,臺北市中山區民權東路2段152巷22弄15號2樓,化菻~零售業
98900188,洛卡手創館,臺北市文山區光輝路71巷5弄5號1樓,化菻~零售業
31957350,生醫企業社,臺北市中山區復興北路82號11樓,化菻~零售業
38495827,嘉諭百貨行,臺北市信義區永吉路30巷178弄1號1樓,化菻~零售業
17089627,貼身情人百貨商行,臺北市大同區重慶北路2段205號,化菻~零售業
10301791,菲藏愛時尚館,臺北市萬華區西寧南路70號2樓之4,化菻~零售業
38463613,新仕界舒壓館,臺北市大同區南京西路131號,化菻~零售業
13448995,蔻蔻服飾精品店,臺北市信義區松仁路203號,化菻~零售業
31880867,雅鑫理髮工作坊,臺北市中正區中華路2段111之1號,化菻~零售業
77523646,金埃及企業社,臺北市大同區太原路8巷3號1樓,化菻~零售業
48782355,姿雅美容坊,臺北市中山區龍江路274號,化菻~零售業
48947309,可喜行銷企業社,臺北市大安區復興南路2段200號7樓之2,化菻~零售業
13834687,宗呈企業社,臺北市中山區中山北路2段183巷22號4樓,化菻~零售業
94908759,莫思設計工作室,臺北市信義區松隆路46號3樓,化菻~零售業
31947868,瑞安傳統整復推拿館,臺北市大安區瑞安街208巷24弄12號,化菻~零售業
17536999,艾曼達精品店,臺北市大安區敦化南路1段190巷13號1樓,化菻~零售業
38576911,霏凡時尚館,臺北市松山區八德路3段232號,232號2樓,234號,化菻~零售業
27172808,發騷站精品服飾店,臺北市士林區天母西路32號,化菻~零售業
94914302,峻興商行,臺北市中山區民權西路20號10樓之10,化菻~零售業
38558012,暐羚工作室,臺北市北投區中和街310號,化菻~零售業
21757797,佳必琪工作坊,臺北市中正區開封街1段27號3樓,化菻~零售業
15666313,龍兒精品百貨行,臺北市信義區永吉路443巷5弄1號2樓,化菻~零售業
31854615,華御行,臺北市士林區天母東路59之2號,化菻~零售業
26304035,晶殿泰式精緻養生館,臺北市文山區羅斯福路6段190號,化菻~零售業
48819888,育禾商行,臺北市士林區天母北路5號,化菻~零售業
29250955,聖田企業社,臺北市北投區崗山路18號2樓之1,化菻~零售業
31858817,氧活美學館,臺北市松山區南京東路3段256巷49號,化菻~零售業
25666729,昇輝服飾行,臺北市松山區南京東路5段4號,化菻~零售業
25504844,林佳蔚美容坊,臺北市文山區忠順街1段26巷34號,化菻~零售業
21716950,利達企業社,臺北市士林區美崙街49巷19號,化菻~零售業
13475107,房角石企業社,臺北市北投區中正街6號,化菻~零售業
48756363,永富家國際商行,臺北市文山區羅斯福路6段106號6樓之3,化菻~零售業
26230739,足享養生企業社,臺北市中山區雙城街12之3號,化菻~零售業
26227880,小船商行,臺北市萬華區西藏路251巷18號4樓,化菻~零售業
26245389,晶茵企業社,臺北市中山區北安路588巷30弄14號7樓,化菻~零售業
31959391,君柏企業社,臺北市松山區民生東路4段76號2樓,化菻~零售業
34773567,響聲行銷工作坊,臺北市萬華區昆明街111號3樓之8,化菻~零售業
42269366,芃羽精品服飾店,臺北市大安區敦化南路1段177巷15號,化菻~零售業
26337612,蔡慎美容坊,臺北市大安區忠孝東路4段341號5樓之4,化菻~零售業
99348762,媚顏輕盈養生館,臺北市中山區明水路397巷7弄60號,化菻~零售業
31873373,羽禾服飾店,臺北市大安區浦城街24之2號,化菻~零售業
38463867,美齊企業社,臺北市松山區慶城街8之1號4樓,化菻~零售業
38565604,御太郎食品行,臺北市信義區莊敬路361號1樓,化菻~零售業
26244564,弘翔實業社,臺北市大同區重慶北路1段15巷8號(4樓),化菻~零售業
38460989,璽安國際企業社,臺北市大同區民族西路31巷10號,化菻~零售業
38669495,千金時尚美睫館,臺北市中山區民生東路1段8號2樓,化菻~零售業
31952382,沙宣工作室,臺北市大安區和平東路3段103號2樓,化菻~零售業
15652205,法雅美容材料行,臺北市中正區漢口街1段103號2樓,化菻~零售業
38575639,愛美美妍社,臺北市中正區延平南路60號3樓,化菻~零售業
26216700,佳羚坊,臺北市士林區天母北路1號1樓,化菻~零售業
29247684,摩賽卡法式茶館,臺北市大安區麗水街24號1樓,化菻~零售業
14734742,九逵通通通寶商行,臺北市松山區南京東路4段95號4樓,化菻~零售業
14331311,京采企業社,臺北市中山區南京西路6號11樓,化菻~零售業
99980701,金緹小鋪,臺北市萬華區西寧南路72之1號4樓,化菻~零售業
38563107,瑪利精品店,臺北市大安區敦化南路1段329巷15號,化菻~零售業
31964388,美麗堡企業社,臺北市士林區天母北路4巷5之2號地下1樓,化菻~零售業
31880199,俊髮美髮沙龍,臺北市大安區瑞安街65之2號,化菻~零售業
18398093,承泰實業社,臺北市內湖區成功路4段323巷2弄1號4樓,化菻~零售業
48694607,韻綮國際商行,臺北市士林區中山北路6段195巷21號3樓,化菻~零售業
38506768,茵悅坊,臺北市大安區瑞安街196號,化菻~零售業
73911119,雅嵐美容坊,臺北市文山區興隆路3段7號1樓,化菻~零售業
98889016,神通企業社,臺北市文山區木柵路4段25號,化菻~零售業
48740320,約瑟糧倉有機食品行,臺北市信義區松山路399號1樓,化菻~零售業
31877194,安鼎生機坊,臺北市內湖區內湖路1段705號,化菻~零售業
18413405,順裕藥行,臺北市大同區歸綏街235號2樓,化菻~零售業
25655552,靜堡實業社,臺北市文山區秀明路2段92巷10號2樓,化菻~零售業
26223189,恩典時尚美學館,臺北市南港區興中路56巷15號10樓,化菻~零售業
38506887,玲行美髮院,臺北市大安區忠孝東路4段223巷55號2樓,化菻~零售業
01111588,良華行,臺北市中正區重慶南路1段88號1樓,化菻~零售業
38503875,士林名品坊,臺北市士林區基河路124號,化菻~零售業
38472789,赫而司企業社,臺北市內湖區成功路5段460號15樓,化菻~零售業
48670268,丰閣服飾精品店,臺北市中正區羅斯福路4段92號水源市場1樓第89號攤,化菻~零售業
38569019,菩心養生館,臺北市中正區許昌街17之1號,化菻~零售業
26230180,瑋芩企業社,臺北市松山區南京東路5段62號10樓,化菻~零售業
38474273,模塑走廊二企業社,臺北市中山區錦州街46號10樓之5,化菻~零售業
48851296,宏昇襪子店,臺北市大安區永康街11之2號,化菻~零售業
10340128,森之蝶美妍館,臺北市北投區西安街2段237號,化菻~零售業
25580379,寶鑫企業社,臺北市南港區興中路12巷15號6樓,化菻~零售業
26233829,鈺方服飾精品店,臺北市中正區臨沂街57巷44號,化菻~零售業
14746206,朵螢美容用品行,臺北市大安區安和路1段100號2樓,化菻~零售業
26210065,小荳精品行,臺北市中正區羅斯褔路3段316巷7之1號,化菻~零售業
31952263,百利足體養生館,臺北市萬華區西寧南路192之4號,化菻~零售業
83949254,太友行,臺北市松山區饒河街146號1樓,化菻~零售業
15646226,螢華美容商行,臺北市內湖區成功路4段30巷16號及16號地下1層,化菻~零售業
26366741,兆耀企業社,臺北市內湖區民權東路6段56巷1弄3號2樓,化菻~零售業
31965020,鈞豪企業社,臺北市信義區信義路6段64號4樓,化菻~零售業
38463450,台灣銀髮族樂活醫療器材企業社,臺北市松山區光復北路190巷39號龍城市場2樓224號攤位,化菻~零售業
31964731,泰鑫悅養生館,臺北市內湖區康寧路1段157號1樓,化菻~零售業
26363977,彩馥美容用品行,臺北市松山區南京東路5段250巷2弄3之1號1樓,化菻~零售業
30239901,采奕整體造型工作室,臺北市內湖區石潭路27號13樓之3,化菻~零售業
38577881,祁甡企業社,臺北市大安區信義路2段36號,化菻~零售業
25513153,東琳時尚創藝髮坊,臺北市中正區南昌路2段207之1號,化菻~零售業
48693987,麗旺日用品商行,臺北市士林區東山路110巷10號2樓,化菻~零售業
38563747,香菇實業商行,臺北市北投區泉源路12號6樓之1,化菻~零售業
38557267,時尚女孩流行飾品商行,臺北市大安區延吉街140之2號,化菻~零售業
25656139,騏鼎峰企管企業社,臺北市信義區虎林街164巷6號5樓,化菻~零售業
38500455,大安芳香卉館,臺北市大安區瑞安街23巷16號,化菻~零售業
15662935,精奇坊資訊實業社,臺北市大同區重慶北路2段114巷6之1號1樓,化菻~零售業
14738199,衡美國際實業洋行,臺北市中山區民生東路1段48號7樓之3,化菻~零售業
83934941,台灣健美社,臺北市信義區基隆路2段189號6樓之8,化菻~零售業
13840371,希爾企業社,臺北市大安區信義路2段228巷15弄3號4樓,化菻~零售業
26228446,流感創意工作室,臺北市萬華區武昌街2段38號(3樓),化菻~零售業
26352057,愛美麗時尚工作室,臺北市大安區忠孝東路4段2號2樓之7,化菻~零售業
80981589,精彩精品店,臺北市文山區羅斯福路6段315號1樓,化菻~零售業
10307943,斐俐髮藝設計館,臺北市內湖區文德路22巷27弄5號,化菻~零售業
38563508,朱合李商行,臺北市大安區延吉街160巷11號,化菻~零售業
38557490,樂芙萊茯館,臺北市大安區忠孝東路4段162號11樓之5,化菻~零售業
21754031,家尚生活館,臺北市北投區自強街87號1樓,化菻~零售業
38460524,奇典餐飲企業社,臺北市中正區信陽街31號1樓、2樓,化菻~零售業
26249245,芮娜藝術美甲商行,臺北市中山區松江路362巷7號1樓,化菻~零售業
31853833,蕾蒂司美學館,臺北市大安區敦化南路1段161巷69弄7號,化菻~零售業
13442205,嘉風蔘藥行,臺北市信義區虎林街82巷27號,化菻~零售業
10367673,竹圍商行,臺北市萬華區西園路1段145號龍山寺地下街商場15號店鋪,化菻~零售業
38561332,吉娳百貨行,臺北市信義區松山路541巷15號,化菻~零售業
26231104,泰芝雅養生館,臺北市萬華區西園路2段258號,化菻~零售業
21716826,嘉琪服裝工作室,臺北市松山區八德路4段453巷7號1樓,化菻~零售業
10318049,愛玩工坊,臺北市中山區北安路630巷2號,化菻~零售業
38578426,蘋果時尚靚眼美睫館,臺北市大同區赤峰街23巷1號2樓,化菻~零售業
31946214,貝比幸福小舖,臺北市大同區重慶北路2段71之1號4樓,化菻~零售業
48904694,玥汏髮藝,臺北市中正區館前路18號3樓,化菻~零售業
27189152,莫麗百貨行,臺北市中正區延平南路83號14樓之1,化菻~零售業
48976205,傳美生活坊,臺北市萬華區漢口街2段73號10樓,化菻~零售業
48979977,桂采企業社,臺北市信義區信安街30號,化菻~零售業
31848810,龍觀企業社,臺北市南港區研究院路2段182巷58弄17號4樓,化菻~零售業
31879019,上好商行,臺北市大同區華陰街42之31號1樓,化菻~零售業
15664906,彩藝美容化菻~行,臺北市南港區忠孝東路6段424號2樓,化菻~零售業
26211629,銘成美容美髮材料行,臺北市內湖區金龍路118號,化菻~零售業
38460989,璽安國際企業社,臺北市松山區市民大道4段35號,化菻~零售業
31947403,奇崴美容行,臺北市松山區復興南路1段37號2樓,化菻~零售業
31855966,善霖企業社,臺北市信義區吳興街281巷72號1樓,化菻~零售業
25589054,太極行,臺北市中山區長安東路2段45之2號,化菻~零售業
38574462,大奕企業社,臺北市士林區文林路565號1樓,化菻~零售業
38579902,手璞天然手工坊,臺北市松山區敦化北路222巷6號5樓,化菻~零售業
26350522,浩世數位科技工作室,臺北市南港區忠孝東路6段269巷3弄6號3樓,化菻~零售業
48712915,麗登網路藥妝館,臺北市士林區文林路261號,化菻~零售業
25583832,金韋服飾精品店,臺北市大安區敦化南路1段177巷40號,化菻~零售業
38464845,敏銳風尚工作室,臺北市松山區南京東路4段197號9樓之1,化菻~零售業
30100408,環音企業社,臺北市信義區信義路5段150巷10號2樓之2,化菻~零售業
38496543,巨恆商行,臺北市大同區延平北路4段157之2號2樓,化菻~零售業
48871053,富媚服飾店,臺北市萬華區成都路7號1樓,化菻~零售業
17747220,攝取製作工作室,臺北市內湖區康寧路3段75巷175弄2之7號2樓,化菻~零售業
25655461,麗星屋精品店,臺北市大安區忠孝東路4段97號3樓之17,化菻~零售業
26349194,北投依人工作室,臺北市北投區中和街365號,化菻~零售業
05256141,儷嘉美容工作室,臺北市大同區長安西路121號8樓,化菻~零售業
31864156,黛可拉精品名店,臺北市中山區松江路297巷21號,化菻~零售業
98676219,纖體食品企業社,臺北市中正區青島東路5號6樓,化菻~零售業
26350305,芬芸工作坊,臺北市中山區中山北路1段121巷10號,化菻~零售業
31965915,忠義時尚造型髮藝店,臺北市士林區忠義街72號,化菻~零售業
10305678,重生二手坊,臺北市士林區文林路128號,化菻~零售業
15638154,寶富麗商行,臺北市中山區林森北路105號9樓之3,化菻~零售業
38562536,合鑫企業社,臺北市信義區松德路65號11樓之1,化菻~零售業
13479146,維孋斯生活館,臺北市大安區復興南路1段133號4樓,化菻~零售業
38580730,采悅生活館,臺北市南港區南港路1段208號,化菻~零售業
83902602,虹飛企業社,臺北市士林區文昌路240號1樓,化菻~零售業
31854185,芙兒妮服飾店,臺北市大安區敦化南路1段160巷9號,化菻~零售業
99626131,集祥時裝工作室,臺北市北投區中正街71號(1樓),化菻~零售業
38500791,皮藝世界工坊,臺北市松山區饒河街158號(1樓),化菻~零售業
99613282,佐伯企業社,臺北市中山區雙城街13巷16之3號1樓,化菻~零售業
26242405,馨儀髮藝工作室,臺北市中山區農安街176號1樓,化菻~零售業
25615428,新翊眼鏡名店,臺北市大安區羅斯福路3段13號1樓,化菻~零售業
31844053,萬家昇企業社,臺北市松山區八德路3段158巷8弄5之3號,化菻~零售業
48721371,詠捷行,臺北市信義區中坡南路235號1樓,化菻~零售業
10371796,晴天工作室,臺北市中山區錦州街臨368號,化菻~零售業
38513114,雅新企業社,臺北市大安區忠孝東路4段211號12樓之2,化菻~零售業
48922291,赤褐飲食店,臺北市大安區復興南路2段339號1樓,化菻~零售業
78379958,名麗服飾店,臺北市中正區羅斯福路4段92號1樓水源市場攤位95號,化菻~零售業
13832323,薇朵莉亞工作室,臺北市大安區大安路1段65號4樓,化菻~零售業
31863425,淞浦企業社,臺北市萬華區德昌街185巷90號4樓,化菻~零售業
26347745,知美國際企業社,臺北市大安區信義路2段72號地下,化菻~零售業
26229775,百洲企業社,臺北市中正區南昌路1段67號,化菻~零售業
38474724,真柏國際企業社,臺北市文山區羅斯福路5段216之1號2樓,化菻~零售業
14313897,捷寶電器行,臺北市中山區農安街4號3樓,化菻~零售業
38504473,萊琦商行,臺北市中正區衡陽路25號2樓,化菻~零售業
48879436,瑞亞時尚美甲工作室,臺北市大安區大安路1段19巷30號,化菻~零售業
13854819,美門商行,臺北市文山區指南路3段71號2樓之2,化菻~零售業
10301188,七三七精品坊,臺北市萬華區西寧南路36之3號,化菻~零售業
38574316,麗穎服飾精品商行,臺北市大安區敦化南路1段161巷45之1號,化菻~零售業
26373026,利樂屋企業社,臺北市內湖區文德路22巷24號,化菻~零售業
48678064,全樂企業社,臺北市中山區林森北路107巷26號2樓,化菻~零售業
48791832,菁嬅工作室,臺北市大安區安和路1段102巷16號,化菻~零售業
14743329,弘帥精品男飾店,臺北市中山區五常街53巷12號,化菻~零售業
25572075,古飾洋行,臺北市大安區大安路1段31巷19號,化菻~零售業
26373644,優麗雅美容坊,臺北市南港區忠孝東路6段405號(1樓),化菻~零售業
42269582,泰陽美容坊,臺北市文山區興隆路2段149號,化菻~零售業
31865090,茱莉喜樂花園,臺北市中山區敬業一路170號,化菻~零售業
98883688,黃亞瑾工作室,臺北市大安區敦化南路1段187巷57號2樓之2,化菻~零售業
38567764,鑫佳美企業社,臺北市大安區光復南路290巷29號4樓,化菻~零售業
31874871,富美企業社,臺北市中山區南京東路2段138巷7號,化菻~零售業
21730876,明昌文化事業行,臺北市南港區中坡北路50巷10號1樓,化菻~零售業
25549292,莎黛服飾名店,臺北市大安區敦化南路1段177巷43號,化菻~零售業
48979580,費莉絲精品企業社,臺北市大安區忠孝東路4段223巷10弄2號,化菻~零售業
99672492,采聯企業社,臺北市大同區迪化街1段46巷22號1樓,化菻~零售業
99352060,偉博泰整合網路行銷顧問企業社,臺北市信義區基隆路1段141號5樓之8,化菻~零售業
48687486,雅得麗生活企業社,臺北市中山區中山北路2段33號10樓,化菻~零售業
08599613,林秋美容材料行,臺北市內湖區成功路4段41巷2號2樓,化菻~零售業
38572295,延壽生活館,臺北市松山區延壽街320號,化菻~零售業
48856757,御品香企業社,臺北市中正區中華路2段311巷31號,化菻~零售業
25671167,衣舞館服飾店,臺北市大安區龍泉街39號1樓,化菻~零售業
38498893,雅苑企業社,臺北市文山區辛亥路5段33號,化菻~零售業
73893870,東霖醫療儀器行,臺北市中正區汀州路3段113號1樓,化菻~零售業
26238578,中泰漢方美容坊莊敬分店,臺北市信義區莊敬路307號地下樓,化菻~零售業
31956036,慕卡精品服飾店,臺北市大安區通化街9號,化菻~零售業
25554604,伊琳造型沙龍,臺北市中正區金華街24之1號1樓,化菻~零售業
10314661,榳擎設計工作室,臺北市松山區南京東路4段56號10樓之6,化菻~零售業
26239675,繆思時尚工作室,臺北市信義區吳興街284巷20弄28號2樓,化菻~零售業
38571802,宏緯商品行,臺北市萬華區漢口街2段5號,化菻~零售業
38574884,隨心所欲服飾店,臺北市大安區忠孝東路4段205巷9號1樓,化菻~零售業
26240244,優諾髮型沙龍,臺北市大安區復興南路2段78巷2號地下,化菻~零售業
31874295,龍龍生活百貨行,臺北市中山區龍江路356巷12號,化菻~零售業
80996979,甜蜜寶貝婦幼用品行,臺北市松山區八德路2段451巷1號1樓,化菻~零售業
38562867,米蕾朵工作室,臺北市信義區基隆路1段147巷25號1樓,化菻~零售業
10359435,歐穎達企業社,臺北市南港區忠孝東路6段6號3樓之6,化菻~零售業
94917722,宥豆精品店,臺北市大同區重慶北路3段273號1樓,化菻~零售業
29205903,芳薰企業社,臺北市大安區仁愛路4段110號14樓之1,化菻~零售業
26246227,尊賢養生坊,臺北市北投區尊賢街247之6號,化菻~零售業
38508597,泰綻健康生活館,臺北市士林區士東路260號1樓,化菻~零售業
10343770,魔鏡造型創意工作室,臺北市信義區虎林街132巷13號,化菻~零售業
48701207,以斯帖工作坊,臺北市士林區中山北路7段82巷8號地下樓,化菻~零售業
08589832,麗比雅美容院,臺北市內湖區江南街65巷33號,化菻~零售業
48904245,象山第一站商行,臺北市信義區莊敬路215號1樓,化菻~零售業
25556552,歐納企業社,臺北市大同區延平北路2段154號,化菻~零售業
26239366,承岳國際時尚企業社,臺北市大安區信義路4段265巷3之1號,化菻~零售業
25693824,丰姿美容商行,臺北市文山區育英街11之6號,化菻~零售業
25581308,勤郁行,臺北市士林區延平北路5段231巷41號1樓,化菻~零售業
26217145,莉晶美容美體館,臺北市內湖區江南街65巷12號,化菻~零售業
98910432,錦松洋行,臺北市信義區永吉路443巷48號1樓,化菻~零售業
26531968,茂琳國際洋行,臺北市中正區許昌街42之1號10樓,化菻~零售業
31874801,實踐髮藝店,臺北市中山區北安路595巷8號,化菻~零售業
48848146,異術工作室,臺北市中山區復興北路18號2樓,化菻~零售業
31850765,姿瑞企業社,臺北市中山區長安東路2段36巷9號地下,化菻~零售業
31842843,水噹噹的店,臺北市大安區青田街13號1樓,化菻~零售業
17735688,韻詩美美容用品坊,臺北市中山區農安街22號1樓,化菻~零售業
25693084,米奈娃工作室,臺北市松山區撫遠街395巷29號1樓,化菻~零售業
99642553,育靜美容工作坊,臺北市松山區八德路3段225號9樓之6,化菻~零售業
48941945,囍色工坊,臺北市大安區復興南路2段111巷7號6樓,化菻~零售業
31870474,米拉國際精品社,臺北市士林區中正路505號6樓,化菻~零售業
48971813,美夢成真工作室,臺北市中山區林森北路354號,化菻~零售業
80995520,舶妃服飾行,臺北市中正區信義路2段85號1樓,化菻~零售業
31952073,洛芙提百貨行,臺北市大安區忠孝東路4段205巷26弄4號,化菻~零售業
38470608,沐藝生活品味行,臺北市大安區復興南路2段340巷5號,化菻~零售業
38504234,秘密花園美睫館,臺北市信義區忠孝東路5段295巷6弄27號(1樓),化菻~零售業
77855644,六月十六設計工作室,臺北市信義區松山路306號2樓,化菻~零售業
48800038,瑋聖精品店,臺北市大安區忠孝東路4段97號4樓,化菻~零售業
15666799,帝城國際企業社,臺北市萬華區大理街159巷9號1樓,化菻~零售業
38514726,艾利絲髮型店,臺北市士林區中山北路6段764號2樓,化菻~零售業
31846334,子漾藝術工作坊,臺北市中正區羅斯福路2段56號12樓,化菻~零售業
