31958040,紓琪國際商行,臺北市中正區南昌路1段20號3樓,化菻~零售業
99993754,菲比美容坊,臺北市中山區南京東路2段11號3樓,化菻~零售業
38569088,字轉創意工作室,臺北市中正區中山北路1段2號4樓之2,化菻~零售業
14341444,喬豐商行,臺北市大安區信義路2段228巷15弄3號4樓,化菻~零售業
38581554,山豐企業社,臺北市中山區新生北路1段46號8樓,化菻~零售業
38567103,世濠企業社,臺北市中山區吉林路170號,化菻~零售業
26255463,田子坊,臺北市士林區天母西路15之1號,化菻~零售業
31872705,力榮企業社,臺北市內湖區五分街23號5樓,化菻~零售業
14871301,韓多企業社,臺北市中山區林森北路536號7樓之5,化菻~零售業
26767393,利丰企業社,臺北市信義區永吉路181之1號,化菻~零售業
26374524,花漾年華美容館,臺北市中山區興安街91號2樓之9,化菻~零售業
13474901,克麗飾品店,臺北市大安區忠孝東路4段67號,化菻~零售業
25503253,野火商行,臺北市萬華區雙園街28號,化菻~零售業
26241362,春寶精品店,臺北市大安區敦化南路1段187巷14號,化菻~零售業
25556841,華亞商行,臺北市內湖區內湖路2段309號,化菻~零售業
38468687,玖發商行,臺北市中正區寧波東街24巷8號1樓,化菻~零售業
31962065,水晶新娘商行,臺北市中山區民生西路45巷11弄15號2樓,化菻~零售業
38467630,我的衣櫃,臺北市中正區詔安街73號,化菻~零售業
31958885,肯尼工作室,臺北市大安區忠孝東路4段248巷19號(1樓),化菻~零售業
31950912,無齡秘笈健康商行,臺北市信義區忠孝東路5段669號6樓,化菻~零售業
38459483,優英實業社,臺北市南港區舊莊街1段145巷6弄18號,化菻~零售業
38572611,果然新鮮蔬果行,臺北市文山區羅斯福路5段190之3號1樓,化菻~零售業
30303683,史丹佛魔髮美學企業社,臺北市松山區復興北路145號2樓,化菻~零售業
31964129,寧皓小舖,臺北市中正區漢口街1段132號7樓之2,化菻~零售業
48883086,奔月企業社,臺北市北投區溫泉路11之1號,化菻~零售業
48761513,仙杜瑞拉美容用品社,臺北市中山區農安街23號2樓,化菻~零售業
73912308,御香坊,臺北市中山區松江路226巷9號,化菻~零售業
26196916,優美蒂美容坊,臺北市北投區清江路68號,化菻~零售業
25522505,資厚百貨行,臺北市士林區社中街33巷19號,化菻~零售業
10387495,采鳳養生館,臺北市信義區松山路514號,化菻~零售業
26232758,依倍爾美容坊,臺北市中正區忠孝東路1段15號4樓,化菻~零售業
17525607,麗妮行,臺北市士林區中正路276號2樓,化菻~零售業
48718241,家樂企業社,臺北市信義區松隆路20號3樓,化菻~零售業
25524481,樂活雜貨商行,臺北市大安區永康街12巷6號,化菻~零售業
13472397,俊鴻企業社,臺北市內湖區成功路4段182巷6弄33號1樓,化菻~零售業
38502448,愛美藝術工作坊,臺北市北投區三合街2段434號,化菻~零售業
99982095,青春生活館,臺北市士林區中山北路7段141巷14弄16號2樓,化菻~零售業
31952518,瑛嬌美容工作坊,臺北市中山區松江路108巷25號3樓,化菻~零售業
26353582,捷寶商行,臺北市松山區市民大道5段197號1樓,化菻~零售業
31951736,城滿精品服飾店,臺北市大安區敦化南路1段161巷5弄2號1樓,化菻~零售業
99613240,小冰工作坊,臺北市大安區樂業街157號1樓,化菻~零售業
38564582,超越美容材料行,臺北市中山區南京東路2段140號2樓,化菻~零售業
10301835,觀自在企業社,臺北市中山區復興南路1段36號4樓,化菻~零售業
48794161,青絲舫髮廊,臺北市中山區中山北路2段39巷6號2樓,化菻~零售業
26255914,斐絲特色染護專門店,臺北市大安區忠孝東路4段94之4號5樓,化菻~零售業
14726721,神農氏企業社,臺北市中正區羅斯福路2段7之2號11樓,化菻~零售業
25672264,汎妍生活商行,臺北市北投區一德街10巷9號3樓,化菻~零售業
38569329,實發企業社,臺北市大安區泰順街40巷40號1樓,化菻~零售業
29222142,鄧老師養生館,臺北市中山區民權東路2段136號,化菻~零售業
94917363,璦瑪美髮沙龍屋,臺北市內湖區金龍路61之1號1樓,化菻~零售業
29200870,世紀企業社,臺北市中正區漢口街1段31號4樓,化菻~零售業
26362533,萬淑玲服飾精品店,臺北市南港區成福路174號,化菻~零售業
98888608,璐緹流行坊,臺北市大安區羅斯福路2段79之1號1樓,化菻~零售業
83930451,以琳國際洋行,臺北市士林區中山北路6段474號1樓,化菻~零售業
10351948,泰俐莎健康養生館,臺北市文山區景文街64號4樓,化菻~零售業
04889268,大順西藥房,臺北市文山區忠順街1段131號1樓,化菻~零售業
25548842,紳士淑女美容館,臺北市中山區南京東路2段20號7樓、7樓之1、7樓之2,化菻~零售業
31851461,信義胡麻園商行,臺北市信義區忠孝東路5段458號(1樓),化菻~零售業
26233139,星河美容名店,臺北市中山區民生東路2段102號,化菻~零售業
94915581,羅曼奴髮藝工作室,臺北市大安區忠孝東路3段285號3樓,化菻~零售業
31952117,沐品實業社,臺北市士林區臺北市士林區前街25號,化菻~零售業
26224498,虹約健康企業社,臺北市中正區羅斯福路4段68號9樓之14,化菻~零售業
81621839,萬軒行,臺北市大同區延平北路1段22號2樓之6,化菻~零售業
38580464,龍徽實業社,臺北市中山區長春路67號2樓,化菻~零售業
99638208,費司髮藝造型坊,臺北市大安區信義路4段28號2樓,化菻~零售業
48669699,玉芙美萓,臺北市文山區景文街92號2樓,化菻~零售業
13853494,樂彩便利商店,臺北市北投區東華街2段166號1樓,化菻~零售業
31716331,微笑實業,臺北市北投區三合街2段489號,化菻~零售業
31879382,安捷路易咖啡館,臺北市中山區大直街99號1樓,化菻~零售業
13450443,東崧黃金寶石名店,臺北市文山區興隆路2段297號,化菻~零售業
26359642,鉑盛服飾企業社,臺北市大安區敦化南路1段161巷16號,化菻~零售業
31948249,辰宣精品行,臺北市內湖區內湖路1段699號1樓,化菻~零售業
31863023,聰嬌國際企業社,臺北市中山區復興北路488巷3號,化菻~零售業
15639267,瞳鏡眼鏡行,臺北市大安區忠孝東路3段136號10樓之3,化菻~零售業
31858788,飛登國際商行,臺北市大同區承德路1段32號12樓之12,化菻~零售業
31854087,友樹工作室,臺北市大安區麗水街7巷11號2樓之1,化菻~零售業
25577418,雜葉商行,臺北市內湖區內湖路2段263巷9弄7號4樓,化菻~零售業
10332801,菲比國際行銷社,臺北市信義區基隆路2段189號5樓之4,化菻~零售業
29224280,菲比氧生館,臺北市內湖區康樂街48巷31號2樓,化菻~零售業
38475033,新生美妍企業社,臺北市中正區新生南路1段56巷8號,化菻~零售業
31961559,松山文創咖啡館,臺北市信義區忠孝東路4段553巷20之1號,化菻~零售業
17267143,藍特莉專業美容沙龍名店,臺北市信義區松仁路228巷7弄6號1樓,化菻~零售業
48693826,元氣十足養生館,臺北市信義區忠孝東路5段524巷10號,化菻~零售業
48960246,大地健康蔬果生活館,臺北市中正區金華街43巷7號1樓,化菻~零售業
25658397,心田國際商行,臺北市大安區復興南路2段86號7樓,化菻~零售業
21717233,抱花戶手創花藝設計坊,臺北市中山區林森北路85巷2之1號3樓,化菻~零售業
99965574,美人源工作室,臺北市萬華區西園路2段235號2樓,化菻~零售業
38510833,茱諾企業社,臺北市大安區忠孝東路4段87號6樓,化菻~零售業
26348028,宇童精品服飾店,臺北市大安區雲和街70之4號,化菻~零售業
38463043,海星國際實業社,臺北市內湖區內湖路3段343巷3弄1號5樓,化菻~零售業
48739576,佳期美容用品商行,臺北市士林區雨聲街67號,化菻~零售業
31954115,水世界養生館,臺北市松山區八德路4段651號,化菻~零售業
18092311,佑昇國際商行,臺北市南港區八德路4段869號地下之1,化菻~零售業
10314894,立可明企業社,臺北市信義區信義路6段126之32號,化菻~零售業
25580130,健和藥萓,臺北市松山區饒河街251號,化菻~零售業
31882020,布雷奇精品服飾店,臺北市萬華區西寧南路72之1號1樓,化菻~零售業
25669296,葛芮絲婚禮工作室,臺北市中山區中山北路2段183巷4之1號,化菻~零售業
29231825,巴菲特文化事業社,臺北市大安區敦化南路2段1號10樓,化菻~零售業
31843786,思瑜商行,臺北市北投區中央北路3段40巷4號,化菻~零售業
38472161,淨永企業社,臺北市大安區龍泉街93巷11號,化菻~零售業
38506021,鑫鑀錢服飾精品店,臺北市大安區忠孝東路4段17巷30號,化菻~零售業
48790453,婕的店服飾精品商行,臺北市中山區安東街19號,化菻~零售業
25537373,祥佑企業社,臺北市中正區羅斯福路4段136巷1弄5號,化菻~零售業
99974285,田川佳子造型工作室,臺北市大安區仁愛路4段398號7樓,化菻~零售業
48850888,魔魔材料行,臺北市中山區伊通街66巷5號,化菻~零售業
02449167,知新企業社,臺北市內湖區東湖路16巷6之1號2樓,化菻~零售業
01088524,新樂町精緻旅居,臺北市萬華區西寧南路67號5樓、5樓之1、5樓之2、5樓之3、6樓、7樓、8樓、9樓,化菻~零售業
98915112,衣望城市服飾精品店,臺北市萬華區昆明街21號1樓,化菻~零售業
31954353,利屹商行,臺北市松山區南京東路5段250巷11之5號1樓,化菻~零售業
38561614,好點子工作室,臺北市內湖區成功路4段145號4樓,化菻~零售業
38581674,麗琦美企業社,臺北市信義區莊敬路325巷56號3樓,化菻~零售業
27195470,今冠少女服飾行,臺北市萬華區漢中街67號1樓,化菻~零售業
26365222,遇見幸福工作室,臺北市文山區辛亥路5段110號,化菻~零售業
31844286,玉真行,臺北市大安區忠孝東路4段170巷5弄10號,化菻~零售業
31852270,妞妞精品雜貨社,臺北市士林區天母東路50巷20之11號,化菻~零售業
29233056,水蜻蜓工作室,臺北市松山區南京東路5段202號12樓之4,化菻~零售業
17537836,育樺企業社,臺北市文山區仙岩路66號1樓,化菻~零售業
77150646,儂萊少女精品店,臺北市萬華區中華路1段128號1樓,化菻~零售業
25660197,樂活優商業企業社,臺北市內湖區大湖山莊街223號4樓,化菻~零售業
99616865,雅?精品店,臺北市大安區復興南路1段107巷45之1號3樓,化菻~零售業
26362941,左岸美容館,臺北市中山區農安街9號房屋地下層,化菻~零售業
26246177,咻思創意設計工作室,臺北市大安區光復南路672號2樓,化菻~零售業
26347647,極白商號,臺北市大安區敦化南路1段160巷10號,化菻~零售業
48815481,願來企業社,臺北市內湖區成功路4段61巷26號5樓,化菻~零售業
94912091,穎和造型工作室,臺北市信義區基隆路1段97號6樓之4,化菻~零售業
25533382,韓格精品舖,臺北市中山區五常街43號1樓,化菻~零售業
10359239,髮情企業社,臺北市文山區羅斯福路6段266號2樓,化菻~零售業
25541897,晴印洋行,臺北市士林區德行西路52號1樓,化菻~零售業
29216922,大綾美容工作坊,臺北市中山區民權西路20號10樓之7,化菻~零售業
38552636,可艾工作室,臺北市北投區中和街234巷1號,化菻~零售業
38503489,愛在鐵塔精品服飾店,臺北市中山區民權東路3段14號(1樓),化菻~零售業
48940495,仟殿美容院,臺北市士林區中正路237號,化菻~零售業
13850497,惠萍沙龍名店,臺北市士林區忠誠路2段70巷10號,化菻~零售業
01286377,妍容坊,臺北市中山區龍江路356巷72號1樓,化菻~零售業
13461716,明慧美容器材行,臺北市中山區中山北路1段105巷11號(3樓),化菻~零售業
31863327,寶德成商行,臺北市大安區大安路2段141巷11號2樓,化菻~零售業
48582928,美美雜貨店,臺北市士林區中山北路7段63巷7號,化菻~零售業
38496918,普吉島養生館重慶店,臺北市大同區重慶北路3段30號2樓,化菻~零售業
38562418,嘟嘟鳥餐坊,臺北市中山區吉林路26巷26號,化菻~零售業
34753767,魔法石工作室,臺北市中正區忠孝東路1段108號1樓A22號攤位,化菻~零售業
42289264,樂麗小舖,臺北市大同區臺北市大同區南京西路69之1號1樓,化菻~零售業
25665691,金福手養身館,臺北市中山區長安東路1段50號1樓,化菻~零售業
38573816,秀的古著名店,臺北市大同區重慶北路1段80號,化菻~零售業
31872276,愛絲特工作坊,臺北市萬華區廣州街32號2樓,化菻~零售業
83911222,時尚焦點精品店,臺北市大安區忠孝東路4段97號4樓,化菻~零售業
38471965,玄太極足體養生館,臺北市大同區鄭州路3之1號1樓、2樓,化菻~零售業
48745985,黃金拍檔工作室,臺北市大安區仁愛路4段401號14樓,化菻~零售業
38550779,典雅商行,臺北市內湖區港墘路17號,化菻~零售業
17080392,女人容房美容店,臺北市中山區北安路458巷41弄44號,化菻~零售業
48742805,非鈴美容材料行,臺北市士林區天母西路3號5樓之9,化菻~零售業
38470656,鉅幼企業社,臺北市文山區忠順街2段25號,化菻~零售業
48762317,美景工房,臺北市中山區雙城街18巷12號1樓,化菻~零售業
48957360,貞琇沙龍店,臺北市內湖區民權東路6段123巷34弄7號,化菻~零售業
26355596,英蕙服飾精品商行,臺北市大安區永康街10號,化菻~零售業
38560586,概伊美髮美容坊,臺北市中正區忠孝西路1段23號5樓,化菻~零售業
38502518,星燁企業社,臺北市大安區臨江街104號,化菻~零售業
99329625,廣寶行,臺北市文山區興隆路4段105巷27號,化菻~零售業
25676000,湘湘商行,臺北市松山區復興北路215號7樓之1,化菻~零售業
26232981,萱柏商行,臺北市大安區仁愛路4段266巷15弄16號2樓,化菻~零售業
31877379,晶圓生技美妍坊,臺北市信義區松山路227號,化菻~零售業
31950960,五餅二魚企業社,臺北市北投區光明路26號19樓之1,化菻~零售業
18398404,喬泰百貨行,臺北市大同區重慶北路1段23號1樓,化菻~零售業
13786926,禹丞企業社,臺北市萬華區和平西路3段29號1樓,化菻~零售業
48856118,菁彩美容美髮材料精品店,臺北市萬華區雙園街55號,化菻~零售業
29205278,沙崙玫瑰工作室,臺北市信義區松德路69號2樓,化菻~零售業
09937079,台灣外貌資訊社,臺北市中山區中山北路1段33巷23號,化菻~零售業
14641499,永明企業行,臺北市萬華區環河南路2段155巷6號2樓,化菻~零售業
31842800,水雲美容工坊,臺北市北投區裕民四路2巷2號(1樓),化菻~零售業
30281793,鴻源企業社,臺北市中正區師大路212號11樓,化菻~零售業
10387283,快樂維生服飾精品店,臺北市萬華區成都路67號5樓之1,化菻~零售業
25554055,德瑞商行,臺北市內湖區文德路22巷53弄25號6樓,化菻~零售業
17261318,歡顏行,臺北市大安區信義路2段36號1至2樓,化菻~零售業
48701804,源富洋行,臺北市文山區辛亥路7段65巷7號2樓,化菻~零售業
31862707,陽光北極熊商行,臺北市信義區忠孝東路5段790巷30弄4號3樓,化菻~零售業
99352272,宣揚媒體行銷工作室,臺北市中正區重慶南路1段99號10樓之6,化菻~零售業
77832782,黃金女郎精品店,臺北市大安區忠孝東路4段49巷8號,化菻~零售業
26336851,凱樂活網路工作室,臺北市大安區樂業街159巷16號1樓,化菻~零售業
26223907,菲萱美容工作室,臺北市大安區忠孝東路4段183號12樓之5,化菻~零售業
13443844,郁嘉婦幼百貨行,臺北市內湖區內湖路2段325號,化菻~零售業
31848966,玄髮髮型名店,臺北市中山區中山北路2段26巷12之1號1樓,化菻~零售業
38581371,金皇族企業社,臺北市大安區安和路2段59巷6號,化菻~零售業
25658713,雅妍服飾精品店,臺北市大安區羅斯福路3段251之1號,化菻~零售業
26352887,天然彩藝國際企業社,臺北市大同區大龍街259巷14號4樓之1,化菻~零售業
31877716,御品生活館,臺北市文山區興隆路1段145號,化菻~零售業
31853545,德蓮企業社,臺北市大安區仁愛路3段123巷7號1樓,化菻~零售業
26360401,保羅國際企業社,臺北市大安區忠孝東路4段205巷7弄1號3樓,化菻~零售業
18465254,長紘商行,臺北市北投區一德街10巷9號3樓,化菻~零售業
26352417,馬纓丹工作室,臺北市松山區八德路4段797號4樓之1,化菻~零售業
48802063,奕蓁精品店,臺北市大安區復興南路2段151巷7號1樓,化菻~零售業
99351153,傑凱瑞通訊器材行,臺北市文山區景文街54號1樓,化菻~零售業
31695933,乙千實業,臺北市北投區中和街28號(2樓),化菻~零售業
25657025,夢幻仙境工作室,臺北市信義區富陽街40號,化菻~零售業
31877286,黃楊企業社,臺北市文山區興隆路3段207巷5弄1號2樓,化菻~零售業
26342761,晶華精品店,臺北市萬華區西寧南路72之1號2樓,化菻~零售業
26361555,德撒律生物科技企業社,臺北市松山區八德路4段616號7樓,化菻~零售業
38468835,綵葳服飾精品店,臺北市松山區民生東路5段212巷11號1樓,化菻~零售業
25560991,匯美鋪,臺北市中山區松江路67號6樓之3,化菻~零售業
31964113,貝拉米服飾精品店,臺北市士林區中正路235巷41號,化菻~零售業
21765353,益發服飾店,臺北市大安區忠孝東路4段87之14號1樓,化菻~零售業
31845829,水舞間時尚館,臺北市中山區建國北路2段33號地下1層及長春路169號地下1層,化菻~零售業
38504966,元敏企業社,臺北市大安區光復南路296號6樓之1,化菻~零售業
31898199,中菲商行,臺北市大安區通化街39巷51號,化菻~零售業
17090259,蕬鈺精緻美容名店,臺北市內湖區內湖路1段737巷78號1樓,化菻~零售業
26253649,湯泉商行,臺北市中山區松江路276號6樓,化菻~零售業
26230920,瑪露美容工作室,臺北市松山區復興北路15號13樓之2,化菻~零售業
25655080,追勢可得服飾店,臺北市大安區光復南路290巷68號1樓,化菻~零售業
26238654,及品時尚店,臺北市信義區忠孝東路5段1之3號,化菻~零售業
99633626,明瑄烘焙原料行,臺北市內湖區港墘路36號,化菻~零售業
25560789,翰倫商行,臺北市松山區南京東路3段346之1號8樓,化菻~零售業
38471732,吻銀企業社,臺北市大安區龍泉街27號1樓,化菻~零售業
31948058,傑妮流行服飾舖,臺北市萬華區西寧南路72之1號3樓,化菻~零售業
26368467,原創美學髮藝,臺北市中山區南京西路1之1號2樓,化菻~零售業
25508341,卑爾工作室,臺北市南港區八德路4段871號15樓之6,化菻~零售業
26242094,大樺服飾行,臺北市信義區松山路137號1樓、139號1樓,化菻~零售業
29219809,東湖美容工作坊,臺北市內湖區康寧路3段16巷130號1樓,化菻~零售業
10308513,來鑫企業社,臺北市中正區連雲街87號,化菻~零售業
31876717,索爾絲服飾店,臺北市中山區吉林路286號6樓,化菻~零售業
31952101,亞芮士設計工作室,臺北市北投區光明路2巷13之5號,化菻~零售業
26234854,豐光企業社,臺北市中山區長安東路2段36巷9號地下,化菻~零售業
26366876,欣滿意足商行,臺北市內湖區江南街85號,化菻~零售業
31709943,京站支付企業社,臺北市中山區松江路207號9樓,化菻~零售業
38508999,英捷百貨商行,臺北市中山區中山北路1段33巷3號2樓,化菻~零售業
10312018,海上花企業社,臺北市大安區嘉興街399號,化菻~零售業
48940707,舒可泰生活館,臺北市信義區信安街127號,化菻~零售業
26338458,肜穎服飾,臺北市內湖區成功路4段30巷24號,化菻~零售業
48834494,仁恩商行,臺北市士林區永平街53號,化菻~零售業
26345113,多晶企業社,臺北市大同區赤峰街5號2樓,化菻~零售業
26214885,名宸工作室,臺北市內湖區江南街117巷8弄19號3樓,化菻~零售業
48790165,宏恩工作室,臺北市中山區林森北路50號4樓之3,化菻~零售業
48785753,人愛清靜美容坊,臺北市大安區信義路4段137號5樓,化菻~零售業
38500363,真幸商行,臺北市士林區後港街18號2樓,化菻~零售業
10396699,水漾工作坊,臺北市士林區雨聲街61號,化菻~零售業
38514275,馬喬企業社,臺北市中山區松江路123巷3號1樓,化菻~零售業
15637676,阿榮小吃店,臺北市中正區重慶南路1段13號1樓、開封街1段29號1樓,化菻~零售業
38499838,歐波精品店,臺北市大安區敦化南路1段161巷34號,化菻~零售業
29216681,芳盛商行,臺北市士林區延平北路5段269號1樓,化菻~零售業
21765500,雙木商行,臺北市大安區忠孝東路4段223巷40號1樓,化菻~零售業
25540222,彩瑞生活館,臺北市中山區民權東路2段135巷20弄12號,化菻~零售業
26250967,美人坊,臺北市松山區饒河街103號,化菻~零售業
38495592,利百加名店,臺北市士林區天玉街38巷19弄1號,化菻~零售業
38503354,幸蓓美容用品店,臺北市文山區興隆路4段106號,化菻~零售業
38574511,豐采燕商行,臺北市信義區中坡南路215巷8號5樓,化菻~零售業
10332035,自在空間髮妝造型沙龍,臺北市文山區木新路3段111號,化菻~零售業
31876548,泰芝戀企業社,臺北市中山區民權東路2段75號,化菻~零售業
38573386,真愛全新二手精品店,臺北市萬華區西寧南路72之1號,化菻~零售業
31417538,久壹租書城,臺北市中山區伊通街87巷8之2號1樓,化菻~零售業
26300278,緁倪卡科技企業社,臺北市北投區中央南路1段25巷4號,化菻~零售業
25562219,詠澄企業社,臺北市松山區民生東路5段250號4樓,化菻~零售業
26251494,俊的髮型工作坊,臺北市文山區興隆路3段81號2樓,化菻~零售業
80990291,美華麗精品百貨行,臺北市中山區南京西路2號1樓,化菻~零售業
99634081,鈦騑精品坊,臺北市士林區文林路53號1樓,化菻~零售業
15643662,富軒商行,臺北市士林區忠誠路2段130巷31號1樓,化菻~零售業
38509245,亮亮企業社,臺北市中山區建國北路2段33號10樓之5,化菻~零售業
13680445,藍點創意企業社,臺北市中山區南京東路3段189號4樓,化菻~零售業
01330325,東莉精品服飾皮鞋店,臺北市中山區錦西街1之3號1樓,化菻~零售業
10371178,祥益企業社,臺北市大同區承德路1段35號6樓,化菻~零售業
29242153,瑤池女子美容美體坊,臺北市北投區大業路572號1樓,化菻~零售業
42276351,豐穰企業社,臺北市中山區中吉里南京東路2段101號11樓,化菻~零售業
17519056,美成美容用品坊,臺北市文山區羅斯福路5段181號1樓,化菻~零售業
38568010,法歐莉小舖,臺北市大同區承德路3段143巷11號4樓,化菻~零售業
48964123,彩蓁美容工作坊,臺北市南港區合順街8巷3弄15號,化菻~零售業
21702013,育群企業社,臺北市中山區建國北路2段129號2樓,化菻~零售業
38496781,映欣精品服飾店,臺北市大安區復興南路1段107巷19之2號,化菻~零售業
48876607,美足家企業社,臺北市士林區大南路238號3樓,化菻~零售業
01793839,史威德生活小舖,臺北市中正區紹興北街31巷6號4樓之1,化菻~零售業
31862642,快樂手工皂坊,臺北市中山區民生西路30號6樓之1,化菻~零售業
15476502,德龍號,臺北市萬華區康定路146號1樓,化菻~零售業
26229769,華想翼視覺設計社,臺北市大同區民族西路42-1號(3樓),化菻~零售業
99325613,岩室服飾精品店,臺北市大安區永康街6巷10號1樓,化菻~零售業
78194039,振奮成長造型沙龍坊,臺北市信義區莊敬路404號1樓,化菻~零售業
01587465,寶景眼鏡行,臺北市松山區民生東路5段119之1號,化菻~零售業
99606297,以法蓮美容材料行,臺北市中正區信義路2段257號2樓,化菻~零售業
31874632,錦秀百貨行,臺北市中正區連雲街85號,化菻~零售業
98892482,復隆企業社,臺北市中山區復興北路514巷58號,化菻~零售業
38505509,實美美菃{,臺北市大安區信義路4段63號1樓,化菻~零售業
17088471,柯夢商行,臺北市中正區寧波西街21號2樓,化菻~零售業
31861221,微賀企業社,臺北市中山區民權東路2段92巷1弄5號,化菻~零售業
25573948,周妏倩藝術造型工作室,臺北市中正區詔安街50巷1弄7號2樓,化菻~零售業
83932726,呈冠國際商行,臺北市信義區吳興街320巷10之1號4樓,化菻~零售業
15631624,璇葳工作坊,臺北市文山區羅斯福路6段274號2樓,化菻~零售業
48998904,美麗手足美甲材料坊,臺北市士林區天母東路1之2號3樓,化菻~零售業
26349096,米妞企業社,臺北市中山區雙城街12巷2之9號,化菻~零售業
31880281,藝術之約髮藝工作室,臺北市大安區羅斯福路2段35巷47號,化菻~零售業
01098852,正豐旗幟禮品行,臺北市萬華區開封街2段74號1樓,化菻~零售業
38508392,神威複印輸出社,臺北市大安區師大路68巷2之1號1樓,化菻~零售業
31844309,斐絲特色染護專門店南西分店,臺北市中山區南京西路13號(3樓),化菻~零售業
29231022,芭塔莎生活館,臺北市松山區新中街6巷15號1樓,化菻~零售業
77901773,延吉眼鏡行,臺北市大安區延吉街110之1號1樓,化菻~零售業
48882164,豐茲蕎企業社,臺北市北投區致遠二路102號,化菻~零售業
38513753,宜濃名店,臺北市松山區民生東路5段43號1樓,化菻~零售業
38645163,慶如服裝飾品行,臺北市內湖區舊宗路1段128號,化菻~零售業
81753438,虹景眼鏡行,臺北市中正區汀州路3段162號1樓,化菻~零售業
41100355,世霖實業社,臺北市大同區民權西路122號6樓之1,化菻~零售業
31879186,虹印國際美容實業社,臺北市大同區延平北路2段143號13樓,化菻~零售業
