25573736,凱倫髮型沙龍名店,臺北市信義區松勤街43號,化菻~零售業
26223955,交朋友汽車百貨行,臺北市信義區吳興街284巷22弄28號1樓,化菻~零售業
31856992,加姿時尚館,臺北市中山區民生東路2段42之1號,化菻~零售業
13470026,聖薇企業社,臺北市大安區信義路4段214號2樓之1,化菻~零售業
48740454,另類火鍋小吃店,臺北市大安區市民大道4段10號,化菻~零售業
14345666,風範美學企業社,臺北市中正區重慶南路1段61號10樓1016室,化菻~零售業
38496305,緯宸國際商行,臺北市信義區吳興街284巷22弄20號3樓,化菻~零售業
38571731,卓越頻譜商行,臺北市士林區福國路56巷17號,化菻~零售業
31949401,九泰傳統整復推拿館,臺北市大安區基隆路2段226號,化菻~零售業
78505505,大誠婦嬰用品行,臺北市中山區錦西街1之2號1樓,化菻~零售業
48980046,快美屋快速剪髮店,臺北市中正區汀州路3段116號,化菻~零售業
38568291,萊恩企業社,臺北市中山區南京東路1段34號7樓,化菻~零售業
31867479,?藝工作坊,臺北市信義區莊敬路424號,化菻~零售業
25558947,染房美容院,臺北市大同區赤峰街3巷19號1樓,化菻~零售業
38565317,世樺企業社,臺北市大同區重慶北路3段65號2樓,化菻~零售業
25661647,孋緹亞專業美容坊,臺北市松山區興安街165號1樓,化菻~零售業
13843829,雲美美容坊,臺北市信義區永吉路30巷75號,化菻~零售業
26208053,易館諮詢工作室,臺北市松山區敦化北路222巷6號7樓,化菻~零售業
38557317,威盛企業社,臺北市大安區信義路2段72號地下,化菻~零售業
48674433,安娜日用品商行,臺北市中山區民權西路20號9樓之5,化菻~零售業
48959705,興隆百貨行,臺北市士林區天母西路63號,化菻~零售業
14316281,良中商行,臺北市中山區龍江路356巷58號1樓,化菻~零售業
31845623,威麒髮藝店,臺北市信義區松山路598號,化菻~零售業
18090411,冠宇眼鏡行,臺北市中正區中華路2段337號1樓,化菻~零售業
25664948,奇蹟實驗工作室,臺北市士林區溪山里31號,化菻~零售業
48745768,捷誠企業社,臺北市信義區福德街300巷35號,化菻~零售業
25574279,金比白工作室,臺北市大安區富陽街97號3樓之1,化菻~零售業
25571955,昂古萊姆商行,臺北市松山區長安東路2段215號5樓之4,化菻~零售業
18408661,讚全服飾店,臺北市松山區民生東路5段125號1樓,化菻~零售業
81652446,怡姿坊,臺北市大安區瑞安街208巷24弄14號1樓,化菻~零售業
17553384,丞樺珠寶店,臺北市大同區重慶北路1段22之22號,化菻~零售業
38571330,鑫樂園養生館,臺北市萬華區康定路296號,化菻~零售業
48976253,瑪璣工作室,臺北市大安區大安路1段7號1樓,化菻~零售業
38508463,豐匯企業社,臺北市內湖區金龍路13巷8弄3號4樓,化菻~零售業
38508180,品茵創意商行,臺北市士林區忠誠路2段98巷5弄8號1樓,化菻~零售業
13466368,宜倫商行,臺北市內湖區新明路304之1號,化菻~零售業
26229276,奇恩生物科技工作室,臺北市松山區健康路288號2樓,化菻~零售業
38572008,金典頻譜企業社,臺北市中山區民生西路30號6樓之3,化菻~零售業
38505064,文祥精品店,臺北市萬華區西寧南路72之1號2樓,化菻~零售業
38509322,崧閔企業社四平分社,臺北市中山區南京東路2段115巷28號1樓,化菻~零售業
38562640,美媞商行,臺北市中山區長安東路1段16號10樓,化菻~零售業
15640004,義功堂商行,臺北市大同區民生西路316號1樓,化菻~零售業
48762409,瑪智國際沙龍館,臺北市內湖區金湖路31號,化菻~零售業
31881492,元宿企業社,臺北市萬華區西寧南路72之1號5樓,化菻~零售業
26342208,金勇泰式養生館,臺北市內湖區金龍路81號1樓,化菻~零售業
99627906,非凡企業社,臺北市士林區通河街80號1樓,化菻~零售業
26389765,財發發服飾精品店敦化店,臺北市大安區敦化南路1段169巷8號,化菻~零售業
01493636,尚賀廣告設計工程社,臺北市大安區市民大道4段68巷2號,化菻~零售業
31871852,慈暉企業社,臺北市中正區水源路49號7樓之2,化菻~零售業
98901617,泡泡太郎服飾精品店,臺北市大安區忠孝東路4段162號4樓之5,化菻~零售業
38505368,錦采精品店,臺北市中正區金山南路1段102號,化菻~零售業
25587422,舒樂斯美的生活館,臺北市北投區尊賢街302巷11號,化菻~零售業
26361696,星棻企業社,臺北市萬華區武昌街2段116號3樓,化菻~零售業
26237509,泰金喜養生館,臺北市北投區知行路277號(1樓),化菻~零售業
38508098,春稻藝術坊,臺北市大安區麗水街13巷7號1樓,化菻~零售業
25541165,百芸采生活館,臺北市萬華區長沙街2段58號1樓,化菻~零售業
15659158,紫緹美容坊,臺北市松山區民生東路5段153之1號1樓,化菻~零售業
20810078,大宗生西藥房,臺北市信義區吳興街156巷19號1樓,化菻~零售業
38581766,睫米兔工坊,臺北市大安區敦化南路1段225號地下2樓之10,化菻~零售業
31949373,阿水師傳統整復推拿館,臺北市中山區北安路458巷41弄31號1樓,化菻~零售業
31921261,小優的店,臺北市文山區木柵路1段59巷11弄5號3樓,化菻~零售業
25668830,舒泰養生館,臺北市信義區光復南路551號,化菻~零售業
48960294,薰一草工作室,臺北市北投區裕民六路114巷22號,化菻~零售業
15651732,美羅服飾精品名店,臺北市士林區忠誠路2段102號1樓,化菻~零售業
38568861,恩堡企業社,臺北市信義區忠孝東路5段457號3樓,化菻~零售業
48835677,棻翔國際商行,臺北市萬華區西寧南路67號3樓之1,化菻~零售業
31867082,媺之諾美容材料行,臺北市中山區伊通街66之4號2樓,化菻~零售業
99336463,金珈鎂女子生活?,臺北市信義區吳興街449巷2弄8號,化菻~零售業
99628530,水水花商行,臺北市中山區南京東路1段21之1號1樓,化菻~零售業
25654126,活力美工作坊,臺北市中山區南京東路3段216巷3之1號2樓,化菻~零售業
31880254,綠芽生活花園工作室,臺北市信義區松山路707號5樓,化菻~零售業
38566033,愛盛特聚合媒體創作室,臺北市松山區光復南路32巷33號,化菻~零售業
31829882,大眼娃娃企業社,臺北市萬華區武昌街2段50巷9號,化菻~零售業
31978448,天宇企業社,臺北市大安區大安路1段77號東區地下街28之1號店舖,化菻~零售業
31953684,歐?美坊,臺北市大安區忠孝東路4段220號7樓,化菻~零售業
38510221,有晟商行,臺北市大安區忠孝東路4段248巷6號,化菻~零售業
10340372,統姿美的工作坊,臺北市大安區信義路4段1之76號,化菻~零售業
38510910,泰皇企業社,臺北市北投區懷德街23號,化菻~零售業
38580838,美宥樂美髮沙龍,臺北市大安區龍泉街93巷11號,化菻~零售業
48894268,伊捷服飾精品店,臺北市萬華區中華路1段144之6號,化菻~零售業
38505276,瑪裘芮緹美甲美睫專門店,臺北市大安區忠孝東路4段205巷7弄8號3樓之1,化菻~零售業
25681685,泰金麒美容坊,臺北市大同區民族西路155號,化菻~零售業
26222436,越泰健康養生館,臺北市南港區園區街25號1樓,化菻~零售業
17769027,大成婦嬰生活館,臺北市大同區鄭州路29巷2之5號1樓,化菻~零售業
26242926,碧緹精品店,臺北市士林區天母東路22巷21號1樓之2,化菻~零售業
26363168,花樣企業社,臺北市中山區中山北路1段140巷5號,化菻~零售業
31710483,宏暐企業社,臺北市中山區復興北路48號3樓,化菻~零售業
31859766,豪麗服飾精品店,臺北市大安區大安路1段51巷4號,化菻~零售業
25669423,拍按叫絕企業社,臺北市信義區永吉路30巷177弄20號,化菻~零售業
26227586,妍華國際開發企業社,臺北市松山區光復南路1號9樓之2,化菻~零售業
25561128,鐵皮兔服飾店,臺北市大安區泰順街40巷21號,化菻~零售業
48803794,大亞服飾店,臺北市信義區永吉路443巷13弄7號,化菻~零售業
26348456,名漾企業社,臺北市士林區福華路164巷13號,化菻~零售業
10332020,蕊綺服飾精品店,臺北市萬華區西寧南路72之1號2樓,化菻~零售業
26223441,皂芬坊,臺北市松山區塔悠路210巷3號1樓,化菻~零售業
48762029,有美全美容坊,臺北市北投區大業路529之1號,化菻~零售業
38574548,朵菈生活百貨,臺北市中正區汀洲路1段92巷37號,化菻~零售業
25516829,盛棠商行,臺北市中山區龍江路100巷1之2號,化菻~零售業
25562479,豪薺商行,臺北市士林區延平北路6段413巷14號,化菻~零售業
25580096,夢天樂商行,臺北市大安區延吉街135號3樓,化菻~零售業
38560235,山享植物工作坊,臺北市中山區民權東路1段70巷17號4樓,化菻~零售業
26253845,舒拉蜜名店,臺北市大同區延平北路2段42號,化菻~零售業
10376005,儷芙實業社,臺北市萬華區民和街65號,化菻~零售業
31844835,泰怡慧養生館,臺北市內湖區成功路2段426巷3號,化菻~零售業
26345818,美之選美髮沙龍,臺北市中正區濟南路2段65號1樓,化菻~零售業
38558006,雅倫工作室,臺北市北投區中和街310號,化菻~零售業
01230873,中明百貨行,臺北市中山區中山北路1段105巷6號1樓,化菻~零售業
48728661,克莉絲汀美容坊,臺北市萬華區西藏路180號2樓,化菻~零售業
26337845,洪銨企業社,臺北市北投區實踐街28號4樓,化菻~零售業
98900032,大點精品店,臺北市松山區八德路4段577之1號1樓,化菻~零售業
31958891,智鴻工作室,臺北市大安區忠孝東路4段248巷19號1樓,化菻~零售業
31957181,吉恩企業社,臺北市中正區羅斯福路2段126號10樓之1,化菻~零售業
26228728,成長國際美學館,臺北市松山區南京東路5段70號2樓,化菻~零售業
31878503,桐漾工坊,臺北市萬華區環河南路2段71巷14號4樓,化菻~零售業
48967249,太來生活館,臺北市大安區金華街251號,化菻~零售業
10351617,格拉斯氛香小舖,臺北市松山區敦化北路120巷52號,化菻~零售業
26229260,波詩工作室,臺北市中山區明水路397巷12號,化菻~零售業
21764755,香賓美容材料行,臺北市大安區忠孝東路3段242號,化菻~零售業
25541290,尤慧婷美容工作室,臺北市內湖區內湖路1段285巷31號,化菻~零售業
38570992,吉吉異國商行,臺北市中正區羅斯福路3段316巷16號2樓,化菻~零售業
31856753,如意企業社,臺北市中正區許昌街42之1號10樓,化菻~零售業
42270820,霈滎精品商行,臺北市萬華區西寧南路72之1號4樓,化菻~零售業
25507791,飛虹行,臺北市大安區信義路4段315號5樓,化菻~零售業
25581530,綠野鮮中生活館,臺北市內湖區內湖路2段179巷48弄42號3樓,化菻~零售業
25561339,克萊兒國際商行,臺北市文山區福興路63巷4弄16號,化菻~零售業
26218622,上禾百貨行,臺北市萬華區中華路1段122號,化菻~零售業
77859114,瀛瀛美容工作室,臺北市大安區光復南路574號2樓,化菻~零售業
31879307,海勝養生館,臺北市南港區南港路2段140號,化菻~零售業
31879685,金璽養生館,臺北市松山區南京東路5段341號1樓,化菻~零售業
26235951,東伊百貨行,臺北市信義區松山路292巷11號,化菻~零售業
38512184,調色盤造型工作室,臺北市信義區崇德街42號,化菻~零售業
38470092,漢美商行,臺北市大同區鄭州路25號,化菻~零售業
14326507,媚力真美顏名店,臺北市中正區南昌路2段70號4樓之2,化菻~零售業
26766438,琬貽企業社,臺北市信義區林口街38巷19號,化菻~零售業
73891459,采揚企業社,臺北市萬華區雙園街43號,化菻~零售業
48842620,吉蒂複合式商店,臺北市中山區中山北路2段20巷25號,化菻~零售業
17530714,方登服飾名店,臺北市中正區羅斯福路4段44號1樓,化菻~零售業
26363532,品榕工作室,臺北市大安區忠孝東路4段170巷17弄3號,化菻~零售業
48864449,麗君美容坊,臺北市松山區南京東路5段145號3樓、4樓,化菻~零售業
31565805,飛祥信商行,臺北市松山區八德路4段660號3樓之5,化菻~零售業
10336779,威宣美髮造型社,臺北市萬華區成都路34號,化菻~零售業
38508800,志在生活手工皂,臺北市內湖區內湖里內湖路2段355巷7弄7號1樓,化菻~零售業
31881134,山櫻戀男女養生屋,臺北市中山區林森北路661號,化菻~零售業
26239099,芮塔行,臺北市中山區林森北路556號,化菻~零售業
17740417,安琪雅精品店,臺北市大安區復興南路2段151巷18號1樓,化菻~零售業
13455593,康氏科技行,臺北市文山區興隆路4段165巷39號1樓,化菻~零售業
31865578,尤佳利企業社,臺北市北投區吉利街106巷1號4樓,化菻~零售業
10347488,京琦美容材料行,臺北市信義區忠孝東路5段412之2及之3號,化菻~零售業
31965464,創一間工作室,臺北市中山區新生北路1段46號8樓,化菻~零售業
13455989,喬崴企業社,臺北市大同區歸綏街209號3樓之2,化菻~零售業
31854827,憶淳沙龍店,臺北市中山區林森北路286號,化菻~零售業
29478636,滈林企業社,臺北市松山區南京東路4段95號4樓,化菻~零售業
48679492,葳臻精品行,臺北市士林區通河街1巷6號1樓,化菻~零售業
10347282,進化吧工作室,臺北市大安區敦化南路1段233巷43號,化菻~零售業
38571346,慈航商行,臺北市士林區文林路441號,化菻~零售業
38502307,富愷興業社,臺北市中山區松江路328號8樓之1,化菻~零售業
94913417,妙鄰居沙龍坊,臺北市文山區興隆路4段157之1號,化菻~零售業
31869716,夢想美甲工坊,臺北市大安區忠孝東路4段181巷35弄10號2樓,化菻~零售業
31878573,利芳商行,臺北市大安區敦化南路1段233巷66號,化菻~零售業
26234708,康寧生技企業社,臺北市北投區東華街1段392號1樓,化菻~零售業
31880971,艾克斯波斯精品店,臺北市萬華區漢中街35之21號,化菻~零售業
48686711,薇多莉雅精品店,臺北市松山區南京東路5段277號1樓,化菻~零售業
31863950,足氧養生企業社,臺北市中山區農安街15號,化菻~零售業
13451962,桑柏造型工作室,臺北市大安區光復南路240巷28號1樓,化菻~零售業
01477925,僾儷萊童裝百貨店,臺北市中正區南昌路1段163號1樓,化菻~零售業
48980411,好絲佳髮型美容院,臺北市大安區復興南路2段148巷33號,化菻~零售業
48706110,李奇髮廊,臺北市萬華區西寧南路153號(2樓)(3樓),化菻~零售業
38471727,菲汛精品服飾店,臺北市松山區八德路3段155巷20弄2號(1樓),化菻~零售業
48727712,晴天創意坊,臺北市大安區忠孝東路4段223巷30號,化菻~零售業
99609718,左耳文化出版社,臺北市大安區大安路1段116巷5號地下,化菻~零售業
13830182,喬之妃美容用品坊,臺北市文山區景興路282巷9號,化菻~零售業
38469428,皂福人身工坊,臺北市文山區福興路78巷1弄12號(1樓),化菻~零售業
48743831,媒甲樂園複合精品商行,臺北市大安區忠孝東路4段216巷16號2樓之8,化菻~零售業
38506161,喬思琳欣企業社,臺北市中正區羅斯福路1段66號2樓,化菻~零售業
26342734,靜晴舒活館,臺北市北投區中和街278號(2樓),化菻~零售業
31850890,艾德華髮絲造型工作室,臺北市大同區承德路1段8號4樓之2,化菻~零售業
26247979,禾泰貿易企業社,臺北市大安區忠孝東路4段205巷26弄3號,化菻~零售業
18093727,雅品商行,臺北市文山區景美街97號1樓,化菻~零售業
48978323,舒活苑健康商行,臺北市松山區敦化北路155巷114號,化菻~零售業
25516742,紋華企業社,臺北市北投區溫泉路82之3號1樓,化菻~零售業
48747148,翔安商行,臺北市萬華區環河南路3段101號5樓之2,化菻~零售業
38573935,晴川小舖,臺北市士林區中山北路7段14巷26號1樓,化菻~零售業
38472140,金旺來商行,臺北市中山區農安街45之1號,化菻~零售業
48800282,安東一路發商行,臺北市大安區安東街45之7號1樓,化菻~零售業
30298197,建達國際企業社,臺北市北投區石牌路1段8號1樓,化菻~零售業
99359319,小熊屋,臺北市信義區永吉路349號1樓,化菻~零售業
25581980,泰揚花生活美容館,臺北市中山區長安東路1段93號,化菻~零售業
99410370,恬蜜名店,臺北市大安區復興南路2段151巷3號1樓,化菻~零售業
25558313,蓮妝美麗坊,臺北市文山區新光路1段152號,化菻~零售業
38557077,富盛精品店,臺北市大安區忠孝東路4段112號10樓之11,化菻~零售業
25536705,阿密斯特精品名店,臺北市萬華區西寧南路72之1號2樓,化菻~零售業
14333612,拾元小店,臺北市大安區臨江街102號1樓,化菻~零售業
26729005,仲旺企業社,臺北市內湖區陽光街285巷3號,化菻~零售業
99956343,勝寶百貨行,臺北市大同區民族西路161號1樓,化菻~零售業
10382999,富康活力藥菮,臺北市南港區研究院路1段101巷8號,化菻~零售業
26243045,凱欣養生館,臺北市萬華區萬大路314號,化菻~零售業
05153601,信忠實業社,臺北市中正區惠安街17號1樓,化菻~零售業
38501150,李傑企業社,臺北市中正區漢口街1段110號8樓之12,化菻~零售業
26357460,瑞辰工作室,臺北市松山區民生東路4段97巷1弄25號6樓,化菻~零售業
80998266,三禾五金百貨店,臺北市松山區饒河街247號1樓,化菻~零售業
94918686,分享美容材料行,臺北市文山區景文街90巷3號,化菻~零售業
99613419,采瑄美材精品店,臺北市士林區大東路86之5號1樓,化菻~零售業
38578517,廣威企業社,臺北市中山區北安路588巷30弄14號7樓,化菻~零售業
09742763,高美館企業行,臺北市大安區敦化南路1段161巷34號(1樓),化菻~零售業
38582033,忠孝胡商行,臺北市大安區忠孝東路3段172號,化菻~零售業
10368693,宜威行,臺北市大安區復興南路1段321號1樓,化菻~零售業
48786802,平安商行,臺北市內湖區康寧路3段165巷30號,化菻~零售業
25586872,貝鈺企業社,臺北市松山區南京東路5段200號6樓之4,化菻~零售業
25541469,萱蓉美容坊,臺北市南港區南港路1段137巷7號,化菻~零售業
17742864,女人一生美妍名店,臺北市松山區八德路3段12巷5弄8號1樓,化菻~零售業
26215553,菩提園,臺北市大安區安和路1段141巷6號,化菻~零售業
29225675,晶鴻百貨行,臺北市中山區雙城街12巷2之1號1樓,化菻~零售業
31948466,東格國際商行,臺北市松山區光復南路6巷23號1樓,化菻~零售業
38470760,卡桑曲創意工作室,臺北市大同區華陰街33號3樓之2,化菻~零售業
26217813,清新美容館,臺北市中山區長春路221號,化菻~零售業
48697533,珍妮貝兒美容材料行,臺北市大安區忠孝東路4段155號12樓之7,化菻~零售業
21725894,明昌資訊行,臺北市南港區中坡北路50巷10號1樓,化菻~零售業
38563079,太月實業社,臺北市信義區忠孝東路5段790巷20弄2號1樓,化菻~零售業
48672863,協昕企業社,臺北市中山區五常街53巷37號,化菻~零售業
01713836,寶祥眼鏡行,臺北市南港區木新路2段223號1樓,化菻~零售業
80992468,海天國際企業社,臺北市南港區研究院路2段70巷47弄10號3樓,化菻~零售業
25667240,大力多商行,臺北市大安區大安路1段51巷32號,化菻~零售業
31876343,蜂采商行,臺北市大安區忠孝東路3段209號,化菻~零售業
48680420,雲堤精品館,臺北市文山區景後街158號1樓,化菻~零售業
99628285,激點精品店,臺北市中正區羅斯福路3段14號1樓,化菻~零售業
25539061,孚佑企業社,臺北市北投區懷德街78巷25號地下1層,化菻~零售業
26341849,聯邦精品行,臺北市信義區永吉路459巷9弄8號,化菻~零售業
48717708,閣樓設計工作室,臺北市文山區興隆路4段29巷3弄9之1號2樓,化菻~零售業
38554260,綠舍健康生活館,臺北市文山區木柵路3段14號,化菻~零售業
38564767,泰吉時尚館,臺北市松山區八德路4段350號,化菻~零售業
48733670,潘客麗傢飾生活館,臺北市北投區中和街267號,化菻~零售業
38531078,仁祥眼鏡行,臺北市中山區民權東路2段45號1樓,化菻~零售業
48701749,窈窕一生美容材料行,臺北市松山區民生東路5段69巷4弄39號1樓,化菻~零售業
31873599,黛曼婗精品商行,臺北市內湖區內湖路2段462號之1,化菻~零售業
48733123,名欣百貨行,臺北市信義區福德街221巷10之1號,化菻~零售業
48995266,雅芙美容坊,臺北市大安區仁愛路4段112巷5號地下室,化菻~零售業
99618646,游淨玲工作室,臺北市大同區延平北路2段61巷19號4樓之2,化菻~零售業
31954109,安美鹿商店,臺北市文山區興隆路4段41號1樓,化菻~零售業
48964860,威揚髮藝名店,臺北市萬華區東園街28巷44號1樓,化菻~零售業
38468716,米亞美甲沙龍店,臺北市中山區龍江路149巷11號1樓,化菻~零售業
31881916,晴安生活商行,臺北市大安區仁愛路4段91巷13號1樓,化菻~零售業
42268747,亮睛睛時尚美睫坊,臺北市中正區信陽街9號3樓,化菻~零售業
48823412,用力商行,臺北市萬華區西寧南路72號之1、3樓,化菻~零售業
31954277,旺旺髮藝名店,臺北市大安區忠孝東路4段46號2樓,化菻~零售業
30280302,台陸宅網購生活事業用品社,臺北市中山區中山北路3段25號2樓之19,化菻~零售業
38566202,徵銓企業社,臺北市士林區中山北路7段186號2樓,化菻~零售業
25583782,伊的美人美容坊,臺北市中山區北安路458巷41弄36號,化菻~零售業
48872671,展悅軒,臺北市大安區和平東路1段214號10樓之1,化菻~零售業
98882772,芭比美容工作室,臺北市松山區南京東路3段303巷14弄6之1號1樓,化菻~零售業
26356835,萬寶養生館,臺北市內湖區成功路4段330號,化菻~零售業
26226355,漢欣生活小舖,臺北市北投區光明路84號,化菻~零售業
34937132,巧格趣商行,臺北市大安區龍泉街17號,化菻~零售業
24063503,禮源西藥房,臺北市內湖區新明路445號1樓,化菻~零售業
48557673,龍記事業工作室,臺北市松山區民生東路4段131巷1號3樓,化菻~零售業
38503684,高橋商行,臺北市中山區建國北路2段129號2樓,化菻~零售業
21730860,廣盛益服裝行,臺北市信義區松山路119巷18號,化菻~零售業
25670076,吉帝斯整合行銷工作室,臺北市大安區忠孝東路4段319號8樓,化菻~零售業
26373074,夯特精品店,臺北市萬華區西寧南路72之1號4樓,化菻~零售業
98887734,青青美妍坊,臺北市中山區民權西路20號12樓之5,化菻~零售業
26519346,艾伶企業社,臺北市信義區忠孝東路5段1之8號5樓,化菻~零售業
25516736,女人園企業社,臺北市中山區民族東路120號1樓,化菻~零售業
26239247,淘樂偲衣舖子商行,臺北市內湖區內湖路1段591巷10弄2號,化菻~零售業
26349547,澄心澄意商行,臺北市信義區永吉路192號,化菻~零售業
09474942,艾翠娣服裝店,臺北市大安區東豐街21號1樓,化菻~零售業
25670420,凱澄設計工作坊,臺北市松山區復興南路1段1號14樓之4,化菻~零售業
38562563,京站視界眼鏡量販館,臺北市信義區松山路232號,化菻~零售業
83938833,名座商行,臺北市士林區大東路29號,化菻~零售業
81782102,寶琳眼鏡行,臺北市士林區德行東路181號1樓,化菻~零售業
38511805,維寶企業社,臺北市士林區天母西路13巷12號3樓,化菻~零售業
25583208,悅活商行,臺北市中山區中山北路2段20巷10號,化菻~零售業
81779079,展發服飾精品店,臺北市萬華區漢中街104號1樓,化菻~零售業
31867457,子菁造型工作室,臺北市北投區北投路1段47號4樓,化菻~零售業
25670435,斐綠時尚精品館,臺北市松山區敦化南路1段100巷13號,化菻~零售業
25583501,羅傑生技坊,臺北市中山區民生東路2段115巷28弄13號,化菻~零售業
26225757,泰和殿養生館,臺北市中山區民生東路2段88號(1、2、3樓),化菻~零售業
98899801,芙之美小舖,臺北市中正區武昌街1段16巷17號,化菻~零售業
26360535,愛莎髮型工作室,臺北市北投區立農街1段279巷5號1樓,化菻~零售業
31874470,名祥百貨行,臺北市大同區重慶北路1段1號地下,化菻~零售業
38571057,稚期婚紗工作室,臺北市中山區雙城街28巷12號,化菻~零售業
31861600,品味生活館,臺北市萬華區西昌街147號1樓,化菻~零售業
21761151,綺美髮容工作坊,臺北市大安區金山南路2段13巷12號1樓,化菻~零售業
31847919,金莎莉養生館,臺北市萬華區桂林路164號,化菻~零售業
38500011,雅威園實業社,臺北市士林區延平北路5段83巷23號1樓,化菻~零售業
29204600,紫苑美容工作室,臺北市中正區羅斯福路4段126號3樓,化菻~零售業
48812105,小馬尾巴商行,臺北市信義區忠孝東路5段439號,化菻~零售業
80988035,玉笠企業商行,臺北市中山區民權西路20號9樓之10,化菻~零售業
10367977,小詹樂器行,臺北市北投區中和街226號,化菻~零售業
26237000,上城泰式養生館,臺北市大同區重慶北路3段239號,化菻~零售業
31954804,復興舒活足體養生館,臺北市大安區復興南路1段279巷20號1樓,化菻~零售業
25540150,寶格麗池企業社,臺北市中山區敬業三路157號、159號,化菻~零售業
31949726,郁盎精品店,臺北市大安區忠孝東路4段205巷29弄2號1樓,化菻~零售業
21711287,巴黎美容坊,臺北市信義區松德路100號1樓,化菻~零售業
26351374,珮芝美容工作室,臺北市松山區民權東路3段160巷22號2樓之1,化菻~零售業
25512598,程鈞商行,臺北市南港區忠孝東路5段978號,化菻~零售業
48755239,巴寶冰工作室,臺北市中山區林森北路50號11樓之7,化菻~零售業
