48704921,亞星工作室,臺北市萬華區開封街2段32號1樓,化菻~零售業
31859267,力升企業社,臺北市文山區景興路262號13樓之2,化菻~零售業
48697512,立家商行,臺北市中山區復興北路176號3樓,化菻~零售業
26340721,良金企業社,臺北市中正區汀州路1段102號,化菻~零售業
31891837,三禾衣料坊,臺北市南港區八德路4段768巷3號2樓,化菻~零售業
31854777,郁恩美容用品坊,臺北市文山區興隆路4段132號1樓,化菻~零售業
26231836,君宇服飾行,臺北市大安區敦化南路1段233巷47號,化菻~零售業
18376936,非常美容館,臺北市中正區南昌路1段66之1號2樓,化菻~零售業
26341735,希貝兒生活美學館,臺北市內湖區成功路3段166號2樓,化菻~零售業
21704194,源進洋行,臺北市大同區太原路47號〈1樓〉,化菻~零售業
26367024,康悅園養生館,臺北市萬華區康定路326號,化菻~零售業
48948721,朵娜造型沙龍店,臺北市松山區慶城街8之1號2樓,化菻~零售業
26245402,?夏生活館,臺北市信義區忠孝東路5段43號4樓,化菻~零售業
29451854,繹翔實業行,臺北市北投區自強街125號2樓之13,化菻~零售業
26209948,尚尹企業社,臺北市文山區萬寧街129號10樓之2,化菻~零售業
26209530,品口醫療器材行,臺北市大安區潮州街132之1號,化菻~零售業
70979938,優墾產銷商行,臺北市大安區忠孝東路3段136號10樓之3,化菻~零售業
25563961,新悅服飾行,臺北市大安區仁愛路4段439號,化菻~零售業
48897125,愛絲造型沙龍美髮院,臺北市北投區明德路157之2號,化菻~零售業
38462543,松子企業社,臺北市北投區崇仁路1段131巷2弄6號4樓,化菻~零售業
31857612,小牧人手作工作室,臺北市內湖區康寧路3段99巷2號,化菻~零售業
31868316,奇蹟手工坊,臺北市內湖區成功路4段30巷21號8樓,化菻~零售業
99606368,酷酷髮蛦y型沙龍店,臺北市大安區忠孝東路4段278號2樓,化菻~零售業
01478190,新生精品百貨行,臺北市中正區南昌路2段26號1樓,化菻~零售業
38559981,幸福感婚紗攝影工作室,臺北市中正區牯嶺街50號,化菻~零售業
48679541,美媚髮屋,臺北市大安區臨江街140號1樓,化菻~零售業
99355340,酒世界商行,臺北市中正區中華路2段313巷16號,化菻~零售業
10336898,天母玩具店,臺北市北投區天母西路132之6號,化菻~零售業
29236912,綺莉美容材料工作室,臺北市大安區通化街39巷6號1樓,化菻~零售業
14312150,祖母綠美容材料名店,臺北市大安區大安路1段175巷7號1樓,化菻~零售業
99638241,紫米音樂工作室,臺北市大安區建國南路1段282號3樓,化菻~零售業
25565216,采懿美容小舖,臺北市大安區忠孝東路4段2號3樓之4,化菻~零售業
48897188,昆華服飾精品行,臺北市內湖區民權東路6段86號,化菻~零售業
81700828,吉米工作室,臺北市中山區長春路172號6樓之9,化菻~零售業
99356191,梅偉玲美容沙龍工作室,臺北市大安區信義路4段30巷8弄13號,化菻~零售業
38571090,漾髮型工作室,臺北市萬華區成都路62號2樓,化菻~零售業
09722719,品妍美材精品店,臺北市北投區清江路14號,化菻~零售業
80992925,逸芸工作室,臺北市中山區伊通街97號,化菻~零售業
48896414,九象限顧問展業社,臺北市大安區忠孝東路4段162號10樓之2,化菻~零售業
17737861,李新創意美容材料行,臺北市士林區磺溪街27號,化菻~零售業
38575820,南風原設計實業社,臺北市大同區長安西路150號14樓之1,化菻~零售業
38501601,瑞朵商行,臺北市信義區虎林街132巷66號1樓,化菻~零售業
38500820,億寶國際精品行,臺北市大同區長安西路78巷3弄1號4樓,化菻~零售業
49986510,宏記洋行,臺北市大同區重慶北路1段67號8樓之2,化菻~零售業
38509033,凱鴻企業社,臺北市中山區北安路458巷41弄29號1樓,化菻~零售業
26253562,鑫漾美妝企業社,臺北市內湖區東湖路106巷8號3樓,化菻~零售業
38553847,夏戀美容工作室,臺北市中山區新生北路3段10號7樓,化菻~零售業
98919124,亞園企業社,臺北市大安區忠孝東路4段177號6樓,化菻~零售業
14312546,喬裝造型工作室,臺北市北投區承德路7段292號3樓,化菻~零售業
73919816,梅鈞美容坊,臺北市內湖區成功路4段68號8樓之2,化菻~零售業
02338802,佳瀚國際商行,臺北市中正區新生南路1段6號7樓之3,化菻~零售業
38669495,千金時尚美睫館,臺北市中山區民生東路1段8號2樓,化菻~零售業
25577542,福網國際商行,臺北市中正區仁愛路1段6號4樓之1,化菻~零售業
31959408,晶捷美容坊,臺北市南港區興華路30巷12號,化菻~零售業
31866730,貫旭企業社,臺北市中正區?門街81巷15號4樓,化菻~零售業
99424873,采蝶企業行,臺北市中山區建國北路2段129號2樓,化菻~零售業
31878476,台灣嘉速美企業社,臺北市大安區忠孝東路4段130號3樓,化菻~零售業
31954662,承臻商行,臺北市內湖區內湖路2段322號,化菻~零售業
48683019,川婷精品店,臺北市萬華區西寧南路70號3樓之13,化菻~零售業
17756971,風雅築養生舒活館,臺北市中正區青島東路4之7號1樓,化菻~零售業
48773551,佳莉爾美容坊,臺北市中山區民生西路3巷2之2號2樓,化菻~零售業
17084165,佳譽商行,臺北市大同區鄭州路23號1樓,化菻~零售業
31865401,吉米周企業社,臺北市松山區南京東路5段230號4樓之1,化菻~零售業
18088999,牧莎手藝精品專賣店,臺北市大同區南京西路30號3樓,化菻~零售業
10382772,上美包裝企業社,臺北市大同區民族西路169巷18之1號2樓,化菻~零售業
25550847,悅芯工作室,臺北市大安區敦化南路1段236巷38號,化菻~零售業
38564963,緹娜娘手作本舖,臺北市大同區承德路1段105號12樓之5,化菻~零售業
31875409,天玉工房,臺北市士林區天母北路68之6號10樓,化菻~零售業
27165454,金美滿美容坊,臺北市中山區龍江路403號,化菻~零售業
48995168,樂嫫精品服飾店,臺北市松山區復興南路1段31之1號,化菻~零售業
94902474,格格養生美顏館,臺北市中山區南昌路1段95號4樓,化菻~零售業
26349574,麗翔商行,臺北市大安區和平東路1段14號2樓之1,化菻~零售業
31962826,文山胡商行,臺北市文山區興隆路2段331號（1樓）,化菻~零售業
25554421,精彩商行,臺北市中山區中山北路2段72巷28號2樓,化菻~零售業
38554661,藝門工作室,臺北市信義區忠孝東路5段177號3樓,化菻~零售業
25570718,盈美美容坊,臺北市中山區南京西路8號5樓,化菻~零售業
26234171,麗歐髮型工作室,臺北市中山區合江街17巷3之2號,化菻~零售業
31953241,天使美睫工作室,臺北市中正區信陽街11號3樓,化菻~零售業
83917746,師大衣著店,臺北市大安區師大路49巷12號1樓,化菻~零售業
42269485,阿水師傳統整復推拿館大直分店,臺北市中山區北安路518巷20號,化菻~零售業
38498444,盼望手作坊,臺北市士林區延平北路6段114號,化菻~零售業
94912536,同慶企業社,臺北市大同區承德路3段64號1樓,化菻~零售業
26339864,達網麗商行,臺北市中山區松江路90巷21號7樓,化菻~零售業
99352218,鴻騰服飾精品店,臺北市萬華區西寧南路48之5號1樓,化菻~零售業
48691088,雅客商行,臺北市中山區民權東路2段206號3樓之2,化菻~零售業
48910416,傳弘商行,臺北市萬華區萬大路486巷59弄13號,化菻~零售業
38497938,金萊休閒舒壓館,臺北市萬華區南寧路31號1樓,化菻~零售業
31874422,闊喜工房,臺北市信義區基隆路2段22號6樓之6,化菻~零售業
31709943,京站支付企業社,臺北市中山區松江路207號9樓,化菻~零售業
01726305,欣欣美材精品店,臺北市北投區石牌路2段68巷1號,化菻~零售業
99230378,慨汶企業商號,臺北市信義區吳興街600巷76弄143號2樓之2,化菻~零售業
48535778,錦足服裝行,臺北市信義區松山路193號1樓,化菻~零售業
48879626,延壽精品店,臺北市松山區延壽街323號,化菻~零售業
17740057,凱蘿造型企業社,臺北市大安區師大路143號2樓,化菻~零售業
98918315,華姿企業社,臺北市松山區新東街12巷6號1樓,化菻~零售業
31956768,吉巧工坊,臺北市大同區太原路87號,化菻~零售業
26360248,美樂客企業社,臺北市信義區雙和里吳興街284巷59弄2號4樓,化菻~零售業
38568150,生命之樹美妝工作室,臺北市大安區忠孝東路4段221號10樓,化菻~零售業
38561121,新悅時尚休閒館,臺北市中山區復興北路282號2樓,化菻~零售業
25543059,紅孩兒生化科技開發工作室,臺北市信義區虎林街119巷17號,化菻~零售業
31957393,奔騰藝術企業社,臺北市萬華區漢口街2段69號1樓,化菻~零售業
99960753,純淨髮藝空間坊,臺北市大同區南京西路18巷4弄8之2號,化菻~零售業
31850202,快樂舞蹈文化社,臺北市中正區中華路1段29之1號3樓,化菻~零售業
26373335,四季悅養生館,臺北市內湖區民權東路6段326號1、2樓,化菻~零售業
38568659,依莉企業社,臺北市大同區承德路2段215號3樓之4,化菻~零售業
26250707,鈺誠企業社,臺北市內湖區星雲街150巷22號4樓,化菻~零售業
31951237,太平洋養生館,臺北市萬華區東園街60之1號,化菻~零售業
80999737,阿林商店,臺北市信義區莊敬路325巷8號,化菻~零售業
77135890,達昌藥菾嬰生活館,臺北市中正區汀州路1段205號1樓,化菻~零售業
25582741,向日葵美容館,臺北市中山區吉林路195號,化菻~零售業
38507204,光彩企業社,臺北市大安區忠孝東路4段191號6樓,化菻~零售業
13826954,洋源國際商行,臺北市大安區忠孝東路4段97號地下樓之36,化菻~零售業
48677446,華達國際企業社,臺北市松山區八德路2段374號7樓,化菻~零售業
39805785,亨源企業社,臺北市大安區東豐街66號3樓,化菻~零售業
38556231,拉諾絲美容坊,臺北市內湖區成功路4段61巷25弄2號,化菻~零售業
48694971,米豆服飾精品行,臺北市中山區新生北路2段137巷63號,化菻~零售業
81755077,菲力克彩妝店,臺北市大安區復興南路1段142號,化菻~零售業
42268789,帛姿服飾,臺北市大安區金山南路2段25之1號,化菻~零售業
38508273,臻韓服飾店,臺北市中山區天津街56之19號,化菻~零售業
31857280,金滿億養生館,臺北市中山區南京東路3段195號1樓,化菻~零售業
10344124,瑞海行銷企業社,臺北市中山區錦州街278號4樓之1,化菻~零售業
14744930,郡康企業社,臺北市內湖區環山路2段109巷6弄7號3樓,化菻~零售業
29244589,宏泰藥妝行,臺北市大同區酒泉街131號1樓,化菻~零售業
25570034,康翔髮廊,臺北市信義區松山路107號2樓,化菻~零售業
26212839,風尚飲食生活館,臺北市大安區敦化南路2段11巷5號,化菻~零售業
38500862,欣晟企業社,臺北市中正區信義路2段91號12樓之4,化菻~零售業
38462852,皂顧天然手作工坊,臺北市南港區研究路1段187號5樓,化菻~零售業
25546041,齊鴻行,臺北市大安區敦化南路2段81巷39號,化菻~零售業
10335820,泰優活美容館,臺北市中山區民權東路2段88號,化菻~零售業
26239128,玄武企業社,臺北市中山區民權東路2段106號,化菻~零售業
25542777,英琪泰美容館,臺北市萬華區內江街64號,化菻~零售業
31956009,京瑤美妍行,臺北市大安區忠孝東路4段233號3樓,化菻~零售業
31954136,卓岳精品店,臺北市大安區延吉街97巷14號,化菻~零售業
15652676,東震實業社,臺北市士林區大東路99號1樓,化菻~零售業
01802204,超豐內衣專賣店,臺北市大安區忠孝東路4段101巷25號1樓,化菻~零售業
48750966,亞筑企業社,臺北市內湖區東湖路94巷2號,化菻~零售業
25586922,泰陽花生活美容館,臺北市內湖區文德街157號,化菻~零售業
80984185,?葳美材屋,臺北市大安區安和路2段167號2樓,化菻~零售業
31852623,恰琦米森工作室,臺北市大安區敦化南路1段177巷37號,化菻~零售業
25582242,永佳安商行,臺北市中山區四平街48號1樓,化菻~零售業
99605776,京凱美妍館,臺北市大同區民生西路171巷7號,化菻~零售業
38561570,凍齡公主商店,臺北市萬華區萬大路153號,化菻~零售業
42269871,可蜜莉兒服飾店,臺北市大安區羅斯福路3段73號,化菻~零售業
99358233,唯美女人企業社,臺北市信義區忠孝東路5段53號3樓,化菻~零售業
38570917,五讚食品企業社,臺北市大同區西寧北路81號2樓之2,化菻~零售業
31952307,水姑娘頭毛店,臺北市信義區嘉興街66號1樓,化菻~零售業
94909069,感恩商行,臺北市大安區通化街39巷50弄47號,化菻~零售業
26342116,健宸企業社,臺北市松山區八德路4段709巷2之3號1樓,化菻~零售業
26358094,李凱潔造形工作室,臺北市信義區忠孝東路5段790巷34號2樓,化菻~零售業
73899234,紅林工作坊,臺北市中山區復興北路80號2樓,化菻~零售業
48802388,婕是禮服精品店,臺北市大安區忠孝東路4段101巷30號,化菻~零售業
31877188,五一按摩館,臺北市中山區農安街51號地下室,化菻~零售業
48670345,清靜美美容坊,臺北市內湖區安康路468號2樓,化菻~零售業
25566411,圓滿商行,臺北市大安區和平東路3段100號2樓,化菻~零售業
26256337,欣盈企業社,臺北市信義區基隆路2段149之49號11樓之4,化菻~零售業
13448828,奇碩工作室,臺北市中山區南京東路2段108號5樓之20,化菻~零售業
14315136,拼音工作室,臺北市中正區重慶南路2段82號6樓,化菻~零售業
31843391,禾苗商行,臺北市士林區文林路101巷1號,化菻~零售業
26232292,宏茂國際商行,臺北市信義區松山路275之3號1樓,化菻~零售業
38458870,均和蓉國際企業社,臺北市內湖區內湖路1段591巷16弄1號,化菻~零售業
13466162,黃千瑋整體造型工作室,臺北市松山區復興北路15號13樓之7,化菻~零售業
31870137,采荷藝術工作室,臺北市松山區八德路3段99巷7號,化菻~零售業
48927676,嘉莉精品店,臺北市大安區忠孝東路4段97號,化菻~零售業
38579620,宣馨美甲,臺北市中正區信義路2段91號10樓之5,化菻~零售業
80986085,鄭月玲精品店,臺北市松山區三民路155巷2號,化菻~零售業
14333394,薔薇村美容用品材料行,臺北市北投區懷德街79號1樓,化菻~零售業
31874886,吉凱服飾行,臺北市大安區敦化南路1段233巷54號,化菻~零售業
48905954,均悅企業社,臺北市信義區永吉路278巷27弄11號,化菻~零售業
38567672,康利企業社,臺北市信義區基隆路1段364巷40號2樓,化菻~零售業
26250381,鑽石服飾店,臺北市信義區永吉路491巷5弄5號,化菻~零售業
77904413,熊樣小舖,臺北市大同區延平北路2段19號,化菻~零售業
31952783,上誼商行,臺北市中山區新生北路1段41號7樓,化菻~零售業
27169439,文玉坊,臺北市萬華區中華路1段114巷7號,化菻~零售業
38469285,晉源行,臺北市大安區復興南路2段237號13樓,化菻~零售業
26337789,可染精品服飾店,臺北市大安區永康街31之2號,化菻~零售業
26351347,織飾家小舖,臺北市信義區松山路462號,化菻~零售業
26348337,霈帝美髮造型名店,臺北市信義區和平東路3段323號,化菻~零售業
25578958,婕思服飾精品館,臺北市大安區忠孝東路4段201號1樓,化菻~零售業
26365285,晉碩企業社,臺北市北投區大度路3段211號8樓,化菻~零售業
26360970,金妮美甲店,臺北市南港區研究院路1段99之12號,化菻~零售業
99947540,艾蘿造型工作室,臺北市大安區敦化南路1段169巷8號,化菻~零售業
31814369,正和醫療器材行,臺北市信義區吳興街225巷2號,化菻~零售業
10396305,大丹工房,臺北市內湖區金湖路363巷67弄21號,化菻~零售業
10372578,佳活美容館,臺北市大同區重慶北路2段26號,化菻~零售業
48857101,利芸企業社,臺北市大安區信義路4段58號,化菻~零售業
38554803,易珈企業社,臺北市大同區赤峰街71巷8號3樓,化菻~零售業
26249174,蕾孟麗美容材料店,臺北市信義區吳興街128號,化菻~零售業
25554935,藍色精品屋,臺北市大安區雲和街85號,化菻~零售業
10948927,右岱文創工作室,臺北市中山區松江路362巷2號2樓,化菻~零售業
38553282,亞細亞美髮社,臺北市中山區中山北路2段26巷9號1樓,化菻~零售業
48838219,貳創造型設計工作室,臺北市大同區歸綏街209號9樓之7,化菻~零售業
38512446,劼磊工作室,臺北市中山區南京東路3段189號4樓,化菻~零售業
26233258,髮本堂美容院,臺北市北投區石牌路2段8號3樓,化菻~零售業
26371420,史蒂文髮型設計坊,臺北市士林區德行東路220號1樓,化菻~零售業
17761448,雅德坊,臺北市松山區光復北路26巷20號,化菻~零售業
31856070,上均行,臺北市大安區大安路1段80號2樓,化菻~零售業
81620347,寶麗晶眼鏡行,臺北市信義區永吉路323、325號1樓,化菻~零售業
26340525,成達企業社,臺北市中正區中華路1段59號7樓,化菻~零售業
13465810,玉璽養生館,臺北市大同區民族西路144號,化菻~零售業
38568222,炳晟美容企業社,臺北市中山區中山北路3段30號4樓之5,化菻~零售業
14729754,虹希美容材料行,臺北市信義區吳興街600巷82號,化菻~零售業
31871776,育禾傳統整復推拿館,臺北市士林區天母北路5號1樓,化菻~零售業
18259183,佛光聯合醫療企業管理顧問社,臺北市大安區基隆路2段226號,化菻~零售業
31881319,沐莎加雅商店,臺北市北投區知行路293巷9弄17號,化菻~零售業
31867344,花草森林企業社,臺北市內湖區新明路498巷14弄11號4樓,化菻~零售業
31865161,米琪棗精坊,臺北市大同區民生西路218號,化菻~零售業
38512261,秘密衣櫥工作室,臺北市中山區龍江路342巷27號,化菻~零售業
17075665,毓倉書局,臺北市信義區忠孝東路5段423巷31號,化菻~零售業
26361627,愛甲園工作室,臺北市中山區南京東路1段62之1號2樓之1,化菻~零售業
38580886,放風箏服飾店,臺北市萬華區成都路31號,化菻~零售業
38471178,逸盛科技行銷社,臺北市中正區重慶南路1段83號6樓,化菻~零售業
26370055,苗芙美容店,臺北市中山區復興北路400號地下,化菻~零售業
99964224,溱緣行,臺北市文山區景美街57之2號,化菻~零售業
31845763,尚營髮廊,臺北市萬華區西寧南路48之3號,化菻~零售業
31862896,朵拉美指工作室,臺北市大安區忠孝東路4段112號6樓之8,化菻~零售業
48706478,大中華材料行,臺北市萬華區昆明街251號1樓,化菻~零售業
10344721,妙妙美容用品專門店,臺北市士林區文林路406號,化菻~零售業
80999027,雅亭商行,臺北市萬華區萬大路476號1樓,化菻~零售業
13850911,曼萍企業社,臺北市大同區延平北路2段98號,化菻~零售業
48980593,映入髮舖,臺北市大同區赤峰街3巷22號,化菻~零售業
26347338,珊瑚海生活館,臺北市中山區民權東路2段128號,化菻~零售業
38570085,林陳來富小舖,臺北市中山區中山北路2段77巷8號14樓之3,化菻~零售業
99339757,卍吉企業社,臺北市中正區和平西路2段58之1號5樓,化菻~零售業
73899451,路斯企業商行,臺北市中山區南京東路3段118號6樓之2,化菻~零售業
10344200,晶妍企業社,臺北市中山區北安路630巷19號,化菻~零售業
17265095,依霓精品店,臺北市內湖區民權東路6段296巷48號,化菻~零售業
48501714,髮原宿沙龍店,臺北市信義區基隆路2段131之1號,化菻~零售業
38457416,淇悅時尚美學館,臺北市信義區忠孝東路5段71巷3弄7號1樓,化菻~零售業
48816550,侑蓁精品店,臺北市萬華區萬大路437號,化菻~零售業
26370219,羅漢國際商行,臺北市萬華區萬大路423巷10弄13號3樓,化菻~零售業
25663737,希也樂國際企業社,臺北市松山區塔悠路292號,化菻~零售業
21731853,仙妮斯美妍館,臺北市中正區羅斯福路2段66巷2號4樓之2,化菻~零售業
37890259,愛維雅企業行,臺北市萬華區西藏路492號5樓之2,化菻~零售業
25581840,馥薇商行,臺北市大安區臨江街102之5號,化菻~零售業
26372716,昆城企業行,臺北市大安區光復南路180巷4號2樓,化菻~零售業
38559504,大雕燒餐坊,臺北市萬華區昆明街88號,化菻~零售業
48750760,雅雯美容工作室,臺北市北投區三合街2段440號,化菻~零售業
01393622,美貴百貨行,臺北市北投區光明路新生巷14號1樓,化菻~零售業
31957160,華妤手工坊,臺北市士林區後港街14號3樓,化菻~零售業
26225573,漢諾威精品行,臺北市中正區衡陽路84號,化菻~零售業
01565271,湘登美容材料行,臺北市松山區民生東路5段137巷2號3樓之3,化菻~零售業
14710397,蕾利絲美材行,臺北市士林區天母西路3號5樓之9,化菻~零售業
31859724,小米工作坊,臺北市信義區基隆路1段143號9樓之2,化菻~零售業
38470776,治伶洋行,臺北市南港區東明街33號,化菻~零售業
31847024,麗絲伶精品店,臺北市內湖區康寧路3段72號地下1層之1,化菻~零售業
25579611,髮力無邊造型沙龍,臺北市大安區忠孝東路3段251巷7弄10號1樓,化菻~零售業
25660871,諾亞美地企業坊,臺北市北投區石牌路1段166巷100號3樓,化菻~零售業
10372090,仙妮美容用品坊,臺北市中正區忠孝西路1段50號20樓之1,化菻~零售業
10398943,淘氣丸精品店,臺北市萬華區峨眉街28號,化菻~零售業
26224841,冠盈企業社,臺北市信義區大道路4號1樓,化菻~零售業
83930874,金恬美容坊,臺北市中山區南京東路2段56號3樓,化菻~零售業
31842560,聚泰養生館,臺北市中山區南京東路3段10號(1、2樓),化菻~零售業
31864037,鐏皇養生館,臺北市中山區農安街2之3號1樓2樓,化菻~零售業
38552679,安妮絲藝術美甲工作坊,臺北市大安區忠孝東路4段155號7樓之3,化菻~零售業
31849070,大安胡麻園商行,臺北市大安區通化街94號(1樓),化菻~零售業
21725037,采士影像造型屋,臺北市大安區延吉街157之5號2樓,化菻~零售業
94917477,茵蝶商行,臺北市大安區忠孝東路4段310號6樓,化菻~零售業
38459272,亮昀美妍館,臺北市大安區忠孝東路4段233號10樓之9,化菻~零售業
42270390,恩多精品行,臺北市中山區松江路69巷8號7樓,化菻~零售業
10309180,富竣專業工作室,臺北市松山區光復北路103巷26號,化菻~零售業
80983117,蕾莉雅美容材料行,臺北市中山區伊通街63號3樓,化菻~零售業
38505156,柯威企業社,臺北市中山區南京東路2段137號14樓,化菻~零售業
48799399,美麗角落小舖,臺北市大安區忠孝東路3段52號5樓之3,化菻~零售業
42271362,家銀企業社,臺北市中山區雙城街19巷6號,化菻~零售業
73889427,您好國際商行,臺北市中山區民權西路20號9樓之7,化菻~零售業
73892582,毅玲商行,臺北市中山區民權西路20號10樓之10,化菻~零售業
18102280,麗方化菻~行,臺北市大安區忠孝東路4段97號地下之7、之9,化菻~零售業
31958007,愷雅美容材料行,臺北市松山區復興北路145號4樓,化菻~零售業
48793894,亞麗亞企業社,臺北市中山區南京西路2號,化菻~零售業
48774448,傳家寶企業社,臺北市大安區金山南路2段209號,化菻~零售業
38468069,美嘉商行,臺北市大安區龍泉街68號,化菻~零售業
31853783,可瑾企業社,臺北市士林區中山北路7段62號1樓,化菻~零售業
26237655,阡薇服飾精品店,臺北市大安區龍泉街82號,化菻~零售業
25563548,上緻商行,臺北市中山區長春路287號2樓,化菻~零售業
48709910,愛馬仕精品服飾店,臺北市萬華區西寧南路72之1號,化菻~零售業
15998045,健乙商店,臺北市萬華區環河南路2段186號1樓,化菻~零售業
17769899,欣樺百貨行,臺北市大同區重慶北路1段26巷47號1樓,化菻~零售業
21764538,芭芭兒服飾店,臺北市中山區四平街55號1樓,化菻~零售業
26215723,芃芃玩具店,臺北市大同區太原路100號1樓,化菻~零售業
48979408,優蘭美材行,臺北市內湖區成功路4段30巷21號2樓,化菻~零售業
48725159,慧俐服飾行,臺北市文山區木柵路3段116號,化菻~零售業
26372440,冠宏美髮材料行,臺北市士林區華齡街17巷36號1樓,化菻~零售業
31877785,高宏日用百貨行,臺北市大安區龍泉街52號,化菻~零售業
17549782,福臨髮型美容院,臺北市內湖區內湖路1段737巷25號1樓、2樓,化菻~零售業
38469975,怡悅養生館,臺北市萬華區長沙街2段161號,化菻~零售業
25537296,二號出口髮型屋,臺北市士林區基河路36號,化菻~零售業
38503170,維京坊,臺北市萬華區東園街122號,化菻~零售業
29230733,一二三皮鞋店,臺北市中山區中山北路1段136號1樓,化菻~零售業
15668754,振加企業行,臺北市中山區長安東路2段75號1樓,化菻~零售業
21719133,開元企業社,臺北市北投區清江路245巷26號,化菻~零售業
38500770,枕戈待旦商行,臺北市中山區興安街93號,化菻~零售業
48995104,杏美企業社,臺北市士林區中正路281號2樓,化菻~零售業
18397828,薇美女人世界坊,臺北市內湖區星雲街168巷35號1樓,化菻~零售業
26361990,法蘿緹美甲工作室,臺北市大安區忠孝東路4段223巷40號,化菻~零售業
31845659,雅緹行,臺北市北投區實踐街33號1樓,化菻~零售業
38514177,采緹雅美容美髮工作室,臺北市大安區忠孝東路4段311號6樓之3,化菻~零售業
38469341,綵姿美妍企業社,臺北市中山區遼寧街45巷32號,化菻~零售業
08718076,璽躍國際商行,臺北市中山區民權西路20號9樓之7,化菻~零售業
