73907190,家和商行,臺北市中山區新生北路2段133巷51號1樓,日常用品批發業
31948389,葉記工程行,臺北市內湖區港墘路82巷7弄19號5樓,日常用品批發業
25565497,鴻葳百貨行,臺北市南港區同德路27號1樓,日常用品批發業
26362061,楓樺工作室,臺北市中山區北安路821巷3弄2號3樓,日常用品批發業
25508187,大祥珊瑚工藝社,臺北市中山區德惠街22號6樓,日常用品批發業
26215723,芃芃玩具店,臺北市大同區太原路100號1樓,日常用品批發業
26352887,天然彩藝國際企業社,臺北市大同區大龍街259巷14號4樓之1,日常用品批發業
26355316,彩翊服飾店,臺北市文山區木柵路3段105號,日常用品批發業
31860270,福輪企業社,臺北市士林區延平北路6段392巷6號9樓之8,日常用品批發業
31851357,寶麟國際洋行,臺北市信義區福德街310巷3號,日常用品批發業
10067113,廣明水電工程行,臺北市南港區研究院路2段35巷23弄12號3樓,日常用品批發業
37889099,漢晶企業社,臺北市士林區中山北路5段250號,日常用品批發業
99456699,富利商行,臺北市文山區興隆路2段196號7樓之3,日常用品批發業
25665475,美強生工作室,臺北市南港區南港路2段36號,日常用品批發業
26357715,天創科技工作室,臺北市中山區新生北路2段73號5樓之21,日常用品批發業
48717995,原愷商行,臺北市內湖區內湖路3段134號,日常用品批發業
21761080,日升企業社,臺北市中正區中華路1段59號7樓,日常用品批發業
38579430,元嘉寶企業社,臺北市松山區南京東路5段200號8樓之14,日常用品批發業
14336152,新居家企業社,臺北市內湖區民權東路6段296巷67號,日常用品批發業
13821120,大宏行,臺北市萬華區和平西路3段320號1樓,日常用品批發業
26235679,順達餐桌椅專賣店,臺北市中正區和平西路2段17號,日常用品批發業
38562064,兩岸雲端企業社,臺北市萬華區昆明街305號,日常用品批發業
26234854,豐光企業社,臺北市中山區長安東路2段36巷9號地下,日常用品批發業
83944119,辰田行,臺北市中正區館前路6號8樓之5,日常用品批發業
31948331,全勝企業社,臺北市文山區興隆路4段89號,日常用品批發業
38500363,真幸商行,臺北市士林區後港街18號2樓,日常用品批發業
80984848,宏昇商行,臺北市中山區錦州街386號,日常用品批發業
38509287,合時服飾行,臺北市大安區仁愛路4段300巷32弄1號1樓,日常用品批發業
38466225,八葉商行,臺北市內湖區大湖街131巷14號,日常用品批發業
38471000,晉坤企業社,臺北市萬華區西園路2段76號5樓之１,日常用品批發業
99619835,飛瑞企業行,臺北市大同區迪化街2段172巷15號,日常用品批發業
83932726,呈冠國際商行,臺北市信義區吳興街320巷10之1號4樓,日常用品批發業
31870241,豐閣實業社,臺北市松山區八德路3段12巷70弄2號,日常用品批發業
31874400,主流咖啡,臺北市信義區莊敬路289巷3弄37號,日常用品批發業
17521525,花龍鮮花店,臺北市中山區八德路2段80號4樓,日常用品批發業
38552220,轟陽實業社,臺北市士林區社中街346巷2弄7號1樓,日常用品批發業
13837761,廣承企業行,臺北市中正區羅斯福路3段210巷8弄7之12號,日常用品批發業
77136997,樹山企業行,臺北市萬華區三水街25巷5號1樓,日常用品批發業
26337774,莉琪兒精品店,臺北市大同區太原路61號,日常用品批發業
38563922,福玲行,臺北市萬華區漢中街49號2樓,日常用品批發業
98903925,柏飛企業社,臺北市內湖區金湖路64巷2號3樓,日常用品批發業
99961351,鑫妤百貨行,臺北市中山區新生北路2段39號8樓,日常用品批發業
31844764,熊猴創義廚房,臺北市萬華區西寧南路70號地下1層之7,日常用品批發業
48930617,阿月巴商行,臺北市文山區木新路3段210號,日常用品批發業
26253789,蜜糖盒子創意蛋糕館,臺北市中山區長春路17號6樓,日常用品批發業
26237944,夏樹洋行,臺北市中山區南京東路2段115巷20-2號1樓,日常用品批發業
31964330,微創藝工作室,臺北市大同區華陰街33號3樓之2,日常用品批發業
38555438,米皮國際汽車商行,臺北市北投區大度路3段286號,日常用品批發業
48884037,鴻劍實業社,臺北市中山區錦州街25號5樓,日常用品批發業
38506232,鈁鈁商行,臺北市信義區虎林街68-3號1樓,日常用品批發業
38459575,松下健康生活館,臺北市中正區羅斯福路3段300號1樓,日常用品批發業
25552768,駿凰企業社,臺北市北投區立農街1段349巷3弄4號1樓,日常用品批發業
48722097,友怡企業社,臺北市中山區中山北路2段45巷11號3樓,日常用品批發業
49858310,晟邑國際商行,臺北市中山區(南)民權西路20號9樓之7,日常用品批發業
81736852,上安健康商行,臺北市中山區中山北路1段105巷13之2號,日常用品批發業
01673145,馨鈴商行,臺北市南港區研究院路3段68巷22號,日常用品批發業
31859127,丞昕企業商行,臺北市中山區南京東路1段86號10樓,日常用品批發業
26220036,芳興商行,臺北市內湖區東湖路160巷10弄45號,日常用品批發業
09655541,鑫家潔企業社,臺北市萬華區貴陽街2段203號1樓,日常用品批發業
17263391,班芙名品店,臺北市大安區仁愛路3段108號1樓,日常用品批發業
38576406,香蘭工作室,臺北市大安區新生南路3段2號10樓,日常用品批發業
48751944,大昌行,臺北市中山區民生東路1段30號地下,日常用品批發業
01131515,昆成工具行,臺北市大同區哈密街59巷38弄31號3樓,日常用品批發業
25657165,勵志百科企業社,臺北市中正區重慶南路1段61號5樓,日常用品批發業
30369002,芳萱企業社,臺北市文山區羅斯福路5段236巷30號3樓,日常用品批發業
13453672,日發衛浴材料行,臺北市文山區景福街42號1樓,日常用品批發業
31862354,承亞名品行,臺北市內湖區成功路2段173號1樓,日常用品批發業
31724830,久亨國際企業社,臺北市信義區忠孝東路5段474號4樓,日常用品批發業
26355076,君儀行,臺北市南港區興中路12巷11號2樓,日常用品批發業
48745768,捷誠企業社,臺北市信義區福德街300巷35號,日常用品批發業
25574279,金比白工作室,臺北市大安區富陽街97號3樓之1,日常用品批發業
38472943,德美安商行,臺北市大安區和平東路1段15號3樓,日常用品批發業
13479103,元同宇企業社,臺北市松山區八德路3段210號11樓,日常用品批發業
31872867,華元國際商行,臺北市北投區中央北路1段76號,日常用品批發業
38574006,美好日子實業社,臺北市內湖區行善路25巷8弄8號8樓,日常用品批發業
26211965,星美雜糧行,臺北市北投區石牌路1段166巷113號1樓,日常用品批發業
42269823,采晨科技,臺北市信義區莊敬路289巷3弄37號,日常用品批發業
13466368,宜倫商行,臺北市內湖區新明路304之1號,日常用品批發業
19759361,順發花材花器批發行,臺北市松山區民生東路4段112巷3弄19號4樓,日常用品批發業
25558019,富玉精品店,臺北市中山區民權西路48號7樓之1,日常用品批發業
01595916,明廣行,臺北市大安區和平東路2段111號8樓,日常用品批發業
25513436,紅陽袁立誠企業社,臺北市文山區景福街226號,日常用品批發業
99333487,聯合派報社,臺北市中山區建國北路2段3巷13弄4號之2、1樓,日常用品批發業
38514079,柏彥企業社,臺北市中山區南京東路2段174號8樓,日常用品批發業
38505064,文祥精品店,臺北市萬華區西寧南路72之1號2樓,日常用品批發業
38559595,關子企業,臺北市大安區復興南路2段333號1樓,日常用品批發業
31921261,小優的店,臺北市文山區木柵路1段59巷11弄5號3樓,日常用品批發業
31860264,益利商行,臺北市士林區延平北路6段392巷6號9樓之8,日常用品批發業
05803859,魚米之鄉企業社,臺北市中山區南京東路2段76號4樓,日常用品批發業
25546719,木火之鄉工作室,臺北市信義區忠孝東路5段482號5樓,日常用品批發業
48980334,思維管理顧問工作室,臺北市信義區忠孝東路5段1之1號9樓,日常用品批發業
31875371,好作文創工作室,臺北市中正區辛亥路1段5號16樓,日常用品批發業
31689812,光展企業社,臺北市松山區民生東路4段75巷5弄3號,日常用品批發業
38581013,千百萬商行,臺北市中正區忠孝西路1段50號24樓之1及之3,日常用品批發業
38470656,鉅幼企業社,臺北市文山區忠順街2段25號,日常用品批發業
48876439,大利行,臺北市大同區太原路138號,日常用品批發業
48762317,美景工房,臺北市中山區雙城街18巷12號1樓,日常用品批發業
81741807,順昇企業社,臺北市信義區松山路541巷7號2樓,日常用品批發業
10354847,冠瑩商行,臺北市中山區北安路458巷51弄10號,日常用品批發業
38553972,米思特黏企業社,臺北市信義區光復南路525號8樓,日常用品批發業
48852247,富德洋行,臺北市內湖區康寧路1段164巷4號4樓,日常用品批發業
25667403,歡誼屋商行,臺北市大同區長安西路153號,日常用品批發業
25581089,魔荳咖啡館,臺北市信義區大道路129號,日常用品批發業
38511657,緯創企業社,臺北市大安區泰順街16巷16號2樓之1,日常用品批發業
25579128,寓傢企業社,臺北市中山區德惠街34號8樓之17,日常用品批發業
15641480,騏詮商行,臺北市南港區興中路28巷4號,日常用品批發業
48762702,鑫邦商行,臺北市中正區博愛路1巷1號,日常用品批發業
38496071,安妙膠囊咖啡企業社,臺北市信義區吳興街118巷26弄18號1樓,日常用品批發業
48806265,神川實業社,臺北市文山區木新路3段74巷1弄6號,日常用品批發業
25513409,喜多屋國際商行,臺北市中山區林森北路306號2樓之1,日常用品批發業
31858648,冠睿商行,臺北市中山區林森北路472號7樓之13,日常用品批發業
25540222,彩瑞生活館,臺北市中山區民權東路2段135巷20弄12號,日常用品批發業
38574511,豐采燕商行,臺北市信義區中坡南路215巷8號5樓,日常用品批發業
26233969,尚竑商行,臺北市中正區忠孝西路1段29巷9號,日常用品批發業
25566812,祥富商行,臺北市士林區大南路325號8樓之14,日常用品批發業
48776993,茂茂森林創意行銷工作室,臺北市大安區復興南路1段127號16樓之1,日常用品批發業
38513753,宜濃名店,臺北市松山區民生東路5段43號1樓,日常用品批發業
38645163,慶如服裝飾品行,臺北市內湖區舊宗路1段128號,日常用品批發業
41100355,世霖實業社,臺北市大同區民權西路122號6樓之1,日常用品批發業
25660632,藍西達康行銷顧問工作室,臺北市大安區建國南路1段286巷50號1樓,日常用品批發業
10637661,兆林商行,臺北市內湖區港墘路127巷16弄3號,日常用品批發業
18089934,衣鑽服飾批發行,臺北市信義區松山路119巷5號,日常用品批發業
48769959,台仲企業行,臺北市中山區農安街227巷3弄20號1樓,日常用品批發業
15665089,威誠企業行,臺北市中正區羅斯福路3段210巷8弄7之12號1樓,日常用品批發業
31881423,澕揚國際企業社,臺北市中正區汀州路3段203號1樓,日常用品批發業
41061178,克萊兒整體造型工作室,臺北市中山區民權東路1段70巷7號,日常用品批發業
31855353,希潔商行,臺北市信義區虎林街132巷26號1樓,日常用品批發業
99345300,升豐商行,臺北市萬華區環河南路1段181號,日常用品批發業
38463655,校園國際商行,臺北市中正區汀州路3段167號3樓,日常用品批發業
26247128,弘展工作室,臺北市松山區八德路4段389巷9號,日常用品批發業
73887440,榮鴻企業社,臺北市南港區成功路1段94巷2弄5號1樓,日常用品批發業
26337752,典洋企業社,臺北市中山區中山北路1段83巷5號5樓之2,日常用品批發業
31952637,永翔資訊傢俱企業社,臺北市北投區自強街5巷100弄3之1號3樓,日常用品批發業
14344527,天瓏行,臺北市士林區社中街474號2樓,日常用品批發業
27180960,振洋水電五金行,臺北市內湖區內湖路1段737巷8弄16號4樓,日常用品批發業
38457176,采新實業社,臺北市北投區明德路116號2樓,日常用品批發業
25665756,歡慶屋商行,臺北市大同區長安西路95號,日常用品批發業
26358313,上大藝品禮品社,臺北市中山區新生北路2段39號8樓,日常用品批發業
26251023,古登商號,臺北市大同區承德路3段150之1號,日常用品批發業
38469481,公主花園工作室,臺北市大安區信義路4段265巷21弄1號6樓,日常用品批發業
26244712,楓葉商行,臺北市北投區中和街55號2樓,日常用品批發業
13842976,逢祥行,臺北市內湖區安康路434巷35號,日常用品批發業
38469736,裕峰藝品行,臺北市大同區民生西路293號,日常用品批發業
13472523,逸樹村商行,臺北市松山區寶清街31號8樓,日常用品批發業
25578726,隆美企業社,臺北市內湖區東湖路160巷10弄45號,日常用品批發業
38580176,妙榕企業社,臺北市中山區八德路2段100號10樓之2,日常用品批發業
25562479,豪薺商行,臺北市士林區延平北路6段413巷14號,日常用品批發業
29219815,利得商行,臺北市信義區光復南路505號9樓之1,日常用品批發業
38571654,佑買新衣商店,臺北市北投區奇岩路8之1號1樓,日常用品批發業
31957345,悅成商行,臺北市內湖區新明路381號2樓,日常用品批發業
26369986,娜璇諾服飾店,臺北市中山區林森北路287號1樓,日常用品批發業
48690546,宏廣設計工作室,臺北市信義區忠孝東路5段743巷13號1樓,日常用品批發業
01540146,鴻逸汽車商行,臺北市信義區忠孝東路5段743巷19號1樓,日常用品批發業
31856445,勳勳商行,臺北市士林區永平街39號1樓,日常用品批發業
38458323,麋鹿迷路企業社,臺北市士林區基河路118號,日常用品批發業
73892675,傑成工程行,臺北市內湖區康寧路3段16巷100號4樓,日常用品批發業
26223955,交朋友汽車百貨行,臺北市信義區吳興街284巷22弄28號1樓,日常用品批發業
26225617,安力企業社,臺北市大同區延平北路2段127號3樓之10,日常用品批發業
31851899,耀美清潔社,臺北市士林區環河北路3段125號,日常用品批發業
26255132,茶北壹零貳商行,臺北市士林區文林路102之24號、102之25號、102之26號、102之27號,日常用品批發業
38502952,雯浩商號,臺北市南港區興中路12巷9號,日常用品批發業
25666896,蔬活企業社,臺北市文山區景文街42號5樓,日常用品批發業
38560333,百翊精品店,臺北市內湖區內湖路1段591巷10弄2號,日常用品批發業
38557317,威盛企業社,臺北市大安區信義路2段72號地下,日常用品批發業
48674433,安娜日用品商行,臺北市中山區民權西路20號9樓之5,日常用品批發業
26352697,好習慣生活養生工房,臺北市中正區重慶南路3段15巷3號2樓,日常用品批發業
25546859,臺灣知風堂,臺北市中山區長安東路2段81號12樓之1,日常用品批發業
38565317,世樺企業社,臺北市大同區重慶北路3段65號2樓,日常用品批發業
04775722,勝隆水電行,臺北市內湖區金龍路53號1樓,日常用品批發業
26366051,全興國際商行,臺北市文山區福興路82巷6弄10號,日常用品批發業
38503024,窩廚房,臺北市中正區羅斯福路3段126號之2、之4,日常用品批發業
26235489,愛莫盛國際貿易行,臺北市中山區敬業1路128巷10號1樓,日常用品批發業
48871526,喬貴服飾店,臺北市北投區中和街258號,日常用品批發業
10385898,邁林企業社,臺北市信義區信義路6段56號7樓,日常用品批發業
31878052,鋌渥設計工作室,臺北市松山區民生東路4段53號7樓,日常用品批發業
48501502,新典企業社,臺北市中山區民生東路2段147巷5弄19號1樓,日常用品批發業
13825771,找狗狗寵物用品店,臺北市大安區樂業街104號4樓,日常用品批發業
38581837,水木衣單手作坊,臺北市中山區中吉里長春路146號3樓,日常用品批發業
31863190,正鼎企業社,臺北市南港區同德路67號5樓,日常用品批發業
38473507,麗台商行,臺北市中山區長安東路2段6-1號3樓,日常用品批發業
99955800,垣久行,臺北市中山區新生北路2段68巷11之2號,日常用品批發業
42269767,誠氏號,臺北市中山區吉林路171號2樓,日常用品批發業
38502279,樂次方音樂工作室,臺北市中正區忠孝東路2段74號2樓,日常用品批發業
48864237,美祈企業社,臺北市中山區南京東路2段71號5樓,日常用品批發業
48747148,翔安商行,臺北市萬華區環河南路3段101號5樓之2,日常用品批發業
31850836,玉閔行,臺北市中正區同安街99之9號1樓,日常用品批發業
99956126,小熊胖胖映畫製作企業社,臺北市中正區廈門街14巷1號3樓,日常用品批發業
31954733,冠鮮行,臺北市內湖區成功路4段328號,日常用品批發業
13457001,女神創造花藝世界坊,臺北市中山區民權東路3段60巷14號1樓,日常用品批發業
38566202,徵銓企業社,臺北市士林區中山北路7段186號2樓,日常用品批發業
31953087,水菏美妍工作室,臺北市內湖區江南街71巷47號,日常用品批發業
31846849,上豪企業社,臺北市中正區紹興北街8號3樓之3,日常用品批發業
26207759,祥餘國際企業社,臺北市松山區南京東路5段250巷2弄5之1號2樓,日常用品批發業
26234138,偉凡企業社,臺北市南港區中南街10號,日常用品批發業
36534900,江進興商號,臺北市信義區和平東路3段391巷47號1樓,日常用品批發業
26246654,久康科技工程行,臺北市大安區忠孝東路4段169號11樓之1,日常用品批發業
48872671,展悅軒,臺北市大安區和平東路1段214號10樓之1,日常用品批發業
38467126,歐米爾洋行,臺北市松山區敦化南路1段100巷7弄35號,日常用品批發業
31955634,格蘭傑當代空間館,臺北市大安區信義路4段302巷4號,日常用品批發業
48854717,明聖企業社,臺北市北投區中和街273號2樓,日常用品批發業
99343437,禹勝企業社,臺北市中山區林森北路50號9樓之8,日常用品批發業
25539837,全球菁英企業社,臺北市中山區松江路194巷59號,日常用品批發業
99624345,服芝飾品企業社,臺北市大同區重慶北路2段80巷18號,日常用品批發業
31852089,玉全企業社,臺北市中山區南京東路2段8號2樓之1,日常用品批發業
26344326,展揮實業社,臺北市中山區復興南路1段36之3號1樓,日常用品批發業
26373068,喜寬豐企業行,臺北市文山區羅斯福路5段176巷51號,日常用品批發業
26220140,泓運企業社,臺北市士林區士商路123號1樓,日常用品批發業
38562563,京站視界眼鏡量販館,臺北市信義區松山路232號,日常用品批發業
26191686,上允企業社,臺北市大同區重慶北路3段278之2號3樓,日常用品批發業
25583208,悅活商行,臺北市中山區中山北路2段20巷10號,日常用品批發業
10397043,品萬企業社,臺北市中山區民權東路2段39號,日常用品批發業
04466845,宏原行,臺北市中正區齊東街82巷36號1樓,日常用品批發業
38559672,德陞監視科技行,臺北市萬華區中華路1段22號,日常用品批發業
38576763,江南貿易行,臺北市中山區興安街42號,日常用品批發業
37851657,運達通企業商行,臺北市中正區衡陽路10號12樓,日常用品批發業
42270005,龍藤企業社,臺北市內湖區成功路2段486巷4號10樓,日常用品批發業
31874470,名祥百貨行,臺北市大同區重慶北路1段1號地下,日常用品批發業
25546669,立鈞企業社,臺北市文山區光輝路134巷10弄6號3樓,日常用品批發業
26351374,珮芝美容工作室,臺北市松山區民權東路3段160巷22號2樓之1,日常用品批發業
38509300,卓昌商行,臺北市中山區民權東路3段17號1樓,日常用品批發業
21765229,栯慈商行,臺北市中山區民生東路3段1號3樓,日常用品批發業
31867196,瀧豐企業社,臺北市大同區重慶北路2段46巷36號,日常用品批發業
80985059,禾稑工程行,臺北市內湖區民權東路6段280巷13號1樓,日常用品批發業
31857676,米迪家居生活館,臺北市大安區文昌街171號,日常用品批發業
25561339,克萊兒國際商行,臺北市文山區福興路63巷4弄16號,日常用品批發業
26218622,上禾百貨行,臺北市萬華區中華路1段122號,日常用品批發業
25556292,優特商行,臺北市士林區福國路26號2樓,日常用品批發業
01943176,金宏企業行,臺北市中山區新生北路1段5巷1號1樓,日常用品批發業
25662907,康寶食品行,臺北市大安區忠孝東路4段52號9樓,日常用品批發業
81617552,阿祥商行,臺北市萬華區和平西路3段23號,日常用品批發業
14346784,幅新手織織聞設計室,臺北市大安區忠孝東路4段177號7樓之1,日常用品批發業
26342615,景瀚實業社,臺北市士林區德行東路90巷19號,日常用品批發業
38471971,合一百貨行,臺北市北投區立農街1段349巷3弄4號,日常用品批發業
38467478,振鈺工程行,臺北市萬華區福星里西寧南路11號7樓之2,日常用品批發業
30134505,佳緯企業社,臺北市文山區久康街72巷3號2樓,日常用品批發業
38502117,祥新車行,臺北市文山區羅斯福路6段237號,日常用品批發業
25550662,雅馨行,臺北市中正區衡陽路112號,日常用品批發業
25661225,盈華企業社,臺北市文山區景興路23巷6弄14號1樓,日常用品批發業
25532813,崇耀國際商行,臺北市文山區景後街95號8樓之4,日常用品批發業
25572379,冠榮大商店,臺北市南港區興中路28巷4號1樓,日常用品批發業
48942901,?恩企業社,臺北市內湖區新明路460巷18弄9號,日常用品批發業
98890745,希悅工作室,臺北市萬華區長沙街2段133號1樓,日常用品批發業
15666828,悅鑫商行,臺北市中山區吉林路161巷1弄5號1樓,日常用品批發業
38455536,格蕾絲芙商行,臺北市中山區南京東路2段76號4樓,日常用品批發業
38571747,元豐清潔用品商行,臺北市大同區民族西路223之9號6樓,日常用品批發業
13455989,喬崴企業社,臺北市大同區歸綏街209號3樓之2,日常用品批發業
38506205,寓見設計工作室,臺北市北投區民族街10號2樓,日常用品批發業
31872331,可可祥百貨行,臺北市士林區德行東路109巷34號1樓,日常用品批發業
26223884,美林商行,臺北市大同區錦西街54號,日常用品批發業
13450393,葛瑞斯國際商行,臺北市大安區仁愛路3段24巷1弄4號1樓,日常用品批發業
99609175,上嘉寵物用品行,臺北市萬華區和平西路3段31號1樓,日常用品批發業
25669079,莊普藝術工作室,臺北市中山區林森北路472號2樓之3,日常用品批發業
13470308,菁山時尚名店,臺北市信義區忠孝東路5段71巷42號,日常用品批發業
38503853,賴憲章服飾店,臺北市大安區敦化南路1段161巷70號,日常用品批發業
38553419,復古老爹洋行,臺北市中山區南京西路12巷12號地下,日常用品批發業
26764305,卍普賢佛教文物用品企業,臺北市中山區建國北路3段113巷7弄3號(1樓),日常用品批發業
15667832,強懋資訊社,臺北市中正區八德路1段78號(3樓),日常用品批發業
25517860,德星企業社,臺北市松山區南京東路5段40號6樓之7,日常用品批發業
99335801,明道工作室,臺北市中山區南京東路3段189號4樓,日常用品批發業
26251375,越峰工程行,臺北市中山區渭水路54號,日常用品批發業
31952756,崴崗專業髮品,臺北市信義區虎林街242巷50號1樓,日常用品批發業
31950053,鑫宏企業社,臺北市萬華區雅江街85號1樓,日常用品批發業
26236059,昌勃企業社,臺北市中山區天津街63號7樓,日常用品批發業
38505254,蠍子館,臺北市大安區光復南路102號(1樓),日常用品批發業
26339169,九牧園藝環保清潔社,臺北市南港區成福路76號,日常用品批發業
42269801,思霈企業社,臺北市內湖區金湖路401巷34號,日常用品批發業
30298197,建達國際企業社,臺北市北投區石牌路1段8號1樓,日常用品批發業
31877618,咖樂烘豆企業社,臺北市大安區延吉街68之16號,日常用品批發業
26371316,匹歐匹廣告社,臺北市大安區仁愛路3段106號5樓,日常用品批發業
42270151,上聖企業社,臺北市北投區大興街23巷17號3樓,日常用品批發業
38572470,今修企業社,臺北市松山區南京東路4段130號3樓之1,日常用品批發業
29504803,大友木器行,臺北市士林區文林路436號1樓,日常用品批發業
37851657,運達通企業商行,臺北市中正區衡陽路10號12樓,日常用品批發業
48940657,翔琳企業社,臺北市中正區廈門街108號3樓,日常用品批發業
17273433,士林玻璃行,臺北市士林區文林路663號(1樓),日常用品批發業
48879338,派對世界商行,臺北市大同區太原路63號1至2樓,日常用品批發業
05153601,信忠實業社,臺北市中正區惠安街17號1樓,日常用品批發業
38501150,李傑企業社,臺北市中正區漢口街1段110號8樓之12,日常用品批發業
73909113,星和岳企業社,臺北市北投區光明路217號3樓之2,日常用品批發業
80998266,三禾五金百貨店,臺北市松山區饒河街247號1樓,日常用品批發業
99613419,采瑄美材精品店,臺北市士林區大東路86之5號1樓,日常用品批發業
26355527,昱通工程企業社,臺北市中正區新生南路1段50之2號5樓,日常用品批發業
