38580181,慧芬企業社,臺北市萬華區昆明街34號8樓之1,日常用品批發業
73889833,佑鑫不袗五金材料行,臺北市北投區懷德街3號1樓,日常用品批發業
31954543,佳仕企業社,臺北市士林區延平北路5段257巷2弄8號1樓,日常用品批發業
38497677,阿畢克漢草本花園商行,臺北市北投區文林北路250號3F,日常用品批發業
38496327,兆元企業社,臺北市文山區辛亥路4段101巷85之6號1樓,日常用品批發業
10351898,聿傑企業社,臺北市萬華區西園路2段162號7樓,日常用品批發業
38575011,政翰企業社,臺北市文山區萬隆街54號1樓,日常用品批發業
26277585,群力精品行,臺北市大同區鄭州路83巷5號,日常用品批發業
21595604,碩宸企業社,臺北市文山區景文街13之2號1樓,日常用品批發業
31863987,國雲企業社,臺北市中山區林森北路121號5樓,日常用品批發業
38564035,忠宬企業社,臺北市萬華區康定路192號2樓,日常用品批發業
17259376,斑斑視覺創意工作室,臺北市大同區承德路3段229號7樓之5,日常用品批發業
18412721,安妮威爾國際商行,臺北市內湖區金湖路46巷15號1樓,日常用品批發業
31873280,舜鋐國際商行,臺北市士林區葫蘆街39巷2號2樓,日常用品批發業
10321516,明發商行,臺北市大同區承德路1段32號12樓之12,日常用品批發業
27186824,廉化光企業行,臺北市中山區民權西路20號4樓,日常用品批發業
34777613,炬鈦企業社,臺北市內湖區新湖二路367號3樓,日常用品批發業
01437403,國達工程行,臺北市萬華區西園路2段303號1樓,日常用品批發業
01304924,吉羊服務社,臺北市信義區松德路65號11樓之1,日常用品批發業
26232933,雙和企業社,臺北市大安區復興南路2段291號4樓之1,日常用品批發業
31862609,網拓商行,臺北市中山區民權東路2段152巷22弄15號2樓,日常用品批發業
98900188,洛卡手創館,臺北市文山區光輝路71巷5弄5號1樓,日常用品批發業
31957350,生醫企業社,臺北市中山區復興北路82號11樓,日常用品批發業
38565956,以便以謝國際商行,臺北市北投區榮華三路43號2樓,日常用品批發業
94914302,峻興商行,臺北市中山區民權西路20號10樓之10,日常用品批發業
80994711,卡蘿美容美髮材料行,臺北市文山區羅斯福路6段210號2樓,日常用品批發業
38574673,翔登企業社,臺北市內湖區成功路2段250巷29號3樓,日常用品批發業
25556856,瑞盈企業社,臺北市中山區長安東路2段178號10樓,日常用品批發業
38577691,台灣御香雅閣,臺北市松山區八德路4段348號1樓,日常用品批發業
10671631,華寶企業社,臺北市萬華區萬大路387巷29弄15號1樓,日常用品批發業
38505389,探子設計實驗室,臺北市大同區鄭州路55號3樓,日常用品批發業
38463867,美齊企業社,臺北市松山區慶城街8之1號4樓,日常用品批發業
26244564,弘翔實業社,臺北市大同區重慶北路1段15巷8號(4樓),日常用品批發業
10396071,昀亨行,臺北市北投區中央南路1段25巷19號,日常用品批發業
29247684,摩賽卡法式茶館,臺北市大安區麗水街24號1樓,日常用品批發業
31964388,美麗堡企業社,臺北市士林區天母北路4巷5之2號地下1樓,日常用品批發業
31873417,台灣夢想國際企業社,臺北市松山區復興北路453號1樓,日常用品批發業
18398093,承泰實業社,臺北市內湖區成功路4段323巷2弄1號4樓,日常用品批發業
48694607,韻綮國際商行,臺北市士林區中山北路6段195巷21號3樓,日常用品批發業
98889016,神通企業社,臺北市文山區木柵路4段25號,日常用品批發業
31961621,萬得福國際商行,臺北市松山區八德路4段660號14樓之2,日常用品批發業
38573999,安心圓嬰兒用品商行,臺北市內湖區大湖街166巷4號,日常用品批發業
38463450,台灣銀髮族樂活醫療器材企業社,臺北市松山區光復北路190巷39號龍城市場2樓224號攤位,日常用品批發業
25572103,正達數位監控企業社,臺北市大同區哈密街86號1樓,日常用品批發業
38557267,時尚女孩流行飾品商行,臺北市大安區延吉街140之2號,日常用品批發業
25665637,萬能起重企業社,臺北市北投區尊賢街203號2樓,日常用品批發業
38471472,鮮綠商行,臺北市中山區南京東路2段76號4樓,日常用品批發業
38563508,朱合李商行,臺北市大安區延吉街160巷11號,日常用品批發業
38557490,樂芙萊茯館,臺北市大安區忠孝東路4段162號11樓之5,日常用品批發業
29247571,噹鴻實業社,臺北市士林區基河路101號公有士林市場短棟08號雜貨攤位,日常用品批發業
48976205,傳美生活坊,臺北市萬華區漢口街2段73號10樓,日常用品批發業
38582224,馨馨服飾店,臺北市大同區民生西路47號捷運中山地下街B66號店鋪,日常用品批發業
77523890,佳昇服飾行,臺北市大同區太原路8巷5號1樓,日常用品批發業
31877027,米亞名床傢俱行,臺北市大安區和平東路3段228巷51號,日常用品批發業
15667592,達博企業社,臺北市松山區復興北路1號11樓之2,日常用品批發業
