38474512,永捷國際洋行,臺北市信義區吳興街524巷16弄2之1號(1樓),日常用品批發業
38558890,奕仕特設計工作室,臺北市信義區忠孝東路5段743巷13號,日常用品批發業
04829184,百松教學用品社,臺北市信義區基隆路2段22號6樓之6,日常用品批發業
99994212,煜博企業社,臺北市松山區南京東路5段66巷3弄27號2樓,日常用品批發業
31860399,鴻錡實業社,臺北市大安區復興南路2段277號3樓,日常用品批發業
48926249,璟瑞商行,臺北市北投區石牌路1段62號,日常用品批發業
01393138,明佑行,臺北市文山區政大二街222號4樓,日常用品批發業
13450160,雅新國際商行,臺北市內湖區金湖路46巷15號,日常用品批發業
25565285,榛和有機坊,臺北市信義區忠孝東路5段508之6號,日常用品批發業
48816221,家家企業社,臺北市北投區公館路340巷8號3樓,日常用品批發業
38495930,玉朋時尚館,臺北市松山區南京東路5段66巷22弄38號,日常用品批發業
13782891,比菲德國際企業社,臺北市中山區林森北路100號5樓之3,日常用品批發業
26766438,琬貽企業社,臺北市信義區林口街38巷19號,日常用品批發業
38470065,大可國際企業社,臺北市文山區仙岩路69號5樓,日常用品批發業
81769142,富喬企業社,臺北市大同區歸綏街232號1樓,日常用品批發業
26215836,鴻?雜糧行,臺北市北投區中央南路1段163號1樓,日常用品批發業
31858990,美樂家商行,臺北市北投區中央南路1段154號,日常用品批發業
73918675,松格企業社,臺北市中正區信義路2段81號(東門公有市場新館第1號攤位),日常用品批發業
38565359,千禧企業社,臺北市中山區南京東路3段118號10樓之1,日常用品批發業
38455923,寶菁美妍館,臺北市中山區民生西路45巷9弄17號1樓,日常用品批發業
29478636,滈林企業社,臺北市松山區南京東路4段95號4樓,日常用品批發業
48770689,掌生穀粒糧商號,臺北市信義區光復南路415巷182號,日常用品批發業
38566272,天妃企業社,臺北市萬華區大理街159巷11號,日常用品批發業
02484298,同樂工作室,臺北市士林區承德路4段188號1樓,日常用品批發業
38576124,綠鑫工作室,臺北市大安區新生南路3段2號10樓,日常用品批發業
26519346,艾伶企業社,臺北市信義區忠孝東路5段1之8號5樓,日常用品批發業
99609718,左耳文化出版社,臺北市大安區大安路1段116巷5號地下,日常用品批發業
31959076,夏娃洋行,臺北市信義區松山路119巷17弄12號,日常用品批發業
73900751,冠婷服飾行,臺北市萬華區康定路239號、241號,日常用品批發業
38496348,恆豐企業社,臺北市文山區樟新街32巷6號,日常用品批發業
99606016,十代商行,臺北市內湖區內湖路1段91巷35弄54號,日常用品批發業
29225675,晶鴻百貨行,臺北市中山區雙城街12巷2之1號1樓,日常用品批發業
48738289,橙衣衫舖,臺北市信義區基隆路1段155號12樓,日常用品批發業
26225665,豐安企業社,臺北市中山區松江路206號13樓之4,日常用品批發業
25507645,騰晞商行,臺北市大安區敦化南路2段77號9樓之4,日常用品批發業
48886648,學設計劃工作室,臺北市大安區泰順街16巷4號,日常用品批發業
38552988,伊登花園美學館,臺北市中正區公園路32號2樓之1,日常用品批發業
20298872,鼎欣酒莊,臺北市北投區大業路517巷17號,日常用品批發業
26211917,韋澄企業社,臺北市萬華區艋舺大道120巷38弄41號,日常用品批發業
15901289,正泰日用品百貨行,臺北市萬華區莒光路181號1樓,日常用品批發業
48732356,樺達國際商行,臺北市中山區松江路38巷2號2樓之1,日常用品批發業
48963736,緒沅商行,臺北市大同區民權西路144巷5弄7號11樓之1,日常用品批發業
26344466,可祥莊商行,臺北市內湖區成功路4段168之2號,日常用品批發業
21737505,義鈦商行,臺北市萬華區武昌街2段47號,日常用品批發業
31965513,鴻?企業社,臺北市萬華區大理街157號,日常用品批發業
38555388,育澄企業社,臺北市大安區忠孝東路4段49巷8號,日常用品批發業
48791262,貓陶鷹創意美術工作室,臺北市士林區忠誠路1段171巷10弄10號2樓,日常用品批發業
48972427,吉達通企業社,臺北市信義區松信路24號1樓,日常用品批發業
38563916,福安行,臺北市萬華區漢中街49號1樓,日常用品批發業
31954889,互信企業社,臺北市中山區長春路20號2樓,日常用品批發業
25535229,貝比卡企業社,臺北市信義區松山路540巷3弄19號,日常用品批發業
38565793,元元國際企業社,臺北市大安區信義路2段72號地下,日常用品批發業
42270758,馨茉國際實業社,臺北市內湖區文德路66巷14弄12號2樓,日常用品批發業
48767559,尚圓玩具百貨商行,臺北市大同區太原路129號1樓,日常用品批發業
38506520,偉華企業社,臺北市士林區蘭雅里德行東路109巷73弄5號1樓,日常用品批發業
80992468,海天國際企業社,臺北市南港區研究院路2段70巷47弄10號3樓,日常用品批發業
48743614,太豐行,臺北市萬華區和平西路3段15號1樓,日常用品批發業
38468286,巨人企業社,臺北市中山區農安街71號1樓,日常用品批發業
01608980,龍鳳珠寶精品行,臺北市大安區安和路1段38號,日常用品批發業
31852692,美萌時尚館,臺北市北投區石牌路2段122號2樓,日常用品批發業
38565941,嘉鎂全球行銷網,臺北市大同區延平北路4段282巷47號,日常用品批發業
14886711,富春商行,臺北市文山區興隆路2段196號7樓之3,日常用品批發業
21761069,明志實業社,臺北市中正區中華路1段59號7樓,日常用品批發業
14731999,元晨商行,臺北市北投區大同街349號,日常用品批發業
26730609,宸金企業社,臺北市文山區忠順街2段25號,日常用品批發業
38505249,涵舍精品服飾,臺北市大安區信義路4段265巷23號1樓,日常用品批發業
25571370,長泰水電行,臺北市中山區松江路156巷24號1樓,日常用品批發業
26249940,欣穎國際企業社,臺北市大安區仁愛路3段129號4樓,日常用品批發業
48739463,震光企業社,臺北市萬華區和平西路3段261之14號,日常用品批發業
42270103,廣海企業社,臺北市萬華區萬大路27號3樓,日常用品批發業
18404166,笙富行,臺北市士林區文林路661巷39弄21號1樓,日常用品批發業
10304896,找到了服飾工作室,臺北市大安區師大路117巷2號,日常用品批發業
20423225,育豐企業社,臺北市北投區知行路216號6樓,日常用品批發業
26242496,薇雅美容坊,臺北市松山區民生東路5段209號1樓,日常用品批發業
26350810,蓁讚國際商行,臺北市中山區松江路206號13樓之1,日常用品批發業
26362858,恩實廣告企業社,臺北市萬華區康定路24號4樓之6,日常用品批發業
26371245,象山名店,臺北市信義區松山路517號2樓,日常用品批發業
31954092,侑創設計工作室,臺北市松山區南京東路4段197號9樓之1,日常用品批發業
31856634,七宸國際商行,臺北市內湖區南京東路6段350之2號4樓之5,日常用品批發業
31870903,廷翊精品店,臺北市萬華區西寧南路50巷13號,日常用品批發業
26369819,日樣汽機車精品店,臺北市大同區西寧北路52號(1樓),日常用品批發業
38507083,鼎記照明企業社,臺北市北投區文化三路22號3樓,日常用品批發業
45847621,品潔家事服務工作室,臺北市大安區忠孝東路4段169號12樓之1,日常用品批發業
38558857,億丞企業社,臺北市士林區承德路4段58巷28弄16號5樓,日常用品批發業
99606070,藝展工作坊,臺北市士林區中山北路6段310號,日常用品批發業
48735591,喬登企業社,臺北市中山區中山北路2段170號,日常用品批發業
48686326,建泓企業社,臺北市北投區中央北路3段40巷34弄1號1樓,日常用品批發業
38557858,冠億冷凍家具行,臺北市萬華區環河南路1段63號,日常用品批發業
37890005,立新國際商行,臺北市北投區文林北路244巷66號1樓,日常用品批發業
29247586,禧美企業社,臺北市大安區復興南路2段291號3樓,日常用品批發業
38497472,晶盈企業社,臺北市大安區忠孝東路4段221號12樓,日常用品批發業
01519621,以馬內利行銷企業社,臺北市中正區漢口街1段110號5樓之7,日常用品批發業
31959337,立安企業社,臺北市大安區市民大道4段232號,日常用品批發業
31854832,夢想傢飾坊,臺北市南港區福德街312號2樓,日常用品批發業
38572160,元偉國際企業社,臺北市松山區南京東路5段251巷24弄20之1號2樓,日常用品批發業
18179560,秝榮國際企業商行,臺北市松山區八德路4段783號3樓之2,日常用品批發業
25549265,奇芳工作室,臺北市大安區延吉街126巷14號,日常用品批發業
31872254,滌聲衣著,臺北市大安區敦化南路1段177巷40號,日常用品批發業
38513091,巧悄設計工作室,臺北市內湖區新明路498巷14弄5號3樓,日常用品批發業
38579641,城?企業社,臺北市士林區葫蘆街77號3樓,日常用品批發業
99954540,鑫仕達製作社,臺北市大同區民族西路223之16號4樓,日常用品批發業
48559145,福星大商店,臺北市北投區中和街258號1樓,日常用品批發業
38576102,瑞力興業社,臺北市大安區忠孝東路4段220號13樓,日常用品批發業
26219306,穩得創意工坊,臺北市中山區長安東路2段31號7樓之5,日常用品批發業
48950423,桐鋅企業社,臺北市文山區和興路52巷7弄11號,日常用品批發業
25577000,將將小舖,臺北市大安區大安路1段31巷19號,日常用品批發業
48823644,綠野設計工作室,臺北市文山區興隆路1段102巷15號2樓,日常用品批發業
48781237,明英商行,臺北市北投區中央北路3段40巷40號1樓,日常用品批發業
26359093,蒼龍寶馬國際企業社,臺北市信義區吳興街161號,日常用品批發業
25523808,奇美文化出版社,臺北市中山區長安東路1段54號5樓,日常用品批發業
26235214,阿薩伊企業社,臺北市中山區長安東路2段246號7樓之5,日常用品批發業
48875868,焦點攝影工作室,臺北市中山區雙城街3巷2號11樓之11,日常用品批發業
38458528,維愛思時尚美學館,臺北市信義區忠孝東路5段71巷12弄28號1樓,日常用品批發業
48535539,愛我企業社,臺北市士林區社中街301號1樓,日常用品批發業
38562509,璞豆企業社,臺北市大安區仁愛路3段5巷1弄21-7號,日常用品批發業
09959713,勁豹國際商行,臺北市南港區研究院路1段99號12樓之5,日常用品批發業
31920798,錦繡大地工作室,臺北市大同區涼州街2號3樓之6,日常用品批發業
31844650,佳弘企業社,臺北市中正區忠孝西路1段72號10樓之18,日常用品批發業
38573225,台灣希美實業社,臺北市大安區信義路4段30巷32號,日常用品批發業
15647317,新象清潔行,臺北市內湖區民權東路6段120巷1弄7號,日常用品批發業
38467322,成妍工作室,臺北市松山區光復北路230巷53號4樓,日常用品批發業
26344944,壹山創意工作室,臺北市松山區南京東路5段336號8樓,日常用品批發業
10381990,泛泰富都企業社,臺北市信義區忠孝東路5段372巷27弄72之1號,日常用品批發業
25532975,祐緯洋行,臺北市中正區金門街34巷4號,日常用品批發業
05260102,大名行,臺北市中山區新生北路3段68巷37號1樓,日常用品批發業
38508631,桂女織服飾店,臺北市信義區松山路556號,日常用品批發業
99961916,八鄉狸精品服飾店,臺北市萬華區武昌街2段50巷11號1樓,日常用品批發業
26361582,鴻鵬商行,臺北市文山區興隆路4段105巷29號地下之3,日常用品批發業
17774289,昌達精品行,臺北市大同區重慶北路1段27巷13號1樓,日常用品批發業
38511875,慈購網實業社,臺北市士林區中山北路7段165號3樓之5,日常用品批發業
31866112,鎬炫精品服飾店,臺北市士林區大北路6號1樓,日常用品批發業
18390114,宏碩企業社,臺北市文山區辛亥路4段101巷74號,日常用品批發業
81742221,亞美服裝號,臺北市萬華區大理街42之3號1樓,日常用品批發業
08574697,閎福商行,臺北市信義區基隆路1段432號8樓803室,日常用品批發業
26236157,正漢行,臺北市文山區景福街281號4樓,日常用品批發業
81718989,凌芸實業商行,臺北市松山區光復北路85巷29號1樓,日常用品批發業
38581132,姿碧穎企業社,臺北市士林區德行西路40號1樓,日常用品批發業
31947184,木在企業社,臺北市文山區萬芳路9之1號,日常用品批發業
38507387,富方商行,臺北市大安區建安里敦化南路1段189號,日常用品批發業
38554640,欣美企業社,臺北市大安區通安街19巷2號,日常用品批發業
99339519,水昆商行,臺北市大安區和平東路3段85號1樓,日常用品批發業
25660963,育昇機電工程行,臺北市北投區大業路635號,日常用品批發業
26248668,海韻茶業行,臺北市信義區松德路59號,日常用品批發業
13834672,元普國際商行,臺北市松山區南京東路4段164號7樓之4,日常用品批發業
31878187,龍均國際企業社,臺北市萬華區長順街99巷16弄11號2樓,日常用品批發業
48890538,菁蘋企業社,臺北市大安區復興南路2段293之3號10樓之1,日常用品批發業
80992208,鍶?玹工作坊,臺北市內湖區成功路4段325號4樓,日常用品批發業
25584086,敦品數位貿易工作室,臺北市大安區溫州街22號4樓之3,日常用品批發業
26248631,嘉鑫百貨行,臺北市內湖區東湖路58巷1號,日常用品批發業
31864281,隆華文具用品行,臺北市大同區重慶北路2段119號,日常用品批發業
42270650,巴酷商行,臺北市中山區南京東路2段137號14樓,日常用品批發業
26226003,多點創意設計工作室,臺北市松山區三民路155巷27號3樓,日常用品批發業
48670160,嵩源企業社,臺北市松山區南京東路4段21號8樓之2,日常用品批發業
21764946,動力屋,臺北市大同區民權西路174號1樓,日常用品批發業
31869130,菲帆企業商行,臺北市松山區民生東路5段137巷4弄14號8樓,日常用品批發業
98914887,百韻工坊,臺北市松山區南京東路4段93號2樓,日常用品批發業
99962393,垣翔企業社,臺北市北投區中央北路2段39號2樓,日常用品批發業
38576428,舒晴商行,臺北市大安區新生南路3段2號10樓,日常用品批發業
38473746,頤亨行,臺北市士林區忠誠路2段108號,日常用品批發業
25504252,海爾企業社,臺北市大安區忠孝東路4段2號11樓之5,日常用品批發業
31842674,御亨設計工程行,臺北市北投區公館路145巷4弄6號2樓,日常用品批發業
31863868,利奇工作室,臺北市信義區永吉路32號7樓之5,日常用品批發業
26352520,衍昌?菜行,臺北市士林區前港街88號2樓,日常用品批發業
99972250,蔣京企業社,臺北市內湖區大湖山莊街218號8樓,日常用品批發業
38571079,譽翔百貨行,臺北市大同區重慶北路3段295巷6號1樓,日常用品批發業
48954552,唯愛精品館,臺北市萬華區貴陽街2段130之1號6樓,日常用品批發業
31934786,鑄木設計工作室,臺北市大安區安和路2段71巷8號,日常用品批發業
38576166,御尊企業社,臺北市中山區天津街50號4樓,日常用品批發業
38562114,邦迪雅工作室,臺北市內湖區內湖路1段91巷39弄18號3樓,日常用品批發業
38560951,雪維服飾店,臺北市大安區敦化南路1段161巷50號1樓,日常用品批發業
25520534,全崧實業社,臺北市士林區中山北路6段758號1樓,日常用品批發業
37851657,運達通企業商行,臺北市中正區衡陽路10號12樓,日常用品批發業
38474920,新亮點企業社,臺北市內湖區南京東路6段461號6樓之3,日常用品批發業
77836289,大安醫療器材行,臺北市大安區大安路1段155號1樓,日常用品批發業
04218640,天壇工藝特產行,臺北市萬華區貴陽街2段17巷10號2樓,日常用品批發業
26222386,中太衛浴廚櫃設備行,臺北市萬華區三水街115巷4號2樓,日常用品批發業
48766849,柏源事業社,臺北市中山區民生東路3段1號3樓,日常用品批發業
31951953,達佩企業社,臺北市信義區信義路5段127號17樓之11,日常用品批發業
25582377,周雙發號,臺北市中山區中山北路1段118之1號3樓,日常用品批發業
49961052,潔芳企業社,臺北市大同區延平北路3段4號3樓,日常用品批發業
26766373,京展眼鏡行,臺北市大同區長安西路52之1號捷運地下街南段A8號店舖,日常用品批發業
17271195,龍鼎禮品百貨社,臺北市南港區興華路114巷1弄5號2樓,日常用品批發業
17076812,康掬文具行,臺北市信義區永吉路278巷42弄7號4樓,日常用品批發業
26357757,捷登精品商行,臺北市士林區中山北路7段148之4號1樓,日常用品批發業
92908640,立德工程行,臺北市內湖區康樂街48巷16號,日常用品批發業
38580106,及第貿易商行,臺北市中山區中山北路2段85巷15號,日常用品批發業
48668312,尚緯堂,臺北市中山區民生東路2段62號,日常用品批發業
38571211,天真軒商行,臺北市中正區寧波西街18號6樓之12,日常用品批發業
20731356,弘正商店,臺北市松山區民生東路4段74號1樓,日常用品批發業
99328908,精元企業社,臺北市南港區舊庄街1段66號1樓,日常用品批發業
31864070,益新國際商行,臺北市內湖區成功路4段323巷14弄5號2樓,日常用品批發業
08589164,皇品食品行,臺北市內湖區環山路1段24巷24號,日常用品批發業
38557668,好好生活實業,臺北市大安區大安路1段84巷2號3樓,日常用品批發業
31860882,探險家企業社,臺北市北投區東華街1段30號,日常用品批發業
83937980,企美國際事業企業社,臺北市中山區民生東路2段70號3樓,日常用品批發業
25559354,品?工坊,臺北市松山區復興北路313巷39號1樓,日常用品批發業
26222745,浩茗設計工作室,臺北市大同區長安西路239號7樓之1,日常用品批發業
01591741,空間工作室,臺北市萬華區中華路2段16號3樓之1,日常用品批發業
31844808,蓓拉精品服飾行,臺北市中山區四平街55號1樓,日常用品批發業
31861720,吉旺企業社,臺北市大安區安居街90號2樓,日常用品批發業
38503636,竹子米兒咖啡,臺北市中山區民生東路2段115巷24號1樓,日常用品批發業
17740253,惠美商號,臺北市大同區迪化街1段224巷19號1樓,日常用品批發業
81752389,名格百貨行,臺北市萬華區康定路350號4樓,日常用品批發業
38566370,柏榤企業社,臺北市信義區光復南路547號6樓之3,日常用品批發業
26238253,昶勝企業社,臺北市內湖區成功路2段250巷29號3樓,日常用品批發業
12403020,龍江五金建材行,臺北市中山區龍江路200之3號,日常用品批發業
25557124,龍鈦五金行,臺北市松山區八德路4段481號,日常用品批發業
09706491,愛之水企業社,臺北市北投區富貴一路5巷12號1樓,日常用品批發業
25556700,勝利醫療器材行,臺北市內湖區大湖山莊街219巷34弄1號地下之1,日常用品批發業
31949459,愛淘網商號,臺北市北投區立德路120巷27號2樓,日常用品批發業
17261470,向日葵商行,臺北市大安區市民大道4段68巷4號1樓,日常用品批發業
10200200,校園國際商行,臺北市中正區汀州路3段167號3樓,日常用品批發業
99972391,富糠行,臺北市大安區麗水街13巷18號1樓,日常用品批發業
25563456,力口設計工作室,臺北市中正區紹興北街31巷3號,日常用品批發業
99945613,心成水電工程行,臺北市士林區承德路4段315號2樓,日常用品批發業
26370267,鈺庭企業社,臺北市大同區迪化街1段189號2樓,日常用品批發業
12417360,松德塑膠包裝材料行,臺北市中山區渭水路24號,日常用品批發業
77908190,日日昇洋行,臺北市松山區八德路3段225號11樓之4,日常用品批發業
01707551,鼎盛企業社,臺北市文山區景華街128巷27號1樓,日常用品批發業
26360599,維梅爾創藝社,臺北市松山區八德路2段348號2樓之11,日常用品批發業
38552896,雨果伸縮帆布工程行,臺北市文山區保儀路109巷3弄15號,日常用品批發業
31862761,豐禾大商店,臺北市南港區興中路12巷9號1樓,日常用品批發業
38515128,權思商行,臺北市大安區光復南路102號8樓,日常用品批發業
38576503,索夫蘭企業社,臺北市松山區南京東路3段287號9樓,日常用品批發業
81747871,聖隆五金行,臺北市內湖區內湖路1段63號1樓,日常用品批發業
99975854,睿懋國際商行,臺北市北投區西安街2段85號1樓,日常用品批發業
48950520,夆興餐具行,臺北市中山區長安東路2段47之4號,日常用品批發業
38576433,合光源企業社,臺北市大安區新生南路3段2號10樓,日常用品批發業
26347745,知美國際企業社,臺北市大安區信義路2段72號地下,日常用品批發業
31878551,好鎂服裝行,臺北市信義區和平東路3段171號,日常用品批發業
29212566,葡萄樹禮品工作室,臺北市大安區新生南路3段14巷10號,日常用品批發業
38578256,群為企業社,臺北市信義區松山路651號5樓,日常用品批發業
48982641,勵鑫企業社,臺北市萬華區興寧街8巷8號3樓,日常用品批發業
38555248,誠國汽車玻璃行,臺北市文山區木新路3段80號2樓,日常用品批發業
25572758,鑫美企業社,臺北市松山區市民大道4段243號4樓,日常用品批發業
26373026,利樂屋企業社,臺北市內湖區文德路22巷24號,日常用品批發業
10319440,首益飾品,臺北市中山區松江路133巷6號,日常用品批發業
25572981,睿紘商行,臺北市萬華區西寧南路70號3樓之4,日常用品批發業
25572075,古飾洋行,臺北市大安區大安路1段31巷19號,日常用品批發業
48979580,費莉絲精品企業社,臺北市大安區忠孝東路4段223巷10弄2號,日常用品批發業
10314661,榳擎設計工作室,臺北市松山區南京東路4段56號10樓之6,日常用品批發業
26366989,北一名店,臺北市信義區吳興街271號2樓,日常用品批發業
25535852,雅比斯旅遊用品資訊社,臺北市中山區松江路39號7樓之3,日常用品批發業
99634126,誠信國際企業社,臺北市松山區八德路4段602號11樓之1,日常用品批發業
26256076,日陽貿易商行,臺北市內湖區陽光街161巷8號5樓,日常用品批發業
25556552,歐納企業社,臺北市大同區延平北路2段154號,日常用品批發業
26231934,小天使傢俱商行,臺北市內湖區環山路1段83號,日常用品批發業
26246090,寶禾園藝企業社,臺北市信義區虎林街293號,日常用品批發業
38464205,豬舍創意製作社,臺北市松山區民權東路3段170號12樓,日常用品批發業
99643912,宏龍工程行,臺北市中山區長安東路2段142號7樓之2,日常用品批發業
38576412,永日工作室,臺北市大安區新生南路3段2號10樓,日常用品批發業
15645916,翰興五金商行,臺北市北投區中央南路1段19號,日常用品批發業
38566195,覺知設計工作室,臺北市內湖區港墘路60巷4號4樓,日常用品批發業
15666799,帝城國際企業社,臺北市萬華區大理街159巷9號1樓,日常用品批發業
38467456,小時代國際媒體工作室,臺北市大安區信義路4段281號11樓,日常用品批發業
17044848,廣玟印刷文具品店,臺北市中正區金門街26號,日常用品批發業
25521251,歡樂屋商行,臺北市大同區長安西路234號,日常用品批發業
01192765,連文餐飲家餐具行,臺北市中山區吉林路174巷11號1樓,日常用品批發業
38470488,弘提顧問企業社,臺北市大安區忠孝東路4段162號5樓之5,日常用品批發業
38495642,東宇企業社,臺北市內湖區文德路220巷5弄13號,日常用品批發業
38576399,甯手工皂坊,臺北市內湖區行善路45號1樓,日常用品批發業
31866035,品睿商行,臺北市中山區復興北路288號7樓之3,日常用品批發業
01846239,仁中行,臺北市士林區承德路4段266巷4號3樓,日常用品批發業
66922224,世宇行,臺北市中正區詔安街173號1樓,日常用品批發業
01383238,鴻裕企業社,臺北市北投區富貴一路5巷12號1樓,日常用品批發業
19526434,加新五金行,臺北市文山區木柵路1段66之8號,日常用品批發業
04905020,東盟服務社,臺北市中山區新生北路1段65之3號,日常用品批發業
38566104,羅亭企業社,臺北市中正區許昌街42之1號10樓,日常用品批發業
48950232,圓滿國際企業社,臺北市萬華區成都路110號10樓之6,日常用品批發業
02363457,駿宏企業社,臺北市信義區忠孝東路5段1之10號11樓,日常用品批發業
10304740,圓彩廣告印刷企業社,臺北市信義區基隆路1段155號13樓之5,日常用品批發業
48812718,郁登美麗工坊,臺北市松山區南京東路5段8號6樓,日常用品批發業
26187775,向騰企業社,臺北市內湖區瑞湖街103號3樓,日常用品批發業
38575482,日連百貨文具行,臺北市中山區中山北路2段96巷52號1樓,日常用品批發業
14317107,亞森行,臺北市中山區長安東路1段28號,日常用品批發業
48558574,梅門養生館,臺北市中正區延平南路87號地下,日常用品批發業
29231825,巴菲特文化事業社,臺北市大安區忠孝東路4段221號12樓,日常用品批發業
38568335,寶旺精品店,臺北市中山區復興北路94號1樓,日常用品批發業
48782215,富宏商行,臺北市中正區館前路6號8樓之5,日常用品批發業
31864677,亞洲混樂企業社,臺北市大同區南京西路370號3樓,日常用品批發業
