38566955,天樂創意行銷工作室,臺北市中山區中山北路1段92號8樓,日常用品批發業
21704194,源進洋行,臺北市大同區太原路47號〈1樓〉,日常用品批發業
31865036,健瑛行,臺北市中山區民生東路1段25號6樓之24,日常用品批發業
31955424,享咖啡企業社,臺北市大安區仁愛路4段71巷9號(1樓),日常用品批發業
38562070,宇通企業社,臺北市中山區中山北路3段27號12樓之1,日常用品批發業
48896414,九象限顧問展業社,臺北市大安區忠孝東路4段162號10樓之2,日常用品批發業
26360248,美樂客企業社,臺北市信義區雙和里吳興街284巷59弄2號4樓,日常用品批發業
31951356,陳楠倉企業社,臺北市中山區民生東路1段42號7樓之8,日常用品批發業
38568150,生命之樹美妝工作室,臺北市大安區忠孝東路4段221號10樓,日常用品批發業
41366283,正德興業,臺北市大同區承德路2段83之2號,日常用品批發業
38562199,納米社,臺北市中山區八德路2段288號1樓,日常用品批發業
49986510,宏記洋行,臺北市大同區重慶北路1段67號8樓之2,日常用品批發業
77138989,鄉村茶莊,臺北市萬華區康定路25巷3號1樓,日常用品批發業
25554421,精彩商行,臺北市中山區中山北路2段72巷28號2樓,日常用品批發業
48677446,華達國際企業社,臺北市松山區八德路2段374號7樓,日常用品批發業
31870805,米哇企業社,臺北市信義區永吉路170號12樓,日常用品批發業
25577803,分享工房,臺北市內湖區星雲街168巷43號3樓之1,日常用品批發業
26253562,鑫漾美妝企業社,臺北市內湖區東湖路106巷8號3樓,日常用品批發業
18392942,金威揚科技水生活館,臺北市信義區莊敬路341巷4弄22號,日常用品批發業
48725003,聯璨商行,臺北市松山區民生東路5段79號1樓,日常用品批發業
31874422,闊喜工房,臺北市信義區基隆路2段22號6樓之6,日常用品批發業
31709943,京站支付企業社,臺北市中山區松江路207號9樓,日常用品批發業
14310441,冠?企業社,臺北市內湖區內湖路1段411巷92號1樓,日常用品批發業
31862410,角落工作室,臺北市松山區南京東路3段285號7樓,日常用品批發業
38568659,依莉企業社,臺北市大同區承德路2段215號3樓之4,日常用品批發業
31853469,有鈞國際貿易企業社,臺北市中山區林森北路85巷39號6樓,日常用品批發業
26218860,順成木材行,臺北市萬華區長沙街2段174號,日常用品批發業
26346865,老三布莊,臺北市大同區西寧北路81號,日常用品批發業
31872206,北極熊系統家居實業社,臺北市文山區興隆路1段123號,日常用品批發業
38508273,臻韓服飾店,臺北市中山區天津街56之19號,日常用品批發業
10344124,瑞海行銷企業社,臺北市中山區錦州街278號4樓之1,日常用品批發業
48721392,永昇五金行,臺北市大安區四維路154巷11號1樓,日常用品批發業
10315296,豐樺企業社,臺北市萬華區東園街28巷50號地下1樓之1,日常用品批發業
09644691,禾力實業社,臺北市信義區基隆路1段155號13樓之5,日常用品批發業
26341334,月之耀咖啡坊,臺北市士林區中山北路6段450巷26號1樓,日常用品批發業
38513493,三富行企業社,臺北市松山區八德路2段374號7樓,日常用品批發業
10350130,歡喜商行,臺北市中山區吉林路133號,日常用品批發業
09693637,盈鑫國際商行,臺北市北投區文林北路244巷66號1樓,日常用品批發業
31109933,國堡紙品行,臺北市大同區哈密街59巷56弄8號1樓,日常用品批發業
10948927,右岱文創工作室,臺北市中山區松江路362巷2號2樓,日常用品批發業
31956140,達鑽商行,臺北市中山區民生東路3段1號3樓,日常用品批發業
38580160,鑫煜企業社,臺北市中山區八德路2段100號10樓之2,日常用品批發業
48967590,邦碩商行,臺北市中山區復興北路48號3樓,日常用品批發業
48782469,手牽手創意思考工作室,臺北市大安區安和路1段11號5樓,日常用品批發業
38512446,劼磊工作室,臺北市中山區南京東路3段189號4樓,日常用品批發業
31872487,怡合行,臺北市大安區金華街207號,日常用品批發業
26237698,宇宙網企業社,臺北市大安區大安路1段31巷20號,日常用品批發業
26342116,健宸企業社,臺北市松山區八德路4段709巷2之3號1樓,日常用品批發業
26349883,珍妃咖啡坊,臺北市中正區羅斯福路3段88號,日常用品批發業
31954240,冠磊商行,臺北市北投區泉源路28號地下樓,日常用品批發業
38512261,秘密衣櫥工作室,臺北市中山區龍江路342巷27號,日常用品批發業
31954826,東津甫企業社,臺北市內湖區大湖街137號,日常用品批發業
42268660,柱姐工坊,臺北市中正區臨沂街44巷3號1樓,日常用品批發業
31954662,承臻商行,臺北市內湖區內湖路2段322號,日常用品批發業
25556125,九久商號,臺北市大安區永康街41巷26號,日常用品批發業
26362920,風之花園雜貨坊,臺北市北投區大興街17號,日常用品批發業
31962918,富林企業管理社,臺北市南港區興華路30巷11號,日常用品批發業
20964896,來來五金行,臺北市松山區基隆路1段1號,日常用品批發業
38459809,四月雨咖啡館,臺北市大安區忠孝東路4段216巷40弄18號1樓,日常用品批發業
48991748,邑瑄企業社,臺北市士林區美崙街114號1樓,日常用品批發業
31876081,拾璞工坊,臺北市中山區中山北路2段11巷11號之1,日常用品批發業
26254106,台灣精品生活館,臺北市中山區民生東路1段25號5樓之23,日常用品批發業
26251419,業欣冷氣行,臺北市萬華區德昌街147巷1號4樓,日常用品批發業
01726305,欣欣美材精品店,臺北市北投區石牌路2段68巷1號,日常用品批發業
31961586,天帝企業社,臺北市中山區新生北路2段45巷27號,日常用品批發業
99230378,慨汶企業商號,臺北市信義區吳興街600巷76弄143號2樓之2,日常用品批發業
09959333,熙葆企業行,臺北市大安區辛亥路2段121號2樓,日常用品批發業
98882457,承洋商行,臺北市北投區致遠一路2段30號1樓,日常用品批發業
31874703,文琳企業社,臺北市萬華區西寧南路36號5樓之17,日常用品批發業
48967584,柏帝工程行,臺北市文山區興隆路3段32號,日常用品批發業
17742040,貴清企業社,臺北市中山區建國北路2段258巷33號4樓,日常用品批發業
15668754,振加企業行,臺北市中山區長安東路2段75號1樓,日常用品批發業
38500770,枕戈待旦商行,臺北市中山區興安街93號,日常用品批發業
48954906,耕圃工程行,臺北市中山區民權東路2段26號6樓之1,日常用品批發業
31845659,雅緹行,臺北市北投區實踐街33號1樓,日常用品批發業
26339885,華謙企業社,臺北市松山區八德路3段212號8樓,日常用品批發業
13696072,隆鑫服裝行,臺北市信義區松隆路282之1號,日常用品批發業
98911690,綺足坊商行,臺北市中山區林森北路50號4樓之9,日常用品批發業
38569828,中美五金行,臺北市信義區吳興街220巷77號1樓,日常用品批發業
25582496,豆粒通信行,臺北市信義區莊敬路357號,日常用品批發業
31951102,拎咖啡複合式餐飲,臺北市南港區南港路2段25號,日常用品批發業
21501965,新一企業社,臺北市萬華區漢中街171巷5號,日常用品批發業
31875506,鎧葳鞋行,臺北市北投區中央南路1段32號,日常用品批發業
25573308,藝饗天地設計工作室,臺北市文山區木新路2段181號,日常用品批發業
31442109,酷鎷企業工作坊,臺北市中正區北平東路24號2樓之5,日常用品批發業
25550874,三十堂商行,臺北市文山區辛亥路4段166巷10號2樓,日常用品批發業
73899451,路斯企業商行,臺北市中山區南京東路3段118號6樓之2,日常用品批發業
10528122,?洋家電精品行,臺北市中山區民權東路3段21號5樓,日常用品批發業
38580611,歡喜樓商行,臺北市大安區新生南路3段2號10樓,日常用品批發業
31860320,穎佳商號,臺北市南港區富康街72巷2號1樓,日常用品批發業
26235072,心月精品館,臺北市信義區基隆路1段398號8樓,日常用品批發業
31868569,耶和華生技企業社,臺北市內湖區星雲街138巷20號6樓,日常用品批發業
48684782,誠實商行,臺北市內湖區東湖路25號1樓,日常用品批發業
25543728,信凱企業社,臺北市中山區中山北路3段30號3樓之3,日常用品批發業
15635488,嘉年長鴻企業社,臺北市文山區政大二街98號3樓,日常用品批發業
99626759,天恩企業社,臺北市中山區長春路215號2樓,日常用品批發業
31867029,甘丹企業社,臺北市信義區松德路65號11樓之2,日常用品批發業
78493162,高欣電氣行,臺北市中山區吉林路161巷11號之1、1樓,日常用品批發業
25578319,年豐企業社,臺北市士林區永平街25巷6號4樓,日常用品批發業
42270440,佑駪工作室,臺北市文山區忠順街2段30號6樓,日常用品批發業
38515210,詠大商行,臺北市文山區下崙路28巷5號4樓,日常用品批發業
25551732,芳子時尚商行,臺北市文山區景興路188號8樓之14,日常用品批發業
41071577,仟虹國際廣告贈品行,臺北市大安區羅斯福路3段335號12樓之1,日常用品批發業
38564942,磊飛國際企業社,臺北市文山區萬盛街146巷1號,日常用品批發業
26371694,益州國際企業社,臺北市松山區八德路3段210號11樓,日常用品批發業
26363218,玻爾鬆餅舖,臺北市萬華區成都路19號,日常用品批發業
83940155,湧勝企業社,臺北市士林區中正路635巷2號7樓,日常用品批發業
25572434,雅仕生活工作室,臺北市北投區杏林二路57號3樓,日常用品批發業
25556862,茉莉國際企業社,臺北市北投區文林北路284巷2號1樓,日常用品批發業
38462071,達育企業社,臺北市中山區興安街51之8號1樓,日常用品批發業
38513613,源榕五金行,臺北市大同區延平北路2段60巷9號1樓,日常用品批發業
38503994,皂映工作室,臺北市中正區忠孝西路1段50號20樓之4,日常用品批發業
25668281,富家企業,臺北市中正區館前路6號7樓,日常用品批發業
48807980,金齊企業社,臺北市大安區忠孝東路4段235號11樓,日常用品批發業
31878623,聯聖企業社,臺北市內湖區民權東路6段123巷28號6樓之2,日常用品批發業
21762341,大都會工程行,臺北市萬華區中華路2段150巷15號1樓,日常用品批發業
26350776,泰達實業行,臺北市北投區中山路47號5樓,日常用品批發業
01847835,雙傑行,臺北市士林區德行東路331巷50弄4號1樓,日常用品批發業
07639172,萬佳五金行,臺北市大同區敦煌路66號1樓,日常用品批發業
31863277,寬盈紙製品行,臺北市萬華區中華路2段132巷26號1樓,日常用品批發業
13478343,藝飾布藝企業社,臺北市信義區基隆路1段155號7樓,日常用品批發業
25663737,希也樂國際企業社,臺北市松山區塔悠路292號,日常用品批發業
26348717,絜絲工作坊,臺北市信義區松隆路102號16樓,日常用品批發業
31832227,鉅鎧商行,臺北市信義區林口街27號,日常用品批發業
37912417,行義企業社,臺北市北投區石牌路2段357巷1號1樓,日常用品批發業
14341444,喬豐商行,臺北市大安區信義路2段228巷15弄3號4樓,日常用品批發業
10381817,欣居傢俱行,臺北市大安區文昌街160號2樓,日常用品批發業
99993136,魔椅商行,臺北市大安區青田街1巷6號,日常用品批發業
48852204,晞臘室內裝修設計工作室,臺北市內湖區陽光街92巷24弄17號,日常用品批發業
31848163,太豐企業社,臺北市松山區南京東路4段197號7樓,日常用品批發業
17977812,東禧日用品社,臺北市松山區八德路4段650號6樓之20,日常用品批發業
38576172,舞丰企業社,臺北市松山區民生東路5段169號15樓之4,日常用品批發業
30985287,幸安五金建材行,臺北市大安區忠孝東路3段217巷4弄1之1號1樓,日常用品批發業
78413800,大地工程行,臺北市中山區中山北路2段128巷3之3號(1樓),日常用品批發業
31878243,傑彥國際企業社,臺北市大安區忠孝東路4段2號9樓之10,日常用品批發業
10308979,茂鑄國際商行,臺北市中山區德惠街34號4樓之13,日常用品批發業
38461848,瑞福祥實業社,臺北市內湖區成功路3段81號5樓,日常用品批發業
26246232,可祥實業社,臺北市中山區北安路548之1號,日常用品批發業
38574527,哈寶國際商行,臺北市大安區忠孝東路4段59號10樓之2,日常用品批發業
25538540,富裕五金行,臺北市萬華區環河南路1段42號21號攤位,日常用品批發業
25557356,上豪五金生活百貨館,臺北市士林區華榮街79號,日常用品批發業
38497634,渢格眼鏡行,臺北市文山區木新路2段271號1樓,日常用品批發業
25581031,立勝億行,臺北市萬華區廣州街156號(地下1樓),日常用品批發業
25517876,迦蓮國際商行,臺北市大同區酒泉街159號1樓,日常用品批發業
83911124,城市記號創意行銷工作室,臺北市萬華區昆明街96巷15號,日常用品批發業
48820098,鉅曜國際商號,臺北市大同區承德路1段32號9樓,日常用品批發業
26229183,金潮眼鏡行,臺北市大安區金山南路2段148號1樓,日常用品批發業
26219586,茱茱童裝屋,臺北市大安區敦化南路2段11巷38弄6號4樓之2,日常用品批發業
25575713,岩松商店,臺北市大安區仁愛路3段160號,日常用品批發業
31845187,家宏百貨行,臺北市南港區中坡南路27號,日常用品批發業
48880200,萬事通商行,臺北市士林區美德街74號,日常用品批發業
26211199,均茂企業社,臺北市萬華區環河南路2段222號3樓,日常用品批發業
38472654,夏米爾企業社,臺北市南港區成福路194巷6號5樓之1,日常用品批發業
26235050,記得商行,臺北市中山區大直街106號1樓,日常用品批發業
94904830,上意企業行,臺北市大同區環河北路1段103號9樓,日常用品批發業
25574088,金億發行,臺北市中山區雙城街21號2樓,日常用品批發業
48903301,弘翔國際商行,臺北市中山區雙城街18巷12號,日常用品批發業
48778161,翔泰國際商行,臺北市大同區哈密街68巷3號,日常用品批發業
14745543,宏丞實業社,臺北市中山區民權東路2段133號2樓,日常用品批發業
31951840,富美家企業社,臺北市南港區南港路3段225號3樓,日常用品批發業
38562819,鼎龍企業社,臺北市士林區社中街426巷17號2樓,日常用品批發業
31957247,福冠企業行,臺北市北投區中和街245號,日常用品批發業
99990378,新響工程行,臺北市大安區復興南路1段107巷5弄19之1號1樓,日常用品批發業
26255766,麒麟水族設計企業社,臺北市松山區民權東路5段54號1樓,日常用品批發業
38505135,容揚企業社,臺北市內湖區成功路4段12號2樓,日常用品批發業
38495495,全和商行,臺北市松山區塔悠路215號4樓,日常用品批發業
13903966,天雅藝術館,臺北市信義區松德路65號11樓之2,日常用品批發業
38579473,呈真企業社,臺北市大同區南京西路163號2樓之81,日常用品批發業
14871301,韓多企業社,臺北市中山區林森北路536號7樓之5,日常用品批發業
14341486,群宇企業社,臺北市文山區福興路86號4樓,日常用品批發業
38511586,指娃娃美甲工坊,臺北市中山區永安里北安路518巷14弄19號,日常用品批發業
26343683,朋騏企業社,臺北市內湖區康寧路3段99巷17弄10號3樓,日常用品批發業
26232981,萱柏商行,臺北市大安區仁愛路4段266巷15弄16號2樓,日常用品批發業
38572788,茂榮企業社,臺北市文山區木新路2段3號7樓,日常用品批發業
26243360,少華洋行,臺北市大安區麗水街9巷13號,日常用品批發業
38573013,稻禾米糧文創工作室,臺北市北投區溫泉路68巷24號4樓之1,日常用品批發業
38464520,寧斯朵兒企業社,臺北市內湖區內湖路2段150之1號,日常用品批發業
25552649,深淩企業社,臺北市松山區八德路2段441號2樓,日常用品批發業
27159559,天韻社,臺北市士林區通河東街1段94號,日常用品批發業
26369281,香蒂商行,臺北市大安區潮州街84之2號,日常用品批發業
99329391,盛元香品商行,臺北市北投區公館路67號1樓,日常用品批發業
38507041,津語商行,臺北市內湖區成功路5段442之1號,日常用品批發業
26341545,濮合元實業社,臺北市松山區三民路107巷10號2樓,日常用品批發業
38467792,汎羽設計工作室,臺北市中山區龍江路155巷11號6樓之1,日常用品批發業
48896842,世界光企業社,臺北市大安區文昌街228號,日常用品批發業
26213555,佳豐富食品行,臺北市大同區甘州街44之1號,日常用品批發業
99981011,飛騰企業行,臺北市大同區迪化街2段172巷15號,日常用品批發業
09837563,潔力欣商行,臺北市信義區吳興街518巷10號2樓,日常用品批發業
10304713,宇鈿科技企業社,臺北市大同區民族西路31巷36號,日常用品批發業
01638083,立德機械五金行,臺北市內湖區新明路125號(1樓),日常用品批發業
48799412,佳鎂洋行,臺北市士林區中正路501號16樓,日常用品批發業
25560789,翰倫商行,臺北市松山區南京東路3段346之1號8樓,日常用品批發業
31877286,黃楊企業社,臺北市文山區興隆路3段207巷5弄1號2樓,日常用品批發業
38468835,綵葳服飾精品店,臺北市松山區民生東路5段212巷11號1樓,日常用品批發業
37896253,星月文創工作室,臺北市松山區延吉街51號(1樓),日常用品批發業
38474338,靖勝五金行,臺北市大同區太原路50之2號3樓,日常用品批發業
01383048,利榮五金行,臺北市北投區自強街5巷71號1樓,日常用品批發業
38459483,優英實業社,臺北市南港區舊莊街1段145巷6弄18號,日常用品批發業
38514562,青果園鮮萃飲品企業社,臺北市大安區和平東路1段159之2號,日常用品批發業
38469124,興融興企業社,臺北市內湖區成功路2段486巷4號10樓,日常用品批發業
38554542,錦上花國際企業社,臺北市松山區塔悠路81號8樓之3,日常用品批發業
38559899,珈蒂斯美學工作室,臺北市大安區復興南路1段3號2樓,日常用品批發業
26367468,凱興行,臺北市萬華區中華路2段364巷24弄28號,日常用品批發業
26230034,小松傢俱行,臺北市萬華區長沙街2段103號1樓,日常用品批發業
94904965,元豐免洗餐具商行,臺北市大同區重慶北路3段257巷17號1樓,日常用品批發業
21764220,富騰企業社,臺北市中山區松江路160巷2號1樓,日常用品批發業
26194092,策略家整合行銷社,臺北市中山區天祥路48巷5號,日常用品批發業
31844672,御品妍企業社,臺北市中正區重慶南路1段57號13樓之5,日常用品批發業
18093418,子宇影像工作室,臺北市松山區八德路4段403之3號,日常用品批發業
21720461,富樂商行,臺北市大安區信義路2段230號8樓之2,日常用品批發業
26251966,魯斯傢俱,臺北市中山區中山北路2段26巷15之1號,日常用品批發業
38498508,雅東服飾店,臺北市士林區大南路34之1號1樓,日常用品批發業
38569051,漾寶貝生活館,臺北市松山區南京東路4段17號8樓之5,日常用品批發業
13849339,合記茶行,臺北市大同區長安西路99號,日常用品批發業
48694901,慶益機電工程材料行,臺北市中山區復興北路488巷1弄11號1樓,日常用品批發業
25570421,珩泰創意工作室,臺北市信義區忠孝東路5段236巷3弄25號3樓,日常用品批發業
78413800,大地工程行,臺北市中山區中山北路2段128巷3之3號(1樓),日常用品批發業
17531087,福貴企業社,臺北市大同區迪化街2段172巷15號,日常用品批發業
31709943,京站支付企業社,臺北市中山區松江路207號9樓,日常用品批發業
38508999,英捷百貨商行,臺北市中山區中山北路1段33巷3號2樓,日常用品批發業
19870787,雅信服裝社,臺北市中山區中山北路2段72巷28號2樓,日常用品批發業
26223316,實鵬服飾行,臺北市萬華區環河南路1段123號3樓,日常用品批發業
26353099,博科數位企業社,臺北市萬華區德昌街7巷15號,日常用品批發業
99427549,旭翔企業社,臺北市中山區松江路402巷26號3樓,日常用品批發業
38556979,和亞商行,臺北市中山區林森北路50號4樓之3,日常用品批發業
38465458,美傑洋行,臺北市中山區農安街13之2號2樓,日常用品批發業
29231825,巴菲特文化事業社,臺北市大安區敦化南路2段1號10樓,日常用品批發業
48963790,台品企業社,臺北市松山區民生東路5段165號8樓之3,日常用品批發業
17756901,順旺商行,臺北市北投區自強街141巷15號,日常用品批發業
21710837,至宇商行,臺北市士林區中山北路5段811巷6號2樓,日常用品批發業
48832186,百林國際商行,臺北市士林區天母北路87巷1號2樓,日常用品批發業
31861263,鴻頂安防實業社,臺北市大同區哈密街83巷1號3樓,日常用品批發業
38501898,穩菖實業社,臺北市中山區建國北路2段85號5樓,日常用品批發業
48718241,家樂企業社,臺北市信義區松隆路20號3樓,日常用品批發業
80990291,美華麗精品百貨行,臺北市中山區南京西路2號1樓,日常用品批發業
38505156,柯威企業社,臺北市中山區南京東路2段137號14樓,日常用品批發業
31847312,安柏琳工作室,臺北市信義區光復南路415巷40號,日常用品批發業
26215414,意龍發企業社,臺北市萬華區長順街14巷1弄18號3樓,日常用品批發業
73891211,尚鼎企業社,臺北市南港區忠孝東路6段320號4樓,日常用品批發業
25551705,祥太企業社,臺北市大同區長安西路180號9樓之1,日常用品批發業
38568320,齊捷精品店,臺北市大安區和平東路2段51號1樓、53巷2號1樓,日常用品批發業
38509245,亮亮企業社,臺北市中山區建國北路2段33號10樓之5,日常用品批發業
14740420,日益工作室,臺北市內湖區康寧路3段75巷272號2樓,日常用品批發業
26238731,朋友工作室,臺北市文山區福興路78巷20弄13號2樓,日常用品批發業
26213197,毯佳企業社,臺北市中山區長安東路2段94號2樓,日常用品批發業
17766582,盧森堡企業社,臺北市萬華區桂林路143號11樓,日常用品批發業
29200870,世紀企業社,臺北市中正區漢口街1段31號4樓,日常用品批發業
83930451,以琳國際洋行,臺北市士林區中山北路6段474號1樓,日常用品批發業
38564020,立拓點和食館,臺北市信義區基隆路1段155號12樓之6,日常用品批發業
13466183,世界叢林寵物用品店,臺北市萬華區和平西路3段7號1樓,日常用品批發業
31952117,沐品實業社,臺北市士林區臺北市士林區前街25號,日常用品批發業
31716331,微笑實業,臺北市北投區三合街2段489號,日常用品批發業
15639267,瞳鏡眼鏡行,臺北市大安區忠孝東路3段136號10樓之3,日常用品批發業
31858788,飛登國際商行,臺北市大同區承德路1段32號12樓之12,日常用品批發業
10352101,金萬億企業行,臺北市萬華區環河南路1段185號,日常用品批發業
10332801,菲比國際行銷社,臺北市信義區基隆路2段189號5樓之4,日常用品批發業
38506731,觀自在商行,臺北市松山區民權東路3段136號6樓之9,日常用品批發業
31953875,尚妍企業社,臺北市士林區大南路415號3樓,日常用品批發業
21717233,抱花戶手創花藝設計坊,臺北市中山區林森北路85巷2之1號3樓,日常用品批發業
98108602,泰一商行,臺北市中山區遼寧街138巷26號4樓,日常用品批發業
26256224,樂我洋行,臺北市中山區農安街255號1樓,日常用品批發業
10314894,立可明企業社,臺北市信義區信義路6段126之32號,日常用品批發業
25580130,健和藥萓,臺北市松山區饒河街251號,日常用品批發業
38462585,雨傘大王商行,臺北市萬華區武昌街2段56號,日常用品批發業
25563272,益群工作室,臺北市松山區南京東路5段251巷24弄20之1號2樓,日常用品批發業
73889427,您好國際商行,臺北市中山區民權西路20號9樓之7,日常用品批發業
73892582,毅玲商行,臺北市中山區民權西路20號10樓之10,日常用品批發業
99960965,雙龍食品行,臺北市萬華區成都路81號11樓之7,日常用品批發業
38576644,約書亞企業社,臺北市內湖區星雲街133號12樓之2,日常用品批發業
25543699,晶美百貨行,臺北市大同區鄭州路83巷9號,日常用品批發業
13848818,禮合企業社,臺北市萬華區寶興街80巷47號,日常用品批發業
38502518,星燁企業社,臺北市大安區臨江街104號,日常用品批發業
38513775,寶食商行,臺北市大同區重慶北路2段82號,日常用品批發業
27171815,大峰利商行,臺北市士林區德行東路109巷5號1樓,日常用品批發業
29227738,石碇公行,臺北市信義區林口街52巷31號1樓,日常用品批發業
38574857,趣味小屋工作室,臺北市士林區福國路5號3樓之1,日常用品批發業
38576855,秀真誠行,臺北市中正區齊東街82巷36號1樓,日常用品批發業
04206308,金祥珠寶藝品商行,臺北市中正區忠孝西路1段102號11樓,日常用品批發業
38570439,聖誕小姐企業社,臺北市大同區南京西路163號2樓之21,日常用品批發業
38562466,威騰企業社,臺北市大安區信義路2段72號地下,日常用品批發業
48982473,五嶺企業社,臺北市萬華區興寧街8巷8號3樓,日常用品批發業
38456465,瑩洲企業社,臺北市松山區民權東路3段160巷19弄27號,日常用品批發業
