48910274,萬客來養生館,臺北市中山區吉林路194號,歇業／撤銷,日常用品零售業
31354604,三尚商行,臺北市士林區士東路286巷3弄6號1樓,歇業／撤銷,日常用品零售業
98909836,傑而發企業社,臺北市松山區延吉街30巷3之1號,歇業／撤銷,日常用品零售業
38457437,天圓地方企業社,臺北市大安區信義路2段30號2樓,歇業／撤銷,日常用品零售業
48879442,臺基企業社,臺北市北投區公館路249號,核准設立,日常用品零售業
26353680,玉之林商行,臺北市大安區新生南路2段8號地下之21,核准設立,日常用品零售業
10376883,廣味食品行,臺北市松山區民生東路4段69號,核准設立,日常用品零售業
17093679,海豐行,臺北市中山區市民大道3段9號1樓,歇業／撤銷,日常用品零售業
29736177,阿進仔便利商店,臺北市士林區承德路4段58巷20號1樓,歇業／撤銷,日常用品零售業
26344450,馬乙叔餐飲企業社,臺北市內湖區安康路246號3樓,廢止,日常用品零售業
48787817,展瑚商行,臺北市北投區清江路79號1樓,核准設立,日常用品零售業
26253789,蜜糖盒子創意蛋糕館,臺北市中山區長春路17號6樓,核准設立,日常用品零售業
26237944,夏樹洋行,臺北市中山區南京東路2段115巷20-2號1樓,核准設立,日常用品零售業
10396754,金福興實業社,臺北市大安區師大路39巷4號,歇業／撤銷,日常用品零售業
48751825,豪記商行,臺北市松山區健康路16號,歇業／撤銷,日常用品零售業
26336959,紫氣軒,臺北市大同區平陽街23號,核准設立,日常用品零售業
81629874,昌展雄服飾行,臺北市萬華區峨眉街44號1樓,核准設立,日常用品零售業
94909716,三宅美繪行,臺北市中正區南昌路1段36號1樓,歇業／撤銷,日常用品零售業
25573285,尤佳利企業社,臺北市北投區吉利街106巷1號4樓,歇業／撤銷,日常用品零售業
31964330,微創藝工作室,臺北市大同區華陰街33號3樓之2,核准設立,日常用品零售業
98918645,亞世藍商店,臺北市大安區延吉街62巷10號1樓,歇業／撤銷,日常用品零售業
99345723,瑞鑫五金百貨行,臺北市北投區中和街263號1樓,核准設立,日常用品零售業
26213416,窩一窩咖啡商行,臺北市大安區復興南路1段107巷5弄15號,核准設立,日常用品零售業
48802649,實踐樂彩投注站,臺北市北投區知行路262號,歇業／撤銷,日常用品零售業
13473071,廣富商行,臺北市萬華區環河南路2段209號1樓,歇業／撤銷,日常用品零售業
48957137,威秀精品店,臺北市大安區大安路1段138號,歇業／撤銷,日常用品零售業
38572491,吉驪服裝行,臺北市大同區重慶北路1段22號地下之16、地下之15,核准設立,日常用品零售業
48811865,特億企業社,臺北市信義區永吉路71號8樓,歇業／撤銷,日常用品零售業
25577727,榛源茶坊永康分行,臺北市大安區金華街199巷1弄6號,核准設立,日常用品零售業
10387930,新易潔靈企業社,臺北市中山區民權東路3段21號5樓之1,廢止,日常用品零售業
48559068,耀運企業社,臺北市文山區羅斯福路5段144號4樓,歇業／撤銷,日常用品零售業
48940410,佳笙企業社,臺北市松山區南京東路5段250巷18弄27號,核准設立,日常用品零售業
48686711,薇多莉雅精品店,臺北市松山區南京東路5段277號1樓,核准設立,日常用品零售業
83940514,台灣鳥園,臺北市中正區重慶南路1段10號10樓,歇業／撤銷,日常用品零售業
48708898,米雅手工創意小舖,臺北市信義區基隆路1段149號7樓之1,廢止,日常用品零售業
25561422,小人物創意坊,臺北市大安區臨江街104號,歇業／撤銷,日常用品零售業
14747042,俊維企業社,臺北市中山區新生北路3段63之3號1樓,歇業／撤銷,日常用品零售業
48735950,賀拿餐坊,臺北市中山區中山北路1段105巷12之6號2樓,歇業／撤銷,日常用品零售業
98891977,元源食品行,臺北市中山區中原街79號1樓,歇業／撤銷,日常用品零售業
17526710,長溢商行,臺北市信義區嘉興街175巷2弄23號1樓,歇業／撤銷,日常用品零售業
31882226,繁體腦工作室,臺北市士林區天母北路26號1樓,停業,日常用品零售業
99977179,家慈商號,臺北市中山區北安路621巷4號1樓,歇業／撤銷,日常用品零售業
98894502,來來發企業社,臺北市士林區中正路342號1樓,歇業／撤銷,日常用品零售業
18403666,逸捷顧問社,臺北市南港區忠孝東路6段70巷20號1樓,歇業／撤銷,日常用品零售業
38463304,郭糖果時尚屋,臺北市文山區八德路3段199巷1弄2號(1樓),停業,日常用品零售業
99616725,德億環保生技企業社,臺北市中正區延平南路70號2樓之2,停業,日常用品零售業
25517860,德星企業社,臺北市松山區南京東路5段40號6樓之7,核准設立,日常用品零售業
48697576,小巧象禮品屋,臺北市信義區松山路540巷11號1樓,歇業／撤銷,日常用品零售業
99606374,魔鏡衣鋪,臺北市大安區敦化南路1段233巷54號1樓,歇業／撤銷,日常用品零售業
99335801,明道工作室,臺北市中山區南京東路3段189號4樓,核准設立,日常用品零售業
99622775,九益行,臺北市萬華區貴陽街2段117號1樓,歇業／撤銷,日常用品零售業
48871639,誠啟企業社,臺北市中正區汀州路2段38號地下,歇業／撤銷,日常用品零售業
26248581,永新水電行,臺北市北投區立農街2段269號1樓,核准設立,日常用品零售業
48931186,綺麗流行飾品坊,臺北市中正區羅斯福路4段138號,歇業／撤銷,日常用品零售業
26348189,太陽集購商行,臺北市大安區青田街13號1樓,核准設立,日常用品零售業
13441753,御綾企劃設計事務工作室,臺北市中山區建國北路1段67巷25號1樓,歇業／撤銷,日常用品零售業
26347822,瑤華閣商行,臺北市大安區新生南路2段8號地下之32,核准設立,日常用品零售業
48751944,大昌行,臺北市中山區民生東路1段30號地下,核准設立,日常用品零售業
30168785,快易烘企業社,臺北市北投區明德路5號2樓,歇業／撤銷,日常用品零售業
25654250,溫馨屋,臺北市大安區仁愛路4段345巷4弄24號1樓,核准設立,日常用品零售業
94908694,同泰洋行,臺北市中山區吉林路393巷2號,歇業／撤銷,日常用品零售業
48831270,義善修古藝坊,臺北市大同區哈密街111號,廢止,日常用品零售業
30247775,艾森豪諾耶企業社,臺北市大安區信義路3段147巷11弄19號,遷他縣市,日常用品零售業
48873756,賓漢商行,臺北市萬華區中華路2段412號,核准設立,日常用品零售業
99639776,澤程商行,臺北市文山區興隆路4段74巷21弄18號1樓,歇業／撤銷,日常用品零售業
48844042,對影髮廊,臺北市大安區仁愛路4段345巷4弄24號,歇業／撤銷,日常用品零售業
30134505,佳緯企業社,臺北市文山區久康街72巷3號2樓,核准設立,日常用品零售業
38502117,祥新車行,臺北市文山區羅斯福路6段237號,核准設立,日常用品零售業
25550662,雅馨行,臺北市中正區衡陽路112號,核准設立,日常用品零售業
21721709,吉品商行,臺北市萬華區康定路25巷33號3樓,歇業／撤銷,日常用品零售業
14732174,永光商行,臺北市士林區天母東路8巷82號1樓,歇業／撤銷,日常用品零售業
48995408,鴻年萃寶坊,臺北市中山區松江路330巷23號,歇業／撤銷,日常用品零售業
17768408,秘密花園三花店,臺北市文山區辛亥路5段31號1樓,歇業／撤銷,日常用品零售業
48979792,愛加倍奈米健康生活館,臺北市信義區基隆路1段378號,歇業／撤銷,日常用品零售業
98908956,大豐雅集舖,臺北市大安區忠孝東路4段181巷20號1樓,歇業／撤銷,日常用品零售業
48868424,愛佳生活百貨商行,臺北市士林區雨聲街55之1號,歇業／撤銷,日常用品零售業
26352394,展億企業社,臺北市萬華區康定路46巷6號,歇業／撤銷,日常用品零售業
25661225,盈華企業社,臺北市文山區景興路23巷6弄14號1樓,核准設立,日常用品零售業
98885052,順全成國際商行,臺北市大同區南京西路185巷7號4樓之1,歇業／撤銷,日常用品零售業
26338464,永豐金商行,臺北市大同區鄭州路21巷6號,核准設立,日常用品零售業
25547793,靜宜鴨莊,臺北市中正區金山南路1段134號,歇業／撤銷,日常用品零售業
26226828,信宏五金商行,臺北市士林區通河西街1段23號(1樓),歇業／撤銷,日常用品零售業
99966264,言藝文化工作室,臺北市信義區林口街226號1樓,歇業／撤銷,日常用品零售業
25532813,崇耀國際商行,臺北市文山區景後街95號8樓之4,核准設立,日常用品零售業
31958695,大玩家商行,臺北市中正區羅斯福路4段58號8樓,停業,日常用品零售業
38474891,石頭魚企業社,臺北市大安區通化街5號,核准設立,日常用品零售業
30968029,進益工藝品社,臺北市大安區和平東路3段378號1樓,歇業／撤銷,日常用品零售業
13464349,年代企業社,臺北市士林區社中街33巷6號,歇業／撤銷,日常用品零售業
48992090,摩力材料行,臺北市中山區天祥路48巷16號,歇業／撤銷,日常用品零售業
99633983,亞太開發企業社,臺北市中山區錦州街254號1樓,遷他縣市,日常用品零售業
48835206,米國帝咖啡館,臺北市信義區莊敬路182、184號,歇業／撤銷,日常用品零售業
42269801,思霈企業社,臺北市內湖區金湖路401巷34號,核准設立,日常用品零售業
98889557,慧釧休閒用品商行,臺北市中山區南京東路1段25號6樓之1,歇業／撤銷,日常用品零售業
99359319,小熊屋,臺北市信義區永吉路349號1樓,核准設立,日常用品零售業
81799770,真凰企業社,臺北市士林區中山北路5段680號2樓,歇業／撤銷,日常用品零售業
48971969,利眾國際商行,臺北市信義區林口街176之1號,遷他縣市,日常用品零售業
51042665,晉文號,臺北市大同區赤?街5號,歇業／撤銷,日常用品零售業
48713105,向日葵蜜餞糖果屋,臺北市士林區德行東路120號1樓,廢止,日常用品零售業
48724898,杉伍商行,臺北市內湖區內湖路1段437巷4弄2號,歇業／撤銷,日常用品零售業
15644542,美麗行,臺北市大安區忠孝東路4段216巷25號1樓,歇業／撤銷,日常用品零售業
48950649,茂璽商行,臺北市北投區中和街328號,核准設立,日常用品零售業
29205967,捷瑞商行,臺北市松山區八德路3段166號1樓,歇業／撤銷,日常用品零售業
25554674,銀月湖咖啡坊,臺北市北投區中央北路1段96號1樓,歇業／撤銷,日常用品零售業
31877618,咖樂烘豆企業社,臺北市大安區延吉街68之16號,核准設立,日常用品零售業
94914008,鑫豐商號,臺北市中正區泉州街95號1樓,核准設立,日常用品零售業
48979287,永靖企業社,臺北市文山區木柵路1段124號,核准設立,日常用品零售業
48672815,寶貝龍禮品屋,臺北市南港區玉成街66之8號1樓,歇業／撤銷,日常用品零售業
26339457,跳蚤王商行,臺北市大同區赤峰街49巷26號地下層,歇業／撤銷,日常用品零售業
17528772,伊甸商行,臺北市大安區和平東路2段38之1號1樓,歇業／撤銷,日常用品零售業
14333612,拾元小店,臺北市大安區臨江街102號1樓,核准設立,日常用品零售業
21701345,全人企業社,臺北市內湖區成功路4段61巷25弄1號1樓,歇業／撤銷,日常用品零售業
99956343,勝寶百貨行,臺北市大同區民族西路161號1樓,核准設立,日常用品零售業
04778122,華晃號,臺北市內湖區內湖路3段60巷12弄65號1樓,歇業／撤銷,日常用品零售業
48879338,派對世界商行,臺北市大同區太原路63號1至2樓,核准設立,日常用品零售業
10382999,富康活力藥菮,臺北市南港區研究院路1段101巷8號,核准設立,日常用品零售業
26243045,凱欣養生館,臺北市萬華區萬大路314號,核准設立,日常用品零售業
05153601,信忠實業社,臺北市中正區惠安街17號1樓,核准設立,日常用品零售業
38501150,李傑企業社,臺北市中正區漢口街1段110號8樓之12,核准設立,日常用品零售業
18410532,鮮之路蘆薈商行,臺北市中山區民權東路2段27號1樓,歇業／撤銷,日常用品零售業
14732293,合新商行,臺北市北投區光明路132之6號1樓,遷他縣市,日常用品零售業
48983022,經典藍標行,臺北市松山區南京東路4段133巷8弄1號,歇業／撤銷,日常用品零售業
31831629,蜂寶暢順行,臺北市中山區建國北路3段81巷11號,歇業／撤銷,日常用品零售業
31867294,南台灣虱目魚之家,臺北市松山區光復北路11巷56號,歇業／撤銷,日常用品零售業
48785228,紅彩商行,臺北市士林區天母東路50巷22之7號,歇業／撤銷,日常用品零售業
98890745,希悅工作室,臺北市萬華區長沙街2段133號1樓,核准設立,日常用品零售業
25666474,益康生活藥菮,臺北市中正區汀州路2段38號,核准設立,日常用品零售業
48827199,穩瀛利得生活用品館,臺北市南港區三重路67巷2弄11號1樓,遷他縣市,日常用品零售業
25537346,錢夫人實業社,臺北市內湖區內湖路2段315號,歇業／撤銷,日常用品零售業
48791621,寶貝兔服飾店,臺北市大安區大安路1段51巷34號,停業,日常用品零售業
38572725,安偲國際貿易行,臺北市松山區三民路136巷34號,歇業／撤銷,日常用品零售業
25573481,百分百愛不飾首百貨行,臺北市松山區八德路4段138號3樓,歇業／撤銷,日常用品零售業
13457001,女神創造花藝世界坊,臺北市中山區民權東路3段60巷14號1樓,核准設立,日常用品零售業
10336124,鍚金工程行,臺北市中正區重慶南路1段99號11樓之8,核准設立,日常用品零售業
38572942,恆亞企業社,臺北市中山區龍江路412巷17號2樓,核准設立,日常用品零售業
48872503,合芳美容坊,臺北市萬華區成都路67號8樓,廢止,日常用品零售業
31953087,水菏美妍工作室,臺北市內湖區江南街71巷47號,核准設立,日常用品零售業
14494877,八號書坊,臺北市信義區基隆路2段22號2樓,歇業／撤銷,日常用品零售業
14715251,喜樂鴿商行,臺北市文山區興隆路2段220巷39號1樓,歇業／撤銷,日常用品零售業
31846849,上豪企業社,臺北市中正區紹興北街8號3樓之3,核准設立,日常用品零售業
18086541,喬心實業社,臺北市信義區林口街38巷7號1樓,歇業／撤銷,日常用品零售業
12552816,周豪超級商店,臺北市中山區農安街269號1樓,歇業／撤銷,日常用品零售業
25566313,東益企業社,臺北市大安區瑞安街264巷2號2樓,停業,日常用品零售業
99634884,總舖師食品餐具總?行,臺北市士林區葫蘆街70巷11號1樓,核准設立,日常用品零售業
48947201,愛快淨商行,臺北市松山區民權東路3段191巷66號,歇業／撤銷,日常用品零售業
80998266,三禾五金百貨店,臺北市松山區饒河街247號1樓,核准設立,日常用品零售業
99613419,采瑄美材精品店,臺北市士林區大東路86之5號1樓,核准設立,日常用品零售業
10339733,智善工作室,臺北市大安區市民大道4段138號,歇業／撤銷,日常用品零售業
27168918,信琦商行,臺北市萬華區西園路2段157號1樓,歇業／撤銷,日常用品零售業
25503351,玖恩實業社,臺北市大安區復興南路2段277號3樓,歇業／撤銷,日常用品零售業
31961002,羅絲蔓花藝坊,臺北市內湖區康樂街136巷15弄43號5樓,核准設立,日常用品零售業
14323348,風采公益彩券行,臺北市信義區忠孝東路5段440號1樓,歇業／撤銷,日常用品零售業
38458132,群青日和生活事業,臺北市中山區大直街52巷3號1樓,核准設立,日常用品零售業
08557281,慶香食品行,臺北市松山區光復北路157號1樓,歇業／撤銷,日常用品零售業
26356194,育朋企業社,臺北市北投區中央北路1段68號地下,歇業／撤銷,日常用品零售業
25519852,省錢大作站生活百貨行,臺北市信義區虎林街132巷12號,核准設立,日常用品零售業
48851401,蜜提斯生活傢飾館,臺北市中正區南昌路1段50之3號,歇業／撤銷,日常用品零售業
38474512,永捷國際洋行,臺北市信義區吳興街524巷16弄2之1號(1樓),核准設立,日常用品零售業
17077299,僑憶家具室內設計工程行,臺北市內湖區江南街105號1樓,歇業／撤銷,日常用品零售業
18099476,賜福金企業社,臺北市士林區文昌路52號4樓,歇業／撤銷,日常用品零售業
14323369,琤穸禶~社,臺北市萬華區西寧南路36號之94，103,核准設立,日常用品零售業
83945193,康麗商行,臺北市南港區研究院路1段51號1樓,歇業／撤銷,日常用品零售業
27174480,益陞汽車百貨行,臺北市士林區至誠路2段126號1樓,歇業／撤銷,日常用品零售業
38494854,維娜精品服飾行,臺北市中正區寧波西街41號,核准設立,日常用品零售業
38577518,宇緻時尚造型工作室,臺北市萬華區漢中街133號7樓之1,核准設立,日常用品零售業
48743889,宏霖商行,臺北市大安區四維路170巷21號,歇業／撤銷,日常用品零售業
10302026,芙拉維企業社,臺北市大安區忠孝東路4段76號3樓之8,歇業／撤銷,日常用品零售業
25665762,奇檬子健康生活館,臺北市大安區和平東路2段96巷53號,歇業／撤銷,日常用品零售業
04296238,新南大藥房,臺北市大同區天水路67號1樓,核准設立,日常用品零售業
31964417,一書漫閱讀資訊館,臺北市大安區羅斯福路2段75號2樓,核准設立,日常用品零售業
01523300,義能行,臺北市南港區中坡北路40巷4號1樓,歇業／撤銷,日常用品零售業
31959483,必買商行,臺北市松山區復興北路223號3樓之1,核准設立,日常用品零售業
26355076,君儀行,臺北市南港區興中路12巷11號2樓,核准設立,日常用品零售業
38475060,若水藏館,臺北市中正區羅斯福路1段72巷1號1樓,歇業／撤銷,日常用品零售業
48796029,中大錢彩券行,臺北市南港區昆陽街79號,核准設立,日常用品零售業
17075497,貴族企業社,臺北市松山區南京東路5段399之1號,歇業／撤銷,日常用品零售業
25659142,寶靚時尚館,臺北市士林區大東路66號,核准設立,日常用品零售業
38564160,樂米企業社,臺北市中正區羅斯福路3段284巷9號1樓,核准設立,日常用品零售業
26346324,樂飴購?子洋行,臺北市松山區八德路3段155巷3號1樓,歇業／撤銷,日常用品零售業
83907249,水美商行,臺北市中山區松江路46巷8號1樓,歇業／撤銷,日常用品零售業
98918146,一加一五金百貨販賣店,臺北市北投區中央南路1段154號,歇業／撤銷,日常用品零售業
48875826,金星行,臺北市文山區興隆路4段72之1號,歇業／撤銷,日常用品零售業
17619338,鴻儷國際商行,臺北市信義區信義路4段413號11樓,歇業／撤銷,日常用品零售業
48854717,明聖企業社,臺北市北投區中和街273號2樓,核准設立,日常用品零售業
38473181,員第房企業社,臺北市中山區南京東路2段20號10樓之1,歇業／撤銷,日常用品零售業
53051232,東昇雜貨店,臺北市萬華區東園街280巷41弄20號1樓,歇業／撤銷,日常用品零售業
98893594,允晟企業社,臺北市內湖區民權東路6段296巷28之2號1樓,歇業／撤銷,日常用品零售業
99343437,禹勝企業社,臺北市中山區林森北路50號9樓之8,核准設立,日常用品零售業
38455304,瑞美企業社,臺北市中山區長安東路2段47之1號2樓,列入廢止中,日常用品零售業
26338078,倫爸商行,臺北市大同區重慶北路1段83巷16號,核准設立,日常用品零售業
18388068,吉嵐商行,臺北市中山區南京東路3段109巷9號1樓,停業,日常用品零售業
38462760,旺旺來商行,臺北市內湖區康樂街116號之3,核准設立,日常用品零售業
17763430,艾妮諾精品服飾店,臺北市大安區忠孝東路4段97號2樓之28,核准設立,日常用品零售業
26141286,博智企業社,臺北市萬華區西寧南路11號7樓之2,遷他縣市,日常用品零售業
14728452,聚朋園餐廳,臺北市中山區中山北路2段11巷16號1、2樓,廢止,日常用品零售業
26339301,愷欣工作室,臺北市大安區泰順街50巷27號,核准設立,日常用品零售業
14337440,欣佳商行,臺北市文山區興隆路3段185巷9弄2號1樓,歇業／撤銷,日常用品零售業
17262787,立旺膠業行,臺北市大同區華陰街175號1樓,廢止,日常用品零售業
99634499,欣樂商行,臺北市大安區臨江街87之6號,歇業／撤銷,日常用品零售業
18391697,泓光國際商行,臺北市南港區八德路4段869號地下之1,歇業／撤銷,日常用品零售業
48770689,掌生穀粒糧商號,臺北市信義區光復南路415巷182號,核准設立,日常用品零售業
14341388,寶鳳雜貨店,臺北市士林區承德路4段80巷2號1樓,核准設立,日常用品零售業
17264032,政廣食品行,臺北市大安區永康街6之5號1樓,歇業／撤銷,日常用品零售業
99974623,婕亞服裝材料行,臺北市大同區貴德街38號3樓,歇業／撤銷,日常用品零售業
31852089,玉全企業社,臺北市中山區南京東路2段8號2樓之1,核准設立,日常用品零售業
26249548,臨江日式創意料理小吃店,臺北市大安區臨江街141號,核准設立,日常用品零售業
81782834,芳誼服飾精品店,臺北市大安區信義路4段416號1樓,歇業／撤銷,日常用品零售業
99957687,一生貴族服飾店,臺北市中山區錦州街443號1樓,歇業／撤銷,日常用品零售業
26221099,大梁名店,臺北市大安區大安路1段206巷1號,核准設立,日常用品零售業
48904202,芮康飲料店,臺北市中山區松江路174號,歇業／撤銷,日常用品零售業
38576763,江南貿易行,臺北市中山區興安街42號,核准設立,日常用品零售業
21777695,美耀晶鑽精品店,臺北市中山區新生北路1段48號8樓,歇業／撤銷,日常用品零售業
48725616,寶屋生活創意坊,臺北市北投區實踐街80之2號,歇業／撤銷,日常用品零售業
81672983,活水居,臺北市大安區金華街243巷23號1樓,歇業／撤銷,日常用品零售業
38513521,臺灣法多賀經銷社,臺北市信義區基隆路1段176號13樓,停業,日常用品零售業
25662977,速呈企業社,臺北市中山區松江路28號11樓之3,遷他縣市,日常用品零售業
26519346,艾伶企業社,臺北市信義區忠孝東路5段1之8號5樓,核准設立,日常用品零售業
31867219,小菊子雜貨屋,臺北市內湖區內湖路2段103巷40號,歇業／撤銷,日常用品零售業
26237228,旭偉實業社,臺北市大同區南京西路262巷11號2樓,核准設立,日常用品零售業
25552182,鞏得理精品店,臺北市萬華區西寧南路72之1號5樓,歇業／撤銷,日常用品零售業
66979632,聯鑫通訊企業社,臺北市中山區松江路132巷5號,廢止,日常用品零售業
48953596,新農茶坊,臺北市中山區敬業一路56號,核准設立,日常用品零售業
48756504,景鑫寶石精品行,臺北市萬華區中華路1段18巷25號5樓之1,歇業／撤銷,日常用品零售業
38509300,卓昌商行,臺北市中山區民權東路3段17號1樓,核准設立,日常用品零售業
25550023,智誠企業社,臺北市信義區忠孝東路5段790巷47弄30號1樓,歇業／撤銷,日常用品零售業
21740826,方圓利商行,臺北市北投區大業路440號1樓,歇業／撤銷,日常用品零售業
94919806,奇倫服裝行,臺北市中山區伊通街102號1樓,歇業／撤銷,日常用品零售業
31861572,怡瑄商行,臺北市大安區龍泉街37號,停業,日常用品零售業
94905660,松安行,臺北市信義區莊敬路275號,核准設立,日常用品零售業
25553204,得仕洋行,臺北市大安區忠孝東路4段181巷35弄1號,核准設立,日常用品零售業
12381503,六福玻璃行,臺北市中山區民權東路525巷15之1號1樓,歇業／撤銷,日常用品零售業
31844379,金苑服飾店,臺北市大安區敦化南路1段161巷26號1樓,核准設立,日常用品零售業
14336104,透樂商行,臺北市中山區吉林路162號1樓,歇業／撤銷,日常用品零售業
14316178,廷玉企業社,臺北市中山區北安路595巷18號1樓,歇業／撤銷,日常用品零售業
48963594,富群企業社,臺北市文山區興隆路4段179巷11號,核准設立,日常用品零售業
48710281,麗鑫企業社,臺北市中山區林森北路100號12樓之1,歇業／撤銷,日常用品零售業
25664428,依恩商行,臺北市大安區臨江街39號,歇業／撤銷,日常用品零售業
31855234,金帛企業社,臺北市中山區北安路458巷11號,核准設立,日常用品零售業
13856318,柯斯莫商行,臺北市中山區中山北路3段51號之1、1樓,歇業／撤銷,日常用品零售業
30948066,昭鳳什貨店,臺北市大安區和平東路2段311巷41號1樓,歇業／撤銷,日常用品零售業
48819418,美麗元素時尚精品工作室,臺北市松山區八德路4段106巷2弄1號,歇業／撤銷,日常用品零售業
73918014,黃冠羽毛精品商行,臺北市中山區民權東路2段146號,核准設立,日常用品零售業
48743683,亞倫商行,臺北市內湖區新湖二路130號1樓,歇業／撤銷,日常用品零售業
48582194,維臻商行,臺北市大安區四維路76巷5號1樓,核准設立,日常用品零售業
25577352,約翰貿易茗茶行,臺北市士林區華齡街22巷5號4樓,停業,日常用品零售業
38512516,沛緁禮品商店,臺北市大安區泰順街40巷29號1樓,歇業／撤銷,日常用品零售業
80982644,源廣企業社,臺北市萬華區貴陽街2段120號4樓之3,歇業／撤銷,日常用品零售業
