25653885,菁品行,臺北市士林區大南路293號1樓,廢止,日常用品零售業
46024921,金華商店,臺北市中正區金華街51巷4號,歇業／撤銷,日常用品零售業
25521908,勁師企業社,臺北市松山區撫遠街399之1號,歇業／撤銷,日常用品零售業
38562579,群僖行士林分店,臺北市士林區文林路760之1號,廢止,日常用品零售業
14732462,中南海企業社,臺北市大安區忠孝東路3段247之1號9樓,歇業／撤銷,日常用品零售業
18387791,美澳企業社,臺北市大同區昌吉街61巷27號,廢止,日常用品零售業
81784354,雅穗服飾精品百貨行,臺北市中山區錦州街21號之3、1樓,歇業／撤銷,日常用品零售業
98883462,喜福商行,臺北市內湖區五分街37號,核准設立,日常用品零售業
13447454,逸軒茶藝館,臺北市中山區吉林路277號1樓,歇業／撤銷,日常用品零售業
38505135,容揚企業社,臺北市內湖區成功路4段12號2樓,核准設立,日常用品零售業
99981286,育慈佛教文物店,臺北市士林區葫蘆街30巷39號,遷他縣市,日常用品零售業
26347631,千川養生館,臺北市松山區健康路168號,核准設立,日常用品零售業
10339620,金一都國際開發企業社,臺北市萬華區武昌街2段82巷2號,核准設立,日常用品零售業
25658333,囍旺家商行,臺北市大同區重慶北路3段231號1樓,歇業／撤銷,日常用品零售業
94915610,購得易百貨行,臺北市中山區農安街257號1樓,歇業／撤銷,日常用品零售業
26341165,桔明商行,臺北市士林區承德路4段40巷153號,核准設立,日常用品零售業
31467895,萬安生技洋行,臺北市大安區復興南路1段137號8樓,歇業／撤銷,日常用品零售業
29240774,婕城國際企業商行,臺北市信義區和平東路3段509巷6號1樓,廢止,日常用品零售業
25541566,滿鑫行,臺北市中山區吉林路299巷7號,核准設立,日常用品零售業
17767267,威尼斯企業社,臺北市松山區民生東路5段49號1樓,歇業／撤銷,日常用品零售業
49934788,肆放創意工作室,臺北市大安區羅斯福路2段79號5樓之8,歇業／撤銷,日常用品零售業
31861411,丞卓服飾行,臺北市萬華區西寧南路70號3樓之33,核准設立,日常用品零售業
25662435,粉紅太陽精品屋,臺北市內湖區成功路4段30巷34號1樓,核准設立,日常用品零售業
80988561,冠辰商行,臺北市中山區中山北路3段25號11樓之1,遷他縣市,日常用品零售業
10382436,乙樂衣舖,臺北市大安區忠孝東路4段216巷19弄18號,歇業／撤銷,日常用品零售業
48835304,百喜企業社,臺北市中山區中山北路1段85號5樓,歇業／撤銷,日常用品零售業
94907132,仙女棒投注行,臺北市中正區寧波西街16號1樓,歇業／撤銷,日常用品零售業
48883868,尊賢商行,臺北市北投區尊賢街212號,歇業／撤銷,日常用品零售業
13473918,李汪商行,臺北市大同區延平北路3段47號1樓,歇業／撤銷,日常用品零售業
14326302,玉芳姿商行,臺北市士林區文林路502號1樓,歇業／撤銷,日常用品零售業
14328553,聯發企業行,臺北市大安區忠孝東路4段197號11樓之8,歇業／撤銷,日常用品零售業
99972977,君庭珠寶藝術坊,臺北市大安區忠孝東路4段216巷62號,核准設立,日常用品零售業
14728404,皇爵商行,臺北市中山區錦州街314號1樓,歇業／撤銷,日常用品零售業
99988372,禾康商行,臺北市大安區通化街143巷33號1樓,歇業／撤銷,日常用品零售業
26355202,多田商行,臺北市士林區文林路320號,歇業／撤銷,日常用品零售業
98883673,青昂精品店,臺北市大安區忠孝東路4段170巷5弄10號1樓,歇業／撤銷,日常用品零售業
38568551,貓艙日用品工作室,臺北市中山區明水路467號,核准設立,日常用品零售業
26343683,朋騏企業社,臺北市內湖區康寧路3段99巷17弄10號3樓,核准設立,日常用品零售業
14724580,介贊企業行,臺北市文山區萬隆街52巷5號1樓,歇業／撤銷,日常用品零售業
13847901,?喜行,臺北市中正區忠孝西路1段29巷9號1樓,歇業／撤銷,日常用品零售業
21713975,于狗彤形商行,臺北市內湖區民權東路6段198號1樓,核准設立,日常用品零售業
14743290,好日子便利商店,臺北市士林區中正路431號1樓,歇業／撤銷,日常用品零售業
38573013,稻禾米糧文創工作室,臺北市北投區溫泉路68巷24號4樓之1,核准設立,日常用品零售業
26348842,泰富宥養生館,臺北市萬華區昆明街107號,核准設立,日常用品零售業
21723679,全館企業社,臺北市萬華區萬大路422號1樓,核准設立,日常用品零售業
25582382,禾定豐商行,臺北市北投區中和街335號,核准設立,日常用品零售業
17766577,集集商行,臺北市大安區臨江街36號1樓,歇業／撤銷,日常用品零售業
26348940,勝堯實業社,臺北市中山區建國北路2段258巷33號4樓,歇業／撤銷,日常用品零售業
38464520,寧斯朵兒企業社,臺北市內湖區內湖路2段150之1號,核准設立,日常用品零售業
27192163,亞歷士國際商行,臺北市松山區南京東路5段291巷38弄13號,核准設立,日常用品零售業
25558910,城市莊園生活企業社,臺北市大安區臥龍街288號,歇業／撤銷,日常用品零售業
17617388,歐相精品服飾店,臺北市中山區撫順街39號1樓,歇業／撤銷,日常用品零售業
25552649,深淩企業社,臺北市松山區八德路2段441號2樓,核准設立,日常用品零售業
31865280,法柔四季企業社,臺北市大安區光復南路260巷25號,歇業／撤銷,日常用品零售業
17543605,宏梅藝術店,臺北市北投區清江路212之4號1樓,核准設立,日常用品零售業
31957154,象神花坊,臺北市中山區松江路133巷14號1樓,核准設立,日常用品零售業
48868655,燕子商行,臺北市北投區裕民二路41號,歇業／撤銷,日常用品零售業
26372568,澄原網路行銷企業社,臺北市松山區延壽街16號,遷他縣市,日常用品零售業
98889796,順雨的店,臺北市內湖區東湖路43巷16號之2、1樓,歇業／撤銷,日常用品零售業
10330584,方正商行,臺北市大安區羅斯福路2段79之1號,歇業／撤銷,日常用品零售業
27170891,建宏商號,臺北市大同區南京西路107巷46號1樓,核准設立,日常用品零售業
42271068,冠呈國際企業社,臺北市信義區基隆路2段33號12樓之2,核准設立,日常用品零售業
48725783,亞帝工程行,臺北市中山區建國北路3段113巷19弄13號,核准設立,日常用品零售業
15640270,丹尼爾時尚花藝工作室,臺北市信義區景雲街22之1號4樓,核准設立,日常用品零售業
25569304,鑫克萊兒國際商行,臺北市中山區遼寧街63巷16號,歇業／撤銷,日常用品零售業
94916272,慧晴企業社,臺北市松山區八德路3段12巷4弄11號,歇業／撤銷,日常用品零售業
13834552,日月發企業社,臺北市大同區天水路38號1樓,歇業／撤銷,日常用品零售業
94914669,雅姿登美容沙龍坊,臺北市信義區福德街310巷3號,歇業／撤銷,日常用品零售業
26341778,金章州企業社,臺北市大安區延吉街62巷5號1樓,停業,日常用品零售業
27158995,風華茶行,臺北市內湖區港墘路44號,歇業／撤銷,日常用品零售業
26369281,香蒂商行,臺北市大安區潮州街84之2號,核准設立,日常用品零售業
99329391,盛元香品商行,臺北市北投區公館路67號1樓,核准設立,日常用品零售業
17748614,台美國際商行,臺北市松山區健康路240號4樓,歇業／撤銷,日常用品零售業
48769634,富比士國際開發洋行,臺北市大安區和平東路3段85號1樓,歇業／撤銷,日常用品零售業
38507041,津語商行,臺北市內湖區成功路5段442之1號,核准設立,日常用品零售業
31320921,高端商行,臺北市北投區民族路76號4樓,遷他縣市,日常用品零售業
42269730,福興二手貨工作坊,臺北市文山區福興路74之4號,歇業／撤銷,日常用品零售業
13840365,心棋商行,臺北市大安區基隆路2段110號12樓,歇業／撤銷,日常用品零售業
48777825,欣正興食糧行,臺北市文山區興隆路2段19號,核准設立,日常用品零售業
48982311,華頓食品行,臺北市大安區忠孝東路4段181巷7弄3號,核准設立,日常用品零售業
13840891,荷康萊國際企業社,臺北市大安區忠孝東路4段166號4樓之2,歇業／撤銷,日常用品零售業
48896842,世界光企業社,臺北市大安區文昌街228號,核准設立,日常用品零售業
26213555,佳豐富食品行,臺北市大同區甘州街44之1號,核准設立,日常用品零售業
10396950,瑪尼朵企業社,臺北市中正區忠孝西路1段50號24樓之10,歇業／撤銷,日常用品零售業
21753223,寶樹企業社,臺北市松山區寶清街5號1樓,歇業／撤銷,日常用品零售業
98888804,迎綺企業社,臺北市大安區復興南路1段213號1樓,核准設立,日常用品零售業
29241416,福谷行,臺北市萬華區西園路1段145號﹝龍山寺地下街商場40號店舖﹞,歇業／撤銷,日常用品零售業
26230843,禾泰企業行,臺北市中正區重慶南路3段75號,核准設立,日常用品零售業
48747344,義式馬可咖啡坊,臺北市文山區一壽街16號1樓,歇業／撤銷,日常用品零售業
94916673,來客多商店,臺北市信義區永吉路470號1樓,核准設立,日常用品零售業
98901412,鉅瀚園藝資材行,臺北市文山區木新路3段232巷6弄15號1樓,停業,日常用品零售業
37797789,快潔屋企業社,臺北市萬華區內江街16號,核准設立,日常用品零售業
21714171,立盛企業社,臺北市中山區新生北路2段76巷37號1樓,歇業／撤銷,日常用品零售業
83930620,億連洗衣材料行,臺北市士林區承德路4段350號地下1樓,遷他縣市,日常用品零售業
48854630,愛力思生活坊,臺北市信義區信義路6段76巷2弄63號2樓,歇業／撤銷,日常用品零售業
48838371,吸游記商行,臺北市信義區崇德街103號,歇業／撤銷,日常用品零售業
18387407,偉蓉企業社,臺北市北投區石牌路2段68巷16號1樓,廢止,日常用品零售業
99620241,旺來商行,臺北市萬華區青年路76號1樓,歇業／撤銷,日常用品零售業
01638083,立德機械五金行,臺北市內湖區新明路125號(1樓),核准設立,日常用品零售業
13466058,蔓庭小吃店,臺北市松山區敦化北路165巷8號1樓,歇業／撤銷,日常用品零售業
48740481,捷芙花禮坊,臺北市大同區民族西路127號,核准設立,日常用品零售業
38500687,利崧商行,臺北市信義區文昌街331號,歇業／撤銷,日常用品零售業
83900695,緣園茶行,臺北市北投區大業路634號1樓,歇業／撤銷,日常用品零售業
18392268,晴艄禶~社,臺北市松山區光復北路98號1樓,歇業／撤銷,日常用品零售業
83906831,凡客服飾行,臺北市大安區忠孝東路4段97號2樓,廢止,日常用品零售業
25597224,千玉生活館,臺北市信義區忠孝東路5段355號11樓之7,歇業／撤銷,日常用品零售業
73908120,三個願望精品店,臺北市中正區中華路2段75巷17號4樓之3,歇業／撤銷,日常用品零售業
99975833,貝祈科技部品工作室,臺北市大安區忠孝東路4段295號3樓,遷他縣市,日常用品零售業
26222442,淳智企業社,臺北市內湖區民權東路6段180巷6號11樓之13,歇業／撤銷,日常用品零售業
12369698,宏昌機械布行,臺北市大安區安和路229號7樓,歇業／撤銷,日常用品零售業
21739948,友和商行,臺北市大同區南京西路103號2樓之10,歇業／撤銷,日常用品零售業
99954823,鄉村小鎮拼布工坊,臺北市大同區重慶北路2段207號7樓之1,歇業／撤銷,日常用品零售業
31851096,示一口田精緻涮涮鍋,臺北市中山區農安街269號,歇業／撤銷,日常用品零售業
01383048,利榮五金行,臺北市北投區自強街5巷71號1樓,核准設立,日常用品零售業
17745356,宏緯行,臺北市士林區德行東路233之1號1樓,歇業／撤銷,日常用品零售業
38560452,婕詩亞生活坊,臺北市中山區吉林路177號,歇業／撤銷,日常用品零售業
25559896,維也納家俱企業社,臺北市內湖區金湖路328之6號,停業,日常用品零售業
14326416,咖啡象店,臺北市大安區安和路1段49巷11號1樓,歇業／撤銷,日常用品零售業
26342657,珊蒂店,臺北市大同區錦西街53巷18號,核准設立,日常用品零售業
38469124,興融興企業社,臺北市內湖區成功路2段486巷4號10樓,核准設立,日常用品零售業
13835222,雙雙藍童裝行,臺北市中山區雙城街12之2號,歇業／撤銷,日常用品零售業
14740006,祥群行,臺北市松山區長春路219號2樓之2,歇業／撤銷,日常用品零售業
38554542,錦上花國際企業社,臺北市松山區塔悠路81號8樓之3,核准設立,日常用品零售業
31953100,雷甲企業社,臺北市大安區復興南路2段148巷39號,核准設立,日常用品零售業
38466597,艾提精品坊,臺北市萬華區武昌街2段56號,核准設立,日常用品零售業
26548742,琣w商行,臺北市大安區臨江街102之3號,停業,日常用品零售業
38497732,醇萃小時光咖啡館,臺北市中山區民權西路73號1樓,核准設立,日常用品零售業
26369091,鑫龍堂,臺北市大安區新生南路2段8號地下之36,核准設立,日常用品零售業
25537373,祥佑企業社,臺北市中正區羅斯福路4段136巷1弄5號,核准設立,日常用品零售業
48535600,八達企業社,臺北市大安區光復南路626號8樓之3,歇業／撤銷,日常用品零售業
99960965,雙龍食品行,臺北市萬華區成都路81號11樓之7,核准設立,日常用品零售業
04544032,欣欣行,臺北市中正區永春路30巷1弄15號,歇業／撤銷,日常用品零售業
25670456,東東雜貨舖,臺北市大同區南京西路64巷10弄6號,歇業／撤銷,日常用品零售業
48786535,金三芝五金百貨行,臺北市文山區景美街99號,核准設立,日常用品零售業
27153458,橘子貓精品百貨行,臺北市文山區仙岩路22巷2號1樓,歇業／撤銷,日常用品零售業
14342719,共識國際商行,臺北市文山區辛亥路1段46號,歇業／撤銷,日常用品零售業
38570634,安新生技企業社,臺北市大安區復興南路1段70號3樓之1,歇業／撤銷,日常用品零售業
80987606,海天自助洗衣店,臺北市文山區羅斯福路5段291號,核准設立,日常用品零售業
48867375,木偶之心商行,臺北市大安區忠孝東路4段216巷18號,歇業／撤銷,日常用品零售業
25669042,凱翎企業社,臺北市大安區復興南路2段285號,歇業／撤銷,日常用品零售業
08598852,明育商行,臺北市內湖區麗山街322號1樓,遷他縣市,日常用品零售業
38558337,彩虹花藝工作室,臺北市大安區建國南路2段123巷8號1樓,核准設立,日常用品零售業
25555603,光速映企業社,臺北市中正區重慶南路1段63號10樓之7,廢止,日常用品零售業
38559899,珈蒂斯美學工作室,臺北市大安區復興南路1段3號2樓,核准設立,日常用品零售業
38461333,柏夏瓦洋行,臺北市南港區興中路80巷10號1樓,核准設立,日常用品零售業
26367468,凱興行,臺北市萬華區中華路2段364巷24弄28號,核准設立,日常用品零售業
26230034,小松傢俱行,臺北市萬華區長沙街2段103號1樓,核准設立,日常用品零售業
38464697,龍鼎陳升號原生態大樹茶莊,臺北市萬華區艋舺大道204之3號,核准設立,日常用品零售業
38499540,奇地日貨專賣商店,臺北市中正區金華街43巷23號,核准設立,日常用品零售業
38465387,玖津商行,臺北市中正區南海路112號,歇業／撤銷,日常用品零售業
38468862,白金御廚實業社,臺北市內湖區成功路4段61巷37之1號,歇業／撤銷,日常用品零售業
31430976,碩錡國際企業社,臺北市文山區萬美街1段19巷1號2樓之2,歇業／撤銷,日常用品零售業
99956505,美士多美容社,臺北市松山區南京東路5段229號1、2樓,歇業／撤銷,日常用品零售業
18087746,廣譯戶工作室,臺北市大安區樂業街41巷22號,歇業／撤銷,日常用品零售業
83905777,大瑩商行,臺北市中山區新生北路2段74之84號9樓,核准設立,日常用品零售業
48770908,凱依工作室,臺北市北投區溫泉路37巷28號3樓之7,核准設立,日常用品零售業
83921256,洋洋免洗餐具行,臺北市萬華區西昌街68號1樓,核准設立,日常用品零售業
25521436,安?精品店,臺北市大安區忠孝東路4段216巷40弄18號,核准設立,日常用品零售業
48766664,和昌企業社,臺北市中山區復興北路86號6樓之1,歇業／撤銷,日常用品零售業
31844672,御品妍企業社,臺北市中正區重慶南路1段57號13樓之5,核准設立,日常用品零售業
25503578,茂盛企業社,臺北市大安區復興南路2段291號2樓,歇業／撤銷,日常用品零售業
26230105,城中戶外休閒用品店,臺北市中正區武昌街1段16巷10號1樓,核准設立,日常用品零售業
99358022,昇力士食品行,臺北市大安區復興南路1段279巷33之1號(1樓),歇業／撤銷,日常用品零售業
15665519,裕理實業社,臺北市信義區忠孝東路5段510號7樓之1,歇業／撤銷,日常用品零售業
48846908,全興佛具行,臺北市松山區八德路4段473號,核准設立,日常用品零售業
04722789,國祥商店,臺北市松山區八德路4段204巷6弄10號,歇業／撤銷,日常用品零售業
29238382,元氣金剛遊樂園,臺北市萬華區中華路1段144號地下1樓之66,歇業／撤銷,日常用品零售業
58063951,林慶榮什貨店,臺北市內湖區康樂街25號,歇業／撤銷,日常用品零售業
13849696,阿泉仔商行,臺北市北投區中和街292巷8號1樓,歇業／撤銷,日常用品零售業
81653965,杏林工作坊,臺北市大同區迪化街1段21號3樓永樂市場3094室,核准設立,日常用品零售業
25539941,祥榮企管企業社,臺北市中山區伊通街58號3樓,核准設立,日常用品零售業
38575504,雅思德企業社,臺北市中山區新生北路二段38號7樓之2,核准設立,日常用品零售業
26370098,捷登全商行,臺北市內湖區環山路2段53巷5弄2號1樓,歇業／撤銷,日常用品零售業
31866149,啤瓦多創意行銷商行,臺北市中正區金門街24巷35號,歇業／撤銷,日常用品零售業
49896567,勁勇建材五金行,臺北市南港區重陽路10號,核准設立,日常用品零售業
48922047,臻品緣企業社,臺北市中正區仁愛路2段89之1號,歇業／撤銷,日常用品零售業
25661870,兆群醫療器材行,臺北市大安區大安路1段169巷1號,核准設立,日常用品零售業
26233623,連樂商行,臺北市萬華區萬大路153號,歇業／撤銷,日常用品零售業
29215938,環璣商行,臺北市大同區承德路3段59號1樓,歇業／撤銷,日常用品零售業
26251966,魯斯傢俱,臺北市中山區中山北路2段26巷15之1號,核准設立,日常用品零售業
38498508,雅東服飾店,臺北市士林區大南路34之1號1樓,核准設立,日常用品零售業
25524948,寵僕美容工作坊,臺北市中山區長春路127號1樓,歇業／撤銷,日常用品零售業
26351894,綠地精品,臺北市大安區龍泉街93巷7號,歇業／撤銷,日常用品零售業
01320500,野風小吃店,臺北市中山區錦州街7之1號1樓,歇業／撤銷,日常用品零售業
17272379,喬洋企業社,臺北市內湖區康樂街20巷14弄5號1樓,遷他縣市,日常用品零售業
38569051,漾寶貝生活館,臺北市松山區南京東路4段17號8樓之5,核准設立,日常用品零售業
13849339,合記茶行,臺北市大同區長安西路99號,核准設立,日常用品零售業
48808849,泰皓企業社,臺北市大安區安和路1段29號11樓,歇業／撤銷,日常用品零售業
12129706,永安百貨行,臺北市中山區北安路476巷14號,核准設立,日常用品零售業
38474718,油桐花幸福手作工作室,臺北市南港區玉成街78號,核准設立,日常用品零售業
26235050,記得商行,臺北市中山區大直街106號1樓,核准設立,日常用品零售業
18089110,對應髮廊,臺北市大安區仁愛路4段151巷32號地下之1,歇業／撤銷,日常用品零售業
25660056,美奇飾商行,臺北市中正區忠孝西路1段50之1號3區15之4號店舖,歇業／撤銷,日常用品零售業
98882077,青森企業社,臺北市信義區松勤街6號6樓,歇業／撤銷,日常用品零售業
13820332,三記電業行,臺北市萬華區環河南路1段126號河濱公有市場第63號攤位,核准設立,日常用品零售業
48791495,立智行,臺北市士林區重慶北路4段201號,廢止,日常用品零售業
17746708,大登家居坊,臺北市士林區中山北路5段623號2樓,遷他縣市,日常用品零售業
48535186,甜蜜狗窩寵物用品屋,臺北市中正區汀州路1段256號1樓,核准設立,日常用品零售業
38561430,千盛商行,臺北市士林區德行東路13號(1樓),核准設立,日常用品零售業
38570711,全省禮贈品百貨行,臺北市信義區忠孝東路5段459號2樓之3,核准設立,日常用品零售業
31862495,真便宜商行,臺北市文山區福興路49號,歇業／撤銷,日常用品零售業
94911781,邑陽實業社,臺北市內湖區康樂街110巷11號5樓,遷他縣市,日常用品零售業
83911010,販得利百貨食品平價商行,臺北市中山區中原街137號,歇業／撤銷,日常用品零售業
81787423,聖利行,臺北市中山區民生東路1段37號3樓,歇業／撤銷,日常用品零售業
38005513,松山源順商店,臺北市松山區有福里第7鄰第5戶,歇業／撤銷,日常用品零售業
10356394,南林商號,臺北市大安區師大路59巷4號,歇業／撤銷,日常用品零售業
48958038,忠孝創意坊,臺北市大安區大安路1段59號,歇業／撤銷,日常用品零售業
25570421,珩泰創意工作室,臺北市信義區忠孝東路5段236巷3弄25號3樓,核准設立,日常用品零售業
38508409,新宿屋企業社,臺北市文山區羅斯福路6段403號1樓之20,核准設立,日常用品零售業
26236537,鑫億商行,臺北市大同區鄭州路3號1樓,歇業／撤銷,日常用品零售業
21722094,振雄服飾百貨商行,臺北市中正區武昌街1段22巷32號1樓,停業,日常用品零售業
98919525,綠奕商行,臺北市信義區虎林街121巷1號1樓,歇業／撤銷,日常用品零售業
15642431,芳菲商行,臺北市北投區光明路47號7樓,遷他縣市,日常用品零售業
10311828,旺人氣企業社,臺北市士林區大東路13之6號1樓,核准設立,日常用品零售業
38500048,民權胡商行,臺北市中山區民權東路2段81號1樓,核准設立,日常用品零售業
48937040,芙洛莉飾品店,臺北市大同區重慶北路1段26巷9弄1號,歇業／撤銷,日常用品零售業
48763759,合田企業行,臺北市萬華區西藏路259巷9號1樓,核准設立,日常用品零售業
38564751,翌豪企業社,臺北市中山區民權東路1段38巷18弄1號2樓之5,核准設立,日常用品零售業
99362525,客市哆摩咖啡館,臺北市內湖區民權東路6段238號1樓,歇業／撤銷,日常用品零售業
99427549,旭翔企業社,臺北市中山區松江路402巷26號3樓,核准設立,日常用品零售業
48754323,果汁熊複合式概念店,臺北市中山區伊通街127之3號,歇業／撤銷,日常用品零售業
38556979,和亞商行,臺北市中山區林森北路50號4樓之3,核准設立,日常用品零售業
26341221,覓熊咖啡館,臺北市松山區三民路101巷8之3號,核准設立,日常用品零售業
38465458,美傑洋行,臺北市中山區農安街13之2號2樓,核准設立,日常用品零售業
26364526,美加元商行,臺北市中山區龍江路318巷27號3樓,核准設立,日常用品零售業
29231825,巴菲特文化事業社,臺北市大安區敦化南路2段1號10樓,核准設立,日常用品零售業
29244997,榮珍商行,臺北市士林區德行東路322號1樓,歇業／撤銷,日常用品零售業
83914425,貴星社,臺北市松山區民生東路5段69巷2之5號1樓,歇業／撤銷,日常用品零售業
48963790,台品企業社,臺北市松山區民生東路5段165號8樓之3,核准設立,日常用品零售業
17523087,大福食品行,臺北市大同區民生西路381號,廢止,日常用品零售業
31860237,一隻貓創意工作室,臺北市萬華區西寧南路11號7樓之2,歇業／撤銷,日常用品零售業
98902550,桃京名坊,臺北市萬華區西寧南路36之6號1樓,歇業／撤銷,日常用品零售業
25538680,御廚坊商行,臺北市萬華區艋舺大道275巷7號3樓,歇業／撤銷,日常用品零售業
73907488,松圃商行,臺北市中山區南京東路1段86號9樓之2,遷他縣市,日常用品零售業
25535847,獻美企業社,臺北市中山區松江路363號10樓,廢止,日常用品零售業
38570402,約書亞美地工作室,臺北市南港區三重路41巷33號5樓之2,核准設立,日常用品零售業
31966674,享叮噹活力坊,臺北市內湖區內湖路3段126號,核准設立,日常用品零售業
13363715,恆好國際商行,臺北市文山區辛亥路4段77巷52號1樓、52號地下1樓,遷他縣市,日常用品零售業
98896017,有餘堂,臺北市大同區重慶北路3段236巷45弄1號1樓,歇業／撤銷,日常用品零售業
38496874,逸柔坊,臺北市北投區西安街1段367號2樓,歇業／撤銷,日常用品零售業
14337103,宏德雜糧行,臺北市大安區安居街117號1樓,核准設立,日常用品零售業
25553366,木棉樹咖啡館,臺北市大安區金山南路2段31巷9之1號,歇業／撤銷,日常用品零售業
10314085,齊鴻行,臺北市大安區安和路2段171巷7號1樓,歇業／撤銷,日常用品零售業
01088524,新樂町精緻旅居,臺北市萬華區西寧南路67號5樓、5樓之1、5樓之2、5樓之3、6樓、7樓、8樓、9樓,核准設立,日常用品零售業
31874128,多莉絲美材坊,臺北市大安區忠孝東路4段220號13樓,歇業／撤銷,日常用品零售業
