31857612,小牧人手作工作室,臺北市內湖區康寧路3段99巷2號,核准設立,日常用品零售業
31855298,辰將企業社,臺北市萬華區大理街157號,核准設立,日常用品零售業
26248013,大元商店,臺北市北投區石牌路1段166巷101號,歇業／撤銷,日常用品零售業
48784656,信馨國際商行,臺北市中正區和平西路2段17號,遷他縣市,日常用品零售業
25533257,昌維企業社,臺北市中山區長安東路1段16號8樓之6,歇業／撤銷,日常用品零售業
21704194,源進洋行,臺北市大同區太原路47號〈1樓〉,核准設立,日常用品零售業
31865036,健瑛行,臺北市中山區民生東路1段25號6樓之24,核准設立,日常用品零售業
98890750,官能浪漫精品店,臺北市中山區吉林路254之2號1樓,歇業／撤銷,日常用品零售業
77908797,長益食品行,臺北市大安區師大路39巷18號1樓,遷他縣市,日常用品零售業
99613754,甲本堂商行,臺北市內湖區民權東路6段234之1號1樓,核准設立,日常用品零售業
26231857,果琳精品店,臺北市大安區仁愛路4段71巷9號,歇業／撤銷,日常用品零售業
48872166,城堡百貨用品行,臺北市大安區基隆路2段106號,廢止,日常用品零售業
25569917,樸實工作室,臺北市中山區民生東路1段72號7樓之8,遷他縣市,日常用品零售業
26365573,濠漾企業社,臺北市松山區南京東路5段139之5號.139之9號,歇業／撤銷,日常用品零售業
98917189,日陞商行,臺北市大安區通化街57巷10之12號,歇業／撤銷,日常用品零售業
13450823,德群服飾名店,臺北市中正區衡陽路74號1樓,歇業／撤銷,日常用品零售業
48953456,啟祥家事管理商行,臺北市萬華區中華路1段192號6樓之1,歇業／撤銷,日常用品零售業
99951868,台灣樂庫企業社,臺北市中山區新生北路3段1號4樓之15,歇業／撤銷,日常用品零售業
31203923,中和商行分行,臺北市北投區中和街2號1樓,歇業／撤銷,日常用品零售業
57062735,成德商店,臺北市南港區成德路68巷13弄1號,歇業／撤銷,日常用品零售業
04820563,金湖商店,臺北市內湖區內湖路1段323巷25號1樓,歇業／撤銷,日常用品零售業
26340721,良金企業社,臺北市中正區汀州路1段102號,核准設立,日常用品零售業
26235609,恩生禮品行,臺北市萬華區康定路20號1樓之1,核准設立,日常用品零售業
31891837,三禾衣料坊,臺北市南港區八德路4段768巷3號2樓,核准設立,日常用品零售業
38566955,天樂創意行銷工作室,臺北市中山區中山北路1段92號8樓,核准設立,日常用品零售業
14314122,金興發實業社,臺北市中山區南京西路5之1號1、2、3樓,歇業／撤銷,日常用品零售業
18376936,非常美容館,臺北市中正區南昌路1段66之1號2樓,核准設立,日常用品零售業
38458077,群僖行,臺北市士林區天母北路4巷5之4號,歇業／撤銷,日常用品零售業
48896414,九象限顧問展業社,臺北市大安區忠孝東路4段162號10樓之2,核准設立,日常用品零售業
48698239,金周商行,臺北市信義區信安街188號1樓,歇業／撤銷,日常用品零售業
17260084,億璋企業商行,臺北市松山區光復北路125號2樓,遷他縣市,日常用品零售業
26552652,家雅工程企業社,臺北市中山區南京西路1之1號11樓,遷他縣市,日常用品零售業
99990166,艾俏兒企業社,臺北市萬華區內江街63號10樓之3,歇業／撤銷,日常用品零售業
48690594,瑞芙妍美容複合式休閒坊,臺北市士林區美德街64號1樓,遷他縣市,日常用品零售業
14323826,永日發商行,臺北市北投區自強街59號1樓,歇業／撤銷,日常用品零售業
29241289,廣騄商行,臺北市萬華區西園路1段145號龍山寺地下街商場45號店舖,核准設立,日常用品零售業
99970226,珍愛蕾絲精品生活館,臺北市大同區重慶北路2段36號,歇業／撤銷,日常用品零售業
38501601,瑞朵商行,臺北市信義區虎林街132巷66號1樓,核准設立,日常用品零售業
38500265,羅莎芒迪服飾店,臺北市士林區大北路38號及38之1號1樓,歇業／撤銷,日常用品零售業
26209948,尚尹企業社,臺北市文山區萬寧街129號10樓之2,核准設立,日常用品零售業
99624274,興昌瓦斯爐具行,臺北市內湖區康樂街136巷3弄22號1樓,歇業／撤銷,日常用品零售業
21704716,漂亮阿姨的店,臺北市松山區八德路4段120號1樓,歇業／撤銷,日常用品零售業
48872757,致發企業社,臺北市士林區至誠路2段132號,核准設立,日常用品零售業
38506492,零脩籽複合能量創意工坊,臺北市中正區羅斯福路2段70號6樓之7,核准設立,日常用品零售業
10340627,仙人居茶行,臺北市文山區景興路175號,歇業／撤銷,日常用品零售業
31955424,享咖啡企業社,臺北市大安區仁愛路4段71巷9號(1樓),核准設立,日常用品零售業
38462543,松子企業社,臺北市北投區崇仁路1段131巷2弄6號4樓,核准設立,日常用品零售業
38462810,凱韻時尚設計工作室,臺北市信義區松德路8號9樓,核准設立,日常用品零售業
26370246,海淘洋行,臺北市大安區安和路1段70號6樓,歇業／撤銷,日常用品零售業
21764495,百寶文房企業社,臺北市中山區樂群二路198號1樓,歇業／撤銷,日常用品零售業
80994542,金歡喜禮品屋,臺北市大安區通化街57巷10之11號1樓,歇業／撤銷,日常用品零售業
94916218,買家企業社,臺北市中山區建國北路3段93巷5弄9號1樓,停業,日常用品零售業
25551888,龍園茶行,臺北市大安區通安街99號,核准設立,日常用品零售業
26366025,鴻梁通訊行,臺北市中山區新生北路3段11巷35號,歇業／撤銷,日常用品零售業
10340696,下北澤企業社,臺北市萬華區西藏路182號,歇業／撤銷,日常用品零售業
31843890,睿宇企業社,臺北市信義區忠孝東路4段553巷52弄1號4樓,核准設立,日常用品零售業
15667755,陽光禮品屋,臺北市松山區饒河街187號1樓,歇業／撤銷,日常用品零售業
13839058,台灣世邦儷仕生活企業社,臺北市中山區民權東路1段67號7樓,歇業／撤銷,日常用品零售業
38470706,茱儷雅服飾精品店,臺北市中正區金山南路1段104號1樓,核准設立,日常用品零售業
26339576,立鑫商行,臺北市中山區長安東路2段81號12樓之1,核准設立,日常用品零售業
29247220,湘凌工作坊,臺北市文山區興隆路2段301巷7號4樓,核准設立,日常用品零售業
81787042,同冠文具行,臺北市中正區晉江街111號1樓,歇業／撤銷,日常用品零售業
31862087,花枝招展工作室,臺北市北投區立農街1段257巷10弄10號6樓,核准設立,日常用品零售業
21714046,得眾行,臺北市北投區崇仁路1段106號,核准設立,日常用品零售業
14320068,漁典水族世界館,臺北市南港區忠孝東路6段274號1樓,歇業／撤銷,日常用品零售業
98907730,奇美企業社,臺北市士林區社子街24號1樓,歇業／撤銷,日常用品零售業
26363202,得得商行,臺北市士林區天母北路4巷5號,歇業／撤銷,日常用品零售業
48979012,瑞庭企業社,臺北市萬華區峨眉街88號4樓之6,歇業／撤銷,日常用品零售業
14335528,年華食品坊,臺北市中山區四平街55號3樓,歇業／撤銷,日常用品零售業
26360248,美樂客企業社,臺北市信義區雙和里吳興街284巷59弄2號4樓,核准設立,日常用品零售業
10321918,高金源企業社,臺北市內湖區東湖路113巷5弄25號,歇業／撤銷,日常用品零售業
38579240,每?用品工作室,臺北市中山區中山北路2段20巷25號2樓,核准設立,日常用品零售業
48964432,明家窗簾行,臺北市南港區重陽路12號,歇業／撤銷,日常用品零售業
26240271,靚彩藝術美甲彩繪館,臺北市中山區新生北路2段58巷50號,歇業／撤銷,日常用品零售業
48697512,立家商行,臺北市中山區復興北路176號3樓,核准設立,日常用品零售業
38559981,幸福感婚紗攝影工作室,臺北市中正區牯嶺街50號,核准設立,日常用品零售業
48709643,美坊生活館,臺北市中山區新生北路3段11巷27號1樓,廢止,日常用品零售業
25516911,佳暉企業社,臺北市大同區承德路2段150號5樓,歇業／撤銷,日常用品零售業
14711733,霸輪機車行,臺北市信義區信安街145號1樓,歇業／撤銷,日常用品零售業
13849014,久鑫五金行,臺北市中山區四平街76號1樓,核准設立,日常用品零售業
18096055,優莎化妝品生活館,臺北市內湖區成功路4段168號,歇業／撤銷,日常用品零售業
21753315,嚴選洒落行,臺北市大安區忠孝東路4段223巷63號1樓,歇業／撤銷,日常用品零售業
38471944,白金御廚實業社,臺北市中正區金華街43巷23號1樓,歇業／撤銷,日常用品零售業
31846290,直心企業社,臺北市松山區南京東路5段260號1樓,核准設立,日常用品零售業
99348019,泰一乾洗名店,臺北市文山區軍功路125號1樓,歇業／撤銷,日常用品零售業
81798391,和平精品百貨商店,臺北市萬華區西昌街147號,歇業／撤銷,日常用品零售業
21754715,皇冠國際百貨企業社,臺北市北投區裕民一路30號(1樓),歇業／撤銷,日常用品零售業
21715100,禾翔商行,臺北市中正區重慶南路1段90號1樓,遷他縣市,日常用品零售業
26235191,詮聖清潔服務社,臺北市內湖區大湖山莊街219巷31弄1號3樓,核准設立,日常用品零售業
31874008,椰子創意工作室,臺北市中正區中華路2段75巷42號,核准設立,日常用品零售業
54054281,永蕻行,臺北市萬華區和平西路2段70巷9號之1,歇業／撤銷,日常用品零售業
38568150,生命之樹美妝工作室,臺北市大安區忠孝東路4段221號10樓,核准設立,日常用品零售業
80987866,宜婕商行,臺北市北投區大業路280巷13號1樓,歇業／撤銷,日常用品零售業
25667059,發掘王精品玩具行,臺北市士林區安平街5巷13號,核准設立,日常用品零售業
18393392,百分百行動通訊行,臺北市萬華區西寧南路36之32號,核准設立,日常用品零售業
31846762,蕾香焙咖啡輕食館,臺北市中山區建國北路1段67巷31號,核准設立,日常用品零售業
38464900,艾比商行,臺北市大安區師大路83巷12號,歇業／撤銷,日常用品零售業
26349053,辰宏閣商行,臺北市大安區新生南路2段8號地下之7,核准設立,日常用品零售業
10340041,亦象設計工作室,臺北市大安區忠孝東路3段217巷4弄10號,歇業／撤銷,日常用品零售業
25564194,博昱商行,臺北市大安區四維路198巷28號,歇業／撤銷,日常用品零售業
21777941,星瑜商行,臺北市中山區林森北路395號1樓,廢止,日常用品零售業
26370549,綠之道社,臺北市中正區襄陽路13之4號5樓,歇業／撤銷,日常用品零售業
31949296,嘉由棧小吃店,臺北市士林區後港街30號1樓,歇業／撤銷,日常用品零售業
26221231,正新企業社,臺北市中正區重慶南路3段71號,核准設立,日常用品零售業
25577542,福網國際商行,臺北市中正區仁愛路1段6號4樓之1,核准設立,日常用品零售業
31866730,貫旭企業社,臺北市中正區?門街81巷15號4樓,核准設立,日常用品零售業
13828209,晶樺霖行,臺北市中山區南京東路2段174號10樓,歇業／撤銷,日常用品零售業
48967563,勤揚商店,臺北市大安區通安街101號,核准設立,日常用品零售業
42268660,柱姐工坊,臺北市中正區臨沂街44巷3號1樓,核准設立,日常用品零售業
17633660,尚帆企業社,臺北市大安區濟南路3段9號2樓,歇業／撤銷,日常用品零售業
13850399,亞曼商行,臺北市松山區八德路4段289號之4、1樓,歇業／撤銷,日常用品零售業
31954662,承臻商行,臺北市內湖區內湖路2段322號,核准設立,日常用品零售業
31948310,六花亭和?子小舖,臺北市松山區民生東路5段244號1樓,核准設立,日常用品零售業
26354750,樂烘焙材料器具,臺北市大安區虎嘯里和平東路3段68之8號,核准設立,日常用品零售業
17529744,砂鍋田名店,臺北市內湖區內湖路1段323巷5弄1號1樓,歇業／撤銷,日常用品零售業
77424195,飛燕花坊,臺北市士林區中山北路7段76號1樓,歇業／撤銷,日常用品零售業
25550760,永樂泉茶莊,臺北市中山區龍江路155巷15號,列入廢止中,日常用品零售業
15634880,浚鈊企業社,臺北市大安區羅斯福路3段325號4樓,歇業／撤銷,日常用品零售業
48677446,華達國際企業社,臺北市松山區八德路2段374號7樓,核准設立,日常用品零售業
39805785,亨源企業社,臺北市大安區東豐街66號3樓,核准設立,日常用品零售業
21763524,中學西用廣告工作室,臺北市文山區辛亥路5段11號5樓,停業,日常用品零售業
15634636,華網國際企業社,臺北市中正區羅斯福路4段58號8樓,歇業／撤銷,日常用品零售業
26338844,岳擎企業社,臺北市松山區南京東路5段291巷18號1樓,歇業／撤銷,日常用品零售業
38556231,拉諾絲美容坊,臺北市內湖區成功路4段61巷25弄2號,核准設立,日常用品零售業
18392942,金威揚科技水生活館,臺北市信義區莊敬路341巷4弄22號,核准設立,日常用品零售業
10391224,長新汽車商行,臺北市內湖區新明街381號2樓,核准設立,日常用品零售業
15649217,漢御商行,臺北市北投區振興街11號1樓,歇業／撤銷,日常用品零售業
14259438,樂特企業社,臺北市信義區林口街38巷7號1樓,歇業／撤銷,日常用品零售業
38581800,寵貓咪百貨行,臺北市北投區中和街493巷1弄7號4樓,核准設立,日常用品零售業
31858963,愛維德思音樂創藝工作室,臺北市中正區南昌路1段37號4樓,歇業／撤銷,日常用品零售業
25654857,金奇國際開發企業社,臺北市中山區四平街69號,歇業／撤銷,日常用品零售業
48694249,富冠商行,臺北市中山區民權西路20號7樓,歇業／撤銷,日常用品零售業
70979938,優墾產銷商行,臺北市大安區忠孝東路3段136號10樓之3,核准設立,日常用品零售業
98883287,安堤商行,臺北市北投區石牌路2段84號1樓,歇業／撤銷,日常用品零售業
38509033,凱鴻企業社,臺北市中山區北安路458巷41弄29號1樓,核准設立,日常用品零售業
26349048,京兆坊,臺北市大安區新生南路2段8號地下,核准設立,日常用品零售業
48754359,依妮調整型內衣精品店,臺北市中山區民權東路2段62號,歇業／撤銷,日常用品零售業
38510714,茂祥商行,臺北市中山區錦州街46號9樓之1,核准設立,日常用品零售業
99623084,好彩頭百貨行,臺北市大安區和平東路3段228巷53號,歇業／撤銷,日常用品零售業
98913058,惠安免洗餐具行,臺北市文山區景福街230巷14號1樓,歇業／撤銷,日常用品零售業
48683025,伊織花店,臺北市中山區林森北路506號,核准設立,日常用品零售業
80980913,泓島商行,臺北市中正區羅斯福路4段24巷14之1號1樓,歇業／撤銷,日常用品零售業
38562199,納米社,臺北市中山區八德路2段288號1樓,核准設立,日常用品零售業
10387093,花點心幸福工作坊,臺北市中山區南京東路1段130之4號,遷他縣市,日常用品零售業
94913486,芝麻哈彩券行,臺北市松山區南京東路4段133巷8弄2號1樓,歇業／撤銷,日常用品零售業
49986510,宏記洋行,臺北市大同區重慶北路1段67號8樓之2,核准設立,日常用品零售業
48796267,鼎隆百貨行,臺北市中正區武昌街1段42號,核准設立,日常用品零售業
83930419,昱睿商行,臺北市士林區德行東路328號1樓,遷他縣市,日常用品零售業
14720938,快樂龍世界遊樂園,臺北市松山區饒河街180號1樓,廢止,日常用品零售業
77138989,鄉村茶莊,臺北市萬華區康定路25巷3號1樓,核准設立,日常用品零售業
01566187,鴻程企業社,臺北市信義區福德街53號1樓,歇業／撤銷,日常用品零售業
98881437,活力寶寶婦幼用品館,臺北市大安區金華街219號1樓,歇業／撤銷,日常用品零售業
25586155,泰之楓養生館,臺北市中山區中山北路1段115號,歇業／撤銷,日常用品零售業
31870805,米哇企業社,臺北市信義區永吉路170號12樓,核准設立,日常用品零售業
38458267,佳泰商行,臺北市中山區八德路2段318號(1樓),核准設立,日常用品零售業
25577803,分享工房,臺北市內湖區星雲街168巷43號3樓之1,核准設立,日常用品零售業
25556602,彥昇日用品商行,臺北市中山區新生北路3段19巷59號,歇業／撤銷,日常用品零售業
38500862,欣晟企業社,臺北市中正區信義路2段91號12樓之4,核准設立,日常用品零售業
99345890,千家寨茶莊,臺北市中山區明水路387號之1、1樓,歇業／撤銷,日常用品零售業
17515241,萬仕興商行,臺北市中正區福州街55號2樓,歇業／撤銷,日常用品零售業
25546041,齊鴻行,臺北市大安區敦化南路2段81巷39號,核准設立,日常用品零售業
48843368,五福財神商行,臺北市萬華區西園路2段249號1樓,歇業／撤銷,日常用品零售業
26255148,紅袋鼠個人工作室,臺北市萬華區漢中街133號9樓之1,核准設立,日常用品零售業
99326373,長壽多商行,臺北市大同區昌吉街4號1樓,歇業／撤銷,日常用品零售業
26239128,玄武企業社,臺北市中山區民權東路2段106號,核准設立,日常用品零售業
14744848,漫畫閣閱書館,臺北市中山區南京東路2段140號2樓,歇業／撤銷,日常用品零售業
17744883,泉虹商行,臺北市大安區師大路39巷20號1樓,歇業／撤銷,日常用品零售業
10317533,永泰豐企業社,臺北市文山區羅斯福路5段245號,歇業／撤銷,日常用品零售業
48691221,米拉堤企業社,臺北市文山區辛亥路4段101巷85之8號,歇業／撤銷,日常用品零售業
80984973,雅芃精品服飾行,臺北市大安區敦化南路1段160巷34號1樓,廢止,日常用品零售業
73879005,民安禮品行,臺北市大同區敦煌路201號1樓,歇業／撤銷,日常用品零售業
83927441,芩莊茶葉商行,臺北市中山區民權東路2段47號1樓,核准設立,日常用品零售業
48705837,欣祐商行,臺北市中山區中原街133號1樓,歇業／撤銷,日常用品零售業
15646817,伊喜屋商行,臺北市中正區羅斯福路4段20號,歇業／撤銷,日常用品零售業
98888918,熊熊禮品屋,臺北市松山區饒河街142號1樓,歇業／撤銷,日常用品零售業
38463487,擺渡咖啡店,臺北市大同區延平北路2段203號,核准設立,日常用品零售業
31962826,文山胡商行,臺北市文山區興隆路2段331號（1樓）,核准設立,日常用品零售業
10379544,向上家具行,臺北市大同區民生西路259號,核准設立,日常用品零售業
13474424,元立商行,臺北市松山區南京東路5段70號5樓,遷他縣市,日常用品零售業
14712199,忠藝軒,臺北市大同區華亭街53號,核准設立,日常用品零售業
17773090,凱盟行,臺北市中山區長安東路1段28之1號1樓,歇業／撤銷,日常用品零售業
14332254,同佳商行,臺北市中正區中華路2段431號1樓,歇業／撤銷,日常用品零售業
26250349,依琦精品店,臺北市中山區農安街24之1號,核准設立,日常用品零售業
14332825,采豐企業社,臺北市中山區建國北路1段23巷60號6樓之1,歇業／撤銷,日常用品零售業
26342116,健宸企業社,臺北市松山區八德路4段709巷2之3號1樓,核准設立,日常用品零售業
99350957,巴登食坊永康分店,臺北市大安區永康街12之1號,廢止,日常用品零售業
14339192,華鈺精品行,臺北市文山區景興路225號1樓,歇業／撤銷,日常用品零售業
26232292,宏茂國際商行,臺北市信義區松山路275之3號1樓,核准設立,日常用品零售業
26365969,和美生活館,臺北市中山區吉林路220號,歇業／撤銷,日常用品零售業
73892252,宜華商行,臺北市內湖區環山路1段74號1樓,歇業／撤銷,日常用品零售業
17549777,葳林圖書文具百貨行,臺北市北投區中央南路1段39號1樓,歇業／撤銷,日常用品零售業
48786401,佳得百貨五金行,臺北市萬華區萬大路486巷31號,核准設立,日常用品零售業
99968875,雅馨商行,臺北市中山區八德路2段278號,歇業／撤銷,日常用品零售業
48998593,歐萊恩斯企業社,臺北市信義區忠孝東路5段800號9樓之8,廢止,日常用品零售業
17738279,麻布百貨店,臺北市中山區長安東路2段75號1樓,歇業／撤銷,日常用品零售業
80984919,辰禧美容坊,臺北市中山區民權東路2段122號(2樓),歇業／撤銷,日常用品零售業
94918089,視點子數位行銷工作室,臺北市大同區寧夏路11號3樓之1,遷他縣市,日常用品零售業
48708980,樂高先企業社,臺北市中山區錦州街12號7樓之5,遷他縣市,日常用品零售業
31954972,金如商行,臺北市松山區八德路3段155巷23號,歇業／撤銷,日常用品零售業
48910416,傳弘商行,臺北市萬華區萬大路486巷59弄13號,核准設立,日常用品零售業
17265757,竹軒餐廳,臺北市中山區龍江路298巷21號1樓,核准設立,日常用品零售業
21714051,百盛行,臺北市大同區貴德街60號1樓,核准設立,日常用品零售業
98901378,布袋精品服飾坊,臺北市松山區富錦街517號,核准設立,日常用品零售業
38569117,勝新欣企業社,臺北市內湖區內湖路1段415號,核准設立,日常用品零售業
26364244,澄季洋行,臺北市內湖區內湖路2段179巷48弄6號2樓,歇業／撤銷,日常用品零售業
20964896,來來五金行,臺北市松山區基隆路1段1號,核准設立,日常用品零售業
38459809,四月雨咖啡館,臺北市大安區忠孝東路4段216巷40弄18號1樓,核准設立,日常用品零售業
25567707,樂騎小屋,臺北市大安區新生南路2段30巷35之1號1樓,廢止,日常用品零售業
01726305,欣欣美材精品店,臺北市北投區石牌路2段68巷1號,核准設立,日常用品零售業
31961586,天帝企業社,臺北市中山區新生北路2段45巷27號,核准設立,日常用品零售業
48765980,德宏企業社,臺北市中山區松江路3號3樓之2,歇業／撤銷,日常用品零售業
99230378,慨汶企業商號,臺北市信義區吳興街600巷76弄143號2樓之2,核准設立,日常用品零售業
48535778,錦足服裝行,臺北市信義區松山路193號1樓,核准設立,日常用品零售業
48864243,生活日記精品坊,臺北市內湖區內湖路2段359號,歇業／撤銷,日常用品零售業
48924679,衣麗百貨行,臺北市大同區迪化街1段21號2樓第2113號攤位,核准設立,日常用品零售業
25668661,明德家具企業社,臺北市北投區致遠一路1段94號,歇業／撤銷,日常用品零售業
99969023,十八佛具總匯企業社,臺北市大同區酒泉街175號1樓,歇業／撤銷,日常用品零售業
31865113,拉貝厚商行,臺北市松山區興安街200號,核准設立,日常用品零售業
29219435,尚榆企業社,臺北市大同區承德路1段51號11樓之1,歇業／撤銷,日常用品零售業
25548603,寬達企業社,臺北市大同區民生西路155號1樓及2樓,歇業／撤銷,日常用品零售業
13838207,東昱五金工具行,臺北市松山區八德路4段604之24號1樓,核准設立,日常用品零售業
14327288,新門餐廳,臺北市中山區復興南路1段22號1至2樓,廢止,日常用品零售業
13834820,維琪草本科技天然屋,臺北市大安區延吉街135號之2﹝1樓﹞,歇業／撤銷,日常用品零售業
26364482,嘉澤商行,臺北市大安區新生南路2段8號地下之10,核准設立,日常用品零售業
99616529,丸橘商行,臺北市中山區民權西路11號1樓,歇業／撤銷,日常用品零售業
26253562,鑫漾美妝企業社,臺北市內湖區東湖路106巷8號3樓,核准設立,日常用品零售業
27162576,德榮商行,臺北市中山區南京東路2段163號6樓,歇業／撤銷,日常用品零售業
15652676,東震實業社,臺北市士林區大東路99號1樓,核准設立,日常用品零售業
26353247,藍鉑樂工作室,臺北市士林區承德路4段297巷9號,歇業／撤銷,日常用品零售業
48750966,亞筑企業社,臺北市內湖區東湖路94巷2號,核准設立,日常用品零售業
09431487,天祥茶行,臺北市大安區信義路2段110號,遷他縣市,日常用品零售業
17515283,蘭盈飲料店,臺北市士林區忠誠路1段157號1樓,歇業／撤銷,日常用品零售業
48856905,樂活美健康舖,臺北市北投區中央南路1段25巷27號,歇業／撤銷,日常用品零售業
38565098,雅比精品屋,臺北市內湖區麗山街338巷14弄4號5樓,核准設立,日常用品零售業
04982519,大統西點麵包店,臺北市大安區泰順街15號1樓,核准設立,日常用品零售業
31859695,拓俐商行,臺北市士林區大東路72號,歇業／撤銷,日常用品零售業
10314206,嘉鴻行,臺北市松山區八德路3段12巷16弄19號,歇業／撤銷,日常用品零售業
31879030,甜心商行,臺北市大安區忠孝東路4段169號6樓之1,歇業／撤銷,日常用品零售業
48980566,旭謙國際商行,臺北市中正區羅斯福路4段80號,廢止,日常用品零售業
57062388,俊發商行,臺北市大同區環河北路75號之1,歇業／撤銷,日常用品零售業
31843907,琉璃金蘋果企業社,臺北市大安區龍泉街73號,歇業／撤銷,日常用品零售業
13823746,和霖企業社,臺北市信義區永吉路120巷57弄10號3樓,歇業／撤銷,日常用品零售業
77908781,慶豐紙紮商行,臺北市大安區臥龍街194號,歇業／撤銷,日常用品零售業
48992599,正寶商行,臺北市中山區民權東路2段71巷24號,核准設立,日常用品零售業
99955870,幸福生活工坊,臺北市信義區信義路4段306號2樓之2,歇業／撤銷,日常用品零售業
