10314661,榳擎設計工作室,臺北市松山區南京東路4段56號10樓之6,核准設立,日常用品零售業
78377591,常春藤花坊,臺北市中正區南海路2巷6號,核准設立,日常用品零售業
25548548,節慶屋商行,臺北市內湖區成功路4段61巷14號1樓,歇業／撤銷,日常用品零售業
26359100,杰辰行,臺北市文山區光煇路84號3樓,核准設立,日常用品零售業
17260900,大進商行,臺北市中正區汀州路2段69號1樓,歇業／撤銷,日常用品零售業
25535852,雅比斯旅遊用品資訊社,臺北市中山區松江路39號7樓之3,核准設立,日常用品零售業
80984853,三九大街商行,臺北市大安區延吉街68之16號1樓,歇業／撤銷,日常用品零售業
17806043,新涵五金行,臺北市內湖區成功路2段316號,核准設立,日常用品零售業
26240244,優諾髮型沙龍,臺北市大安區復興南路2段78巷2號地下,核准設立,日常用品零售業
26239648,方舟商行,臺北市松山區敦化北路199巷2弄17號,歇業／撤銷,日常用品零售業
26238471,易鄰購商行,臺北市信義區莊敬路423巷8弄4號,列入廢止中,日常用品零售業
26171204,泊飛商行,臺北市萬華區長泰街297巷7號,遷他縣市,日常用品零售業
48890903,第卡摩工作室,臺北市士林區福國路95號5樓之2,歇業／撤銷,日常用品零售業
73881419,安福商行,臺北市士林區重慶北路4段79號4樓之5,歇業／撤銷,日常用品零售業
01472267,蘭亭金石書畫藝廊,臺北市中正區羅斯福路1段8號2樓南門市場274號,核准設立,日常用品零售業
17546770,宏明免洗餐具商行,臺北市萬華區開封街2段47號,核准設立,日常用品零售業
13476794,大穎企業社,臺北市萬華區西昌街68號1樓,歇業／撤銷,日常用品零售業
31874295,龍龍生活百貨行,臺北市中山區龍江路356巷12號,核准設立,日常用品零售業
83929320,孚羅咖啡商行,臺北市中山區龍江路281巷21號1樓,核准設立,日常用品零售業
80996979,甜蜜寶貝婦幼用品行,臺北市松山區八德路2段451巷1號1樓,核准設立,日常用品零售業
38502616,永業企業社,臺北市大安區通化街39巷50弄78號,停業,日常用品零售業
26352319,蕾莎服飾精品店,臺北市中正區臨沂街81號,核准設立,日常用品零售業
42275888,岩璞茶行,臺北市信義區莊敬路341巷3號,核准設立,日常用品零售業
99634126,誠信國際企業社,臺北市松山區八德路4段602號11樓之1,核准設立,日常用品零售業
26208188,慧醇商行,臺北市中山區遼寧街259巷1號1樓,核准設立,日常用品零售業
25548863,真便宜拾元商店,臺北市中正區中華路2段75巷8號,歇業／撤銷,日常用品零售業
73876035,貴都企業社,臺北市松山區民生東路5段69巷2之5號,遷他縣市,日常用品零售業
14727480,天達樂商店,臺北市信義區忠孝東路5段790巷68弄2號1樓,歇業／撤銷,日常用品零售業
73893576,金玉商行,臺北市中山區長春路76號1樓,歇業／撤銷,日常用品零售業
48972502,豐順商行,臺北市松山區南京東路4段164號,歇業／撤銷,日常用品零售業
38581750,來派對實業社,臺北市北投區行義路122號4樓,核准設立,日常用品零售業
26234067,金洽裕商店,臺北市士林區大西路4號,歇業／撤銷,日常用品零售業
21758450,天其商行,臺北市萬華區廣州街178號1樓,歇業／撤銷,日常用品零售業
13446906,藝寶堂精品店,臺北市大同區承德路2段197號1樓,核准設立,日常用品零售業
18104180,楓葉行,臺北市松山區八德路4段295巷18弄12號1樓,歇業／撤銷,日常用品零售業
49038190,金源商店,臺北市大同區蘭州街3號,歇業／撤銷,日常用品零售業
48967183,十翊企業社,臺北市士林區延平北路5段188號,歇業／撤銷,日常用品零售業
04901657,興才商店,臺北市文山區辛亥路4段130巷1弄35號,歇業／撤銷,日常用品零售業
73895933,吉晏商行,臺北市中山區松江路43號7樓之1,歇業／撤銷,日常用品零售業
31851223,旺茶工作室,臺北市文山區木新路3段74巷1弄20號,歇業／撤銷,日常用品零售業
31966029,裕順企業社,臺北市大安區和平東路3段246號,核准設立,日常用品零售業
38508597,泰綻健康生活館,臺北市士林區士東路260號1樓,核准設立,日常用品零售業
19923026,莨茗企業行,臺北市中正區重慶南路1段139號2樓,廢止,日常用品零售業
81795887,蕾蒂商行,臺北市松山區饒河街154號1樓,歇業／撤銷,日常用品零售業
25544634,?俐美容坊,臺北市信義區忠孝東路5段412之2號,遷他縣市,日常用品零售業
25538289,葉記工程行,臺北市內湖區港墘路82巷7弄19號5樓,歇業／撤銷,日常用品零售業
15662365,弘熙電訊企業社,臺北市南港區南港路1段153號1樓,遷他縣市,日常用品零售業
48953505,光大企業社,臺北市松山區南京東路4段197號4樓,核准設立,日常用品零售業
26232005,李太工作坊,臺北市士林區承德路4段55號8樓,歇業／撤銷,日常用品零售業
48901036,七色龍精品店,臺北市文山區羅斯福路5段136之2號,核准設立,日常用品零售業
81795964,康和商行,臺北市大同區延平北路3段47之1號,歇業／撤銷,日常用品零售業
77906329,康格家飾坊,臺北市大安區大安路1段125號1樓,核准設立,日常用品零售業
31864466,簡單說小吃店,臺北市大安區光復南路554號,核准設立,日常用品零售業
38571541,黑熊企業社,臺北市大安區敦化南路1段169巷8號,核准設立,日常用品零售業
13833054,欣軒商行,臺北市中山區林森北路159巷12號1樓,歇業／撤銷,日常用品零售業
48582103,馨之戀企業社,臺北市大安區辛亥路3段157巷24弄14號1樓,歇業／撤銷,日常用品零售業
83911433,晶晶書庫精品店,臺北市中正區羅斯福路3段210巷8弄7之14號1樓,歇業／撤銷,日常用品零售業
21242428,佳品油糧行,臺北市北投區尊賢街302巷16號,核准設立,日常用品零售業
48904245,象山第一站商行,臺北市信義區莊敬路215號1樓,核准設立,日常用品零售業
21720440,草本家企業社,臺北市中山區松江路100巷24號1樓,歇業／撤銷,日常用品零售業
21710647,十亞美容坊,臺北市文山區景後街122號3樓之1,歇業／撤銷,日常用品零售業
18101769,互動設計家具館,臺北市大安區潮州街126號,歇業／撤銷,日常用品零售業
25556552,歐納企業社,臺北市大同區延平北路2段154號,核准設立,日常用品零售業
26239366,承岳國際時尚企業社,臺北市大安區信義路4段265巷3之1號,核准設立,日常用品零售業
83904572,富小屋百貨行,臺北市南港區南港路2段20巷23號,歇業／撤銷,日常用品零售業
48950697,武昌租格坊,臺北市萬華區武昌街2段30號,歇業／撤銷,日常用品零售業
48714060,佰印企業社,臺北市中正區中華路1段59號1樓之9,歇業／撤銷,日常用品零售業
31965886,忠華商行,臺北市信義區永吉路30巷86號1樓,核准設立,日常用品零售業
07191412,明正百貨行,臺北市大同區安西街26號1樓,核准設立,日常用品零售業
26247984,素蘭越式道地美食,臺北市中正區中華路2段391號,歇業／撤銷,日常用品零售業
73876387,昇曜實業社,臺北市信義區信義路5段150巷409號1樓,歇業／撤銷,日常用品零售業
31858443,永健商行,臺北市中正區博愛路146號1樓,核准設立,日常用品零售業
14732998,極鮮食品行,臺北市文山區指南路2段127號1樓,核准設立,日常用品零售業
20932868,利祥商行,臺北市中山區龍江路248號1樓,歇業／撤銷,日常用品零售業
94911240,金合利鋼刀專賣店,臺北市信義區忠孝東路4段553巷22弄51之1號1樓,歇業／撤銷,日常用品零售業
26231934,小天使傢俱商行,臺北市內湖區環山路1段83號,核准設立,日常用品零售業
26531968,茂琳國際洋行,臺北市中正區許昌街42之1號10樓,核准設立,日常用品零售業
09749267,昂亞實業社,臺北市信義區基隆路1段147巷28號1樓,歇業／撤銷,日常用品零售業
38555802,夢衣裳服飾店,臺北市中正區金華街43巷23號1樓,遷他縣市,日常用品零售業
31850765,姿瑞企業社,臺北市中山區長安東路2段36巷9號地下,核准設立,日常用品零售業
48834430,千金公主洋行,臺北市內湖區康寧路3段54之7號,廢止,日常用品零售業
81782855,回留茶藝素食店,臺北市大安區永康街31巷9號1樓,核准設立,日常用品零售業
25584229,佳陽企業商行,臺北市士林區社中街118號1樓,歇業／撤銷,日常用品零售業
48777022,蕎富豪商行,臺北市大同區歸綏街209號4樓之7,歇業／撤銷,日常用品零售業
38567700,林亞齊工作室,臺北市士林區天母東路38-2號,核准設立,日常用品零售業
13455518,哲洋商店,臺北市大安區臥龍街256之1號1樓,歇業／撤銷,日常用品零售業
10396728,金旺興實業社,臺北市大安區師大路39巷6號,歇業／撤銷,日常用品零售業
17259853,火車頭資訊坊,臺北市中山區中山北路1段53巷6之1號3樓,歇業／撤銷,日常用品零售業
29209295,天利商行,臺北市中山區中山北路2段115巷3弄10號3樓,遷他縣市,日常用品零售業
14720769,銨鑫工程行,臺北市大安區忠孝東路4段278號8樓之1,歇業／撤銷,日常用品零售業
38514303,宇彤國際企業社,臺北市內湖區民權東路6段150之3號4樓之2,核准設立,日常用品零售業
26221703,貝林國際企業社,臺北市大同區民族西路223之9號6樓,歇業／撤銷,日常用品零售業
31842843,水噹噹的店,臺北市大安區青田街13號1樓,核准設立,日常用品零售業
21711097,亮麗商行,臺北市萬華區西園路1段145號﹝龍山寺地下街商場51號店舖﹞,歇業／撤銷,日常用品零售業
38464205,豬舍創意製作社,臺北市松山區民權東路3段170號12樓,核准設立,日常用品零售業
26357481,??美容坊,臺北市中山區林森北路410號3樓之42,歇業／撤銷,日常用品零售業
98916273,旭利清潔社,臺北市中山區新生北路2段123巷15號1樓,歇業／撤銷,日常用品零售業
38576412,永日工作室,臺北市大安區新生南路3段2號10樓,核准設立,日常用品零售業
38455402,蕾媽美日韓小舖,臺北市內湖區內湖路1段737巷33弄2號,核准設立,日常用品零售業
48735311,朵昂思生活精緻館,臺北市大安區大安路1段125號,歇業／撤銷,日常用品零售業
26244950,米佩羅美容店,臺北市士林區忠義街113之3號1樓,核准設立,日常用品零售業
15645916,翰興五金商行,臺北市北投區中央南路1段19號,核准設立,日常用品零售業
17085158,荷雅免洗材料行,臺北市北投區承德路7段196號,歇業／撤銷,日常用品零售業
38566195,覺知設計工作室,臺北市內湖區港墘路60巷4號4樓,核准設立,日常用品零售業
77929569,威廷企業社,臺北市士林區中正路655巷17號4樓,核准設立,日常用品零售業
99969109,慧怡行,臺北市北投區東華街1段364號1樓,歇業／撤銷,日常用品零售業
48774019,品鈞企業社,臺北市南港區忠孝東路6段112號,歇業／撤銷,日常用品零售業
25665165,廚子饌商行,臺北市萬華區中華路2段522號4樓,停業,日常用品零售業
80986043,寶玲名牌商品拍賣店,臺北市內湖區金湖路376號3樓之3,停業,日常用品零售業
29201884,富加企業社,臺北市信義區林口街93號1樓,歇業／撤銷,日常用品零售業
99611236,翡麗精品服飾店,臺北市北投區實踐街16號1樓,歇業／撤銷,日常用品零售業
99961177,鳳凰橋餐坊,臺北市中山區長安東路1段46之1號1樓,歇業／撤銷,日常用品零售業
94905079,祥捷商行,臺北市文山區溪口街64之1號1樓,歇業／撤銷,日常用品零售業
38470608,沐藝生活品味行,臺北市大安區復興南路2段340巷5號,核准設立,日常用品零售業
48930546,高泉商行,臺北市信義區永吉路376號,歇業／撤銷,日常用品零售業
81647520,上騰茶行,臺北市信義區松山路465巷29弄15號1樓,核准設立,日常用品零售業
13859379,謙誠企業社,臺北市文山區一壽街3巷4號1樓,歇業／撤銷,日常用品零售業
15666799,帝城國際企業社,臺北市萬華區大理街159巷9號1樓,核准設立,日常用品零售業
81791600,昱康企業社,臺北市信義區莊敬路343號2樓,歇業／撤銷,日常用品零售業
25567333,小小舖商店,臺北市內湖區金湖路401巷26號,歇業／撤銷,日常用品零售業
14741716,天晴小舖,臺北市大安區復興南路2段27號11樓之3,歇業／撤銷,日常用品零售業
31844650,佳弘企業社,臺北市中正區忠孝西路1段72號10樓之18,核准設立,日常用品零售業
94904141,喜來發商行,臺北市中山區民權東路2段71巷41號1樓,歇業／撤銷,日常用品零售業
14324178,發大發商行,臺北市士林區中山北路7段166號1樓,歇業／撤銷,日常用品零售業
81780694,葵芳企業社,臺北市信義區永吉路302號4樓之7,歇業／撤銷,日常用品零售業
73870530,聖崴企業社,臺北市大同區哈密街148號1樓,歇業／撤銷,日常用品零售業
38578777,擎利企業社,臺北市中正區忠孝東路1段15號5樓,核准設立,日常用品零售業
25570800,智優利商行,臺北市北投區大業路65巷2弄14號,核准設立,日常用品零售業
26213823,秘密集會小吃店,臺北市大安區復興南路1段107巷5弄15號地下室,歇業／撤銷,日常用品零售業
31845715,達賀尊爵精品店,臺北市內湖區康寧路1段34號,歇業／撤銷,日常用品零售業
83932367,友德行,臺北市松山區南京東路5段367號1樓,核准設立,日常用品零售業
81605789,保豐堂醫療器材行,臺北市大安區仁愛路4段266巷15弄8號1樓,核准設立,日常用品零售業
10339332,囍霸精品店,臺北市大安區忠孝東路4段205巷29弄8號,核准設立,日常用品零售業
80995916,訴說美麗複合店,臺北市中山區長春路133之5號1樓,歇業／撤銷,日常用品零售業
26214772,睿智企業社,臺北市大安區延吉街153之1號,歇業／撤銷,日常用品零售業
38497563,日昇百貨行,臺北市士林區中正路235巷12號,核准設立,日常用品零售業
31847805,禾加宥服裝工作室,臺北市萬華區西寧南路72之1號3樓,歇業／撤銷,日常用品零售業
15664878,吳寶芬商行,臺北市中山區天祥路86巷6弄2號1樓,歇業／撤銷,日常用品零售業
17769510,慶同食品行,臺北市信義區松勤街41號1樓,歇業／撤銷,日常用品零售業
99332591,韓廚食品店,臺北市中正區臨沂街52之6號1樓,歇業／撤銷,日常用品零售業
48967796,德興禮宴用品社,臺北市中山區民權東路2段113巷1弄13號,遷他縣市,日常用品零售業
99610166,蝶色髮館,臺北市萬華區西寧南路167號2、3樓,核准設立,日常用品零售業
48855390,哥倫布戶外生活館,臺北市中山區堤頂大道2段296號,核准設立,日常用品零售業
48502122,惠壽養生食品商行,臺北市士林區社中街156巷14號1樓,核准設立,日常用品零售業
81725308,萬益汽車材料行,臺北市北投區三合街2段462號1樓,歇業／撤銷,日常用品零售業
26222288,新松源商行,臺北市中山區龍江路356巷68號,核准設立,日常用品零售業
48501658,台揚農產行,臺北市中山區新生北路2段66號1樓,歇業／撤銷,日常用品零售業
38005788,松山協發商行,臺北市松山區有福里11鄰,核准設立,日常用品零售業
15652628,藍格子精品店,臺北市大安區樂利路31之1號1樓,歇業／撤銷,日常用品零售業
25521251,歡樂屋商行,臺北市大同區長安西路234號,核准設立,日常用品零售業
26347365,遊玩商行,臺北市士林區中山北路7段18號地下1樓,歇業／撤銷,日常用品零售業
81792973,嘉興商行,臺北市中山區長春路31號5樓,歇業／撤銷,日常用品零售業
26372602,樂活國際商行,臺北市大安區復興南路1段126巷1號2樓之1,歇業／撤銷,日常用品零售業
25513631,浴汪城市商行,臺北市內湖區金湖路328之5號,歇業／撤銷,日常用品零售業
01302209,上美茶行,臺北市中山區林森北路632號1樓,歇業／撤銷,日常用品零售業
38511636,咕哎嘀爾創意工作室,臺北市中山區民族東路262號4樓,核准設立,日常用品零售業
13833569,拾緣便利屋,臺北市文山區木柵路1段150號1樓,歇業／撤銷,日常用品零售業
95870935,加易企業社,臺北市內湖區內湖路2段405號1樓,遷他縣市,日常用品零售業
01192765,連文餐飲家餐具行,臺北市中山區吉林路174巷11號1樓,核准設立,日常用品零售業
57062316,明明雜貨店,臺北市文山區光明路光明巷22號,歇業／撤銷,日常用品零售業
38470488,弘提顧問企業社,臺北市大安區忠孝東路4段162號5樓之5,核准設立,日常用品零售業
14342339,東宏行,臺北市內湖區東湖路113巷3弄3號1樓,核准設立,日常用品零售業
26251142,韓趣屋,臺北市士林區福華路165巷9號1樓,核准設立,日常用品零售業
48501854,大熊禮品屋,臺北市松山區饒河街140號1樓,歇業／撤銷,日常用品零售業
73918160,天恩小吃店,臺北市士林區德行東路74巷15弄16號,廢止,日常用品零售業
38495642,東宇企業社,臺北市內湖區文德路220巷5弄13號,核准設立,日常用品零售業
31846910,福和企業社,臺北市大安區復興南路2段291號,核准設立,日常用品零售業
48582477,彩羽精品店,臺北市中山區四平街64號1樓,歇業／撤銷,日常用品零售業
04761662,仁記商店,臺北市南港區舊莊街292之3號,歇業／撤銷,日常用品零售業
47031094,協發食品行,臺北市大安區東安市場5號,核准設立,日常用品零售業
26349440,愛微兒流行百貨坊,臺北市內湖區文德路78號,歇業／撤銷,日常用品零售業
48683432,和賞企業社,臺北市中山區八德路2段327號,歇業／撤銷,日常用品零售業
15885871,水木商行,臺北市中山區敬業一路36巷5號,核准設立,日常用品零售業
48745774,小女巫的店,臺北市中正區忠孝西路1段50號2樓,廢止,日常用品零售業
99344626,久億企業社,臺北市中正區沅陵街9號1樓,廢止,日常用品零售業
14724385,天行健資訊社,臺北市中山區民生東路2段119號地下1層之2,歇業／撤銷,日常用品零售業
73894006,利懋國際商行,臺北市松山區南京東路3段285號7樓,歇業／撤銷,日常用品零售業
73889165,古早人陶瓷工藝坊,臺北市中山區建國北路3段74號12樓,遷他縣市,日常用品零售業
25551846,夏木漱石生活館,臺北市大安區光復南路616號7樓之1,歇業／撤銷,日常用品零售業
14715554,采峰精品行,臺北市大同區民生西路51號1樓,歇業／撤銷,日常用品零售業
26250452,金億商行,臺北市中正區南昌路2段42巷18號4樓,歇業／撤銷,日常用品零售業
38576399,甯手工皂坊,臺北市內湖區行善路45號1樓,核准設立,日常用品零售業
48787339,北投小雜舖,臺北市北投區新市街25號,核准設立,日常用品零售業
25516975,畢娃樂坊,臺北市松山區民生東路3段113巷25弄8號,核准設立,日常用品零售業
31866035,品睿商行,臺北市中山區復興北路288號7樓之3,核准設立,日常用品零售業
01846239,仁中行,臺北市士林區承德路4段266巷4號3樓,核准設立,日常用品零售業
31881107,富田企業,臺北市大同區民權西路72號,歇業／撤銷,日常用品零售業
48855954,紅綩酒珠寶名店,臺北市大安區忠孝東路4段325號12樓,歇業／撤銷,日常用品零售業
14347593,旺來精品百貨名店,臺北市中山區天祥路22號1樓,歇業／撤銷,日常用品零售業
14332521,璀色精品店,臺北市大安區忠孝東路4段216巷19弄5號1樓,歇業／撤銷,日常用品零售業
17758035,廣?堂企業社,臺北市大安區羅斯福路2段33號5樓,歇業／撤銷,日常用品零售業
98919932,翔宇企業社,臺北市信義區吳興街362號7樓,歇業／撤銷,日常用品零售業
31869238,伊奇商行,臺北市北投區中央北路4段501號1樓,停業,日常用品零售業
31878031,伊來企業社,臺北市內湖區麗山街67號2樓,核准設立,日常用品零售業
48687036,首爾國際商行,臺北市士林區天母東路22巷23號6樓之2,歇業／撤銷,日常用品零售業
10372492,車美樂興業行,臺北市信義區福德街50號,核准設立,日常用品零售業
38474816,光妍企業社,臺北市士林區葫東街40號1樓,歇業／撤銷,日常用品零售業
48673960,鑫礸企業社,臺北市內湖區港墘路43號1樓,歇業／撤銷,日常用品零售業
27172645,洋生洋行,臺北市中正區汀州路3段180號1樓,歇業／撤銷,日常用品零售業
38513037,瑞音坊,臺北市士林區中山北路5段694號,核准設立,日常用品零售業
18103154,汎韻商行,臺北市大安區仁愛路4段71巷8號2樓,遷他縣市,日常用品零售業
17262560,尚渼商行,臺北市士林區文林路76號1樓,歇業／撤銷,日常用品零售業
15888504,遠東衣架行,臺北市中正區西寧南路13號1樓,歇業／撤銷,日常用品零售業
48907670,減茶一夏複合式休閒館,臺北市南港區重陽路166巷8號,廢止,日常用品零售業
99355931,錡順行,臺北市士林區延平北路6段116巷39弄2號1樓,歇業／撤銷,日常用品零售業
21537295,恩百國際企業社,臺北市文山區木柵路1段169號,廢止,日常用品零售業
42275888,岩璞茶行,臺北市信義區莊敬路341巷3號,遷他縣市,日常用品零售業
04372690,五常什貨店,臺北市中山區五常街139號之2,歇業／撤銷,日常用品零售業
25551901,瑟技髮廊,臺北市大安區仁愛路4段345巷4弄32號,核准設立,日常用品零售業
99983735,富得企業行,臺北市南港區南港路1段287巷2之1號3樓,遷他縣市,日常用品零售業
48799948,陶喜家飾店,臺北市士林區天母西路41巷9號,歇業／撤銷,日常用品零售業
01383238,鴻裕企業社,臺北市北投區富貴一路5巷12號1樓,核准設立,日常用品零售業
26247176,寧靜泰養生館,臺北市中山區長安東路1段24號,歇業／撤銷,日常用品零售業
48838956,深梓服飾行,臺北市松山區民權東路3段120號,停業,日常用品零售業
17270436,慎泰企業社,臺北市中山區建國北路1段28號2樓,遷他縣市,日常用品零售業
19526434,加新五金行,臺北市文山區木柵路1段66之8號,核准設立,日常用品零售業
31868505,大宇精品店,臺北市大安區永康街2巷7號,核准設立,日常用品零售業
48851660,盛隆書局,臺北市中山區中原街35號,核准設立,日常用品零售業
98893757,長青歌商行,臺北市內湖區康寧路3段189巷18號地下樓,歇業／撤銷,日常用品零售業
38570135,洪白服飾店,臺北市大安區安東街40巷7號,核准設立,日常用品零售業
98919530,杜林商行,臺北市松山區忠孝東路5段17號10樓,歇業／撤銷,日常用品零售業
38566104,羅亭企業社,臺北市中正區許昌街42之1號10樓,核准設立,日常用品零售業
18377983,瑞龍企業社,臺北市文山區木新路3段310巷12弄15號1樓,歇業／撤銷,日常用品零售業
13449002,中國菁桂行,臺北市大同區承德路1段46號,歇業／撤銷,日常用品零售業
26249147,樓蘭小舖,臺北市士林區士東路266巷5弄2號3樓,歇業／撤銷,日常用品零售業
99301289,捷德數位企業社,臺北市大同區民生西路231號3樓之5,遷他縣市,日常用品零售業
48950232,圓滿國際企業社,臺北市萬華區成都路110號10樓之6,核准設立,日常用品零售業
48582883,原鄉企業社,臺北市南港區研究院路3段86巷27弄1號1樓,遷他縣市,日常用品零售業
98912699,曜昌國際商行,臺北市中山區南京東路1段2號6樓之5,歇業／撤銷,日常用品零售業
48764407,富都企業社,臺北市中山區松江路27號5樓之4,歇業／撤銷,日常用品零售業
14341401,壽司王商行,臺北市中正區重慶南路1段13號1樓,歇業／撤銷,日常用品零售業
38504760,喔啦商行,臺北市大安區泰順街50巷19號,核准設立,日常用品零售業
18377816,漢亮傢俱店,臺北市大安區信義路4段199巷17號,核准設立,日常用品零售業
13826053,日堡企業社,臺北市士林區文林路488號4樓,歇業／撤銷,日常用品零售業
01467314,先盈美工五金行,臺北市中正區金門街24巷24號︹之5︺1樓,遷他縣市,日常用品零售業
48774094,柏均五金行,臺北市士林區通河西街2段9號,歇業／撤銷,日常用品零售業
99643928,良成實業社,臺北市萬華區萬大路548號1樓,遷他縣市,日常用品零售業
15652508,信程科技企業社,臺北市內湖區民權東路6段136巷50號1樓,歇業／撤銷,日常用品零售業
48713040,參壹便利館,臺北市大安區瑞安街137號,廢止,日常用品零售業
21717873,麻吉小舖,臺北市大同區延平北路1段51號10樓之10,核准設立,日常用品零售業
17268868,豐藝文化社,臺北市大安區安居街8巷11號1樓,歇業／撤銷,日常用品零售業
10355825,寬齊食品行,臺北市內湖區文湖街21巷98弄1號,歇業／撤銷,日常用品零售業
81789153,宏國行,臺北市中正區南昌路2段82號,歇業／撤銷,日常用品零售業
25668304,鑫德汽車美容坊,臺北市內湖區環山路2段109巷3弄11號1樓,遷他縣市,日常用品零售業
48762371,亞繆蕾時尚設計企業社,臺北市大同區寧夏路11號4樓之9,遷他縣市,日常用品零售業
17756640,芝品香商行,臺北市大同區延平北路2段126號1樓,歇業／撤銷,日常用品零售業
48871722,愛海維根小站,臺北市南港區南港路3段149巷43號,核准設立,日常用品零售業
