83919483,大友日常用品行,臺北市信義區永吉路120巷75號,建材零售業
73905910,芳國企業社,臺北市信義區莊敬路423巷2弄10號1樓,建材零售業
25548483,銘彥五金企業社,臺北市萬華區西藏路180號,建材零售業
25555717,景華五金百貨行,臺北市文山區景華街222號,建材零售業
48851275,譽興工程行,臺北市文山區興隆路2段95巷5號,建材零售業
26255652,德合水電材料社,臺北市北投區育仁路85號,建材零售業
48777064,承泰不袗工程行,臺北市士林區永平街16號1樓,建材零售業
17769342,鼎豪室內裝修設計工程行,臺北市北投區中央北路4段124號1樓,建材零售業
99358536,鼎豐木業行,臺北市大安區新生南路1段165巷3號1樓,建材零售業
48823314,金興隆工程行,臺北市文山區興隆路2段130巷19號,建材零售業
17759196,誌恩禮儀社,臺北市文山區興隆路4段32號,建材零售業
38501905,石神工程行,臺北市萬華區昆明街46號7樓之47,建材零售業
25554463,紘華工程行,臺北市北投區中央北路4段142巷2之1號2樓,建材零售業
38496142,隆德工程行,臺北市內湖區康寧路1段1號3樓,建材零售業
21741607,尚益實業裝潢行,臺北市中山區新生北路3段84巷9號2樓之1,建材零售業
99972250,蔣京企業社,臺北市內湖區大湖山莊街218號8樓,建材零售業
14716483,建寬工程行,臺北市南港區研究院路3段29號,建材零售業
17543128,鉅亞企業社,臺北市士林區大東路174號1樓,建材零售業
13476372,健宏水電行,臺北市萬華區萬青路150號,建材零售業
10314661,榳擎設計工作室,臺北市松山區南京東路4段56號10樓之6,建材零售業
99357184,煒立企業社,臺北市北投區中央南路1段46號1樓,建材零售業
99608513,圓邦企業社,臺北市士林區延平北路5段136巷27弄21號,建材零售業
25580167,僑富工程行,臺北市中山區中原街9號,建材零售業
73885061,昌庭建材行,臺北市松山區新中街12巷20號,建材零售業
17743940,王維水電冷氣工程行,臺北市大同區重慶北路3段152巷12號1樓,建材零售業
10335814,佳能企業社,臺北市中山區民生東路1段96號1樓,建材零售業
83945481,石黑建材行,臺北市南港區興中路58號,建材零售業
26211655,一九六工程行,臺北市大安區復興南路1段253巷38號1樓,建材零售業
10303025,嘉銘企業社,臺北市大安區龍泉街61號,建材零售業
26232722,鼎旺企業社,臺北市北投區文林北路252號3樓,建材零售業
10382029,承寬工作坊,臺北市信義區基隆路2段189號15樓之13,建材零售業
31961256,蔡念孝空間設計工作室,臺北市大安區忠孝東路4段333號7樓之1,建材零售業
17259002,晨富不袗工程行,臺北市萬華區和平西路3段328號1樓,建材零售業
48750831,皇興工程行,臺北市中山區長春路258巷6號7樓之11,建材零售業
37851657,運達通企業商行,臺北市中正區衡陽路10號12樓,建材零售業
17766041,宏鎰企業社,臺北市北投區崇仁路1段45號,建材零售業
38572204,阿杜工程行,臺北市內湖區江南街71巷65弄15號7樓,建材零售業
31959569,予峰石材行,臺北市士林區延平北路8段80巷53弄4號,建材零售業
48953505,光大企業社,臺北市松山區南京東路4段197號4樓,建材零售業
10396895,原宏工程行,臺北市南港區東新街77巷9號,建材零售業
38505389,探子設計實驗室,臺北市大同區鄭州路55號3樓,建材零售業
17084974,鑫鎂設計室內裝修工程行,臺北市信義區基隆路1段143號6樓之7,建材零售業
77137026,福昌商行,臺北市萬華區中華路1段196之3號1樓,建材零售業
24034177,東田工程行,臺北市松山區寶清街22之1號1樓,建材零售業
20996840,上順五金行,臺北市信義區永吉路189之2號1樓,建材零售業
29343477,全益工程行,臺北市中正區汀州路1段109號,建材零售業
01358548,雅祥室內裝修設計行,臺北市北投區公館路61號1樓,建材零售業
38503642,明旺工程行,臺北市信義區虎林街100巷45號,建材零售業
13826286,良柏工程行,臺北市中山區農安街28之1號3樓之2,建材零售業
99961401,欣興工程行,臺北市南港區成福路202號1樓,建材零售業
26231934,小天使傢俱商行,臺北市內湖區環山路1段83號,建材零售業
31948509,勝發工程行,臺北市士林區格致路20巷1號2樓之7,建材零售業
81652184,信方裝潢行,臺北市內湖區內湖路1段737巷29號2樓,建材零售業
99643912,宏龍工程行,臺北市中山區長安東路2段142號7樓之2,建材零售業
15645916,翰興五金商行,臺北市北投區中央南路1段19號,建材零售業
77929569,威廷企業社,臺北市士林區中正路655巷17號4樓,建材零售業
38572632,振鼎工程行,臺北市中山區林森北路259巷9號5樓之14,建材零售業
99955506,惠華空間景觀設計坊,臺北市中山區長安東路2段118之3號1樓,建材零售業
25671217,駿和企業社,臺北市大同區重慶北路3段113巷4號,建材零售業
92908640,立德工程行,臺北市內湖區康樂街48巷16號,建材零售業
14339480,玉山門窗專賣店,臺北市南港區南港路3段296號1樓,建材零售業
80993446,明恩企業社,臺北市南港區玉成街2號1樓,建材零售業
10601214,源清工程行,臺北市北投區自強街5巷56號,建材零售業
17774437,古特設計工作室,臺北市信義區忠孝東路4段553巷34號1樓,建材零售業
81636755,友山企業行,臺北市士林區大南路393號1樓,建材零售業
31950173,璽園建設開發企業社,臺北市內湖區基湖路10巷46號5樓,建材零售業
38507083,鼎記照明企業社,臺北市北投區文化三路22號3樓,建材零售業
31952881,名耀室內裝修工程行,臺北市萬華區環河南路2段100巷5號5樓,建材零售業
01582258,承航室內裝修工程行,臺北市南港區成福路212號5樓,建材零售業
38573034,星陽園藝社,臺北市大安區富陽街102號1樓,建材零售業
17264568,允湛企業行,臺北市文山區辛亥路4段99號2樓,建材零售業
18410688,和康水電行,臺北市信義區吳興街65號1樓,建材零售業
38560495,雅登工程行,臺北市北投區義理街72號2樓,建材零售業
42268465,帷新工程行,臺北市中山區民族東路410巷23弄22號5樓,建材零售業
13828334,家齊企業社,臺北市大安區敦化南路1段376號2樓,建材零售業
25516840,天際線室內裝修工作坊,臺北市萬華區東園街177號4樓,建材零售業
13848211,天揚衛生工程行,臺北市文山區忠順街2段100號6樓,建材零售業
99966139,祐德玻璃工程行,臺北市中山區民權東路3段75巷2弄9號1樓,建材零售業
25577064,佳盛清潔服務社,臺北市北投區新民路1巷8號5樓之3,建材零售業
99987373,宇星空間室內裝修工作室,臺北市中正區汀州路1段92巷3號1樓,建材零售業
26374828,鋐昌工程行,臺北市中正區北平東路20號3樓,建材零售業
26237986,毅勃石室工程行,臺北市士林區士東路46巷5之1號6樓,建材零售業
25599763,景德鎮傢俱裝潢行,臺北市大同區環河北路2段281號,建材零售業
13826547,鎮豐企業社,臺北市信義區忠孝東路5段71巷3弄24號2樓,建材零售業
10386989,成淵工程行,臺北市士林區通河西街1段135號3樓之2,建材零售業
83933078,燈輝照明材料行,臺北市大同區承德路3段174號3樓,建材零售業
17766083,至上工程行,臺北市文山區木新路3段95巷50號8樓,建材零售業
26361020,罌粟工程行,臺北市北投區民族街10號2樓,建材零售業
17270457,立恆實業行,臺北市信義區松信路107號,建材零售業
26234284,賴氏水車工程行,臺北市北投區石牌路1段17號,建材零售業
31402253,祥鼎工程行,臺北市萬華區東園街28巷50之6號,建材零售業
41070606,創升工程行,臺北市內湖區東湖路160巷10弄20號4樓,建材零售業
26224960,忠信建材行,臺北市中山區龍江路429巷1號1樓,建材零售業
48773927,廣樹工程行,臺北市文山區新光路1段160號1樓,建材零售業
17770523,明發環保企業社,臺北市大同區錦西街38巷18號1樓,建材零售業
25663309,千川工程行,臺北市北投區中和街274號,建材零售業
10314590,利國企業社,臺北市南港區昆陽街140巷19號,建材零售業
31858106,開暘企業社,臺北市南港區舊莊街1段145巷6弄13號,建材零售業
25551661,友良企業社,臺北市南港區興南街52巷29之1號3樓,建材零售業
26208429,宗冠裝潢工程行,臺北市士林區延平北路5段163巷26弄22號2樓,建材零售業
14718757,大湖企業社,臺北市內湖區東湖路113巷91號2樓,建材零售業
48826781,銘晟企業社,臺北市中山區龍江路412巷5號,建材零售業
99349093,琨海企業行,臺北市大安區安居街35巷12號1樓,建材零售業
31856120,蓋亞土木包工業,臺北市中山區農安街34號5樓之15,建材零售業
81709855,合眾企業社,臺北市大同區延平北路4段102巷41號,建材零售業
26226600,健新工程行,臺北市北投區中央北路3段272號2樓,建材零售業
48762484,原采視覺工作室,臺北市南港區重陽路547號6樓,建材零售業
38474885,潤林商行,臺北市南港區永吉路535號1樓,建材零售業
48979977,桂采企業社,臺北市信義區信安街30號,建材零售業
26726035,郝鄰居企業社,臺北市大同區環河北路2段95號,建材零售業
48839250,宏?工程行,臺北市內湖區內湖路1段91巷90號3樓,建材零售業
26372510,營碩工程行,臺北市信義區信義路5段150巷445弄1號,建材零售業
48999214,玄皇工程行,臺北市文山區興隆路3段192巷8弄42號,建材零售業
48868178,浩禎企業社,臺北市北投區中央南路1段70號,建材零售業
10330487,一葉企業社,臺北市內湖區康樂街136巷3弄18號2樓,建材零售業
48698245,恆億水電材料行,臺北市文山區恆光街14巷16號1樓,建材零售業
10382941,伍力工程行,臺北市中山區北安路670巷9號,建材零售業
04907821,順華建材行,臺北市文山區興隆路4段197號,建材零售業
19526434,加新五金行,臺北市文山區木柵路1段66之8號,建材零售業
38575589,以勒工程行,臺北市大安區忠孝東路3段249號3樓,建材零售業
48810319,山葉工程行,臺北市內湖區康樂街136巷3弄18號3樓之2,建材零售業
17255527,保台建材行,臺北市信義區林口街124號1樓,建材零售業
31850239,潤霖工程行,臺北市內湖區潭美街131號地下,建材零售業
21777914,定鑫裝璜工程行,臺北市萬華區武成街7號1樓,建材零售業
83940134,盛頂建材行,臺北市士林區社中街330號1樓,建材零售業
48936400,亨佳工程行,臺北市北投區公館路340巷6號,建材零售業
29238448,超函地板工程行,臺北市大安區復興南路2段180巷18號1樓,建材零售業
12403020,龍江五金建材行,臺北市中山區龍江路200之3號,建材零售業
25557124,龍鈦五金行,臺北市松山區八德路4段481號,建材零售業
27180119,歐萊特室內裝修設計工程行,臺北市文山區一壽街20巷11號5樓,建材零售業
77912976,明禾建材行,臺北市大安區富陽路120號1樓,建材零售業
01484221,立吉事業坊,臺北市中正區中華路2段381巷15弄9號,建材零售業
26252521,金鼎工程行,臺北市大同區昌吉街121號,建材零售業
99348812,永誠建材行,臺北市大同區寧夏路112之3號1樓,建材零售業
25658994,義昇裝潢工程行,臺北市內湖區康樂街136巷30弄2號5樓,建材零售業
14339448,大信工程行,臺北市大安區復興南路1段85號1樓,建材零售業
