38552811,蓁豪小吃店,臺北市士林區文林路766號1樓,核准設立,食品什貨、飲料零售業
38511024,瓏珍企業社,臺北市南港區南港路3段106巷7弄8號4樓,核准設立,食品什貨、飲料零售業
26340721,良金企業社,臺北市中正區汀州路1段102號,核准設立,食品什貨、飲料零售業
26235609,恩生禮品行,臺北市萬華區康定路20號1樓之1,核准設立,食品什貨、飲料零售業
26209948,尚尹企業社,臺北市文山區萬寧街129號10樓之2,核准設立,食品什貨、飲料零售業
25582947,金將菁仔行,臺北市萬華區寶興街11號1樓,核准設立,食品什貨、飲料零售業
78350050,益榮食品行,臺北市松山區富錦街581巷11號,核准設立,食品什貨、飲料零售業
31857612,小牧人手作工作室,臺北市內湖區康寧路3段99巷2號,核准設立,食品什貨、飲料零售業
31869856,泰皇泰式料理坊,臺北市內湖區成功路5段69號1樓,核准設立,食品什貨、飲料零售業
38569046,耐汀普拉斯企業社,臺北市大安區安東街45之2號,核准設立,食品什貨、飲料零售業
01785789,咖里屋小吃坊,臺北市大安區金華街199巷1弄4號1樓,核准設立,食品什貨、飲料零售業
31855298,辰將企業社,臺北市萬華區大理街157號,核准設立,食品什貨、飲料零售業
48932896,奉陪品茗餐飲,臺北市文山區指南路3段38巷37之1號(2樓),核准設立,食品什貨、飲料零售業
38601616,鮮豆烘焙商行,臺北市南港區研究院路2段92號1樓,核准設立,食品什貨、飲料零售業
38552994,盛曠二十八餐廳,臺北市中山區南京東路3段28號地下,核准設立,食品什貨、飲料零售業
17742983,喜悅來食坊,臺北市中正區市民大道1段100號地下1層(鄭州地下街商場輕食區024號店舖),核准設立,食品什貨、飲料零售業
31864901,大客滿商行,臺北市大安區延吉街70巷8號,核准設立,食品什貨、飲料零售業
17756424,和進商行,臺北市中正區市民大道一段一00號地下一層鄭州路地下街商場輕食1區006號,核准設立,食品什貨、飲料零售業
14718882,千豐食品商行,臺北市松山區富錦街108號1樓,核准設立,食品什貨、飲料零售業
31963894,淞美商行,臺北市松山區新東街41之6號,核准設立,食品什貨、飲料零售業
27181686,鄭義月檳榔店,臺北市信義區吳興街345巷5號1樓,核准設立,食品什貨、飲料零售業
26229536,密斯黛安小舖,臺北市中正區南海路112號,核准設立,食品什貨、飲料零售業
21704194,源進洋行,臺北市大同區太原路47號〈1樓〉,核准設立,食品什貨、飲料零售業
48890376,茗穀屋烘焙坊,臺北市內湖區內湖路3段43號,核准設立,食品什貨、飲料零售業
48705323,陽光食品坊,臺北市內湖區內湖路1段323巷21弄22號,核准設立,食品什貨、飲料零售業
38575069,易河行,臺北市士林區忠誠路2段136號1樓,核准設立,食品什貨、飲料零售業
38473611,魔法站前商行,臺北市中正區忠孝西路1段173號,核准設立,食品什貨、飲料零售業
48834564,吉甲地商行,臺北市大安區光復南路102號1樓,核准設立,食品什貨、飲料零售業
13858575,八集鍋貼店,臺北市松山區八德路3段221號,核准設立,食品什貨、飲料零售業
10376700,陽明小吃店,臺北市大同區延平北路3段156號,核准設立,食品什貨、飲料零售業
48872757,致發企業社,臺北市士林區至誠路2段132號,核准設立,食品什貨、飲料零售業
31860877,巷仔口食品店,臺北市士林區延平北路5段304號1樓,核准設立,食品什貨、飲料零售業
31865036,健瑛行,臺北市中山區民生東路1段25號6樓之24,核准設立,食品什貨、飲料零售業
41370955,承延軒食品行,臺北市大安區忠孝東路4段293號6樓之2,核准設立,食品什貨、飲料零售業
30359807,新興食品行,臺北市文山區景美街55號,核准設立,食品什貨、飲料零售業
26348625,連線咖啡,臺北市信義區基隆路1段188之2號,核准設立,食品什貨、飲料零售業
99960178,紅鑽餐坊,臺北市中山區長安東路1段53巷18號1樓,核准設立,食品什貨、飲料零售業
10311355,樂騏單車精品行,臺北市大安區信義路2段86巷10號1樓,核准設立,食品什貨、飲料零售業
48896076,魚太豐生猛海鮮小吃店,臺北市大安區新生南路2段28號,核准設立,食品什貨、飲料零售業
31955424,享咖啡企業社,臺北市大安區仁愛路4段71巷9號(1樓),核准設立,食品什貨、飲料零售業
13841478,金九龍商行,臺北市士林區中正路235巷8號,核准設立,食品什貨、飲料零售業
38495565,萬如茶行,臺北市中山區錦西街18號,核准設立,食品什貨、飲料零售業
21721150,龍月堂糕餅舖,臺北市大同區延平北路2段169號1樓,核准設立,食品什貨、飲料零售業
26214800,白壽日興健康生活館,臺北市內湖區東湖路7巷5號,核准設立,食品什貨、飲料零售業
38577849,水滴手作烘焙坊,臺北市文山區保儀路167號,核准設立,食品什貨、飲料零售業
29213087,沈記川味商行,臺北市中正區南海路2巷2號1樓,核准設立,食品什貨、飲料零售業
26228142,你會紅飲食坊,臺北市中山區四平街66號2樓,核准設立,食品什貨、飲料零售業
26246471,熹亞餐廳,臺北市中山區林森北路119巷7號1樓,核准設立,食品什貨、飲料零售業
31859267,力升企業社,臺北市文山區景興路262號13樓之2,核准設立,食品什貨、飲料零售業
48979293,羅曼蒂克餐廳,臺北市中山區林森北路145巷22號,核准設立,食品什貨、飲料零售業
26241399,福星手工養生饅頭坊,臺北市大安區建國南路2段79巷5號,核准設立,食品什貨、飲料零售業
48693348,夏可義式餐坊,臺北市松山區南京東路3段335巷17之1號1樓,核准設立,食品什貨、飲料零售業
38513212,禎漾食品行,臺北市中山區雙城街13巷5號,核准設立,食品什貨、飲料零售業
99344610,德芳漢堡店,臺北市中正區延平南路220號1樓,核准設立,食品什貨、飲料零售業
26229043,益丞蔘藥號,臺北市大同區延平北路2段181號,核准設立,食品什貨、飲料零售業
25560079,金茗貿易行,臺北市信義區基隆路1段350號1樓,核准設立,食品什貨、飲料零售業
99612684,祿意絲餐飲國際商行,臺北市大安區敦化南路1段236巷18號1樓,核准設立,食品什貨、飲料零售業
17747875,詩蕾食品坊,臺北市內湖區港墘路69號1樓,核准設立,食品什貨、飲料零售業
31861165,敬業實業社,臺北市中山區敬業三路22號5樓,核准設立,食品什貨、飲料零售業
26217763,葉林貿易行,臺北市內湖區康寧路1段152號1樓,核准設立,食品什貨、飲料零售業
38462543,松子企業社,臺北市北投區崇仁路1段131巷2弄6號4樓,核准設立,食品什貨、飲料零售業
48851514,城市烘焙坊,臺北市內湖區麗山街137號,核准設立,食品什貨、飲料零售業
99981080,亞堤香法式烘焙坊,臺北市內湖區江南街99號1樓,核准設立,食品什貨、飲料零售業
31878898,麗味庭食品商行,臺北市南港區成福路20號,核准設立,食品什貨、飲料零售業
25574496,倍羚國際商行,臺北市大安區和平東路1段141巷7號之2,核准設立,食品什貨、飲料零售業
29231212,二空眷村小館,臺北市松山區敦化北路155巷14號1樓,核准設立,食品什貨、飲料零售業
31982457,羅福記製麵店,臺北市中正區汀州路1段131巷11號,核准設立,食品什貨、飲料零售業
70979938,優墾產銷商行,臺北市大安區忠孝東路3段136號10樓之3,核准設立,食品什貨、飲料零售業
17547497,佳昕行,臺北市萬華區西昌街213號1樓,核准設立,食品什貨、飲料零售業
26213400,小小餐館,臺北市大安區信義路4段60之24號1樓,核准設立,食品什貨、飲料零售業
83917128,廣紀食品行,臺北市大安區通化街122號1樓,核准設立,食品什貨、飲料零售業
01404162,元緣圓茶藝行,臺北市北投區承德路7段臨1之3號,核准設立,食品什貨、飲料零售業
38463206,拾伍階工作室,臺北市信義區莊敬路423巷7弄25號1樓,核准設立,食品什貨、飲料零售業
38509033,凱鴻企業社,臺北市中山區北安路458巷41弄29號1樓,核准設立,食品什貨、飲料零售業
26353295,特斯堤烘焙工作室,臺北市中山區龍江路415巷2號2樓,核准設立,食品什貨、飲料零售業
48896414,九象限顧問展業社,臺北市大安區忠孝東路4段162號10樓之2,核准設立,食品什貨、飲料零售業
99605500,聖堡羅香雞排店,臺北市文山區羅斯福路6段403號1樓,核准設立,食品什貨、飲料零售業
31953137,廣州伊露發小吃店,臺北市萬華區西園路1段168號8樓,核准設立,食品什貨、飲料零售業
25520886,活水養生小舖,臺北市中山區明水路397巷19弄16號,核准設立,食品什貨、飲料零售業
17257258,慶貓餐廳,臺北市中山區林森北路159巷44號,核准設立,食品什貨、飲料零售業
31863396,張一番企業社,臺北市北投區雙全街34號,核准設立,食品什貨、飲料零售業
10370570,小廚房複合式早餐店,臺北市大同區酒泉街19號,核准設立,食品什貨、飲料零售業
48991661,上鑽檳榔店,臺北市南港區成福路190號,核准設立,食品什貨、飲料零售業
31879989,小?食品坊,臺北市北投區中和街493巷5弄9號1樓,核准設立,食品什貨、飲料零售業
38553749,五味瓶餐廳,臺北市大安區永康街61巷15號,核准設立,食品什貨、飲料零售業
10311475,李家食堂,臺北市大同區民族西路292號,核准設立,食品什貨、飲料零售業
14716385,原香居飲品坊,臺北市北投區新市街75號1樓,核准設立,食品什貨、飲料零售業
26229959,朱渱小吃店,臺北市萬華區中華路1段114巷19號2樓,核准設立,食品什貨、飲料零售業
26375100,大傑企業社,臺北市文山區辛亥路6段35號10樓之2,核准設立,食品什貨、飲料零售業
01162468,榮豐企業社,臺北市大同區迪化街1段338號,核准設立,食品什貨、飲料零售業
38573750,木之樣企業行,臺北市大安區和平東路2段118巷52弄16號,核准設立,食品什貨、飲料零售業
80998060,悅大商行,臺北市中山區復興北路204號6樓之4,核准設立,食品什貨、飲料零售業
49986510,宏記洋行,臺北市大同區重慶北路1段67號8樓之2,核准設立,食品什貨、飲料零售業
38497085,饅對味手工饅頭包子專賣店,臺北市內湖區文德路111號1樓,核准設立,食品什貨、飲料零售業
48815996,喬義麵館,臺北市大安區羅斯福路3段283巷23號,核准設立,食品什貨、飲料零售業
25553627,倫浩堂食品行,臺北市大同區長安西路242、244號1樓,核准設立,食品什貨、飲料零售業
77512731,欣茂茶行,臺北市大同區民族西路220號,核准設立,食品什貨、飲料零售業
26256370,南京東飲食坊,臺北市中山區南京東路2段21巷8號地下室,核准設立,食品什貨、飲料零售業
10336898,天母玩具店,臺北市北投區天母西路132之6號,核准設立,食品什貨、飲料零售業
81776452,日太蔘茸藥行,臺北市大同區歸綏街267號1樓,核准設立,食品什貨、飲料零售業
25560747,旭昇企業社,臺北市信義區吳興街180號,核准設立,食品什貨、飲料零售業
26354082,創意烘焙坊,臺北市士林區福港街103號1樓,核准設立,食品什貨、飲料零售業
37913035,來喜商行,臺北市中正區北平東路2號,核准設立,食品什貨、飲料零售業
25546458,芸采餐廳,臺北市中山區中山北路1段83巷22號,核准設立,食品什貨、飲料零售業
77138989,鄉村茶莊,臺北市萬華區康定路25巷3號1樓,核准設立,食品什貨、飲料零售業
10376862,世界豆漿店,臺北市中山區龍江路356巷2號,核准設立,食品什貨、飲料零售業
26215054,四平五八早餐店,臺北市中山區四平街4號,核准設立,食品什貨、飲料零售業
38497923,甘苦一滴商行,臺北市大安區信義路4段30巷29號,核准設立,食品什貨、飲料零售業
26348505,忠孝資訊館,臺北市南港區忠孝東路6段296號,核准設立,食品什貨、飲料零售業
10330711,佰元剪髮工作坊,臺北市萬華區長沙街2段85號,核准設立,食品什貨、飲料零售業
29220377,臻品關東煮小吃店,臺北市松山區民生東路4段56巷3弄1號1樓,核准設立,食品什貨、飲料零售業
25584109,三葉足健養生館,臺北市中山區雙城街17之3號2樓,核准設立,食品什貨、飲料零售業
38557323,岳家食品行,臺北市北投區天母西路117巷12-1號6樓之1,核准設立,食品什貨、飲料零售業
15658762,佑鑫商行,臺北市中正區水源路39之3號,核准設立,食品什貨、飲料零售業
25517910,米鄉小吃店,臺北市內湖區東湖路33巷11號,核准設立,食品什貨、飲料零售業
99609560,三仁肉鬆店,臺北市中山區民族東路410巷41號1樓,核准設立,食品什貨、飲料零售業
38470749,達達原味手工烘焙坊,臺北市中山區吉林路265號1樓,核准設立,食品什貨、飲料零售業
01166464,迪化建安行,臺北市大同區迪化街1段72巷9號,核准設立,食品什貨、飲料零售業
31870805,米哇企業社,臺北市信義區永吉路170號12樓,核准設立,食品什貨、飲料零售業
38557371,大晟小吃店,臺北市大安區和平東路3段228巷53號,核准設立,食品什貨、飲料零售業
01447937,韓泰商行,臺北市萬華區西寧南路201號1樓,核准設立,食品什貨、飲料零售業
31881970,廣泰灃潮州包子店,臺北市南港區忠孝東路6段122號,核准設立,食品什貨、飲料零售業
38509499,蘋果糖發廚坊,臺北市內湖區陽光街289號,核准設立,食品什貨、飲料零售業
25551888,龍園茶行,臺北市大安區通安街99號,核准設立,食品什貨、飲料零售業
18389159,酩園商行,臺北市大安區安和路1段137號地下1樓,核准設立,食品什貨、飲料零售業
38458267,佳泰商行,臺北市中山區八德路2段318號(1樓),核准設立,食品什貨、飲料零售業
38464824,運昌商行,臺北市中山區長安東路2段161之1號1樓,核准設立,食品什貨、飲料零售業
48950916,水坊軒,臺北市萬華區三水街124號6樓,核准設立,食品什貨、飲料零售業
31951573,港龍池上飯包店,臺北市內湖區港墘里港墘路153號1樓,核准設立,食品什貨、飲料零售業
15976372,新之坊餐廳,臺北市萬華區西園路1段212巷4號1樓,核准設立,食品什貨、飲料零售業
81719220,雲泰小吃店,臺北市松山區八德路2段377號1樓,核准設立,食品什貨、飲料零售業
38555970,男子小吃店,臺北市中山區長春路190號1樓,核准設立,食品什貨、飲料零售業
31959104,幸福婚禮小物專賣店,臺北市大同區長安西路170號,核准設立,食品什貨、飲料零售業
26255203,大眾清茶館,臺北市萬華區華西街30巷4號,核准設立,食品什貨、飲料零售業
31856873,家一源企業社,臺北市松山區八德路3段12巷51弄15號,核准設立,食品什貨、飲料零售業
38557983,好杯咖啡商號,臺北市大同區昌吉街22號,核准設立,食品什貨、飲料零售業
48930258,法瑪企業社,臺北市內湖區內湖路1段629巷101弄2號3樓,核准設立,食品什貨、飲料零售業
99355340,酒世界商行,臺北市中正區中華路2段313巷16號,核准設立,食品什貨、飲料零售業
31860763,四季香頂級饅頭店寧波分店,臺北市中正區寧波西街87之1號,核准設立,食品什貨、飲料零售業
48693831,永明菸酒商行,臺北市信義區莊敬路321號1樓,核准設立,食品什貨、飲料零售業
94919897,盛立商行,臺北市中山區民族東路410巷34號1樓,核准設立,食品什貨、飲料零售業
10317457,佳欣冷飲店,臺北市大安區大安路2段88之1號,核准設立,食品什貨、飲料零售業
98905212,大雄蛋行,臺北市大同區錦西街180之3號1樓,核准設立,食品什貨、飲料零售業
14322994,開來商店,臺北市大同區重慶北路1段49巷20號1樓,核准設立,食品什貨、飲料零售業
48704957,橙佳坊,臺北市南港區玉成街211號1樓,核准設立,食品什貨、飲料零售業
31860047,長兆?早餐坊,臺北市信義區光復南路417巷90號,核准設立,食品什貨、飲料零售業
18099594,雙峰酒吧,臺北市中山區林森北路83號地下1樓,核准設立,食品什貨、飲料零售業
13849871,億錸行,臺北市中山區錦州街321號1樓,核准設立,食品什貨、飲料零售業
31962086,歐比爾企業社,臺北市士林區中正路213巷19號,核准設立,食品什貨、飲料零售業
30313373,聖峰企業社,臺北市信義區信義路6段76巷8弄70號,核准設立,食品什貨、飲料零售業
14330349,原點食品商行,臺北市大安區四維路22巷11號,核准設立,食品什貨、飲料零售業
31921950,宏美水晶餃肉包店,臺北市萬華區漢口街2段54之31號,核准設立,食品什貨、飲料零售業
26233320,旺來商行,臺北市大安區伊通街68之3號1樓,核准設立,食品什貨、飲料零售業
38502313,金元豐小吃店,臺北市內湖區港墘路103號,核准設立,食品什貨、飲料零售業
18097505,吉軒茶莊,臺北市松山區長春路474號1樓,核准設立,食品什貨、飲料零售業
04982519,大統西點麵包店,臺北市大安區泰順街15號1樓,核准設立,食品什貨、飲料零售業
21737651,德鑫企業社,臺北市中山區中山北路1段64號1樓,核准設立,食品什貨、飲料零售業
31868879,烤狀元企業社,臺北市松山區南京東路5段123巷6弄1號1樓,核准設立,食品什貨、飲料零售業
26339576,立鑫商行,臺北市中山區長安東路2段81號12樓之1,核准設立,食品什貨、飲料零售業
10305403,鈞朋商行,臺北市大安區復興南路2段84之6號,核准設立,食品什貨、飲料零售業
18630803,正順?店,臺北市中正區羅斯福路1段︹南門市場1樓198號︺,核准設立,食品什貨、飲料零售業
99606120,杏豐製麵店,臺北市士林區士東路100號1樓第26號攤位,核准設立,食品什貨、飲料零售業
94911797,佳惠食品店,臺北市內湖區文德路17號,核准設立,食品什貨、飲料零售業
99612426,魚玄雞小吃店,臺北市文山區興隆路3段229巷1號,核准設立,食品什貨、飲料零售業
38505472,尚品活蝦小吃店,臺北市松山區市民大道4段145號,核准設立,食品什貨、飲料零售業
26358242,鐠蔻商行,臺北市松山區長春路498之1號,核准設立,食品什貨、飲料零售業
26211016,林新利商店,臺北市萬華區莒光路153巷25號1樓,核准設立,食品什貨、飲料零售業
26246710,哈肯帝糖果坊,臺北市萬華區中華路1段114巷4號1樓之23,核准設立,食品什貨、飲料零售業
17740275,南冠美食坊,臺北市中正區市民大道1段100號地下街1層〈鄭州路地下商場輕食區011號店舖〉,核准設立,食品什貨、飲料零售業
25502944,超廣角影像工作室,臺北市大安區師大路49巷3號2樓,核准設立,食品什貨、飲料零售業
77887580,華軒食品行,臺北市大安區泰順街42之1號,核准設立,食品什貨、飲料零售業
31866730,貫旭企業社,臺北市中正區?門街81巷15號4樓,核准設立,食品什貨、飲料零售業
25554421,精彩商行,臺北市中山區中山北路2段72巷28號2樓,核准設立,食品什貨、飲料零售業
25513203,全鴻食品行,臺北市信義區松德路269巷2號,核准設立,食品什貨、飲料零售業
29481962,趕路的雁商行,臺北市北投區中央北路1段96號1樓,核准設立,食品什貨、飲料零售業
48713392,陞龍商行,臺北市萬華區德昌街152號1樓,核准設立,食品什貨、飲料零售業
26337021,祈昌肉店,臺北市士林區德行東路109巷57號1樓,核准設立,食品什貨、飲料零售業
26223815,御房手作企業社,臺北市中正區延平南路163巷2號,核准設立,食品什貨、飲料零售業
48967563,勤揚商店,臺北市大安區通安街101號,核准設立,食品什貨、飲料零售業
13828550,宗榮蛋品企業社,臺北市文山區恆光街22巷23號1樓,核准設立,食品什貨、飲料零售業
26362745,雙月青島東商行,臺北市中正區青島東路6之2號,核准設立,食品什貨、飲料零售業
26222647,上館子企業社,臺北市大安區師大路92巷13號1樓,核准設立,食品什貨、飲料零售業
25586319,利田小吃店,臺北市大安區敦化南路1段160巷9號,核准設立,食品什貨、飲料零售業
31956768,吉巧工坊,臺北市大同區太原路87號,核准設立,食品什貨、飲料零售業
25562365,以琳時尚烘焙坊,臺北市文山區木柵路1段167號,核准設立,食品什貨、飲料零售業
15964066,大通食品行,臺北市萬華區德昌街235巷22號,核准設立,食品什貨、飲料零售業
13820086,生機蔬?行,臺北市內湖區東湖路112號1樓,核准設立,食品什貨、飲料零售業
26367328,賀穗商行,臺北市中山區明水路475巷19號,核准設立,食品什貨、飲料零售業
15643939,美德小吃店,臺北市士林區美德街34號,核准設立,食品什貨、飲料零售業
48964340,雅茗居,臺北市信義區吳興街118巷25弄15號,核准設立,食品什貨、飲料零售業
38502828,信郁企業社,臺北市中山區中原街138號,核准設立,食品什貨、飲料零售業
48823454,恩冕商行,臺北市中山區民生東路1段25之2號,核准設立,食品什貨、飲料零售業
10336829,加得美果汁小舖,臺北市松山區南京東路5段123巷8弄1號,核准設立,食品什貨、飲料零售業
78379578,石記牛肉麵店,臺北市中正區羅斯福路3段244巷10弄21號,核准設立,食品什貨、飲料零售業
26352795,鶴田屋,臺北市中山區北安路595巷2弄16號1樓,核准設立,食品什貨、飲料零售業
26360248,美樂客企業社,臺北市信義區雙和里吳興街284巷59弄2號4樓,核准設立,食品什貨、飲料零售業
13852333,天晴小吃店,臺北市士林區天母北路20號1樓,核准設立,食品什貨、飲料零售業
31866231,頌巧烘焙坊,臺北市北投區石牌路2段86號,核准設立,食品什貨、飲料零售業
31953241,天使美睫工作室,臺北市中正區信陽街11號3樓,核准設立,食品什貨、飲料零售業
25556244,趙時餐坊,臺北市大安區通安街81號地下(1樓),核准設立,食品什貨、飲料零售業
31954662,承臻商行,臺北市內湖區內湖路2段322號,核准設立,食品什貨、飲料零售業
31874008,椰子創意工作室,臺北市中正區中華路2段75巷42號,核准設立,食品什貨、飲料零售業
38508554,農鳳小吃店,臺北市北投區明德路128號,核准設立,食品什貨、飲料零售業
31954403,?達企業社,臺北市士林區社中街231巷26號1樓,核准設立,食品什貨、飲料零售業
81683052,老鄰居小吃店,臺北市內湖區內湖路2段103巷74號1樓,核准設立,食品什貨、飲料零售業
38466077,得發金投注站,臺北市內湖區民權東路6段63號,核准設立,食品什貨、飲料零售業
10359006,元大商行,臺北市中山區民生東路1段25之3號,核准設立,食品什貨、飲料零售業
18090833,清淨天地食品行,臺北市文山區木柵路1段89巷12弄9號,核准設立,食品什貨、飲料零售業
83917746,師大衣著店,臺北市大安區師大路49巷12號1樓,核准設立,食品什貨、飲料零售業
25662126,天晨企業社,臺北市大安區信義路4段265巷23號1樓,核准設立,食品什貨、飲料零售業
48883516,德誠企業社,臺北市中山區南京東路1段16號9樓之1,核准設立,食品什貨、飲料零售業
38577545,阿秀商行,臺北市大同區赤峰街47巷21號1樓,核准設立,食品什貨、飲料零售業
26234030,美雅工藝坊,臺北市中山區遼寧街45巷31號,核准設立,食品什貨、飲料零售業
17084165,佳譽商行,臺北市大同區鄭州路23號1樓,核准設立,食品什貨、飲料零售業
26368234,邦軒小吃店,臺北市大安區市民大道4段20號1樓,核准設立,食品什貨、飲料零售業
26237661,藤元實業社,臺北市信義區大道路52號,核准設立,食品什貨、飲料零售業
38572062,金田肉粽店,臺北市信義區忠孝東路5段372巷27弄77之2號1樓,核准設立,食品什貨、飲料零售業
25628916,茉莉漢堡小吃店,臺北市內湖區瑞光路588號,核准設立,食品什貨、飲料零售業
38510714,茂祥商行,臺北市中山區錦州街46號9樓之1,核准設立,食品什貨、飲料零售業
38560657,摩堤美食坊,臺北市中正區懷寧街42號,核准設立,食品什貨、飲料零售業
38464417,皕蔑茼,臺北市大同區重慶北路2段57巷15號,核准設立,食品什貨、飲料零售業
29236883,人體方程式健美服飾店,臺北市萬華區康定路229號5樓,核准設立,食品什貨、飲料零售業
48830960,祥榮食品行,臺北市萬華區萬大路85巷8號,核准設立,食品什貨、飲料零售業
38555937,人品養生御膳坊,臺北市中山區錦州街50號8樓之18,核准設立,食品什貨、飲料零售業
01721701,春茶鄉茶坊,臺北市文山區指南路3段38巷30號,核准設立,食品什貨、飲料零售業
21777647,月野莎千層蛋糕坊,臺北市士林區忠義街126號1樓,核准設立,食品什貨、飲料零售業
31856803,大器咖啡坊,臺北市大安區大安路2段130號,核准設立,食品什貨、飲料零售業
25556069,閎泰商行,臺北市松山區新東街51巷7號1樓,核准設立,食品什貨、飲料零售業
26349574,麗翔商行,臺北市大安區和平東路1段14號2樓之1,核准設立,食品什貨、飲料零售業
31846762,蕾香焙咖啡輕食館,臺北市中山區建國北路1段67巷31號,核准設立,食品什貨、飲料零售業
