99612087,成功漢堡店,臺北市內湖區成功路2段189之1號,核准設立,食品什貨、飲料零售業
48957191,御珍食品行,臺北市中山區長春路199號1樓,核准設立,食品什貨、飲料零售業
26355723,利威食品企業社,臺北市大同區敦煌路184號1樓,核准設立,食品什貨、飲料零售業
07030021,大隆企業社,臺北市中山區民權東路2段176號2樓,核准設立,食品什貨、飲料零售業
26011143,吃餅乾工坊,臺北市內湖區民權東路6段253號,核准設立,食品什貨、飲料零售業
73872333,紙芸舖,臺北市中山區新生北路2段127巷42號,核准設立,食品什貨、飲料零售業
48929512,喜全冷飲站,臺北市松山區八德路4段791號,核准設立,食品什貨、飲料零售業
31963352,彩金滿堂商行,臺北市萬華區和平西路3段174之1號1樓,核准設立,食品什貨、飲料零售業
31869379,唯田食品行,臺北市萬華區西園路2段111巷9號1樓,核准設立,食品什貨、飲料零售業
25569439,金來旺餐廳,臺北市萬華區三水街124號5樓,核准設立,食品什貨、飲料零售業
26370576,木林森餐藝坊,臺北市信義區忠孝東路5段790巷25弄3號,核准設立,食品什貨、飲料零售業
48843769,利可富室內裝修企業社,臺北市北投區立功街108號1樓,核准設立,食品什貨、飲料零售業
38571887,七姊妹商行,臺北市士林區華榮街89號,核准設立,食品什貨、飲料零售業
26366524,咖瓦咖啡專賣店,臺北市松山區南京東路5段163之6號,核准設立,食品什貨、飲料零售業
31084412,漢昌蔘藥行,臺北市北投區清江路92號1樓,核准設立,食品什貨、飲料零售業
26223955,交朋友汽車百貨行,臺北市信義區吳興街284巷22弄28號1樓,核准設立,食品什貨、飲料零售業
98890745,希悅工作室,臺北市萬華區長沙街2段133號1樓,核准設立,食品什貨、飲料零售業
25672026,牛魔王食品店,臺北市松山區饒河街157號,核准設立,食品什貨、飲料零售業
38464036,晨曦健康工作坊,臺北市南港區研究院路1段2號,核准設立,食品什貨、飲料零售業
38505515,承益企業社,臺北市萬華區昆明街200號7樓之1,核准設立,食品什貨、飲料零售業
10321305,捌捌捌中福實業行,臺北市士林區德行東路250號2樓,核准設立,食品什貨、飲料零售業
14327554,梁祥碧阿松青菜行,臺北市萬華區西寧南路67號,核准設立,食品什貨、飲料零售業
73899001,享迪商行,臺北市士林區福林路251巷5號,核准設立,食品什貨、飲料零售業
27178465,禿頭檳榔店,臺北市南港區南港路3段161號1樓,核准設立,食品什貨、飲料零售業
38504868,優西西咖啡餐坊,臺北市中山區民生東路1段9號,核准設立,食品什貨、飲料零售業
18100229,麗華餅店,臺北市中正區開封街1段57號1樓,核准設立,食品什貨、飲料零售業
31949654,家傳味企業社,臺北市北投區中央北路4段481號,核准設立,食品什貨、飲料零售業
42271200,天母香酥雞,臺北市士林區小北街1號1樓,核准設立,食品什貨、飲料零售業
26526260,咖馬現烘咖啡館,臺北市中正區南昌路1段39號,核准設立,食品什貨、飲料零售業
25549693,阿牛茶舖,臺北市內湖區成功路3段191號,核准設立,食品什貨、飲料零售業
38458132,群青日和生活事業,臺北市中山區大直街52巷3號1樓,核准設立,食品什貨、飲料零售業
48930644,怡紀飲品店,臺北市信義區忠孝東路5段31巷18弄9號1樓,核准設立,食品什貨、飲料零售業
38580936,香香味商行,臺北市大安區忠孝東路3段305號6樓之1,核准設立,食品什貨、飲料零售業
25570626,長青小吃店,臺北市內湖區瑞光路517號,核准設立,食品什貨、飲料零售業
38576139,串前食堂,臺北市中山區民權東路2段6號,核准設立,食品什貨、飲料零售業
99974882,春芳茶館,臺北市萬華區西園路1段79號之1、1樓,核准設立,食品什貨、飲料零售業
94906106,來春飲料店,臺北市大同區民權西路292巷20號,核准設立,食品什貨、飲料零售業
48815588,蒂耀商行,臺北市大同區民生西路169之1號,核准設立,食品什貨、飲料零售業
38578191,悅讚養生館,臺北市松山區饒河街100號,核准設立,食品什貨、飲料零售業
48904651,菊鶴御食館,臺北市士林區天母北路60號,核准設立,食品什貨、飲料零售業
25519852,省錢大作站生活百貨行,臺北市信義區虎林街132巷12號,核准設立,食品什貨、飲料零售業
26229331,包富樂洋行,臺北市中山區合江街36巷32之3號3樓,核准設立,食品什貨、飲料零售業
38561987,完美線條工坊,臺北市松山區南京東路3段256巷51號,核准設立,食品什貨、飲料零售業
21719675,多福商行,臺北市士林區通河街165號1樓,核准設立,食品什貨、飲料零售業
26732640,川湘號,臺北市中山區松江路194巷3號,核准設立,食品什貨、飲料零售業
13826390,全閎商行,臺北市北投區知行路245巷8號,核准設立,食品什貨、飲料零售業
10351476,中麒企業社,臺北市中山區民族東路258號3樓,核准設立,食品什貨、飲料零售業
10346988,昇瑞商行,臺北市大安區通安街73號,核准設立,食品什貨、飲料零售業
80996339,朝陽飲食店,臺北市內湖區行善路25巷1弄1號1樓,核准設立,食品什貨、飲料零售業
38563541,雅品企業社,臺北市中山區南京東路3段89巷3弄11號,核准設立,食品什貨、飲料零售業
25538160,新淨自然坊,臺北市士林區天母東路26號,核准設立,食品什貨、飲料零售業
38470699,水成冰果店,臺北市中山區伊通街52巷15號1樓,核准設立,食品什貨、飲料零售業
26353324,嘉佳柑仔店,臺北市信義區福德街248號,核准設立,食品什貨、飲料零售業
42271166,庫塔廚房,臺北市中山區合江街29號,核准設立,食品什貨、飲料零售業
38565317,世樺企業社,臺北市大同區重慶北路3段65號2樓,核准設立,食品什貨、飲料零售業
83917513,姿璇茶坊,臺北市大同區歸綏街207號,核准設立,食品什貨、飲料零售業
78069829,嘉嘉屋花坊,臺北市信義區永吉路124號1樓,核准設立,食品什貨、飲料零售業
48976198,阿舍養生館,臺北市內湖區民權東路6段280巷74號,核准設立,食品什貨、飲料零售業
80981194,亞泰洗衣坊,臺北市中山區樂群二路150號1樓,核准設立,食品什貨、飲料零售業
25655321,鈺膳園傳統養生美食館,臺北市信義區忠孝東路5段15巷9號,核准設立,食品什貨、飲料零售業
31874984,鴻豐雜糧行,臺北市南港區成福路165號1樓,核准設立,食品什貨、飲料零售業
25665708,小福食品屋,臺北市大安區辛亥路2段171巷12號1樓,核准設立,食品什貨、飲料零售業
25577276,瑪德蓮食品行,臺北市松山區光復北路11巷97號,核准設立,食品什貨、飲料零售業
81717460,那伊村花園茶坊,臺北市文山區指南路3段34巷33之5號,核准設立,食品什貨、飲料零售業
10335758,幸福盒餐坊,臺北市信義區吳興街48號,核准設立,食品什貨、飲料零售業
21778890,語童洋行,臺北市松山區民權東路3段106巷15弄8號1樓,核准設立,食品什貨、飲料零售業
48675427,媽咪早餐店,臺北市文山區辛亥路4段85號,核准設立,食品什貨、飲料零售業
25665714,彩椒廚房,臺北市大安區溫州街74巷5弄1號,核准設立,食品什貨、飲料零售業
27177120,國日花檳榔店,臺北市松山區撫遠街187號1樓,核准設立,食品什貨、飲料零售業
81751656,陳法助檳榔店,臺北市信義區信義路6段85號1樓,核准設立,食品什貨、飲料零售業
38562156,金緣商行,臺北市中山區林森北路105號地下室,核准設立,食品什貨、飲料零售業
48717411,水龜伯古早味店,臺北市北投區石牌路2段75巷8號1樓,核准設立,食品什貨、飲料零售業
25584305,上福茶店,臺北市大安區潮州街32號1樓,核准設立,食品什貨、飲料零售業
48790720,鑫鑫隆小吃店,臺北市松山區八德路4段216號,核准設立,食品什貨、飲料零售業
10355894,尚月中華時尚料理店,臺北市中山區松江路194巷4號1樓,核准設立,食品什貨、飲料零售業
31866823,久良食品行,臺北市中山區八德路2段174巷9弄5號3樓,核准設立,食品什貨、飲料零售業
25671808,亞堤商行,臺北市大安區敦化南路2段63巷57號,核准設立,食品什貨、飲料零售業
17080533,旺旺鋪雙人煮商店,臺北市大安區忠孝東路4段97號4樓,核准設立,食品什貨、飲料零售業
38577572,紐約中央企業社,臺北市中正區羅斯福路3段240巷3號1樓,核准設立,食品什貨、飲料零售業
48791185,財神到投注站,臺北市內湖區民權東路6段63號,核准設立,食品什貨、飲料零售業
48777368,紅箭食品行,臺北市中山區民生西路45巷9弄21號1樓,核准設立,食品什貨、飲料零售業
38506606,有意間咖啡簡餐店,臺北市文山區新光路1段51號,核准設立,食品什貨、飲料零售業
26214013,聖喻飲品店,臺北市中山區中山北路1段105巷6號1樓,核准設立,食品什貨、飲料零售業
38585469,洋嘉彤商行,臺北市信義區永吉路476號,核准設立,食品什貨、飲料零售業
81745389,天天來茶館,臺北市萬華區和平西路3段89巷4號1樓,核准設立,食品什貨、飲料零售業
26241594,元品滷味,臺北市中正區開封街1段2之50號,核准設立,食品什貨、飲料零售業
48536050,彗富食品行,臺北市信義區永吉路332號,核准設立,食品什貨、飲料零售業
31865140,悅庭餐坊,臺北市萬華區康定路36號1樓,核准設立,食品什貨、飲料零售業
48728655,匠香房,臺北市中山區南京東路3段89巷5弄2號1樓,核准設立,食品什貨、飲料零售業
38575618,美芝城食品行,臺北市松山區寧安街7巷1號2樓之1,核准設立,食品什貨、飲料零售業
26249343,馬札羅咖啡烘培商行,臺北市松山區南京東路3段335巷23之11號,核准設立,食品什貨、飲料零售業
04300401,健步鞋號,臺北市大同區民生西路360號1樓,核准設立,食品什貨、飲料零售業
29212881,家一鍋鍋物小酌店,臺北市大安區安和路2段167號,核准設立,食品什貨、飲料零售業
38455711,瑞益商行,臺北市中山區龍江路143號,核准設立,食品什貨、飲料零售業
17747050,統將商行,臺北市大安區溫州街74巷12號,核准設立,食品什貨、飲料零售業
73874183,好好吃食品行,臺北市中山區新生北路2段108號11樓之6,核准設立,食品什貨、飲料零售業
13842167,道朝食品店,臺北市大安區文昌街2號,核准設立,食品什貨、飲料零售業
25508481,朱媽媽精緻美食店,臺北市大安區敦化南路1段270巷22號,核准設立,食品什貨、飲料零售業
10355310,雙成對商行,臺北市文山區羅斯福路5段150巷57號,核准設立,食品什貨、飲料零售業
25655639,爵林商行,臺北市士林區基河路104號,核准設立,食品什貨、飲料零售業
26221801,宏昇興業社,臺北市中山區新生北路1段83號4樓,核准設立,食品什貨、飲料零售業
48943394,熱賣創意製作工作室,臺北市中正區忠孝西路1段50號20樓之4,核准設立,食品什貨、飲料零售業
13859461,滿饌食品行,臺北市中山區松江路132巷34號1樓,核准設立,食品什貨、飲料零售業
26208384,滿?屋台料理店,臺北市大安區師大路92巷臨46號(1樓),核准設立,食品什貨、飲料零售業
81780414,仲鼎科技工程行,臺北市北投區承德路7段382之1號1樓,核准設立,食品什貨、飲料零售業
25516829,盛棠商行,臺北市中山區龍江路100巷1之2號,核准設立,食品什貨、飲料零售業
31403534,普欣禮儀社,臺北市中山區民權東路2段172號2樓,核准設立,食品什貨、飲料零售業
31958153,嘉品商行,臺北市中正區金山南路1段122號,核准設立,食品什貨、飲料零售業
48767087,食尚鑫粿實業社,臺北市文山區指南路2段51號,核准設立,食品什貨、飲料零售業
31859040,延吉胡麻園商行,臺北市大安區延吉街153之4號,核准設立,食品什貨、飲料零售業
17742371,元傑茶莊,臺北市北投區雙全街48巷1號1樓,核准設立,食品什貨、飲料零售業
38561451,行門行素園,臺北市大同區民權西路143號(1樓),核准設立,食品什貨、飲料零售業
29209204,大順小吃店,臺北市萬華區廣州街249號,核准設立,食品什貨、飲料零售業
48960822,糜家莊小吃店,臺北市松山區市民大道4段241號,核准設立,食品什貨、飲料零售業
25664172,馬卡龍酒店,臺北市中山區民生東路1段77號及2、3樓,核准設立,食品什貨、飲料零售業
25567832,信義漢堡店,臺北市信義區基隆路2段131之6號,核准設立,食品什貨、飲料零售業
31861735,蟹王商行,臺北市松山區三民路43巷21號,核准設立,食品什貨、飲料零售業
48953998,德昌茶行,臺北市松山區南京東路5段59巷21號1樓,核准設立,食品什貨、飲料零售業
99619764,飄香食品行,臺北市信義區永吉路30巷115號1樓,核准設立,食品什貨、飲料零售業
31879088,柔柔時尚小鋪,臺北市萬華區東園街32之1號1樓,核准設立,食品什貨、飲料零售業
38473979,瑪克盃飲料店,臺北市信義區忠孝東路4段559巷16弄8號,核准設立,食品什貨、飲料零售業
98914562,上瑩咖啡便利舖,臺北市中正區羅斯福路2段58號1樓,核准設立,食品什貨、飲料零售業
29219815,利得商行,臺北市信義區光復南路505號9樓之1,核准設立,食品什貨、飲料零售業
38570206,泰馨養生館,臺北市萬華區西園路2段259號1樓、2樓,核准設立,食品什貨、飲料零售業
38557317,威盛企業社,臺北市大安區信義路2段72號地下,核准設立,食品什貨、飲料零售業
14724012,馥華精緻西點麵包店,臺北市北投區自強街120號1樓,核准設立,食品什貨、飲料零售業
48682763,阿淵商行,臺北市大安區通化街39巷50弄16號1樓,核准設立,食品什貨、飲料零售業
99620045,美麗潔企業社,臺北市中正區晉江街124巷2號（之1）1樓,核准設立,食品什貨、飲料零售業
26216510,金光頭百貨行,臺北市北投區立農街2段299號1樓,核准設立,食品什貨、飲料零售業
38558033,浩瀚行銷社,臺北市信義區基隆路1段103號14樓之4,核准設立,食品什貨、飲料零售業
48674433,安娜日用品商行,臺北市中山區民權西路20號9樓之5,核准設立,食品什貨、飲料零售業
15665659,開泰茗茶行,臺北市士林區德行西路54之1號1樓,核准設立,食品什貨、飲料零售業
38558202,嗨王子異世廚房,臺北市松山區市民大道5段127號1樓,核准設立,食品什貨、飲料零售業
83921299,星海軒,臺北市萬華區廣州街186巷5號1樓,核准設立,食品什貨、飲料零售業
48959705,興隆百貨行,臺北市士林區天母西路63號,核准設立,食品什貨、飲料零售業
78505505,大誠婦嬰用品行,臺北市中山區錦西街1之2號1樓,核准設立,食品什貨、飲料零售業
14316281,良中商行,臺北市中山區龍江路356巷58號1樓,核准設立,食品什貨、飲料零售業
31954207,富園屋,臺北市士林區磺溪街55巷1號1樓,核准設立,食品什貨、飲料零售業
48872617,正宗麗江雲南麵食館,臺北市大安區雲和街51號,核准設立,食品什貨、飲料零售業
38509224,粥心匙粥品店,臺北市松山區延壽街95號1樓,核准設立,食品什貨、飲料零售業
02107555,太陽咖啡館,臺北市士林區中山北路7段113號,核准設立,食品什貨、飲料零售業
25662913,正家養生館,臺北市中正區忠孝東路1段108號公有華山市場2樓9號,核准設立,食品什貨、飲料零售業
15658469,吉信豆腐食品行,臺北市萬華區武成街63巷5號1樓,核准設立,食品什貨、飲料零售業
17530756,亨奇食品器具行,臺北市北投區明德路277號1樓,核准設立,食品什貨、飲料零售業
83937383,大發高爾夫用品專賣店,臺北市大安區和平東路2段103號1樓,核准設立,食品什貨、飲料零售業
80998771,王家獨臭之鄉食品行,臺北市文山區景福街3巷13號1樓,核准設立,食品什貨、飲料零售業
26352079,雷斯理廚房,臺北市大安區復興南路2段160巷11號1樓,核准設立,食品什貨、飲料零售業
25664454,五二小吃店,臺北市萬華區西園路2段243之9號,核准設立,食品什貨、飲料零售業
04904042,順泰玩具食品行,臺北市文山區羅斯福路6段453號,核准設立,食品什貨、飲料零售業
10384645,伍財商行,臺北市萬華區內江街29號公有西門市場44號攤位,核准設立,食品什貨、飲料零售業
10376531,老李牛肉麵,臺北市中山區吉林路383號,核准設立,食品什貨、飲料零售業
18090411,冠宇眼鏡行,臺北市中正區中華路2段337號1樓,核准設立,食品什貨、飲料零售業
31844835,泰怡慧養生館,臺北市內湖區成功路2段426巷3號,核准設立,食品什貨、飲料零售業
31870170,宇婷料理工作室,臺北市中山區錦州街426巷1之2號,核准設立,食品什貨、飲料零售業
31952159,平怡餐廳,臺北市中山區林森北路107巷39號,核准設立,食品什貨、飲料零售業
13857288,新臺灣網報社,臺北市萬華區西寧南路4號西寧市場1樓1095號百貨攤位,核准設立,食品什貨、飲料零售業
31864563,花千鳥商行,臺北市中山區林森北路96之8號,核准設立,食品什貨、飲料零售業
26363391,采熙餐坊,臺北市中山區林森北路85巷36號,核准設立,食品什貨、飲料零售業
26234186,人合飲酒店,臺北市萬華區三水街127號2樓,核准設立,食品什貨、飲料零售業
38579826,菁采茗茶,臺北市大同區敦煌路22號1樓,核准設立,食品什貨、飲料零售業
48972215,泰活養生館,臺北市松山區復興北路455號,核准設立,食品什貨、飲料零售業
38568291,萊恩企業社,臺北市中山區南京東路1段34號7樓,核准設立,食品什貨、飲料零售業
48882072,陽明春天園藝坊,臺北市士林區菁山路119之1號,核准設立,食品什貨、飲料零售業
48872314,春春小吃店,臺北市大同區長安西路277號,核准設立,食品什貨、飲料零售業
17086852,萊客蛋糕店,臺北市士林區士東路87之1號1樓,核准設立,食品什貨、飲料零售業
80999758,建治商行,臺北市中山區民權東路2段71巷51號1樓,核准設立,食品什貨、飲料零售業
13841441,芝玫蛋糕店,臺北市士林區德行東路89號1樓,核准設立,食品什貨、飲料零售業
38579966,邱家包子店,臺北市信義區福德街209號1樓,核准設立,食品什貨、飲料零售業
83943619,三八食品行,臺北市北投區中和街236之1號1樓,核准設立,食品什貨、飲料零售業
31950650,祥豐餅舖行,臺北市大同區延平北路2段138號,核准設立,食品什貨、飲料零售業
48958115,良品沁商行,臺北市大安區大安路1段51巷30號,核准設立,食品什貨、飲料零售業
31710483,宏暐企業社,臺北市中山區復興北路48號3樓,核准設立,食品什貨、飲料零售業
38469790,天官餐飲企業社,臺北市內湖區瑞光路421號,核准設立,食品什貨、飲料零售業
38505212,順興工作室,臺北市文山區保儀路124號3樓,核准設立,食品什貨、飲料零售業
48931355,貳零參早餐店,臺北市中正區惠安街15號,核准設立,食品什貨、飲料零售業
48771842,松旺深坑臭豆腐店,臺北市信義區林口街41號,核准設立,食品什貨、飲料零售業
38579071,仕傑卉工作室,臺北市南港區昆陽街157巷3號1樓,核准設立,食品什貨、飲料零售業
38560880,哈打奶奶工作室,臺北市南港區富康街1巷16弄10號,核准設立,食品什貨、飲料零售業
25568213,藝豐咖啡店,臺北市松山區民生東路5段69巷9號,核准設立,食品什貨、飲料零售業
01430372,壹捌柒風味軒餐廳,臺北市萬華區和平西路3段187號2樓,核准設立,食品什貨、飲料零售業
17769027,大成婦嬰生活館,臺北市大同區鄭州路29巷2之5號1樓,核准設立,食品什貨、飲料零售業
31869413,喬治屋冷飲店,臺北市中山區松江路259巷33號,核准設立,食品什貨、飲料零售業
38506090,樂水茶行,臺北市中正區黎明里衡陽路15號1樓,核准設立,食品什貨、飲料零售業
31867055,大田廚房,臺北市大同區重慶北路3段217號,核准設立,食品什貨、飲料零售業
94900530,賀生蔘藥行,臺北市內湖區民權東路6段308號12樓,核准設立,食品什貨、飲料零售業
25622954,茶飄香茶飲專賣店,臺北市萬華區寶興街87號1樓,核准設立,食品什貨、飲料零售業
25570317,足步飛揚養生?,臺北市大安區忠孝東路4段216巷38號2樓,核准設立,食品什貨、飲料零售業
10372177,盛宴時尚美食餐館,臺北市大安區忠孝東路4段223巷10弄6號,核准設立,食品什貨、飲料零售業
14333599,鉅佳三媽小吃店,臺北市中山區樂群二路180號1樓,核准設立,食品什貨、飲料零售業
14725906,寶島鹹粥店,臺北市信義區富陽街89號1樓,核准設立,食品什貨、飲料零售業
14349311,福泉茶行,臺北市中山區錦州街376號1樓,核准設立,食品什貨、飲料零售業
48705127,山本檳榔行,臺北市內湖區成功路2段262號1樓,核准設立,食品什貨、飲料零售業
80985059,禾稑工程行,臺北市內湖區民權東路6段280巷13號1樓,核准設立,食品什貨、飲料零售業
25669423,拍按叫絕企業社,臺北市信義區永吉路30巷177弄20號,核准設立,食品什貨、飲料零售業
25561176,金品商行,臺北市中山區吉林路398號1樓,核准設立,食品什貨、飲料零售業
38574907,馬克斯速食館,臺北市萬華區昆明街96巷22號,核准設立,食品什貨、飲料零售業
38560235,山享植物工作坊,臺北市中山區民權東路1段70巷17號4樓,核准設立,食品什貨、飲料零售業
38471064,聚廠樂活運動館,臺北市北投區北投路2段13號地下1層之1,核准設立,食品什貨、飲料零售業
48501860,德立企業社,臺北市信義區信義路5段5號,核准設立,食品什貨、飲料零售業
26346561,羅迪思咖啡館,臺北市中山區大直街9巷1號1樓,核准設立,食品什貨、飲料零售業
83948163,向勻茶亭,臺北市大安區溫州街86號,核准設立,食品什貨、飲料零售業
26253845,舒拉蜜名店,臺北市大同區延平北路2段42號,核准設立,食品什貨、飲料零售業
38581978,福南梅森茶館,臺北市信義區基隆路1段370號1樓,核准設立,食品什貨、飲料零售業
10376005,儷芙實業社,臺北市萬華區民和街65號,核准設立,食品什貨、飲料零售業
17748473,大水缸食品坊,臺北市大安區復興南路2段151巷19號1樓,核准設立,食品什貨、飲料零售業
98900032,大點精品店,臺北市松山區八德路4段577之1號1樓,核准設立,食品什貨、飲料零售業
29223310,牛老大小吃店,臺北市大同區承德路3段74、76號,核准設立,食品什貨、飲料零售業
38505254,蠍子館,臺北市大安區光復南路102號(1樓),核准設立,食品什貨、飲料零售業
48954379,酷獸飲食坊,臺北市大安區延吉街70巷5弄1號1樓,核准設立,食品什貨、飲料零售業
48996201,松元美食坊,臺北市松山區南京東路4段63號,核准設立,食品什貨、飲料零售業
77838049,信義肉店,臺北市大安區信義路4段60號地下樓信維市場第101號攤位,核准設立,食品什貨、飲料零售業
14733103,文德餃子館,臺北市內湖區文德路232號1樓,核准設立,食品什貨、飲料零售業
77902061,阿瘦檳榔店,臺北市大安區泰順街3之1號,核准設立,食品什貨、飲料零售業
26366904,山泰茶行,臺北市內湖區內湖路2段315號(1樓),核准設立,食品什貨、飲料零售業
25554739,立裴米緹商行,臺北市中山區中山北路2段16巷10號,核准設立,食品什貨、飲料零售業
37882568,大稻埕古早味餐館,臺北市北投區富貴一路1巷28號1樓,核准設立,食品什貨、飲料零售業
13361060,壬成洋行,臺北市大同區昌吉街7號,核准設立,食品什貨、飲料零售業
42271454,饗蒔小吃,臺北市信義區吳興街8巷3號,核准設立,食品什貨、飲料零售業
25670667,賦格創意工作室,臺北市大同區華亭街4號7樓,核准設立,食品什貨、飲料零售業
25585986,壹豆餐飲店,臺北市萬華區寶興街139號,核准設立,食品什貨、飲料零售業
38576264,加時商行,臺北市大安區和平東路2段96巷15弄30號,核准設立,食品什貨、飲料零售業
10371917,大維製麵廠,臺北市萬華區富民路155巷25號,核准設立,食品什貨、飲料零售業
25565911,順發小吃店,臺北市文山區興隆路2段325號,核准設立,食品什貨、飲料零售業
26348456,名漾企業社,臺北市士林區福華路164巷13號,核准設立,食品什貨、飲料零售業
37794333,東興食品行,臺北市內湖區環山路2段26巷11號4樓,核准設立,食品什貨、飲料零售業
26235489,愛莫盛國際貿易行,臺北市中山區敬業1路128巷10號1樓,核准設立,食品什貨、飲料零售業
26255436,凱爵酒坊,臺北市中山區雙城街32巷2之3號,核准設立,食品什貨、飲料零售業
26229732,吉季韓式小吃店,臺北市松山區民生東路3段113巷6弄13號,核准設立,食品什貨、飲料零售業
38512207,漁六實業社,臺北市中山區松江路259巷14號1樓,核准設立,食品什貨、飲料零售業
26343184,小茶匙生活商行,臺北市松山區延壽街82號,核准設立,食品什貨、飲料零售業
10352637,樂多西式小舖,臺北市中山區大直街57巷26號1樓,核准設立,食品什貨、飲料零售業
