31961241,龍禾飲品店,臺北市中山區錦州街250號,核准設立,食品什貨、飲料零售業
73908424,扣引站食品行,臺北市內湖區金龍路133號1樓,核准設立,食品什貨、飲料零售業
38509385,安心手作製?社,臺北市文山區木柵路1段269號(1樓),核准設立,食品什貨、飲料零售業
31881303,胖手指藝文館,臺北市中正區忠孝東路2段7號,核准設立,食品什貨、飲料零售業
38564598,華蜜蔬食屋,臺北市松山區延壽街66號1樓,核准設立,食品什貨、飲料零售業
10332801,菲比國際行銷社,臺北市信義區基隆路2段189號5樓之4,核准設立,食品什貨、飲料零售業
38552925,陽光天天生活館,臺北市中山區農安街20號2樓之21,核准設立,食品什貨、飲料零售業
31857774,上豪鵝肉店,臺北市內湖區金龍路134號1樓,核准設立,食品什貨、飲料零售業
99326057,星瑪小吃店,臺北市北投區光明路148之1號1樓,核准設立,食品什貨、飲料零售業
48803984,正金企業社,臺北市萬華區西寧南路219號,核准設立,食品什貨、飲料零售業
25539870,海蒂洋行,臺北市松山區八德路2段437巷2弄8號,核准設立,食品什貨、飲料零售業
31876879,十二咖啡商行,臺北市文山區羅斯福路6段142巷20弄2號,核准設立,食品什貨、飲料零售業
01194665,大為商行,臺北市中山區林森北路341號,核准設立,食品什貨、飲料零售業
48834157,馥如餐廳,臺北市中山區林森北路133巷33號,核准設立,食品什貨、飲料零售業
26368543,行達企業社,臺北市士林區延平北路6段448號,核准設立,食品什貨、飲料零售業
26213598,津野日式小吃店,臺北市內湖區成功路5段83號85號,核准設立,食品什貨、飲料零售業
15927719,美鈴獸肉號,臺北市萬華區環河南路2段245號公有環南市場甲棟第731號攤,核准設立,食品什貨、飲料零售業
31851119,台北四季企業社,臺北市大安區仁愛路3段26之3號4樓,核准設立,食品什貨、飲料零售業
01394782,尊賢餐飲店,臺北市北投區尊賢街243巷1號1樓,核准設立,食品什貨、飲料零售業
81743262,智利洋行,臺北市大安區安和路1段141巷9號1樓,核准設立,食品什貨、飲料零售業
26250571,祥意小吃店,臺北市中正區公園路28號1樓,核准設立,食品什貨、飲料零售業
26372928,奧亞米企業社,臺北市萬華區武昌街2段50巷15號2樓,核准設立,食品什貨、飲料零售業
99990834,金泉冰店,臺北市士林區大西路21號1樓,核准設立,食品什貨、飲料零售業
48787719,四海商行,臺北市萬華區富民路119號,核准設立,食品什貨、飲料零售業
31879593,洋梨房食品,臺北市大安區忠孝東路4段169號6樓之1,核准設立,食品什貨、飲料零售業
48907691,為禾商行,臺北市中山區樂群三路35號、39號1樓,核准設立,食品什貨、飲料零售業
38497634,渢格眼鏡行,臺北市文山區木新路2段271號1樓,核准設立,食品什貨、飲料零售業
25618966,大竹食堂,臺北市文山區羅斯福路6段9號,核准設立,食品什貨、飲料零售業
01677992,如松商號,臺北市南港區忠孝東路6段70巷4號1樓,核准設立,食品什貨、飲料零售業
10377503,陳玉琴商行,臺北市萬華區成都路10巷49號西門市場024號攤位,核准設立,食品什貨、飲料零售業
38571818,芙芙法式烘焙工作室,臺北市內湖區內湖路1段388號2樓之2,核准設立,食品什貨、飲料零售業
15669705,東陽飯包店,臺北市大同區長安西路232號1樓,核准設立,食品什貨、飲料零售業
31856183,彩鈺清茶館,臺北市萬華區環河南路2段71巷12號,核准設立,食品什貨、飲料零售業
38557766,一信念食品企業社,臺北市信義區基隆路2段79巷33弄5號5樓,核准設立,食品什貨、飲料零售業
31961559,松山文創咖啡館,臺北市信義區忠孝東路4段553巷20之1號,核准設立,食品什貨、飲料零售業
38562162,貝莉絲烘焙坊,臺北市文山區景華街77號1樓,核准設立,食品什貨、飲料零售業
01714933,阿義師的大茶壺茶餐廳,臺北市文山區指南路3段38巷37之1號,核准設立,食品什貨、飲料零售業
26232096,英花閣軒,臺北市萬華區三水街106巷7號,核准設立,食品什貨、飲料零售業
77890311,千日檳榔店,臺北市大安區建國南路1段159號,核准設立,食品什貨、飲料零售業
48848167,月仙都茶莊,臺北市萬華區華西街21巷1之3號,核准設立,食品什貨、飲料零售業
25517876,迦蓮國際商行,臺北市大同區酒泉街159號1樓,核准設立,食品什貨、飲料零售業
21721362,傑立宏餐廳,臺北市中山區吉林路14巷18號地下1樓,核准設立,食品什貨、飲料零售業
31959462,天秦茶飲專賣店,臺北市萬華區萬大路265號,核准設立,食品什貨、飲料零售業
48789511,明峰檳榔,臺北市中山區建國北路3段109號,核准設立,食品什貨、飲料零售業
21710246,銘饌咖啡坊,臺北市中山區民權西路35號1樓,核准設立,食品什貨、飲料零售業
81654893,六季香茶坊,臺北市文山區指南路3段34巷53之1號,核准設立,食品什貨、飲料零售業
15649981,梵婗偲商行,臺北市南港區同德路49號1樓,核准設立,食品什貨、飲料零售業
38571681,御寶企業社,臺北市南港區東新街205號2樓,核准設立,食品什貨、飲料零售業
77483905,水手餐廳,臺北市中山區雙城街24號,核准設立,食品什貨、飲料零售業
81612607,老媽的菜餐館,臺北市大安區光復南路260巷33號,核准設立,食品什貨、飲料零售業
48727543,富家麵包坊,臺北市信義區吳興街524巷41號1樓,核准設立,食品什貨、飲料零售業
25552964,上味香魚丸店,臺北市信義區松山路294號1樓永春市場132號攤位,核准設立,食品什貨、飲料零售業
98905141,阿胖師小吃店,臺北市信義區莊敬路346號1樓,核准設立,食品什貨、飲料零售業
94900026,榮星商行,臺北市中山區合江街180巷16號,核准設立,食品什貨、飲料零售業
18917216,富田商店,臺北市大安區通化街39巷50弄53號,核准設立,食品什貨、飲料零售業
38560538,巧妮企業社,臺北市中山區南京東路2段76號4樓,核准設立,食品什貨、飲料零售業
99993494,班德拉米食品坊,臺北市中山區中原街29號1樓,核准設立,食品什貨、飲料零售業
26348857,寶之薌食品企業社,臺北市中正區紹興南街4之5號,核准設立,食品什貨、飲料零售業
25539941,祥榮企管企業社,臺北市中山區伊通街58號3樓,核准設立,食品什貨、飲料零售業
30917423,俊明行,臺北市大安區師大路67號1樓,核准設立,食品什貨、飲料零售業
77150272,福龍獸肉號,臺北市萬華區環河南路2段245號環南市場丁棟第1212號攤,核准設立,食品什貨、飲料零售業
31859864,志騰活力小屋,臺北市信義區莊敬路289巷4之2號,核准設立,食品什貨、飲料零售業
31879637,三福商行,臺北市松山區民生東路4段56巷1弄3號,核准設立,食品什貨、飲料零售業
26237368,布朗尼爾咖啡,臺北市松山區寧安街7巷1號,核准設立,食品什貨、飲料零售業
38499324,寶拉卡費飲品店,臺北市大安區忠孝東路4段205巷29弄7號1樓,核准設立,食品什貨、飲料零售業
38506417,掌福包點商行,臺北市南港區聯成里忠孝東路6段244號,核准設立,食品什貨、飲料零售業
31947918,三美金企業社,臺北市中山區德惠街200號,核准設立,食品什貨、飲料零售業
26232461,九佰碗小吃店,臺北市文山區景中街33號,核准設立,食品什貨、飲料零售業
38504380,巧品手工小鋪,臺北市內湖區康寧路3段189巷30號,核准設立,食品什貨、飲料零售業
38579522,田晨美食坊,臺北市松山區新中街7號,核准設立,食品什貨、飲料零售業
38569897,?軒企業社,臺北市松山區八德路2段437巷2弄6號1樓,核准設立,食品什貨、飲料零售業
38557750,五三七商行,臺北市萬華區長順街7號1樓,核准設立,食品什貨、飲料零售業
26367755,東北大餅店,臺北市大安區和平東路2段60之2號,核准設立,食品什貨、飲料零售業
13851469,達益商行,臺北市南港區東南街26號之2,核准設立,食品什貨、飲料零售業
38471347,益多咖啡館,臺北市大安區溫州街79號,核准設立,食品什貨、飲料零售業
38499582,澄意企業社,臺北市大安區和平東路2段118巷36號,核准設立,食品什貨、飲料零售業
13853380,美味小館,臺北市萬華區漢中街147巷5號1樓,核准設立,食品什貨、飲料零售業
48960246,大地健康蔬果生活館,臺北市中正區金華街43巷7號1樓,核准設立,食品什貨、飲料零售業
25503850,利曲餐坊,臺北市中山區松江路362巷81號,核准設立,食品什貨、飲料零售業
31833680,好彩頭食品行,臺北市北投區中央南路2段12之1號1樓,核准設立,食品什貨、飲料零售業
26238866,麗鑫美容養生館,臺北市大同區民權西路189號,核准設立,食品什貨、飲料零售業
27161680,小霖食堂,臺北市大安區新生南路1段165巷16號,核准設立,食品什貨、飲料零售業
48746984,我家歡樂屋,臺北市北投區大興街59號,核准設立,食品什貨、飲料零售業
48819212,忻宸企業社,臺北市文山區興隆路4段60號,核准設立,食品什貨、飲料零售業
48975613,唐唐仿古家具,臺北市松山區饒河街245號2樓,核准設立,食品什貨、飲料零售業
18375541,可嬡島高優質蔬果商店,臺北市中山區北安路554巷47號1樓,核准設立,食品什貨、飲料零售業
25661870,兆群醫療器材行,臺北市大安區大安路1段169巷1號,核准設立,食品什貨、飲料零售業
26366708,聯呈商行,臺北市萬華區東園街28巷11號1樓,核准設立,食品什貨、飲料零售業
38457534,及利餐飲店,臺北市文山區景華街93號,核准設立,食品什貨、飲料零售業
31957513,食安行,臺北市大安區復興南路1段206號10樓,核准設立,食品什貨、飲料零售業
21765635,先定味小吃店,臺北市中山區錦州街25號1樓,核准設立,食品什貨、飲料零售業
14710586,阿亮小吃店,臺北市北投區承德路7段78號1樓,核准設立,食品什貨、飲料零售業
25658426,東北辣媽小吃店,臺北市大安區光復南路308巷51號,核准設立,食品什貨、飲料零售業
98885308,豪品味小吃店,臺北市中正區青島東路7之3號1樓,核准設立,食品什貨、飲料零售業
25663244,綠緹商店,臺北市大安區忠孝東路4段216巷11弄16號,核准設立,食品什貨、飲料零售業
38565392,登鼎商行,臺北市松山區八德路2段346巷7弄42號1樓,核准設立,食品什貨、飲料零售業
25656715,東利屋,臺北市大安區永康街12之1號,核准設立,食品什貨、飲料零售業
48693038,千友小吃店,臺北市萬華區萬大路424巷112之7號1樓,核准設立,食品什貨、飲料零售業
48788077,佶佳彩券行,臺北市北投區吉利街123巷22號,核准設立,食品什貨、飲料零售業
10314352,慈軒園素食店,臺北市松山區延吉街59號,核准設立,食品什貨、飲料零售業
14742187,饒河遊樂園,臺北市松山區饒河街190號1樓,核准設立,食品什貨、飲料零售業
08582063,嘉順行,臺北市內湖區五分街25號1樓,核准設立,食品什貨、飲料零售業
10355281,林映聲川養生餐館,臺北市內湖區內湖路3段365號,核准設立,食品什貨、飲料零售業
25524623,嗶嗶啵啵企業社,臺北市士林區延平北路5段83巷20號,核准設立,食品什貨、飲料零售業
99615958,采風餐館,臺北市北投區泉源路12號2樓之1,核准設立,食品什貨、飲料零售業
48879560,次文化企業社,臺北市大安區敦化南路1段177巷39號,核准設立,食品什貨、飲料零售業
48971644,賓國商店,臺北市中山區長春路318號,核准設立,食品什貨、飲料零售業
48997742,貓空休閒咖啡館,臺北市文山區久康街24巷16號12樓,核准設立,食品什貨、飲料零售業
29241582,綠田自然生活館,臺北市士林區文林路512之1號,核准設立,食品什貨、飲料零售業
31951026,勒馬克精品咖啡店,臺北市大安區通化街193號,核准設立,食品什貨、飲料零售業
13849339,合記茶行,臺北市大同區長安西路99號,核准設立,食品什貨、飲料零售業
10343321,茜茜商行,臺北市大安區信義路3段134巷22號,核准設立,食品什貨、飲料零售業
14038415,福美西點麵包店,臺北市士林區承德路4段40巷21號1樓,核准設立,食品什貨、飲料零售業
38565301,千惠食坊,臺北市中山區大直街32號1樓,核准設立,食品什貨、飲料零售業
48854857,良鑫商行,臺北市信義區虎林街82巷11號,核准設立,食品什貨、飲料零售業
25512529,春禾企業社,臺北市大同區民族西路67號,核准設立,食品什貨、飲料零售業
38505923,林董糕餅,臺北市萬華區西園路1段85號1樓,核准設立,食品什貨、飲料零售業
48961815,林文必涼麵,臺北市中山區大直街38號1樓,核准設立,食品什貨、飲料零售業
31954918,嫚軒餐坊,臺北市士林區福華路148號1樓,核准設立,食品什貨、飲料零售業
26356552,海灘福美食店,臺北市中山區龍江路356巷20號5樓,核准設立,食品什貨、飲料零售業
48852099,思扣伊自然能量養生館,臺北市士林區美崙街49巷2號,核准設立,食品什貨、飲料零售業
83903807,順祥天然有機食品坊,臺北市中正區重慶南路3段15巷23號1樓,核准設立,食品什貨、飲料零售業
48830504,海洋魚丸號,臺北市萬華區富民路151號,核准設立,食品什貨、飲料零售業
26243713,紅厝客家小吃店,臺北市松山區八德路4段245巷32弄36號,核准設立,食品什貨、飲料零售業
26236282,廣大順食品店,臺北市大同區延平北路2段36巷4號,核准設立,食品什貨、飲料零售業
48937055,阿三阿四食品行,臺北市內湖區大湖山莊56之2號地下樓,核准設立,食品什貨、飲料零售業
48992492,孟泰企業社,臺北市士林區中山北路5段437號,核准設立,食品什貨、飲料零售業
38560410,沃野咖啡店,臺北市大同區天水路13號,核准設立,食品什貨、飲料零售業
18385196,三峰茶行,臺北市大同區酒泉街179號,核准設立,食品什貨、飲料零售業
48781742,艾蜜利食品商行,臺北市北投區光明路218之5號2樓,核准設立,食品什貨、飲料零售業
10347234,全成行,臺北市萬華區富民路91巷5號,核准設立,食品什貨、飲料零售業
26373525,巧味美商行,臺北市內湖區瑞光路287號,核准設立,食品什貨、飲料零售業
25658397,心田國際商行,臺北市大安區復興南路2段86號7樓,核准設立,食品什貨、飲料零售業
26252276,王嘉霖超玩美生活工作室,臺北市北投區中央南路1段117號,核准設立,食品什貨、飲料零售業
21717233,抱花戶手創花藝設計坊,臺北市中山區林森北路85巷2之1號3樓,核准設立,食品什貨、飲料零售業
48922258,娜倫企業社,臺北市大同區赤?街17巷21號,核准設立,食品什貨、飲料零售業
38514232,悄悄好食手作坊,臺北市大安區安和路1段24號1樓,核准設立,食品什貨、飲料零售業
29209014,欣洋食品行,臺北市中正區汀州路2段214號,核准設立,食品什貨、飲料零售業
38561430,千盛商行,臺北市士林區德行東路13號(1樓),核准設立,食品什貨、飲料零售業
38570711,全省禮贈品百貨行,臺北市信義區忠孝東路5段459號2樓之3,核准設立,食品什貨、飲料零售業
48751402,萬太郎商行,臺北市南港區興中路20號,核准設立,食品什貨、飲料零售業
26307589,黑布朗咖啡專賣店,臺北市中山區長安東路2段129巷4號,核准設立,食品什貨、飲料零售業
48796463,數萊寶商行,臺北市士林區中山北路7段94號,核准設立,食品什貨、飲料零售業
48790783,吉是美食品商行,臺北市文山區景興路282巷1號,核准設立,食品什貨、飲料零售業
25550950,崇琦美食坊,臺北市士林區中山北路6段740號1樓,核准設立,食品什貨、飲料零售業
38574081,任珍記食品行,臺北市士林區華崗路47巷1號,核准設立,食品什貨、飲料零售業
25558019,富玉精品店,臺北市中山區民權西路48號7樓之1,核准設立,食品什貨、飲料零售業
31956774,寶愛酒吧,臺北市中山區林森北路413號2樓,核准設立,食品什貨、飲料零售業
14325802,多蕾咪冷飲店,臺北市大安區光復南路420巷30號1樓,核准設立,食品什貨、飲料零售業
38510833,茱諾企業社,臺北市大安區忠孝東路4段87號6樓,核准設立,食品什貨、飲料零售業
31868414,遠走糕啡館,臺北市大安區信義路3段166巷4號,核准設立,食品什貨、飲料零售業
15644923,阿根早點店,臺北市內湖區金湖路3號1樓,核准設立,食品什貨、飲料零售業
98108602,泰一商行,臺北市中山區遼寧街138巷26號4樓,核准設立,食品什貨、飲料零售業
25569249,佳遊自行車行,臺北市南港區南港路3段193號,核准設立,食品什貨、飲料零售業
15645752,關芯餐坊,臺北市大安區大安路1段147號地下,核准設立,食品什貨、飲料零售業
94900855,林家姐妹海鮮水餃店,臺北市大同區長安西路285號1樓,核准設立,食品什貨、飲料零售業
38558673,喜滿福餐飲店,臺北市中正區南海路50之1號,核准設立,食品什貨、飲料零售業
26375925,亨利與凱莉巧克力店,臺北市大安區溫州街74巷14號1樓,核准設立,食品什貨、飲料零售業
99637361,松農茶行,臺北市中山區龍江路328巷24號1樓,核准設立,食品什貨、飲料零售業
13859363,香天下牛肉麵店,臺北市北投區知行路317號,核准設立,食品什貨、飲料零售業
31869737,永荃企業社,臺北市中山區龍江路336號,核准設立,食品什貨、飲料零售業
10318929,禾楓食品行,臺北市大同區重慶北路3段154號,核准設立,食品什貨、飲料零售業
31881155,即思整合行銷工作室,臺北市北投區石牌路2段315巷12之1號2樓,核准設立,食品什貨、飲料零售業
31963064,鴻熙企業社,臺北市士林區德行西路105號1樓,核准設立,食品什貨、飲料零售業
38562297,貫盈企業社,臺北市大安區四維路170巷2號,核准設立,食品什貨、飲料零售業
31877743,小知茶堂,臺北市內湖區成功路5段450巷22弄10號,核准設立,食品什貨、飲料零售業
99629995,永鴻食品行,臺北市士林區重慶北路4段143巷3弄14號2樓,核准設立,食品什貨、飲料零售業
38463043,海星國際實業社,臺北市內湖區內湖路3段343巷3弄1號5樓,核准設立,食品什貨、飲料零售業
38510329,迎禾小吃店,臺北市萬華區昆明街259號1樓,核准設立,食品什貨、飲料零售業
26247773,越芳蘭餐廳,臺北市士林區中山北路5段604號1樓及地下層,核准設立,食品什貨、飲料零售業
48829979,美味道商店,臺北市北投區中和街40號,核准設立,食品什貨、飲料零售業
25503970,小樽食品商行,臺北市松山區富錦街108號,核准設立,食品什貨、飲料零售業
77887195,通隆商行,臺北市大安區通化街39巷49弄1號,核准設立,食品什貨、飲料零售業
38504044,金品西點麵包店,臺北市文山區永安街22巷31號,核准設立,食品什貨、飲料零售業
15645660,魯米耶工作室,臺北市大安區羅斯福路3段283巷14弄15號1樓,核准設立,食品什貨、飲料零售業
48754175,甫龍行,臺北市大安區仁愛路4段122巷58號3樓,核准設立,食品什貨、飲料零售業
98885258,九三刀削麵館,臺北市中正區青島東路3之2號1樓,核准設立,食品什貨、飲料零售業
48802009,平田屋,臺北市中山區林森北路119巷80號,核准設立,食品什貨、飲料零售業
26337839,達酷企業社,臺北市中正區懷寧街106之1號,核准設立,食品什貨、飲料零售業
13831561,介芹餐廳,臺北市中山區林森北路138巷36號1樓,核准設立,食品什貨、飲料零售業
26235208,長鴻小館,臺北市大安區光復南路200巷5號,核准設立,食品什貨、飲料零售業
25664187,鄉村餅屋,臺北市萬華區艋舺大道140號,核准設立,食品什貨、飲料零售業
80999188,香綿饅頭店,臺北市文山區木柵路2段31號1樓,核准設立,食品什貨、飲料零售業
38554819,宸緣企業社,臺北市松山區八德路4段666號9樓,核准設立,食品什貨、飲料零售業
25571759,一郎商行,臺北市南港區忠孝東路6段69號,核准設立,食品什貨、飲料零售業
48975515,鮮活家國際企業社,臺北市松山區八德路3段225號8樓之6,核准設立,食品什貨、飲料零售業
80999434,宏來雜糧行,臺北市北投區清江路140號1樓,核准設立,食品什貨、飲料零售業
38509527,巴爾扎克咖啡館,臺北市信義區光復南路415巷4號1樓,核准設立,食品什貨、飲料零售業
48975992,自然恬園,臺北市內湖區東湖路106巷14號,核准設立,食品什貨、飲料零售業
99984039,黛比蛋糕藝術工房,臺北市南港區研究院路1段69號1樓,核准設立,食品什貨、飲料零售業
25519662,紅襪清茶館,臺北市萬華區三水街115巷6號,核准設立,食品什貨、飲料零售業
10304811,明洞館小吃店,臺北市大安區延吉街62巷11號,核准設立,食品什貨、飲料零售業
10354207,鮮味鮮麵館,臺北市萬華區西寧南路78號,核准設立,食品什貨、飲料零售業
38500048,民權胡商行,臺北市中山區民權東路2段81號1樓,核准設立,食品什貨、飲料零售業
31882231,一級蒡小吃店,臺北市中山區龍江路412巷41號(1樓),核准設立,食品什貨、飲料零售業
01823518,來客食品店,臺北市士林區至善路2段130號1樓,核准設立,食品什貨、飲料零售業
01721575,光羽?茶坊,臺北市文山區指南路3段38巷14之2號,核准設立,食品什貨、飲料零售業
18092311,佑昇國際商行,臺北市南港區八德路4段869號地下之1,核准設立,食品什貨、飲料零售業
10314894,立可明企業社,臺北市信義區信義路6段126之32號,核准設立,食品什貨、飲料零售業
25556173,大阪根丼屋,臺北市中山區松江路235巷35號,核准設立,食品什貨、飲料零售業
48884254,中崙商行,臺北市松山區八德路3段12巷51弄35號,核准設立,食品什貨、飲料零售業
26246922,無敵水餃食品行,臺北市信義區虎林街164巷3號,核准設立,食品什貨、飲料零售業
25657685,足頌軒養生館,臺北市中山區長春路228號,核准設立,食品什貨、飲料零售業
48872454,萬鑫商行,臺北市文山區羅斯福路5段234之1號,核准設立,食品什貨、飲料零售業
73891486,頂好蔬果行,臺北市松山區八德路4段72巷14弄2號,核准設立,食品什貨、飲料零售業
48880200,萬事通商行,臺北市士林區美德街74號,核准設立,食品什貨、飲料零售業
99427549,旭翔企業社,臺北市中山區松江路402巷26號3樓,核准設立,食品什貨、飲料零售業
18086508,品欣食品行,臺北市中山區吉林路129號1樓,核准設立,食品什貨、飲料零售業
38558836,傳千小吃店,臺北市中山區林森北路67巷122號,核准設立,食品什貨、飲料零售業
31856108,宇康咖啡館,臺北市信義區莊敬路214號2樓,核准設立,食品什貨、飲料零售業
48954223,邦妮精品服飾行,臺北市文山區景興路235號,核准設立,食品什貨、飲料零售業
77163327,鴻福眼鏡行,臺北市萬華區萬大路414號1樓,核准設立,食品什貨、飲料零售業
81756174,店小一檳榔攤,臺北市松山區光復北路140號1樓,核准設立,食品什貨、飲料零售業
14729516,萬輪日式小吃店,臺北市信義區虎林街57之11號1樓,核准設立,食品什貨、飲料零售業
31844981,新豪休閒餐坊,臺北市中山區民族東路91號,核准設立,食品什貨、飲料零售業
25541566,滿鑫行,臺北市中山區吉林路299巷7號,核准設立,食品什貨、飲料零售業
48687872,春月咖啡廳,臺北市中山區合江街73巷3號1樓,核准設立,食品什貨、飲料零售業
48698575,宋江小吃店,臺北市士林區天母北路2號1樓,核准設立,食品什貨、飲料零售業
14333367,川巴子餐館,臺北市大安區復興南路1段144號1、2樓,核准設立,食品什貨、飲料零售業
77830980,四海茶莊,臺北市大安區敦化南路1段233巷45號1樓,核准設立,食品什貨、飲料零售業
31868759,珍華小吃店,臺北市大安區金山南路2段211號,核准設立,食品什貨、飲料零售業
38576530,松龍餐飲坊,臺北市信義區松山路315號,核准設立,食品什貨、飲料零售業
26241882,仁愛樂活館,臺北市大安區仁愛路4段122巷4號,核准設立,食品什貨、飲料零售業
10387164,伸適廊餐廳,臺北市中山區林森北路477號地下1層,核准設立,食品什貨、飲料零售業
10386475,風谷餐廳,臺北市中山區林森北路133巷55號,核准設立,食品什貨、飲料零售業
38467006,滿?園上海館,臺北市士林區天母北路35號1樓,核准設立,食品什貨、飲料零售業
38556979,和亞商行,臺北市中山區林森北路50號4樓之3,核准設立,食品什貨、飲料零售業
13440282,政欣食品行,臺北市大同區民生西路382號1樓,核准設立,食品什貨、飲料零售業
38474219,寧靜時光屋,臺北市中正區八德路1段82巷9弄22號,核准設立,食品什貨、飲料零售業
25532530,百馥生鮮食品行,臺北市內湖區康寧路3段103之2號(1樓),核准設立,食品什貨、飲料零售業
77145270,三行肉脯店,臺北市萬華區富民路83號1樓,核准設立,食品什貨、飲料零售業
