80980287,騁龍行,臺北市大同區重慶北路3段223巷19號1樓,核准設立,食品什貨、飲料零售業
31968954,延吉早餐屋,臺北市大安區延吉街131巷4號,核准設立,食品什貨、飲料零售業
10308226,運動家商行,臺北市北投區中央南路1段137號,核准設立,食品什貨、飲料零售業
31843364,紅太洋商行,臺北市士林區華榮街34號,核准設立,食品什貨、飲料零售業
31965865,舊漫小吃店,臺北市中正區汀州路3段305號1樓,核准設立,食品什貨、飲料零售業
48735895,興真味行,臺北市中山區復興北路176號,核准設立,食品什貨、飲料零售業
31881964,好時光企業社,臺北市松山區新中街35之1號(1樓),核准設立,食品什貨、飲料零售業
83919131,韋成商行,臺北市松山區撫遠街376巷2號1樓,核准設立,食品什貨、飲料零售業
31953713,怡香園時尚餐廳,臺北市士林區德行東路322號1樓,核准設立,食品什貨、飲料零售業
38464676,江廚商行,臺北市內湖區新明路475巷12之1號1樓,核准設立,食品什貨、飲料零售業
18086269,大亞食品行,臺北市大安區新生南路3段56巷8號1樓,核准設立,食品什貨、飲料零售業
48884276,一一平小吃店,臺北市大安區敦化南路2段81巷47號1樓,核准設立,食品什貨、飲料零售業
94914979,宜生企業社,臺北市南港區研究院路1段2號2樓,核准設立,食品什貨、飲料零售業
38471233,杯子食品行,臺北市北投區裕民六路114巷27號,核准設立,食品什貨、飲料零售業
31860139,新日成食品行,臺北市大同區歸綏街218之2號,核准設立,食品什貨、飲料零售業
26217291,藍於海餐廳,臺北市中山區中山北路1段135巷30號,核准設立,食品什貨、飲料零售業
42269886,梵園小吃,臺北市大安區建國南路2段151巷18號,核准設立,食品什貨、飲料零售業
38500791,皮藝世界工坊,臺北市松山區饒河街158號(1樓),核准設立,食品什貨、飲料零售業
15634039,餃子國食品坊,臺北市內湖區金湖路390號1樓,核准設立,食品什貨、飲料零售業
48998756,誠寶生活百貨坊,臺北市文山區景興路39之2號,核准設立,食品什貨、飲料零售業
38460593,穩?彩券行,臺北市萬華區廣州街138號,核准設立,食品什貨、飲料零售業
48716953,克捷行,臺北市士林區文林路184號1樓,核准設立,食品什貨、飲料零售業
38504142,老哥麵糰食坊,臺北市中正區金門街9之9號1樓,核准設立,食品什貨、飲料零售業
01794106,月牙泉蔎品屋,臺北市大安區永康街6之7號,核准設立,食品什貨、飲料零售業
17262301,鮮美香自助餐店,臺北市中山區南京東路2段115巷3弄2號,核准設立,食品什貨、飲料零售業
15648189,龍涎居雞膳食坊,臺北市大安區羅斯福路3段135號,核准設立,食品什貨、飲料零售業
38571021,魚強日本料理店,臺北市松山區新東街6巷4號1樓,核准設立,食品什貨、飲料零售業
31857991,迪拉咖啡工坊,臺北市大安區忠孝東路3段217巷2弄4號1樓,核准設立,食品什貨、飲料零售業
26218427,貓守城堡企業社,臺北市中山區龍江路429巷7號1樓,核准設立,食品什貨、飲料零售業
48904646,高記商店,臺北市大同區五原路26號,核准設立,食品什貨、飲料零售業
25571548,三水堂商號,臺北市萬華區昆明街303號6樓,核准設立,食品什貨、飲料零售業
25531808,?龍商店,臺北市士林區延平北路8段79號,核准設立,食品什貨、飲料零售業
38471439,太陽與鐵小吃部,臺北市大安區金山南路2段169號,核准設立,食品什貨、飲料零售業
38470157,創藝餐飲坊,臺北市松山區南京東路三段256巷40號1樓,核准設立,食品什貨、飲料零售業
48793825,得連店,臺北市士林區重慶北路4段184號,核准設立,食品什貨、飲料零售業
25559024,高馬克餐坊,臺北市松山區八德路3段12巷4弄5之1號1樓,核准設立,食品什貨、飲料零售業
12247555,清祥店,臺北市中山區遼寧街52號,核准設立,食品什貨、飲料零售業
83904427,渱瀧洋行,臺北市萬華區漢口街2段54號2樓,核准設立,食品什貨、飲料零售業
20298872,鼎欣酒莊,臺北市北投區大業路517巷17號,核准設立,食品什貨、飲料零售業
26248668,海韻茶業行,臺北市信義區松德路59號,核准設立,食品什貨、飲料零售業
01721667,邀月茶坊,臺北市文山區指南路3段40巷6號,核准設立,食品什貨、飲料零售業
99980174,全億精緻盒餐店,臺北市北投區致遠一路1段120號1樓,核准設立,食品什貨、飲料零售業
48750092,舞之海小坊,臺北市中山區林森北路85巷19號,核准設立,食品什貨、飲料零售業
29219548,宇辰實業社,臺北市北投區致遠三路147巷2弄48號,核准設立,食品什貨、飲料零售業
83942978,瑞億麵包店,臺北市萬華區康定路47號1樓,核准設立,食品什貨、飲料零售業
25615428,新翊眼鏡名店,臺北市大安區羅斯福路3段13號1樓,核准設立,食品什貨、飲料零售業
98881963,昱正商行,臺北市萬華區貴陽街2段232巷2號1樓,核准設立,食品什貨、飲料零售業
38459717,佳裕小吃店,臺北市南港區忠孝東路5段1000號2樓,核准設立,食品什貨、飲料零售業
10646937,橡園坊,臺北市士林區美德街3號,核准設立,食品什貨、飲料零售業
99617007,老竹子三發點心總匯商行,臺北市大同區迪化街1段21號1樓永樂市場1431號攤位,核准設立,食品什貨、飲料零售業
38497727,鮑大人水產行,臺北市萬華區萬大路493巷12弄17號1樓,核准設立,食品什貨、飲料零售業
26218741,仁安堂傳統整復推拿館,臺北市北投區懷德街25號,核准設立,食品什貨、飲料零售業
25669991,金蘭豆漿店,臺北市中山區長春路352號,核准設立,食品什貨、飲料零售業
25568950,泓泉商行,臺北市中山區長安東路2段230號11樓之3,核准設立,食品什貨、飲料零售業
37908498,昀佐企業社,臺北市萬華區桂林路1號,核准設立,食品什貨、飲料零售業
98892130,龍坊上海點心店,臺北市中正區杭州南路1段139之1號,核准設立,食品什貨、飲料零售業
13838430,橘果租書店,臺北市文山區景華街100號1樓,核准設立,食品什貨、飲料零售業
18407558,美二佳食品行,臺北市南港區研究院路1段69號1樓,核准設立,食品什貨、飲料零售業
31850293,冠饌商行,臺北市大安區大安路1段31巷21號,核准設立,食品什貨、飲料零售業
31962001,錢來也彩券投注站,臺北市萬華區康定路223號(1樓),核准設立,食品什貨、飲料零售業
14346314,璽宴食品行,臺北市松山區三民路107巷21號4樓,核准設立,食品什貨、飲料零售業
29208465,佳盈生活商行,臺北市內湖區成功路4段20巷12號,核准設立,食品什貨、飲料零售業
26207961,普羅旺斯綠耕社,臺北市中山區林森北路100號5樓之4,核准設立,食品什貨、飲料零售業
21595604,碩宸企業社,臺北市文山區景文街13之2號1樓,核准設立,食品什貨、飲料零售業
38554439,永康三一六工坊,臺北市大安區永康街31巷16號,核准設立,食品什貨、飲料零售業
38566126,京點企業社,臺北市文山區木柵路3段49巷1號,核准設立,食品什貨、飲料零售業
81665441,陳鵬仁印文社,臺北市大安區敦化南路1段344號2樓之2,核准設立,食品什貨、飲料零售業
26238887,怪獸一麵團食品商行,臺北市中山區林森北路409號7樓之9,核准設立,食品什貨、飲料零售業
48788273,泉蘆綠茶店,臺北市中正區忠孝東路1段11號,核准設立,食品什貨、飲料零售業
48856709,麵大師商號,臺北市萬華區西藏路142號,核准設立,食品什貨、飲料零售業
13821347,綿綿小品店,臺北市中正區廣州街10之1號1樓,核准設立,食品什貨、飲料零售業
38580268,永沅商行,臺北市士林區德行東路363號,核准設立,食品什貨、飲料零售業
48904293,家妤商行,臺北市萬華區萬大路340號,核准設立,食品什貨、飲料零售業
25582284,波波小吃店,臺北市信義區嘉興街216巷17號1樓,核准設立,食品什貨、飲料零售業
13854536,永泰商行,臺北市大安區永康街22號1樓,核准設立,食品什貨、飲料零售業
38570986,駿工翡翠泡菜屋,臺北市大同區南京西路109號1樓,核准設立,食品什貨、飲料零售業
14721795,康園企業社,臺北市信義區虎林街132巷2號1樓,核准設立,食品什貨、飲料零售業
38651045,奇水餃商行,臺北市信義區富陽街91號,核准設立,食品什貨、飲料零售業
38579558,物豐商行,臺北市大同區迪化街1段179號,核准設立,食品什貨、飲料零售業
48890538,菁蘋企業社,臺北市大安區復興南路2段293之3號10樓之1,核准設立,食品什貨、飲料零售業
31856114,一杯咖啡店,臺北市士林區文林路291號,核准設立,食品什貨、飲料零售業
49853933,君問山食品坊,臺北市中正區羅斯福路1段8號1樓南門市場199號攤位,核准設立,食品什貨、飲料零售業
31873388,輪輪商號,臺北市信義區基隆路1段380巷38號,核准設立,食品什貨、飲料零售業
48922291,赤褐飲食店,臺北市大安區復興南路2段339號1樓,核准設立,食品什貨、飲料零售業
26368945,金沙洋行,臺北市大安區信義路3段25號,核准設立,食品什貨、飲料零售業
48960528,海益行,臺北市士林區福國路28號,核准設立,食品什貨、飲料零售業
31855001,青年商行,臺北市萬華區青年路110號1樓,核准設立,食品什貨、飲料零售業
25503401,蘭奢待香社,臺北市松山區復興北路417號2樓,核准設立,食品什貨、飲料零售業
25545351,喜樂滿屋鮮果屋,臺北市中正區衡陽路53號,核准設立,食品什貨、飲料零售業
25661105,果子有機店,臺北市文山區興隆路3段14號,核准設立,食品什貨、飲料零售業
38574688,旭立宸企業社,臺北市信義區永吉路120巷50弄25號3樓,核准設立,食品什貨、飲料零售業
17758226,合?美食坊,臺北市中正區市民大道一段一00號地下一層鄭州路地下街商場輕食區14號店舖,核准設立,食品什貨、飲料零售業
81758996,協成泰商行,臺北市士林區通河東街1段105巷1弄1號,核准設立,食品什貨、飲料零售業
48949290,冠與美複合式美食館,臺北市大同區民生西路71號2樓,核准設立,食品什貨、飲料零售業
31962852,星華鍋物小吃店,臺北市中山區長安東路2段168號1樓,核准設立,食品什貨、飲料零售業
48947997,米琪蛋糕食品行,臺北市中山區中山北路2段16巷23號,核准設立,食品什貨、飲料零售業
31950883,九號公寓咖啡館,臺北市大安區羅斯福路3段9號,核准設立,食品什貨、飲料零售業
26362371,慕名咖啡館,臺北市南港區園區街6之6號,核准設立,食品什貨、飲料零售業
38473921,以馬內利國際企業社,臺北市中山區龍江路209巷24號,核准設立,食品什貨、飲料零售業
25667760,皇后家洋品店,臺北市士林區大東路24號,核准設立,食品什貨、飲料零售業
31855403,一戶手作水餃軒,臺北市松山區富錦街525號,核准設立,食品什貨、飲料零售業
13845143,柿子火鍋店,臺北市萬華區漢中街155號1樓,核准設立,食品什貨、飲料零售業
38568530,波士頓洋行,臺北市松山區南京東路4段47號地下室,核准設立,食品什貨、飲料零售業
33873244,三財商店,臺北市南港區合順街8巷5弄31號1樓,核准設立,食品什貨、飲料零售業
99975854,睿懋國際商行,臺北市北投區西安街2段85號1樓,核准設立,食品什貨、飲料零售業
99644530,摩豆咖啡坊,臺北市中山區雙城街10巷20號1樓,核准設立,食品什貨、飲料零售業
26211917,韋澄企業社,臺北市萬華區艋舺大道120巷38弄41號,核准設立,食品什貨、飲料零售業
48888580,鎰源企業社,臺北市大同區延平北路2段213號3樓,核准設立,食品什貨、飲料零售業
05058472,遠東棋橋社,臺北市萬華區中華路1段78號8樓,核准設立,食品什貨、飲料零售業
31843245,若恩商行,臺北市中山區中山北路1段140巷13號,核准設立,食品什貨、飲料零售業
38513825,味蕾趣小舖,臺北市大安區復興南路2段366號,核准設立,食品什貨、飲料零售業
26340546,金億名店,臺北市中山區林森北路409號3樓之11,核准設立,食品什貨、飲料零售業
31952989,雄雄小吃店,臺北市大安區大安路2段23號,核准設立,食品什貨、飲料零售業
26355060,樂生活商行,臺北市內湖區康樂街72巷17弄5號地下室,核准設立,食品什貨、飲料零售業
73917492,上水行,臺北市萬華區中華路1段98號1樓,核准設立,食品什貨、飲料零售業
48720859,金雅食府風味館,臺北市中正區衡陽路90號1、2樓,核准設立,食品什貨、飲料零售業
38466718,中國創業報社,臺北市士林區至善路3段85號,核准設立,食品什貨、飲料零售業
26230822,食宜商行,臺北市中山區復興南路1段30巷4號1樓,核准設立,食品什貨、飲料零售業
31863987,國雲企業社,臺北市中山區林森北路121號5樓,核准設立,食品什貨、飲料零售業
38513254,尹仁食堂,臺北市中正區鎮江街3號1樓,核准設立,食品什貨、飲料零售業
25658214,沁涼企業社,臺北市內湖區新明路202號,核准設立,食品什貨、飲料零售業
25538730,五八一生活館,臺北市文山區指南路2段133號,核准設立,食品什貨、飲料零售業
01724453,上典電動工具五金行,臺北市文山區羅斯福路6段92巷1號1樓,核准設立,食品什貨、飲料零售業
38468390,國王烘焙坊,臺北市松山區八德路2段414號,核准設立,食品什貨、飲料零售業
25660247,岳紘企業社,臺北市松山區延吉街48巷3號3樓,核准設立,食品什貨、飲料零售業
01311707,鼎九肉類食品行,臺北市中山區北安路458巷41弄3號大直公有市場A樓9號攤位,核准設立,食品什貨、飲料零售業
48963736,緒沅商行,臺北市大同區民權西路144巷5弄7號11樓之1,核准設立,食品什貨、飲料零售業
38509174,穜欣桌球館,臺北市士林區天母西路13巷9號,核准設立,食品什貨、飲料零售業
42271335,遇見梵谷咖啡烘焙坊,臺北市信義區吳興街394巷6號,核准設立,食品什貨、飲料零售業
94907652,懋昇商行,臺北市萬華區萬大路311號1樓,核准設立,食品什貨、飲料零售業
48788040,元立行,臺北市萬華區和平西路3段57號1樓,核准設立,食品什貨、飲料零售業
48762631,森澤美容養生館,臺北市中山區長春路346號1、2樓,核准設立,食品什貨、飲料零售業
25524010,金梅花小吃店,臺北市南港區昆陽街157巷15號,核准設立,食品什貨、飲料零售業
25656948,正豐行,臺北市內湖區安康路468號,核准設立,食品什貨、飲料零售業
26201523,古軒亭茶坊,臺北市信義區永吉路120巷16號1樓,核准設立,食品什貨、飲料零售業
38460475,開來運動彩券商行,臺北市中山區錦州街264號,核准設立,食品什貨、飲料零售業
38501428,柔之坊,臺北市中山區林森北路85巷71號1樓,核准設立,食品什貨、飲料零售業
38647583,永吉紅豆餅商行,臺北市信義區永吉路30巷168弄2號1樓,核准設立,食品什貨、飲料零售業
25547941,意旺資訊社,臺北市南港區忠孝東路7段635號1樓,核准設立,食品什貨、飲料零售業
31966294,麥歡樂小吃店,臺北市松山區八德路4段512之1號,核准設立,食品什貨、飲料零售業
26369276,新自然烘焙工坊,臺北市大安區復興南路2段193巷3號,核准設立,食品什貨、飲料零售業
13848964,財神爺玩具藝品行,臺北市文山區車前路7號1樓,核准設立,食品什貨、飲料零售業
38556746,皓閔商店,臺北市松山區新東街3巷17號1樓,核准設立,食品什貨、飲料零售業
26232357,非苣不可麵食工坊,臺北市松山區民生東路4段131巷3號,核准設立,食品什貨、飲料零售業
99614851,美爾美複合式美食坊,臺北市南港區新民街23號1樓,核准設立,食品什貨、飲料零售業
25566469,保證好麵食館,臺北市大同區南京西路18巷6弄8之1號1樓,核准設立,食品什貨、飲料零售業
13379667,惠生中藥行,臺北市大同區迪化街1段100號,核准設立,食品什貨、飲料零售業
26345681,牛車水小吃店,臺北市松山區市民大道4段87號,核准設立,食品什貨、飲料零售業
31847782,雲品企業社,臺北市士林區重慶北路4段78號1樓,核准設立,食品什貨、飲料零售業
81768782,王冠蛋糕店,臺北市文山區木柵路3段35號1樓,核准設立,食品什貨、飲料零售業
80992208,鍶?玹工作坊,臺北市內湖區成功路4段325號4樓,核准設立,食品什貨、飲料零售業
26239416,皇鳳餐廳,臺北市萬華區西寧南路157、159號(5樓),核准設立,食品什貨、飲料零售業
31961306,穩當中彩券行,臺北市士林區延平北路5段154號,核准設立,食品什貨、飲料零售業
26229775,百洲企業社,臺北市中正區南昌路1段67號,核准設立,食品什貨、飲料零售業
38568573,元富麵團工房,臺北市中山區民生東路2段77號,核准設立,食品什貨、飲料零售業
31911828,御珍寶商行,臺北市松山區八德路4段789號,核准設立,食品什貨、飲料零售業
01227933,耕福園斤餅牛肉店,臺北市中山區松江路123巷12之1號1樓,核准設立,食品什貨、飲料零售業
38474724,真柏國際企業社,臺北市文山區羅斯福路5段216之1號2樓,核准設立,食品什貨、飲料零售業
26281265,好思吉禮品工作室,臺北市萬華區大理街114號2樓,核准設立,食品什貨、飲料零售業
48788267,財神食品商行,臺北市信義區松隆路56號,核准設立,食品什貨、飲料零售業
38581061,新富烘焙坊,臺北市士林區社中街148號,核准設立,食品什貨、飲料零售業
38582104,陞華企業社,臺北市大同區延平北路1段147號,核准設立,食品什貨、飲料零售業
42268578,雅果食舖,臺北市松山區南京東路5段251巷22弄29號,核准設立,食品什貨、飲料零售業
01721580,談天園茶行,臺北市文山區指南路3段38巷14之3號,核准設立,食品什貨、飲料零售業
25584086,敦品數位貿易工作室,臺北市大安區溫州街22號4樓之3,核准設立,食品什貨、飲料零售業
21737505,義鈦商行,臺北市萬華區武昌街2段47號,核准設立,食品什貨、飲料零售業
25558735,遠賀?子屋,臺北市信義區松山路119巷17弄5號,核准設立,食品什貨、飲料零售業
38496699,尚雅音樂餐坊,臺北市大安區和平東路3段73號1樓,核准設立,食品什貨、飲料零售業
01272802,樺樺禮品店,臺北市中山區中山北路2段27巷1號,核准設立,食品什貨、飲料零售業
38504473,萊琦商行,臺北市中正區衡陽路25號2樓,核准設立,食品什貨、飲料零售業
25619753,臻品食品行,臺北市南港區三重路19之4號,核准設立,食品什貨、飲料零售業
42270928,睿澄企業社,臺北市士林區忠誠路2段40巷14弄9號1樓,核准設立,食品什貨、飲料零售業
25564531,聖凱雜貨店,臺北市中正區南昌路1段43號,核准設立,食品什貨、飲料零售業
25672861,鴻奕書坊,臺北市北投區明德路77號1樓,核准設立,食品什貨、飲料零售業
26248631,嘉鑫百貨行,臺北市內湖區東湖路58巷1號,核准設立,食品什貨、飲料零售業
14335359,長客小吃店,臺北市中山區華陰街65號1樓,核准設立,食品什貨、飲料零售業
31874577,棕羽商行,臺北市松山區南京東路5段23巷4號1樓,核准設立,食品什貨、飲料零售業
48717159,舜發行,臺北市文山區辛亥路7段65巷7號1樓,核准設立,食品什貨、飲料零售業
48739739,陳媽媽的店,臺北市信義區松山路532號1樓,核准設立,食品什貨、飲料零售業
42271264,合泰商行,臺北市中山區新生北路2段60巷16號,核准設立,食品什貨、飲料零售業
38569860,東京物語館,臺北市萬華區西藏路338之1號,核准設立,食品什貨、飲料零售業
20998755,新瑞嘜食品行,臺北市大同區昌吉街100號1樓,核准設立,食品什貨、飲料零售業
99959897,馬叔餅舖,臺北市中正區臨沂街67之2號1樓,核准設立,食品什貨、飲料零售業
26222040,辛香小吃店,臺北市中山區錦州街242號1樓,核准設立,食品什貨、飲料零售業
30435426,皇華企業社,臺北市松山區吳興街284巷15之7號1樓,核准設立,食品什貨、飲料零售業
48844710,明方包子饅頭專賣店,臺北市中正區汀州路2段135號,核准設立,食品什貨、飲料零售業
78350431,王永盛木器行,臺北市松山區八德路4段785號1樓,核准設立,食品什貨、飲料零售業
26223723,巧芸商號,臺北市中正區館前路6號9樓之5,核准設立,食品什貨、飲料零售業
13854819,美門商行,臺北市文山區指南路3段71號2樓之2,核准設立,食品什貨、飲料零售業
26245260,太春居,臺北市中山區遼寧街19巷13號,核准設立,食品什貨、飲料零售業
25563131,甘露水雅集商行,臺北市信義區忠孝東路5段685號1樓,核准設立,食品什貨、飲料零售業
48902106,臻?子商行,臺北市北投區新興路158巷6號,核准設立,食品什貨、飲料零售業
77508645,進成魚丸店,臺北市大同區迪化街1段336號,核准設立,食品什貨、飲料零售業
38502876,躍邦咖啡茶飲坊,臺北市信義區逸仙路42巷11號1樓,核准設立,食品什貨、飲料零售業
38509152,復興胡商行,臺北市大安區復興南路2段181號1樓,核准設立,食品什貨、飲料零售業
80987704,安安自助洗衣店,臺北市內湖區文德路90巷15號,核准設立,食品什貨、飲料零售業
83925289,及品行,臺北市內湖區成功路3段187巷4號,核准設立,食品什貨、飲料零售業
38578256,群為企業社,臺北市信義區松山路651號5樓,核准設立,食品什貨、飲料零售業
73919153,明欣食品行,臺北市北投區承德路7段300號1樓,核准設立,食品什貨、飲料零售業
25535966,洛加怡營養早餐店,臺北市松山區三民路110巷10之2號1樓,核准設立,食品什貨、飲料零售業
38559997,田醬食食坊,臺北市南港區成福路121巷60弄18號,核准設立,食品什貨、飲料零售業
48967640,松嶸小吃店,臺北市信義區莊敬路438號1樓,核准設立,食品什貨、飲料零售業
38566462,不甘單咖啡,臺北市松山區慶城街14之1號,核准設立,食品什貨、飲料零售業
48982641,勵鑫企業社,臺北市萬華區興寧街8巷8號3樓,核准設立,食品什貨、飲料零售業
05196003,今東雲茶莊,臺北市中正區汀州路2段283號,核准設立,食品什貨、飲料零售業
14348642,興復發饅頭店,臺北市士林區德行東路109巷113號,核准設立,食品什貨、飲料零售業
42270504,安東城市企業社,臺北市中山區安東街19之1號,核准設立,食品什貨、飲料零售業
48971877,喜從天降烘焙屋,臺北市信義區信義路5段150巷225號,核准設立,食品什貨、飲料零售業
26252326,立成發食品行,臺北市大同區民生西路423巷17號1樓,核准設立,食品什貨、飲料零售業
25524525,文泰商行,臺北市文山區興隆路4段93號,核准設立,食品什貨、飲料零售業
38505873,花旺企業社,臺北市文山區景豐街48巷1號,核准設立,食品什貨、飲料零售業
48948807,葛莉蕬食品行,臺北市文山區新光路1段158號,核准設立,食品什貨、飲料零售業
77151390,萬大小吃店,臺北市萬華區萬大路425號1樓,核准設立,食品什貨、飲料零售業
10368568,奕盛小吃店,臺北市信義區忠孝東路5段627號,核准設立,食品什貨、飲料零售業
38552853,山東高家莊餃子館,臺北市松山區光復北路26巷12號,核准設立,食品什貨、飲料零售業
99344962,保寬商號,臺北市內湖區內湖路2段253巷6弄3號,核准設立,食品什貨、飲料零售業
99339525,高昇麵店,臺北市文山區木新路3段232巷4號1樓,核准設立,食品什貨、飲料零售業
31950188,大魚墮落小吃店,臺北市文山區指南路2段161號(2樓),核准設立,食品什貨、飲料零售業
13449072,靈悅天然芳香養生館,臺北市大安區忠孝東路4段216巷33弄4號,核准設立,食品什貨、飲料零售業
38574189,淳品飲料店,臺北市松山區八德路4段669號1樓,核准設立,食品什貨、飲料零售業
31872515,昱辰企業社,臺北市信義區吳興街600巷98弄2號2樓,核准設立,食品什貨、飲料零售業
77485642,璀璨東方古玩店,臺北市大安區信義路2段44巷2號,核准設立,食品什貨、飲料零售業
21725917,芊葒小吃店,臺北市中正區汀州路1段133號1樓,核准設立,食品什貨、飲料零售業
26235116,大炒一番小吃店,臺北市北投區東華街2段180號,核准設立,食品什貨、飲料零售業
17085565,元氣則小吃店,臺北市松山區復興北路231巷7號1樓,核准設立,食品什貨、飲料零售業
31849141,一氣餐飲,臺北市中山區遼寧街168號1樓,核准設立,食品什貨、飲料零售業
38553712,春春天餐坊,臺北市中山區林森北路85巷39號地下,核准設立,食品什貨、飲料零售業
25577732,光真城餐廳,臺北市中山區林森北路119巷47號,核准設立,食品什貨、飲料零售業
99629448,英芳香料行,臺北市萬華區西園路2段121號1樓,核准設立,食品什貨、飲料零售業
26352943,明輝蔬菜行,臺北市中山區行仁里龍江路2段370巷52號,核准設立,食品什貨、飲料零售業
83919527,七喜米商行,臺北市松山區南京東路4段133巷5弄1號,核准設立,食品什貨、飲料零售業
