38570613,水天齊企業社,臺北市中山區松江路123巷8之2號1樓,核准設立,食品什貨批發業
31844552,晉倫商行,臺北市大同區延平北路3段4號3樓,核准設立,食品什貨批發業
38558033,浩瀚行銷社,臺北市信義區基隆路1段103號14樓之4,核准設立,食品什貨批發業
31710483,宏暐企業社,臺北市中山區復興北路48號3樓,核准設立,食品什貨批發業
26373068,喜寬豐企業行,臺北市文山區羅斯福路5段176巷51號,核准設立,食品什貨批發業
26351374,珮芝美容工作室,臺北市松山區民權東路3段160巷22號2樓之1,核准設立,食品什貨批發業
31873681,艾莉絲美顏館,臺北市中山區林森北路561號10樓之5,核准設立,食品什貨批發業
48725073,聯來企業社,臺北市大同區重慶北路2段73巷20號4樓,核准設立,食品什貨批發業
48536278,欣淇企業社,臺北市大安區復興南路2段148號9樓之1,核准設立,食品什貨批發業
48907812,義路食品行,臺北市內湖區內湖路2段355巷2號8樓之1,核准設立,食品什貨批發業
26341411,利昂商號,臺北市中正區館前路6號8樓之5,核准設立,食品什貨批發業
48939666,魯旦茶酒菜館,臺北市中山區建國南路2段151巷48號,核准設立,食品什貨批發業
31851075,酉一二行號,臺北市大安區忠孝東路3段249號3樓,核准設立,食品什貨批發業
04829184,百松教學用品社,臺北市信義區基隆路2段22號6樓之6,核准設立,食品什貨批發業
10652402,鵬呈商行,臺北市大同區太原路153號,核准設立,食品什貨批發業
25565285,榛和有機坊,臺北市信義區忠孝東路5段508之6號,核准設立,食品什貨批發業
48816221,家家企業社,臺北市北投區公館路340巷8號3樓,核准設立,食品什貨批發業
26351986,大阜企業社,臺北市大安區信義路4段1號12樓之10,核准設立,食品什貨批發業
26348456,名漾企業社,臺北市士林區福華路164巷13號,核准設立,食品什貨批發業
26218622,上禾百貨行,臺北市萬華區中華路1段122號,核准設立,食品什貨批發業
25576760,嘉鄉豆腐店,臺北市士林區福志路24號,核准設立,食品什貨批發業
25539837,全球菁英企業社,臺北市中山區松江路194巷59號,核准設立,食品什貨批發業
38576763,江南貿易行,臺北市中山區興安街42號,核准設立,食品什貨批發業
48931828,永毅企業社,臺北市內湖區成功路2段250巷33號2樓,核准設立,食品什貨批發業
26251184,好餡食品原料行,臺北市松山區塔悠路19號9樓之4,核准設立,食品什貨批發業
25509221,和達人食品店,臺北市萬華區西園路1段314之2號,核准設立,食品什貨批發業
99987958,法亞企業社,臺北市內湖區成功路4段182巷6弄43號2樓之1,核准設立,食品什貨批發業
48979028,昇輝行,臺北市士林區重慶北路4段58號1樓,核准設立,食品什貨批發業
38565359,千禧企業社,臺北市中山區南京東路3段118號10樓之1,核准設立,食品什貨批發業
26224618,巧堡美食企業社,臺北市大安區忠孝東路4段166號12樓,核准設立,食品什貨批發業
38455923,寶菁美妍館,臺北市中山區民生西路45巷9弄17號1樓,核准設立,食品什貨批發業
99986819,京川食品物料行,臺北市北投區承德路7段280巷14號1樓,核准設立,食品什貨批發業
27165433,元泉餐飲設備行,臺北市中正區汀州路1段380號,核准設立,食品什貨批發業
10347488,京琦美容材料行,臺北市信義區忠孝東路5段412之2及之3號,核准設立,食品什貨批發業
38571747,元豐清潔用品商行,臺北市大同區民族西路223之9號6樓,核准設立,食品什貨批發業
20144764,陳氏蛋行,臺北市中山區民權東路2段148號3樓,核准設立,食品什貨批發業
38509300,卓昌商行,臺北市中山區民權東路3段17號1樓,核准設立,食品什貨批發業
21765229,栯慈商行,臺北市中山區民生東路3段1號3樓,核准設立,食品什貨批發業
38506140,綵軒企業社,臺北市松山區新東街41巷6號4樓,核准設立,食品什貨批發業
42270407,威品企業社,臺北市松山區八德路3段12巷51弄15號1樓,核准設立,食品什貨批發業
31878573,利芳商行,臺北市大安區敦化南路1段233巷66號,核准設立,食品什貨批發業
26234708,康寧生技企業社,臺北市北投區東華街1段392號1樓,核准設立,食品什貨批發業
38507154,大禮記食品行,臺北市文山區保儀路109巷17號2樓,核准設立,食品什貨批發業
42268275,極鮮美食企業社,臺北市大同區華陰街91號及91號2樓之1,核准設立,食品什貨批發業
29245855,欽愛眼鏡行,臺北市北投區石牌路2段62號1樓,核准設立,食品什貨批發業
48872736,立辰商行,臺北市大安區復興南路2段128巷6號4樓,核准設立,食品什貨批發業
48975563,唯好商行,臺北市士林區德行東路76號,核准設立,食品什貨批發業
30953047,良果食品店,臺北市大安區和平東路2段189號,核准設立,食品什貨批發業
26255219,東方庭園工作室,臺北市中山區雙城街19巷8號13樓之13,核准設立,食品什貨批發業
26223884,美林商行,臺北市大同區錦西街54號,核准設立,食品什貨批發業
31952236,瑞家商行,臺北市士林區福港街244巷18弄11號3樓,核准設立,食品什貨批發業
25517860,德星企業社,臺北市松山區南京東路5段40號6樓之7,核准設立,食品什貨批發業
48792213,大耀實業社,臺北市北投區自強街5巷118號,核准設立,食品什貨批發業
10317724,仲才實業社,臺北市中山區民生東路1段48號7樓之3,核准設立,食品什貨批發業
26251375,越峰工程行,臺北市中山區渭水路54號,核准設立,食品什貨批發業
25552958,永吉上品香行,臺北市信義區永吉路278巷1弄30號永吉市場34號攤位,核准設立,食品什貨批發業
31951969,幸韻草企業社,臺北市松山區民生東路3段158號地下一層之1,核准設立,食品什貨批發業
38582239,大匠和食企業社,臺北市中山區民權東路2段152巷22弄3號,核准設立,食品什貨批發業
26764305,卍普賢佛教文物用品企業,臺北市中山區建國北路3段113巷7弄3號(1樓),核准設立,食品什貨批發業
15667832,強懋資訊社,臺北市中正區八德路1段78號(3樓),核准設立,食品什貨批發業
38458528,維愛思時尚美學館,臺北市信義區忠孝東路5段71巷12弄28號1樓,核准設立,食品什貨批發業
38504184,和旺企業行,臺北市中山區長安東路一段16號4樓之7,核准設立,食品什貨批發業
26355370,白波健康企業社,臺北市松山區敦化北路120巷52號,核准設立,食品什貨批發業
01680069,廣飴鄉商行,臺北市北投區溫泉路30巷11之1號2樓,核准設立,食品什貨批發業
26249913,咪你酷可主題咖啡,臺北市中正區牯嶺街107號,核准設立,食品什貨批發業
42270151,上聖企業社,臺北市北投區大興街23巷17號3樓,核准設立,食品什貨批發業
31860399,鴻錡實業社,臺北市大安區復興南路2段277號3樓,核准設立,食品什貨批發業
38562509,璞豆企業社,臺北市大安區仁愛路3段5巷1弄21-7號,核准設立,食品什貨批發業
10381990,泛泰富都企業社,臺北市信義區忠孝東路5段372巷27弄72之1號,核准設立,食品什貨批發業
26215499,億芳企業社,臺北市信義區虎林街164巷72號2樓,核准設立,食品什貨批發業
31482404,鼎譽企業社,臺北市萬華區艋舺大道120巷11弄16號4樓,核准設立,食品什貨批發業
31877618,咖樂烘豆企業社,臺北市大安區延吉街68之16號,核准設立,食品什貨批發業
48557673,龍記事業工作室,臺北市松山區民生東路4段131巷1號3樓,核准設立,食品什貨批發業
26729005,仲旺企業社,臺北市內湖區陽光街285巷3號,核准設立,食品什貨批發業
05153601,信忠實業社,臺北市中正區惠安街17號1樓,核准設立,食品什貨批發業
38501150,李傑企業社,臺北市中正區漢口街1段110號8樓之12,核准設立,食品什貨批發業
38556632,廣灃水產行,臺北市萬華區西園路2段281巷18號1樓,核准設立,食品什貨批發業
38504939,大阜餐飲店,臺北市信義區忠孝東路4段553巷22弄4之1號,核准設立,食品什貨批發業
26215239,生全食品行,臺北市中山區龍江路358號,核准設立,食品什貨批發業
31847256,升懋生技企業社,臺北市大安區敦化南路1段317號,核准設立,食品什貨批發業
26355337,震威商行,臺北市萬華區三水街63號,核准設立,食品什貨批發業
45592438,穗霖農產行,臺北市萬華區萬大路424巷160號,核准設立,食品什貨批發業
26339479,春吉農產品行,臺北市北投區立農街1段257巷3弄5號2樓,核准設立,食品什貨批發業
48856573,有樂橫丁屋,臺北市文山區久康街66號,核准設立,食品什貨批發業
31860481,食采樂活商行,臺北市松山區富錦街485號1樓,核准設立,食品什貨批發業
48926249,璟瑞商行,臺北市北投區石牌路1段62號,核准設立,食品什貨批發業
26352922,漫動作咖啡館,臺北市中山區中山北路1段33巷20弄6號,核准設立,食品什貨批發業
38473112,九園企業社,臺北市大同區承德路3段198巷7號,核准設立,食品什貨批發業
99613419,采瑄美材精品店,臺北市士林區大東路86之5號1樓,核准設立,食品什貨批發業
38554260,綠舍健康生活館,臺北市文山區木柵路3段14號,核准設立,食品什貨批發業
38578170,鑫濠食品行,臺北市大同區安西街48號,核准設立,食品什貨批發業
38474512,永捷國際洋行,臺北市信義區吳興街524巷16弄2之1號(1樓),核准設立,食品什貨批發業
31715902,邦達創意工作坊,臺北市中山區民權東路3段57號4樓,核准設立,食品什貨批發業
31952475,安舜生命禮儀社,臺北市中山區民權東路2段174號,核准設立,食品什貨批發業
26371358,明月湯包小吃店,臺北市大安區通化街171巷40號,核准設立,食品什貨批發業
48821499,豐華商店,臺北市士林區延平北路5段127號4樓,核准設立,食品什貨批發業
26362034,濬品食品商行,臺北市文山區和興路26巷3之1號,核准設立,食品什貨批發業
26519346,艾伶企業社,臺北市信義區忠孝東路5段1之8號5樓,核准設立,食品什貨批發業
25657117,和宏食品行,臺北市文山區萬芳路19號,核准設立,食品什貨批發業
42270862,紳石商行,臺北市中山區林森北路119巷58號5樓,核准設立,食品什貨批發業
25656406,三采妍企業社,臺北市大安區忠孝東路4段329號8樓之1,核准設立,食品什貨批發業
31857401,銓福商行,臺北市松山區光復南路57巷3之1號1樓,核准設立,食品什貨批發業
38507387,富方商行,臺北市大安區建安里敦化南路1段189號,核准設立,食品什貨批發業
48720794,鄭家農產企業社,臺北市萬華區公有環南市場乙棟1樓第200號攤位,核准設立,食品什貨批發業
29216583,咖比咖啡店,臺北市松山區民生東路3段113巷21號1樓,核准設立,食品什貨批發業
38554640,欣美企業社,臺北市大安區通安街19巷2號,核准設立,食品什貨批發業
48735895,興真味行,臺北市中山區復興北路176號,核准設立,食品什貨批發業
25548408,天意養生館,臺北市中山區吉林路152號,核准設立,食品什貨批發業
26218427,貓守城堡企業社,臺北市中山區龍江路429巷7號1樓,核准設立,食品什貨批發業
38497640,偉殷企業社,臺北市文山區三福街4巷38號,核准設立,食品什貨批發業
38580268,永沅商行,臺北市士林區德行東路363號,核准設立,食品什貨批發業
48890538,菁蘋企業社,臺北市大安區復興南路2段293之3號10樓之1,核准設立,食品什貨批發業
26230822,食宜商行,臺北市中山區復興南路1段30巷4號1樓,核准設立,食品什貨批發業
25660247,岳紘企業社,臺北市松山區延吉街48巷3號3樓,核准設立,食品什貨批發業
31847782,雲品企業社,臺北市士林區重慶北路4段78號1樓,核准設立,食品什貨批發業
25584086,敦品數位貿易工作室,臺北市大安區溫州街22號4樓之3,核准設立,食品什貨批發業
26248631,嘉鑫百貨行,臺北市內湖區東湖路58巷1號,核准設立,食品什貨批發業
13449072,靈悅天然芳香養生館,臺北市大安區忠孝東路4段216巷33弄4號,核准設立,食品什貨批發業
26251683,文山茶行,臺北市中山區民族東路2號6樓之3,核准設立,食品什貨批發業
25579204,潘朵拉的盒子西點烘焙原料行,臺北市松山區饒河街200號,核准設立,食品什貨批發業
25553056,夏布立小吃店,臺北市大安區仁愛路4段228之6號1樓,核准設立,食品什貨批發業
31869130,菲帆企業商行,臺北市松山區民生東路5段137巷4弄14號8樓,核准設立,食品什貨批發業
98914887,百韻工坊,臺北市松山區南京東路4段93號2樓,核准設立,食品什貨批發業
99962393,垣翔企業社,臺北市北投區中央北路2段39號2樓,核准設立,食品什貨批發業
38473746,頤亨行,臺北市士林區忠誠路2段108號,核准設立,食品什貨批發業
30287396,津品企業社,臺北市信義區永吉路53號7樓之2,核准設立,食品什貨批發業
38572020,海城商行,臺北市信義區福德街5號1樓,核准設立,食品什貨批發業
25504252,海爾企業社,臺北市大安區忠孝東路4段2號11樓之5,核准設立,食品什貨批發業
03570102,德孚貿易行,臺北市中正區寶慶路37號7樓,核准設立,食品什貨批發業
26208130,咖啡捌拾捌咖啡專賣店,臺北市文山區木柵路1段88號,核准設立,食品什貨批發業
25655737,馬東小吃店,臺北市大安區忠孝東路4段223巷10弄4號,核准設立,食品什貨批發業
10332534,彩虹企業社,臺北市文山區景明街14巷6之1號,核准設立,食品什貨批發業
17759196,誌恩禮儀社,臺北市文山區興隆路4段32號,核准設立,食品什貨批發業
26352520,衍昌?菜行,臺北市士林區前港街88號2樓,核准設立,食品什貨批發業
25540047,情愫餐坊,臺北市大安區仁愛路4段407，407之1號地下1樓,核准設立,食品什貨批發業
48685950,逸采康健工作坊,臺北市士林區承德路4段116號2樓之7,核准設立,食品什貨批發業
25668162,凱星食品行,臺北市中山區新生北路2段108號11樓之6,核准設立,食品什貨批發業
38571079,譽翔百貨行,臺北市大同區重慶北路3段295巷6號1樓,核准設立,食品什貨批發業
38576166,御尊企業社,臺北市中山區天津街50號4樓,核准設立,食品什貨批發業
18405159,上吉創意企業社,臺北市中山區新生北路1段67號1樓,核准設立,食品什貨批發業
42269838,民丰果菜批發商行,臺北市松山區三民路35巷1號11樓之3,核准設立,食品什貨批發業
26360417,朋昌食品坊,臺北市松山區八德路4段92號,核准設立,食品什貨批發業
38580529,豐物美食行,臺北市內湖區東湖路43巷15號,核准設立,食品什貨批發業
25513816,有瑭商號,臺北市北投區中央南路1段217號,核准設立,食品什貨批發業
31723023,麓飲企業社,臺北市北投區中央北路4段142巷2號,核准設立,食品什貨批發業
77836289,大安醫療器材行,臺北市大安區大安路1段155號1樓,核准設立,食品什貨批發業
26359621,六顆星專業外燴坊,臺北市內湖區內湖路3段365號,核准設立,食品什貨批發業
38497992,上善企業社,臺北市中山區農安街45號10樓之4,核准設立,食品什貨批發業
48766849,柏源事業社,臺北市中山區民生東路3段1號3樓,核准設立,食品什貨批發業
25663315,鄉匯食品行,臺北市中山區松江路26巷13號3樓,核准設立,食品什貨批發業
31951953,達佩企業社,臺北市信義區信義路5段127號17樓之11,核准設立,食品什貨批發業
25538078,新生活全健康管理工作坊,臺北市大同區長安西路342號6樓之1,核准設立,食品什貨批發業
25582377,周雙發號,臺北市中山區中山北路1段118之1號3樓,核准設立,食品什貨批發業
10049729,凱閎食品行,臺北市信義區松壽路20號2樓,核准設立,食品什貨批發業
31864439,蓁豆家商行,臺北市大安區通化街57巷12號,核准設立,食品什貨批發業
31844758,奇樂創意行銷工作室,臺北市大同區民權西路144巷5弄7號6樓之3,核准設立,食品什貨批發業
26222962,瑞宏香興業社,臺北市中山區松江路46巷13號2樓,核准設立,食品什貨批發業
99775265,治源企業行,臺北市北投區尊賢街230巷12號2樓,核准設立,食品什貨批發業
20731356,弘正商店,臺北市松山區民生東路4段74號1樓,核准設立,食品什貨批發業
26215152,太駿多媒體行銷顧問,臺北市中正區許昌街42之1號10樓,核准設立,食品什貨批發業
26221844,咖比咖啡雜誌社,臺北市松山區民生東路3段113巷21號,核准設立,食品什貨批發業
99328908,精元企業社,臺北市南港區舊庄街1段66號1樓,核准設立,食品什貨批發業
31864070,益新國際商行,臺北市內湖區成功路4段323巷14弄5號2樓,核准設立,食品什貨批發業
31425880,若熊工作室,臺北市大安區仁愛路4段406之1號,核准設立,食品什貨批發業
08589164,皇品食品行,臺北市內湖區環山路1段24巷24號,核准設立,食品什貨批發業
38557668,好好生活實業,臺北市大安區大安路1段84巷2號3樓,核准設立,食品什貨批發業
31682677,由蒂食品,臺北市中山區雙城街38之1號,核准設立,食品什貨批發業
83937980,企美國際事業企業社,臺北市中山區民生東路2段70號3樓,核准設立,食品什貨批發業
25559354,品?工坊,臺北市松山區復興北路313巷39號1樓,核准設立,食品什貨批發業
38553467,上善文化館,臺北市中正區羅斯福路1段72巷1號1樓,核准設立,食品什貨批發業
48828205,天母漁店,臺北市士林區天玉街38巷6號2樓,核准設立,食品什貨批發業
26239529,福多雜糧行,臺北市大安區新生南路1段137巷9之1號,核准設立,食品什貨批發業
38503636,竹子米兒咖啡,臺北市中山區民生東路2段115巷24號1樓,核准設立,食品什貨批發業
05162860,全國眼鏡行,臺北市中正區羅斯福路3段278號1樓,核准設立,食品什貨批發業
13827406,立捷金屬企業社,臺北市信義區松德路25巷30號,核准設立,食品什貨批發業
30143814,金湯品企業社,臺北市松山區民生東路5段198號11樓之10,核准設立,食品什貨批發業
26728569,愛普資訊社,臺北市中山區民權西路27號10樓,核准設立,食品什貨批發業
25513822,小馬食品行,臺北市內湖區成功路3段187巷35弄23號,核准設立,食品什貨批發業
38571850,晶露實業社,臺北市文山區忠順街2段1號3樓,核准設立,食品什貨批發業
30273148,微笑森活企業社,臺北市中山區南京東路3段189號4樓,核准設立,食品什貨批發業
25580862,普樂創意工作室,臺北市中山區明水路702號4樓之3,核准設立,食品什貨批發業
09706491,愛之水企業社,臺北市北投區富貴一路5巷12號1樓,核准設立,食品什貨批發業
38566759,真平安滿喜樂商行,臺北市松山區八德路4段138號地下3層,核准設立,食品什貨批發業
38566272,天妃企業社,臺北市萬華區大理街159巷11號,核准設立,食品什貨批發業
31855712,展鳳禮儀社,臺北市中山區民權東路2段196號,核准設立,食品什貨批發業
38496348,恆豐企業社,臺北市文山區樟新街32巷6號,核准設立,食品什貨批發業
26235410,天馬茶房,臺北市大同區南京西路189號3樓,核准設立,食品什貨批發業
30289937,家禾健康美食館,臺北市松山區基隆路1段10號7樓,核准設立,食品什貨批發業
26254653,二十五號廚房,臺北市信義區中坡北路25號,核准設立,食品什貨批發業
38565941,嘉鎂全球行銷網,臺北市大同區延平北路4段282巷47號,核准設立,食品什貨批發業
38579641,城?企業社,臺北市士林區葫蘆街77號3樓,核准設立,食品什貨批發業
25535662,見達食品商行,臺北市松山區南京東路5段251巷46弄16號,核准設立,食品什貨批發業
48559145,福星大商店,臺北市北投區中和街258號1樓,核准設立,食品什貨批發業
25540150,寶格麗池企業社,臺北市中山區敬業三路157號、159號,核准設立,食品什貨批發業
25581102,三五階小吃店,臺北市信義區信義路5段7號35樓,核准設立,食品什貨批發業
48781237,明英商行,臺北市北投區中央北路3段40巷40號1樓,核准設立,食品什貨批發業
38580020,勤家餐飲事業行,臺北市大安區敦化南路2段275號,核准設立,食品什貨批發業
04473655,新光實業商行,臺北市大同區太原路175巷26號2樓,核准設立,食品什貨批發業
26337937,杬?臻?商行,臺北市南港區東新街80巷10弄22號,核准設立,食品什貨批發業
26353555,義采企業社,臺北市北投區永興路1段53巷4號3樓,核准設立,食品什貨批發業
38466463,小紅樓企業社,臺北市文山區羅斯福路5段214號9樓之7,核准設立,食品什貨批發業
38552988,伊登花園美學館,臺北市中正區公園路32號2樓之1,核准設立,食品什貨批發業
20298872,鼎欣酒莊,臺北市北投區大業路517巷17號,核准設立,食品什貨批發業
38459717,佳裕小吃店,臺北市南港區忠孝東路5段1000號2樓,核准設立,食品什貨批發業
38554439,永康三一六工坊,臺北市大安區永康街31巷16號,核准設立,食品什貨批發業
38570986,駿工翡翠泡菜屋,臺北市大同區南京西路109號1樓,核准設立,食品什貨批發業
38574688,旭立宸企業社,臺北市信義區永吉路120巷50弄25號3樓,核准設立,食品什貨批發業
15901289,正泰日用品百貨行,臺北市萬華區莒光路181號1樓,核准設立,食品什貨批發業
48732356,樺達國際商行,臺北市中山區松江路38巷2號2樓之1,核准設立,食品什貨批發業
48963736,緒沅商行,臺北市大同區民權西路144巷5弄7號11樓之1,核准設立,食品什貨批發業
26232357,非苣不可麵食工坊,臺北市松山區民生東路4段131巷3號,核准設立,食品什貨批發業
48717159,舜發行,臺北市文山區辛亥路7段65巷7號1樓,核准設立,食品什貨批發業
26223723,巧芸商號,臺北市中正區館前路6號9樓之5,核准設立,食品什貨批發業
26252326,立成發食品行,臺北市大同區民生西路423巷17號1樓,核准設立,食品什貨批發業
48972566,億達企業社,臺北市中山區新生北路3段11巷30號,核准設立,食品什貨批發業
31872515,昱辰企業社,臺北市信義區吳興街600巷98弄2號2樓,核准設立,食品什貨批發業
26352943,明輝蔬菜行,臺北市中山區行仁里龍江路2段370巷52號,核准設立,食品什貨批發業
26227679,光芒企業社,臺北市中山區松江路469巷1號6樓之1,核准設立,食品什貨批發業
31953410,行得利開發商行,臺北市大同區民權西路89號4樓,核准設立,食品什貨批發業
31954889,互信企業社,臺北市中山區長春路20號2樓,核准設立,食品什貨批發業
25535229,貝比卡企業社,臺北市信義區松山路540巷3弄19號,核准設立,食品什貨批發業
26230153,漾果子食品坊,臺北市大安區忠孝東路4段169號6樓之1,核准設立,食品什貨批發業
38579229,寶島傳奇商行,臺北市中山區中山北路2段137巷34號6樓之2,核准設立,食品什貨批發業
42270758,馨茉國際實業社,臺北市內湖區文德路66巷14弄12號2樓,核准設立,食品什貨批發業
38473247,蜜思禮企業社,臺北市大同區重慶北路1段22號地下之5,核准設立,食品什貨批發業
38506520,偉華企業社,臺北市士林區蘭雅里德行東路109巷73弄5號1樓,核准設立,食品什貨批發業
31860948,朴子魚丸店,臺北市中山區民族東路410巷19號,核准設立,食品什貨批發業
25542832,春吉蛋行,臺北市北投區公館路255巷1弄3號2樓,核准設立,食品什貨批發業
13841934,瑋捷企業社,臺北市中山區建國北路3段113巷19弄3號,核准設立,食品什貨批發業
38568139,開心點創意美食網,臺北市中山區新生北路2段58巷21號之1,核准設立,食品什貨批發業
38468286,巨人企業社,臺北市中山區農安街71號1樓,核准設立,食品什貨批發業
48800348,拉撒路企業社,臺北市萬華區環河南路3段185號,核准設立,食品什貨批發業
31952094,花花姐姐工作坊,臺北市文山區萬隆街47號、47之2號1樓,核准設立,食品什貨批發業
01608980,龍鳳珠寶精品行,臺北市大安區安和路1段38號,核准設立,食品什貨批發業
04841552,中興企業社,臺北市文山區景華街128巷3弄5號1樓,核准設立,食品什貨批發業
21761482,吉米商行,臺北市中山區松江路514號1樓,核准設立,食品什貨批發業
38553950,金鳳旺食品行,臺北市中山區松江路28號7樓之2,核准設立,食品什貨批發業
31852692,美萌時尚館,臺北市北投區石牌路2段122號2樓,核准設立,食品什貨批發業
99972792,錦辰行,臺北市信義區忠孝東路5段701號4樓,核准設立,食品什貨批發業
38496213,春富企業社,臺北市南港區東明街33號,核准設立,食品什貨批發業
26730609,宸金企業社,臺北市文山區忠順街2段25號,核准設立,食品什貨批發業
26211780,三千櫻商行,臺北市松山區南京東路3段303巷7弄5號,核准設立,食品什貨批發業
31878264,展宸商行,臺北市士林區福港街149巷15弄8號,核准設立,食品什貨批發業
38513352,田寶健康蔬食食品行,臺北市信義區莊敬路289巷14號,核准設立,食品什貨批發業
81648231,鑽石亮晶晶清潔社,臺北市中山區吉林路245號3樓,核准設立,食品什貨批發業
26249940,欣穎國際企業社,臺北市大安區仁愛路3段129號4樓,核准設立,食品什貨批發業
