14317303,新奕城商行,臺北市中山區長春路16號11樓,歇業／撤銷,菸酒零售業
48808741,紅柏餐坊,臺北市中山區中山北路2段16巷23號,核准設立,菸酒零售業
99365044,虹玫瑰軒,臺北市萬華區三水街124號7樓,廢止,菸酒零售業
17077919,柏特實業社,臺北市中山區民族東路60號7樓之2,遷他縣市,菸酒零售業
77890311,千日檳榔店,臺北市大安區建國南路1段159號,核准設立,菸酒零售業
48848167,月仙都茶莊,臺北市萬華區華西街21巷1之3號,核准設立,菸酒零售業
73903130,隨緣軒,臺北市萬華區三水街127號129號4樓,廢止,菸酒零售業
21721362,傑立宏餐廳,臺北市中山區吉林路14巷18號地下1樓,核准設立,菸酒零售業
21721187,美地的店,臺北市大安區敦化南路1段233巷62號1樓,歇業／撤銷,菸酒零售業
48731949,暢茂商行,臺北市中正區中華路2段75巷19號1樓,歇業／撤銷,菸酒零售業
26340855,炭坊主串燒店,臺北市松山區市民大道4段225號,歇業／撤銷,菸酒零售業
25576044,九東商行,臺北市中山區中山北路1段121巷11號,歇業／撤銷,菸酒零售業
13451267,多閤食府敦南一店,臺北市大安區敦化南路1段236巷18號1樓,歇業／撤銷,菸酒零售業
31855781,水閣餐坊,臺北市中山區林森北路85巷68號地下,歇業／撤銷,菸酒零售業
48900043,國亨商行,臺北市中山區林森北路263號2樓,歇業／撤銷,菸酒零售業
25503850,利曲餐坊,臺北市中山區松江路362巷81號,核准設立,菸酒零售業
27161680,小霖食堂,臺北市大安區新生南路1段165巷16號,核准設立,菸酒零售業
99349087,都市商行,臺北市中山區林森北路409號3樓之1,歇業／撤銷,菸酒零售業
17530117,慧珍商行,臺北市北投區中央北路3段30號1樓,廢止,菸酒零售業
48929219,麗加餐坊,臺北市中山區林森北路138巷12號,歇業／撤銷,菸酒零售業
99615958,采風餐館,臺北市北投區泉源路12號2樓之1,核准設立,菸酒零售業
38565301,千惠食坊,臺北市中山區大直街32號1樓,核准設立,菸酒零售業
48673687,安心薑母鴨店,臺北市中山區興安街42號1樓,歇業／撤銷,菸酒零售業
17526015,一肥仔商行,臺北市中山區天津街41號1樓,歇業／撤銷,菸酒零售業
99976452,薩拉森企業社,臺北市信義區林口街180號之2、1樓,歇業／撤銷,菸酒零售業
14312145,斯薇芙企業社,臺北市大安區復興南路2段128巷3之2號1樓,歇業／撤銷,菸酒零售業
10302428,梵谷餐坊,臺北市中山區雙城街32巷4之1號1樓,歇業／撤銷,菸酒零售業
13820950,唻萊香軒,臺北市萬華區西園路1段212巷36號38號、2樓,歇業／撤銷,菸酒零售業
48975819,梅山商行,臺北市大安區光復南路346巷56號1樓、地下樓,歇業／撤銷,菸酒零售業
48559102,哥莉瑪餐坊,臺北市文山區景興路65號1樓,歇業／撤銷,菸酒零售業
18387167,鹿港食品行,臺北市內湖區民權東路6段29號1樓,歇業／撤銷,菸酒零售業
48803154,千燕商行,臺北市松山區南京東路5段66巷25號,歇業／撤銷,菸酒零售業
99961578,聚隆商行,臺北市大安區忠孝東路4段209號9樓,廢止,菸酒零售業
14749766,白人蔘商行,臺北市大同區民生西路290號地下1樓,歇業／撤銷,菸酒零售業
48954862,卡爾食品行,臺北市萬華區和平西路3段122號,遷他縣市,菸酒零售業
31881155,即思整合行銷工作室,臺北市北投區石牌路2段315巷12之1號2樓,核准設立,菸酒零售業
17769878,頂福小吃店,臺北市士林區天母東路8巷92號,歇業／撤銷,菸酒零售業
26247773,越芳蘭餐廳,臺北市士林區中山北路5段604號1樓及地下層,核准設立,菸酒零售業
15650852,亞平陽光田園咖啡店,臺北市松山區八德路3段12巷5弄17號1樓,歇業／撤銷,菸酒零售業
10352051,美樂麗餐廳,臺北市中山區林森北路131號2樓,歇業／撤銷,菸酒零售業
26375973,伍伍伍小吃店,臺北市南港區忠孝東路7段555號,歇業／撤銷,菸酒零售業
13455762,復古小吃店,臺北市松山區北寧路40號1樓,歇業／撤銷,菸酒零售業
10304811,明洞館小吃店,臺北市大安區延吉街62巷11號,核准設立,菸酒零售業
25562105,波月日式餐坊,臺北市大安區新生南路3段68之2號,歇業／撤銷,菸酒零售業
27157258,馨坊食品行,臺北市中山區伊通街50號1樓,歇業／撤銷,菸酒零售業
25541566,滿鑫行,臺北市中山區吉林路299巷7號,核准設立,菸酒零售業
94917259,金色陽光坊,臺北市大安區忠孝東路4段209號11樓之1,歇業／撤銷,菸酒零售業
10346586,達人農產行,臺北市萬華區康定路46巷9號6樓之6,遷他縣市,菸酒零售業
83908248,閣樓坊,臺北市中山區雙城街32巷2之3號2樓,歇業／撤銷,菸酒零售業
10383054,紫琳餐廳,臺北市中山區林森北路133巷19號,廢止,菸酒零售業
48788230,神牛日式燒肉店,臺北市中山區建國北路2段88號1樓,核准設立,菸酒零售業
80981758,同豐禮品社,臺北市中山區林森北路410之2號410之5號1樓,歇業／撤銷,菸酒零售業
26370203,友雅軒,臺北市萬華區華西街14之1號,核准設立,菸酒零售業
15634707,商鼎食品行,臺北市南港區研究院路2段24號1樓,核准設立,菸酒零售業
26351579,美樂家小吃店,臺北市中山區中山北路1段83巷13號,核准設立,菸酒零售業
29238382,元氣金剛遊樂園,臺北市萬華區中華路1段144號地下1樓之66,歇業／撤銷,菸酒零售業
21758276,新友樂商行,臺北市中山區林森北路85巷40號,歇業／撤銷,菸酒零售業
26235050,記得商行,臺北市中山區大直街106號1樓,核准設立,菸酒零售業
14322489,笙歌夜小館,臺北市大安區敦化南路2段140號1樓,歇業／撤銷,菸酒零售業
17270978,海克利斯企業社,臺北市中山區民族東路10號2樓,歇業／撤銷,菸酒零售業
48791495,立智行,臺北市士林區重慶北路4段201號,廢止,菸酒零售業
99344724,富悅餐坊,臺北市大安區仁愛路4段112巷21號1樓,廢止,菸酒零售業
13845761,金豹商行,臺北市大安區仁愛路4段8巷33號1樓,歇業／撤銷,菸酒零售業
29227701,浪居坊,臺北市大安區敦化南路2段63巷15號1樓,廢止,菸酒零售業
18097076,洋廣行商行,臺北市中山區吉林路36號7樓,歇業／撤銷,菸酒零售業
26354169,康妮小坊,臺北市中山區南京東路1段132巷12號1樓,歇業／撤銷,菸酒零售業
15650311,新辰彩券行,臺北市士林區社中街209號1樓,歇業／撤銷,菸酒零售業
99642723,廣林商行,臺北市士林區福港街107巷8號1樓,歇業／撤銷,菸酒零售業
48743608,晴之屋餐坊,臺北市中山區北安路608巷5弄1號1樓,歇業／撤銷,菸酒零售業
80996247,歐洲視野餐飲店,臺北市中正區館前路42號地下樓,歇業／撤銷,菸酒零售業
48583187,昌茂商號,臺北市大同區長安西路25號1樓,核准設立,菸酒零售業
81739008,銘佳商店,臺北市中山區長春路128之8號1樓,歇業／撤銷,菸酒零售業
21765375,法式香檳餐坊,臺北市信義區松德路171號地下之3、之4,廢止,菸酒零售業
27161014,喬依商行,臺北市中山區林森北路50號8樓之9,歇業／撤銷,菸酒零售業
13854331,永怡平價量販店,臺北市內湖區康樂街91號1樓,歇業／撤銷,菸酒零售業
27166849,東門吳檳榔店,臺北市中正區金山南路1段132號,核准設立,菸酒零售業
25540264,酒條通商行,臺北市信義區嘉興街181巷9弄40號,歇業／撤銷,菸酒零售業
48778063,搖擺咖啡店,臺北市大安區安和路2段233號1樓,歇業／撤銷,菸酒零售業
48788409,鴻昌彩券投注站,臺北市松山區南京東路5段250巷11之1號,歇業／撤銷,菸酒零售業
10318934,夏姿林餐坊,臺北市內湖區康寧路3段75巷272號,核准設立,菸酒零售業
99362454,偉祥商行,臺北市士林區中山北路5段734號6樓,廢止,菸酒零售業
25540320,金富豪餐廳,臺北市中山區林森北路381號2樓,列入廢止中,菸酒零售業
99955457,波阿斯小吃店,臺北市內湖區內湖路1段316號1樓,歇業／撤銷,菸酒零售業
13849696,阿泉仔商行,臺北市北投區中和街292巷8號1樓,歇業／撤銷,菸酒零售業
98890301,華柚餐坊,臺北市中山區林森北路119巷45號,歇業／撤銷,菸酒零售業
25583559,玖坊餐廳,臺北市萬華區西園路1段212巷36號2樓,廢止,菸酒零售業
99951847,邦果食品店,臺北市大安區溫州街74巷5弄3號1樓,歇業／撤銷,菸酒零售業
48949931,馥芳食品行,臺北市中正區南昌路1段47號,歇業／撤銷,菸酒零售業
13847276,聯彩食品行,臺北市大安區大安路1段213號1樓,歇業／撤銷,菸酒零售業
99350915,富譽行,臺北市中山區雙城街32巷2之6號2樓,歇業／撤銷,菸酒零售業
13468984,旺仔清茶館,臺北市萬華區西園路1段72巷17號1樓,歇業／撤銷,菸酒零售業
48962407,圓緣園軒,臺北市萬華區梧州街53號2樓,廢止,菸酒零售業
26231821,捌捌捌酒坊,臺北市中山區林森北路133巷53號,歇業／撤銷,菸酒零售業
48737612,香之田食堂,臺北市內湖區內湖路1段323巷7號地下1樓之1,廢止,菸酒零售業
25573362,尚雅商行,臺北市中正區忠孝西路1段173號,歇業／撤銷,菸酒零售業
13824442,揚森商行,臺北市中山區民生西路16號7樓之1,歇業／撤銷,菸酒零售業
99988443,漢誠堂,臺北市大同區迪化街1段131號,核准設立,菸酒零售業
31866062,親密愛人餐坊,臺北市中山區林森北路85巷69號,歇業／撤銷,菸酒零售業
80984988,松米美食坊,臺北市中正區仁愛路2段6號1樓,歇業／撤銷,菸酒零售業
48709806,高華企業社,臺北市南港區南港路1段73號,遷他縣市,菸酒零售業
48857046,馬恩田園法國餐廳,臺北市松山區興安街161號,核准設立,菸酒零售業
26218572,鑫世紀企業社,臺北市中山區南京東路2段176號5樓,歇業／撤銷,菸酒零售業
26239345,甲味仙商店,臺北市北投區中央北路2段260號,歇業／撤銷,菸酒零售業
25547132,康榮食品商行,臺北市信義區基隆路1段155號13樓之5,遷他縣市,菸酒零售業
25574088,金億發行,臺北市中山區雙城街21號2樓,核准設立,菸酒零售業
25562718,鑫意南洋料理店,臺北市中山區民生東路2段115巷4號,歇業／撤銷,菸酒零售業
14744761,燒肉偉人小吃店,臺北市大安區市民大道4段118號120號1樓及地下層,歇業／撤銷,菸酒零售業
13850460,?星商行,臺北市文山區羅斯福路6段44號,歇業／撤銷,菸酒零售業
13846109,林何商行,臺北市大同區環河北路1段65號1樓,歇業／撤銷,菸酒零售業
14328553,聯發企業行,臺北市大安區忠孝東路4段197號11樓之8,歇業／撤銷,菸酒零售業
99988372,禾康商行,臺北市大安區通化街143巷33號1樓,歇業／撤銷,菸酒零售業
26355202,多田商行,臺北市士林區文林路320號,歇業／撤銷,菸酒零售業
25637730,廣三餐廳,臺北市中山區民權東路1段72號3樓,歇業／撤銷,菸酒零售業
15664785,六條食品行,臺北市中山區中山北路1段105巷6號2樓,歇業／撤銷,菸酒零售業
29201245,大都餐坊,臺北市中山區民權東路3段57號1樓,歇業／撤銷,菸酒零售業
98882386,就是義大利食品行,臺北市大安區大安路1段83巷2號，85號,廢止,菸酒零售業
14340156,舒福商號,臺北市大安區忠孝東路4段201號6樓,歇業／撤銷,菸酒零售業
48781200,吉翔洋行,臺北市中山區建國北路2段86號5樓,歇業／撤銷,菸酒零售業
73902316,馨福軒,臺北市萬華區華西街30巷8之1號2樓,歇業／撤銷,菸酒零售業
21701892,佐里小吃店,臺北市中山區林森北路119巷89號1樓,歇業／撤銷,菸酒零售業
48501947,快樂雞餐坊,臺北市信義區松壽路16號2樓,歇業／撤銷,菸酒零售業
15663293,松緣坊,臺北市中山區德惠街95之1號1樓,廢止,菸酒零售業
25541926,鼎?涮涮鍋餐坊,臺北市信義區基隆路2段143號,停業,菸酒零售業
18088338,寬頻道餐坊,臺北市中山區雙城街32巷2之3號2樓,歇業／撤銷,菸酒零售業
25556912,嘉頓洋行,臺北市中正區衡陽路85號2樓之2,歇業／撤銷,菸酒零售業
26218382,心生活商行,臺北市北投區中央北路1段88號,核准設立,菸酒零售業
14334416,玉翎樓餐廳,臺北市中山區中山北路1段105巷12之4號1樓,歇業／撤銷,菸酒零售業
29205501,寶神小吃店,臺北市中山區吉林路233號1樓,歇業／撤銷,菸酒零售業
99957032,幸福樂手音樂工作室,臺北市中正區南昌路2段222號5樓之12,遷他縣市,菸酒零售業
81641737,淶可餐坊,臺北市萬華區成都路54號3樓,核准設立,菸酒零售業
31952171,酒膳家庭料理,臺北市中山區錦州街241巷1弄2號1樓,核准設立,菸酒零售業
25583100,舜子牛肉麵店,臺北市中山區民生東路2段122號,廢止,菸酒零售業
48725165,蓁鴻商行,臺北市萬華區德昌街152號1樓,歇業／撤銷,菸酒零售業
83920593,飲座軒,臺北市萬華區梧州街24、26號2樓,廢止,菸酒零售業
48797049,泉勝商行,臺北市中山區松江路27號7樓之9,廢止,菸酒零售業
48762436,虹喜食品小吃店,臺北市信義區莊敬路396、398號1樓,歇業／撤銷,菸酒零售業
99950381,珍竹林餐廳,臺北市中山區林森北路133巷9號,歇業／撤銷,菸酒零售業
98907464,日之坊有機營養餐館,臺北市信義區莊敬路6巷7號1樓,歇業／撤銷,菸酒零售業
73900823,鳳花樓軒,臺北市萬華區廣州街174號2樓3樓4樓5樓,歇業／撤銷,菸酒零售業
15649687,昶興商店,臺北市南港區南港路1段130號1樓,歇業／撤銷,菸酒零售業
48871602,紅銅美食坊,臺北市中正區杭州南路1段27號地下二層,歇業／撤銷,菸酒零售業
26338653,漁村薑母鴨小吃店,臺北市信義區松山路639號,列入廢止中,菸酒零售業
31947327,大串小吃店,臺北市大安區市民大道路4段臨42號,核准設立,菸酒零售業
26255626,簡單的幸福餐坊,臺北市內湖區環山路1段47號,核准設立,菸酒零售業
15640258,金安小吃店,臺北市大同區延平北路2段286之5號,歇業／撤銷,菸酒零售業
38562418,嘟嘟鳥餐坊,臺北市中山區吉林路26巷26號,核准設立,菸酒零售業
31869624,慶展商行,臺北市松山區北寧路6號,核准設立,菸酒零售業
73917839,龍祥商行,臺北市信義區永吉路468巷17弄5號1樓,停業,菸酒零售業
26249049,弘偉餐坊,臺北市松山區八德路2段375號1樓,歇業／撤銷,菸酒零售業
73913637,安塔羅食品行,臺北市松山區三民路167巷10號1樓,歇業／撤銷,菸酒零售業
38567223,富實餐廳,臺北市中山區林森北路133巷40號1樓,核准設立,菸酒零售業
26249202,鮨和日本料理食堂,臺北市內湖區民權東路6段296巷46號,歇業／撤銷,菸酒零售業
48726381,樂華鑫軒,臺北市萬華區漢口街2段34巷15號2樓3樓及17號2樓3樓,歇業／撤銷,菸酒零售業
10331036,一粒麥子蛋糕專業烘焙坊,臺北市士林區承德路4段40巷66號,核准設立,菸酒零售業
31880775,公食官企業社,臺北市中正區羅斯福路3段302號地下室,歇業／撤銷,菸酒零售業
25601938,欣水晶軒,臺北市萬華區廣州街190號7樓,歇業／撤銷,菸酒零售業
99951522,南澳實業社,臺北市文山區仙岩路12號1樓,歇業／撤銷,菸酒零售業
48808539,尹清邁小吃店,臺北市大安區安和路2段213號,歇業／撤銷,菸酒零售業
38467842,極上堂,臺北市松山區民權東路3段146號,核准設立,菸酒零售業
99327859,金角商行,臺北市松山區八德路4段256號1樓,遷他縣市,菸酒零售業
48808910,日嘉娟之坊小吃店,臺北市文山區木新路3段117號,歇業／撤銷,菸酒零售業
48876120,旺來發彩券行,臺北市萬華區武昌街2段100號,歇業／撤銷,菸酒零售業
48770858,愛麗思簡餐店,臺北市文山區興隆路1段232號1樓,核准設立,菸酒零售業
13852002,姬小松小吃店,臺北市中山區農安街88號1樓,歇業／撤銷,菸酒零售業
29201224,八度么哥哥牛排複合式早餐店,臺北市文山區興隆路3段36巷17弄5號1樓,歇業／撤銷,菸酒零售業
77900649,里市商店,臺北市大安區敦化南路1段187巷61號1樓,歇業／撤銷,菸酒零售業
14743290,好日子便利商店,臺北市士林區中正路431號1樓,歇業／撤銷,菸酒零售業
14733217,龜萬年食堂,臺北市內湖區內湖路1段285巷65弄19號,歇業／撤銷,菸酒零售業
15668889,泰信商行,臺北市中山區林森北路409號3樓之4,歇業／撤銷,菸酒零售業
25656216,築地小吃店,臺北市大安區永康街34之4號,核准設立,菸酒零售業
21723679,全館企業社,臺北市萬華區萬大路422號1樓,核准設立,菸酒零售業
14329309,名媛小坊,臺北市中山區南京東路2段65號2樓、67號2樓,歇業／撤銷,菸酒零售業
25582382,禾定豐商行,臺北市北投區中和街335號,核准設立,菸酒零售業
48847337,由申甲企業社,臺北市大安區臨江街82號,歇業／撤銷,菸酒零售業
99358352,永正食品行,臺北市信義區忠孝東路5段1之1號13樓,歇業／撤銷,菸酒零售業
26336326,順心商行,臺北市中山區中山北路2段77巷24之2號,歇業／撤銷,菸酒零售業
48694374,一水堂商行,臺北市松山區基隆路1段97號5樓之1,歇業／撤銷,菸酒零售業
48847343,寂靜之外咖啡館,臺北市大安區安和路2段32巷19號,廢止,菸酒零售業
48735945,貳伍捌餐飲企業社,臺北市文山區興隆路1段233號,歇業／撤銷,菸酒零售業
25507954,錢豐商行,臺北市士林區永平街75巷3號1樓,核准設立,菸酒零售業
48678830,吉輝實業社,臺北市中山區林森北路575號7樓之11,歇業／撤銷,菸酒零售業
48936653,我們的家餐坊,臺北市中山區中山北路2段77巷18之3號,歇業／撤銷,菸酒零售業
48769780,飲冰思茶飲食坊,臺北市內湖區內湖路1段423號,廢止,菸酒零售業
80987893,廣島屋本店,臺北市信義區吳興街269巷22號1樓,核准設立,菸酒零售業
13445511,順興商行,臺北市文山區木新路2段277號1樓,歇業／撤銷,菸酒零售業
99948169,四季藝術茶坊,臺北市萬華區三水街135號1樓,核准設立,菸酒零售業
48691405,梅芝坊,臺北市中山區林森北路107巷61號1樓,歇業／撤銷,菸酒零售業
17543605,宏梅藝術店,臺北市北投區清江路212之4號1樓,核准設立,菸酒零售業
99336745,陽春商號,臺北市信義區光復南路447之24號1樓,核准設立,菸酒零售業
48891614,京之日食坊,臺北市萬華區西寧南路36之90號,歇業／撤銷,菸酒零售業
48762983,韻嘉企業社,臺北市大安區敦化南路1段161巷38號,歇業／撤銷,菸酒零售業
14734074,真記茶水舖,臺北市大安區延吉街68之24號,歇業／撤銷,菸酒零售業
21761309,聚香食坊,臺北市松山區八德路3段139號1樓,歇業／撤銷,菸酒零售業
38472795,豐陞行,臺北市士林區延平北路5段187號1樓,核准設立,菸酒零售業
15664194,錦后小吃店,臺北市南港區南港路2段20巷15號1樓,歇業／撤銷,菸酒零售業
31851048,氛圍餐廳,臺北市中山區林森北路133巷19號1樓,歇業／撤銷,菸酒零售業
26368810,?吃餐飲行,臺北市大安區潮州街188號1樓,核准設立,菸酒零售業
14327800,金都財商行,臺北市萬華區和平西路3段32之4號1樓,歇業／撤銷,菸酒零售業
25655413,大阪城小吃店,臺北市文山區車前路9號,歇業／撤銷,菸酒零售業
25515547,鳳賓清茶館,臺北市萬華區梧州街51號,歇業／撤銷,菸酒零售業
27152676,三蔆食品行,臺北市中正區忠孝東路1段150號10樓之2,歇業／撤銷,菸酒零售業
15651655,強翎餐坊,臺北市中山區錦西街8號1樓,廢止,菸酒零售業
68113057,開杰商行,臺北市萬華區西藏路149號1樓,歇業／撤銷,菸酒零售業
48750781,聖旺小吃坊,臺北市士林區雨農路29號,核准設立,菸酒零售業
48964355,水鈴瓏店,臺北市萬華區三水街124號4樓,歇業／撤銷,菸酒零售業
73907086,米羅商行,臺北市中山區中山北路1段105巷23號2樓,歇業／撤銷,菸酒零售業
94906767,老英商行,臺北市中山區民權東路1段72號9樓之11,歇業／撤銷,菸酒零售業
05721132,欣欣旅店,臺北市萬華區昆明街34號4樓,核准設立,菸酒零售業
98891343,武淵小吃店,臺北市中正區武昌街1段29號2樓,歇業／撤銷,菸酒零售業
31870777,一番食堂,臺北市大同區延平北路2段91號,核准設立,菸酒零售業
48777281,竹婷商行,臺北市文山區辛亥路4段233號,廢止,菸酒零售業
48886078,籌學費美食坊,臺北市信義區光復南路417巷37號,核准設立,菸酒零售業
48876254,露娜餐廳,臺北市大安區忠孝東路4段270號地下1樓之1,歇業／撤銷,菸酒零售業
38474180,泰格餐廳,臺北市中山區長安東路1段53巷24號地下,核准設立,菸酒零售業
25552943,麥香商行,臺北市大安區新生南路3段96之3號,歇業／撤銷,菸酒零售業
25568760,三洋小吃店,臺北市萬華區西園路1段212巷34號,歇業／撤銷,菸酒零售業
25538963,金錢櫃餐廳,臺北市萬華區和平西路3段187號地下1樓,歇業／撤銷,菸酒零售業
18100543,昆成軒,臺北市萬華區昆明街79號10樓,歇業／撤銷,菸酒零售業
48950417,御莎小吃店,臺北市中山區林森北路119巷65號,歇業／撤銷,菸酒零售業
10317941,小夜曲音樂餐坊,臺北市中山區民生東路1段78號,歇業／撤銷,菸酒零售業
31953489,魚木人文咖啡,臺北市大安區溫州街74巷5弄3號,歇業／撤銷,菸酒零售業
83925422,偉馨農產行,臺北市松山區南京東路5段291巷6弄10號1樓,核准設立,菸酒零售業
21737152,賓來小吃店,臺北市中山區一江街10號1樓,歇業／撤銷,菸酒零售業
48777825,欣正興食糧行,臺北市文山區興隆路2段19號,核准設立,菸酒零售業
31877053,萬勝仁美食鋪,臺北市北投區西安街1段291號1樓,核准設立,菸酒零售業
99352408,鼎上春秋食品行,臺北市中正區汀州路3段295號2樓,廢止,菸酒零售業
99961063,饌瑔精品行,臺北市松山區復興北路313巷43號1樓,歇業／撤銷,菸酒零售業
25556737,漢陽小吃店,臺北市信義區基隆路1段380巷6號,核准設立,菸酒零售業
38576807,山木的店,臺北市士林區文林路330號,核准設立,菸酒零售業
26213555,佳豐富食品行,臺北市大同區甘州街44之1號,核准設立,菸酒零售業
48814315,富王餐廳,臺北市中山區中山北路2段27巷2號地下樓,廢止,菸酒零售業
48982311,華頓食品行,臺北市大安區忠孝東路4段181巷7弄3號,核准設立,菸酒零售業
48994225,草棠茶藝行,臺北市大安區麗水街7巷8號1樓,核准設立,菸酒零售業
14329286,夜來香舞場,臺北市萬華區漢口街2段54號10樓,歇業／撤銷,菸酒零售業
83945840,成品商行,臺北市中正區八德路1段29號1樓,廢止,菸酒零售業
13854938,千榮企業社,臺北市萬華區萬大路141號1樓,歇業／撤銷,菸酒零售業
14742519,古奇企業社,臺北市大安區敦化南路2段10號1樓,歇業／撤銷,菸酒零售業
31847235,熊飲飲料店,臺北市萬華區昆明街192號2樓,核准設立,菸酒零售業
17267214,鄉芝緣食品行,臺北市大同區南京西路262巷11號,廢止,菸酒零售業
17079297,金響小吃店,臺北市萬華區環河南路2段199號,歇業／撤銷,菸酒零售業
15637818,十字路口食品行,臺北市大安區敦化南路1段233巷62號1樓,歇業／撤銷,菸酒零售業
38559770,岡太郎家商行,臺北市大安區和平東路2段175巷12號,核准設立,菸酒零售業
48827352,迎家國際企業社,臺北市中山區松江路283號3樓,遷他縣市,菸酒零售業
42286837,魯米耶工作室新生分店,臺北市大安區新生南路3段86巷11號,核准設立,菸酒零售業
26250122,哈莉瓦嫩思咖啡店,臺北市大安區和平東路3段67巷8號,核准設立,菸酒零售業
25659895,亨利廚房,臺北市大安區和平東路1段199巷4號1樓,歇業／撤銷,菸酒零售業
13441108,芯華商行,臺北市中山區長安東路1段55之2號2樓,歇業／撤銷,菸酒零售業
98899204,醇欣咖啡店,臺北市中山區民生東路2段151號1樓,歇業／撤銷,菸酒零售業
99345694,豪家小館,臺北市內湖區安康路229號1樓,歇業／撤銷,菸酒零售業
26368332,穎樂小吃舖,臺北市中山區建國北路1段74號,核准設立,菸酒零售業
48875234,屋頂上的一頭牛餐坊,臺北市士林區天母東路93號,歇業／撤銷,菸酒零售業
25541073,香樂餐廳,臺北市中山區農安街53號,歇業／撤銷,菸酒零售業
13827736,紫金殿音樂餐廳,臺北市大安區仁愛路4段27巷43號地下樓,歇業／撤銷,菸酒零售業
48957404,獅子園餐飲小吃店,臺北市信義區光復南路447之20號,歇業／撤銷,菸酒零售業
13463714,仁水企業社,臺北市中山區雙城街17巷13之3號1樓,歇業／撤銷,菸酒零售業
26228852,阿波羅小吃店,臺北市內湖區江南街107巷8號,列入廢止中,菸酒零售業
26264189,阿發檳榔,臺北市信義區信義路6段41號,核准設立,菸酒零售業
10368315,金盃餐廳,臺北市中山區民生東路1段72號地下,歇業／撤銷,菸酒零售業
94917856,名軒商行,臺北市中山區新生北路1段83號2樓,歇業／撤銷,菸酒零售業
13849859,酒大王洋行,臺北市士林區承德路4段305號1樓,歇業／撤銷,菸酒零售業
48672012,賢平清茶館,臺北市萬華區西園路1段136巷16弄6號1樓,廢止,菸酒零售業
26350430,將發串烤專門店,臺北市大安區忠孝東路4段248巷17號,核准設立,菸酒零售業
31864022,瑤瑤餐廳,臺北市大安區忠孝東路4段1號8樓,核准設立,菸酒零售業
