26215239,生全食品行,臺北市中山區龍江路358號,核准設立,菸酒零售業
15652325,尊王食補薑母鴨小吃店,臺北市大安區和平東路3段228巷45號,核准設立,菸酒零售業
26254149,銀之鈴餐坊,臺北市中山區林森北路85巷18號1樓,歇業／撤銷,菸酒零售業
17090722,艷陽酒吧,臺北市中山區民生東路1段43號地下1樓,歇業／撤銷,菸酒零售業
29242999,天風小吃店,臺北市萬華區三水街131號4樓,歇業／撤銷,菸酒零售業
38568530,波士頓洋行,臺北市松山區南京東路4段47號地下室,核准設立,菸酒零售業
33873244,三財商店,臺北市南港區合順街8巷5弄31號1樓,核准設立,菸酒零售業
17554308,老朋友老地方食品行,臺北市信義區松信路131號1樓,歇業／撤銷,菸酒零售業
83901435,坤盈商行,臺北市大安區通化街171巷41號1樓,歇業／撤銷,菸酒零售業
38465181,勝華百貨行,臺北市中山區雙城街21號1樓,核准設立,菸酒零售業
17081462,億利商店,臺北市信義區中坡南路265號1樓,歇業／撤銷,菸酒零售業
31859251,台北九號食品行,臺北市萬華區中華路1段90之41號,歇業／撤銷,菸酒零售業
17085306,泰亞美食館,臺北市松山區復興北路313巷47號1樓,歇業／撤銷,菸酒零售業
25538730,五八一生活館,臺北市文山區指南路2段133號,核准設立,菸酒零售業
29226837,新紀平價餐飲店,臺北市信義區松山路315號1樓,歇業／撤銷,菸酒零售業
14332206,泰鍋美食坊,臺北市大安區延吉街131巷39號1樓,歇業／撤銷,菸酒零售業
14319652,佶利飲食坊,臺北市北投區中和街431號1樓,核准設立,菸酒零售業
38460475,開來運動彩券商行,臺北市中山區錦州街264號,核准設立,菸酒零售業
38501428,柔之坊,臺北市中山區林森北路85巷71號1樓,核准設立,菸酒零售業
25520936,亞泰農產食品行,臺北市南港區忠孝東路6段92號,遷他縣市,菸酒零售業
17756135,成記迷你火鍋小吃店,臺北市大同區延平北路3段69號,核准設立,菸酒零售業
81770062,譽軒西點麵包店,臺北市中山區八德路2段278號,廢止,菸酒零售業
14348565,真珠坊,臺北市中山區中山北路1段105巷13之2號2樓,歇業／撤銷,菸酒零售業
48979322,美的威小吃店,臺北市松山區健康路191號,核准設立,菸酒零售業
48799222,邢金寶商號,臺北市信義區基隆路1段350之29號,核准設立,菸酒零售業
73900801,艾之坊軒,臺北市萬華區西園路1段212巷10號1、2樓,歇業／撤銷,菸酒零售業
17523734,佳伯商行,臺北市內湖區文湖街21巷100弄1之1號1樓,核准設立,菸酒零售業
87783992,盛和中藥房,臺北市大同區安西街39之1號,遷他縣市,菸酒零售業
15665399,港展行,臺北市大安區延吉街66之1號1樓,歇業／撤銷,菸酒零售業
48845464,水中鮮小吃店延吉分店,臺北市松山區延吉街44號1樓,核准設立,菸酒零售業
14311758,采心園,臺北市中正區青島東路7之5號1樓,歇業／撤銷,菸酒零售業
31955162,宏達企業社,臺北市中山區民權東路1段72號9樓之11,歇業／撤銷,菸酒零售業
14341269,巴沙沙日式燒肉店,臺北市大安區敦化南路1段177巷9之1號,歇業／撤銷,菸酒零售業
25579507,煦夏坊,臺北市信義區中坡南路24號2樓,核准設立,菸酒零售業
98915669,煜彤餐廳,臺北市中山區德惠街52號1樓,歇業／撤銷,菸酒零售業
99616078,紹光小吃店,臺北市松山區延吉街45號,廢止,菸酒零售業
83915705,利元商品行,臺北市士林區延平北路6段15號1樓,歇業／撤銷,菸酒零售業
48869351,驊茶飲料店,臺北市大同區承德路3段51巷4號,廢止,菸酒零售業
29238284,龍嘟小吃店,臺北市萬華區西園路1段72巷7號1樓,歇業／撤銷,菸酒零售業
25551254,胖哥瘦妹小吃店,臺北市中山區錦州街252號1樓,歇業／撤銷,菸酒零售業
10305874,愛樂食坊,臺北市萬華區西寧南路82巷6號,核准設立,菸酒零售業
20824951,吳家菸酒號,臺北市松山區永吉路278巷39弄23號1樓,歇業／撤銷,菸酒零售業
25524525,文泰商行,臺北市文山區興隆路4段93號,核准設立,菸酒零售業
48680940,台灣阿城檳榔店,臺北市萬華區莒光路166巷20號,歇業／撤銷,菸酒零售業
14329639,軒樺商行,臺北市中山區建國北路2段72號1樓,歇業／撤銷,菸酒零售業
38456198,亮亮餐坊,臺北市中山區天津街56號2樓之61至68,歇業／撤銷,菸酒零售業
99984468,心喬餐飲店,臺北市信義區松山路407號1樓,歇業／撤銷,菸酒零售業
48694894,雅湘食料店,臺北市信義區基隆路2段149號1樓,歇業／撤銷,菸酒零售業
14337259,洞天食堂,臺北市中正區羅斯福路1段1之2號1樓,歇業／撤銷,菸酒零售業
48502951,美里餐坊,臺北市中山區林森北路119巷72號1樓,核准設立,菸酒零售業
48820273,力銓商行,臺北市中山區龍江路415巷48號,歇業／撤銷,菸酒零售業
12285261,李時商店,臺北市中山區新生北路2段28巷15號,歇業／撤銷,菸酒零售業
25576918,弘達商行,臺北市中山區興安街65號,歇業／撤銷,菸酒零售業
31964296,多情坊,臺北市萬華區西園路1段212巷29號2樓,核准設立,菸酒零售業
31857401,銓福商行,臺北市松山區光復南路57巷3之1號1樓,核准設立,菸酒零售業
48680097,費姐的店,臺北市松山區八德路4段245巷50號1樓,歇業／撤銷,菸酒零售業
26239534,那維爾料理店,臺北市中山區林森北路133巷19號,遷他縣市,菸酒零售業
99993516,宏樓酒吧,臺北市中山區南京東路2段11號8樓,歇業／撤銷,菸酒零售業
15948284,?琩書店,臺北市萬華區貴陽街2段242號1樓,歇業／撤銷,菸酒零售業
10336433,米蘭諾企業社,臺北市北投區振興街33號,廢止,菸酒零售業
77905644,大韓門小吃店,臺北市大安區延吉街110號,核准設立,菸酒零售業
73903125,新花園飲酒店,臺北市萬華區三水街125號2樓,列入廢止中,菸酒零售業
25503465,真豪餐坊,臺北市文山區景興路110號,核准設立,菸酒零售業
25522195,北盛商店,臺北市大安區新生南路3段76巷10之1號,核准設立,菸酒零售業
48558461,利璟美食坊,臺北市中山區吉林路257號1樓,歇業／撤銷,菸酒零售業
14335962,情人餐坊,臺北市萬華區環河南路2段35巷15弄9號1樓,歇業／撤銷,菸酒零售業
94905280,愛麗絲商行,臺北市中山區農安街47號1樓,廢止,菸酒零售業
27171081,喜樂帝酒吧,臺北市松山區南京東路4段103號2樓、2樓之1、2樓之3,歇業／撤銷,菸酒零售業
17737877,慧寬國際洋行,臺北市內湖區金湖路22號1樓,歇業／撤銷,菸酒零售業
31872162,感恩美食餐飲,臺北市大安區新生南路3段56巷6號,核准設立,菸酒零售業
48884135,古豐咖啡廳,臺北市大安區羅斯福路2段83之2號,歇業／撤銷,菸酒零售業
99616773,新幹線外語生活館,臺北市信義區信安街117號1樓,歇業／撤銷,菸酒零售業
48718565,老酒館生活品味坊,臺北市士林區天母北路4巷5之1號地下1樓,廢止,菸酒零售業
48908431,掬晴餐廳,臺北市中山區林森北路133巷12號,歇業／撤銷,菸酒零售業
17092117,寶格麗名店,臺北市中山區雙城街2之1號地下1樓,歇業／撤銷,菸酒零售業
29211927,清心餐坊,臺北市中山區林森北路119巷5號,歇業／撤銷,菸酒零售業
25567185,緣中緣餐廳,臺北市中山區林森北路119巷60號,歇業／撤銷,菸酒零售業
26356841,繁盛小吃店,臺北市大安區通安街37號,核准設立,菸酒零售業
38503501,竹間慶日式創意餐廳,臺北市中山區林森北路133巷23號,核准設立,菸酒零售業
98886159,田園小吃店,臺北市南港區八德路4段903號1樓,歇業／撤銷,菸酒零售業
13843686,藍思特商行,臺北市大安區光復南路180巷5號1樓,歇業／撤銷,菸酒零售業
10318028,源宏食品行,臺北市大安區敦化南路1段190巷36號,核准設立,菸酒零售業
81793760,鴻羽商行,臺北市大安區師大路117巷6號1樓,歇業／撤銷,菸酒零售業
99987824,吉村井日式料理飲食店,臺北市中山區雙城街23之3號1樓,歇業／撤銷,菸酒零售業
48559790,伊娜複合式餐坊,臺北市大安區濟南路3段16號1樓,廢止,菸酒零售業
18409937,新上人軒,臺北市萬華區廣州街235之2號2樓,歇業／撤銷,菸酒零售業
48536116,饌味小吃店,臺北市中山區長春路258巷20號1樓,廢止,菸酒零售業
48500659,鬥魚小吃店,臺北市士林區文林路697號1樓,歇業／撤銷,菸酒零售業
48583216,清萊泰式料理餐廳,臺北市松山區民生東路3段113巷25弄10號1樓,歇業／撤銷,菸酒零售業
48766778,一品味美食坊,臺北市內湖區文德路213號,歇業／撤銷,菸酒零售業
29209197,真膳美小吃店,臺北市信義區永吉路120巷72號1樓,廢止,菸酒零售業
25551352,都座餐廳,臺北市中山區中山北路1段105巷20號地下樓,歇業／撤銷,菸酒零售業
73900197,黑媄人軒,臺北市萬華區三水街115巷8號2樓,歇業／撤銷,菸酒零售業
26218284,春乃家食品行,臺北市北投區中山路28之4號地下二層,歇業／撤銷,菸酒零售業
21761292,萬珍樓食坊,臺北市松山區敦化北路120巷11號1樓,核准設立,菸酒零售業
14321502,莉傑小吃店,臺北市萬華區桂林路95號2樓,歇業／撤銷,菸酒零售業
48502256,昂斯餐坊,臺北市大安區延吉街270號1樓,歇業／撤銷,菸酒零售業
17756141,良田商行,臺北市內湖區成功路2段291號3樓,歇業／撤銷,菸酒零售業
25534592,晴份餐坊,臺北市中山區林森北路85巷69號,歇業／撤銷,菸酒零售業
10381773,?諰店,臺北市大安區安和路1段49巷11號,歇業／撤銷,菸酒零售業
98889326,玖伍茶行,臺北市北投區中央北路2段330號1樓,歇業／撤銷,菸酒零售業
15662127,富甲商行,臺北市大同區民族西路317號1樓,歇業／撤銷,菸酒零售業
27177178,醇酒城洋行,臺北市中山區八德路2段339號1樓,歇業／撤銷,菸酒零售業
15643868,亞才行,臺北市士林區承德路4段12巷33號地下層,核准設立,菸酒零售業
13465614,醉玉軒,臺北市萬華區華西街6號後面1樓,歇業／撤銷,菸酒零售業
17521068,店小二檳榔店,臺北市大同區民族西路46號,核准設立,菸酒零售業
13835095,玫瑰派對食品行,臺北市文山區興隆路3段79巷1號1樓,歇業／撤銷,菸酒零售業
31874767,玉林唱飲城,臺北市中山區新生北路2段60巷58號,核准設立,菸酒零售業
99644715,樂特而主題餐飲商號,臺北市松山區八德路4段171號地下1樓,歇業／撤銷,菸酒零售業
80980456,愷悅餐館,臺北市中山區中山北路2段27巷2號地下室,歇業／撤銷,菸酒零售業
73873121,棧戀商行,臺北市大安區忠孝東路4段101巷30號1樓,歇業／撤銷,菸酒零售業
31853828,京泰養生館,臺北市中山區長春路408號,核准設立,菸酒零售業
38553261,人靚餐廳,臺北市中山區民權東路1段72號2樓,歇業／撤銷,菸酒零售業
29250224,花佃音樂餐廳,臺北市中山區長安東路1段101號地下1樓,歇業／撤銷,菸酒零售業
25551613,金大碗牛肉麵館,臺北市中山區長安東路2段178之5號,歇業／撤銷,菸酒零售業
99326042,玩耍實業社,臺北市信義區松隆路3號1樓,廢止,菸酒零售業
31867793,維伊羅餐廳,臺北市中山區林森北路133巷27號,歇業／撤銷,菸酒零售業
31958724,金鑰匙餐廳,臺北市中山區吉林路２８號地下,核准設立,菸酒零售業
48902942,上大企業社,臺北市中正區同安街57號,歇業／撤銷,菸酒零售業
14713155,港龍行,臺北市大同區錦西街46號1樓,歇業／撤銷,菸酒零售業
48678846,聯銀企業社,臺北市中山區林森北路575號7樓之11,歇業／撤銷,菸酒零售業
94904796,舞食原複合式餐坊,臺北市大安區濟南路3段16號1樓,歇業／撤銷,菸酒零售業
13850721,超客電腦資訊社,臺北市中山區長春路31號8樓,歇業／撤銷,菸酒零售業
25555511,阡紫餐廳,臺北市中山區林森北路119巷9號1樓,歇業／撤銷,菸酒零售業
13837832,愛爾波特酒坊,臺北市大安區四維路19號1樓,歇業／撤銷,菸酒零售業
21761238,大家好港式粥粉麵飯小吃店,臺北市松山區八德路4段245巷50之1號1樓,核准設立,菸酒零售業
26225975,源茂豐餐飲店,臺北市中山區長春路3巷9號,核准設立,菸酒零售業
48953646,麗智商行,臺北市大同區民生西路108號,歇業／撤銷,菸酒零售業
48903490,品樺商行,臺北市中山區中山北路1段83巷9之1號,歇業／撤銷,菸酒零售業
13854352,年連食品商行,臺北市大安區濟南路3段43號1樓,歇業／撤銷,菸酒零售業
99633359,萊富商店,臺北市南港區舊莊街1段3巷16號1樓,歇業／撤銷,菸酒零售業
99616513,雙園小吃店,臺北市萬華區雙園街148號1樓,歇業／撤銷,菸酒零售業
29219527,潗隆小吃店,臺北市松山區民生東路5段87號1樓,歇業／撤銷,菸酒零售業
48721787,尤妮行雜貨舖,臺北市中山區長春路258巷32號1樓,核准設立,菸酒零售業
31865253,恩琪樂烘焙坊,臺北市大安區仁愛路4段112巷3弄10號,遷他縣市,菸酒零售業
26221458,麗緻金典餐廳,臺北市中山區中山北路2段65巷7號8樓,歇業／撤銷,菸酒零售業
14343745,金豬小吃店,臺北市大同區重慶北路2段114巷17號1樓,廢止,菸酒零售業
25542592,拉蕾餐坊,臺北市中山區南京東路2段165號、165之1號,歇業／撤銷,菸酒零售業
21738053,湛藍餐廳,臺北市中山區雙城街32巷11之1號1樓,廢止,菸酒零售業
26348701,幸福洋麵複合式餐廳,臺北市中山區北安路595巷28號1樓,歇業／撤銷,菸酒零售業
13471637,喜登商行,臺北市大安區敦化南路1段160巷56號1樓,歇業／撤銷,菸酒零售業
99347911,王記英倫咖啡商行,臺北市中山區合江街73巷3號1樓,歇業／撤銷,菸酒零售業
14743947,佳均飲料店,臺北市中山區長春路348之5號1樓,歇業／撤銷,菸酒零售業
26363717,晟盛餐廳,臺北市大安區延吉街64之3號1樓,歇業／撤銷,菸酒零售業
48871737,樂肥牛燒肉小吃店,臺北市中正區公園路22之2號3樓,歇業／撤銷,菸酒零售業
27195871,妮羅河小吃店,臺北市萬華區武昌街2段85之2號1、2樓,歇業／撤銷,菸酒零售業
01845409,虹堡恪食品行,臺北市士林區中山北路7段31號1樓,歇業／撤銷,菸酒零售業
48883683,尚好飲酒店,臺北市萬華區西園路1段72巷7號1樓,歇業／撤銷,菸酒零售業
10354678,順溜小吃店,臺北市大安區忠孝東路4段181巷7弄15號,核准設立,菸酒零售業
05093105,薌村小吃店,臺北市中正區重慶南路1段1之1號2樓,核准設立,菸酒零售業
48957024,晶晶食品行,臺北市松山區八德路4段389巷18號,歇業／撤銷,菸酒零售業
26216808,鋅盛商行,臺北市內湖區安康路418號,核准設立,菸酒零售業
48698527,丞典商行,臺北市大安區四維路154巷31號1樓,歇業／撤銷,菸酒零售業
48683480,天津知音飲食坊,臺北市中山區天津街40號2樓,歇業／撤銷,菸酒零售業
48796288,寶彩飾品百貨行,臺北市內湖區東湖路43巷18號之1,歇業／撤銷,菸酒零售業
38510735,牡丹園餐廳,臺北市萬華區西園路1段136巷16弄8號,核准設立,菸酒零售業
29505508,三玉號,臺北市士林區中山北路6段820號1樓,核准設立,菸酒零售業
38559547,金艷清茶館,臺北市萬華區華西街26巷4號,歇業／撤銷,菸酒零售業
17774083,攸品小吃店,臺北市南港區南港路2段20巷13號1樓,歇業／撤銷,菸酒零售業
31853926,晴乙資訊企業社,臺北市士林區德行西路127號1樓,歇業／撤銷,菸酒零售業
48673602,品妍餐廳,臺北市信義區永吉路195號地下1樓,核准設立,菸酒零售業
10303496,富邦運動彩券行,臺北市北投區明德路22號1樓,歇業／撤銷,菸酒零售業
31723023,麓飲企業社,臺北市北投區中央北路4段142巷2號,歇業／撤銷,菸酒零售業
48694965,七寶茶舖,臺北市中正區南陽街7號1樓,歇業／撤銷,菸酒零售業
27186275,奇檬子食品行,臺北市中山區林森北路133巷4號1樓,歇業／撤銷,菸酒零售業
48887421,克林頓店舖,臺北市大同區民權西路216號地下1樓,廢止,菸酒零售業
15645090,鳳凰城軒,臺北市萬華區華西街19之1號2樓,廢止,菸酒零售業
25534262,獲客小吃店,臺北市大安區安和路2段217巷16號,核准設立,菸酒零售業
26346957,拉雅商行,臺北市萬華區長泰街21號,歇業／撤銷,菸酒零售業
48740047,普雷克斯工作室,臺北市萬華區武昌街2段82巷2號2樓,歇業／撤銷,菸酒零售業
15664125,第一品蔬菜羊肉小吃店,臺北市松山區基隆路1段10號,歇業／撤銷,菸酒零售業
38580268,永沅商行,臺北市士林區德行東路363號,核准設立,菸酒零售業
14347518,煲煲屋小吃店,臺北市信義區松仁路232號1樓,歇業／撤銷,菸酒零售業
17756959,超宇企業社,臺北市萬華區武昌街2段87號1樓,歇業／撤銷,菸酒零售業
48743537,玉暄屋商行,臺北市中山區中原街119號,停業,菸酒零售業
26236678,魚饌屋小吃店,臺北市士林區中山北路6段275號,歇業／撤銷,菸酒零售業
10304827,永得利商行,臺北市松山區南京東路5段23巷15弄19號,歇業／撤銷,菸酒零售業
14724879,晶圓食品行,臺北市大安區忠孝東路4段181巷7弄13號1樓,歇業／撤銷,菸酒零售業
14312834,鄧記豆花庄館,臺北市中正區連雲街83號1樓,歇業／撤銷,菸酒零售業
48834939,萬豐商行,臺北市大同區重慶北路3段296巷3號,核准設立,菸酒零售業
48701728,妹仔商行,臺北市大同區重慶北路3段271號1樓,歇業／撤銷,菸酒零售業
48896603,壹莉莎商坊,臺北市大安區通化街171巷30弄2號,歇業／撤銷,菸酒零售業
48844036,沛瀅素食館,臺北市中山區吉林路199巷26之ｌ號,核准設立,菸酒零售業
15640813,名酒集行銷企業社,臺北市士林區中山北路6段23號1樓,遷他縣市,菸酒零售業
99633914,熊?一族複合式餐廳,臺北市中山區龍江路45巷17號1樓,歇業／撤銷,菸酒零售業
29236933,壹零柒陸餐廳,臺北市中山區林森北路107巷37號1樓,歇業／撤銷,菸酒零售業
31855001,青年商行,臺北市萬華區青年路110號1樓,核准設立,菸酒零售業
13455904,月之海商行,臺北市大同區承德路3段267號地下2層,歇業／撤銷,菸酒零售業
80994108,新星企業社,臺北市萬華區萬大路155號1樓,歇業／撤銷,菸酒零售業
80989800,名享企業社,臺北市萬華區寶興街76號1樓,歇業／撤銷,菸酒零售業
10358127,三星茶坊,臺北市萬華區西園路1段72巷28號,歇業／撤銷,菸酒零售業
94919242,金夜小吃店,臺北市中山區林森北路147號地下1樓,列入廢止中,菸酒零售業
99348539,蘿拉飲料店,臺北市信義區仁愛路4段512巷6之1號1樓,廢止,菸酒零售業
26364722,鴻運徠餐廳,臺北市萬華區三水街118號2樓3樓,歇業／撤銷,菸酒零售業
42268612,饌義德披薩商行,臺北市士林區中山北路7段92號,核准設立,菸酒零售業
48947997,米琪蛋糕食品行,臺北市中山區中山北路2段16巷23號,核准設立,菸酒零售業
48687583,幸福滋味餃子工坊,臺北市內湖區港墘路127巷29號1樓,遷他縣市,菸酒零售業
17741915,國新商店,臺北市萬華區昆明街197號1樓,遷他縣市,菸酒零售業
26355060,樂生活商行,臺北市內湖區康樂街72巷17弄5號地下室,核准設立,菸酒零售業
26230822,食宜商行,臺北市中山區復興南路1段30巷4號1樓,核准設立,菸酒零售業
13821590,上來軒,臺北市萬華區梧州街53號2樓及3樓,歇業／撤銷,菸酒零售業
13859032,興樂坊,臺北市萬華區梧州街12巷3號1樓,核准設立,菸酒零售業
99640035,白靈菇餐坊,臺北市士林區中山北路7段63巷1號1樓,歇業／撤銷,菸酒零售業
13858081,偉達實業社,臺北市大同區延平北路2段150號1樓,歇業／撤銷,菸酒零售業
17762426,鼎成國際興業行,臺北市中山區松江路187號1樓,歇業／撤銷,菸酒零售業
25536579,高陞企業社,臺北市文山區車前路2號4樓,歇業／撤銷,菸酒零售業
13827953,香香企業社,臺北市中山區松江路97巷25號1樓,歇業／撤銷,菸酒零售業
26344108,金獅酒店,臺北市中山區中山北路2段65巷39號2樓,歇業／撤銷,菸酒零售業
14737375,奈良餐廳,臺北市中山區林森北路287之1號1樓,歇業／撤銷,菸酒零售業
25551536,甄珍小吃店,臺北市南港區成福路243號,歇業／撤銷,菸酒零售業
48697647,俊諭商行,臺北市士林區基河路60號﹝士林市場第32號攤位﹞,核准設立,菸酒零售業
14314805,盈億商店,臺北市大安區建國南路2段79巷5號,歇業／撤銷,菸酒零售業
17519350,上富嘉雜糧行,臺北市中山區遼寧街168號1樓,核准設立,菸酒零售業
14346882,雙子龍檳榔行,臺北市信義區松山路512號1樓,廢止,菸酒零售業
38468390,國王烘焙坊,臺北市松山區八德路2段414號,核准設立,菸酒零售業
27171420,同來小吃店,臺北市內湖區內湖路2段103巷98號地下1樓之2,歇業／撤銷,菸酒零售業
10314677,頂好茶莊,臺北市萬華區西昌街141號,廢止,菸酒零售業
13856160,友立商行,臺北市大安區忠孝東路4段191號3樓之1,歇業／撤銷,菸酒零售業
31966294,麥歡樂小吃店,臺北市松山區八德路4段512之1號,核准設立,菸酒零售業
18391330,良生餐館,臺北市大安區通化街143巷35號1樓,廢止,菸酒零售業
13836876,萬年町資訊社,臺北市萬華區西寧南路70號10樓,歇業／撤銷,菸酒零售業
99333439,復古寶瓶餐飲店,臺北市信義區崇德街38巷26號1樓,歇業／撤銷,菸酒零售業
98918693,跩哥雪茄館,臺北市大安區延吉街270號1樓,歇業／撤銷,菸酒零售業
13475839,華鈴清茶館,臺北市大同區民權西路308之1號1樓,核准設立,菸酒零售業
17077782,祈晴名店,臺北市中山區林森北路413號4樓,歇業／撤銷,菸酒零售業
26228065,幸福好粥道粥品專賣店,臺北市內湖區內湖路1段737巷12號1樓,核准設立,菸酒零售業
17079331,伊莎貝餐坊,臺北市中山區中山北路1段121巷18之1號1樓,歇業／撤銷,菸酒零售業
31847782,雲品企業社,臺北市士林區重慶北路4段78號1樓,核准設立,菸酒零售業
26239416,皇鳳餐廳,臺北市萬華區西寧南路157、159號(5樓),核准設立,菸酒零售業
98908098,道地火鍋店,臺北市士林區中山北路6段328號1樓,歇業／撤銷,菸酒零售業
38496699,尚雅音樂餐坊,臺北市大安區和平東路3段73號1樓,核准設立,菸酒零售業
10379360,金華二零一小吃店,臺北市大安區金華街201號1樓,核准設立,菸酒零售業
10355297,三川商行,臺北市中山區民權東路2段11號,廢止,菸酒零售業
49880642,新南亞企業社,臺北市萬華區中華路2段508號,遷他縣市,菸酒零售業
98913536,福國排球用品社,臺北市士林區士東路12號之1,歇業／撤銷,菸酒零售業
21731951,紅龍食坊,臺北市北投區永興路1段25號1樓,廢止,菸酒零售業
48832221,揚咩咩食品商行,臺北市大安區濟南路3段24之1號,廢止,菸酒零售業
26339007,甜田餐廳,臺北市中山區林森北路159巷46號,核准設立,菸酒零售業
42271476,毅威商行,臺北市中山區合江街150號1樓,核准設立,菸酒零售業
38502587,新國華餐館,臺北市中正區漢口街1段110號地下室,核准設立,菸酒零售業
14332971,錡龍天昇商行,臺北市中正區羅斯福路3段284巷13號1樓,歇業／撤銷,菸酒零售業
14723267,娛樂新聞報社,臺北市中山區建國北路2段112號5樓,歇業／撤銷,菸酒零售業
17737588,大善行,臺北市大安區金山南路2段13巷3號1樓,歇業／撤銷,菸酒零售業
15639301,隆運開運精品文物社,臺北市松山區光復北路157號1樓,歇業／撤銷,菸酒零售業
99345596,豪樂小吃舖,臺北市中山區新生北路1段140號1樓,核准設立,菸酒零售業
48765877,靖軒美食坊,臺北市大安區樂利路6巷3號1樓,歇業／撤銷,菸酒零售業
26344705,布若家居酒屋,臺北市大安區市民大道4段230號,廢止,菸酒零售業
17520568,怎麼回事商店,臺北市北投區中央北路2段177號1樓,歇業／撤銷,菸酒零售業
94902642,水果精靈科技企業社,臺北市中山區龍江路356巷13號1樓,歇業／撤銷,菸酒零售業
48896168,新姿態企業社,臺北市大安區忠孝東路4段248巷17號,歇業／撤銷,菸酒零售業
38509152,復興胡商行,臺北市大安區復興南路2段181號1樓,核准設立,菸酒零售業
99351920,九顆星商行,臺北市中山區民生東路1段29號3樓之2,歇業／撤銷,菸酒零售業
17747312,仟禧整合行銷企業社,臺北市大安區復興南路1段76號8樓之2,歇業／撤銷,菸酒零售業
29242007,竹圍商行,臺北市萬華區西園路1段145號龍山寺地下街商場15號店舖,歇業／撤銷,菸酒零售業
26352731,奉品小吃店,臺北市士林區福國路60號,歇業／撤銷,菸酒零售業
14323240,帝大紅面薑母鴨小吃店,臺北市南港區八德路4段907號1樓,歇業／撤銷,菸酒零售業
77151390,萬大小吃店,臺北市萬華區萬大路425號1樓,核准設立,菸酒零售業
27177992,行古行,臺北市中山區中山北路2段77巷6號,核准設立,菸酒零售業
26341101,舊識愛喝餐廳,臺北市中山區新生北路2段72巷8號1樓,核准設立,菸酒零售業
21761722,伊西歐咖啡?,臺北市中山區松江路97巷12號1樓,歇業／撤銷,菸酒零售業
25582658,臻愛商號,臺北市士林區重慶北路4段93號,核准設立,菸酒零售業
14322798,將星企業社,臺北市中山區民生東路2段66號1樓,歇業／撤銷,菸酒零售業
