38552811,蓁豪小吃店,臺北市士林區文林路766號1樓,核准設立,菸酒零售業
31869407,暢得音樂餐坊,臺北市中山區林森北路85巷18號,歇業／撤銷,菸酒零售業
10383499,迪尼諾企業社,臺北市大安區羅斯福路3段283巷14弄15號,遷他縣市,菸酒零售業
58064535,永成菸酒號,臺北市松山區文昌街350號,歇業／撤銷,菸酒零售業
73903949,媋之頌軒,臺北市萬華區西園路1段72巷9號1樓,廢止,菸酒零售業
13856485,復興奇小吃店,臺北市中山區復興南路1段26號、28號1樓,歇業／撤銷,菸酒零售業
26340721,良金企業社,臺北市中正區汀州路1段102號,核准設立,菸酒零售業
17520271,吉也歐食品百貨行,臺北市士林區福林路193號,歇業／撤銷,菸酒零售業
99990047,和苑飲食店,臺北市松山區長安東路2段272號2樓,歇業／撤銷,菸酒零售業
30359807,新興食品行,臺北市文山區景美街55號,核准設立,菸酒零售業
25582947,金將菁仔行,臺北市萬華區寶興街11號1樓,核准設立,菸酒零售業
48831601,元緣小吃店,臺北市信義區松隆路215巷20號,歇業／撤銷,菸酒零售業
48784656,信馨國際商行,臺北市中正區和平西路2段17號,遷他縣市,菸酒零售業
15650902,大極酒店,臺北市松山區南京東路3段259號地下1樓,歇業／撤銷,菸酒零售業
38575069,易河行,臺北市士林區忠誠路2段136號1樓,核准設立,菸酒零售業
83906092,完全爵士音樂餐廳,臺北市大安區安和路1段80號1樓,歇業／撤銷,菸酒零售業
83929779,富林飲食店,臺北市中山區林森北路133巷67號1樓,歇業／撤銷,菸酒零售業
26348625,連線咖啡,臺北市信義區基隆路1段188之2號,核准設立,菸酒零售業
48979293,羅曼蒂克餐廳,臺北市中山區林森北路145巷22號,核准設立,菸酒零售業
48900607,富麗餐廳,臺北市中山區林森北路119巷30號,歇業／撤銷,菸酒零售業
17520808,麗池商行,臺北市松山區南京東路3段259號地下1樓,歇業／撤銷,菸酒零售業
17089746,東海酒業商行,臺北市萬華區萬大路237巷10弄23號1樓,歇業／撤銷,菸酒零售業
48875488,亞仕餐坊,臺北市大安區安和路2段217巷2弄1號,歇業／撤銷,菸酒零售業
94918139,源興行企業社,臺北市內湖區東湖路33巷7號1樓,歇業／撤銷,菸酒零售業
26224053,大福燒肉店,臺北市大安區仁愛路4段345巷4弄45號1樓,歇業／撤銷,菸酒零售業
29210125,紅帥食坊,臺北市北投區雙全街32號1樓,歇業／撤銷,菸酒零售業
26246471,熹亞餐廳,臺北市中山區林森北路119巷7號1樓,核准設立,菸酒零售業
48936577,威嘉咖啡館,臺北市松山區復興北路229號,歇業／撤銷,菸酒零售業
99986917,珮欣餐廳,臺北市中山區林森北路133巷16號,歇業／撤銷,菸酒零售業
10352138,新美樂力餐廳,臺北市中山區林森北路131號地下1樓,歇業／撤銷,菸酒零售業
38462543,松子企業社,臺北市北投區崇仁路1段131巷2弄6號4樓,核准設立,菸酒零售業
26213400,小小餐館,臺北市大安區信義路4段60之24號1樓,核准設立,菸酒零售業
48789097,尚旺商行,臺北市北投區致遠一路2段47號,核准設立,菸酒零售業
99332537,林峰企業社,臺北市南港區南港路1段124號1樓,歇業／撤銷,菸酒零售業
17515565,宗智商行,臺北市萬華區昆明街79號10樓,歇業／撤銷,菸酒零售業
31869856,泰皇泰式料理坊,臺北市內湖區成功路5段69號1樓,核准設立,菸酒零售業
38552994,盛曠二十八餐廳,臺北市中山區南京東路3段28號地下,核准設立,菸酒零售業
14320476,梁記小吃店,臺北市大安區延吉街70巷2弄1號1樓,廢止,菸酒零售業
27168733,麥多小吃店,臺北市大安區仁愛路4段417之1號,歇業／撤銷,菸酒零售業
29247761,楓琳小吃店,臺北市信義區忠孝東路5段783號2樓,歇業／撤銷,菸酒零售業
48823068,豐餘園食品行,臺北市中正區延平南路222號,歇業／撤銷,菸酒零售業
26375523,傳達數碼企業社,臺北市大安區敦化南路1段233巷31號4樓之3,停業,菸酒零售業
17549657,遠超商行,臺北市大同區承德路1段8號4樓之1,歇業／撤銷,菸酒零售業
99639874,大內小吃坊,臺北市信義區松仁路188號1樓,歇業／撤銷,菸酒零售業
29222059,向陽茶坊,臺北市萬華區梧州街21號地下1樓,廢止,菸酒零售業
13471411,軒華餐坊,臺北市士林區通河街9號1樓,歇業／撤銷,菸酒零售業
78350050,益榮食品行,臺北市松山區富錦街581巷11號,核准設立,菸酒零售業
99329890,泰運商行,臺北市中山區吉林路482號1樓,歇業／撤銷,菸酒零售業
31863396,張一番企業社,臺北市北投區雙全街34號,核准設立,菸酒零售業
99642195,水連扁食坊,臺北市士林區美崙街57號1樓,歇業／撤銷,菸酒零售業
48535783,地中海禮品屋,臺北市文山區景華街27號1樓,歇業／撤銷,菸酒零售業
04537004,安利西藥房,臺北市萬華區廣州街128號1樓,歇業／撤銷,菸酒零售業
14720439,角落企業社,臺北市信義區嘉興街131號1樓,歇業／撤銷,菸酒零售業
17091813,百星商行,臺北市中山區長安東路2段170號1樓,歇業／撤銷,菸酒零售業
48815996,喬義麵館,臺北市大安區羅斯福路3段283巷23號,核准設立,菸酒零售業
01241870,茂佳圓小吃店,臺北市中山區長安東路2段185號1樓,歇業／撤銷,菸酒零售業
48857094,樂事食品商行,臺北市大安區敦化南路2段101號,歇業／撤銷,菸酒零售業
15650966,心緣軒,臺北市萬華區西園路1段212巷29號1、2樓,歇業／撤銷,菸酒零售業
73890000,建勝商行,臺北市中山區民權東路2段71巷47號,歇業／撤銷,菸酒零售業
29246123,尚品檳榔,臺北市文山區羅斯福路5段42之1號1樓,歇業／撤銷,菸酒零售業
18389159,酩園商行,臺北市大安區安和路1段137號地下1樓,核准設立,菸酒零售業
26366025,鴻梁通訊行,臺北市中山區新生北路3段11巷35號,歇業／撤銷,菸酒零售業
48950916,水坊軒,臺北市萬華區三水街124號6樓,核准設立,菸酒零售業
26255203,大眾清茶館,臺北市萬華區華西街30巷4號,核准設立,菸酒零售業
38495988,泓揚商行,臺北市內湖區康寧路3段54之9號地下(1樓),停業,菸酒零售業
26229959,朱渱小吃店,臺北市萬華區中華路1段114巷19號2樓,核准設立,菸酒零售業
26233320,旺來商行,臺北市大安區伊通街68之3號1樓,核准設立,菸酒零售業
29209400,漾漾小吃店,臺北市中山區長安東路2段92號2樓,歇業／撤銷,菸酒零售業
48896076,魚太豐生猛海鮮小吃店,臺北市大安區新生南路2段28號,核准設立,菸酒零售業
01785789,咖里屋小吃坊,臺北市大安區金華街199巷1弄4號1樓,核准設立,菸酒零售業
99610216,嗑棧小吃店,臺北市大安區延吉街70巷5弄6號1樓,歇業／撤銷,菸酒零售業
31843126,富翔餐廳,臺北市大安區延吉街64之3號,歇業／撤銷,菸酒零售業
18091262,亞伯企業社,臺北市中山區南京東路3段189號11樓,歇業／撤銷,菸酒零售業
80989040,天景商行,臺北市中山區林森北路575號11樓之1,歇業／撤銷,菸酒零售業
48940615,聚福樓,臺北市信義區基隆路1段426號,廢止,菸酒零售業
15650403,酒饌餐坊,臺北市大安區安和路1段127巷6號1樓,歇業／撤銷,菸酒零售業
17269326,千禧名店,臺北市中山區新生北路2段108號地下1層,廢止,菸酒零售業
14335528,年華食品坊,臺北市中山區四平街55號3樓,歇業／撤銷,菸酒零售業
48946569,逗陣食品行,臺北市中山區新生北路1段66號地下1樓,歇業／撤銷,菸酒零售業
17541352,翔宇書坊,臺北市北投區石牌路2段336之1號1樓,歇業／撤銷,菸酒零售業
17085973,羅曼餐坊,臺北市中山區中山北路1段105巷23號2樓,歇業／撤銷,菸酒零售業
27154962,宴繽軒,臺北市萬華區西園路1段212巷31號1、2樓,歇業／撤銷,菸酒零售業
21760126,逍遙閣軒,臺北市萬華區三水街118號2、3樓,廢止,菸酒零售業
31842463,香格視聽歌城,臺北市中山區林森北路413號2樓,歇業／撤銷,菸酒零售業
98887869,滿吉餐坊,臺北市中山區民生東路2段66號1樓,歇業／撤銷,菸酒零售業
83909268,麗年堡洋行,臺北市士林區中正路122號2樓之2,歇業／撤銷,菸酒零售業
14326696,澤翔小吃店,臺北市大安區忠孝東路4段205巷7弄11號1樓,歇業／撤銷,菸酒零售業
73911743,炘炘食品行,臺北市中山區林森北路432號2樓之1,歇業／撤銷,菸酒零售業
25546458,芸采餐廳,臺北市中山區中山北路1段83巷22號,核准設立,菸酒零售業
81777781,誠瑞商店,臺北市文山區指南路2段45巷24弄20號1樓,歇業／撤銷,菸酒零售業
99349066,巷貓商店,臺北市大安區麗水街8號地下,歇業／撤銷,菸酒零售業
38560657,摩堤美食坊,臺北市中正區懷寧街42號,核准設立,菸酒零售業
31846762,蕾香焙咖啡輕食館,臺北市中山區建國北路1段67巷31號,核准設立,菸酒零售業
48795892,慶發彩券行,臺北市大同區延平北路2段150號1樓,歇業／撤銷,菸酒零售業
98893383,月光寶盒複合式餐坊,臺北市中山區建國北路2段86號1樓,廢止,菸酒零售業
99355340,酒世界商行,臺北市中正區中華路2段313巷16號,核准設立,菸酒零售業
25671899,好口味檳榔店,臺北市南港區東新街93號1樓,歇業／撤銷,菸酒零售業
18414994,麻里翁食軒,臺北市大安區光復南路180巷11號,歇業／撤銷,菸酒零售業
15638788,虎馬餐坊,臺北市大安區忠孝東路4段223巷49弄1號1樓,歇業／撤銷,菸酒零售業
31958816,大莽甲複合式餐坊,臺北市萬華區廣州街170號2樓,歇業／撤銷,菸酒零售業
18087703,玉利便利商店,臺北市松山區南京東路5段368號1樓,歇業／撤銷,菸酒零售業
26246839,饗賀餐館,臺北市北投區中央北路2段167號,歇業／撤銷,菸酒零售業
25560660,夢妍小吃店,臺北市北投區裕民一路3號,核准設立,菸酒零售業
31948310,六花亭和?子小舖,臺北市松山區民生東路5段244號1樓,核准設立,菸酒零售業
99349256,派奇商行,臺北市信義區松隆路341號1樓,歇業／撤銷,菸酒零售業
15634880,浚鈊企業社,臺北市大安區羅斯福路3段325號4樓,歇業／撤銷,菸酒零售業
27165932,彩虹行,臺北市大安區信義路4段30巷2號2樓,歇業／撤銷,菸酒零售業
17739208,喜久餐坊,臺北市中山區林森北路119巷80號1樓,遷他縣市,菸酒零售業
14730302,葩芬食品行,臺北市松山區光復南路22巷31號1樓,歇業／撤銷,菸酒零售業
26365270,富水餐坊,臺北市中山區中山北路1段121巷15號,歇業／撤銷,菸酒零售業
10311714,穩贏興業行,臺北市中山區民生東路1段25之2號,歇業／撤銷,菸酒零售業
48931073,娟之坊小吃店,臺北市文山區木新路3段117號,歇業／撤銷,菸酒零售業
13828209,晶樺霖行,臺北市中山區南京東路2段174號10樓,歇業／撤銷,菸酒零售業
48967563,勤揚商店,臺北市大安區通安街101號,核准設立,菸酒零售業
26346507,儂徠餐廳,臺北市萬華區梧州街51之1號房屋地下層,歇業／撤銷,菸酒零售業
98883499,天馨鍋小吃店,臺北市信義區莊敬路366號、368號,歇業／撤銷,菸酒零售業
48726397,水玥樓軒,臺北市萬華區三水街124號4樓,歇業／撤銷,菸酒零售業
48827487,南洋美食店,臺北市內湖區成功路4段182巷8弄7號,歇業／撤銷,菸酒零售業
83912138,蘋果商行,臺北市中正區汀州路2段187號1樓,歇業／撤銷,菸酒零售業
13847705,宏典商行,臺北市松山區長安東路2段219號7樓之7,歇業／撤銷,菸酒零售業
17546309,星光商行,臺北市中正區博愛路25號9樓之6,歇業／撤銷,菸酒零售業
25654081,多座餐廳,臺北市中山區中山北路1段105巷20號地下,歇業／撤銷,菸酒零售業
48670128,傌奇達酒坊,臺北市中山區雙城街32巷2之2號1樓,歇業／撤銷,菸酒零售業
14324698,派普洋行,臺北市大安區東豐街69號1樓,歇業／撤銷,菸酒零售業
31858963,愛維德思音樂創藝工作室,臺北市中正區南昌路1段37號4樓,歇業／撤銷,菸酒零售業
26218263,伊是伊音樂餐坊,臺北市信義區松信路141號,歇業／撤銷,菸酒零售業
29231212,二空眷村小館,臺北市松山區敦化北路155巷14號1樓,核准設立,菸酒零售業
99333705,億路發商行,臺北市中山區林森北路500號地下室,廢止,菸酒零售業
31952735,晴天蛙蛙工作室,臺北市信義區忠孝東路5段410號13樓之5,停業,菸酒零售業
70979938,優墾產銷商行,臺北市大安區忠孝東路3段136號10樓之3,核准設立,菸酒零售業
73882260,宏都舞廳,臺北市萬華區峨嵋街115號7樓、7樓之1,歇業／撤銷,菸酒零售業
48837838,薇閣小吃店,臺北市萬華區三水街106巷8號(1樓及2樓),歇業／撤銷,菸酒零售業
99612684,祿意絲餐飲國際商行,臺北市大安區敦化南路1段236巷18號1樓,核准設立,菸酒零售業
13825300,朝安機車行,臺北市中山區中山北路1段78號1樓,停業,菸酒零售業
25574496,倍羚國際商行,臺北市大安區和平東路1段141巷7號之2,核准設立,菸酒零售業
04787184,金永食品商行,臺北市內湖區內湖路2段263巷4號1樓,歇業／撤銷,菸酒零售業
81798391,和平精品百貨商店,臺北市萬華區西昌街147號,歇業／撤銷,菸酒零售業
14743144,牛二小吃店,臺北市中山區八德路2段223號1樓,歇業／撤銷,菸酒零售業
25521800,山城小吃店,臺北市中山區敬業一路128巷39號5樓,歇業／撤銷,菸酒零售業
17735218,三加一軒,臺北市萬華區華西街19號1樓,歇業／撤銷,菸酒零售業
14327506,巨星資訊服務社,臺北市中山區民權西路48號地下1樓,歇業／撤銷,菸酒零售業
14739438,月照小吃店,臺北市中山區吉林路205號1樓,核准設立,菸酒零售業
14326529,小貓企業社,臺北市大安區復興南路1段348號1樓,歇業／撤銷,菸酒零售業
38510714,茂祥商行,臺北市中山區錦州街46號9樓之1,核准設立,菸酒零售業
15634404,川都小吃店,臺北市中山區龍江路39號,歇業／撤銷,菸酒零售業
99623084,好彩頭百貨行,臺北市大安區和平東路3段228巷53號,歇業／撤銷,菸酒零售業
14330777,大嘉食品商行,臺北市中山區天津街62號2樓,歇業／撤銷,菸酒零售業
18383211,浩勝商行,臺北市中山區長春路40號12樓之2,歇業／撤銷,菸酒零售業
13464707,天天?小吃店,臺北市中山區南京東路1段132巷13號1樓,核准設立,菸酒零售業
38579403,晴光煙酒行,臺北市中山區雙城街13巷1號,核准設立,菸酒零售業
83928271,法皇商行,臺北市南港區重陽路122號,歇業／撤銷,菸酒零售業
99634723,花田音樂餐廳,臺北市中山區長安東路1段101號地下1樓,歇業／撤銷,菸酒零售業
29240578,水晶商行,臺北市中山區松江路293之403號,廢止,菸酒零售業
98895397,大家莊軒,臺北市萬華區梧州街53號2樓,歇業／撤銷,菸酒零售業
29209534,國亨商行,臺北市大同區重慶北路2段46巷36號1樓,遷他縣市,菸酒零售業
48722006,十三香餐坊,臺北市大安區和平東路3段48之6號1樓,核准設立,菸酒零售業
26347034,微莉那餐廳,臺北市中山區林森北路133巷54號1樓,核准設立,菸酒零售業
15651923,嘉伯商行,臺北市大安區延吉街131巷8號1樓,歇業／撤銷,菸酒零售業
31962826,文山胡商行,臺北市文山區興隆路2段331號（1樓）,核准設立,菸酒零售業
25672187,神牛日式燒肉店大直店,臺北市中山區北安路627號,核准設立,菸酒零售業
13454166,高爾夫商行,臺北市中山區農安街53號1樓,歇業／撤銷,菸酒零售業
99362068,千喜咖啡小吃店,臺北市松山區八德路4段106巷2弄1號,歇業／撤銷,菸酒零售業
98912500,綠橄欖義大利麵店,臺北市大安區光復南路308巷22號1樓,歇業／撤銷,菸酒零售業
38576638,帆星食品坊,臺北市松山區光復北路146,148號1樓,核准設立,菸酒零售業
99968875,雅馨商行,臺北市中山區八德路2段278號,歇業／撤銷,菸酒零售業
98898802,茗軒商行,臺北市中山區新生北路1段83號2樓,歇業／撤銷,菸酒零售業
25615399,關欣便當店,臺北市大安區樂業街59號,歇業／撤銷,菸酒零售業
37913035,來喜商行,臺北市中正區北平東路2號,核准設立,菸酒零售業
38555970,男子小吃店,臺北市中山區長春路190號1樓,核准設立,菸酒零售業
27154837,瀧王軒,臺北市萬華區廣州街235之2號3樓,廢止,菸酒零售業
48875678,大發商行,臺北市大安區仁愛路4段345巷2弄13號,遷他縣市,菸酒零售業
18099594,雙峰酒吧,臺北市中山區林森北路83號地下1樓,核准設立,菸酒零售業
94904584,?發商行,臺北市大安區安和路2段5號,歇業／撤銷,菸酒零售業
17525938,永康煙酒店,臺北市南港區富康街28之1號1樓,核准設立,菸酒零售業
21715093,威尼斯餐廳,臺北市中山區市民大道3段135號,歇業／撤銷,菸酒零售業
26211016,林新利商店,臺北市萬華區莒光路153巷25號1樓,核准設立,菸酒零售業
94919051,招財貓食品行,臺北市中山區吉林路28號地下1樓,歇業／撤銷,菸酒零售業
73896150,義類食品行,臺北市松山區三民路93號1樓,歇業／撤銷,菸酒零售業
25562365,以琳時尚烘焙坊,臺北市文山區木柵路1段167號,核准設立,菸酒零售業
13446700,麥之田食品屋,臺北市中山區錦州街404號1樓,廢止,菸酒零售業
48936099,美日春美食館,臺北市中山區林森北路131號2樓,歇業／撤銷,菸酒零售業
01307443,金如意餐館,臺北市中山區新生北路1段104號1樓,核准設立,菸酒零售業
10340056,雙連食品店,臺北市大同區興城街13號,歇業／撤銷,菸酒零售業
18393652,琴馨軒,臺北市萬華區梧州街57號2、3、4樓,歇業／撤銷,菸酒零售業
15645280,小城故事咖啡館,臺北市內湖區內湖路1段315號1樓,歇業／撤銷,菸酒零售業
10381794,愛晴小舖,臺北市內湖區江南街83號,廢止,菸酒零售業
13854120,台北西門撞球運動館,臺北市萬華區西寧南路70號7樓,歇業／撤銷,菸酒零售業
38464795,玲瓏小吃店,臺北市中山區雙城街23之3號1樓,核准設立,菸酒零售業
83915352,唯心殯儀社,臺北市信義區光復南路505號11樓之7,核准設立,菸酒零售業
73899179,展億行,臺北市南港區研究院路2段35巷23弄25號3樓,歇業／撤銷,菸酒零售業
19105124,德祥永號,臺北市中正區克難街2巷43號,歇業／撤銷,菸酒零售業
80996470,曼摩小吃店,臺北市中山區伊通街66巷3之3號1樓,核准設立,菸酒零售業
48751711,魔法食堂,臺北市大安區四維路208巷4號1樓,廢止,菸酒零售業
80989739,萬順小吃店,臺北市文山區萬隆街19巷1號1樓,歇業／撤銷,菸酒零售業
31953137,廣州伊露發小吃店,臺北市萬華區西園路1段168號8樓,核准設立,菸酒零售業
31846405,輪三番串燒店,臺北市內湖區成功路2段187號,歇業／撤銷,菸酒零售業
17257258,慶貓餐廳,臺北市中山區林森北路159巷44號,核准設立,菸酒零售業
13452478,金吉利菸酒洋行,臺北市中山區林森北路349之1號1樓,歇業／撤銷,菸酒零售業
21778218,饕客來小吃店,臺北市信義區仁愛路4段512巷6號之11樓,歇業／撤銷,菸酒零售業
10344166,樂奇餐廳,臺北市中山區林森北路107巷37號,歇業／撤銷,菸酒零售業
14720938,快樂龍世界遊樂園,臺北市松山區饒河街180號1樓,廢止,菸酒零售業
80988865,檸檬魚企業社,臺北市中山區一江街33號1樓,歇業／撤銷,菸酒零售業
18384696,神經大條小吃店,臺北市士林區文林路339號1樓,廢止,菸酒零售業
15658762,佑鑫商行,臺北市中正區水源路39之3號,核准設立,菸酒零售業
29223233,天藏帝酒餐坊,臺北市中山區林森北路107巷60號1樓,廢止,菸酒零售業
38470749,達達原味手工烘焙坊,臺北市中山區吉林路265號1樓,核准設立,菸酒零售業
99962247,力音餐廳,臺北市中山區中山北路1段121巷15號1樓,歇業／撤銷,菸酒零售業
48708948,百荷坊,臺北市中山區南京東路1段132巷31號地下樓,歇業／撤銷,菸酒零售業
48693831,永明菸酒商行,臺北市信義區莊敬路321號1樓,核准設立,菸酒零售業
27162576,德榮商行,臺北市中山區南京東路2段163號6樓,歇業／撤銷,菸酒零售業
13461933,葡萄圓軒,臺北市萬華區廣州街186巷9號1樓2樓,歇業／撤銷,菸酒零售業
25515510,美佳利軒,臺北市萬華區廣州街186巷10號2樓,歇業／撤銷,菸酒零售業
48930383,六星級餐飲坊,臺北市信義區松山路315號,歇業／撤銷,菸酒零售業
18394511,紅配綠商行,臺北市大安區敦化南路1段160巷25號1樓,歇業／撤銷,菸酒零售業
17265757,竹軒餐廳,臺北市中山區龍江路298巷21號1樓,核准設立,菸酒零售業
38510405,慈元行,臺北市大同區民生西路383號,核准設立,菸酒零售業
31872613,米奇林餐廳,臺北市信義區信義路4段456號3樓之2及3樓之3,歇業／撤銷,菸酒零售業
77134338,安利行,臺北市萬華區廣州街128號1樓,歇業／撤銷,菸酒零售業
38570944,順兄弟餐飲商行,臺北市大安區東豐街32號1樓,核准設立,菸酒零售業
21714051,百盛行,臺北市大同區貴德街60號1樓,核准設立,菸酒零售業
15637107,富豪企業社,臺北市中山區松江路129號8樓之4,歇業／撤銷,菸酒零售業
48946266,弘德企業社,臺北市中山區北安路655號地下一樓,歇業／撤銷,菸酒零售業
48958059,牧嚕棧商行,臺北市中山區林森北路85巷48號,歇業／撤銷,菸酒零售業
31843110,萬德餐廳,臺北市大安區延吉街85號,歇業／撤銷,菸酒零售業
17760905,鴻香檳軒,臺北市萬華區華西街19之1號1樓,歇業／撤銷,菸酒零售業
26232883,蝶戀花餐廳,臺北市中山區林森北路133巷18號1樓,歇業／撤銷,菸酒零售業
48927465,雙連食品行,臺北市大同區興城街13號,歇業／撤銷,菸酒零售業
27160211,昌品餐坊,臺北市中山區建國北路1段61號,歇業／撤銷,菸酒零售業
25564286,紅之葉餐廳,臺北市中山區林森北路133巷27號,歇業／撤銷,菸酒零售業
14724673,吉祥昌商行,臺北市萬華區寶興街222巷62號1樓,歇業／撤銷,菸酒零售業
18102471,悠閒咖啡館,臺北市大安區復興南路1段219巷16號,歇業／撤銷,菸酒零售業
98892960,特財商行,臺北市萬華區西寧南路36號之87、1樓,歇業／撤銷,菸酒零售業
94909069,感恩商行,臺北市大安區通化街39巷50弄47號,核准設立,菸酒零售業
73897637,影子餐坊,臺北市大安區光復南路116巷24號1樓,歇業／撤銷,菸酒零售業
14749077,捷瑜商行,臺北市中山區民權西路70號3樓之1,歇業／撤銷,菸酒零售業
17076587,小江小吃店,臺北市中山區合江街69之4號,歇業／撤銷,菸酒零售業
18091235,黃金海岸活蝦之家,臺北市中山區民權東路2段67號1樓,廢止,菸酒零售業
38553516,揚笙企業社,臺北市信義區松德路65號4樓之2,核准設立,菸酒零售業
99957363,五五七薑母鴨小吃店,臺北市南港區永吉路557號1樓,廢止,菸酒零售業
14340542,宜佳休閒茶館,臺北市萬華區長泰街38號1樓,歇業／撤銷,菸酒零售業
48713392,陞龍商行,臺北市萬華區德昌街152號1樓,核准設立,菸酒零售業
04982519,大統西點麵包店,臺北市大安區泰順街15號1樓,核准設立,菸酒零售業
29205024,北安撞球體育用品社,臺北市中山區北安路655號地下1樓,歇業／撤銷,菸酒零售業
31856542,緣圓小吃店,臺北市萬華區西園路1段72巷7號,歇業／撤銷,菸酒零售業
21720981,帝鑫商行,臺北市中山區松江路330巷24號1樓,歇業／撤銷,菸酒零售業
13852333,天晴小吃店,臺北市士林區天母北路20號1樓,核准設立,菸酒零售業
25556244,趙時餐坊,臺北市大安區通安街81號地下(1樓),核准設立,菸酒零售業
17757704,年代撞球坊,臺北市大同區延平北路1段102號、104號、106號2樓,歇業／撤銷,菸酒零售業
14738590,歐蘭吉食坊,臺北市士林區忠誠路2段138號1樓,歇業／撤銷,菸酒零售業
25662126,天晨企業社,臺北市大安區信義路4段265巷23號1樓,核准設立,菸酒零售業
17078121,鎮平號什貨店,臺北市信義區富陽街7號1樓,歇業／撤銷,菸酒零售業
15900227,富帆商店,臺北市萬華區萬大路464號1樓,遷他縣市,菸酒零售業
21764262,典筠書坊,臺北市內湖區星雲街28號,歇業／撤銷,菸酒零售業
25563499,極品六次方咖啡館,臺北市中正區羅斯福路3段284巷9號1樓,歇業／撤銷,菸酒零售業
15976372,新之坊餐廳,臺北市萬華區西園路1段212巷4號1樓,核准設立,菸酒零售業
98893362,邁阿蜜酒坊,臺北市中山區雙城街32巷2之3號1樓,歇業／撤銷,菸酒零售業
15661350,香辣蟹商行,臺北市萬華區西寧南路107號2樓,歇業／撤銷,菸酒零售業
48864757,八六複合式餐坊,臺北市中山區建國北路2段86號,歇業／撤銷,菸酒零售業
26234622,粉鳥林小吃店,臺北市松山區敦化北路155巷9之1號,核准設立,菸酒零售業
21764663,晶瀅咖啡館,臺北市中山區建國北路2段125號,歇業／撤銷,菸酒零售業
15668852,凱斯小吃店,臺北市松山區光復北路105號1樓,歇業／撤銷,菸酒零售業
48968155,正旺雜糧行,臺北市松山區撫遠街378之3號,核准設立,菸酒零售業
14313290,安捷商行,臺北市信義區虎林街85號1樓,歇業／撤銷,菸酒零售業
15647359,荔星舫餐坊,臺北市文山區興隆路1段112號1樓,核准設立,菸酒零售業
