94902426,阿波羅餐坊,臺北市中山區八德路2段239號1樓,歇業／撤銷,菸酒零售業
18089792,廣盈商店,臺北市中山區新生北路2段96號之1,歇業／撤銷,菸酒零售業
14731338,宏光食品行,臺北市松山區民生東路3段130巷7弄1號1樓,歇業／撤銷,菸酒零售業
17762517,昱生商行,臺北市中山區德惠街167巷2號1樓,歇業／撤銷,菸酒零售業
26190434,金柱商行,臺北市萬華區環河南路3段241號1樓,歇業／撤銷,菸酒零售業
98913748,茶思飯想小吃店,臺北市松山區南京東路3段335巷17之1號,歇業／撤銷,菸酒零售業
25537140,水木林藝品輕食店,臺北市松山區民生東路5段69巷3弄32號1樓,核准設立,菸酒零售業
80990145,宏鑫商行,臺北市信義區光復南路421巷13號1樓,核准設立,菸酒零售業
25563189,現撈大溪港小吃店,臺北市萬華區長沙街2段69號,核准設立,菸酒零售業
83931037,磨菇坊西餐廳,臺北市大安區敦化南路1段223號地下1樓,歇業／撤銷,菸酒零售業
38557800,唯蓁日式料理店,臺北市文山區興隆路2段215之2號,核准設立,菸酒零售業
25557948,錢隆商行,臺北市大同區寧夏路9號,歇業／撤銷,菸酒零售業
38470240,二田餐坊,臺北市中山區德惠街202號,核准設立,菸酒零售業
14338285,動力網際網路科技社,臺北市松山區延吉街30巷7號1樓,歇業／撤銷,菸酒零售業
25661837,串堂居酒屋,臺北市大安區大安路1段51巷35號,核准設立,菸酒零售業
15647153,天行者餐館,臺北市中山區民生東路2段119號地下1層,廢止,菸酒零售業
81789180,藝品茶行,臺北市大同區延平北路2段272巷31號1樓,歇業／撤銷,菸酒零售業
31842490,上宴餐廳,臺北市中山區林森北路107巷24號1樓,歇業／撤銷,菸酒零售業
48875972,麗聲小吃店,臺北市萬華區漢口街2段111號1樓,歇業／撤銷,菸酒零售業
25516659,國揚小吃店,臺北市南港區研究院路2段76號,核准設立,菸酒零售業
31949752,武運餐飲店,臺北市信義區松仁路287號1樓,核准設立,菸酒零售業
38557702,安力美廚坊,臺北市信義區基隆路2段39巷10號1樓,核准設立,菸酒零售業
26360768,新雅涮涮鍋,臺北市松山區南京東路5段55之1號,核准設立,菸酒零售業
38554521,酩迪商行,臺北市大安區忠孝東路4段162號5樓之5,歇業／撤銷,菸酒零售業
25538767,統冠食品行,臺北市信義區永吉路30巷109號1樓,歇業／撤銷,菸酒零售業
25545520,天椒小吃店,臺北市大安區復興南路2段84號,核准設立,菸酒零售業
14332276,彭發商行,臺北市大安區復興南路1段144號1、2樓,歇業／撤銷,菸酒零售業
14738607,泰福國際企業行,臺北市中山區長春路40號5樓之3,歇業／撤銷,菸酒零售業
26345845,凱傑洋行,臺北市大安區安和路2段27號,核准設立,菸酒零售業
26244889,川鍋魯旦茶酒菜館,臺北市中山區建國北路2段16號,核准設立,菸酒零售業
15634072,達華雜貨店,臺北市南港區南港路2段120號1樓,核准設立,菸酒零售業
38472232,金申一企業社,臺北市大安區師大路59巷13號2樓,歇業／撤銷,菸酒零售業
38473507,麗台商行,臺北市中山區長安東路2段6-1號3樓,核准設立,菸酒零售業
99955800,垣久行,臺北市中山區新生北路2段68巷11之2號,核准設立,菸酒零售業
48831476,明德電腦彩券行,臺北市北投區明德路22號1樓,歇業／撤銷,菸酒零售業
48669298,財官商行,臺北市大安區濟南路3段69號1樓,歇業／撤銷,菸酒零售業
31954966,全順工作室,臺北市松山區光復北路5號地下,核准設立,菸酒零售業
25550522,豪冶餐飲店,臺北市大安區羅斯福路3段277之1號2樓,歇業／撤銷,菸酒零售業
26238508,米黃商號,臺北市中山區中山北路2段20巷19號1樓,核准設立,菸酒零售業
38579255,拾食樸餐廳,臺北市大安區濟南路3段59之1號,核准設立,菸酒零售業
18089322,球友撞球場,臺北市中山區南京東路2段11號5樓,歇業／撤銷,菸酒零售業
48763076,杜康企業社,臺北市中山區松江路22號5樓之3,廢止,菸酒零售業
99352786,喜都餐廳,臺北市中正區羅斯福路2段60號66巷2號2樓、2樓之1、2樓之2、2樓之3,歇業／撤銷,菸酒零售業
13840061,忠順商行,臺北市文山區忠順街1段137號1樓,核准設立,菸酒零售業
31954451,巷子口餐飲店,臺北市大安區安和路2段35巷1號,核准設立,菸酒零售業
13858771,歐品餐坊,臺北市大安區四維路363號1樓及365號1樓,歇業／撤銷,菸酒零售業
38550503,晏敬餐飲小吃店,臺北市中山區長安東路2段179號1樓,核准設立,菸酒零售業
25574931,京?餐坊,臺北市南港區忠孝東路6段283號,歇業／撤銷,菸酒零售業
38470558,吉翔餐坊,臺北市大安區仁愛路4段31號地下,核准設立,菸酒零售業
26349390,津饌火鍋店,臺北市萬華區西寧南路157、159號(1樓),核准設立,菸酒零售業
18957504,隆銓商店,臺北市大安區濟南路3段70號1樓,核准設立,菸酒零售業
15652129,柏菲苑飲食店,臺北市大安區敦化南路1段190巷2號地下1樓,歇業／撤銷,菸酒零售業
81715408,儂橘泡沫紅茶店,臺北市中山區復興南路1段36號1樓,歇業／撤銷,菸酒零售業
21713855,星辰咖啡店,臺北市大同區哈密街59巷29號1樓,廢止,菸酒零售業
29242914,大都會簡餐坊,臺北市士林區重慶北路4段61號1樓,歇業／撤銷,菸酒零售業
83939707,東方美人視聽歌唱坊,臺北市松山區八德路3段120號2樓、2樓之1至之6,廢止,菸酒零售業
99326394,來華小吃店,臺北市中山區中原街69號1樓,歇業／撤銷,菸酒零售業
99979015,黃晶海軒,臺北市萬華區梧州街47號3樓,歇業／撤銷,菸酒零售業
26209026,吻鑽餐廳,臺北市中山區林森北路119巷45號2樓,歇業／撤銷,菸酒零售業
38465767,饌異料理家餐坊,臺北市松山區民權東路3段160巷19弄3號,歇業／撤銷,菸酒零售業
01715258,麥田小吃店,臺北市文山區羅斯福路5段176巷1弄1號,歇業／撤銷,菸酒零售業
48781715,隆笙企業社,臺北市松山區光復南路13巷39號,遷他縣市,菸酒零售業
18377576,薏薈坊,臺北市中山區長春路336號1樓,歇業／撤銷,菸酒零售業
83900317,大漠洋行,臺北市中山區林森北路639號1樓,歇業／撤銷,菸酒零售業
25575072,大翔美食餐坊,臺北市中山區長安東路2段178號之3、1樓,核准設立,菸酒零售業
38507696,祥酩商行,臺北市大同區涼州街1之13號1樓,核准設立,菸酒零售業
14494877,八號書坊,臺北市信義區基隆路2段22號2樓,歇業／撤銷,菸酒零售業
48927438,兆福商行,臺北市中山區林森北路510號,歇業／撤銷,菸酒零售業
17773079,伊思特的店,臺北市松山區北寧路40號1樓,歇業／撤銷,菸酒零售業
48844090,吉員小吃店,臺北市士林區文林路173號,歇業／撤銷,菸酒零售業
10652402,鵬呈商行,臺北市大同區太原路153號,核准設立,菸酒零售業
98913085,銀湯匙泰式自助主題餐廳,臺北市松山區南京東路4段21之1號1樓,遷他縣市,菸酒零售業
13852544,千上商行,臺北市信義區松隆路60號,核准設立,菸酒零售業
10367603,龍記搶鍋麵館,臺北市中正區衡陽路84巷6號1樓,核准設立,菸酒零售業
31850809,田原香食品商行仁愛分店,臺北市中正區仁愛路1段22號1樓,廢止,菸酒零售業
17758984,花蘭軒,臺北市萬華區三水街124號126號2樓,歇業／撤銷,菸酒零售業
27186774,大勝商行,臺北市士林區文林路313號1樓,歇業／撤銷,菸酒零售業
26346324,樂飴購?子洋行,臺北市松山區八德路3段155巷3號1樓,歇業／撤銷,菸酒零售業
83916562,合忠商行,臺北市大安區忠孝東路3段305號11樓,歇業／撤銷,菸酒零售業
25524671,巴客咖啡館,臺北市內湖區文德路2號,歇業／撤銷,菸酒零售業
48762323,璦莉萊食品行,臺北市萬華區西園路1段212巷1號,歇業／撤銷,菸酒零售業
31861524,太易商行,臺北市松山區八德路2段346巷9弄17號,歇業／撤銷,菸酒零售業
99643933,山水情餐飲店,臺北市中山區中山北路2段77巷18之3號3樓,歇業／撤銷,菸酒零售業
26338078,倫爸商行,臺北市大同區重慶北路1段83巷16號,核准設立,菸酒零售業
38462760,旺旺來商行,臺北市內湖區康樂街116號之3,核准設立,菸酒零售業
31845601,幸子美食坊,臺北市萬華區萬青街125號,核准設立,菸酒零售業
14731180,蜜士坊,臺北市中山區長安東路2段161之1號1樓,歇業／撤銷,菸酒零售業
83935809,星光大道餐廳,臺北市大安區敦化南路1段219號地下2樓,廢止,菸酒零售業
04535245,建東商店,臺北市萬華區東園公有市場32號,廢止,菸酒零售業
38576763,江南貿易行,臺北市中山區興安街42號,核准設立,菸酒零售業
38568406,有榮餐坊,臺北市中山區林森北路500號地下室,核准設立,菸酒零售業
45023470,元祥行,臺北市中正區漢口街2段101號,歇業／撤銷,菸酒零售業
26213725,傳斌小吃店,臺北市大安區通安街63號,歇業／撤銷,菸酒零售業
98902329,順昌行商店,臺北市信義區松山路198號1樓,歇業／撤銷,菸酒零售業
48946667,久豐食品行,臺北市信義區松山路119巷17弄5號,歇業／撤銷,菸酒零售業
14728426,朗伯商行,臺北市中山區中山北路2段74號3樓,歇業／撤銷,菸酒零售業
30018668,天堤商號,臺北市大同區華陰街127號,歇業／撤銷,菸酒零售業
29227646,衣蝶小吃店,臺北市中山區新生北路3段10號1樓,歇業／撤銷,菸酒零售業
25553204,得仕洋行,臺北市大安區忠孝東路4段181巷35弄1號,核准設立,菸酒零售業
17079178,雙魚座洋行,臺北市大安區建國南路1段32號1樓,歇業／撤銷,菸酒零售業
80989793,雙園企業社,臺北市萬華區東園街28巷61號1樓,歇業／撤銷,菸酒零售業
48710281,麗鑫企業社,臺北市中山區林森北路100號12樓之1,歇業／撤銷,菸酒零售業
99955317,橘子天空咖啡館,臺北市松山區南京東路5段250巷18弄8號1樓,歇業／撤銷,菸酒零售業
25558067,臻愛餐廳,臺北市中山區林森北路119巷37號地下,歇業／撤銷,菸酒零售業
99955415,祥好商行,臺北市大安區敦化南路1段177巷37號1樓,廢止,菸酒零售業
99988160,阿宏檳榔店,臺北市大同區酒泉街197號1樓,歇業／撤銷,菸酒零售業
14318859,樂透雜貨行,臺北市萬華區康定路138號1樓,歇業／撤銷,菸酒零售業
48922243,八豆小吃,臺北市萬華區昆明街126號2樓,歇業／撤銷,菸酒零售業
81795922,歐莉薇小坊,臺北市中山區中山北路2段77巷17之2號地下樓,歇業／撤銷,菸酒零售業
48834473,雅品酒坊,臺北市中山區天津街56號2樓之16至22,歇業／撤銷,菸酒零售業
25523820,叡和商行,臺北市萬華區桂林路113號8號,核准設立,菸酒零售業
13836165,橘子咖啡館,臺北市松山區南京東路5段250巷18弄8號1樓,廢止,菸酒零售業
13827551,蓉鼎小吃店,臺北市信義區忠孝東路4段553巷22弄1號1樓,核准設立,菸酒零售業
25508975,世偉檳榔店,臺北市信義區永吉路115號,廢止,菸酒零售業
99644089,我我們咖啡坊,臺北市中山區遼寧街199巷33號1樓,歇業／撤銷,菸酒零售業
10391548,多味堂小吃店,臺北市大安區樂業街45號,核准設立,菸酒零售業
17082011,麗平炭火燒肉店,臺北市北投區西安街2段213號1樓,歇業／撤銷,菸酒零售業
26355569,龍鼎餐廳,臺北市松山區南京東路3段256巷52號1樓、54號1樓,歇業／撤銷,菸酒零售業
94908441,囍兒餐飲店,臺北市中山區南京東路3段168號1樓,歇業／撤銷,菸酒零售業
48967260,雲軒商行,臺北市信義區永吉路269號,核准設立,菸酒零售業
99961021,天采餐廳,臺北市中正區忠孝西路1段41號之5、之6、之7、之8、之9、之10、之11、之12、之13、之14、之16、之17、之18、之19（1樓）,核准設立,菸酒零售業
25667614,琴聖園餐坊,臺北市中山區新生北路1段100號,核准設立,菸酒零售業
48877970,喜寶餐廳,臺北市中山區林森北路85巷26號,歇業／撤銷,菸酒零售業
26244810,及利行,臺北市中正區汀州路3段269號,歇業／撤銷,菸酒零售業
30953047,良果食品店,臺北市大安區和平東路2段189號,核准設立,菸酒零售業
48909277,久酒餐廳,臺北市中山區林森北路85巷52號,核准設立,菸酒零售業
26216027,奇米餐坊,臺北市大安區敦化南路2段63巷28號,歇業／撤銷,菸酒零售業
13844593,大吉大利興業行,臺北市中山區長春路40號12樓之4,歇業／撤銷,菸酒零售業
99642343,一六一小吃店,臺北市松山區興安街161號1樓,歇業／撤銷,菸酒零售業
13836664,雲亨餐坊,臺北市中山區長春路100號1樓,歇業／撤銷,菸酒零售業
25547338,川普日式燒肉館,臺北市信義區逸仙路50巷8號,歇業／撤銷,菸酒零售業
80985255,柏美坊,臺北市中山區松江路101號9樓,歇業／撤銷,菸酒零售業
10367738,日惹企業社,臺北市文山區興隆路2段220巷41號,核准設立,菸酒零售業
25571239,捷寶企業社,臺北市信義區忠孝東路5段669號2樓之1,歇業／撤銷,菸酒零售業
48684875,鑫豐餐坊,臺北市中山區松江路362巷81號1樓,歇業／撤銷,菸酒零售業
25577748,葡京企業社,臺北市中山區中山北路2段71號8樓,歇業／撤銷,菸酒零售業
26256857,維也納小咖啡,臺北市中山區撫順街41巷3號,核准設立,菸酒零售業
25656222,湘媛小吃店,臺北市中山區錦州街32號2樓,歇業／撤銷,菸酒零售業
48930519,驕傲瑪麗小吃店,臺北市松山區南京東路4段11號1樓,歇業／撤銷,菸酒零售業
31864769,星漾餐坊,臺北市中山區林森北路107巷62號,核准設立,菸酒零售業
73918226,梨花食品商行,臺北市萬華區開封街2段80號6樓之2,歇業／撤銷,菸酒零售業
48764390,盛德企業社,臺北市中山區松江路27號5樓之4,歇業／撤銷,菸酒零售業
31881893,?貳逼萬企業社,臺北市中山區錦州街32號地下,歇業／撤銷,菸酒零售業
25539132,傲耳思商號,臺北市大安區敦化南路1段161巷40號,歇業／撤銷,菸酒零售業
18654001,同昌號,臺北市大安區潮州街53號之2,廢止,菸酒零售業
42287224,寒泰國際企業社永吉店,臺北市信義區永吉路30巷157弄2號,核准設立,菸酒零售業
18095350,金禧園店,臺北市大安區四維路88號,歇業／撤銷,菸酒零售業
38575645,喜子商行,臺北市大安區文昌街96號,核准設立,菸酒零售業
29245948,福運餐廳,臺北市中山區林森北路133巷67號地下1層,核准設立,菸酒零售業
48947547,鈺祥坊,臺北市中山區農安街35之2號,歇業／撤銷,菸酒零售業
13850779,馨升洋行,臺北市信義區永吉路522號1樓,歇業／撤銷,菸酒零售業
01680069,廣飴鄉商行,臺北市北投區溫泉路30巷11之1號2樓,核准設立,菸酒零售業
17553194,國聲菸酒行,臺北市大安區和平東路2段125號1樓,歇業／撤銷,菸酒零售業
48799449,償鑫投注站,臺北市中山區龍江路358號,核准設立,菸酒零售業
26214610,蘭姐飲酒店,臺北市萬華區華西街17號,核准設立,菸酒零售業
73913171,大江山企業社,臺北市士林區福國路9號1樓,歇業／撤銷,菸酒零售業
38593849,君湛小吃店,臺北市中山區遼寧街185巷7弄15號,核准設立,菸酒零售業
10371120,佳芳清茶館,臺北市萬華區環河南路2段71巷4號,核准設立,菸酒零售業
15646491,祥好食坊,臺北市松山區八德路4段108號2樓,歇業／撤銷,菸酒零售業
48680316,東王茶坊,臺北市萬華區廣州街186巷12號2樓,歇業／撤銷,菸酒零售業
48558820,金世紀視聽社,臺北市中山區松江路185號3樓,核准設立,菸酒零售業
81784761,安堤食品行,臺北市信義區信義路6段76巷2弄69號1樓,歇業／撤銷,菸酒零售業
20664808,弘祥商店,臺北市松山區永吉路278巷42弄5號,歇業／撤銷,菸酒零售業
48673618,橫綱日式火鍋坊,臺北市內湖區成功路4段228號1樓,歇業／撤銷,菸酒零售業
48847385,林家羊肉爐小吃店,臺北市萬華區寶興街129號,廢止,菸酒零售業
14729656,百川洋行,臺北市松山區民權東路3段106巷1號3樓之1,歇業／撤銷,菸酒零售業
25508601,聚富禮品屋,臺北市南港區興華路8號,歇業／撤銷,菸酒零售業
99605543,宗豪撞球運動館,臺北市信義區基隆路1段155號2樓之2,歇業／撤銷,菸酒零售業
77902153,八潮小吃店,臺北市大安區光復南路240巷47號1樓,歇業／撤銷,菸酒零售業
99332760,吉事軒餐坊,臺北市中山區林森北路107巷60號1樓,歇業／撤銷,菸酒零售業
13848417,穩展樂透商號,臺北市中山區吉林路179號1樓,歇業／撤銷,菸酒零售業
99337420,三八二海鮮火y小吃店,臺北市北投區承德路7段382號1樓,歇業／撤銷,菸酒零售業
98886828,橘子工坊,臺北市大安區忠孝東路4段205巷7弄5號,列入廢止中,菸酒零售業
99993348,鑫豐泰食品行,臺北市中山區民族東路410巷2弄6號1樓,核准設立,菸酒零售業
13454124,雙聯食品行,臺北市大同區雙連街11巷11號1樓,歇業／撤銷,菸酒零售業
48728445,嗎哪創義廚,臺北市大安區敦化南路2段81巷45弄21號,核准設立,菸酒零售業
48855477,萬媽媽商店,臺北市內湖區星雲街76號,核准設立,菸酒零售業
94919812,柏騰資訊社,臺北市大同區民生西路138號1樓,歇業／撤銷,菸酒零售業
73901409,錢嫂商行,臺北市萬華區華西街21巷3號1樓,歇業／撤銷,菸酒零售業
15651297,沛發行企業社,臺北市大安區忠孝東路3段303號12樓之1,歇業／撤銷,菸酒零售業
48805673,詠裕企業社,臺北市松山區饒河街126號,遷他縣市,菸酒零售業
26217671,協成商行,臺北市萬華區梧州街46巷8號,核准設立,菸酒零售業
73902879,日之佳軒,臺北市萬華區西園路1段212巷11號1樓,歇業／撤銷,菸酒零售業
20796337,義馨堂香舖,臺北市信義區松山路615巷4號1樓,核准設立,菸酒零售業
17744960,清楓棧軒,臺北市萬華區萬大路192號194號1樓,歇業／撤銷,菸酒零售業
18375084,新展商行,臺北市中山區林森北路100號4樓之1,核准設立,菸酒零售業
99616274,心月小吃店,臺北市信義區信義路4段466號1樓,核准設立,菸酒零售業
31858252,義發餐坊,臺北市中山區天津街56號2樓之61至68,歇業／撤銷,菸酒零售業
26213470,名亨餐廳,臺北市中山區林森北路133巷30號1樓,歇業／撤銷,菸酒零售業
48983487,巧婦安心肉品專賣店,臺北市文山區指南路1段36號,歇業／撤銷,菸酒零售業
13840908,生活圈食品行,臺北市松山區八德路4段604號2樓之8,歇業／撤銷,菸酒零售業
99613966,美味齋商行,臺北市中正區衡陽路16號2樓,歇業／撤銷,菸酒零售業
13830303,泓龍小吃店,臺北市中山區德惠街86號1樓,核准設立,菸酒零售業
48779680,龍旺來洋行,臺北市松山區延吉街7之1號地下室,核准設立,菸酒零售業
21700280,華風行,臺北市松山區南京東路5段200號13樓之2,歇業／撤銷,菸酒零售業
26352922,漫動作咖啡館,臺北市中山區中山北路1段33巷20弄6號,核准設立,菸酒零售業
10385172,大排檔小吃店,臺北市士林區德行東路109巷4號,歇業／撤銷,菸酒零售業
25663217,秀永餐坊,臺北市中山區興安街69號,歇業／撤銷,菸酒零售業
18399993,傑順實業行,臺北市北投區泉源路12號2樓,歇業／撤銷,菸酒零售業
80994487,輕鬆時刻坊,臺北市大安區光復南路308巷49號1樓,歇業／撤銷,菸酒零售業
17749607,築水商行,臺北市中山區錦州街20號2樓,歇業／撤銷,菸酒零售業
98902411,寄情軒,臺北市萬華區梧州街12巷1號地下樓,停業,菸酒零售業
48778726,卡哇咿餐廳,臺北市中山區長安東路1段81號地下,核准設立,菸酒零售業
10321810,迪拉小館,臺北市大安區師大路59巷9號,歇業／撤銷,菸酒零售業
27168348,日式攤食品行,臺北市萬華區漢中街52號地下2樓,遷他縣市,菸酒零售業
48582357,蜜奇餐坊,臺北市中山區中山北路2段65巷24號2樓,歇業／撤銷,菸酒零售業
48746844,王蘭工作室,臺北市中山區建國北路2段96號11樓,歇業／撤銷,菸酒零售業
13454715,上琦小吃店,臺北市松山區復興南路1段31之1號1樓,歇業／撤銷,菸酒零售業
99979633,可堤商行,臺北市大安區敦化南路1段233巷23號1樓,核准設立,菸酒零售業
21714502,吃家食品行,臺北市中山區松江路90巷3之2號1樓,歇業／撤銷,菸酒零售業
48839792,中南美風味餐廳,臺北市大安區敦化南路2段277號地下1樓,廢止,菸酒零售業
14718829,菊芳食坊,臺北市北投區永興路1段50號1樓,核准設立,菸酒零售業
21716092,長堤咖啡店,臺北市中山區龍江路189號1樓,歇業／撤銷,菸酒零售業
83937237,戒子屋商行,臺北市大安區敦化南路1段187巷37號1樓,歇業／撤銷,菸酒零售業
13450204,伊瓦洛複合式餐坊,臺北市中正區臨沂街33巷38號1樓,歇業／撤銷,菸酒零售業
26224027,霖霖餐廳,臺北市中山區林森北路138巷42號2樓,歇業／撤銷,菸酒零售業
13446976,小瑄瑄餐飲屋,臺北市萬華區東園街144號1樓,歇業／撤銷,菸酒零售業
21712173,漫畫駭客小說店,臺北市大同區長安西路140之1號1至3樓,歇業／撤銷,菸酒零售業
15649440,上梅園茶坊,臺北市中正區重慶南路1段5巷1號1樓,歇業／撤銷,菸酒零售業
25558171,天鍋火鍋店,臺北市大安區延吉街117號,核准設立,菸酒零售業
17736835,全華商行,臺北市中山區雙城街19巷14號1樓,歇業／撤銷,菸酒零售業
26352824,農夫之家餐廳,臺北市文山區興隆路2段220巷35號,核准設立,菸酒零售業
98891006,寵物當前生活小舖,臺北市松山區南京東路4段52巷10號1樓,廢止,菸酒零售業
99328436,齊泰洋行,臺北市萬華區昆明街148之1號1樓,核准設立,菸酒零售業
38460524,奇典餐飲企業社,臺北市中正區信陽街31號1樓、2樓,核准設立,菸酒零售業
15823616,杰良雜糧行,臺北市萬華區東園街66巷47號1樓,核准設立,菸酒零售業
14728002,野村日式燒肉店,臺北市中山區農安街55號1樓,歇業／撤銷,菸酒零售業
38471466,高朋海鮮餐廳,臺北市中山區新生北路3段49號1樓,核准設立,菸酒零售業
99616458,鑽石小吃店,臺北市松山區健康路327號1樓,歇業／撤銷,菸酒零售業
26353210,滿意小吃店,臺北市大安區臨江街35號,核准設立,菸酒零售業
01591876,冠京華商行,臺北市松山區南京東路4段133巷4弄1號1樓,核准設立,菸酒零售業
18382395,波斯貓鋼琴酒吧,臺北市中山區民生東路1段29號2樓之2至之5,核准設立,菸酒零售業
48790622,大營商號,臺北市大同區南京西路163號,歇業／撤銷,菸酒零售業
14316374,飯田小吃店,臺北市士林區忠誠路1段91號1樓,歇業／撤銷,菸酒零售業
26351590,長藏酒久菸酒專賣店,臺北市內湖區東湖路43巷16號,核准設立,菸酒零售業
48502544,邱家商行,臺北市內湖區民權東路6段90巷5弄2號1樓,歇業／撤銷,菸酒零售業
26218236,古味小吃店,臺北市北投區大業路278號,停業,菸酒零售業
73874888,寶石之星名店,臺北市中山區中山北路2段65巷7之3號3樓,歇業／撤銷,菸酒零售業
99952557,圓滿名坊,臺北市中山區林森北路575號7樓之4,廢止,菸酒零售業
31963070,朱萬生商行,臺北市士林區德行西路76號,核准設立,菸酒零售業
14340894,伍倫商行,臺北市中山區民權東路1段72號9樓之11,歇業／撤銷,菸酒零售業
98892510,佳酩商號,臺北市南港區研究院路2段39之3號1樓,歇業／撤銷,菸酒零售業
21719247,天堂鳥撞球體育用品社,臺北市中山區北安路655號地下1樓,歇業／撤銷,菸酒零售業
26353555,義采企業社,臺北市北投區永興路1段53巷4號3樓,核准設立,菸酒零售業
07166309,成全商號,臺北市大同區中正路2007號,歇業／撤銷,菸酒零售業
99619482,典藏藝術商行,臺北市中山區長安東路1段8之1號2至4樓,歇業／撤銷,菸酒零售業
38560024,普拉斯行,臺北市松山區南京東路5段52號地下室,核准設立,菸酒零售業
48739338,集億餐坊,臺北市中山區復興北路290號,廢止,菸酒零售業
03163306,介壽號,臺北市中正區忠孝西路1段90號,歇業／撤銷,菸酒零售業
29204480,冰之焱茶舖,臺北市中山區吉林路22巷17號1樓,歇業／撤銷,菸酒零售業
18381874,水谷企業社,臺北市中山區復興北路186號2樓,歇業／撤銷,菸酒零售業
73904031,親之閣軒,臺北市萬華區廣州街186巷6號1樓,歇業／撤銷,菸酒零售業
26243636,香村重慶小吃店,臺北市士林區重慶北路4段154號〈1樓〉,歇業／撤銷,菸酒零售業
17745052,文文軒,臺北市萬華區華西街30巷1號1樓,歇業／撤銷,菸酒零售業
13845087,哈酒族商行,臺北市萬華區長沙街2段54號1樓,歇業／撤銷,菸酒零售業
26257244,放羊咖啡,臺北市信義區永吉路120巷45號1樓,歇業／撤銷,菸酒零售業
48793732,大獎投注站,臺北市文山區興隆路3段124號1樓,歇業／撤銷,菸酒零售業
80981547,世間情小吃坊,臺北市中山區中山北路1段83巷9之1號1樓,歇業／撤銷,菸酒零售業
15890614,常來小吃店,臺北市萬華區三水街106巷6號1樓,核准設立,菸酒零售業
18401843,登峰造極撞球場,臺北市中山區中山北路3段32號地下樓,歇業／撤銷,菸酒零售業
31868499,芝嵐餐廳,臺北市中山區林森北路145巷36號,歇業／撤銷,菸酒零售業
48535502,潮騷創意料理坊,臺北市松山區光復北路34號1樓,歇業／撤銷,菸酒零售業
