03263006,昇源水電行,臺北市中正區金山南路1段110巷20號1樓,電器批發業
26350895,有財專業電池企業行,臺北市大同區環河北路二段23號,電器批發業
21533018,東瓏電機工程行,臺北市士林區葫蘆街122號1樓,電器批發業
38562199,納米社,臺北市中山區八德路2段288號1樓,電器批發業
48863700,億昌電器工程行,臺北市中山區吉林路168巷4號,電器批發業
01162468,榮豐企業社,臺北市大同區迪化街1段338號,電器批發業
38473056,聚鑫工程行,臺北市中正區北平東路20號3樓,電器批發業
31870805,米哇企業社,臺北市信義區永吉路170號12樓,電器批發業
26253562,鑫漾美妝企業社,臺北市內湖區東湖路106巷8號3樓,電器批發業
38508739,宇鑫工程行,臺北市大同區承德路2段155巷7號,電器批發業
38497607,暐創工程行,臺北市內湖區康寧路3段56巷1號10樓之2,電器批發業
48728281,冠倫企業社,臺北市士林區福國路45號3樓,電器批發業
34468969,長城水電行,臺北市中山區吉林路154巷14號,電器批發業
48823285,友鼎機電行,臺北市松山區南京東路5段230號15樓之8,電器批發業
38578397,鹿米工作室,臺北市信義區忠孝東路5段412號13樓之4,電器批發業
31952307,水姑娘頭毛店,臺北市信義區嘉興街66號1樓,電器批發業
31874422,闊喜工房,臺北市信義區基隆路2段22號6樓之6,電器批發業
98882457,承洋商行,臺北市北投區致遠一路2段30號1樓,電器批發業
31709943,京站支付企業社,臺北市中山區松江路207號9樓,電器批發業
99983897,鎂利固冷氣行,臺北市信義區虎林街30巷32號1樓,電器批發業
78070656,信毅水電行,臺北市大安區和平東路2段107巷4之1號1樓,電器批發業
25668796,兒童園圖書社,臺北市信義區吳興街583巷151號3樓,電器批發業
45376522,禾亦富企業社,臺北市中山區民生東路2段83號4樓之29,電器批發業
99351512,騰笙水電企業社,臺北市文山區興隆路3段181巷3弄1號,電器批發業
09644691,禾力實業社,臺北市信義區基隆路1段155號13樓之5,電器批發業
77511141,三悅國際企業社,臺北市大同區承德路3段35號1樓,電器批發業
10367961,耐震工程行,臺北市松山區八德路4段602號11樓之6,電器批發業
17550056,精選企業社,臺北市松山區民族東路671號2樓,電器批發業
77923235,吉銳企業社,臺北市士林區後港街161號3樓之2,電器批發業
48751108,立正企業社,臺北市文山區興隆路1段163號,電器批發業
25582496,豆粒通信行,臺北市信義區莊敬路357號,電器批發業
10646423,鐠洛科技商行,臺北市中山區八德路2段68號,電器批發業
26510909,泳灃企業社,臺北市士林區葫蘆街130號1樓,電器批發業
10528122,?洋家電精品行,臺北市中山區民權東路3段21號5樓,電器批發業
38562276,格那斯企業社,臺北市中山區錦州街46號9樓之1,電器批發業
48776234,維安實業社,臺北市中山區新生北路2段76巷10號1樓,電器批發業
14324493,奇亞家具行,臺北市文山區景興路195號10樓之1,電器批發業
10347564,德成企業行,臺北市萬華區廣州街81巷14號,電器批發業
18259183,佛光聯合醫療企業管理顧問社,臺北市大安區基隆路2段226號,電器批發業
26251419,業欣冷氣行,臺北市萬華區德昌街147巷1號4樓,電器批發業
48766799,昱融工程企業行,臺北市中正區忠孝東路2段120號4樓,電器批發業
48822808,一成工程行,臺北市大同區保安街49巷24號,電器批發業
48967584,柏帝工程行,臺北市文山區興隆路3段32號,電器批發業
38462071,達育企業社,臺北市中山區興安街51之8號1樓,電器批發業
81750299,鑫旺電器行,臺北市北投區致遠一路1段118號1樓,電器批發業
30293860,富昇工程行,臺北市士林區通河西街2段146號3樓,電器批發業
48954906,耕圃工程行,臺北市中山區民權東路2段26號6樓之1,電器批發業
31954826,東津甫企業社,臺北市內湖區大湖街137號,電器批發業
90921554,承鈞工程行,臺北市萬華區東園街66巷53弄8號,電器批發業
31949015,順上通訊社,臺北市文山區木新路3段129號,電器批發業
31442109,酷鎷企業工作坊,臺北市中正區北平東路24號2樓之5,電器批發業
13837761,廣承企業行,臺北市中正區羅斯福路3段210巷8弄7之12號,電器批發業
01237849,雅美家具飾品店,臺北市松山區民生東路3段113巷33號1樓,電器批發業
48755168,建元冷材行,臺北市北投區致遠一路2段50號1樓,電器批發業
25556125,九久商號,臺北市大安區永康街41巷26號,電器批發業
31871895,承鴻企業社,臺北市信義區光復南路495號,電器批發業
15659376,秋葉原攝影器材專賣店,臺北市中正區漢口街1段59號1樓,電器批發業
10372628,舒展企業社,臺北市內湖區文德路171巷3弄17號,電器批發業
38514562,青果園鮮萃飲品企業社,臺北市大安區和平東路1段159之2號,電器批發業
14715371,元陞企業行,臺北市松山區八德路3段99巷9之2號3樓,電器批發業
30303683,史丹佛魔髮美學企業社,臺北市松山區復興北路145號2樓,電器批發業
01726305,欣欣美材精品店,臺北市北投區石牌路2段68巷1號,電器批發業
09959333,熙葆企業行,臺北市大安區辛亥路2段121號2樓,電器批發業
26251537,加菲工程行,臺北市信義區莊敬路289巷8弄30號3樓,電器批發業
81623013,嘉元工程行,臺北市文山區木新路3段50巷8號1樓,電器批發業
25573807,有情水電行,臺北市大安區大安路1段51巷11號2樓,電器批發業
19510361,加勒比企業社,臺北市北投區育仁路119巷13號1樓,電器批發業
42269892,千岳工程行,臺北市萬華區萬青街195號2樓,電器批發業
25574257,佳隆水電工程行,臺北市文山區辛亥路4段166巷17號,電器批發業
10352334,宏洋工程行,臺北市北投區豐年路2段76號,電器批發業
38512543,精英水電工程行,臺北市萬華區臺北市萬華區青年路30巷4號11樓之4,電器批發業
10351567,業勤企業社,臺北市南港區興中路12巷19號10樓,電器批發業
73891211,尚鼎企業社,臺北市南港區忠孝東路6段320號4樓,電器批發業
31960284,唐榮百業企業社,臺北市中正區中山北路1段2號7樓之6,電器批發業
26354597,?燊工程行,臺北市文山區興隆路1段70巷11弄9號,電器批發業
38572561,大員空調冷氣工程行,臺北市南港區興中路80巷12號3樓,電器批發業
48852204,晞臘室內裝修設計工作室,臺北市內湖區陽光街92巷24弄17號,電器批發業
99983171,佳蒂企業社,臺北市文山區興隆路1段251巷6號1樓,電器批發業
26371012,惠淳工程行,臺北市萬華區西昌街96號,電器批發業
38508082,勝群工程行,臺北市大同區鄭州路119號2樓之3,電器批發業
10626658,夢想家興業社,臺北市中山區長春路202號1樓,電器批發業
31877589,伸通企業社,臺北市中正區新生南路1段6號地下1樓之6,電器批發業
48760970,這虎音樂工作室,臺北市南港區忠孝東路6段83號3樓,電器批發業
17766582,盧森堡企業社,臺北市萬華區桂林路143號11樓,電器批發業
78413800,大地工程行,臺北市中山區中山北路2段128巷3之3號(1樓),電器批發業
17091270,台茂力照明行,臺北市萬華區寶興街162號1樓,電器批發業
48921672,健恆電器工程行,臺北市松山區南京東路5段23巷9弄2號,電器批發業
29200870,世紀企業社,臺北市中正區漢口街1段31號4樓,電器批發業
25551162,銀侖企業社,臺北市大同區昌吉街69號4樓,電器批發業
83930451,以琳國際洋行,臺北市士林區中山北路6段474號1樓,電器批發業
01290371,一一大台北企業行,臺北市中山區新生北路2段72巷17號2樓之1,電器批發業
31866443,橙語空間設計工作室,臺北市大安區忠孝東路4段303號9樓,電器批發業
38496706,湧盛水電工程行,臺北市中山區南京東路3段189號4樓,電器批發業
48879409,利威工程行,臺北市中正區泉州街43號,電器批發業
25685113,優福全方位商行,臺北市中山區新生北路2段40號14樓之2,電器批發業
38474409,丞暘五金商行,臺北市內湖區內湖路2段339巷6號,電器批發業
10344237,和喬企業社,臺北市南港區新民街73號,電器批發業
38464649,兆生科技商行第一分店,臺北市中正區市民大道3段8號3樓61號店鋪,電器批發業
25560227,一二一企業社,臺北市萬華區興寧街66巷2號1樓,電器批發業
73910408,百晟自動化企業社,臺北市文山區指南路3段73號5樓之1,電器批發業
21764220,富騰企業社,臺北市中山區松江路160巷2號1樓,電器批發業
48797168,大仕林實業社,臺北市大同區庫倫街27號,電器批發業
98888847,瑞暉水電工程行,臺北市文山區景興路188號23樓之6,電器批發業
10352101,金萬億企業行,臺北市萬華區環河南路1段185號,電器批發業
25517876,迦蓮國際商行,臺北市大同區酒泉街159號1樓,電器批發業
11324625,明利電器行,臺北市中山區林森北路342號1樓,電器批發業
81680718,元邦興業社,臺北市萬華區西園路2段261巷12弄13號1樓,電器批發業
25573089,建成工程行,臺北市萬華區西藏路165號2樓,電器批發業
31873789,安豐電控技術工作室,臺北市內湖區瑞光路580號7樓,電器批發業
26218974,富鈞水電行,臺北市大同區重慶北路3段69號,電器批發業
25512529,春禾企業社,臺北市大同區民族西路67號,電器批發業
48880200,萬事通商行,臺北市士林區美德街74號,電器批發業
26373216,明峰通信企業社,臺北市南港區重陽路166巷8號,電器批發業
99957259,光成實業社,臺北市文山區辛亥路7段84巷14號2樓,電器批發業
27193579,立任燈光音響工程行,臺北市內湖區金龍路198號1樓,電器批發業
31448011,欣嬅企業社,臺北市內湖區文德路90巷34號7樓之2,電器批發業
38567455,全億工程行,臺北市信義區松山路256號8樓,電器批發業
26254859,科炬裝潢工程行,臺北市萬華區萬大路171號5樓,電器批發業
04892876,松發登山體育用品社,臺北市文山區興隆路3段62號,電器批發業
38499247,穩宏通訊行,臺北市萬華區西寧南路36之48號,電器批發業
38566603,木新數位通訊行,臺北市文山區木新路3段105號1樓,電器批發業
31878807,信成通訊社,臺北市南港區中坡南路37號,電器批發業
26232981,萱柏商行,臺北市大安區仁愛路4段266巷15弄16號2樓,電器批發業
25545578,鴻海工程行,臺北市南港區福德街339巷1弄10號2樓,電器批發業
26243360,少華洋行,臺北市大安區麗水街9巷13號,電器批發業
26215723,芃芃玩具店,臺北市大同區太原路100號1樓,電器批發業
25552346,金品工程行,臺北市大同區興城街35號,電器批發業
38496993,崴視吉音響企業社,臺北市萬華區西寧南路4號(臺北市公有西寧市場1樓1143、1144號攤位),電器批發業
31696291,摩爾通訊行,臺北市文山區羅斯福路6段222巷28號,電器批發業
26219495,國政企業社,臺北市士林區社子街125巷22號1樓,電器批發業
38575292,華麗空間設計社,臺北市松山區民生東路5段204號2樓之2,電器批發業
31860285,籟德商號,臺北市內湖區內湖路1段691巷7號,電器批發業
13786926,禹丞企業社,臺北市萬華區和平西路3段29號1樓,電器批發業
18088169,孟億電器行,臺北市中正區同安街101巷20之1號1樓,電器批發業
48558912,愛莉娜設計工作室,臺北市大同區延平北路2段62號3樓,電器批發業
83946242,鴻賀行,臺北市松山區民族東路733之1號1樓,電器批發業
78413800,大地工程行,臺北市中山區中山北路2段128巷3之3號(1樓),電器批發業
31709943,京站支付企業社,臺北市中山區松江路207號9樓,電器批發業
38508999,英捷百貨商行,臺北市中山區中山北路1段33巷3號2樓,電器批發業
83920003,冠富廚衛裝璜行,臺北市北投區承德路7段106巷5號2樓,電器批發業
26248359,鼎興行,臺北市文山區羅斯福路5段95號2樓,電器批發業
26358735,楊其聰工作室,臺北市士林區延平北路7段27巷12號2樓,電器批發業
48887055,上立企業社,臺北市士林區通河西街2段109號1樓,電器批發業
48936106,榮進水電行,臺北市中正區新生南路1段54巷11號,電器批發業
09701897,伍義工程行,臺北市內湖區東湖路106巷7弄5號4樓,電器批發業
14737327,財健企業社,臺北市中山區中山北路2段128巷6弄5號4樓,電器批發業
25508341,卑爾工作室,臺北市南港區八德路4段871號15樓之6,電器批發業
34769085,利基行銷價值鏈整合顧問室,臺北市松山區南京東路5段63號7樓之2,電器批發業
13519365,帛格圖文社,臺北市大安區復興南路2段157號4樓之4,電器批發業
26218989,日元商行,臺北市南港區八德路4段917號,電器批發業
29630007,花盛發商號,臺北市士林區大北路73號1樓,電器批發業
48672955,凡玉曲商行,臺北市中山區遼寧街63巷30號地下室,電器批發業
30128790,綠光行,臺北市大安區復興南路2段27號5樓之4,電器批發業
25577944,崴鴻科技企業社,臺北市文山區興隆路2段220巷65弄31之2號,電器批發業
30185736,冠允企業社,臺北市文山區辛亥路7段51號,電器批發業
42269204,呈靖實業社,臺北市士林區社中街156巷28號,電器批發業
48982261,吉碼企業社,臺北市中山區民生東路3段27號2樓,電器批發業
01283625,信佳企業社,臺北市萬華區西園路2段261巷14之1號1樓,電器批發業
31873578,新華國企業社,臺北市文山區富山路1巷16號4樓,電器批發業
49993907,權舜企業社,臺北市大同區民權西路136號7樓之11,電器批發業
17042010,立昌冷氣工程行,臺北市內湖區文德路210巷30弄31號1樓,電器批發業
17844855,亨瑀洋行,臺北市中山區錦州街25號5樓,電器批發業
13837761,廣承企業行,臺北市中正區羅斯福路3段210巷8弄7之12號,電器批發業
26209829,佳和國際社,臺北市大安區羅斯福路3段187號,電器批發業
99853613,邰渼企業社,臺北市大同區延平北路4段282巷19弄3號1樓,電器批發業
13467303,景久工程行,臺北市文山區三福街4巷17號,電器批發業
38562466,威騰企業社,臺北市大安區信義路2段72號地下,電器批發業
38463395,裕雄企業社,臺北市內湖區新明路380巷6弄7號2樓,電器批發業
42270048,海神堡音響,臺北市中山區民生東路3段57號2樓之1,電器批發業
10067113,廣明水電工程行,臺北市南港區研究院路2段35巷23弄12號3樓,電器批發業
99456699,富利商行,臺北市文山區興隆路2段196號7樓之3,電器批發業
31873768,中野商行,臺北市士林區忠義街71巷13弄7號地下,電器批發業
31948331,全勝企業社,臺北市文山區興隆路4段89號,電器批發業
48751944,大昌行,臺北市中山區民生東路1段30號地下,電器批發業
31580171,鑫采工程行,臺北市萬華區昆明街201巷8號1樓,電器批發業
99619835,飛瑞企業行,臺北市大同區迪化街2段172巷15號,電器批發業
31258010,隆進實業社,臺北市大同區承德路3段214巷10號,電器批發業
26230386,東林工程行,臺北市北投區吉利街123巷18號2樓,電器批發業
26257194,常勝水電材料行,臺北市大同區大龍街58號,電器批發業
17742604,立榮音響電器行,臺北市北投區尊賢街246號1樓,電器批發業
14741201,緯林水電行,臺北市內湖區康樂街72巷17弄19之1號,電器批發業
01131515,昆成工具行,臺北市大同區哈密街59巷38弄31號3樓,電器批發業
48749960,廖子豪設計工作室,臺北市大安區仁愛路4段125號9樓之1,電器批發業
38496071,安妙膠囊咖啡企業社,臺北市信義區吳興街118巷26弄18號1樓,電器批發業
48806265,神川實業社,臺北市文山區木新路3段74巷1弄6號,電器批發業
42270173,職人咖啡商行,臺北市內湖區新湖一路128巷15號,電器批發業
38508105,偉泰工程行,臺北市中正區博愛路36號地下,電器批發業
37942496,格凌企業社,臺北市中正區汀州路2段230號,電器批發業
31877820,漢霖行,臺北市信義區嘉興街265號,電器批發業
26223224,依心電子材料企業社,臺北市中正區金門街52號,電器批發業
31952637,永翔資訊傢俱企業社,臺北市北投區自強街5巷100弄3之1號3樓,電器批發業
17751407,深澤工程行,臺北市中山區民權東路1段72號11樓之2,電器批發業
25667874,天威工程行,臺北市松山區光復北路157號1樓,電器批發業
26237992,木匠實業社,臺北市萬華區莒光路153巷4號1樓,電器批發業
48954075,泰生工程企業社,臺北市松山區八德路3段182號6樓,電器批發業
31724830,久亨國際企業社,臺北市信義區忠孝東路5段474號4樓,電器批發業
37906626,新明修車業,臺北市大同區長安西路66號4樓之2,電器批發業
38474294,宏洋貿易商行,臺北市大安區復興南路2段111巷17弄7號2樓,電器批發業
15665089,威誠企業行,臺北市中正區羅斯福路3段210巷8弄7之12號1樓,電器批發業
26247871,大安科技行,臺北市信義區和平東路3段325號,電器批發業
26247128,弘展工作室,臺北市松山區八德路4段389巷9號,電器批發業
25541566,滿鑫行,臺北市中山區吉林路299巷7號,電器批發業
31842626,右腦音樂工作室,臺北市中山區林森北路260號3樓,電器批發業
99344891,東雅小廚館,臺北市大安區濟南路3段7之1號1樓,電器批發業
10332393,永大資訊社,臺北市士林區通河西街1段22號,電器批發業
38560158,宏昌水電行,臺北市內湖區永保街136號4樓,電器批發業
25560486,明川工程行,臺北市大同區長安西路97號,電器批發業
25573320,康德電器行,臺北市士林區延平北路6段45號,電器批發業
04882194,協真動力工程行,臺北市文山區興隆路1段70巷11弄7號1樓,電器批發業
18093472,全億企業社,臺北市內湖區民權東路6段47巷10弄12號2樓,電器批發業
26206196,和勝工程行,臺北市南港區南港路2段27號,電器批發業
17747050,統將商行,臺北市大安區溫州街74巷12號,電器批發業
48868212,弘瑋工程行,臺北市中正區水源路131之3號,電器批發業
04777448,金鼎冷凍社,臺北市南港區南港路2段136號1樓,電器批發業
20909613,明益實業社,臺北市松山區八德路4段245巷52弄40號,電器批發業
26356531,傑聖服裝行,臺北市萬華區西園路1段203巷4之1號,電器批發業
31870158,經宇實業社,臺北市中正區西藏路114號,電器批發業
48674433,安娜日用品商行,臺北市中山區民權西路20號9樓之5,電器批發業
25580321,立硐鷎僭茼,臺北市萬華區洛陽街9之5號,電器批發業
48728091,松廉工程行,臺北市內湖區成功路4段324巷1弄1號1樓,電器批發業
26233193,福鑫企業社,臺北市松山區民族東路689號,電器批發業
18088800,松下數位生活館,臺北市中正區羅斯福路3段100號8樓之13,電器批發業
26228804,大金冷氣材料行,臺北市文山區辛亥路7段51號,電器批發業
25580791,大中華通訊行,臺北市大安區通化街110號,電器批發業
31847122,晨堡工程行,臺北市大安區臥龍街195巷25號,電器批發業
04775722,勝隆水電行,臺北市內湖區金龍路53號1樓,電器批發業
26366051,全興國際商行,臺北市文山區福興路82巷6弄10號,電器批發業
17737790,泉峰工程行,臺北市信義區永吉路127巷17號1樓,電器批發業
14716028,宜和通訊企業社,臺北市中山區林森北路410之2號,電器批發業
48733756,榮營工程行,臺北市南港區東新街118巷77號3樓,電器批發業
26344178,巨禾興行,臺北市大同區重慶北路3段252巷1號3樓,電器批發業
30192650,奇蹟企業社,臺北市信義區忠孝東路5段510號15樓,電器批發業
31956417,廣成冷凍零件行,臺北市士林區葫蘆街70巷15號3樓,電器批發業
48582407,永勝工程行,臺北市內湖區內湖路3段60巷50弄6號,電器批發業
30179946,鴻墨水耗材專賣店,臺北市信義區基隆路2段185號,電器批發業
48747148,翔安商行,臺北市萬華區環河南路3段101號5樓之2,電器批發業
49891438,聖賀企業社,臺北市萬華區梧州街60巷11號3樓,電器批發業
15641480,騏詮商行,臺北市南港區興中路28巷4號,電器批發業
48501502,新典企業社,臺北市中山區民生東路2段147巷5弄19號1樓,電器批發業
26256456,展盟國際商行,臺北市信義區松山路482巷32號8樓,電器批發業
34757362,均盈企業社,臺北市大同區華陰街227巷7號,電器批發業
21527347,東展工程行,臺北市南港區南港路3段80巷29號,電器批發業
25540222,彩瑞生活館,臺北市中山區民權東路2段135巷20弄12號,電器批發業
10646423,鐠洛科技商行,臺北市北投區光明路170號1樓,電器批發業
48770442,崴通儀器行,臺北市大安區和平東路3段308巷68號,電器批發業
48908158,東宸企業社,臺北市信義區基隆路1段186號3樓之7,電器批發業
26246654,久康科技工程行,臺北市大安區忠孝東路4段169號11樓之1,電器批發業
48776993,茂茂森林創意行銷工作室,臺北市大安區復興南路1段127號16樓之1,電器批發業
66995582,豪華水電工程行,臺北市大同區南京西路452號4樓,電器批發業
30293860,富昇工程行,臺北市士林區通河西街2段146號3樓,電器批發業
26359426,重輝水電行,臺北市士林區延平北路8段2巷153弄臨9號,電器批發業
31858859,光音工作室,臺北市信義區忠孝東路5段410號地下之4,電器批發業
38456774,新益冷氣行,臺北市北投區尊賢街302巷21號1樓,電器批發業
99993781,佑?影像工作室,臺北市內湖區民權東路6段23號4樓之3,電器批發業
38571177,品浩企業社,臺北市松山區八德路4段445號7樓之6,電器批發業
10397043,品萬企業社,臺北市中山區民權東路2段39號,電器批發業
26249152,得盛機電工程行,臺北市大同區延平北路4段70號1樓,電器批發業
37851657,運達通企業商行,臺北市中正區衡陽路10號12樓,電器批發業
41807303,澄品烘焙屋,臺北市士林區承德路4段80巷52號,電器批發業
38508127,明星汽車商行,臺北市中山區南京東路2段71號8樓之2,電器批發業
66995582,豪華水電行,臺北市大同區南京西路452號4樓,電器批發業
07720927,慶安水電行,臺北市中山區農安街66號1樓,電器批發業
38576763,江南貿易行,臺北市中山區興安街42號,電器批發業
38563943,建民數位企業社,臺北市中正區市民大道3段8號光華數位新天地商場3樓31號店鋪,電器批發業
21765229,栯慈商行,臺北市中山區民生東路3段1號3樓,電器批發業
25584001,諦孚國際流通商號,臺北市大安區忠孝東路3段251巷3弄18之3號,電器批發業
41019910,富海工程行,臺北市信義區虎林街57之21號1樓,電器批發業
13450393,葛瑞斯國際商行,臺北市大安區仁愛路3段24巷1弄4號1樓,電器批發業
26245796,新錡音響行,臺北市萬華區中華路1段20號,電器批發業
38467478,振鈺工程行,臺北市萬華區福星里西寧南路11號7樓之2,電器批發業
26242502,超越科技行,臺北市內湖區文德路1號,電器批發業
10609497,盛穎企業社,臺北市大同區民權西路236號2樓,電器批發業
83947559,日進水電行,臺北市中山區新生北路1段78號9樓之2,電器批發業
31856796,立豐室內裝修工程行,臺北市文山區新光路1段134號,電器批發業
37851657,運達通企業商行,臺北市中正區衡陽路10號12樓,電器批發業
31846685,米黎時尚生活會館,臺北市信義區基隆路1段149號,電器批發業
38502952,雯浩商號,臺北市南港區興中路12巷9號,電器批發業
25666896,蔬活企業社,臺北市文山區景文街42號5樓,電器批發業
78329178,一久捲門行,臺北市大同區延平北路2段242號3樓之3,電器批發業
25552774,阿嚕咪電器行,臺北市中正區漢口街1段136號1樓,電器批發業
38474581,萬固工程行,臺北市信義區忠孝東路5段786號6樓,電器批發業
04829184,百松教學用品社,臺北市信義區基隆路2段22號6樓之6,電器批發業
09680128,達誠通訊行,臺北市中山區長春路186號1樓,電器批發業
38497439,御淳空調行,臺北市南港區重陽路504巷2號(1樓),電器批發業
38514182,孚懋實業社,臺北市南港區東明街94號1樓,電器批發業
04911424,大宇文具影印行,臺北市文山區羅斯福路6段102號,電器批發業
99447313,建華空調工程行,臺北市大同區民權西路245巷8號1樓,電器批發業
48926249,璟瑞商行,臺北市北投區石牌路1段62號,電器批發業
31873872,磐石工程行,臺北市內湖區東湖路106巷7弄23號4樓,電器批發業
31871641,一嘉空調工程行,臺北市南港區市民大道8段532號,電器批發業
48799530,瑋爵通訊行,臺北市中正區忠孝西路1段72號1樓之24,電器批發業
13441563,豐群行,臺北市信義區光復南路505號10樓之8,電器批發業
81714442,佳晉水電材料行,臺北市南港區南港路1段79號1樓,電器批發業
38574076,修易士電器行,臺北市大安區臨江街25號6樓之1,電器批發業
10321184,捷創貿易行,臺北市松山區八德路3段12巷17弄21號,電器批發業
38501139,力美企業社,臺北市南港區向陽路120巷2弄34號3樓,電器批發業
31858990,美樂家商行,臺北市北投區中央南路1段154號,電器批發業
38510138,展毅通信資訊社,臺北市松山區八德路4段44號(2樓),電器批發業
08654869,易禾工程行,臺北市中山區敬業三路162巷178號8樓,電器批發業
48947455,鴻宇資訊企業社,臺北市中正區新生南路1段16號13樓之2,電器批發業
