25669401,品屋企業社,臺北市萬華區西園路2段261巷20弄32號,電器批發業
29230678,新震憲企業社,臺北市士林區永平街20巷11弄5號1樓,電器批發業
26342615,景瀚實業社,臺北市士林區德行東路90巷19號,電器批發業
26369584,?野通訊器材行,臺北市文山區景興路179號1樓,電器批發業
38555079,常虹國際企業社,臺北市信義區永吉路30巷151弄13號4樓,電器批發業
26251375,越峰工程行,臺北市中山區渭水路54號,電器批發業
30298197,建達國際企業社,臺北市北投區石牌路1段8號1樓,電器批發業
30290131,蕙成企業社,臺北市中山區新生北路3段1號3樓之21,電器批發業
31876131,廣福國際研發企業社,臺北市信義區基隆路1段35巷7弄8號4樓,電器批發業
05153601,信忠實業社,臺北市中正區惠安街17號1樓,電器批發業
80998266,三禾五金百貨店,臺北市松山區饒河街247號1樓,電器批發業
99613419,采瑄美材精品店,臺北市士林區大東路86之5號1樓,電器批發業
26360824,台亞美行,臺北市中正區重慶南路3段1之3號,電器批發業
26357932,宥笙企業社,臺北市中正區漢口街1段140號1樓,電器批發業
48841426,正麟企業社,臺北市文山區興隆路2段244巷10號,電器批發業
48559145,福星大商店,臺北市北投區中和街258號1樓,電器批發業
38497199,堉信水電行,臺北市內湖區文德路22巷44弄8號,電器批發業
26232928,金享企業社,臺北市文山區景華街32號2樓,電器批發業
38467322,成妍工作室,臺北市松山區光復北路230巷53號4樓,電器批發業
26345649,九緯工務社,臺北市萬華區開封街2段10號,電器批發業
15644682,聯鑫企業社,臺北市士林區德行東路155號,電器批發業
42279929,恩雨實業社,臺北市南港區忠孝東路6段70巷24號1樓,電器批發業
26373047,星榮電料五金行,臺北市大同區承德路3段8巷18號4樓,電器批發業
38580106,及第貿易商行,臺北市中山區中山北路2段85巷15號,電器批發業
26247725,吉祥企業社,臺北市松山區健康路190號1樓,電器批發業
38571182,禾峰企業社,臺北市文山區指南路2段45巷4弄11號4樓,電器批發業
25541833,歐保企業社,臺北市大同區延平北路1段69巷30號,電器批發業
26763729,大不同通訊行,臺北市中正區羅斯福路4段74之1號,電器批發業
09699604,標榜企業社,臺北市大安區忠孝東路4段147巷1號9樓,電器批發業
26233026,通榮企業社,臺北市中正區市民大道3段8號4樓光華數位新天地商場30號31號店舖,電器批發業
17262822,全音域設計企業社,臺北市中山區南京東路3段89巷6號4樓,電器批發業
17269851,冠榮企業社,臺北市中山區民生東路2段34號1至3樓,電器批發業
10359202,杰果音樂工作室,臺北市大安區忠孝東路4段325號12樓之1,電器批發業
38562536,合鑫企業社,臺北市信義區松德路65號11樓之1,電器批發業
87773039,雅家油漆工程行,臺北市內湖區金湖路46巷15號,電器批發業
98783225,國俊工程行,臺北市萬華區萬大路84巷9號5樓,電器批發業
25664010,澄品水電企業社,臺北市信義區虎林街164巷60弄21號,電器批發業
30307251,威名通訊行,臺北市內湖區成功路3段93號,電器批發業
17529723,金勝水電材料行,臺北市松山區民生東路5段260巷24號1樓,電器批發業
48958071,明耀水電冷氣工程行,臺北市中正區濟南路2段31之23號,電器批發業
26373026,利樂屋企業社,臺北市內湖區文德路22巷24號,電器批發業
10319440,首益飾品,臺北市中山區松江路133巷6號,電器批發業
04892947,廚友企業行,臺北市文山區羅斯福路5段236巷5之9號1樓,電器批發業
25554463,紘華工程行,臺北市北投區中央北路4段142巷2之1號2樓,電器批發業
21730876,明昌文化事業行,臺北市南港區中坡北路50巷10號1樓,電器批發業
01680119,旭日工程行,臺北市北投區大同街343號,電器批發業
17743940,王維水電冷氣工程行,臺北市大同區重慶北路3段152巷12號1樓,電器批發業
48812436,承泓機電工程行,臺北市中山區新生北路3段61號4樓之1,電器批發業
48855791,傳景水電工程行,臺北市士林區延平北路7段106巷23號1樓,電器批發業
25556552,歐納企業社,臺北市大同區延平北路2段154號,電器批發業
21716712,景傑利企業社,臺北市松山區八德路3段106巷56號1樓,電器批發業
13848211,天揚衛生工程行,臺北市文山區忠順街2段100號6樓,電器批發業
10391619,鑫茂企業社,臺北市內湖區成功路4段61巷25弄5號,電器批發業
38572400,陳亞孚空間設計工作室,臺北市南港區園區街58巷3號9樓,電器批發業
48999663,豪泉淨水設備商行,臺北市內湖區五分街62號2樓,電器批發業
01192765,連文餐飲家餐具行,臺北市中山區吉林路174巷11號1樓,電器批發業
15885871,水木商行,臺北市中山區敬業一路36巷5號,電器批發業
25577281,冠泉工程行,臺北市文山區福興路4巷5號2樓,電器批發業
17092783,仁昱行,臺北市大安區和平東路1段8號7樓,電器批發業
02363457,駿宏企業社,臺北市信義區忠孝東路5段1之10號11樓,電器批發業
25503140,柏敘企業社,臺北市中正區中華路1段59號7樓,電器批發業
26187775,向騰企業社,臺北市內湖區瑞湖街103號3樓,電器批發業
14317107,亞森行,臺北市中山區長安東路1段28號,電器批發業
