42270217,億輝冷氣工程行,臺北市南港區中南街74巷18號4樓,電器批發業
17818343,貿順工程行,臺北市萬華區萬大路550號2樓,電器批發業
15632052,舜發石材工程行,臺北市信義區基隆路1段155號8樓之8,電器批發業
25567919,鑫聯高爾夫用品社,臺北市中山區吉林路389號1樓,電器批發業
26249245,芮娜藝術美甲商行,臺北市中山區松江路362巷7號1樓,電器批發業
04466845,宏原行,臺北市中正區齊東街82巷36號1樓,電器批發業
48738289,橙衣衫舖,臺北市信義區基隆路1段155號12樓,電器批發業
81769924,長龍實業行,臺北市大同區重慶北路2段188號5樓,電器批發業
38559672,德陞監視科技行,臺北市萬華區中華路1段22號,電器批發業
14654888,音揚舞台硬體整合行銷企業社,臺北市中正區中華路2段305巷13號,電器批發業
14872688,億倡工程行,臺北市中山區南京東路1段2號6樓之5,電器批發業
25564693,翔豐水電工程行,臺北市南港區研究院路3段16巷5號1樓,電器批發業
26352628,悅心生活坊,臺北市松山區南京東路4段197號11樓之1,電器批發業
15773340,弘電工程行,臺北市信義區永吉路491巷9弄20號,電器批發業
26234741,中元電器行,臺北市萬華區長順街107巷16號,電器批發業
38570472,葉欣寧運動實業社,臺北市中山區農安街208號,電器批發業
31862679,新成電器行,臺北市北投區中央北路2段39號,電器批發業
98885102,文新汽車百貨行,臺北市大同區重慶北路3段257巷12號1樓,電器批發業
17760089,祺祿水電工程行,臺北市大同區大龍街159巷12號1樓,電器批發業
29243955,先進企業社,臺北市信義區永吉路278巷2弄16號2樓,電器批發業
26211917,韋澄企業社,臺北市萬華區艋舺大道120巷38弄41號,電器批發業
25572379,冠榮大商店,臺北市南港區興中路28巷4號1樓,電器批發業
48942901,?恩企業社,臺北市內湖區新明路460巷18弄9號,電器批發業
17542916,力基水電冷氣行,臺北市大安區樂業街42號7樓,電器批發業
15901289,正泰日用品百貨行,臺北市萬華區莒光路181號1樓,電器批發業
73889138,翔宏行,臺北市大安區敦化南路1段337號11樓,電器批發業
48963736,緒沅商行,臺北市大同區民權西路144巷5弄7號11樓之1,電器批發業
48943211,源準商號,臺北市內湖區康寧路1段86巷1弄6號2樓,電器批發業
31965513,鴻?企業社,臺北市萬華區大理街157號,電器批發業
18390114,宏碩企業社,臺北市文山區辛亥路4段101巷74號,電器批發業
99988350,頂盛音響企業社,臺北市萬華區中華路1段18巷31號,電器批發業
48754457,巨?水電行,臺北市中山區農安街227巷3弄22之1號,電器批發業
26217449,建宏維修工作室,臺北市大同區南京西路107巷48號,電器批發業
31859365,奕辰企業社,臺北市萬華區西園路2段320巷36弄6號5樓,電器批發業
38512001,翃緯通訊行,臺北市中山區長春路217號,電器批發業
25542798,功成通訊行,臺北市大安區延吉街122號1樓,電器批發業
15632102,東保工程行,臺北市信義區基隆路1段83巷20弄6號1樓,電器批發業
38515231,鴻脖子工作室,臺北市信義區信義路6段76巷2弄62號1樓,電器批發業
48559551,台新工程行,臺北市內湖區金湖路40號1樓,電器批發業
31873704,高鈰企業社,臺北市信義區忠孝東路5段1之6號10樓,電器批發業
25587008,隆翔戶外生活用品社,臺北市北投區大業路727號,電器批發業
31866020,達特工作室,臺北市大安區忠孝東路4段107號12樓之4,電器批發業
48903323,正信水電工程行,臺北市北投區致遠三路117巷9號,電器批發業
01961217,全慶五金電料行,臺北市大同區環河北路2段223巷14號,電器批發業
13824040,達達音響行,臺北市大安區復興南路1段295巷1號1樓,電器批發業
49993907,權舜企業社,臺北市大同區民權西路136號7樓之11,電器批發業
99339519,水昆商行,臺北市大安區和平東路3段85號1樓,電器批發業
31954889,互信企業社,臺北市中山區長春路20號2樓,電器批發業
31861783,藝順工程行,臺北市大安區和平東路3段228巷24號4樓之1,電器批發業
29220094,音律影音企業行,臺北市文山區木柵路1段327號1樓,電器批發業
99494119,興業水電工程行,臺北市文山區木新路2段79巷6弄11號3樓,電器批發業
38565793,元元國際企業社,臺北市大安區信義路2段72號地下,電器批發業
73799328,一宏盛冷氣行,臺北市內湖區康樂街136巷18弄66號,電器批發業
31878187,龍均國際企業社,臺北市萬華區長順街99巷16弄11號2樓,電器批發業
38555269,政豐企業社,臺北市大安區基隆路2段132巷21之3號,電器批發業
48755195,杰克實業社,臺北市士林區中正路690之2號,電器批發業
38714148,誠攻國際商行,臺北市松山區南京東路5段250巷36弄35號4樓,電器批發業
48788040,元立行,臺北市萬華區和平西路3段57號1樓,電器批發業
80992208,鍶?玹工作坊,臺北市內湖區成功路4段325號4樓,電器批發業
31957181,吉恩企業社,臺北市中正區羅斯福路2段126號10樓之1,電器批發業
25666967,佰億資訊企業社,臺北市大安區敦化南路2段128號11樓之6,電器批發業
25584086,敦品數位貿易工作室,臺北市大安區溫州街22號4樓之3,電器批發業
80995541,協聲水電行,臺北市士林區中山北路7段190巷6號1樓,電器批發業
26765867,豪鼎企業社,臺北市北投區承德路7段342巷14號2樓,電器批發業
31851201,峰九八通訊行,臺北市萬華區西寧南路36之98號,電器批發業
01608980,龍鳳珠寶精品行,臺北市大安區安和路1段38號,電器批發業
48670160,嵩源企業社,臺北市松山區南京東路4段21號8樓之2,電器批發業
27163532,鉅翔企業社,臺北市中山區民權東路1段58巷8號3樓,電器批發業
38562228,鼎季商行,臺北市大安區浦城街13巷24號2樓,電器批發業
25556053,佑昌企業社,臺北市萬華區長順街107巷20號4樓,電器批發業
13476083,志鼎企業行,臺北市內湖區金龍路223號2樓,電器批發業
38556020,廣威工程行,臺北市文山區忠順街1段26巷12弄1號,電器批發業
14886711,富春商行,臺北市文山區興隆路2段196號7樓之3,電器批發業
98914887,百韻工坊,臺北市松山區南京東路4段93號2樓,電器批發業
99962393,垣翔企業社,臺北市北投區中央北路2段39號2樓,電器批發業
26552484,全國監視器企業社,臺北市萬華區長沙街2段93號10樓之3,電器批發業
14731999,元晨商行,臺北市北投區大同街349號,電器批發業
26348054,誠品數位工作室,臺北市大安區羅斯福路2段79號4樓之2,電器批發業
42268401,宏正環境維護企業社,臺北市中山區建國北路3段95號2樓,電器批發業
48733221,世一企業社,臺北市萬華區峨嵋街130號,電器批發業
81769142,富喬企業社,臺北市大同區歸綏街232號1樓,電器批發業
01932348,鳴宏水電行,臺北市萬華區桂林路120號10樓之2,電器批發業
11208409,正華電器行,臺北市中山區中山北路1段120號之1,電器批發業
04821562,中興電料行,臺北市南港區同德路59號,電器批發業
26352562,宏道電器行,臺北市文山區木柵路3段6號,電器批發業
25556167,速易購電腦資訊社,臺北市萬華區東園街140巷18號,電器批發業
09606182,造鴻工程行,臺北市內湖區內湖路1段205號,電器批發業
38566765,嗨嗨批發零售飲食商行,臺北市中山區林森北路119巷81號1樓,電器批發業
25581813,弘鉅汽車百貨商行,臺北市內湖區江南街71巷81號3樓,電器批發業
10396895,原宏工程行,臺北市南港區東新街77巷9號,電器批發業
31852476,展創企業社,臺北市中山區渭水路36號,電器批發業
25580167,僑富工程行,臺北市中山區中原街9號,電器批發業
14741981,上億工程行,臺北市大安區延吉街131巷1弄36號1樓,電器批發業
26214843,宇明企業社,臺北市萬華區西寧南路63號9樓,電器批發業
99609718,左耳文化出版社,臺北市大安區大安路1段116巷5號地下,電器批發業
99624339,允丰企業社,臺北市大安區忠孝東路3段249號7樓,電器批發業
37851657,運達通企業商行,臺北市中正區衡陽路10號12樓,電器批發業
38580416,鼎坤資訊社,臺北市中正區市民大道3段8號光華數位新天地商場3樓8號店鋪,電器批發業
31954092,侑創設計工作室,臺北市松山區南京東路4段197號9樓之1,電器批發業
13837018,大河音樂工作室,臺北市松山區民生東路5段69巷2弄16號1樓,電器批發業
77836289,大安醫療器材行,臺北市大安區大安路1段155號1樓,電器批發業
29301526,朗佑室內裝潢工程行,臺北市北投區中央北路3段148巷4弄13號4樓,電器批發業
26369819,日樣汽機車精品店,臺北市大同區西寧北路52號(1樓),電器批發業
13445343,巧全冷氣行,臺北市萬華區武成街125巷6弄1號1樓,電器批發業
30273371,杰揚企業社,臺北市南港區研究院路1段155號,電器批發業
10359913,怡誠水電工程行,臺北市士林區延平北路5段136巷27弄29號,電器批發業
48766849,柏源事業社,臺北市中山區民生東路3段1號3樓,電器批發業
17523333,全盟家電服務站,臺北市中山區吉林路199巷17號,電器批發業
38507083,鼎記照明企業社,臺北市北投區文化三路22號3樓,電器批發業
15822406,永全機電行,臺北市萬華區萬大路85巷4號1樓,電器批發業
01637520,樺達電機行,臺北市內湖區內湖路1段411巷9弄26號,電器批發業
21725894,明昌資訊行,臺北市南港區中坡北路50巷10號1樓,電器批發業
26766373,京展眼鏡行,臺北市大同區長安西路52之1號捷運地下街南段A8號店舖,電器批發業
17271195,龍鼎禮品百貨社,臺北市南港區興華路114巷1弄5號2樓,電器批發業
26336705,酷碧兒冷氣工程行,臺北市中正區水源路39之4號,電器批發業
31873319,誠達電器行,臺北市內湖區金龍路85號,電器批發業
92908640,立德工程行,臺北市內湖區康樂街48巷16號,電器批發業
26374828,鋐昌工程行,臺北市中正區北平東路20號3樓,電器批發業
10339868,鑫宏工程行,臺北市松山區光復北路85巷29號,電器批發業
38557858,冠億冷凍家具行,臺北市萬華區環河南路1段63號,電器批發業
30313325,聖地音響工程企業社,臺北市士林區社中街231巷21號1樓,電器批發業
38556794,正隆廚具行,臺北市萬華區和平西路3段384號6樓之6,電器批發業
31920798,錦繡大地工作室,臺北市大同區涼州街2號3樓之6,電器批發業
99775265,治源企業行,臺北市北投區尊賢街230巷12號2樓,電器批發業
98909842,偉辰企業社,臺北市松山區三民路154號1樓,電器批發業
20731356,弘正商店,臺北市松山區民生東路4段74號1樓,電器批發業
48972968,中威電器工程行,臺北市北投區新興路134號,電器批發業
13837761,廣承企業行,臺北市中正區羅斯福路3段210巷8弄7之12號,電器批發業
99328908,精元企業社,臺北市南港區舊庄街1段66號1樓,電器批發業
38469433,擎宇事業社,臺北市大安區泰順街50巷34號1樓,電器批發業
26250333,希恩娜藝術美甲工坊,臺北市大安區忠孝東路4段319號5樓之1,電器批發業
38474175,秦朝娛樂事業工作室,臺北市大安區忠孝東路4段169號6樓之1,電器批發業
05260102,大名行,臺北市中山區新生北路3段68巷37號1樓,電器批發業
99961916,八鄉狸精品服飾店,臺北市萬華區武昌街2段50巷11號1樓,電器批發業
01519621,以馬內利行銷企業社,臺北市中正區漢口街1段110號5樓之7,電器批發業
83937980,企美國際事業企業社,臺北市中山區民生東路2段70號3樓,電器批發業
21533018,東瓏電機工程行,臺北市士林區葫蘆街122號1樓,電器批發業
26222745,浩茗設計工作室,臺北市大同區長安西路239號7樓之1,電器批發業
48983682,瀚洋行,臺北市大同區哈密街59巷59號,電器批發業
01498098,大發工程行,臺北市萬華區中華路2段504巷49號2樓,電器批發業
38568243,佳誼工程行,臺北市中正區忠孝西路1段72號9樓之11,電器批發業
26208429,宗冠裝潢工程行,臺北市士林區延平北路5段163巷26弄22號2樓,電器批發業
13844101,極光工作室,臺北市松山區八德路4段604號2樓之12,電器批發業
38468238,周姐工作室,臺北市信義區光復南路495號2樓之1,電器批發業
26353957,引領通訊行,臺北市北投區東華街1段360號1樓,電器批發業
10305375,立昇舊貨行,臺北市中正區廈門街101之2號,電器批發業
38503636,竹子米兒咖啡,臺北市中山區民生東路2段115巷24號1樓,電器批發業
31853812,上和立企業社,臺北市中山區南京東路3段189號8樓,電器批發業
09707203,小錢通訊行,臺北市士林區文林路265號,電器批發業
25556700,勝利醫療器材行,臺北市內湖區大湖山莊街219巷34弄1號地下之1,電器批發業
10311405,擎光媒體工作室,臺北市大同區長安西路287號8樓之1,電器批發業
01382028,永豐冷氣行,臺北市北投區義理街74號1樓,電器批發業
48936400,亨佳工程行,臺北市北投區公館路340巷6號,電器批發業
48868418,聖榕企業社,臺北市南港區福德街339巷3弄16號,電器批發業
48704653,全盈峰企業社,臺北市北投區中央北路2段137號1樓,電器批發業
99972391,富糠行,臺北市大安區麗水街13巷18號1樓,電器批發業
26231364,裕林車業,臺北市大安區市民大道3段132號,電器批發業
25557124,龍鈦五金行,臺北市松山區八德路4段481號,電器批發業
38555985,立安醫療器材商行,臺北市內湖區內湖路3段329巷2弄1號,電器批發業
31877976,祥舜冷氣行,臺北市文山區和平東路4段89號,電器批發業
17270506,岡展企業社,臺北市中山區松江路185號6樓之2,電器批發業
73880170,富麗行,臺北市文山區興隆路4段165巷37號1樓,電器批發業
10396261,留聲跡藝文工坊,臺北市中山區民權西路27號8樓之1,電器批發業
38566441,谷德工程行,臺北市萬華區和平西路3段109巷11號3樓,電器批發業
31843738,非常木木亦大華工作室,臺北市松山區八德路3段212號8樓,電器批發業
31862761,豐禾大商店,臺北市南港區興中路12巷9號1樓,電器批發業
25664644,無限志娛樂創意工作室,臺北市中山區松江路32之1號地下室,電器批發業
38578328,聖嘉工程行,臺北市中山區松江路283號5樓,電器批發業
31864677,亞洲混樂企業社,臺北市大同區南京西路370號3樓,電器批發業
26349342,東燦企業社,臺北市中山區松江路182號11樓之1,電器批發業
08584978,宇盛企業社,臺北市內湖區民權東路6段120巷5弄3號4樓,電器批發業
99639868,心思國際事業行,臺北市南港區中坡北路50巷10號1樓,電器批發業
80991550,中二水電行,臺北市大安區忠孝東路3段251巷9弄14號,電器批發業
31874035,創富燈光照明行,臺北市士林區社中街152巷31號1樓,電器批發業
13455735,弘盛電器行,臺北市中山區松江路330巷16號,電器批發業
17736244,錄堡音樂工作室,臺北市士林區忠誠路1段173巷28弄10號1樓,電器批發業
31582451,信威實業社,臺北市萬華區德昌街144號3樓,電器批發業
48887219,永弘電器行,臺北市北投區懷德街20號,電器批發業
38564035,忠宬企業社,臺北市萬華區康定路192號2樓,電器批發業
01773622,怡良水電工程行,臺北市中山區民權東路2段75號3樓,電器批發業
02207294,懋森企業社,臺北市北投區溫泉路30巷15號,電器批發業
26359740,冠君文教事業社,臺北市南港區忠孝東路6段159巷4弄7號1樓,電器批發業
10318596,奕翔企業社,臺北市士林區中正路696號7樓,電器批發業
01304924,吉羊服務社,臺北市信義區松德路65號11樓之1,電器批發業
25556820,威信工程行,臺北市中山區復興北路68巷5號1樓,電器批發業
10335814,佳能企業社,臺北市中山區民生東路1段96號1樓,電器批發業
42290564,鴻玓冷氣工程行,臺北市信義區忠孝東路5段1-3號14樓,電器批發業
29208900,安利實業社,臺北市中山區長春路3巷15號2樓,電器批發業
38505389,探子設計實驗室,臺北市大同區鄭州路55號3樓,電器批發業
48961300,佰塑水電行,臺北市南港區忠孝東路6段256號,電器批發業
66983811,嘉升冷氣行,臺北市文山區木柵路2段109巷27弄10號4樓,電器批發業
31850104,成大科技工程企業社,臺北市松山區八德路3段120號8樓之6,電器批發業
98889016,神通企業社,臺北市文山區木柵路4段25號,電器批發業
38463450,台灣銀髮族樂活醫療器材企業社,臺北市松山區光復北路190巷39號龍城市場2樓224號攤位,電器批發業
25572103,正達數位監控企業社,臺北市大同區哈密街86號1樓,電器批發業
41070606,創升工程行,臺北市內湖區東湖路160巷10弄20號4樓,電器批發業
13832169,青竣企業社,臺北市士林區社中街272號1樓,電器批發業
31874859,豪瑞企業社,臺北市萬華區成都路42號,電器批發業
38573739,品讚行動通訊行,臺北市中山區興安街122號1樓,電器批發業
48698245,恆億水電材料行,臺北市文山區恆光街14巷16號1樓,電器批發業
18100662,國源冷氣行,臺北市中正區林森南路141號1樓,電器批發業
17762538,宗興儀器企業社,臺北市中正區仁愛路3段17號11樓,電器批發業
38501187,金昌電器企業社,臺北市萬華區西園路2段261巷25號1樓,電器批發業
38468954,長虹數位企業社,臺北市中正區漢口街1段85號,電器批發業
15667592,達博企業社,臺北市松山區復興北路1號11樓之2,電器批發業
42271118,新詠鴻冷氣工程行,臺北市大安區和平東路3段63號8樓,電器批發業
99624366,巧修家工程行,臺北市士林區延平北路5段182號4樓,電器批發業
38562070,宇通企業社,臺北市中山區中山北路3段27號12樓之1,電器批發業
10382772,上美包裝企業社,臺北市大同區民族西路169巷18之1號2樓,電器批發業
48676690,晟富工程行,臺北市中山區民權西路20號11樓之6,電器批發業
31853469,有鈞國際貿易企業社,臺北市中山區林森北路85巷39號6樓,電器批發業
14744930,郡康企業社,臺北市內湖區環山路2段109巷6弄7號3樓,電器批發業
38469285,晉源行,臺北市大安區復興南路2段237號13樓,電器批發業
81749569,明星燈飾行,臺北市內湖區成功路3段187巷35弄23號1樓,電器批發業
99635498,映象前線工作室,臺北市南港區玉成街176巷15號2樓,電器批發業
26351867,東洲企業社,臺北市大同區民生西路272號6樓,電器批發業
31956140,達鑽商行,臺北市中山區民生東路3段1號3樓,電器批發業
31871179,金采工作室,臺北市士林區通河街325巷38之1號,電器批發業
25661739,日溢通訊行,臺北市文山區羅斯福路6段403號1樓之5,電器批發業
26254106,台灣精品生活館,臺北市中山區民生東路1段25號5樓之23,電器批發業
31956388,冠宸國際企業社,臺北市士林區承德路4段198號3樓,電器批發業
26241095,家樂照明企業社,臺北市北投區東華街2段258號,電器批發業
81621296,南區家電服務站,臺北市大安區臥龍街279號,電器批發業
78493162,高欣電氣行,臺北市中山區吉林路161巷11號之1、1樓,電器批發業
81683567,陞隆水電行,臺北市內湖區陽光街92巷14弄2號,電器批發業
38579754,朝暘美術社,臺北市信義區基隆路2段23號5樓之1,電器批發業
17742055,鉅聖工程行,臺北市內湖區康樂街20巷37號2樓,電器批發業
26226806,健佑工程行,臺北市信義區永吉路278巷37弄20號1樓,電器批發業
48972496,台晶科技實業社,臺北市中山區新生北路3段26號10樓之2,電器批發業
99990378,新響工程行,臺北市大安區復興南路1段107巷5弄19之1號1樓,電器批發業
38581604,原創全方位音樂工作室,臺北市中山區興安街91號2樓之1,電器批發業
25540829,優異安控工程行,臺北市中正區羅斯福路3段100之101號,電器批發業
13903966,天雅藝術館,臺北市信義區松德路65號11樓之2,電器批發業
26247859,三圓企業社,臺北市文山區興隆路4段145巷23弄5號,電器批發業
17544463,上川工程行,臺北市士林區福志路64號1樓,電器批發業
26338838,無為藝術工作坊,臺北市信義區基隆路1段350號1樓之71,電器批發業
78067982,東區家電服務站,臺北市信義區松德路217號1樓,電器批發業
48896842,世界光企業社,臺北市大安區文昌街228號,電器批發業
99981011,飛騰企業行,臺北市大同區迪化街2段172巷15號,電器批發業
25573953,博士通冷氣水電工程行,臺北市大同區承德路3段55號3樓,電器批發業
10332268,富明企業社,臺北市士林區延平北路5段163巷13號,電器批發業
48799412,佳鎂洋行,臺北市士林區中正路501號16樓,電器批發業
01096947,加彰工程行,臺北市北投區稻香路155號,電器批發業
29339213,衛爾士數位貿易工作室,臺北市松山區南京東路5段70號6樓之1,電器批發業
26194092,策略家整合行銷社,臺北市中山區天祥路48巷5號,電器批發業
48636924,鳴嘩音響企業社,臺北市萬華區忠孝西路2段16巷13號,電器批發業
38579425,亦翔工程行,臺北市北投區中央北路4段456巷2號,電器批發業
49983529,英吉利企業社,臺北市萬華區武成街24號,電器批發業
48694901,慶益機電工程材料行,臺北市中山區復興北路488巷1弄11號1樓,電器批發業
38557652,薇恩企業社,臺北市大安區信義路2段72號地下,電器批發業
48963790,台品企業社,臺北市松山區民生東路5段165號8樓之3,電器批發業
21710837,至宇商行,臺北市士林區中山北路5段811巷6號2樓,電器批發業
78194164,金蘋果音樂社,臺北市內湖區行善路122號,電器批發業
31861263,鴻頂安防實業社,臺北市大同區哈密街83巷1號3樓,電器批發業
26346400,佳嘉工程行,臺北市大安區敦化南路2段46號12樓之11,電器批發業
04810447,竣祥企業行,臺北市內湖區陽光街155號1樓,電器批發業
38502518,星燁企業社,臺北市大安區臨江街104號,電器批發業
38576855,秀真誠行,臺北市中正區齊東街82巷36號1樓,電器批發業
38466225,八葉商行,臺北市內湖區大湖街131巷14號,電器批發業
38571578,八隻貓企業社,臺北市文山區羅斯福路5段88之5號2樓,電器批發業
31870143,瀧森實業社,臺北市信義區永吉路120巷53號,電器批發業
25662673,世全事務機器行,臺北市信義區虎林街242巷60號1樓,電器批發業
38469285,晉源行,臺北市大安區復興南路2段237號13樓,電器批發業
48930617,阿月巴商行,臺北市文山區木新路3段210號,電器批發業
26220872,蔻絲生活寢具館,臺北市中山區建國北路2段129號6樓,電器批發業
48694923,榮鑫企業社,臺北市中山區松江路38巷2號2樓之1,電器批發業
48884037,鴻劍實業社,臺北市中山區錦州街25號5樓,電器批發業
26207569,圓融工程行,臺北市南港區舊莊街1段44號,電器批發業
38459575,松下健康生活館,臺北市中正區羅斯福路3段300號1樓,電器批發業
38568102,安心租賃商行,臺北市萬華區西藏路510號,電器批發業
38580653,三才企業社,臺北市大安區忠孝東路4段162號11樓之5,電器批發業
25513436,紅陽袁立誠企業社,臺北市文山區景福街226號,電器批發業
05803859,魚米之鄉企業社,臺北市中山區南京東路2段76號4樓,電器批發業
26348792,澄橘數位工作室,臺北市大安區羅斯福路2段33號8樓之1,電器批發業
31965372,華義工程行,臺北市松山區南京東路5段47號12樓,電器批發業
25581089,魔荳咖啡館,臺北市信義區大道路129號,電器批發業
48983070,新視界國際事業企業社,臺北市松山區民族東路632號,電器批發業
31881423,澕揚國際企業社,臺北市中正區汀州路3段203號1樓,電器批發業
29280178,慶億企業社,臺北市大同區大龍街161號1樓,電器批發業
31579961,景意水電工程行,臺北市中山區建國北路2段262號6樓,電器批發業
99970008,亞迅通資訊器材行,臺北市大安區信義路4段60之20號1樓,電器批發業
01932847,龍館電器行,臺北市中正區重慶南路3段138號1樓,電器批發業
26358313,上大藝品禮品社,臺北市中山區新生北路2段39號8樓,電器批發業
38576052,尚程企業社,臺北市士林區忠誠路2段130巷9之2號2樓,電器批發業
26223955,交朋友汽車百貨行,臺北市信義區吳興街284巷22弄28號1樓,電器批發業
26225617,安力企業社,臺北市大同區延平北路2段127號3樓之10,電器批發業
18100229,麗華餅店,臺北市中正區開封街1段57號1樓,電器批發業
38473817,利偉水電企業城,臺北市北投區東華街2段132號,電器批發業
25662505,兆鈦企業社,臺北市士林區承德路4段277巷48號,電器批發業
48743353,泰毅工程行,臺北市大同區酒泉街254號1樓,電器批發業
17751413,東靖企業社,臺北市南港區玉成街201巷10號1樓,電器批發業
31710483,宏暐企業社,臺北市中山區復興北路48號3樓,電器批發業
26373068,喜寬豐企業行,臺北市文山區羅斯福路5段176巷51號,電器批發業
25546605,藍紫光企業社,臺北市士林區中山北路6段405巷76號1樓,電器批發業
26208119,蒙恩國際貿易行,臺北市士林區環河北路3段215號3樓,電器批發業
25561339,克萊兒國際商行,臺北市文山區福興路63巷4弄16號,電器批發業
26218622,上禾百貨行,臺北市萬華區中華路1段122號,電器批發業
