CID,CNAME,CADDR,Response_Address,Response_X,Response_Y
27721157,泰銓國際運通有限公司,臺北市松山區民權東路3段190號2樓,臺北市松山區民有里30鄰民權東路三段190號,305501.763,2772694.447
27723177,云晟企管顧問股份有限公司,臺北市大安區和平東路2段181號2樓,臺北市大安區龍生里4鄰和平東路二段181號,304692.132,2768686.851
27729088,兆太國際物流股份有限公司,臺北市中山區松江路50號11樓,臺北市中山區興亞里8鄰松江路50號,303754.412,2771227.221
27729377,漢祺國際展業有限公司,臺北市中正區重慶南路１段１０號１１樓之５,臺北市中正區光復里2鄰重慶南路一段10號,301776.839,2771035.918
27734218,嘉陽國際開發有限公司,臺北市中山區林森北路399巷19號13樓,臺北市中山區聚盛里16鄰林森北路399巷19號,303087.15,2772477.931
27734364,阿波羅國際物流股份有限公司,臺北市大安區忠孝東路３段９６號８樓,臺北市大安區民輝里18鄰忠孝東路三段96號,304110.118,2770495.882
27739403,德丸倉儲有限公司,臺北市松山區八德路3段2號7樓之1,臺北市松山區敦化里1鄰八德路三段2號,305432.416,2771198.182
27740345,海寧物流有限公司,臺北市松山區八德路3段199巷4弄8號1樓,臺北市松山區復勢里6鄰八德路三段199巷4弄8號,306104.569,2771287.608
27741301,首特企業有限公司,臺北市中山區南京東路2段95號11樓,臺北市中山區中吉里1鄰南京東路二段95號,303703.569,2771670.072
27741787,高見文化行銷股份有限公司,臺北市松山區東興路8號8樓,臺北市松山區新聚里17鄰東興路8號,307005.589,2771448.087
27742322,贏贊國際有限公司,臺北市大同區長安西路82號7樓之3,臺北市大同區建明里2鄰長安西路82號,302385.386,2771449.73
27743048,鯨捷有限公司,臺北市中正區羅斯福路２段１０２號２４樓,臺北市中正區板溪里2鄰羅斯福路二段102號,302729.505,2768829.904
27743722,誌盛物流股份有限公司,臺北市松山區南京東路5段336號7樓之4,臺北市松山區新聚里8鄰南京東路五段336號,307404.693,2771556.222
27744525,台北花園大酒店股份有限公司,臺北市中正區中華路2段1號,臺北市中正區愛國里3鄰中華路二段1號,301148.231,2769911.21
27753517,紀恩有限公司,臺北市松山區民生東路3段128號12樓,臺北市松山區松基里5鄰民生東路三段128號,305087.742,2772259.992
27754522,凱陞企業有限公司,臺北市大安區信義路4段6號6樓,臺北市大安區住安里3鄰信義路四段6號,304909.961,2769557.308
27755965,達成運通國際有限公司,臺北市中山區南京東路2段174號10樓,臺北市中山區朱園里1鄰南京東路二段174號,303972.346,2771625
27756346,喜事達企業股份有限公司,臺北市信義區忠孝東路5段396號地下,臺北市信義區廣居里5鄰忠孝東路五段396號,307983.588,2770412.185
27756444,天吉榮實業股份有限公司,臺北市中山區敬業一路128巷39號4樓,臺北市中山區成功里18鄰敬業一路128巷39號,305833.243,2775132.48
27757231,森林家族股份有限公司,臺北市大同區南京西路203號3樓,臺北市大同區永樂里10鄰南京西路203號,301588.914,2771850.824
27760432,華威人資股份有限公司,臺北市松山區復興北路1號9樓,臺北市松山區中正里1鄰復興北路1號,304906.54,2771201.056
27761018,萬瑞國際有限公司,臺北市中正區漢口街１段１１０號５樓之８,臺北市中正區光復里10鄰漢口街一段110號,301561.948,2770869.376
27768201,台灣佐川急便國際股份有限公司,臺北市中山區民生東路3段1號2樓,臺北市中山區江山里12鄰民生東路三段1號,304213.673,2772324.649
27769068,詮進國際有限公司,臺北市中山區南京東路3段101號7樓,臺北市中山區復華里14鄰南京東路三段101號,304413.927,2771661.892
27770163,雷諾斯亞洲有限公司,臺北市內湖區堤頂大道二段411號3樓,臺北市內湖區西康里26鄰堤頂大道二段411號,306816.354,2774832.16
27783414,東穎國際室內裝修企業有限公司,臺北市文山區忠順街2段85巷25號3樓,臺北市文山區忠順里17鄰忠順街二段85巷25號,307031.085,2764378.438
27837066,卡易行銷股份有限公司,臺北市大同區庫倫街3號,臺北市大同區保安里11鄰庫倫街3號,302164.476,2773862.544
27840203,名冠搬家物流貨運有限公司,臺北市內湖區成功路4段168號10樓之2,臺北市內湖區內湖里24鄰成功路四段168號,309820.004,2775126.369
27864963,威昂科技有限公司,臺北市中山區北安路518巷14弄17號,臺北市中山區永安里5鄰北安路518巷14弄17號,305005.581,2774676.372
27872719,紹坤室內裝修有限公司,臺北市萬華區萬大路187巷3弄9號,臺北市萬華區新安里6鄰萬大路187巷3弄9號,300586.533,2769057.712
27925687,香港商都樂有限公司,臺北市北投區北投路1段5號1樓,臺北市北投區八仙里7鄰北投路一段5號,300626.592,2779347.714
27934200,國光石化科技股份有限公司,臺北市中山區松江路301號8樓之１,臺北市中山區松江里10鄰松江路301號,303815.428,2772659.473
27944495,薩摩亞商寶宏國際實業股份有限公司,臺北市內湖區瑞光路302號4樓之2,臺北市內湖區港墘里20鄰瑞光路302號,307932.41,2774373.396
27946233,遠雄巨蛋事業股份有限公司,臺北市信義區松高路1號22樓,臺北市信義區興雅里2鄰松高路1號,306907.982,2770276.969
27952348,華樂國際股份有限公司,臺北市中正區懷寧街90號10樓,臺北市中正區黎明里8鄰懷寧街90號,301863.91,2770614.991
27954583,津華國際有限公司,臺北市信義區基隆路2段79巷17弄14號,臺北市信義區景聯里9鄰基隆路二段79巷17弄14號,306488.804,2769223.07
27956061,伍六伍爸爸爸網路媒體廣告有限公司,臺北市大安區信義路4段265巷17-1號5樓,臺北市大安區敦煌里5鄰信義路四段265巷17之1號,305960.854,2769676.374
27957300,兆亮國際股份有限公司,臺北市大安區延吉街239號4樓,臺北市大安區光信里11鄰延吉街239號,306077.009,2769914.06
27957907,港盛租賃股份有限公司,臺北市中山區吉林路245號3樓,臺北市中山區新生里12鄰吉林路245號,303510.653,2772671.282
27958743,米特行銷股份有限公司,臺北市南港區忠孝東路6段21號10樓之2,臺北市南港區合成里26鄰忠孝東路六段21號,308787.427,2771099.306
27960109,奧黛莉科技股份有限公司,臺北市大同區長安西路３４２號５樓,臺北市大同區玉泉里9鄰長安西路342號,301482.39,2771627.623
27960635,合作金庫資產管理股份有限公司,臺北市大安區忠孝東路4段325號7樓,臺北市大安區華聲里10鄰忠孝東路四段325號,306137.331,2770499.177
27964983,春旭實業有限公司,臺北市信義區光復南路547號3樓之4,臺北市信義區中興里7鄰光復南路547號,306271.279,2769391.205
27967335,壹零壹科技管理顧問股份有限公司,臺北市松山區南京東路5段63號9樓,臺北市松山區東光里23鄰南京東路五段63號,306439.329,2771622.66
27968735,台北農特產品貿易股份有限公司,臺北市中山區中山北路2段68號3樓,臺北市中山區民安里18鄰中山北路二段68號,302726.236,2772173.521
27969951,杰廣股份有限公司,臺北市中山區中山北路2段44號5樓,臺北市中山區民安里15鄰中山北路二段44號,302718.718,2771993.47
27974949,峰瑪國際有限公司,臺北市大安區臥龍街195巷13號1樓,臺北市大安區黎元里4鄰臥龍街195巷13號,305791.713,2767922.987
27975807,采科聯運股份有限公司,臺北市士林區大南路415號1樓,臺北市士林區後港里21鄰大南路415號,302053.052,2775865.52
27977495,鼎運物流股份有限公司,臺北市中山區松江路111號3樓之3,臺北市中山區朱園里8鄰松江路111號,303802.055,2771575.903
27979613,鼎特科技股份有限公司,臺北市大同區貴德街36巷7號1樓,臺北市大同區永樂里23鄰貴德街36巷7號,301236.391,2771908.127
27980766,網骨科技娛樂股份有限公司,臺北市內湖區基湖路３９號４樓,臺北市內湖區西湖里13鄰基湖路39號,306968.465,2774684.618
27981815,華康國際事業有限公司,臺北市中正區忠孝西路1段50號12樓之42,臺北市中正區黎明里11鄰忠孝西路一段50號,302048.097,2771005.519
27982286,渥鈞股份有限公司,臺北市中山區中山北路2段44號5樓,臺北市中山區民安里15鄰中山北路二段44號,302718.718,2771993.47
27982379,鴻任整合行銷股份有限公司,臺北市萬華區中華路1段78號11樓之2,臺北市萬華區福星里4鄰中華路一段78號,301344.385,2770921.506
27986446,車迅企業有限公司,臺北市中山區松江路３號６樓,臺北市中山區朱園里21鄰松江路3號,303794.628,2770978.676
27987557,倍肯股份有限公司,臺北市士林區福志路14巷17號,臺北市士林區福志里17鄰福志路14巷17號,303628.345,2776884.464
27989859,帝飛運通有限公司,臺北市松山區復興北路101號8樓之11,臺北市松山區中正里31鄰復興北路101號,304916.912,2771756.869
27990531,富力交通器材有限公司,臺北市大同區太原路115巷16號1樓,臺北市大同區建泰里6鄰太原路115巷16號,302120.057,2771694.08
27992566,韋博國際有限公司,臺北市士林區至誠路2段11號1樓,臺北市士林區名山里4鄰至誠路二段11號,303482.934,2777184.457
27994966,侑睿有限公司,臺北市大安區新生南路1段121號5樓,臺北市大安區民輝里2鄰新生南路一段121號,303794.928,2770219.912
27999723,歐航國際物流有限公司,臺北市松山區八德路4段135號2樓,臺北市松山區吉祥里10鄰八德路四段135號,306724.767,2771296.026
28004745,葳華國際股份有限公司,臺北市松山區敦化北路201之24號6樓,臺北市松山區精忠里4鄰敦化北路201之24號,305460.459,2772111.898
28007026,弘馳企業有限公司,臺北市大安區和平東路2段118巷4弄19號,臺北市大安區龍淵里8鄰和平東路二段118巷4弄19號,304721.096,2768550.235
28007665,聯恆國際股份有限公司,臺北市內湖區瑞光路581號,臺北市內湖區西湖里13鄰瑞光路581號,307288.201,2774729.793
28008910,中通國際有限公司,臺北市內湖區新明路211號,臺北市內湖區石潭里18鄰新明路211號,309324.756,2772365.503
28009994,芯銳有限公司,臺北市士林區德行東路３３１巷５４弄２號地下１樓,臺北市士林區東山里13鄰德行東路331巷54弄2號,304278.341,2778390.069
28058805,耀豐國際有限公司,臺北市松山區八德路4段660號3樓之5,臺北市松山區慈祐里22鄰八德路四段660號,308102.667,2771422.507
28061479,創鈺國際科技股份有限公司,臺北市松山區南京東路4段1號9樓,臺北市松山區中華里11鄰南京東路四段1號,305457.611,2771640.975
28100509,松果体國際文創有限公司,臺北市大同區民權西路108號2樓之1,臺北市大同區民權里21鄰民權西路108號,302172.623,2772825.335
28104890,福鼎國際有限公司,臺北市中山區合江街35之1號1樓,臺北市中山區朱馥里19鄰合江街35之1號,304404.353,2772039.212
28126439,星瑋國際股份有限公司,臺北市中正區忠孝西路1段72號4樓之1,臺北市中正區黎明里5鄰忠孝西路一段72號,301870.158,2771062.744
28170244,喜建成建設股份有限公司,臺北市中山區復興北路48號5樓,臺北市中山區力行里12鄰復興北路48號,304865.651,2771374.679
28170856,裕利國際貨運有限公司,臺北市松山區寶清街１７號３樓,臺北市松山區新聚里5鄰寶清街17號,307410.947,2771435.767
28174179,伊麗雅國際有限公司,臺北市中正區衡陽路51號12樓,臺北市中正區光復里8鄰衡陽路51號,301682.54,2770569.53
28175803,元邦物流股份有限公司,臺北市內湖區內湖路１段３９６號１２樓,臺北市內湖區港墘里20鄰內湖路一段396號,307822.869,2774819.581
28178652,台灣泰瑞龍科技股份有限公司,臺北市松山區八德路3段200號2樓之2,臺北市松山區復建里11鄰八德路三段200號,306144.17,2771202.814
28180799,甲邑開發股份有限公司,臺北市北投區珠海路219號,臺北市北投區泉源里3鄰珠海路219號,301804.551,2781717.33
28182564,尚好呷食品有限公司,臺北市內湖區民權東路6段483號2樓,臺北市內湖區金湖里10鄰民權東路六段483號,311026.887,2773955.353
28184057,品都開發有限公司,臺北市內湖區堤頂大道2段285號5樓,臺北市內湖區西湖里13鄰堤頂大道二段285號,307049.212,2774599.006
28188292,聯運國際貨運有限公司,臺北市松山區民權東路3段142號12樓之2,臺北市松山區民有里32鄰民權東路三段142號,305172.534,2772725.699
28191825,龍飛國際運輸股份有限公司,臺北市中山區松江路148號4樓,臺北市中山區中吉里6鄰松江路148號,303761.795,2771845.801
28195168,中央集保儲運有限公司,臺北市中山區長安東路2段163之1號3樓,臺北市中山區力行里4鄰長安東路二段163之1號,304510.737,2771250.274
28196997,特波汽車股份有限公司,臺北市南港區南港路3段16巷3號,臺北市南港區西新里9鄰南港路三段16巷3號,309755.798,2772007.619
28198664,億兆京國際股份有限公司,臺北市萬華區萬大路423巷42號,臺北市萬華區日祥里13鄰萬大路423巷42號,300573.083,2768253.055
28199262,穩賺資訊有限公司,臺北市大安區復興南路1段368號13樓,臺北市大安區和安里4鄰復興南路一段368號,304835.541,2769757.148
28203890,迅輝國際貨運股份有限公司,臺北市松山區八德路4段135號7樓之4,臺北市松山區吉祥里10鄰八德路四段135號,306724.767,2771296.026
28204201,領威船務代理有限公司,臺北市松山區八德路4段135號4樓,臺北市松山區吉祥里10鄰八德路四段135號,306724.767,2771296.026
28209091,益馳京采資通股份有限公司,臺北市大安區安和路2段217巷12號,臺北市大安區全安里8鄰安和路二段217巷12號,305579.274,2768755.663
28212928,嘉北國際股份有限公司,臺北市中山區中山北路2段96號,臺北市中山區集英里7鄰中山北路二段96號,302732.634,2772468.427
28214123,華信整合公關股份有限公司,臺北市中正區青島東路7號5樓之1,臺北市中正區幸福里1鄰青島東路7號,302710.295,2770737.623
28216451,鋐騏國際物流有限公司,臺北市內湖區成功路4段70號9樓,臺北市內湖區內湖里22鄰成功路四段70號,309822.742,2775086.275
28216939,鼎酆企業有限公司,臺北市信義區光復南路447之2號9樓之4,臺北市信義區正和里21鄰光復南路447之2號,306277.556,2769790.449
28217851,兀點滴股份有限公司,臺北市內湖區潭美街587號,臺北市內湖區蘆洲里3鄰潭美街587號,310855.259,2772706.899
28219725,藍泰有限公司,臺北市松山區民生東路4段55巷14號3樓,臺北市松山區精忠里14鄰民生東路四段55巷14號,305529.383,2772366.374
28220103,智點整合行銷有限公司,臺北市大安區樂利路91號7樓,臺北市大安區法治里5鄰樂利路91號,305732.509,2768726.797
28220477,新焦點麗車坊股份有限公司,臺北市內湖區舊宗路1段86號,臺北市內湖區湖元里18鄰舊宗路一段86號,308482.959,2772473.196
28221237,欣碩股份有限公司,臺北市萬華區成都路116之1號,臺北市萬華區菜園里7鄰成都路116之1號,300570.5,2770722.004
28222952,瑋倫國際有限公司,臺北市內湖區江南街107巷2號1樓,臺北市內湖區港墘里11鄰江南街107巷2號,308184.01,2774376.407
28225888,萬事通國際服務網股份有限公司,臺北市中山區南京東路3段61號10樓,臺北市中山區復華里14鄰南京東路三段61號,304295.018,2771663.97
28225917,肯儀實業有限公司,臺北市中山區松江路8號7樓之19,臺北市中山區興亞里1鄰松江路8號,303752.243,2771032.689
28226649,八達通貿易有限公司,臺北市大安區復興南路1段137號8樓之1,臺北市大安區光武里27鄰復興南路一段137號,304895.124,2770582.685
28227669,海潤國際物流有限公司,臺北市萬華區昆明街111號12樓之9,臺北市萬華區西門里13鄰昆明街111號,300929.773,2770534.311
28228718,榮邦國際物流有限公司,臺北市中山區長安東路2段31號6樓,臺北市中山區興亞里12鄰長安東路二段31號,303600.637,2771264.504
28228885,金佛國際有限公司,臺北市中山區撫順街23號3樓之2,臺北市中山區集英里21鄰撫順街23號,302504.763,2772925.903
28306447,弘溢國際興業有限公司,臺北市士林區延平北路9段92巷1號,臺北市士林區富洲里10鄰延平北路九段92巷1號,297827.498,2777638.591
28324058,藍鵲建設股份有限公司,臺北市信義區基隆路1段155號5樓之9,臺北市信義區興雅里6鄰基隆路一段155號,307046.103,2770572.592
28378618,翰宇有限公司,臺北市中正區忠孝西路1段50號12樓之22,臺北市中正區黎明里11鄰忠孝西路一段50號,302048.097,2771005.519
28413517,日商好侍食品股份有限公司,臺北市中山區中山北路2段114號9樓,臺北市中山區集英里8鄰中山北路二段114號,302740.1,2772616.828
28423493,薩摩亞商羅亞科技股份有限公司,臺北市文山區辛亥路4段176號1樓,臺北市文山區興泰里8鄰辛亥路四段176號,306132.264,2766278.794
28438186,藍海氣體工業股份有限公司,臺北市中山區中山北路2段21號6樓,臺北市中山區康樂里2鄰中山北路二段21號,302750.855,2771752.363
28441632,大都市搬家貨運有限公司,臺北市大安區樂業街173號1樓,臺北市大安區黎孝里18鄰樂業街173號,305954.529,2767997.482
28442040,崴騰國際通運有限公司,臺北市信義區基隆路1段149號2樓之2,臺北市信義區興雅里6鄰基隆路一段149號,307067.554,2770610.978
28442652,拓肯國際顧問有限公司,臺北市大安區安和路2段23巷6號,臺北市大安區通安里4鄰安和路二段23巷6號,305802.883,2769436.036
28443343,宏合科技有限公司,臺北市大同區重慶北路2段74號8樓,臺北市大同區朝陽里16鄰重慶北路二段74號,301828.215,2772117.479
28446735,台北運通股份有限公司,臺北市大同區民權西路108號8樓之3,臺北市大同區民權里21鄰民權西路108號,302172.623,2772825.335
28449070,暐基企業有限公司,臺北市中山區長安東路2段52號8樓之2,臺北市中山區興亞里8鄰長安東路二段52號,303734.024,2771239.73
28451379,希代多媒體書版股份有限公司,臺北市內湖區洲子街88號3樓,臺北市內湖區港墘里20鄰洲子街88號,307626.043,2774702.451
28454262,南聯牛乳石鹼國際股份有限公司,臺北市信義區忠孝東路4段560號12樓,臺北市信義區興隆里15鄰忠孝東路四段560號,306900.85,2770435.559
28454679,台灣迪達全球物流有限公司,臺北市大安區忠孝東路4段169號11樓之1,臺北市大安區建安里16鄰忠孝東路四段169號,305541.268,2770509.776
28457612,鑫元鑫股份有限公司,臺北市大安區忠孝東路4段222號2樓,臺北市大安區車層里9鄰忠孝東路四段222號,305861.022,2770456.574
28458788,統賀通運有限公司,臺北市信義區忠孝東路4段553巷46弄2號,臺北市信義區新仁里9鄰忠孝東路四段553巷46弄2號,306810.097,2770785.434
28459941,永捷國際物流有限公司,臺北市內湖區新湖一路157號7樓,臺北市內湖區湖元里18鄰新湖一路157號,308274.035,2772402.98
28462404,挺順國際股份有限公司,臺北市中山區錦州街298號7樓,臺北市中山區松江里14鄰錦州街298號,304073.815,2772554.764
28463023,譽文武企業有限公司,臺北市北投區雙全街48巷3號(1樓),臺北市北投區中庸里15鄰雙全街48巷3號,300494.624,2781159.41
28463261,鴻億國際運通股份有限公司,臺北市內湖區內湖路1段77號2樓,臺北市內湖區西康里8鄰內湖路一段77號,306551.248,2775291.175
28464536,郁氏實業有限公司,臺北市萬華區西藏路199巷43號2樓,臺北市萬華區日善里11鄰西藏路199巷43號,300448.047,2768964.648
28465444,華康航空貨運承攬有限公司,臺北市南港區八德路4段778號6樓,臺北市南港區玉成里17鄰八德路四段778號,308548.819,2771489.67
28466252,達盟財經股份有限公司,臺北市大同區南京西路366號,臺北市大同區永樂里9鄰南京西路366號,301547.84,2771825.288
28473845,海鑫貿易有限公司,臺北市大安區忠孝東路4段325號12樓之1,臺北市大安區華聲里10鄰忠孝東路四段325號,306137.331,2770499.177
28475371,高捷郵通有限公司,臺北市內湖區內湖路3段339之1號,臺北市內湖區金瑞里16鄰內湖路三段339之1號,308985.796,2775766.626
28479496,頂好國際企業有限公司,臺北市文山區景福街54巷5弄18號1樓,臺北市文山區萬隆里18鄰景福街54巷5弄18號,304259.288,2765885.496
28480310,慧璞國際有限公司,臺北市松山區基隆路1段38號6樓之2,臺北市松山區新聚里3鄰基隆路一段38號,307454.177,2771427.011
28481937,中外運空運股份有限公司,臺北市中山區南京東路3段65號5樓,臺北市中山區復華里14鄰南京東路三段65號,304322.567,2771663.971
28482133,億發全球股份有限公司,臺北市松山區南京東路5段296號10樓,臺北市松山區新聚里10鄰南京東路五段296號,307243.707,2771558.701
28485103,五零七零社會型企管顧問有限公司,臺北市松山區敦化南路1段3號6樓之1,臺北市松山區敦化里1鄰敦化南路一段3號,305424.853,2771139.369
28487361,世州國際物流有限公司,臺北市大安區敦化南路2段1號4樓,臺北市大安區義安里1鄰敦化南路二段1號,305417.871,2769547.769
28488426,泛邦船務有限公司,臺北市中山區建國北路2段66號4樓之3,臺北市中山區中央里12鄰建國北路二段66號,304127.152,2771913.262
28490106,阿諾立資源企業有限公司,臺北市大同區長安西路78巷3弄1號4樓,臺北市大同區建明里3鄰長安西路78巷3弄1號,302394.372,2771398.81
28532990,佑昌海空聯運有限公司,臺北市中山區龍江路235號2樓之2,臺北市中山區江山里17鄰龍江路235號,304566.312,2772321.144
28547889,緹陽國際有限公司,臺北市中山區南京東路3段189號8樓,臺北市中山區復華里11鄰南京東路三段189號,304710.237,2771656.457
28565942,中港台光電有限公司,臺北市中山區復興北路66號7樓,臺北市中山區力行里12鄰復興北路66號,304868.143,2771490.999
28575224,賽揚實業有限公司,臺北市信義區松德路159號11樓之2,臺北市信義區安康里20鄰松德路159號,308007.956,2769942.259
28576504,伊格斯實業有限公司,臺北市信義區松德路159號11樓之2,臺北市信義區安康里20鄰松德路159號,308007.956,2769942.259
28579565,達迅物流有限公司,臺北市松山區南京東路4段75巷6號1樓,臺北市松山區東勢里15鄰南京東路四段75巷6號,305860.752,2771654.489
28585460,品嘉國際企業有限公司,臺北市中山區中山北路2段27巷4號3樓,臺北市中山區康樂里2鄰中山北路二段27巷4號,302825.22,2771766.389
28641245,順億科技有限公司,臺北市文山區永安街22巷3號,臺北市文山區木新里17鄰永安街22巷3號,307517.692,2764408.369
28671726,美湖股份有限公司,臺北市大同區延平北路2段202號18樓之2,臺北市大同區大有里10鄰延平北路二段202號,301585.974,2772413.883
28674575,博運通物流管理股份有限公司,臺北市松山區民生東路4段133號3樓,臺北市松山區精忠里6鄰民生東路四段133號,305938.737,2772371.227
28678306,三六一度半島國際餐飲有限公司,臺北市松山區八德路3段191號2樓,臺北市松山區復勢里1鄰八德路三段191號,306108.853,2771226.866
28679591,嵐蒂國際股份有限公司,臺北市內湖區民權東路6段123巷24號3樓,臺北市內湖區寶湖里3鄰民權東路六段123巷24號,309804.528,2773652.801
28683363,興瀧開發實業有限公司,臺北市中山區天祥路33巷16號,臺北市中山區集英里12鄰天祥路33巷16號,302617.832,2772674.101
28683700,源豐冰溫有限公司,臺北市信義區信義路4段391號7樓之2,臺北市信義區中興里12鄰信義路四段391號,306357.023,2769578.226
28688281,瀚鏘中國有限公司,臺北市大安區忠孝東路4段142號11樓之2,臺北市大安區建倫里1鄰忠孝東路四段142號,305435.731,2770464.431
28688825,碩格科技有限公司,臺北市中正區林森北路5巷10之1號7樓,臺北市中正區梅花里7鄰林森北路5巷10之1號,302896.848,2770878.626
28688888,宏國國際物流有限公司,臺北市中山區南京東路3段189號8樓,臺北市中山區復華里11鄰南京東路三段189號,304710.237,2771656.457
28689140,歐立德國際物流有限公司,臺北市中山區民族東路252巷9號1樓,臺北市中山區行孝里14鄰民族東路252巷9號,303991.32,2773367.629
28692742,奇豆網路科技有限公司,臺北市萬華區漢中街116號,臺北市萬華區西門里7鄰漢中街116號,301207.764,2770615.004
28692927,律僑國際物流有限公司,臺北市中山區建國北路2段33號5樓之8,臺北市中山區朱馥里3鄰建國北路二段33號,304204.491,2771982.163
28694615,冰河森林數位科技股份有限公司,臺北市信義區基隆路2段77號8樓之3,臺北市信義區景聯里4鄰基隆路二段77號,306325.342,2769253.875
28696199,威展環保工程有限公司,臺北市萬華區漢中街147巷22號2樓,臺北市萬華區新起里18鄰漢中街147巷22號,301183.016,2770426.27
28701209,永業物流股份有限公司,臺北市內湖區行愛路100號3樓,臺北市內湖區湖元里18鄰行愛路100號,308576.372,2772894.765
28701340,海學文化事業股份有限公司,臺北市大安區辛亥路1段34巷1號1樓,臺北市大安區大學里19鄰辛亥路一段34巷1號,303513.34,2768074.36
