CID,CNAME,CADDR,Response_Address,Response_X,Response_Y
701755,源泉鋼鐵股份有限公司,臺北市中山區民權東路3段2號12樓,臺北市中山區江寧里14鄰民權東路三段2號,304255.322,2772768.897
713302,友亦企業股份有限公司,臺北市中山區德惠街9號6樓,臺北市中山區圓山里9鄰德惠街9號,302928.973,2773279.004
751121,大洋冷凍股份有限公司,臺北市中山區朱崙街15號,臺北市中山區力行里30鄰朱崙街15號,304269.75,2771446.575
1176152,中菲行國際物流股份有限公司,臺北市內湖區民權東路6段160號11樓,臺北市內湖區寶湖里13鄰民權東路六段160號,309711.229,2773515.268
1180260,巨煥興業股份有限公司,臺北市中山區南京東路2段125號8樓之1,臺北市中山區中央里8鄰南京東路二段125號,303937.54,2771668.29
1193130,哈伯實業有限公司,臺北市中山區建國北路2段88號10樓,臺北市中山區中央里1鄰建國北路二段88號,304131.391,2772109.481
1405633,榮德彩色印刷有限公司,臺北市萬華區東園街35巷62號(1樓),臺北市萬華區日善里3鄰東園街35巷62號,300204.063,2768875.213
1506490,邦普企業有限公司,臺北市大安區安居街34巷6號6樓,臺北市大安區黎孝里5鄰安居街34巷6號,305930.954,2768193.405
2510346,大榮冷凍股份有限公司,臺北市中山區朱崙街15號,臺北市中山區力行里30鄰朱崙街15號,304269.75,2771446.575
2528802,建和冰凍股份有限公司,臺北市中山區朱崙街15號,臺北市中山區力行里30鄰朱崙街15號,304269.75,2771446.575
3036501,三泰化工原料股份有限公司,臺北市中正區延平南路82號1樓,臺北市中正區光復里11鄰延平南路82號,301485.286,2770816.272
3043101,三陽金屬工業股份有限公司,臺北市松山區復興北路57號3樓,臺北市松山區中正里20鄰復興北路57號,304912.496,2771478.752
3049512,三德企業股份有限公司,臺北市中正區延平南路82號,臺北市中正區光復里11鄰延平南路82號,301485.286,2770816.272
3069208,天成飯店股份有限公司,臺北市中正區忠孝西路1段43號,臺北市中正區黎明里3鄰忠孝西路一段43號,302285.084,2770997.59
3098301,中華貿易開發股份有限公司,臺北市大安區住安里信義路4段96號6樓,臺北市大安區住安里18鄰信義路四段96號,305283.855,2769554.425
3244509,亞洲水泥股份有限公司,臺北市大安區敦化南路2段207號30、31樓,臺北市大安區全安里14鄰敦化南路二段207號,305430.665,2768770.912
3251108,和泰汽車股份有限公司,臺北市中山區松江路121號8~14樓,臺北市中山區中央里8鄰松江路121號,303803.838,2771716.175
3283306,厚生股份有限公司,臺北市中正區漢口街1段82號8樓,臺北市中正區光復里5鄰漢口街一段82號,301681.221,2770870.747
3353007,益航股份有限公司,臺北市大安區復興南路2段237號14樓,臺北市大安區群賢里2鄰復興南路二段237號,304871.11,2768750.522
3354202,聯億貿易股份有限公司,臺北市中正區延平南路82號2樓,臺北市中正區光復里11鄰延平南路82號,301485.286,2770816.272
3506003,福大化學工業股份有限公司,臺北市中正區延平南路74號1樓,臺北市中正區光復里11鄰延平南路74號,301489.855,2770834.296
3522003,遠東航空股份有限公司,臺北市松山區敦化北路405巷123弄5號,臺北市松山區精忠里11鄰敦化北路405巷123弄7號,306038.328,2772825.99
3522600,遠東新世紀股份有限公司,臺北市大安區敦化南路2段207號36樓,臺北市大安區全安里14鄰敦化南路二段207號,305430.665,2768770.912
3543210,台榮產業股份有限公司,臺北市中山區南京東路2段206號6樓,臺北市中山區朱園里1鄰南京東路二段206號,304065.932,2771624.336
3555307,台鳳股份有限公司,臺北市中正區重慶南路1段57號11樓之9,臺北市中正區黎明里7鄰重慶南路一段57號,301799.252,2770817.981
3556404,台灣中國運通股份有限公司,臺北市中山區長安東路1段25號11樓,臺北市中山區正得里10鄰長安東路一段25號,302874.134,2771350.418
3564501,台灣三洋電機股份有限公司,臺北市中山區松江路266號10樓,臺北市中山區中庄里21鄰松江路266號,303769.574,2772454.381
3626801,佳美貿易股份有限公司,臺北市內湖區瑞光路302號9樓,臺北市內湖區港墘里20鄰瑞光路302號,307932.41,2774373.396
3634302,台灣夾板實業股份有限公司,臺北市松山區南京東路5段31號10樓,臺北市松山區東光里5鄰南京東路五段31號,306324.892,2771624.054
3634507,台灣通運倉儲股份有限公司,臺北市中山區中山北路2段113號10樓,臺北市中山區聚盛里1鄰中山北路二段113號,302792.383,2772600.382
3741302,中華郵政股份有限公司,臺北市大安區永康里金山南路2段55號,臺北市大安區永康里10鄰金山南路二段55號,303200.341,2769460.447
3795101,台灣肥料股份有限公司,臺北市中山區南京東路2段88號6樓,臺北市中山區興亞里18鄰南京東路二段88號,303580.87,2771615.84
3795904,台灣電力股份有限公司,臺北市中正區羅斯福路3段242號,臺北市中正區文盛里7鄰羅斯福路三段242號,303598.521,2767833.497
4206709,士盟國際通運股份有限公司,臺北市南港區八德路4段778號2樓,臺北市南港區玉成里17鄰八德路四段778號,308548.819,2771489.67
4286999,輝昌有限公司,臺北市大同區迪化街1段136號,臺北市大同區大有里17鄰迪化街一段136號,301426.737,2772228.104
4293133,員和工業股份有限公司,臺北市中山區德惠街9號6樓,臺北市中山區圓山里9鄰德惠街9號,302928.973,2773279.004
4294365,綿興紡織股份有限公司,臺北市大同區迪化街1段63號7樓,臺北市大同區永樂里17鄰迪化街一段63號,301466.786,2772052.802
4327387,永全貨運有限公司,臺北市南港區東新街187號,臺北市南港區新光里13鄰東新街187號,309872.173,2771078.698
4339047,廣齊物流有限公司,臺北市中山區民族東路524號4樓,臺北市中山區下埤里21鄰民族東路524號,304757.57,2773351.59
4345414,玟志企業有限公司,臺北市中山區北安路458巷47弄2號1樓,臺北市中山區永安里3鄰北安路458巷47弄2號,304989.267,2774531.267
4348947,新台塑膠工業股份有限公司,臺北市大同區重慶北路3段9巷31號,臺北市大同區隆和里6鄰重慶北路三段9巷31號,301945.114,2772988.977
4368669,慶宜股份有限公司,臺北市松山區南京東路3段346號3樓,臺北市松山區中正里11鄰南京東路三段346號,305301.733,2771600.655
4378245,得美行股份有限公司,臺北市內湖區民權東路6段160號11樓之1,臺北市內湖區寶湖里13鄰民權東路六段160號,309711.229,2773515.268
4383084,台灣不二實業股份有限公司,臺北市松山區南京東路5段343號9樓,臺北市松山區安平里23鄰南京東路五段343號,307274.939,2771608.233
4387384,同誠興農企業股份有限公司,臺北市中山區松江路363號7樓,臺北市中山區行政里15鄰松江路363號,303819.931,2772953.246
4398474,貿聯企業股份有限公司,臺北市中正區濟南路一段15號,臺北市中正區幸福里3鄰濟南路一段15號,302709.875,2770597.372
4399353,立盟海空通運股份有限公司,臺北市內湖區瑞光路76巷59號5樓,臺北市內湖區湖元里18鄰瑞光路76巷59號,308543.263,2773673.023
4401230,嘉新國際股份有限公司,臺北市中山區中山北路2段96號1樓,臺北市中山區集英里7鄰中山北路二段96號,302732.634,2772468.427
4401323,恆昶實業股份有限公司,臺北市內湖區民權東路6段38號,臺北市內湖區湖元里18鄰民權東路六段38號,308636.478,2773388.884
4404855,昭元化成股份有限公司,臺北市中山區松江路129號9樓,臺北市中山區中央里5鄰松江路129號,303805.734,2771844.231
4407570,金懋企業股份有限公司,臺北市中山區南京東路2段100號5樓,臺北市中山區興亞里18鄰南京東路二段100號,303664.285,2771626.803
4412124,欣臨企業股份有限公司,臺北市中山區南京東路3段70號4樓,臺北市中山區力行里26鄰南京東路三段70號,304373.26,2771618.049
4424022,環宙航空貨運有限公司,臺北市內湖區瑞光路258巷55號4樓,臺北市內湖區港墘里20鄰瑞光路258巷55號,307950.652,2774161.811
4441943,賀華實業股份有限公司,臺北市中山區中山北路1段27號11樓之1,臺北市中山區正得里1鄰中山北路一段27號,302601.252,2771277.456
4445666,浩陽貿易有限公司,臺北市中山區吉林路10號,臺北市中山區興亞里21鄰吉林路10號,303464.991,2771412.263
4448299,臺陽儲運股份有限公司,臺北市中正區紹興北街5號3樓,臺北市中正區梅花里8鄰紹興北街5號,303006.334,2770842.841
4467859,安聯速運有限公司,臺北市大同區五原路2號1樓,臺北市大同區星明里9鄰五原路2號,302247.943,2772121.779
4550147,臺北農產運銷股份有限公司,臺北市中山區民族東路336號,臺北市中山區行孝里16鄰民族東路336號,304209.881,2773408.616
4622563,台灣富士通股份有限公司,臺北市中正區中華路1段39號19樓,臺北市中正區光復里12鄰中華路一段39號,301412.422,2770858.797
4648938,威健實業股份有限公司,臺北市內湖區內湖路1段308號11樓,臺北市內湖區西湖里13鄰內湖路一段308號,307417.34,2774930.783
4690055,洋基通運股份有限公司,臺北市中山區建國北路2段82號1樓,臺北市中山區中央里1鄰建國北路二段82號,304129.989,2772037.374
4708554,台茂通運報關有限公司,臺北市松山區南京東路5段389巷8號1樓,臺北市松山區安平里8鄰南京東路五段389巷8號,307436.786,2771658.065
4745740,內外實業股份有限公司,臺北市信義區基隆路2段149之17號10樓,臺北市信義區黎順里8鄰基隆路二段149之17號,306052.884,2768848.93
4747796,瑞順企業股份有限公司,臺北市中正區重慶南路1段121號4樓之9,臺北市中正區黎明里9鄰重慶南路一段121號,301802.599,2770552.616
4784911,福泉工程股份有限公司,臺北市松山區富錦街89號1樓,臺北市松山區精忠里10鄰富錦街89號,305702.126,2772533.437
4788347,承欣交通有限公司,臺北市士林區福壽街12號,臺北市士林區舊佳里9鄰福壽街12號,303021.22,2776500.245
4792742,甘霖國際物流股份有限公司,臺北市中山區中山北路2段68號3樓,臺北市中山區民安里18鄰中山北路二段68號,302726.236,2772173.521
4816630,奇羽企業有限公司,臺北市南港區向陽路120巷2弄29號2樓,臺北市南港區東新里20鄰向陽路120巷2弄29號,310281.802,2771979.818
4822990,弘專有限公司,臺北市大安區新生南路3段2號10樓,臺北市大安區龍坡里1鄰新生南路三段2號,303954.774,2768739.365
4824499,智彬電機有限公司,臺北市內湖區內湖路1段91巷24弄2號,臺北市內湖區西康里16鄰內湖路一段91巷24弄2號,306712.426,2775323.289
4906317,大遠工程有限公司,臺北市文山區和平東路4段83號1樓,臺北市文山區博嘉里13鄰和平東路四段83號,307289.966,2766491.791
4906610,爾雅有限公司,臺北市松山區南京東路３段２６９巷６號５樓之１,臺北市松山區中正里26鄰南京東路三段269巷6號,305053.508,2771709.892
4927158,陸海股份有限公司,臺北市松山區復興北路99號13樓,臺北市松山區中正里31鄰復興北路99號,304916.628,2771741.723
4933975,美孚建設股份有限公司,臺北市信義區市民大道6段288號9樓之7,臺北市信義區永吉里1鄰市民大道六段288號,308435.453,2771353.716
4937233,大業倉儲股份有限公司,臺北市大安區敦化南路2段76號6樓之2,臺北市大安區龍雲里19鄰敦化南路二段76號,305341.756,2769113.396
4949174,林克航空貨運代理股份有限公司,臺北市內湖區瑞光路360號7樓,臺北市內湖區港墘里20鄰瑞光路360號,307742.173,2774455.706
4964250,東森國際股份有限公司,臺北市大安區復興南路1段368號5樓、8樓及370號6樓、11樓,臺北市大安區和安里4鄰復興南路一段368號,304835.541,2769757.148
5060358,盈祺國際物流有限公司,臺北市中正區忠孝東路2段96號2樓,臺北市中正區幸市里1鄰忠孝東路二段96號,303501.64,2770626.664
5071405,台灣快桅股份有限公司,臺北市松山區敦化南路1段2號10樓,臺北市松山區福成里1鄰敦化南路一段2號,305342.194,2771194.241
5085203,寶豐隆興業股份有限公司,臺北市大安區仁愛路4段71巷36號2樓,臺北市大安區仁愛里20鄰仁愛路四段71巷36號,305222.003,2770359.502
5091774,世平興業股份有限公司,臺北市南港區成功路1段74號、76號8樓,臺北市南港區西新里8鄰成功路一段74號,309772.598,2772210.195
5191491,台灣波律股份有限公司,臺北市松山區民權東路3段178號14樓,臺北市松山區民有里30鄰民權東路三段178號,305444.359,2772697.768
5258865,聯華氣體工業股份有限公司,臺北市大同區承德路1段44號6樓,臺北市大同區建泰里17鄰承德路一段44號,302159.728,2771564.702
5415289,協達機械起重工程有限公司,臺北市南港區成功路1段23號,臺北市南港區西新里6鄰成功路一段23號,309848.465,2772018.606
5427763,鼎擎金屬工程有限公司,臺北市南港區市民大道7段35號1樓,臺北市南港區玉成里20鄰市民大道七段35號,308767.465,2771404.242
5634637,六霖企業有限公司,臺北市中正區杭州南路1段19號10樓,臺北市中正區幸福里12鄰杭州南路一段19號,303131.945,2770592.834
5635571,伯罕企業有限公司,臺北市文山區景興路195號8樓之1,臺北市文山區景東里24鄰景興路195號,304925.616,2765011.546
5711866,全銓租賃股份有限公司,臺北市大安區敦化南路2段69號9樓,臺北市大安區義安里13鄰敦化南路二段69號,305417.569,2769288.17
5941706,和豐化工企業股份有限公司,臺北市松山區敦化北路207號4樓之7,臺北市松山區精忠里4鄰敦化北路207號,305439.614,2772316.944
7046620,中日國際企業股份有限公司,臺北市中山區力行里12鄰復興北路48號7樓,臺北市中山區力行里12鄰復興北路48號,304865.651,2771374.679
7057442,六和化工股份有限公司,臺北市中山區德惠街9號6樓,臺北市中山區圓山里9鄰德惠街9號,302928.973,2773279.004
7067309,味王股份有限公司,臺北市中山區聚盛里中山北路2段79號5樓,臺北市中山區聚盛里1鄰中山北路二段79號,302776.665,2772326.294
7097009,明志交通有限公司,臺北市中山區民權東路3段58號7樓之5,臺北市中山區江寧里18鄰民權東路三段58號,304709.524,2772772.343
7284214,瑞圓纖維股份有限公司,臺北市中山區復興北路８６號５樓,臺北市中山區力行里14鄰復興北路86號,304869.458,2771559.826
7305105,台灣豐田通商股份有限公司,臺北市信義區松仁路101號5樓,臺北市信義區安康里9鄰松仁路101號,307387.803,2769881.418
7330809,桃源紡織股份有限公司,臺北市大同區長安西路303號7樓之1,臺北市大同區玉泉里8鄰長安西路303號,301219.609,2771675.788
7487111,新燕實業股份有限公司,臺北市內湖區內湖路1段512號3樓,臺北市內湖區港墘里20鄰內湖路一段512號,307887.406,2774803.644
7608781,有志貨運物流有限公司,臺北市士林區承德路4段33巷10號2樓,臺北市士林區明勝里5鄰承德路四段33巷10號,302772.563,2774801.645
7613308,亞東開發科技有限公司,臺北市士林區前港街120巷1號1樓,臺北市士林區百齡里18鄰前港街120巷1號,302260.734,2775287.405
7649690,億高資產管理股份有限公司,臺北市松山區健康路6號,臺北市松山區東勢里15鄰健康路6號,305767.208,2771669.883
7708830,花仙子企業股份有限公司,臺北市大同區承德路3段230號13樓,臺北市大同區保安里8鄰承德路三段230號,302306.424,2773894.014
9442581,東典貿易股份有限公司,臺北市大安區敦化南路2段99號23樓,臺北市大安區義安里16鄰敦化南路二段99號,305422.178,2769080.889
9462164,呈達科技股份有限公司,臺北市大安區忠孝東路4段223巷5號11樓之1,臺北市大安區建安里20鄰忠孝東路四段223巷5號,305789.601,2770517.642
9462538,佳濃實業有限公司,臺北市中山區松江路194巷36號,臺北市中山區中吉里20鄰松江路194巷36號,303592.502,2772204.681
9473177,甘氏貿易有限公司,臺北市大安區復興南路2段236號4樓之5,臺北市大安區龍生里1鄰復興南路二段236號,304813.802,2768670.432
11007515,七巧通運股份有限公司,臺北市中山區建國北路2段147之2號,臺北市中山區江寧里1鄰建國北路二段147之2號,304232.016,2772722.318
11026506,大同股份有限公司,臺北市中山區集英里21鄰中山北路3段22號,臺北市中山區集英里21鄰中山北路三段22號,302636.351,2773019.802
11072509,三福氣體股份有限公司,臺北市中山區中山北路2段21號5樓,臺北市中山區康樂里2鄰中山北路二段21號,302750.855,2771752.363
11167006,正大纖維工業股份有限公司,臺北市中山區南京東路1段21號,臺北市中山區康樂里1鄰南京東路一段21號,302877.489,2771679.965
11169010,永通國際物流股份有限公司,臺北市松山區富錦街77巷2弄4號1樓,臺北市松山區精忠里10鄰富錦街77巷2弄4號,305671.077,2772563.39
11173598,立天行通運股份有限公司,臺北市內湖區瑞光路258巷50號4樓,臺北市內湖區港墘里20鄰瑞光路258巷50號,307996.419,2774169.609
11182800,雍利企業股份有限公司,臺北市中山區長安東路1段25號11樓,臺北市中山區正得里10鄰長安東路一段25號,302874.134,2771350.418
11189803,永和順股份有限公司,臺北市中山區南京東路2段98號10樓,臺北市中山區興亞里18鄰南京東路二段98號,303647.668,2771626.958
11261451,旭懋企業股份有限公司,臺北市中山區松江路67號10樓之6,臺北市中山區朱園里11鄰松江路67號,303798.737,2771336.96
11286039,宏吉企業股份有限公司,臺北市松山區敦化南路1段2號4樓之1,臺北市松山區福成里1鄰敦化南路一段2號,305342.194,2771194.241
11332202,東元電機股份有限公司,臺北市中山區松江路156-2號,臺北市中山區中吉里8鄰松江路156之2號,303763.984,2771937.097
11349370,德莎運通股份有限公司,臺北市中山區民權東路3段35號10樓,臺北市中山區下埤里1鄰民權東路三段35號,304702.086,2772815.321
11384405,東<U+78B1>股份有限公司,臺北市大安區敦化南路2段99號23樓,臺北市大安區義安里16鄰敦化南路二段99號,305422.178,2769080.889
11438401,坤慶國際開發股份有限公司,臺北市信義區忠孝東路4段560號9樓之2,臺北市信義區興隆里15鄰忠孝東路四段560號,306900.85,2770435.559
11472110,飛翔航空貨運承攬股份有限公司,臺北市中山區松江路328號10樓之10,臺北市中山區新生里3鄰松江路328號,303771.766,2772638.517
11505604,美商美國新美股份有限公司,臺北市大安區龍雲里敦化南路2段76號9樓之2,臺北市大安區龍雲里19鄰敦化南路二段76號,305341.756,2769113.396
11511090,皇冠金屬工業股份有限公司,臺北市中山區復興南路1段2號8樓之1,臺北市中山區埤頭里15鄰復興南路一段2號,304858.884,2771113.492
11520909,南港輪胎股份有限公司,臺北市大安區仁愛路3段136號6樓608室,臺北市大安區和安里1鄰仁愛路三段136號,304634.836,2770041.732
11522202,香港商信可股份有限公司,臺北市中山區民生東路3段49號3樓,臺北市中山區江山里10鄰民生東路三段49號,304489.825,2772319.942
11529802,春源鋼鐵工業股份有限公司,臺北市中山區復興北路502號6樓、6樓之1、7樓、7樓之1,臺北市中山區下埤里13鄰復興北路502號,304895.516,2773151.348
11653034,甲天下股份有限公司,臺北市大同區西寧北路62號8樓之11,臺北市大同區玉泉里10鄰西寧北路62號,301304.453,2771704.364
11768107,裕信股份有限公司,臺北市松山區民權東路3段170號12樓之1,臺北市松山區民有里30鄰民權東路三段170號,305382.617,2772714.539
11825825,嘉裕股份有限公司,臺北市大安區仁愛路4段25號7樓,臺北市大安區仁愛里5鄰仁愛路四段25號,304969.97,2770123.203
11828007,台北貿易股份有限公司,臺北市中山區松江路363號8樓,臺北市中山區行政里15鄰松江路363號,303819.931,2772953.246
11832971,台灣德信海空運承攬股份有限公司,臺北市中山區南京東路3段219號4樓,臺北市中山區復華里11鄰南京東路三段219號,304798.282,2771654.636
11880755,湳開股份有限公司,臺北市內湖區南京東路6段348號4樓及新明路174巷13號1樓、地下1樓,臺北市內湖區石潭里11鄰南京東路六段451巷15號,309246.011,2772689.53
11892605,嘉新食品化纖股份有限公司,臺北市大安區忠孝東路4段219號6樓,臺北市大安區建安里20鄰忠孝東路四段219號,305752.357,2770505.971
11892801,嘉新水泥股份有限公司,臺北市中山區中山北路2段96號,臺北市中山區集英里7鄰中山北路二段96號,302732.634,2772468.427
11912102,台灣紙業股份有限公司,臺北市中山區建國北路1段96號10樓,臺北市中山區朱園里3鄰建國北路一段96號,304112.727,2771462.392
11913502,臺灣水泥股份有限公司,臺北市中山區中山北路2段113號,臺北市中山區聚盛里1鄰中山北路二段113號,302792.383,2772600.382
11915305,台灣日立股份有限公司,臺北市中山區南京東路3段61號1、2樓63號1、2、3、4樓,臺北市中山區復華里14鄰南京東路三段61號,304295.018,2771663.97
11941057,震豐股份有限公司,臺北市中正區羅斯福路2段44號4樓,臺北市中正區南福里2鄰羅斯福路二段44號,302630.886,2768976.003
12015605,馥麗工業股份有限公司,臺北市大安區仁愛路4段376號13樓,臺北市大安區光信里10鄰仁愛路四段376號,306081.862,2770035.792
12101307,海豐運通股份有限公司,臺北市中山區松江路87號6樓,臺北市中山區朱園里9鄰松江路87號,303800.072,2771471.395
12105486,七洋聯運股份有限公司,臺北市中山區南京東路2段206號11樓,臺北市中山區朱園里1鄰南京東路二段206號,304065.932,2771624.336
12128426,立通股份有限公司,臺北市松山區敦化北路201之18號12樓,臺北市松山區精忠里4鄰敦化北路201之18號,305450.142,2772188.421
12132033,元禎企業股份有限公司,臺北市松山區民生東路4段54號3樓之3,臺北市松山區精忠里4鄰民生東路四段54號,305583.932,2772285.491
12133650,台灣美強股份有限公司,臺北市中山區南京東路2段66號4樓,臺北市中山區興亞里18鄰南京東路二段66號,303512.993,2771627.349
12135600,統振股份有限公司,臺北市內湖區安美街181號1樓及6樓,臺北市內湖區蘆洲里3鄰安美街181號,310654.259,2772574.973
12147612,泰岫企業股份有限公司,臺北市松山區復興北路３３７號５樓,臺北市松山區民有里5鄰復興北路337號,304936.767,2772557.928
12160255,新竹化工實業股份有限公司,臺北市中山區松江路82號3樓,臺北市中山區興亞里15鄰松江路82號,303756.826,2771423.321
12167948,金慶實業股份有限公司,臺北市松山區南京東路3段248號10樓之2,臺北市松山區中正里21鄰南京東路三段248號,304947.513,2771608.137
12177447,利多福股份有限公司,臺北市大同區民權西路104號7樓之1,臺北市大同區民權里21鄰民權西路104號,302212.378,2772822.792
12177592,台灣三菱電機股份有限公司,臺北市士林區中山北路6段88號11樓,臺北市士林區忠誠里19鄰中山北路六段88號,302947.337,2777509.225
12206034,新健海運股份有限公司,臺北市中山區民權東路3段4號3樓,臺北市中山區江寧里14鄰民權東路三段4號,304340.299,2772766.272
12208321,南聯國際貿易股份有限公司,臺北市信義區忠孝東路4段560號12樓,臺北市信義區興隆里15鄰忠孝東路四段560號,306900.85,2770435.559
12215548,精技電腦股份有限公司,臺北市內湖區新湖二路236號3樓,臺北市內湖區湖元里18鄰新湖二路236號,308727.033,2773033.546
12217150,元寶實業股份有限公司,臺北市內湖區瑞湖街182號,臺北市內湖區湖元里18鄰瑞湖街182號,308143.983,2773598.693
12229178,康福搬家貨運有限公司,臺北市松山區撫遠街259號,臺北市松山區新益里8鄰撫遠街259號,307211.757,2772645.115
12232981,台灣東芝電子零組件股份有限公司,臺北市中山區民生東路3段10號10樓,臺北市中山區朱馥里10鄰民生東路三段10號,304324.122,2772266.784
12264131,毅太企業股份有限公司,臺北市中山區建國北路2段147號6樓,臺北市中山區江寧里1鄰建國北路二段147號,304215.429,2772706.372
12278607,臺灣寶露股份有限公司,臺北市中山區中山北路2段45巷23號6樓,臺北市中山區康樂里5鄰中山北路二段45巷23號,302874.35,2771913.031
12324709,企榮股份有限公司,臺北市中山區松江路66號12樓,臺北市中山區興亞里14鄰松江路66號,303755.86,2771320.18
12332932,浩閎有限公司,臺北市大安區忠孝東路4段289號7樓,臺北市大安區華聲里11鄰忠孝東路四段289號,305976.888,2770501.153
12340449,海捷股份有限公司,臺北市中山區松江路76號9樓,臺北市中山區興亞里14鄰松江路76號,303756.591,2771382.281
12341051,康舒科技股份有限公司,臺北市松山區南京東路5段99號11樓,臺北市松山區東光里24鄰南京東路五段99號,306550.679,2771620.86
12367208,台灣範卯實業有限公司,臺北市松山區南京東路5段208號12樓,臺北市松山區新聚里29鄰南京東路五段208號,307007.603,2771566.168
