CID,CNAME,CADDR,Response_Address,Response_X,Response_Y
22957766,美商達美航空股份有限公司,臺北市松山區敦化南路1段2號9樓,臺北市松山區福成里1鄰敦化南路一段2號,305342.194,2771194.241
23023595,金洲股份有限公司,臺北市大安區忠孝東路3段239號4樓,臺北市大安區誠安里1鄰忠孝東路三段239號,304567.39,2770521.947
23026093,偉瀚實業股份有限公司,臺北市士林區後港街169號1樓2樓,臺北市士林區前港里3鄰後港街169號,302571.832,2775570.362
23046859,昌億運通股份有限公司,臺北市信義區松信路１８號１樓,臺北市信義區雅祥里17鄰松信路18號,307723.622,2771275.254
23050488,泰德物流有限公司,臺北市中山區新生北路3段19巷36號1樓,臺北市中山區新福里13鄰新生北路三段19巷36號,303406.656,2772962.698
23060232,台灣善美的股份有限公司,臺北市中山區敬業四路33號8樓,臺北市中山區金泰里14鄰敬業四路33號,306288.398,2774870.314
23060401,台灣上組股份有限公司,臺北市中山區建國北路2段129號12樓,臺北市中山區江山里7鄰建國北路二段129號,304212.476,2772532.814
23060541,聯強國際股份有限公司,臺北市中山區民生東路3段75號4樓,臺北市中山區江山里23鄰民生東路三段75號,304867.903,2772315.781
23060824,千日股份有限公司,臺北市中山區南京東路2段90號20樓,臺北市中山區興亞里18鄰南京東路二段90號,303589.581,2771615.76
23064011,紀森實業股份有限公司,臺北市大安區臥龍街3號8樓之1,臺北市大安區虎嘯里2鄰臥龍街3號,305181.146,2768592.9
23114552,尚義工程股份有限公司,臺北市內湖區成功路5段87之2號,臺北市內湖區金湖里7鄰成功路五段87之2號,311052.015,2774098.052
23117328,安地企業有限公司,臺北市中正區汀州路1段193號2樓,臺北市中正區永功里15鄰汀州路一段193號,301600.552,2768864.576
23134543,捷元股份有限公司,臺北市內湖區瑞光路66巷36號,臺北市內湖區湖元里18鄰瑞光路66巷36號,308643.533,2773660.912
23137871,大躍環球物流有限公司,臺北市中山區松江路66號8樓,臺北市中山區興亞里14鄰松江路66號,303755.86,2771320.18
23145632,帆宣系統科技股份有限公司,臺北市南港區園區街3-2號6樓,臺北市南港區三重里25鄰園區街3之2號,311739.337,2772220.871
23152443,拓領環球運輸股份有限公司,臺北市內湖區堤頂大道2段301號6樓,臺北市內湖區西湖里13鄰堤頂大道二段301號,306984.949,2774624.575
23219388,美商優比速國際股份有限公司,臺北市士林區大南路361號地下1樓,臺北市士林區福中里10鄰大南路361號,302096.505,2775723.049
23219465,龍霖投資股份有限公司,臺北市中山區明水路411號7樓,臺北市中山區永安里29鄰明水路411號,305334.815,2774476.401
23220076,昌盛國際企業股份有限公司,臺北市松山區南京東路3段248號10樓之2,臺北市松山區中正里21鄰南京東路三段248號,304947.513,2771608.137
23224707,百陸達股份有限公司,臺北市信義區基隆路2段149之17號10樓,臺北市信義區黎順里8鄰基隆路二段149之17號,306052.884,2768848.93
23226418,多禮股份有限公司,臺北市中山區中山北路2段45巷21之1號3樓,臺北市中山區康樂里5鄰中山北路二段45巷21之1號,302855.656,2771913.856
23263834,中棉倉儲股份有限公司,臺北市中山區長安東路1段63之1號5樓,臺北市中山區正義里2鄰長安東路一段63之1號,303209.828,2771266.53
23284134,慶威集運有限公司,臺北市中山區長安東路2段80號2樓之1,臺北市中山區朱園里13鄰長安東路二段80號,303892.138,2771237.566
23285582,萊爾富國際股份有限公司,臺北市內湖區西湖里瑞光路502號3樓,臺北市內湖區西湖里13鄰瑞光路502號,307312.72,2774675.549
23297476,盈健股份有限公司,臺北市中山區松江路54號6樓之2,臺北市中山區興亞里13鄰松江路54號,303755.321,2771275.43
23309091,都城實業股份有限公司,臺北市大安區忠孝東路4段312號8樓之3,臺北市大安區正聲里14鄰忠孝東路四段312號,306192.509,2770450.142
23311033,旗標出版股份有限公司,臺北市中正區杭州南路1段15之1號19樓,臺北市中正區幸福里12鄰杭州南路一段15之1號,303163.735,2770617.023
23319491,富崙有限公司,臺北市內湖區成功路4段30巷10號11樓之1,臺北市內湖區內湖里11鄰成功路四段30巷10號,309646.957,2774998.077
23323707,中華通路租賃股份有限公司,臺北市大安區安和路1段29號15樓,臺北市大安區建倫里3鄰安和路一段29號,305542.774,2770224.585
23357403,光寶科技股份有限公司,臺北市內湖區瑞光路392號22樓,臺北市內湖區港墘里20鄰瑞光路392號,307627.173,2774516.717
23357733,吸引力綜合百貨股份有限公司,臺北市信義區松仁路89號5樓,臺北市信義區安康里8鄰松仁路89號,307392.924,2770021.133
23416579,美商聯邦快遞股份有限公司,臺北市中山區中山北路2段61號9樓,臺北市中山區中山里4鄰中山北路二段61號,302765.038,2772092.58
23420757,潤力有限公司,臺北市南港區重陽路522號1樓,臺北市南港區三重里4鄰重陽路522號,311797.845,2772689.665
23450098,聚孚企業股份有限公司,臺北市大安區復興南路１段３５２號５樓之１,臺北市大安區和安里3鄰復興南路一段352號,304829.166,2769825.38
23451224,瑪蒂雅股份有限公司,臺北市中山區松江路25巷2、4號1樓,臺北市中山區朱園里19鄰松江路25巷2號,303820.624,2771089.086
23454263,恩比仕科技股份有限公司,臺北市中山區民權東路1段36號7樓之1,臺北市中山區聚葉里2鄰民權東路一段36號,302851.939,2772805.462
23503264,開成實業有限公司,臺北市大同區西寧北路62之5號8樓,臺北市大同區玉泉里10鄰西寧北路62之5號,301309.349,2771746.01
23525865,台灣住倉股份有限公司,臺北市中山區中山北路2段129號8樓之3,臺北市中山區聚葉里1鄰中山北路二段129號,302783.595,2772686.469
23527441,台灣瑞薩電子股份有限公司,臺北市松山區復興北路363號13樓,臺北市松山區民有里5鄰復興北路363號,304930.074,2772631.337
23528309,台灣三井物產股份有限公司,臺北市大安區敦化南路2段97號20、21樓,臺北市大安區義安里16鄰敦化南路二段97號,305422.269,2769092.35
23529341,郵船通運股份有限公司,臺北市中正區忠孝東路2段88號8樓,臺北市中正區幸福里16鄰忠孝東路二段88號,303424.556,2770649.374
23529784,捷盟行銷股份有限公司,臺北市信義區忠孝東路4段560號7樓,臺北市信義區興隆里15鄰忠孝東路四段560號,306900.85,2770435.559
23534251,天剛資訊股份有限公司,臺北市中山區中山北路3段27號3樓之5,臺北市中山區晴光里15鄰中山北路三段27號,302710.087,2773121.74
23589972,尊貿化學有限公司,臺北市松山區敦化北路207號4樓之8及10,臺北市松山區精忠里4鄰敦化北路207號,305439.614,2772316.944
23590226,東合冷凍食品有限公司,臺北市萬華區西藏路478號1樓,臺北市萬華區和平里23鄰西藏路478號,299904.639,2769070.034
23591040,彩辰廣告股份有限公司,臺北市內湖區文德路208巷62號,臺北市內湖區瑞陽里6鄰文德路208巷62號,308849.343,2774345.447
23591219,鼎太國際股份有限公司,臺北市中正區和平西路1段170號2樓,臺北市中正區螢雪里13鄰和平西路一段170號,301955.836,2768916.869
23599423,生于貿易股份有限公司,臺北市中山區建國北路2段65號8樓,臺北市中山區朱馥里3鄰建國北路二段65號,304206.808,2772076.825
23606775,台灣三井倉庫股份有限公司,臺北市中山區松江路80號10樓,臺北市中山區興亞里15鄰松江路80號,303756.755,2771406.662
23615486,力麗觀光開發股份有限公司,臺北市中山區松江路162號3樓,臺北市中山區中吉里10鄰松江路162號,303764.297,2772017.155
23617668,達優利國際運通有限公司,臺北市松山區八德路4段135號2樓之1,臺北市松山區吉祥里10鄰八德路四段135號,306724.767,2771296.026
23623795,嘉榮行銷股份有限公司,臺北市中山區民生東路3段77號3樓,臺北市中山區江山里23鄰民生東路三段77號,304874.212,2772322.113
23625631,遠東生物科技股份有限公司,臺北市南港區園區街3號13樓,臺北市南港區三重里25鄰園區街3號,311745.412,2772394.44
23629572,溫鼎億貿易化工有限公司,臺北市松山區敦化北路207號4樓之6及9、7樓之2,臺北市松山區精忠里4鄰敦化北路207號,305439.614,2772316.944
23640801,所羅門股份有限公司,臺北市內湖區行忠路42號6樓,臺北市內湖區湖元里18鄰行忠路42號,308290.959,2773138.478
23732055,高效率數位科技股份有限公司,臺北市中山區復興南路1段36號3樓,臺北市中山區埤頭里17鄰復興南路一段36號,304858.948,2771008.526
23733420,東宜資訊股份有限公司,臺北市信義區光復南路495號3樓、3樓之1,臺北市信義區中興里2鄰光復南路495號,306298.666,2769488.833
23739368,前錦國際開發室內裝修設計工程有限公司,臺北市松山區復興北路57號15樓之4,臺北市松山區中正里20鄰復興北路57號,304912.496,2771478.752
23742856,吉杏展業股份有限公司,臺北市大安區延吉街239號3樓,臺北市大安區光信里11鄰延吉街239號,306077.009,2769914.06
23746017,嚨福貿易有限公司,臺北市士林區德行東路190巷1弄8號1樓,臺北市士林區聖山里9鄰德行東路190巷1弄8號,303599.811,2777895.627
23746190,瑞登國際有限公司,臺北市內湖區堤頂大道2段477號8樓之1,臺北市內湖區西康里26鄰堤頂大道二段477號,306714.499,2774967.7
23756788,海聯國際有限公司,臺北市中山區中山北路2段129號8樓之2,臺北市中山區聚葉里1鄰中山北路二段129號,302783.595,2772686.469
23761071,高佳林實業股份有限公司,臺北市內湖區新湖一路89號3樓,臺北市內湖區湖元里18鄰新湖一路89號,308100.893,2772380.19
23761945,道成企業有限公司,臺北市文山區羅斯福路6段142巷82號1樓,臺北市文山區景仁里15鄰羅斯福路六段142巷82號,304371.445,2765592.344
23788698,陸耀貿易有限公司,臺北市中山區明水路397巷19弄22號(1樓),臺北市中山區永安里25鄰明水路397巷19弄22號,305412.918,2774590.14
23885137,芫玉企業有限公司,臺北市中正區桃源街13號6樓之3,臺北市中正區建國里5鄰桃源街13號,301518.907,2770504.789
23885559,巨大國際通運股份有限公司,臺北市松山區民生東路5段165號8樓,臺北市松山區富錦里3鄰民生東路五段165號,306917.16,2772453.412
23892989,舜翊有限公司,臺北市中山區新生北路1段25之2號1樓,臺北市中山區興亞里9鄰新生北路一段25之2號,303612.241,2771107.511
23908862,昶志企管顧問有限公司,臺北市中山區松江路32之1號8樓,臺北市中山區興亞里4鄰松江路32之1號,303753.782,2771127.261
23912471,翔正行有限公司,臺北市中山區民權西路11號10樓,臺北市中山區集英里18鄰民權西路11號,302649.023,2772855.074
23918165,思高國際物流有限公司,臺北市中山區民權東路1段76號13樓,臺北市中山區聚葉里12鄰民權東路一段76號,303003.48,2772802.972
23931049,商船三井物流股份有限公司,臺北市中山區南京東路2段71號6樓,臺北市中山區中吉里1鄰南京東路二段71號,303560.533,2771670.32
23984185,英屬維爾京群島商高力國際股份有限公司,臺北市信義區信義路5段7號49樓,臺北市信義區西村里8鄰信義路五段7號,306976.247,2769609.563
23988865,華信航空股份有限公司,臺北市松山區敦化北路405巷123弄3號,臺北市松山區精忠里11鄰敦化北路405巷123弄7號,306038.328,2772825.99
24042542,南港鐵路承攬運輸行有限公司,臺北市南港區舊莊街1段64號5樓,臺北市南港區舊莊里3鄰舊莊街一段64號,312421.544,2770464.531
24231924,瑞程供應鏈有限公司,臺北市松山區八德路4段106巷4弄10號,臺北市松山區復盛里18鄰八德路四段106巷4弄10號,306548.187,2771162.187
24273085,全磐興業股份有限公司,臺北市大安區復興南路2段327號7樓之1,臺北市大安區臥龍里8鄰復興南路二段327號,304857.764,2768528.794
24274681,中聯產經股份有限公司,臺北市中山區長安東路1段63之1號2樓,臺北市中山區正義里2鄰長安東路一段63之1號,303209.828,2771266.53
24289853,賽亞實業有限公司,臺北市大安區敦化南路1段205號14樓之3,臺北市大安區建安里15鄰敦化南路一段205號,305423.834,2770542.762
24296799,三通物流有限公司,臺北市松山區八德路4段699號11樓之1,臺北市松山區慈祐里20鄰八德路四段699號,308183.427,2771462.572
24299867,創品企業有限公司,臺北市中山區復興南路1段36之1號3樓,臺北市中山區埤頭里17鄰復興南路一段36之1號,304858.771,2771002.359
24300267,詩樺有限公司,臺北市內湖區行愛路169號2樓,臺北市內湖區湖元里18鄰行愛路169號,308468.982,2773121.677
24300956,豐立物流股份有限公司,臺北市中山區南京東路2段206號13樓之3,臺北市中山區朱園里1鄰南京東路二段206號,304065.932,2771624.336
24303721,台灣國際瓷業有限公司,臺北市南港區昆陽街140巷21號,臺北市南港區新光里2鄰昆陽街140巷21號,309869.162,2771415.84
24305039,慶烽建設有限公司,臺北市中山區復興北路488巷1弄3號,臺北市中山區下埤里13鄰復興北路488巷1弄3號,304865.245,2773121.569
24306852,彩廣人資行銷有限公司,臺北市松山區塔悠路292號,臺北市松山區新益里12鄰塔悠路292號,307375.968,2772521.826
24307249,富聯光電股份有限公司,臺北市中正區八德路1段30號3樓,臺北市中正區梅花里15鄰八德路一段30號,303498.847,2770711.795
24307563,大自然農場股份有限公司,臺北市松山區南京東路4段137號9樓之2,臺北市松山區東勢里1鄰南京東路四段137號,306033.093,2771630.363
24307590,大宏航業股份有限公司,臺北市信義區基隆路1段143號10樓之2,臺北市信義區興雅里10鄰基隆路一段143號,307092.307,2770648.837
24308731,裕達國際有限公司,臺北市文山區景華街150巷9號,臺北市文山區興安里21鄰景華街150巷9號,305330.412,2765524.011
24309231,有鵬股份有限公司,臺北市大安區信義路3段99巷34號,臺北市大安區和安里13鄰信義路三段99巷34號,304327.726,2769746.138
24310434,都訊聯合資訊有限公司,臺北市萬華區富民路155巷49號3樓之2,臺北市萬華區興德里15鄰富民路155巷49號,300601.225,2767939.416
24312279,諺暘開發有限公司,臺北市大同區太原路117號4樓,臺北市大同區建泰里2鄰太原路117號,302061.497,2771725.894
24313559,美善品企業有限公司,臺北市中山區德惠街79巷2號1樓,臺北市中山區新庄里21鄰德惠街79巷2號,303313.1,2773287.737
24317400,奧寶運通有限公司,臺北市大安區信義路4段6號6樓,臺北市大安區住安里3鄰信義路四段6號,304909.961,2769557.308
24318180,全博物流股份有限公司,臺北市士林區至誠路2段17號2樓,臺北市士林區名山里4鄰至誠路二段17號,303451.056,2777193.597
24321811,勤裕物業股份有限公司,臺北市中山區民權東路3段58號15樓之2,臺北市中山區江寧里18鄰民權東路三段58號,304709.524,2772772.343
24324198,奕誠策略行銷有限公司,臺北市文山區羅斯福路5段35號,臺北市文山區萬盛里1鄰羅斯福路五段35號,304378.108,2766717.708
24326225,新港全球物流有限公司,臺北市中山區長安東路2段169號2樓,臺北市中山區力行里4鄰長安東路二段169號,304560.426,2771249.867
24326415,國暉開發股份有限公司,臺北市中正區忠孝西路1段50號11樓之15,臺北市中正區黎明里11鄰忠孝西路一段50號,302048.097,2771005.519
24327189,帝圖科技文化股份有限公司,臺北市內湖區堤頂大道2段297號6樓,臺北市內湖區西湖里13鄰堤頂大道二段297號,307011.619,2774614.731
24327596,當代化學股份有限公司,臺北市大安區東豐街52號2樓,臺北市大安區德安里10鄰東豐街52號,305183.071,2769869.739
24329308,興律股份有限公司,臺北市松山區民權東路3段178號14樓,臺北市松山區民有里30鄰民權東路三段178號,305444.359,2772697.768
24329623,翡翠森林股份有限公司,臺北市內湖區民權東路6段180巷6號10樓之23,臺北市內湖區寶湖里13鄰民權東路六段180巷6號,309789.618,2773462.164
24332578,雍久有限公司,臺北市信義區忠孝東路5段250號6樓,臺北市信義區廣居里3鄰忠孝東路五段250號,307798.193,2770417.413
24332697,友巧國際貿易有限公司,臺北市中山區復興北路48號3樓,臺北市中山區力行里12鄰復興北路48號,304865.651,2771374.679
24333767,璞森國際有限公司,臺北市中山區通北街124號,臺北市中山區劍潭里9鄰通北街124號,304253.144,2775181.993
24336602,鑫湛國際管理顧問股份有限公司,臺北市中正區忠孝東路2段35號,臺北市中正區梅花里12鄰忠孝東路二段35號,303279.09,2770738.18
24338778,騰順國際有限公司,臺北市中山區復興北路490號2樓,臺北市中山區下埤里13鄰復興北路490號,304894.311,2773110.225
24342787,廣捷國際運通有限公司,臺北市松山區南京東路4段93號9樓之2,臺北市松山區東勢里2鄰南京東路四段93號,305912.33,2771632.428
24343408,世茂重機械股份有限公司,臺北市中山區中山北路3段53之4號3樓之7,臺北市中山區圓山里13鄰中山北路三段53之4號,302758.307,2773399.454
24345898,普騰科技有限公司,臺北市松山區南京東路4段164號6樓之4,臺北市松山區復勢里21鄰南京東路四段164號,306169.585,2771583.521
24346215,山水聯合有限公司,臺北市松山區南京東路4段93號12樓,臺北市松山區東勢里2鄰南京東路四段93號,305912.33,2771632.428
24347609,台灣萬絡環球物流有限公司,臺北市信義區信義路5段8號14樓,臺北市信義區景新里15鄰信義路五段8號,306573.939,2769531.153
24347729,馥傳電通有限公司,臺北市大安區安和路2段217巷12號,臺北市大安區全安里8鄰安和路二段217巷12號,305579.274,2768755.663
24348327,永棠國際股份有限公司,臺北市中山區復興北路48號3樓,臺北市中山區力行里12鄰復興北路48號,304865.651,2771374.679
24350630,誠浩股份有限公司,臺北市內湖區成功路4段182巷6弄43號8樓之3,臺北市內湖區內湖里8鄰成功路四段182巷6弄43號,309793.82,2775153.642
24375132,育丞國際有限公司,臺北市士林區劍潭路55巷8號,臺北市士林區前港里5鄰劍潭路55巷8號,302600.108,2775190.098
24413001,探索綜合國際開發股份有限公司,臺北市中山區林森北路487號地下、1樓、2樓,臺北市中山區聚葉里16鄰林森北路487號,303043.91,2772677.396
24438381,如石有限公司,臺北市中山區德惠街92號(1樓),臺北市中山區新庄里10鄰德惠街92號,303351.429,2773247.248
24451709,首搴股份有限公司,臺北市中山區南京東路3段118號11樓,臺北市中山區力行里26鄰南京東路三段118號,304516.25,2771617.16
24451932,天邁興業有限公司,臺北市大安區東豐街7號,臺北市大安區仁慈里14鄰東豐街7號,304910.414,2769892.931
24452545,綠友國際實業有限公司,臺北市大安區敦化南路1段261號地下1樓,臺北市大安區敦安里19鄰敦化南路一段261號,305422.921,2769938.457
24452881,德育資訊股份有限公司,臺北市中正區忠孝西路1段50號7樓之3,臺北市中正區黎明里11鄰忠孝西路一段50號,302048.097,2771005.519
24457957,全球綠能科技股份有限公司,臺北市中山區明水路413號,臺北市中山區永安里29鄰明水路413號,305349.244,2774476.224
24457979,台北港埠通商股份有限公司,臺北市內湖區新湖一路8號4樓,臺北市內湖區湖元里18鄰新湖一路8號,307956.53,2772373.232
24459189,創業國際物流股份有限公司,臺北市中山區林森北路577號9樓之2,臺北市中山區晴光里6鄰林森北路577號,303051.354,2773136.596
24462430,酷悠悠網絡有限公司,臺北市中正區公園路26號9樓,臺北市中正區黎明里12鄰公園路26號,302167.588,2770858.317
24463938,小吉企業有限公司,臺北市內湖區康寧路3段189巷21弄1號,臺北市內湖區明湖里13鄰康寧路三段189巷21弄1號,311821.279,2773743.601
24464367,捷森堡國際有限公司,臺北市南港區成功路1段56號,臺北市南港區西新里8鄰成功路一段56號,309784.58,2772121.622
24465529,捷鑫國際企業有限公司,臺北市中山區龍江路415巷48號1樓,臺北市中山區下埤里17鄰龍江路415巷48號,304814.137,2773233.682
24465669,公冶企業顧問股份有限公司,臺北市中山區北安路549號3樓,臺北市中山區大直里26鄰北安路549號,305246.423,2774778.869
24466597,浩群國際有限公司,臺北市中山區松江路289之908號,臺北市中山區松江里10鄰松江路289之908號,303826.688,2772580.361
24467619,時尚家居有限公司,臺北市內湖區新湖二路19號,臺北市內湖區湖元里18鄰新湖二路19號,307932.75,2772584.794
24468764,華品文創出版股份有限公司,臺北市中正區重慶南路1段57號13樓之1,臺北市中正區黎明里7鄰重慶南路一段57號,301799.252,2770817.981
24469736,星榮物流有限公司,臺北市內湖區瑞光路188巷51號,臺北市內湖區港墘里20鄰瑞光路188巷51號,308125.072,2774078.526
24470868,怡亞通物流服務有限公司,臺北市中山區南京東路3段201號3樓,臺北市中山區復華里11鄰南京東路三段201號,304739.508,2771656.976
24471228,維凱國際有限公司,臺北市南港區新民街79號,臺北市南港區南港里10鄰新民街79號,311664.237,2772080.606
24471677,賀森國際有限公司,臺北市松山區三民路166巷9號,臺北市松山區富錦里21鄰三民路166巷9號,306881.668,2772765.996
24472562,實聯能源科技股份有限公司,臺北市內湖區堤頂大道2段207號9樓,臺北市內湖區西湖里13鄰堤頂大道二段207號,307290.218,2774530.628
24472958,開店壹貳參科技有限公司,臺北市松山區復興北路101號5樓之2,臺北市松山區中正里31鄰復興北路101號,304916.912,2771756.869
24473181,津詠大實業有限公司,臺北市南港區八德路4段875號3樓,臺北市南港區玉成里5鄰八德路四段875號,308559.098,2771530.176
24473513,上平管理顧問有限公司,臺北市北投區中和街40號2樓之20,臺北市北投區中心里17鄰中和街40號,300681.717,2781185.899
24475293,台灣高力物業股份有限公司,臺北市信義區信義路5段7號49樓之1,臺北市信義區西村里8鄰信義路五段7號,306976.247,2769609.563
24476069,銀藍企業有限公司,臺北市南港區忠孝東路6段21號14樓之7,臺北市南港區合成里26鄰忠孝東路六段21號,308787.427,2771099.306
24477692,凱鷗國際有限公司,臺北市士林區社中街412號1樓,臺北市士林區永倫里15鄰社中街412號,300717.171,2776065.961
24478518,千翔國際物流有限公司,臺北市南港區忠孝東路6段260號3樓,臺北市南港區聯成里5鄰忠孝東路六段260號,309386.306,2771332.446
24478904,峻越國際有限公司,臺北市中山區建國北路2段103號,臺北市中山區江山里7鄰建國北路二段103號,304222.885,2772428.463
24479328,框起來有限公司,臺北市大同區迪化街1段136號1樓,臺北市大同區大有里17鄰迪化街一段136號,301426.737,2772228.104
24479657,宇通電商股份有限公司,臺北市中山區松江路101號4樓之1,臺北市中山區朱園里8鄰松江路101號,303801.737,2771549.62
24487328,旭航國際物流有限公司,臺北市中山區南京東路3段26號7樓,臺北市中山區力行里28鄰南京東路三段26號,304268.105,2771621.179
24487875,波詩麗股份有限公司,臺北市中山區中山北路2段45巷23號6樓,臺北市中山區康樂里5鄰中山北路二段45巷23號,302874.35,2771913.031
24488044,玉山倉儲物流股份有限公司,臺北市中山區復興北路2號4樓之11,臺北市中山區朱崙里16鄰復興北路2號,304861.884,2771178.627
24488092,匯德行國際有限公司,臺北市大同區西寧北路128號,臺北市大同區永樂里20鄰西寧北路128號,301343.078,2772139.179
24488564,祥祐全球物流有限公司,臺北市松山區東興路26號11樓,臺北市松山區復盛里26鄰東興路26號,307057.511,2771281.3
24488683,傑偉克股份有限公司,臺北市士林區承德路4段220號2樓之1,臺北市士林區前港里3鄰承德路四段220號,302607.12,2775668.75
24490533,台灣阿特拉斯物流有限公司,臺北市內湖區瑞光路188巷51號,臺北市內湖區港墘里20鄰瑞光路188巷51號,308125.072,2774078.526
24491168,鮮洋食品股份有限公司,臺北市中山區民權東路3段2號12樓,臺北市中山區江寧里14鄰民權東路三段2號,304255.322,2772768.897
24491266,精彩饗宴股份有限公司,臺北市中山區民權東路3段4號18樓,臺北市中山區江寧里14鄰民權東路三段4號,304340.299,2772766.272
24491934,遠東電通股份有限公司,臺北市中正區忠孝東路2段60號1樓,臺北市中正區幸福里13鄰忠孝東路二段60號,303330.485,2770677.476
24492188,有根人力資源股份有限公司,臺北市松山區南京東路5段16號11樓之2,臺北市松山區吉祥里18鄰南京東路五段16號,306376.816,2771579.953
24499231,華邦國際物流有限公司,臺北市信義區基隆路1段178、180號11樓,臺北市信義區新仁里18鄰基隆路一段176之1號,307029.379,2770630.128
