"統一編號","公司名稱","公司地址"
"00862175","行天馬有限公司","基隆市中山區德安里復興路291號底層"
"01807566","祥發國際傳播有限公司","彰化縣鹿港鎮草中里頂草路四段四六二號"
"03069208","天成飯店股份有限公司","臺北市中正區忠孝西路1段43號"
"03090407","中國力霸股份有限公司","臺北市大安區復興南路1段135巷15號7樓"
"03158102","伊士曼攝影事業有限公司","臺北市中山區龍江路239號1樓"
"03322504","建台水泥股份有限公司","高雄市苓雅區意誠里5鄰自強三路3號24樓之6"
"03373812","國都鐘錶攝影有限公司","臺北市中正區紹興南街５之４號"
"03521905","遠東百貨股份有限公司","新北市板橋區新站路16號18樓"
"04261738","滋味珍企業有限公司","臺南市中西區國華街二段165號2樓"
"04368767","永光彩色印刷股份有限公司","新北市中和區建三路9號"
"04409839","和諧影業有限公司","臺北市中山區松江路131號5樓502室"
"04491020","盛毅實業股份有限公司","新北市五股區五權三路42號"
"04822350","龍麒機械工程有限公司","基隆市信義區深溪路115號"
"04878163","世全實業有限公司","臺北市文山區興隆路1段70巷11弄7號1樓"
"04987726","蘋果樹科技有限公司","臺北市大安區金華街223之8號5樓"
"05001529","隆盛欣企業有限公司","新北市板橋區松柏里1鄰松柏街36巷2之3號"
"05007994","北杰企業有限公司","臺北市南港區忠孝東路7段611號(1樓)"
"05016240","凌鉅企業有限公司","臺北市大安區和平東路1段8號7樓"
"05022664","必合實業有限公司","新北市新店區松林路6號之9"
"05022812","亞宙貿易有限公司","臺北市大安區泰順街50巷11號4樓"
"05023489","榮彥企業股份有限公司","臺北市大安區忠孝東路4段341號6樓之2"
"05026438","遠流出版事業股份有限公司","臺北市中正區南昌路2段81號6樓"
"05061764","佳譽國際音像有限公司","臺北市大安區濟南路3段62之1號2樓"
"05085203","寶豐隆興業股份有限公司","臺北市大安區仁愛路4段71巷36號2樓"
"05110596","貳零零壹育樂有限公司","臺北市信義區忠孝東路5段508號24樓之1"
"05135956","邱氏鼎食品企業股份有限公司","臺北市中正區博愛路99號1、2樓"
"05162622","懷寧錄影傳播事業有限公司","彰化縣員林鎮博愛路12號2樓"
"05184787","金石堂圖書股份有限公司","臺北市中正區汀州路3段184號1樓之11，12，13，14，15，16，17，18，及192號地下室"
"05634377","老麥攝影文化事業有限公司","臺北市中正區愛國東路76號1樓"
"05639372","虎山國際股份有限公司","臺北市內湖區內湖路1段91巷23弄4號4樓"
"05714195","遠百企業股份有限公司","新北市板橋區貴興路101號"
"07139232","江東實業股份有限公司","臺北市大同區迪化街2段307-1號"
"07613308","亞東開發科技有限公司","臺北市士林區前港街120巷1號1樓"
"07622475","臺新攝影彩色冲印有限公司","臺北市大同區延平北路3段24號1樓"
"07628864","漢佳國際股份有限公司","臺北市大同區長安西路289號10樓之5"
"07678060","東潛實業股份有限公司","臺北市松山區塔悠路319號"
"09409056","美兆生活事業股份有限公司","臺北市中正區忠孝西路1段66號29樓之1"
"09419218","悅創國際科技有限公司","臺北市大安區大安路1段145號2樓"
"09433154","聲岳行實業有限公司","新北市永和區雙和里中和路335巷18弄8號(1樓)"
"09491148","煥承企業有限公司","臺北市士林區文林路287號"
"11039306","士林電機廠股份有限公司","臺北市士林區忠誠里19鄰中山北路6段88號16樓"
"12156148","環境有限公司","臺北市松山區八德路3段20號10樓之4"
"12242756","創新企業管理顧問有限公司","臺北市中山區中山北路3段11號2樓"
"12290980","亞良企業有限公司","新北市新莊區中正路831號之5(1樓)"
"12372201","昱昌貿易股份有限公司","臺北市松山區民族東路737號"
"12391848","美壽多股份有限公司","臺北市松山區南京東路5段291巷47弄50號1樓"
"12396105","三上實業股份有限公司","臺北市中山區雙城街19巷21號1樓"
"12400810","台灣歐力士股份有限公司","臺北市大安區復興南路1段303號11樓"
"12430716","得恩欣業有限公司","臺北市中山區新生北路3段88巷50號1樓"
"12457398","代統企業股份有限公司","臺北市中山區合江街100巷17號1樓"
"12461442","鈺翔廣告股份有限公司","臺北市中山區建國北路3段79號7樓"
"12504152","香港商傑霸國際有限公司","新北市淡水區中山北路3段31巷88號6樓"
"12545225","榮育有限公司","臺北市內湖區民權東路6段180巷6號9樓之18"
"12553316","思匯有限公司","臺北市中山區長安東路2段246號7樓"
"12563980","千佑興業有限公司","新北市八里區龍米路2段88之1號6樓"
"12600649","亨達利優海洋事業有限公司","屏東縣恆春鎮城南里新興路11巷7號"
"12601957","世界華文網路資訊股份有限公司","宜蘭縣羅東鎮北成里中山路四段二五八巷一號一樓"
"12603152","龍琦文化事業有限公司","臺中市豐原區北陽里豐東路八六號"
"12606209","戎盛股份有限公司","臺中市大里區內新街七二號一樓"
"12608136","聖雅典婚紗攝影有限公司","臺中市中區大墩里三民路二段一二四號一樓"
"12609894","生生實業有限公司","新北市板橋區金門街67巷6號"
"12610180","復興聯創廣告有限公司","桃園市中壢區新明里中央西路2段270之1號6樓"
"12611364","新昌沖印事業有限公司","臺南市中西區金華路四段五二號"
"12614236","映曈視覺有限公司","臺中市西區存中街一六五號一樓"
"12618710","碧利斯音響有限公司","新北市中和區民利街五八巷五弄三之三號"
"12625249","真工藝術事業有限公司","臺中市東區東英里旱溪街三九七號一樓"
"12627268","同科科技企業股份有限公司","臺中市西區福壽里居仁街一○號一樓"
"12627561","慶廣億有限公司","臺南市中西區康樂街九六號之二○，二樓"
"12629385","純粹創意整合行銷有限公司","新北市板橋區富貴里三民路2段37號22樓之1"
"12633091","卡迪亞婚紗有限公司","臺中市北區三民路三段一九○號一、二、三樓"
"12634107","大羽海事工程有限公司","基隆市七堵區明德二路1巷123-2號"
"12640591","亞諾蒂企業有限公司","臺中市北屯區文心路四段九三四號九樓之一"
"12641536","東盛創意有限公司","新北市新莊區永安街147號"
"12643773","客意得企業有限公司","新北市新莊區建國一路59號之2二樓"
"12645646","捷越音響有限公司","桃園市桃園區中正路919號2樓之5"
"12646510","伊果站影像有限公司","桃園市龜山區萬壽路一段一六三︱一號二一樓之一　"
"12647623","性本善數位廣告有限公司","新北市永和區中正路四六五巷二二號"
"12647757","米花映像有限公司","新北市淡水區淡金路3段308巷8號2樓"
"12648382","浩瀚有限公司","新北市土城區永寧里永安街114號3樓"
"12651702","聯合創意網股份有限公司","臺北市大安區復興南路1段103號12樓之6"
"12658212","秉禾資訊商務股份有限公司","新北市新莊區中正路三三四巷一號一樓"
"12659394","極元多媒體股份有限公司","臺北市中山區八德路2段312巷19號1樓"
"12660293","不予置評有限公司","臺北市中山區民生東路2段113號2樓"
"12660364","上閤企業有限公司","新北市淡水區中山北路1段71號3樓"
"12660505","第一街數位影像有限公司","臺北市大安區和平東路2段102號"
"12664663","新王朝廣告股份有限公司","桃園市中壢區興和里新生路三吉公寓一巷14號"
"12665190","喜麗美容企業股份有限公司","臺北市松山區南京東路3段337號11樓"
"12665207","力冠國際股份有限公司","臺中市西屯區惠中一街32號1樓"
"12665240","博捷視覺設計有限公司","臺北市大同區寧夏路107號1樓"
"12666120","第一超市股份有限公司","臺北市松山區南京東路4段1號"
"12667943","貝平方國際設計有限公司","臺北市中山區長春路100號9樓之7"
"12676886","相虎網路科技股份有限公司","臺北市信義區莊敬路311號2樓"
"12678809","鉅震網路事業有限公司","臺北市萬華區西藏路１２５巷１７號１樓"
"12680191","妙點電商股份有限公司","臺北市萬華區和平西路３段３１２號３樓"
"12686630","智略諾雅顧問有限公司","臺北市中山區林森北路131號5樓"
"12688588","台訊多媒體股份有限公司","臺北市大安區信義路４段７１號４樓"
"12691937","勍亞有限公司","臺北市士林區士東路252號2樓"
"12692696","一心傳播有限公司","臺北市中正區新生南路1段148號10樓之1"
"12693007","普洛達數位科技有限公司","臺北市中山區中山北路2段27巷2號6樓之6"
"12693273","六年五班有限公司","臺北市中山區中山北路２段４５巷５號４樓"
"12703976","惠得恆企業有限公司","臺北市中山區合江街55巷17號1樓"
"12704784","機智時代廣告行銷有限公司","新北市新店區北新路3段18號2樓"
"12704855","創意曲美學有限公司","新北市新店區北新路2段198號地下1層"
"12715065","耀陽創意整合行銷有限公司","臺北市中山區中山北路3段45號4樓之7"
"12717296","視象數位設計有限公司","新北市新莊區中正路一七號五樓之一"
"12718719","彩宣貿易有限公司","新北市新莊區新泰路227號16樓　"
"12719415","力霸國際婚紗攝影有限公司","彰化縣彰化市萬壽里中正路二段一七四號"
"12721432","亞商維珍數位婚紗有限公司","新北市蘆洲區三民路16、18、20、22號"
"12725063","義特舞台音響工程有限公司","屏東縣萬丹鄉加興村社皮路二段35號"
"12725486","佐辰鐘錶有限公司","臺中市大里區德芳南路四七一巷六○號一樓"
"12728532","東汯設計有限公司","苗栗縣銅鑼鄉銅鑼村中正路6-7號"
"12729949","進錸廣告事業有限公司","新北市新店區光明街二五四號"
"12730538","比堤婚紗有限公司","臺中市北屯區崇德路1段548號1樓"
"12730679","炬曜廣告事業有限公司","桃園市桃園區福安里金門二街304號"
"12734078","國賓環保科技有限公司","新北市新店區北宜路1段158號6樓之1"
"12735837","新店雅風股份有限公司","新北市新店區達觀路12號"
"12740206","晉驊文化圖書有限公司","臺中市沙鹿區六路里六路９街６８號１樓"
"12743837","駿鼎國際企業管理顧問有限公司","臺中市南區光輝街74號1樓"
"12747290","電腦帝國全球有限公司","彰化縣彰化市長樂里中正路二段五七號二樓"
"12749092","群民實業股份有限公司","臺中市西屯區福康路89號1樓"
"12749446","美景文化有限公司","新竹縣竹北市斗崙里光明六路269號　"
"12749488","集願樹創意行銷有限公司","臺中市北屯區水景里水景街122號1樓"
"12752259","巧聖機械有限公司","臺中市梧棲區下寮里大智路二段四六一號"
"12752574","駿逸科技影視有限公司","臺南市永康區中華路198-18號10樓"
"12754123","虹得有限公司","臺中市南屯區文心路1段306號4樓之1"
"12754622","古魚廣告事業有限公司","桃園市桃園區慈文里慈光街一０一巷七號一０樓"
"12755896","劦虹昌音響有限公司","臺北市萬華區洛陽街55號6樓之2"
"12757260","吉麗映畫有限公司","新北市新店區安和路2段213號6樓"
"12758991","采繽有限公司","新北市板橋區中山路二段六○巷三弄一八號五樓"
"12760173","卡美拉有限公司","臺中市南屯區大墩南路360號及362號"
"12763875","泛洋科技有限公司","臺中市東區東信里東英五街82號1樓"
"12765281","量子世紀股份有限公司","臺中市南屯區公益路二段五一號九樓"
"12765661","新娘百分百婚紗有限公司","臺中市大里區大明路三九一號"
"12769998","鎂迪企業股份有限公司","臺中市烏日區慶光路70之25號1樓"
"12770854","法維克視覺設計有限公司","新北市中和區保健路四六巷十三之三號"
"12773064","生才網路科技股份有限公司","彰化縣員林鎮新興里新興街二七號二樓　"
"12774943","季源婚紗攝影有限公司","新北市板橋區館前東路六六、六八號"
"12775627","量子動力股份有限公司","臺中市南屯區公益路二段五一號九樓"
"12776626","東傣企業有限公司","高雄市鳳山區五福里福德街一二五巷九號"
"12776652","春池文教事業股份有限公司","新北市中和區宜安路112號8樓"
"12780760","俠客國際股份有限公司","臺中市北屯區安順二街八五號三樓"
"12781424","主豐有限公司","臺中市北區邱厝里美德街4號"
"12782036","風華彩色印刷有限公司","新北市板橋區縣民大道3段250號"
"12782704","寶佳利實業股份有限公司","新北市三重區興德路117號5樓"
"12785596","騰峯設計有限公司","新北市蘆洲區長安街三四七巷九號二樓"
"12786146","全彩數位影像有限公司","桃園市桃園區中山路八五四之三號"
"12797278","元祥資訊有限公司","花蓮縣吉安鄉仁里村仁里八街93號1樓"
"12797333","囍宴婚紗國際有限公司","臺中市西屯區漢口路二段九八號一樓"
"12797615","禾米國際股份有限公司","臺北市信義區光復南路473巷11弄40號4樓之3"
"12798207","廣三崇光國際開發股份有限公司","臺中市西區臺灣大道二段459號14樓"
"12801224","大自然國際開發有限公司","臺北市中正區武昌街1段1-2號8樓"
"12802856","品致有限公司","新北市中和區德光路七七巷二五號四樓"
"12803692","丹比婚紗攝影有限公司","臺中市中區重慶里中正路一二五號"
"12804427","日泰廣告有限公司","臺中市南區建國北路1段267號1樓"
"12805805","艾克司卡勒股份有限公司","臺中市南區和平里工學路一四六巷三一號一樓"
"12807515","菘展企業有限公司","新北市板橋區大同街8巷49之1號2樓"
"12811308","台灣大創百貨股份有限公司","臺北市中山區南京西路1號5樓之7"
"12811721","康特克國際發展股份有限公司","臺中市南區福平里忠明南路七八九號二○樓之一"
"12814656","鉅威彩藝印刷事業有限公司","新北市新莊區化成路113巷17號"
"12818463","香榭帝國企業有限公司","桃園市中壢區延平路498號1樓"
"12819054","崴策資訊有限公司","臺南市永康區安康里二六鄰中華路七二七巷一號一樓"
"12823629","美林生活事業股份有限公司","臺南市東區怡東路四二號"
"12823705","亞都婚紗攝影有限公司","新北市蘆洲區中山一路七五號"
"12824562","如影隨形股份有限公司","臺北市大安區樂利路64號1樓"
"12825491","亞曼尼婚紗攝影有限公司","臺南市中西區永福里民生路1段89號"
"12829433","立岡國際股份有限公司","臺南市安定區海寮里海寮132-38號2樓"
"12830608","長堤影像製作有限公司","臺中市西區中興里向上北路一三七號二樓"
"12832090","國閣數位股份有限公司","新北市樹林區大慶街九一號一樓"
"12834105","李岱淩實業有限公司","臺中市西區英才路五○三號一樓"
"12834148","兆冠國際有限公司","新北市汐止區中興路96巷1號6樓"
"12835152","珍好有限公司","桃園市桃園區中華路二九號"
"12835569","綵綸視覺設計有限公司","新北市中和區橋和路122號12樓之5"
"12836618","台灣辣網國際有限公司","嘉義市溪興街二三一巷二二弄一號"
"12840824","高珈企業有限公司","臺中市大里區永隆里永隆路289號3樓"
"12842581","術方有限公司","臺南市安平區怡平里文平路四六一巷六一號　"
"12844194","映岱企業有限公司","桃園市中壢區興國里元化路2段47號9樓"
"12845026","鉅騰科技股份有限公司","屏東縣屏東市大同北路16巷37號"
"12847376","黃英文化事業有限公司","臺南市歸仁區許厝里17鄰忠孝北路21號5樓"
"12849233","仁人國際股份有限公司","臺中市西屯區逢甲路253巷33號"
"12851624","大大廣傳影藝事業有限公司","臺北市信義區基隆路1段131號5樓之9"
"12851862","致寰自動化工程有限公司","桃園市龜山區南上路二九○巷二一弄四號"
"12852356","友善的貓有限公司","臺北市文山區新光路1段29號2樓"
"12855065","賢影有限公司","臺北市大安區延吉街259-1號"
"12857325","天成開發股份有限公司","臺北市中正區忠孝西路1段41號5樓之16"
"12860314","佐藤皇國際事業股份有限公司","臺北市松山區民生東路3段105號8樓"
"12861307","生活空間國際有限公司","新北市汐止區新台五路一段二二○號一二樓"
"12861469","長陽開發股份有限公司","桃園市桃園區經國路369號地下1樓、1樓及2樓"
"12862636","銓昇企業管理顧問有限公司","臺北市信義區莊敬路325巷60號3樓"
"12862875","優聯國際實業有限公司","臺北市大安區羅斯福路2段93號21樓之3"
"12863255","丞印廣告有限公司","臺北市中山區新生北路３段１號４樓之１５"
"12869429","振宸廣告有限公司","新北市板橋區陽明里自由路9巷2之2號"
"12870235","華辰影像科技股份有限公司","新北市新莊區中正路708之27號5樓"
"12872156","福爾摩沙影像有限公司","臺北市大安區建國南路2段73號"
"12872487","經綸廣告設計有限公司","新北市汐止區樟樹一路2巷5號10樓"
"12875392","怡馥兒童發展有限公司","臺北市中山區大直街9巷4號6樓"
"12875837","御堂貿易有限公司","臺北市大安區復興南路1段352號3樓之3"
"12877722","五十五股份有限公司","新北市板橋區府後街1巷6號2樓"
"12878010","柯弗創意設計有限公司","臺北市大同區民族西路171號"
"12878172","帝京媒體有限公司","臺中市西屯區中港路三段101號7樓"
"12878692","華計有限公司","新北市中和區立德街98巷54號"
"12882289","倍數整合行銷股份有限公司","新竹市文華里22鄰北大路19號1樓"
"12883689","立泰特殊印刷有限公司","新北市三重區光復路1段79號7樓"
"12885119","宗來影視器材有限公司","新北市三重區昌隆街六五號"
"12888946","吉威廣告設計有限公司","臺中市北屯區興安路二段３３巷８弄４號３樓"
"12889109","樺影實業有限公司","新北市新莊區中平路164號2樓"
"12889591","輝祥器材有限公司","新北市樹林區保安二街三二號一樓"
"12889924","面具國際美容造型有限公司","臺中市南屯區大業里公益路二段6之1號11樓"
"12890669","希拉雅運動用品有限公司","臺南市東區中華東路三段44巷10號"
"12890817","瑞森國際興業有限公司","新北市三峽區中正路1段292巷18號1樓"
"12891061","普敦電腦有限公司","南投縣草屯鎮御史里中正路一一一０號一樓"
"12891999","梅林國際婚紗有限公司","嘉義市西區博愛路一段五０八、五一０、五一二號一樓"
"12893770","撒拉攝影禮服有限公司","臺中市北屯區平安里文昌三街六七號一樓"
"12893808","藝塾創意企劃有限公司","基隆市中正區義一路18號12樓"
"12893906","勾引廣告有限公司","新北市蘆洲區民權路38巷1號3樓之1"
"12894861","鑽巴黎企業有限公司","新竹縣竹北市莊敬南路27號"
"12895019","進鴻國際有限公司","新北市蘆洲區中山一路一八四號一樓"
"12896636","飛龍傳播有限公司","新北市蘆洲區民生街127號5樓"
"12897163","衛橋事業有限公司","新北市永和區永貞路379號2樓"
"12898825","永錠實業有限公司","新竹市東區科園里一七鄰民享街一六五巷四０號"
"12901878","禾青印刷事業有限公司","新北市中和區泰和街30巷5號"
"12902911","甫華多媒體有限公司","彰化縣彰化市新興里自強路109巷19號2樓"
"12903138","惠康殯儀有限公司","新北市新店區雙城里安泰路60巷134弄52號"
"12905847","皇鈞廣告事業有限公司","新北市板橋區長江路1段106巷12弄18號"
"12906206","新傑雷企業有限公司","新北市新莊區中港一街三三號之三"
"12913614","維京漁人股份有限公司","新北市淡水區沙崙路234號1樓"
"12915113","新特綺有限公司","臺中市北屯區松安里興安路二段四○五巷二一號一樓"
"12915423","順頤股份有限公司","臺中市北屯區平田里文心路四段九三四號九樓之一"
"12916056","喜果設計有限公司","基隆市暖暖區源遠路297巷99號"
"12917180","茱莉亞精品有限公司","臺中市北屯區崇德路一段548之2號3樓"
"12919096","吉本輸出製版有限公司","桃園市桃園區國聖一街一九二號"
"12921419","瑞發昇信企業有限公司","彰化縣員林鎮三義里莒光路一六一巷六八號一樓"
"12925061","鈺彩國際有限公司","臺中市南區樹義里復興路一段二六七巷二五號一樓"
"12927883","郁特里洛文化事業有限公司","臺北市松山區南京東路4段164號12樓"
"12930326","佳豆廣告事業有限公司","臺中市東區東興里建成路七００號十樓之二"
"12940154","聖金廣告有限公司","新北市林口區忠孝路581巷8號(1樓)"
"12941800","達客廣告有限公司","新北市五股區登林路貿商巷8弄5號5樓"
"12942322","法意國際有限公司","臺北市信義區忠孝東路５段１之８號２樓"
"12942483","東璟實業有限公司","新北市土城區中央路4段2號3樓之2"
"12943672","煥采創意廣告有限公司","臺北市北投區中央北路1段70號10樓"
"12944659","虹舍藝術印刷事業有限公司","臺北市松山區八德路2段374號2樓之8"
"12946740","光合國際有限公司","臺北市中山區龍江路７６巷２５號１樓"
"12949009","桔聚創藝有限公司","臺北市中山區民權東路1段53號6樓"
"12949492","蓋堤斯有限公司","臺北市松山區南京東路３段２４８號１４樓之１"
"12952025","艾迪摩爾國際有限公司","臺北市大安區和平東路３段３４６巷２之１號１樓"
"12952284","中旅環視股份有限公司","臺北市中山區南京東路３段２４８號１４樓之１"
"12953235","慈元國際有限公司","臺北市大安區羅斯福路3段65號3樓"
"12957746","廈林國際廣告有限公司","新北市新莊區福德一街80號10樓"
"12957936","紅運發便利店股份有限公司","臺北市中山區南京東路1段120號5樓之1"
"12958576","電波戰國企業有限公司","臺北市萬華區長沙街2段89號15樓之1"
"12958652","太乙廣告行銷股份有限公司","新北市新店區北新路3段225號7樓"
"12960025","禾豐傳播有限公司","臺北市大安區忠孝東路4段299號7樓之1"
"12960849","艾迪法影像事業有限公司","臺北市大同區萬全街3巷1之13號1樓"
"12961241","瑞卡企業有限公司","桃園市蘆竹區南昌路83號8樓"
"12961636","甦活創意管理顧問股份有限公司","臺北市大安區敦化南路1段259號13樓"
"12962065","湯普攝影有限公司","臺北市松山區南京東路5段158號"
"12962369","珉生傳播有限公司","臺北市松山區南京東路５段１４７巷１號３樓"
"12968286","奕汎國際開發有限公司","臺北市信義區基隆路1段360號2樓之22"
"12968808","百星傳播育樂有限公司","臺北市大安區忠孝東路３段２３３號之７號４樓"
"12970810","三勝國際育樂開發股份有限公司","臺北市松山區復興北路369號10樓之2"
"12973318","全球整合國際網路有限公司","新北市三重區車頭路街114號2樓"
"12973437","大亮國際有限公司","臺北市大安區復興南路2段125巷22號1樓"
"12973443","名媛婚紗攝影有限公司","臺北市中山區中山北路３段５７號１、２樓"
"12975456","尚象設計攝影有限公司","臺北市南港區舊莊街1段91巷10號3樓"
"12975821","貝宇科技有限公司","臺北市內湖區內湖路2段339巷6號3樓之2"
"12978658","上慶傳播文化事業有限公司","臺北市大安區忠孝東路4段51之5號"
"12978968","台北麗緻影像有限公司","臺北市中山區中山北路２段１５８號１樓"
"12979517","歡樂童顏文化事業有限公司","臺北市中正區敦化南路２段３８號６樓之１"
"12980346","賽尚圖文事業有限公司","臺北市大安區臥龍街267-4號"
"12981680","博翰印刷設計有限公司","新北市中和區中山路3段110號9樓之3"
"12981801","弘色影像服務股份有限公司","新北市永和區民富里得和路三九二號一樓"
"12983272","景佑實業有限公司","臺中市南屯區五權西路二段三八六號一樓"
"12983505","左力數位科技股份有限公司","新北市永和區中和路三四三號一七樓之一"
"12983553","蘇菲雅麗緻婚紗企業有限公司","桃園市桃園區文明里復興路251號"
"12986550","鈞馴企業有限公司","高雄市鳳山區文昌街31號"
"12989705","富禾科技有限公司","新北市五股區五福路七六號一樓"
"12990029","那摩溫資訊有限公司","新北市新店區北新路2段228巷23號2樓"
"12991771","東京凌壹國際有限公司","臺北市大安區樂利路28巷7號3樓"
"12992862","八石國際娛樂股份有限公司","臺北市大同區南京西路６１號６樓"
"12994355","特里莎婚姻事業股份有限公司","新北市板橋區館前東路六○號、六二號"
"13001903","元澔實業有限公司","臺南市東區東門路二段九０號一樓"
"13008238","崇盛國際有限公司","桃園市桃園區中山路五二０號一樓"
