"統一編號","公司名稱","公司地址"
"31228136","北海水底工程有限公司","新北市淡水區新興里新春街九三︱三號一樓"
"31245162","昶欣有限公司","臺北市中山區民生東路3段113巷6弄21號3樓"
"31264218","郭元益食品股份有限公司","臺北市士林區文林路546號1樓"
"31304605","錫安實業有限公司","臺北市北投區東華街1段360號5樓"
"31307223","晟豊工業有限公司","臺北市士林區延平北路9段155號1樓"
"31310542","西北影像股份有限公司","臺北市中山區雙城街19巷21號1樓"
"33115502","艾德蒙海外股份有限公司","新北市中和區中正路716號12樓之3"
"33760017","杉茂企業股份有限公司","臺北市內湖區洲子街100號5樓"
"34375836","華國數位影像有限公司","新北市永和區中興街5號"
"34639302","安德印刷股份有限公司","新北市中和區建八路153號"
"35960481","堉鑫國際商有限公司","臺北市中山區德惠街42號2樓"
"36083659","國園實業有限公司","臺北市中山區錦州街254號1樓"
"36269894","允美實業有限公司","新北市三重區仁福街64巷12號3樓"
"36501387","立全尚業有限公司","臺北市大安區富陽街123號"
"36519627","崇富實業有限公司","臺北市中山區民權東路2段26號12樓之1"
"36549707","申吉貿易股份有限公司","臺北市中山區復興北路164號6樓之1"
"42560378","彪騏有限公司","桃園市龜山區幸福二十五街16號"
"42560671","藝大國際有限公司","苗栗縣公館鄉館南村民權街20鄰39巷20號2樓"
"42561616","雄富醫材科技有限公司","基隆市仁愛區智仁里延平街16之26號"
"42562663","珍品香有限公司","花蓮縣花蓮市民生里中山路154號1樓"
"42565628","嗨咖運動行銷有限公司","桃園市八德區瑞泰里介壽路二段755號"
"42566680","六旺生態顧問有限公司","屏東縣內埔鄉東寧村康寧路150號3樓之1"
"42567098","矩放實業有限公司","桃園市桃園區中寧里大興西路二段26之8號17樓"
"42568759","澄研國際有限公司","桃園市中壢區忠福里南園二路296巷38號8樓"
"42571044","竹北新世紀購物中心股份有限公司","新竹縣竹北市復興二路231號3樓之2"
"42572769","富躍科技有限公司","桃園市桃園區寶慶里中埔二街52號13樓"
"42573401","臨界點視覺傳達設計有限公司","桃園市桃園區龍岡里文中路509號4樓"
"42574393","旺晨國際有限公司","基隆市中山區文化路161巷40號"
"42575750","瑭宜網路多媒體有限公司","雲林縣斗六市三平里慶生路37號4樓"
"42575822","竹冶文化創意有限公司","新竹縣竹北市福興路867號4樓之2"
"42576224","好趣覓有限公司","屏東縣屏東市崇蘭里廣東路1408號"
"42577217","璦帝斯有限公司","桃園市平鎮區新榮里崇德街12號1樓"
"42577455","僖仂管理顧問有限公司","桃園市中壢區中正路66號(2樓)"
"42579209","神銳國際影業有限公司","桃園市平鎮區南勢里13鄰中豐路南勢二段259號一樓"
"42580206","歐普林特廣告有限公司","彰化縣竹塘鄉小西村復興路96號1樓"
"42580493","三田九實有限公司","桃園市八德區大勇里忠勇街424巷108號4樓"
"42581134","德多國際貿易有限公司","南投縣南投市平和里育樂路114巷29號"
"42581325","歐飛創意有限公司","屏東縣內埔鄉內田村德美路259號1樓"
"42581704","拍樂科技有限公司","彰化縣員林鎮東北里山腳路六段東北巷278號1樓"
"42582302","愛爸爸實業有限公司","宜蘭縣羅東鎮復興路一段51號1樓"
"42583533","皇家貝拉國際開發有限公司","桃園市桃園區福信街19號"
"42584580","奇蹟種子有限公司","花蓮縣花蓮市民勤里永興路51巷19弄2號1樓"
"42585005","全翔貨運股份有限公司","桃園市觀音區工業七路10號"
"42585167","拍樂科技有限公司","彰化縣員林鎮東北里山腳路六段東北巷278號1樓"
"42585602","星辰精密股份有限公司","桃園市桃園區中正五街198號7樓"
"42585722","綺影映畫有限公司","桃園市八德區忠勇街375號2樓"
"42585835","啟航資訊有限公司","基隆市暖暖區源遠路249巷181號1樓"
"42585928","弘禾文化事業有限公司","桃園市中壢區環北路400號9樓之7"
"42586519","觀見一合有限公司","桃園市中壢區仁義里福州二街541號"
"42586905","浩客文創有限公司","苗栗縣頭份鎮成功里忠孝一路306-2號7樓"
"42587236","思廣博貿易有限公司","桃園市平鎮區雙連里民族路雙連二段9號1樓"
"42589608","咖朵創意婚紗有限公司","桃園市中壢區中建里延平路472號1樓"
"42590210","日曰有限公司","基隆市中山區德安路100之1號2樓"
"42594341","奈斯影像有限公司","桃園市中壢區金華里新生路272之13號1樓"
"42595236","至希數位媒體行銷有限公司","桃園市楊梅區永寧里環南路80巷5號9樓"
"42595812","瘋極限有限公司","苗栗縣頭份鎮山下里10鄰建國路二段119巷37號1樓"
"42596050","高府有限公司","桃園市中壢區新明路51號2樓"
"42597023","黃埔國際資源整合有限公司","桃園市桃園區三民里三民路一段138號"
"42597092","迪諾國際實業有限公司","桃園市桃園區寶山里民光東路118號8樓"
"42597558","歐維斯事業有限公司","桃園市桃園區中正路1065號2樓"
"42600337","微慢城鄉生活顧問有限公司","臺東縣臺東市新生里仁五街65號5樓"
"42601265","漢堡影音有限公司","嘉義縣水上鄉水頭村新進街102號1樓"
"42601618","覺醒藝術策展有限公司","嘉義市西區永康一街43號1樓"
"42603432","冠儀廣告企劃有限公司","新竹縣竹東鎮榮華里興農街143巷9號1樓"
"42606819","寶嘉誠企業有限公司","彰化縣社頭鄉山湖村山興巷202號1樓"
"42607802","戲逗行銷國際事業有限公司","苗栗縣苑裡鎮田心里7鄰田心67之7號1樓"
"42610291","一起拍電影有限公司","臺北市內湖區內湖路2段103巷48號"
"42610362","映視娛樂股份有限公司","臺北市大安區忠孝東路3段194號2樓之1"
"42610948","涿鹿行動科技有限公司","臺北市中山區南京西路1-1號10樓"
"42611003","汎德實業有限公司","新北市蘆洲區長安街58號3樓"
"42611051","在一起整合行銷有限公司","臺北市大安區忠孝東路3段305號6樓之1"
"42612973","攜希創意有限公司","臺北市士林區美崙街62巷8號4樓"
"42613332","銘豪有限公司","臺北市信義區光復南路417號8樓"
"42613733","夏朵創意行銷有限公司","臺北市松山區延壽街322號"
"42613797","勝達資訊科技有限公司","臺北市信義區基隆路1段186號8樓之2"
"42614254","艾帝爾公關顧問有限公司","臺北市內湖區內湖路3段326巷3弄12號4樓"
"42614402","酸芒果創意有限公司","臺北市北投區大度路3段299號6樓"
"42614450","誼河傳播有限公司","臺北市士林區中正路707巷9之1號五樓"
"42614557","此刻影像有限公司","臺北市中正區忠孝西路1段50號15樓之34"
"42614613","巧思教藝音樂製作有限公司","臺北市中山區長安東路2段81號12樓之1"
"42615009","神呂企業有限公司","臺北市內湖區安康路434巷31號2樓"
"42615161","皇展開發建設有限公司","臺北市士林區德行西路36號3樓之16"
"42615232","蘋果三點零有限公司","臺北市士林區德行西路36號3樓之13"
"42615346","皇翔物業管理顧問有限公司","臺北市士林區德行西路36號3樓之14"
"42615937","張智崴商業攝影有限公司","臺北市士林區承德路4段22號3樓"
"42616154","躍界新媒體有限公司","臺北市文山區景興路159號2樓"
"42616324","邦巧飛工作室有限公司","臺北市中山區民生東路2段176號6樓"
"42616422","璿創攝影有限公司","臺北市大安區基隆路2段136號6樓之2"
"42617225","勝利道有限公司","臺北市大同區南京西路163號2樓之73"
"42617745","哇沙筆文創有限公司","臺北市內湖區大湖山莊街166號1樓"
"42618110","成家影像有限公司","臺北市信義區忠孝東路5段1之10號11樓"
"42618272","米嵐國際有限公司","臺北市信義區吳興街169號"
"42618483","光盛影像製作有限公司","臺北市中山區南京西路1之1號6樓"
"42618723","萊特整合行銷股份有限公司","臺北市中山區民權東路3段16號15樓之1"
"42618759","創創市場行銷顧問有限公司","臺北市內湖區南京東路6段461號8樓之5"
"42618842","籟音多媒體有限公司","臺北市南港區忠孝東路5段815號8樓"
"42619173","全勝發網路資訊股份有限公司","臺北市大安區信義路3段41號12樓之1"
"42620122","錸盛跨媒體有限公司","臺北市中正區重慶南路1段121號8樓之14"
"42620636","潤泰全婚紗精品國際有限公司","臺北市信義區松德路25巷37號"
"42620777","金氏文創製作有限公司","臺北市松山區八德路4段783號11樓之1"
"42620827","新創國際傳媒股份有限公司","臺北市大安區復興南路1段82號12樓之2"
"42620951","台灣旅拍股份有限公司","臺北市中山區民生東路2段147巷3之1號"
"42621163","臺灣熊報股份有限公司","臺北市中山區復興北路290號2樓之3"
"42621179","昫龢婚紗有限公司","臺北市中正區延平南路61號9樓之10"
"42621298","嘻熊多媒體股份有限公司","臺北市大安區和平東路1段216號7樓"
"42621706","女力設計有限公司","臺北市中山區長春路328號4樓之6"
"42621918","帕菲克運動經紀有限公司","臺北市內湖區江南街117巷8弄5號7樓之1"
"42621939","禾一行銷有限公司","臺北市中山區林森北路399巷22號2樓"
"42622070","金馬文創有限公司","臺北市士林區德行西路36號3樓之16"
"42622085","文華欣業有限公司","臺北市士林區德行西路36號3樓之13"
"42622347","好空間天達原創影像設計有限公司","臺北市松山區南京東路5段393號2樓"
"42622466","啟動音樂文創有限公司","臺北市信義區松德路25巷46之2號"
"42623084","一群羊整合行銷有限公司","臺北市北投區石牌路1段166巷69弄25號5樓"
"42623704","月牙人整合行銷有限公司","臺北市中山區八德路2段66號6樓之7"
"42624605","智創開發有限公司","臺北市大安區羅斯福路2段79號4樓之7"
"42624632","耳言視覺創意有限公司","臺北市中山區長安東路2段81號12樓之1"
"42624801","尼斯實創設計有限公司","臺北市中正區汀州路2段127巷8號"
"42624909","星河國際企業有限公司","臺北市信義區忠孝東路5段510號8樓之1"
"42624984","印可策略整合行銷有限公司","臺北市大安區光復南路404號2樓"
"42625034","迷子創意有限公司","臺北市大安區和平東路1段81號"
"42625082","奇格設計有限公司","臺北市萬華區西園路2段281巷6弄16號1樓"
"42625267","天使皇后有限公司","臺北市大安區忠孝東路4段59號10樓之2"
"42626060","牡丹影像製作有限公司","臺北市大安區和平東路3段63號8樓"
"42626168","威浩思傳媒有限公司","臺北市大安區復興南路1段133之1號5樓"
"42626174","欣鎮科技有限公司","臺北市信義區松德路10號7樓"
"42626435","白日國際娛樂有限公司","臺北市信義區松德路65號10樓之5"
"42626527","奧麥迪國際整合有限公司","新北市新店區中正路230巷5號(1樓)"
"42626625","桔立整合行銷有限公司","臺北市中正區忠孝東路1段176號2樓之1"
"42627321","凡卡藝廊有限公司","臺北市松山區南京東路4段164號12樓"
"42627504","鈞烽影像製作有限公司","臺北市松山區塔悠路294號"
"42627547","星磊創意有限公司","臺北市松山區八德路2段400號6樓之2"
"42628145","果穀有限公司","臺北市大安區安和路2段63號9樓之1"
"42628530","老娜有限公司","臺北市信義區松德路10號7樓"
"42629329","巢巢創意有限公司","臺北市大安區信義路4段279號8樓"
"42629453","大島文化有限公司","臺北市士林區後港街185號4樓"
"42629828","派多有限公司","臺北市大安區復興南路1段253巷8號4樓之3"
"42630304","貳目影像有限公司","臺北市南港區南港路3段225號1樓"
"42630607","原盟實業有限公司","臺北市中山區建國北路2段260號3樓"
"42630938","許智彥導演工作室有限公司","臺北市松山區八德路3段158巷8弄18號4樓"
"42631508","好人整合行銷有限公司","臺北市大安區復興南路1段200號12樓"
"42631824","沐木品牌整合行銷有限公司","臺北市中山區南京東路3段189號4樓"
"42631916","唐英閣藝術有限公司","臺北市中山區民權東路1段38巷1弄2之1號2樓"
"42632422","海島設計有限公司","臺北市北投區石牌路1段166巷43弄19號2樓"
"42632669","永祥國際租賃有限公司","臺北市大同區承德路2段114號"
"42632942","買花樣有限公司","臺北市中山區南京東路2段76號4樓"
"42633077","子宇影像有限公司","臺北市南港區昆陽街171巷1弄18號4樓"
"42634152","雙生道娛樂股份有限公司","臺北市中正區衡陽路51號5樓之10"
"42634202","翰元電子商務股份有限公司","臺北市內湖區瑞光路513巷33號4樓"
"42634385","洞天映畫有限公司","臺北市大安區安居街38號5樓"
"42634625","鴻大營利事業股份有限公司","臺北市松山區南京東路5段251巷32弄9號2樓"
"42636031","盛聚有限公司","臺北市大安區安和路2段35巷16號6樓之1"
"42636193","轉個彎整合行銷有限公司","臺北市萬華區萬大路277巷48號9樓之3"
"42636270","優生國際管理顧問有限公司","臺北市中正區忠孝西路1段50號22樓"
"42636588","昱彰實業有限公司","臺北市中山區吉林路161巷31號1樓"
"42636638","史特基有限公司","臺北市大同區重慶北路3段37號"
"42636736","多滾那創意動畫有限公司","臺北市中正區晉江街48巷5弄7號4樓"
"42636742","闌珊處網路股份有限公司","臺北市中山區八德路2段203號4樓"
"42636898","火氣音樂股份有限公司","臺北市大安區忠孝東路4段177號6樓之4"
"42637019","八號影像有限公司","臺北市信義區忠孝東路5段482號5樓之5"
"42637209","五一影音有限公司","臺北市大安區忠孝東路4段169號12樓"
"42637236","觀察視覺設計股份有限公司","臺北市大安區復興南路1段372號12樓"
"42637741","奧利曼有限公司","臺北市松山區復興南路1段63號10樓之3"
"42637783","芮歐有限公司","臺北市大安區復興南路1段107巷17號2樓"
"42637799","富訊國際企業有限公司","臺北市內湖區新湖三路128號1樓"
"42637849","思構燚有限公司","臺北市中正區南昌路2段146號2樓"
"42638185","絕佳策略有限公司","臺北市士林區文昌路262號1樓"
"42638278","馬洛卡有限公司","臺北市大安區敦化南路2段5號4樓之3"
"42638501","藝琳彩妝造型有限公司","臺北市大安區延吉街255之2號2樓"
"42638848","田音画廣告製作有限公司","臺北市信義區忠孝東路5段1之8號2樓"
"42638946","詠創國際有限公司","臺北市大安區忠孝東路4段169號12樓之1"
"42638951","抱抱文創有限公司","臺北市中山區松江路152號12樓"
"42639023","汲影堂有限公司","臺北市士林區士東路260之2號5樓"
"42639277","龍介電影有限公司","臺北市萬華區長沙街2段91號6樓之3"
"42639473","辰徉數位股份有限公司","臺北市士林區承德路4段188號3樓"
"42639810","接上他的腿有限公司","臺北市中山區中山北路2段137巷1號地下之2"
"42639895","過度有限公司","臺北市信義區忠孝東路5段423巷4弄19號4樓"
"42641034","紅頂商人咖啡有限公司","臺北市大安區安和路1段21巷9號"
"42641061","戲盒子影片數位行銷有限公司","臺北市信義區松德路25巷46之2號1樓"
"42641560","對的影像製作有限公司","臺北市松山區南京東路5段291巷19弄8號"
"42641718","雙果娛樂有限公司","臺北市大安區忠孝東路4段59號10樓之2"
"42641793","奕冠有限公司","臺北市中山區南京東路2段101號11樓"
"42642316","儷京企業股份有限公司","臺北市中山區吉林路99號8樓"
"42642527","雲昇科技有限公司","臺北市中山區北安路789號4樓之5"
"42642771","囍門文創有限公司","臺北市萬華區西寧南路265號"
"42642786","愛慕婚禮顧問有限公司","臺北市中山區新生北路1段66號"
"42642792","淘樂思造型有限公司","臺北市大同區酒泉街50巷1號"
"42642815","嘉客文旅飯店股份有限公司","臺北市中正區重慶南路1段113號2樓"
"42642961","達迪奇森設計有限公司","臺北市信義區莊敬路325巷60號3樓"
"42643103","蒸汽影像有限公司","臺北市南港區忠孝東路6段269巷4弄19號"
"42643321","大口創意有限公司","臺北市中山區民權西路79號4樓之1"
"42643407","立禾文化股份有限公司","臺北市大同區延平北路1段22號11樓之6"
"42643510","四口田創意有限公司","臺北市大安區安居街60巷4號1樓"
"42643716","趣吧股份有限公司","臺北市松山區敦化北路170號3樓"
"42645094","子影有限公司","臺北市大安區樂利路28巷2之1號"
"42645192","原始碼智慧股份有限公司","臺北市松山區八德路3段199巷21號2樓之11"
"42646087","接觸整合行銷有限公司","臺北市大安區忠孝東路4段221號10號"
"42646565","無懼股份有限公司","臺北市南港區南港路3段314巷5號2樓"
"42646571","亞姆娛樂行銷有限公司","臺北市中山區長安東路2段175號2樓"
"42646805","全球達人國際娛樂傳媒股份有限公司","臺北市信義區忠孝東路5段1之10號3樓"
"42646875","八月有限公司","臺北市大安區忠孝東路4段166號10樓"
"42647261","想藝國際有限公司","臺北市南港區重陽路144號3樓"
"42647543","至善文創股份有限公司","臺北市內湖區內湖路1段322號8樓"
"42647889","上藝多媒體創意有限公司","臺北市松山區民權東路3段102號8樓"
"42647902","品弦有限公司","臺北市萬華區昆明街126號3樓"
"42648297","梧爾芙當代國際有限公司","臺北市松山區八德路2段346巷9弄9號1樓"
"42649388","雲之衣有限公司","臺北市信義區仁愛路4段452巷5號"
"42649438","千味淳股份有限公司","臺北市松山區復興北路73號8樓之2"
"42649676","老爹國際傳播媒體有限公司","臺北市松山區八德路4段245巷18之2號"
"42650336","相和樂舞劇有限公司","臺北市中正區林森北路5巷12號3樓"
"42650461","奇實數位文創股份有限公司","臺北市松山區三民路102巷3號1樓"
"42651623","同隆股份有限公司","臺北市大安區信義路4段1號4樓之7"
"42652073","轉化創意工作室有限公司","臺北市大安區忠孝東路4段206之1號4樓"
"42652616","科科拉諮詢有限公司","臺北市信義區基隆路2段15號10樓"
"42652622","路人甲有限公司","臺北市大同區迪化街1段48號3樓"
"42652741","好時光國際娛樂有限公司","臺北市大安區忠孝東路4段221號10樓"
"42660307","宇騰設計實業有限公司","臺中市北區中清路一段372號3樓"
"42661798","重點設計印刷有限公司","臺中市北區五常里五常街57號1樓"
"42663281","皆傑企業有限公司","臺中市神岡區岸裡里大洲路406號2樓"
"42664922","幸福諸事會社有限公司","臺中市西區公益路52號7樓之2"
"42666766","錦藝國際有限公司","臺中市西區土庫里美村路一段568號"
"42668379","沐光國際創意文化有限公司","臺中市南區平和里美和街66巷9號1樓"
"43880259","笙洋影視事業股份有限公司","臺北市內湖區瑞光路５１３巷２２弄１７號"
"52214904","真善美室內裝修工程有限公司","臺中市北屯區平安里崇德路二段１３８號３樓"
"52461518","真納視覺文化股份有限公司","臺中市南屯區文心南三路312號1樓"
"52481789","藝斌傳播事業有限公司","臺中市南區五權南路575號1樓"
"52881737","隆成事業有限公司","臺中市南屯區寶山里工業20路5號"
"52926988","藝康攝影視聽器材有限公司","臺中市西區藍興里大全街一五四巷三二號一樓"
"53001719","駿岳廣告行銷企劃有限公司","金門縣金城鎮西門里民生路45巷4弄7之2號"
"53003224","香港商瑩音樂有限公司","臺北市中山區明水路650號4樓之2"
"53009830","香港商力高網際網路有限公司","桃園市桃園區中山里吉昌街102號4樓"
"53010689","香港商永樂美有限公司","臺北市大同區南京西路41號10樓之6、10樓之7"
"53017748","香港商林亞國際有限公司","新北市土城區中華路1段253號4樓"
"53017965","美商律譜多媒體商務諮詢有限公司","臺北市松山區南京東路3段248號8樓之1"
"53022313","薩摩亞商臺品流通事業有限公司","新北市汐止區新台五路1段81號10樓之2"
"53022968","藝斯義思文化有限公司","連江縣南竿鄉福沃村90-6號"
"53027648","吉福麗影像企業有限公司","金門縣烈嶼鄉上林村南塘1之5號"
"53029049","塞席爾商齊旺事達股份有限公司","臺北市大安區樂利路72巷21號"
"53029391","楊禮謄設計有限公司","臺中市清水區西社里三民路二段91巷1弄6號"
"53031262","尼卡企業有限公司","臺中市西屯區黎明路二段940號1樓"
"53033156","艾情瑪琲國際婚紗攝影有限公司","臺中市豐原區頂街里博愛街23、25號1樓"
"53035226","逸林數位畫相有限公司","臺中市西屯區大信街56號4樓之2"
"53037701","恩瀛企業有限公司","屏東縣恆春鎮大光路118-2號"
"53038722","合邑映像有限公司","臺北市大安區復興南路2段160巷21號1樓"
"53042824","幸福盒子有限公司","桃園市桃園區大德二街2巷4號"
"53045060","群喆有限公司","臺中市南屯區大業里大業路180號4樓之4"
"53045771","儒林房屋仲介有限公司","彰化縣芳苑鄉三合村斗苑路三合段2號"
"53049951","金鑽婚禮有限公司","新北市三重區三和路4段231巷33號"
"53049988","麗莎貝拉有限公司","臺中市中區大墩里三民路二段114號1樓"
"53050339","笙竽設計有限公司","臺中市西區後龍里梅川東路一段73號"
"53051175","新團整創設計股份有限公司","臺北市內湖區大湖街131巷2弄37號3樓"
"53051581","蘿曼思攝影有限公司","桃園市中壢區中建里延平路518號"
"53052765","兆禾媒體科技股份有限公司","桃園市桃園區民有東路18-1號4樓"
"53054497","若宇顧問有限公司","嘉義市東區義教里保建街81巷1號"
"53055088","富肯有限公司","臺中市北屯區平德里文心路4段528號4樓之9"
"53055897","激發有限公司","新竹縣竹東鎮長春路一段261號"
"53056994","格昕數位科技有限公司","彰化縣彰化市忠權里自強南路116-8號"
"53057298","娛樂坊有限公司","新竹縣竹北市復興1街135號4樓"
"53060054","永塘有限公司","高雄市鳳山區國光里新富路405巷11號1樓"
"53060809","尚登海事工程有限公司","高雄市鳳山區瑞明街33巷10之4號"
"53061504","育廣開發股份有限公司","臺中市南區福平街53-2號1樓"
"53062095","采威品牌形象設計有限公司","臺中市南屯區溝墘里大墩十四街310巷20號1樓"
"53065348","竹心生技貿易有限公司","高雄市湖內區中正路1段513巷33號1樓"
"53065699","道祥有限公司","花蓮縣花蓮市主農里中正路73號"
"53066233","瑪莎文化創意股份有限公司","臺中市南屯區溝墘里大墩14街280號1樓"
"53068128","冠陽創意有限公司","臺南市安南區安東里安和路1段496巷23弄27號1樓"
"53068963","美好食代股份有限公司","花蓮縣鳳林鎮鳳仁里1鄰中和路142號1樓"
"53069816","集鹿攝影有限公司","臺南市中西區民生路一段18號"
"53070686","濃閣餐飲股份有限公司","臺中市大雅區雅環路二段19號"
"53070882","蒂芬妮婚紗攝影有限公司","臺南市中西區西門路二段306號"
"53071094","玖兆京開發有限公司","臺中市北區新興里三民路三段52號1樓、2樓、3樓"
"53072072","你的攝影有限公司","臺中市西區五權西四街118號1樓"
"53073591","俊揚興業有限公司","桃園市大園區大園里中正東路8號"
"53075388","亞卓尼多媒體行銷有限公司","臺中市西區昇平里忠明南路303號6樓之3"
"53077359","囍樂婚紗有限公司","臺中市北區新興里三民路三段2號、4號"
"53078884","六月天數位影像有限公司","桃園市楊梅區四維里永美路387巷122號1樓"
"53078907","日昇意定科技顧問有限公司","基隆市仁愛區孝一路56號3樓"
"53079602","大口心一創意有限公司","臺北市信義區忠孝東路5段1之1號10樓"
"53079820","普士有限公司","臺北市中山區吉林路236巷13號"
"53080100","杰特尼演藝經紀有限公司","臺北市大安區仁愛路4段48巷12號地下層"
"53080208","元徠有限公司","臺北市士林區社中街298巷4弄8號4樓"
"53080283","愛加倍管理顧問有限公司","臺北市中正區衡陽路51號12樓"
"53080328","華酒國際開發股份有限公司","臺北市松山區敦化北路102號7樓"
"53080349","不累本舖股份有限公司","臺北市信義區忠孝東路5段508號12樓之1"
"53080777","椅子工作室有限公司","臺北市松山區民權東路3段144號9樓"
"53080919","代門影音製作有限公司","臺北市文山區萬慶街14號1樓"
"53081305","好品創作有限公司","臺北市中正區重慶南路3段66號"
"53081699","羿昇國際廣告事業有限公司","臺北市中山區南京東路4段47號2樓之1"
"53082629","程軒設計有限公司","臺北市內湖區金湖路40號"
"53082748","商奇整合行銷股份有限公司","臺北市大安區羅斯福路2段33號12樓"
