"統一編號","公司名稱","公司地址"
"54164704","寀玴創意庫房有限公司","臺北市松山區八德路4段678號4樓之5"
"54165529","衣果設計有限公司","臺北市松山區敦化北路165巷18號1樓"
"54165540","精準度整合行銷有限公司","臺北市北投區公館路302號1樓"
"54165719","甜日子影像製作有限公司","臺北市內湖區康寧路3段189巷12弄13號4樓"
"54165936","龍影視覺有限公司","臺北市大安區仁愛路3段98號5樓"
"54166415","三一聯合科技設計顧問有限公司","臺北市內湖區民權東路6段280巷19號地下1樓之13"
"54166908","印證愛婚紗攝影有限公司","臺北市大安區忠孝東路4段2號8樓之7"
"54167667","安樂茂思國際事業有限公司","彰化縣和美鎮竹營里孝順路76號"
"54168201","振宇文創科技有限公司","臺北市中山區長春路172號8樓之8"
"54168217","晶典顧問有限公司","臺北市北投區榮華二路19巷7號"
"54168552","仁美愛天空股份有限公司","臺北市信義區基隆路1段333號12樓(1205室)"
"54168737","發現文化事業有限公司","臺北市中正區許昌街42-1號10樓"
"54168770","精研國際傳播事業有限公司","臺北市信義區基隆路1段155號7樓"
"54169779","喜樂啤映像有限公司","臺北市信義區忠孝東路4段560號10樓之2"
"54170494","里金館有限公司","臺北市南港區忠孝東路6段81巷22號2樓"
"54170797","創堂廣告股份有限公司","臺北市中山區建國北路2段120號13樓"
"54170847","熱點數位科技有限公司","臺北市大安區忠孝東路4段142號8樓之10"
"54172042","尚霖演藝經紀有限公司","臺北市信義區基隆路1段155號11樓之5"
"54172063","禾映電影製作有限公司","臺北市大同區迪化街2段420號1樓"
"54172795","宏達數位影業有限公司","臺北市內湖區民權東路6段11巷39號3樓"
"54172850","昇禾彩藝印刷有限公司","臺北市文山區木新路3段298號"
"54173176","虹舍藝術文化事業有限公司","臺北市松山區八德路2段437巷6弄16號1樓"
"54173302","台灣亞藍渥克資產管理股份有限公司","臺北市大安區忠孝東路4段285號9樓"
"54173464","向喆文創股份有限公司","臺北市松山區敦化北路170號3樓"
"54173577","大馬房東網有限公司","臺北市大安區和平東路2段175巷15弄12號"
"54174560","十一音像有限公司","臺北市南港區研究院路2段182巷76號3樓"
"54174668","金禾創意股份有限公司","臺北市萬華區內江街51號5樓之3、5樓之4"
"54175630","洛商公關顧問有限公司","臺北市中山區復興北路170號8樓"
"54175651","愛迪浩斯影像制作有限公司","臺北市大安區延吉街241巷2弄13號4樓"
"54175688","紐堤思股份有限公司","臺北市大安區仁愛路4段27巷9號地下室"
"54176005","想像力股份有限公司","臺北市內湖區陽光街321巷56號5樓之2"
"54177124","橄欖枝有限公司","臺北市大安區和平東路3段406巷1號2樓"
"54177314","震撼三維影像有限公司","臺北市大安區忠孝東路4段299號11樓"
"54177320","魔漫科技有限公司","桃園市蘆竹區南興里奉化路258巷29號12樓"
"54177567","林可有限公司","臺北市內湖區江南街71巷16弄20號2樓"
"54177573","紅果創意攝影有限公司","臺北市大同區華陰街227巷7號"
"54178067","西華藝設計有限公司","臺北市大安區信義路3段151號5樓"
"54179185","舞嶽映畫有限公司","臺北市大安區復興南路2段351號2樓"
"54179875","義欣創意有限公司","臺北市北投區中和街40號6樓之9"
"54180107","居是邦也有限公司","臺北市松山區八德路4段245巷32弄45號"
"54180280","福驊有限公司","臺北市松山區南京東路5段230號7樓"
"54181133","人生知道創意有限公司","臺北市士林區永平街73號1樓"
"54181160","我是保羅網路設計股份有限公司","臺北市信義區信義路4段415號14樓之1"
"54181324","愛戀海外婚禮有限公司","臺北市大安區忠孝東路4段221號8樓"
"54182273","翔藝文創有限公司","臺北市內湖區瑞光路513巷39號9樓"
"54182999","宜東文化創意有限公司","臺北市大安區仁愛路3段7之3號2樓"
"54183097","大維數位行銷有限公司","臺北市信義區光復南路495號2樓之1"
"54183619","傑姆國際有限公司","臺北市大安區敦化南路1段232巷4號1樓、4號地下室1樓、6號地下室1樓"
"54183717","二日影像有限公司","臺北市內湖區港墘路90號4樓"
"54185089","未來思考創意有限公司","臺北市中正區寧波西街40巷1號4樓之1"
"54185270","方成事整合行銷有限公司","臺北市大安區忠孝東路4段97號地下樓"
"54185905","大東協地產有限公司","臺北市中山區長安東路2段212號"
"54186101","點石娛樂有限公司","臺北市大同區華陰街227巷7號"
"54187191","愛瘋音樂有限公司","臺北市信義區福德街113號1樓"
"54187586","東冉娛樂實業有限公司","臺北市松山區民生東路5段36巷4弄55號"
"54188558","費思文創設計顧問有限公司","臺北市信義區忠孝東路5段139號5樓"
"54189064","鵲兒喜娛樂經紀有限公司","臺北市南港區南港路2段36號(2樓)"
"54190273","貿博商貿股份有限公司","高雄市苓雅區廣州一街141之6號3樓"
"54192981","知識行動商務有限公司","高雄市前金區瑞源路65巷42號1樓"
"54193617","魔果國際企業有限公司","高雄市前鎮區武營路1號3樓"
"54194221","瞹戀網路媒體科技股份有限公司","高雄市苓雅區五福一路77號3樓之4"
"54194355","百賀謙現設計有限公司","高雄市苓雅區三多二路45巷6號"
"54196255","申合數位影業有限公司","高雄市前鎮區溫江街21號1樓、2樓"
"54196516","音飛弦創意整合行銷有限公司","高雄市三民區褒揚街218號15樓之4"
"54198009","福善緣生命禮儀有限公司","高雄市左營區崇德路22號"
"54198388","百羚廣告設計工程有限公司","高雄市鳳山區光復路243號1樓"
"54198438","鴻鑫海事工程有限公司","高雄市楠梓區大學七街122號"
"54199485","在人文創有限公司","高雄市苓雅區自強三路3號30樓之1"
"54200075","峰創意整合行銷有限公司","高雄市苓雅區安溪路18號1樓"
"54200080","美利達整合行銷有限公司","高雄市鼓山區明誠三路689號4樓"
"54200309","木草田影像工作室有限公司","高雄市苓雅區青年一路245號1樓"
"54202073","昊業公關顧問有限公司","高雄市仁武區北屋5街172巷36號1樓"
"54202313","展億環境工程有限公司","高雄市小港區龍門街192號1樓"
"54202572","吳任庭國際公關顧問有限公司","高雄市左營區尾北里洲仔巷6號"
"54203994","靜體天心視覺設計有限公司","高雄市鳳山區武營路106巷65號1樓"
"54204109","采紅行銷傳播有限公司","高雄市前鎮區鎮海三街12號"
"54205727","卡麥拉事業股份有限公司","高雄市三民區建國二路183之3號1樓"
"54206394","台灣榮工國際實業股份有限公司","高雄市鳳山區鳳仁路246號"
"54206649","米樂創意行銷有限公司","高雄市鳳山區西湖街62號6樓"
"54206697","彩能輝創意影像有限公司","高雄市鳳山區文衡路297號3樓"
"54207865","德派空間有限公司","彰化縣彰化市茄南里茄苳路一段247號4樓"
"54208739","囍滿客國際企業有限公司","高雄市左營區自勉路116號7樓"
"54208978","品攝創意婚紗有限公司","高雄市新興區尚信街66號1樓"
"54209104","靚彩文化事業有限公司","高雄市楠梓區楠梓新路261巷3號"
"54209511","上寶龍開發有限公司","臺南市東區自強里中華東路2段193號8樓之15"
"54209717","夢工坊創意整合有限公司","高雄市前鎮區文橫三路47號3樓"
"54212207","三和願有限公司","高雄市左營區民族一路973號14樓之1"
"54213374","參冶創意有限公司","高雄市三民區大昌二路398號"
"54213661","原動漫遊有限公司","高雄市鳳山區南江街16巷4之3號"
"54213819","便便國際有限公司","高雄市新興區尚信街29號1樓"
"54214731","一十設計有限公司","高雄市鹽埕區大安街135號1樓"
"54214845","維度空間設計有限公司","高雄市楠梓區廣昌街29巷18弄14號"
"54215942","榮森多媒體有限公司","高雄市三民區皓東路136號1樓"
"54216055","佶佶創意有限公司","高雄市小港區崇明街141之2號"
"54217012","紳昱祥創意有限公司","高雄市三民區光裕路43號1樓"
"54217287","蒼穹科技有限公司","高雄市新興區文橫二路127巷20之1號"
"54217569","永興疏浚海事工程有限公司","高雄市小港區宏平路658號8樓"
"54221260","歐風美學有限公司","基隆市仁愛區同風里孝一路9號（2樓）"
"54221873","木紋印象股份有限公司","新竹縣竹北市東平里六家六街27巷2號"
"54222373","奧羅拉設計有限公司","嘉義市西區書院里中山路638號1樓"
"54222562","富翊達科技有限公司","新竹市北區興南里3鄰中山路233之2號1樓"
"54223020","奇享創意行銷有限公司","彰化縣鹿港鎮頂番里頂草路一段52號1樓"
"54223083","三艾創設有限公司","臺中市南區江川里仁義街231號12樓之2"
"54223112","幸福空間婚紗攝影有限公司","桃園市中壢區中建里延平路482號"
"54224180","萬越廣告有限公司","臺中市潭子區頭家里和平路131號1樓"
"54226510","阿克影像傳播有限公司","臺中市西區後龍里民生北路103號2樓"
"54227665","英傑銳網路數位有限公司","宜蘭縣宜蘭市凱旋里中山路1段709號1樓"
"54227829","佶音文創表演藝術有限公司","桃園市中壢區中央里復興路12號5樓14號5樓"
"54229137","樂氣球王國有限公司","新竹縣竹北市文信路185號（1樓）"
"54231669","恬園科技有限公司","桃園市平鎮區新富里新富四街8號9樓"
"54232891","杰穗企業管理顧問股份有限公司","臺中市東區東英六街6號1樓"
"54233934","葴誠創意設計有限公司","臺中市霧峰區中正路893號2樓"
"54234151","意為整合行銷國際有限公司","臺中市南屯區文心里向心路109號16樓之2"
"54234687","漢洋有限公司","臺中市西屯區台中港路二段22-20號1樓"
"54237410","妍藝之堂婚禮顧問有限公司","臺中市烏日區烏日里建國路373號1、2樓"
"54240371","蘋果甜心婚禮顧問有限公司","新竹市城北街137巷9弄25號4樓"
"54241272","人言網通有限公司","新竹縣新豐鄉潤泰街1巷5號"
"54242321","東呈廣告製作有限公司","桃園市蘆竹區南山路一段90巷20號"
"54243089","百年好合喜慶服務有限公司","新竹市東區新莊里關新路63巷1號6樓"
"54245066","誠蹊廣告企劃有限公司","嘉義市博東路115號4樓之1"
"54246987","大鵬光電有限公司","新北市五股區新城八路116號14樓"
"54247183","鑫文明彩色快速沖印有限公司","苗栗縣竹南鎮竹南里11鄰民族街77號1樓"
"54249112","優路威國際有限公司","臺中市西屯區安和路121-30號"
"54251720","永發汽車零件有限公司","臺中市西屯區協和里安和路103號11-1號"
"54251947","睿鍠有限公司","臺中市太平區新吉里4鄰新平路三段97號1樓"
"54252919","新嘉文創事業股份有限公司","新竹市柴橋里瑞麟路1號1樓"
"54257941","全景商業攝影有限公司","桃園市龜山區仁愛街9號2樓"
"54258060","灝宇科技股份有限公司","桃園市中壢區新街里元化路218號6樓"
"54258483","震中股份有限公司","桃園市中壢區舊明里中正路389號"
"54258723","亞丁貿易有限公司","臺中市北屯區仁美里30鄰豐樂路12-12號"
"54259693","怪獸老爸創意文化有限公司","臺北市萬華區武昌街2段132號6樓之2"
"54262037","禾斗有限公司","基隆市暖暖區東勢街２６巷１２７號一樓"
"54264274","大田科技有限公司","臺中市沙鹿區斗抵里沙田路17-5號1樓"
"54265386","福宥設計開發有限公司","新竹市民富里經國路二段248巷12號1樓"
"54265772","數動整合行銷股份有限公司","臺中市豐原區西湳里三豐路675巷16弄23之8號1樓"
"54266836","全國租車有限公司","桃園市平鎮區北貴里18鄰關爺東路59巷7號一樓"
"54268399","桐花渡假會館股份有限公司","苗栗縣三義鄉廣盛村41鄰八股路館前9巷1-15號2樓"
"54269897","討喜空間創意攝影有限公司","新北市蘆洲區中山一路27號2樓"
"54270439","藝雲有限公司","新北市土城區中正路1號8樓之3"
"54271205","鴻原印刷設計有限公司","新北市板橋區中山路2段318巷11號(1樓)"
"54271325","主題設計工程有限公司","新北市新店區安祥路69巷54弄10號"
"54271388","自然堂文創有限公司","新北市永和區永樂里自由街47號2樓"
"54271401","仲立實業有限公司","新北市樹林區中山里八德街1188號"
"54272507","洛可馬國際有限公司","臺北市士林區重慶北路4段248號2樓"
"54272577","馳騰國際貿易有限公司","新北市汐止區祥雲街21號4樓"
"54272936","愛喜肆創意有限公司","新北市樹林區俊英街133巷3號5樓"
"54273105","信竑國際顧問有限公司","新北市三重區重陽路3段192之3號3樓"
"54274110","栩栩文物造像有限公司","新北市中和區信義街36號"
"54274688","愚舍創藝有限公司","新北市土城區清水里仁愛路42號(1樓)"
"54275650","愛酷奇多媒體有限公司","新北市板橋區民生路3段6號18樓之3"
"54275716","意識意思文創有限公司","新北市中和區壽南里南山路421巷1弄9號4樓"
"54275808","晴天造型有限公司","新北市板橋區文化路2段135號(1樓)"
"54276686","紅攝有限公司","新北市蘆洲區中華街91號3樓之1"
"54276709","夏米廣告企業有限公司","新北市新莊區雙鳳路126號11樓"
"54277046","華威攝影有限公司","新北市新店區錦秀路52巷47號5樓"
"54279207","黑市音樂有限公司","臺北市松山區南京東路4段130號2樓之1"
"54279678","禪濤文創有限公司","新北市三重區過圳街7巷28號7樓"
"54279810","鑫發整合行銷有限公司","新北市中和區景平路180號33樓之2"
"54280252","政豪影音唱片有限公司","新北市新莊區中平路288號之1"
"54280416","福熹國際有限公司","新北市坪林區坪林里坪林39號"
"54280680","了了文化有限公司","新北市板橋區新海路72巷64號3樓"
"54280696","逸達整合行銷有限公司","新北市板橋區國慶路158巷11弄7之2號"
"54280984","藝亘有限公司","新北市淡水區新民街222巷13號12樓"
"54281301","吉米柚子行創媒體有限公司","新北市新店區民權路108之1號"
"54282250","天成儀器有限公司","新北市三重區光華路53號"
"54282358","萬事屋文化有限公司","新北市土城區長風里順風路8號3樓"
"54283103","上合創意行銷顧問有限公司","新北市新店區民權路123號9樓"
"54284026","永晴國際設計有限公司","新北市土城區中央路4段67巷36號5樓"
"54286299","大強影像製作有限公司","新北市板橋區仁愛路59之2號"
"54286896","汘澍文創有限公司","新北市板橋區長江路2段245號(1樓)"
"54287467","羅藝行銷股份有限公司","臺北市松山區光復北路103巷18號"
"54287950","艾爾生態有限公司","新北市新店區寶興里中興路3段133號(1樓)"
"54289036","寧斐御業有限公司","新北市三重區重陽路1段66號11樓"
"54289182","琺騏國際行銷有限公司","新北市汐止區樟樹一路122號2樓之2"
"54290717","元均創意整合有限公司","新北市新店區大同街8巷19號"
"54290934","及思有限公司","新北市永和區民族街81巷32號"
"54291080","極光影像股份有限公司","新北市汐止區汐萬路2段66巷115號"
"54291883","看見娛樂有限公司","臺北市北投區明德路103號2樓"
"54292320","邑富室內裝修設計工程有限公司","新北市汐止區中興路96巷1號6樓"
"54292497","笨蛋工作室有限公司","臺北市松山區南京東路5段399號9樓"
"54295163","衣菲有限公司","新北市板橋區中山路1段160之12號"
"54296206","安世祺國際股份有限公司","新北市汐止區大同路2段175號6樓之1"
"54296557","鎂淂有限公司","新北市蘆洲區民族路227巷14號"
"54296613","思利德國際有限公司","新北市新莊區青山路1段58之4號8樓"
"54297232","相信原創有限公司","新北市新店區民權路153號4樓"
"54298247","艾迪邇創意行銷有限公司","新北市樹林區太順街80號2樓"
"54299153","牧秀企業有限公司","新北市中和區中山路2段33號10樓"
"54299267","子雨藝術文化事業有限公司","新北市淡水區民族路65巷46號10樓"
"54299421","胖潮人創意文化有限公司","新北市蘆洲區中山一路134號17樓"
"54302002","璽璽企業有限公司","新北市板橋區雙十路2段86號2樓"
"54302087","大日創意有限公司","新北市永和區雙和街64巷19號5樓"
"54302100","合迅電信工程有限公司","臺北市中山區松江路283號5樓之1"
"54302517","博克利國際文化傳播有限公司","新北市蘆洲區長興路278號7樓"
"54302523","東方神州事業有限公司","新北市板橋區文化路1段268號5樓之1"
"54302565","澄几行銷有限公司","新北市汐止區長江街251號6樓"
"54302713","夢想開麥拉協力行銷顧問有限公司","新北市板橋區中正路31號2樓"
"54303537","皆準創意股份有限公司","新北市中和區中山路2段296號4樓之3"
"54303868","春雷品牌創意有限公司","新北市新莊區福營路356號"
"54304114","搖滾寓言有限公司","新北市土城區青雲路158號5樓"
"54305021","興旺數位有限公司","新北市板橋區莊敬路25巷4弄7號"
"54305057","圖起乘李國民影像有限公司","新北市八里區龍米路2段32巷12號4樓"
"54305465","凱恩尼國際有限公司","新北市中和區中和路350巷12號"
"54306231","偉尊國際股份有限公司","臺北市松山區南京東路4段47號2樓之1"
"54306437","演創整合行銷股份有限公司","新北市永和區中正路370號3樓"
"54306703","宣創傳播製作有限公司","新北市土城區順風路50號"
"54307983","有點肝設計有限公司","新北市中和區中正路955號9樓"
"54308174","星映活動有限公司","新北市中和區中正路464號"
"54308385","鑫豔有限公司","新北市五股區蓬萊路6巷11號"
"54308483","威得數位行銷有限公司","新北市新莊區中信里14鄰中義街21號4樓"
"54308934","天耘策略行銷有限公司","新北市中和區中和路350巷21弄1號4樓"
"54309146","孚梭有限公司","新北市蘆洲區中正路185巷25弄31號3樓"
"54311038","星語公關顧問有限公司","新北市中和區中正路786號12樓"
"54311234","海晏活動行銷有限公司","新北市鶯歌區鶯桃路295巷20號(1樓)"
"54311585","翰墨有限公司","新北市蘆洲區長榮路179號13樓"
"54312091","集緻整合設計有限公司","新北市板橋區莒光里莒光路32號(1樓)"
"54312114","瑞廷創意影像有限公司","新北市汐止區湖前街110巷97弄5之5號17樓"
"54313057","皓皓表演藝術有限公司","新北市板橋區留侯里府中路145號7樓"
"54313562","源作設計有限公司","新北市中和區安樂路5號10樓之1"
"54314393","愷橖國際實業有限公司","新北市汐止區康寧街169巷27之1號5樓之3"
"54316580","迪伸文教有限公司","新北市中和區華順街19號2樓"
"54316907","冠淵工程有限公司","新北市新店區寶元路2段65號(1樓)"
"54317309","說故事影像創意有限公司","臺北市大安區忠孝東路4段169號6樓之1"
"54319284","向揚企劃有限公司","臺北市中山區復興北路176號5樓之1"
"54319756","妹妹娃娃多媒體有限公司","臺北市中山區龍江路235號3樓之2"
"54319931","十分之一電影製作有限公司","臺北市內湖區港墘路109之1號3樓"
"54320331","奇邑整合行銷有限公司","臺北市內湖區民權東路6段180巷42弄8號"
"54320352","光宇創新有限公司","臺北市大安區信義路2段104號6樓"
"54320613","就是音樂國際有限公司","臺北市信義區忠孝東路5段372巷27弄69號1樓"
"54320971","光禹國際數位娛樂開發股份有限公司","臺北市松山區敦化北路207號11樓之1"
"54321606","大栔娛樂有限公司","臺北市文山區興隆路2段217巷8之11號9樓"
"54321676","鈕祜祿氏有限公司","臺北市大安區忠孝東路4段216巷32弄2號7樓"
"54321747","本我攝影有限公司","臺北市中正區杭州南路1段69號之3"
"54322133","御展咖創意整合有限公司","臺北市大安區安居街8巷15號"
"54322491","神鼎設計股份有限公司","臺北市松山區八德路4段106巷6弄1號1樓"
"54323323","源創國際事業有限公司","臺北市內湖區陽光街321巷26號5樓之7"
"54323533","創凡行銷有限公司","臺北市信義區吳興街354號1樓"
"54323597","台藝連結有限公司","臺北市松山區八德路3段12巷52弄16號"
"54324300","蘭博灣發展股份有限公司","臺北市大安區仁愛路3段30號7樓"
"54324370","鉅富攝影有限公司","臺北市北投區致遠一路2段15號1樓"
"54324955","馬克奧森視覺行銷管理顧問有限公司","臺北市大安區敦化南路1段176號8樓"
"54325188","奧帝歐創意有限公司","臺北市大安區樂業街159巷35號4樓"
"54326187","台灣天願結婚慶股份有限公司","臺北市中山區建國北路2段262號2樓"
"54326763","藍研科技有限公司","臺北市大安區忠孝東路3段303號3樓之9"
"54326975","思鹿生活企業有限公司","臺北市萬華區大理街42巷3號"
"54327854","雙囍婚禮顧問股份有限公司","臺北市中山區中山北路2段72巷19號1樓"
"54328312","騰寶娛樂有限公司","臺北市中山區撫順街31號2樓之4"
"54328495","愛思邦溝通有限公司","臺北市大安區忠孝東路4段169號11樓之1"
"54328903","熙金國際設計有限公司","臺北市大安區忠孝東路4段221號12樓"
"54328967","果禾有限公司","新北市永和區永安里永貞路210號8樓之1"
"54329157","新發國際有限公司","臺北市中山區南京東路3段189號10樓"
"54329451","一一映画有限公司","臺北市信義區忠孝東路5段1-1號8樓"
"54329585","宏拓設計有限公司","臺北市中山區松江路206號7樓之4"
"54329608","相弄花苑有限公司","臺北市大安區光復南路102號"
"54329950","東康有限公司","臺北市大安區復興南路2段125巷20弄6之8號1樓"
"54330491","永翊廣告有限公司","臺北市信義區莊敬路423巷2弄17號"
"54330936","夏煦婚嫁有限公司","臺北市中山區民權東路1段7巷11號1樓"
"54331301","澄銳行銷有限公司","臺北市大安區樂業街41巷22號"
"54331506","威睿影像設計有限公司","臺北市內湖區南京東路6段459號1樓"
"54332391","尼可樂表演藝術有限公司","臺北市中正區愛國東路60號4樓之1"
"54333309","貝斯特影像製作有限公司","臺北市士林區雨農路9之2號1樓"
"54333835","金聚易國際企業股份有限公司","臺北市中正區忠孝西路1段7號9樓之2"
"54334356","賀仲文化國際有限公司","臺北市中正區八德路1段46號4樓"
"54334686","立新展業有限公司","臺北市中山區雙城街19巷12號4樓之1"
"54334784","大家創意影像有限公司","臺北市文山區興隆路3段185巷11弄7號5樓"
"54336468","美女子有限公司","臺北市大安區忠孝東路3段251巷8弄1之3號4樓"
"54336988","三啪娛樂行銷有限公司","臺北市松山區八德路4段604號2樓之7"
"54337136","一張嘴有限公司","臺北市士林區劍潭路25號2樓"
"54337662","詠語創意國際有限公司","臺北市內湖區堤頂大道1段327號4樓"
"54338374","冠鈞股份有限公司","臺北市松山區光復南路6巷43號"
"54338402","黑鴉文化有限公司","高雄市三民區延吉街1巷57號"
"54338536","珍一生有限公司","臺北市大同區南京西路222號1樓"
"54339887","傑希國際股份有限公司","臺北市文山區羅斯福路6段142巷20弄6號"
"54340081","橙子設計有限公司","臺北市松山區南京東路4段17號8樓之4"
"54340104","太奇有限公司","臺北市士林區福華路141巷8號1樓"
"54340300","曼恩國際有限公司","新北市永和區店街里自由街12號7樓之2"
"54340511","國風傳媒有限公司","臺北市內湖區洲子街107號2樓"
"54340548","鉅興整合行銷有限公司","臺北市中山區中山北路1段83巷5號5樓之9"
"54341292","劇驕文創事業有限公司","臺北市內湖區內湖路1段411巷91號"
"54342314","理程行銷有限公司","臺北市中山區南京東路1段8號4樓"
"54342481","誠實創意有限公司","臺北市中山區龍江路376號"
"54342638","這誰創意有限公司","桃園市平鎮區金龍路190巷39弄100號9樓"
"54342784","於是傳播製作有限公司","臺北市士林區美崙街49巷7號2樓"
"54343279","安品有限公司","臺北市松山區民權東路3段160巷19弄10號"
"54346206","種子藝術家國際有限公司","臺北市文山區羅斯福路5段24號地下"
"54347036","黑彩管理顧問有限公司","臺北市大安區光復南路180巷2號9樓"
"54347090","居居多媒體整合行銷有限公司","臺北市大同區市民大道1段209號10樓之1"
"54347269","華夏智創文化股份有限公司","臺北市中山區南京東路3段208號10樓"
"54347922","伊凡博達互動設計有限公司","臺北市大安區安和路2段120號2樓"
"54348112","雅映國際廣告製作有限公司","臺北市松山區健康路325巷24弄7號"
"54348339","定泳文創有限公司","臺北市信義區光復南路417巷213號1樓"
"54348366","夢森林文創有限公司","臺北市中正區重慶南路3段129號3樓"
