"統一編號","公司名稱","公司地址"
"24888766","小犬映像有限公司","南投縣水里鄉中央村6鄰民生路367號"
"24889765","四維設計有限公司","桃園市大園區領航北路四段366-6號3樓"
"24890165","能牽科技有限公司","桃園市中壢區忠福里南園二路296巷12號9樓"
"24890720","亞昕活動企劃有限公司","桃園市桃園區鎮南街56號"
"24890849","溱情演繹顧問有限公司","桃園市桃園區寶慶里1鄰大興西路二段190巷15弄11號1樓"
"24891299","魏斯特理有限公司","桃園市桃園區愛國街60號1樓"
"24891523","藝朵文化事業有限公司","基隆市中山區德安里7鄰德安路116巷197號"
"24891755","鳥人人文文創整合行銷有限公司","南投縣南投市內興里大埤街107號1樓"
"24892614","向駿有限公司","桃園市平鎮區新榮里安平街34巷23號11樓"
"24893178","和豐園有限公司","雲林縣虎尾鎮德興里公安路75巷12號1樓"
"24893873","天展燈光音響有限公司","桃園市蘆竹區大竹路449巷6弄21號"
"24895133","富達金實業有限公司","桃園市蘆竹區錦中里南崁路265號10樓之8"
"24895942","神蹟文創有限公司","花蓮縣花蓮市國光里林森路270號5樓"
"24896061","雄富醫材科技有限公司","基隆市仁愛區智仁里延平街16之26號"
"24896317","就適設計有限公司","桃園市平鎮區北勢里金陵路202號"
"24896409","維兒國際股份有限公司","花蓮縣花蓮市國興里建興街137巷15弄13號1樓"
"24896702","九藝文創整合行銷有限公司","桃園市蘆竹區南順八街7號6樓之3"
"24896885","戴那米克國際科技有限公司","桃園市桃園區雲林里樹林九街67巷12號4樓"
"24897322","紫鑫國際股份有限公司","桃園市桃園區成功路3段8號2樓"
"24897688","圈圈兒童文化事業有限公司","新竹市東區光明里大學路214號2樓"
"24897821","樂之有限公司","桃園市桃園區寶慶里1鄰大興西路二段190巷15弄11號1樓"
"24898357","遠方偵防科技有限公司","臺南市永康區復興路23號"
"24898526","夢享製造所有限公司","臺南市北區開元里北園街87巷34號2樓"
"24899243","雙元印刷股份有限公司","臺南市仁德區太子里太子路707-1號"
"24899270","天齊有限公司","臺南市鹽水區後宅里後寮20號"
"24899601","綠量工程有限公司","臺南市永康區永康里永平街３９號2樓"
"24900852","艾爾曼數位科技有限公司","臺南市東區富農街1段31號1樓"
"24902134","采漾有限公司","臺南市中西區青年里民權路一段279號1樓"
"24902710","采藝影像創意有限公司","臺南市永康區三合里南工街247巷82號1樓"
"24903605","愛得勝有限公司","臺南市仁德區民安路1段310巷3號"
"24905385","銳勢國際多媒體有限公司","臺南市南區文南三街64號1樓"
"24906574","時驗創意有限公司","臺南市北區六甲里公園路509巷8弄14號1樓"
"24907383","台北時尚攝影有限公司","臺南市中西區西門路二段306號"
"24909431","西普攝影有限公司","臺南市北區育賢街317號3樓"
"24910417","城改有限公司","臺南市安南區府安路三段311巷19號1樓"
"24911437","三星國際傳播有限公司","臺南市永康區中華路196之3號4樓"
"24928198","東美出版事業有限公司","臺北市中正區中華路1段59號3樓之11"
"24928253","回傢有限公司","臺北市松山區八德路4段123號3樓"
"24928970","韋禎整合行銷有限公司","臺北市松山區民權東路3段124號8樓"
"24929056","最美一刻婚紗攝影有限公司","臺北市大安區忠孝東路4段162號4樓之3"
"24929112","荻漾禮服有限公司","臺北市松山區八德路4段453巷7號2樓"
"24930069","東方傳奇娛樂有限公司","臺北市信義區基隆路1段176號13樓"
"24930384","京城銀國際租賃股份有限公司","臺北市松山區敦化北路167號8樓"
"24930764","雷聲股份有限公司","臺北市南港區南港路2段147號7樓"
"24931399","艾米文創有限公司","臺北市萬華區環河南路2段125巷7弄16號1樓"
"24932067","簡約體制有限公司","臺北市南港區舊莊街1段242號3樓"
"24932550","好日子國際有限公司","臺北市中山區龍江路120巷7號"
"24933072","沐堂室內裝修設計工程有限公司","臺北市中正區永春街268號"
"24934375","宇拓國際股份有限公司","臺北市信義區永吉路168號5樓之2"
"24934516","日寺娛樂有限公司","臺北市松山區復興南路1段1號7樓之1"
"24934699","東滋音樂有限公司","臺北市中正區南昌路1段37號4樓"
"24934868","森思股份有限公司","臺北市中山區松江路111號14樓"
"24934874","盛會娛樂有限公司","臺北市中正區忠孝西路1段33號7樓"
"24934902","大話開發娛樂事業有限公司","臺北市大安區忠孝東路4段233號5樓之7"
"24935114","潮流娛樂事業有限公司","臺北市中正區水源路33巷14號"
"24935536","趨向企管顧問有限公司","臺北市中正區中華路1段59號7樓"
"24935796","量子創意影音有限公司","臺北市中正區羅斯福路3段76號3樓"
"24936253","傑克安東尼海明影像製作有限公司","臺北市信義區松德路12號9樓"
"24936752","愛蜜莉寵物有限公司","臺北市松山區南京東路5段393號3樓"
"24936964","玩美影像有限公司","臺北市信義區基隆路1段155號13樓之6"
"24938127","真我形象有限公司","臺北市中正區愛國東路24號4樓"
"24938251","酷比創意有限公司","臺北市中山區南京東路2段101號11樓"
"24938484","德普斯管理顧問有限公司","臺北市中山區農安街49號4樓之6"
"24938695","角珞有限公司","臺北市松山區南京東路5段33號7樓"
"24939759","嘉嘉顧問有限公司","臺北市萬華區貴陽街2段175號4樓"
"24939955","億百分設計有限公司","臺北市萬華區長沙街2段91號3樓之3"
"24940117","疑問詞科技有限公司","臺北市士林區承德路4段237號9樓"
"24940587","越界文化創藝有限公司","臺北市大安區信義路2段230號12樓之8"
"24940670","松露文化創意有限公司","臺北市大安區文昌街66號"
"24940720","填心國際股份有限公司","臺北市松山區民權東路3段184巷1號7樓"
"24940931","哲言國際有限公司","臺北市士林區磺溪街39號4樓"
"24941565","喆奇行銷股份有限公司","臺北市中山區長安東路2段31號4樓"
"24942543","異角藝術股份有限公司","臺北市松山區民權東路3段178號8樓"
"24942966","愛比藝術國際有限公司","臺北市中山區民生東路2段122號"
"24943634","可立拍文創有限公司","臺北市松山區八德路4段286號4樓"
"24943698","凱泰國際多媒體有限公司","臺北市中山區松江路122號11樓"
"24943775","縫影子宇宙有限公司","臺北市內湖區行愛路77巷63號4樓"
"24944253","綿谷婚紗有限公司","臺北市內湖區大湖山莊街159號"
"24945751","天祿東尼科技有限公司","臺北市中山區南京東路2段101號11樓"
"24947272","非凡力創意行銷股份有限公司","臺北市南港區園區街17號3樓之3"
"24947385","魅奇藝術有限公司","臺北市中正區銅山街24號地下樓"
"24947435","品行良好整合行銷有限公司","臺北市信義區中坡南路184號1樓"
"24947913","艾瓦整合設計有限公司","臺北市中山區南京東路2段101號11樓"
"24948146","運來富貴藝術文創有限公司","臺北市松山區敦化北路170號3樓"
"24948309","安善設計有限公司","臺北市大安區忠孝東路4段59號10樓之2"
"24948666","未來映像有限公司","臺北市內湖區金龍路37號"
"24948716","亮相娛樂有限公司","臺北市松山區八德路3段12巷20弄9號1樓"
"24949074","仕鉅有限公司","臺北市士林區重慶北路4段248號2樓"
"24949932","橙檍數位行銷顧問有限公司","臺北市大安區信義路4段341號8樓"
"24950249","微笑國際文創有限公司","臺北市士林區葫蘆街70巷15號3樓"
"24950424","豐拾貨有限公司","臺北市中山區錦州街7號"
"24951417","不毛文化有限公司","臺北市中山區民權東路2段135巷30弄17號2樓"
"24951459","香尼歐整合行銷有限公司","臺北市大安區忠孝東路4段221號10樓"
"24951789","創砥數位設計股份有限公司","臺北市中山區錦州街46號12樓之3"
"24952181","華儀攝影有限公司","臺北市中山區撫順街15號8樓之1"
"24952204","齊心娛樂事業有限公司","臺北市中山區長春路129號6樓之1"
"24952387","星肯有限公司","臺北市中山區中山北路1段53巷8號10樓之2"
"24952400","卵子創意有限公司","臺北市中山區長春路130之6號"
"24952794","五樓創意有限公司","臺北市文山區羅斯福路5段170巷29號5樓"
"24952886","愛美麗視覺影像有限公司","臺北市信義區基隆路2段189號13樓之13"
"24953528","本勢娛樂事業有限公司","臺北市大安區仁愛路4段425之1號"
"24953941","香客大廟文化事業有限公司","臺北市中山區錦州街46號12樓之3"
"24954189","多元國際文創有限公司","臺北市內湖區瑞光路513巷22弄5號8樓之3"
"24954907","克莉思朵蕾絲有限公司","臺北市北投區大度路怡和巷3弄16號"
"24955194","鑉洣國際行銷有限公司","臺北市中山區民權東路3段58號11樓之5"
"24955265","星海銀河國際有限公司","新北市三重區重陽路1段1號6樓之1"
"24956356","魚禾草影像有限公司","臺北市中山區長春路130之6號"
"24956378","瑞致國際企業有限公司","臺北市中正區許昌街42之1號10樓"
"24956383","好樹文創有限公司","臺北市松山區南京東路5段405號7樓之4"
"24956530","果冊視覺行銷整合有限公司","臺北市大同區歸綏街209號6樓之6"
"24956594","虎斑股份有限公司","臺北市中正區延平南路61號9樓之10"
"24956601","秀達人娛樂整合行銷股份有限公司","臺北市中山區長春路378號3樓之1"
"24956779","震聲音有限公司","臺北市松山區富錦街417巷5號4樓"
"24956829","童趣放肆股份有限公司","臺北市松山區八德路4段123號地下1層之3"
"24956898","意識數位有限公司","臺北市內湖區新湖三路237號5樓"
"24957593","逸思創意有限公司","臺北市中正區重慶南路1段43號6樓之4"
"24957881","海邦有限公司","臺北市中山區長春路128之2號4樓"
"24958397","台北利境創意室內裝修設計股份有限公司","臺北市大安區復興南路1段200號12樓"
"24958609","森平房有限公司","臺北市大同區太原路54之1號"
"24958930","熊屋傳播事業有限公司","臺北市萬華區雙園街150號1樓"
"24959001","黑潮海事工程有限公司","臺北市北投區知行路286號2樓"
"24959240","群羿堂策略整合行銷有限公司","臺北市萬華區桂林路27號5樓"
"24959403","播鵝鐳達商業攝影有限公司","臺北市松山區八德路3段12巷63弄10號"
"24959451","益帖國際有限公司","臺北市大安區忠孝東路3段136號11樓"
"24959852","伽馬實業有限公司","臺北市信義區光復南路495號2樓之1"
"24961029","佳畫影音製作有限公司","臺北市中山區復興北路516號之1"
"24961153","這光影像有限公司","臺北市大同區民族西路59號"
"24961175","上下誌有限公司","臺北市大同區大龍街231號"
"24961436","光和影映像股份有限公司","臺北市松山區光復北路35號9樓"
"24962012","愛唯得網路科技有限公司","臺北市中山區民生西路6號3樓"
"24962168","桓創科技有限公司","臺北市中山區伊通街87巷4之1號2樓"
"24962322","澄銳國際創意有限公司","臺北市信義區莊敬路325巷60號3樓"
"24962414","令可顧問有限公司","臺北市大安區忠孝東路3段136號9樓之5"
"24962688","瑩妃有限公司","臺北市大安區忠孝東路4段162號4樓之7"
"24963531","昇羽國際有限公司","臺北市南港區南港路3段314巷5號2樓"
"24963785","自造玩創有限公司","臺北市信義區忠孝東路5段482號地下樓及482號地下樓之1"
"24963808","究穎國際娛樂股份有限公司","臺北市中山區農安街19號地下1樓"
"24964102","上達創意生活股份有限公司","臺北市中正區南海路46號"
"24964709","異國娛樂有限公司","臺北市大安區和平東路1段87之1號4樓"
"24964898","山媽映畫有限公司","臺北市信義區基隆路2段48號11樓之2"
"24965398","想你音樂有限公司","臺北市大同區涼州街2-11號"
"24966039","我在家設計科技股份有限公司","臺北市士林區中山北路6段172巷16弄2號4樓之6"
"24966050","有事創意有限公司","臺北市大安區泰順街38巷16號"
"24966354","對不隊電影股份有限公司","臺北市大安區忠孝東路4段107號12樓之3"
"24966474","富山坊有限公司","臺北市大同區南京西路163號2樓之57"
"24967023","過癮科技有限公司","臺北市中山區民族東路512巷13弄20號3樓"
"24967614","夢之日國際企劃有限公司","臺北市中山區南京東路3段189號4樓"
"24967728","綠活國際有限公司","臺北市信義區信義路5段150巷401弄20號1樓"
"24967972","捷旭有限公司","臺北市信義區基隆路2段145號9樓之1"
"24967987","想像公園有限公司","臺北市信義區松德路25巷30號"
"24968114","太森聯合有限公司","臺北市松山區三民路113巷5之2號"
"24968769","明華園文化藝術有限公司","臺北市內湖區環山路1段24巷24號4樓"
"24968846","白日夢創意國際有限公司","臺北市中山區中山北路2段103號8樓之1"
"24969227","九聲有限公司","臺北市大安區忠孝東路3段305號6樓之1"
"24969253","甜柿影像制作有限公司","臺北市中正區晉江街31號"
"24969373","八號星球有限公司","臺北市大安區金山南路2段127號"
"24969654","旅飯股份有限公司","臺北市內湖區民權東路6段146號5樓之24"
"24969887","影流文創有限公司","臺北市文山區福興路82巷6弄2號5樓"
"24970202","元盟生活實業有限公司","臺北市大同區重慶北路3段363號"
"24970701","合砌設計有限公司","臺北市松山區塔悠路292號"
"24970863","黑格影像有限公司","臺北市大安區忠孝東路4段221號10樓"
"24971552","扭轉力行銷股份有限公司","臺北市中山區南京東路2段101號11樓"
"24972362","艾墨創意行銷有限公司","臺北市大安區信義路4段248號7樓"
"24972460","必樂創意行銷整合有限公司","臺北市大安區忠孝東路4段59號10樓之3"
"24973398","沐希企業有限公司","臺北市南港區忠孝東路6段467號2樓"
"24973453","大象設計整合有限公司","臺北市大安區新生南路1段103巷9號"
"24974050","亮采影像有限公司","臺北市中山區民生東路3段88巷34號1樓"
"24974066","世紀印刷有限公司","臺北市大同區蘭州街30號1樓"
"24974501","心衣有限公司","臺北市大同區承德路1段77巷15號1樓"
"24974517","和璞影像有限公司","臺北市大同區重慶北路3段140號"
"24974761","織稻糧商號有限公司","臺北市松山區八德路4段656號4樓"
"24975038","舅車庫有限公司","臺北市內湖區行善路417巷28號1樓"
"24975184","版塊有限公司","臺北市松山區敦化北路222巷23號"
"24975924","極品國際開發股份有限公司","臺北市中山區明水路397巷7弄2號2樓之1"
"24976249","法碩資訊有限公司","臺北市內湖區康寧路3段159號3樓"
"24976254","卵形有限公司","臺北市中山區龍江路37巷9號1樓"
"24976389","時間因子有限公司","臺北市文山區景興路253號1樓"
"24976493","樺科智慧科技股份有限公司","臺北市中山區敬業一路128巷22號6樓"
"24977802","震典國際有限公司","臺北市中山區南京東路2段95號11樓"
"24978226","水京棧國際酒店股份有限公司","高雄市苓雅區中正一路120號16樓之2"
"24979169","美芙蒂有限公司","高雄市苓雅區自強三路3號13樓之8"
"24980503","優米雅有限公司","高雄市前金區中華三路217號10樓之6"
"24981550","蘿蔓朵婚紗有限公司","高雄市鼓山區美術東五路52號"
"24981806","仉氏影業有限公司","高雄市左營區大中二路750號4樓"
"24983473","高田國際事業有限公司","高雄市鼓山區明誠三路695號4樓"
"24983570","翻轉食糧有限公司","高雄市鼓山區美術北五街55號7樓"
"24983950","愛拍國際有限公司","高雄市苓雅區四維四路2號4樓之2"
"24987338","亞詰室內裝修有限公司","高雄市三民區民族一路186號1樓"
"24987750","長元育樂股份有限公司","高雄市田寮區長山路1號"
"24988580","諾伯國際企業有限公司","高雄市三民區市中一路384巷81號1樓"
"24988596","熊光光電科技有限公司","高雄市鳳山區埤北路55號3樓"
"24988836","樂麗欣國際股份有限公司","高雄市新興區民生一路56號23樓之6"
"24989032","旭峻資訊有限公司","高雄市楠梓區常盛街276巷28號1樓"
"24989526","亞格農時尚股份有限公司","高雄市前金區自強一路22號10樓之1"
"24990214","七點廣告設計有限公司","高雄市新興區復橫一路157巷24號1樓"
"24991115","千益創新有限公司","高雄市苓雅區民權一路26巷1號12樓之1"
"24991728","大衛咖啡有限公司","高雄市左營區後昌路611巷33號1樓"
"24992326","賺錢國際事業有限公司","高雄市三民區覺民路31號1樓"
"24992780","鑫時代整合行銷有限公司","高雄市三民區明誠一路128號5樓"
"24993486","亞洲混音國際有限公司","高雄市新興區玉竹一街27號2樓"
"24993508","璟鋐國際貿易有限公司","高雄市三民區嫩江街2巷24號3樓"
"24993795","冠昇生態有限公司","高雄市苓雅區光華一路226號9樓"
"24994653","桔立國際有限公司","高雄市苓雅區自強三路3號26樓之3"
"24995793","羽臣有限公司","高雄市三民區大豐一路300號1樓"
"25000787","寶達開發建設有限公司","臺中市大雅區員林里大林路195巷23之17號1樓"
"25000908","睿熾設計有限公司","宜蘭縣宜蘭市進士里健康路1段145號1樓"
"25001168","森彩科技有限公司","桃園市龜山區萬壽路2段660巷11號"
"25003932","耘集室內裝修有限公司","新竹市湳中里16鄰武陵路167號13樓之2"
"25004849","偉光國際有限公司","臺中市東區東橋里仁和路482號1樓"
"25006157","尼歐立體高清影像有限公司","臺中市西區五權三街283號"
"25009416","法樂琦有限公司","臺南市中西區永福里民生路1段89號1丶2樓"
"25009680","中華擴增實境股份有限公司","新北市板橋區莊敬路25巷4弄7號(1樓)"
"25011031","協奏曲整合行銷有限公司","臺南市東區自強里7鄰東門路三段37巷55弄6號1樓"
"25011335","晶璽國際開發有限公司","桃園市大溪區美華里23鄰美山路一段601巷142弄17號6樓"
"25011692","琮修文創有限公司","高雄市鼓山區內惟路435巷15號1樓"
"25012968","輝創意攝影有限公司","臺中市西區忠義街51巷7號5樓"
"25015418","拓鋒有限公司","新北市新莊區中平里中平路304號1樓"
"25015888","鳳凰國際公關顧問有限公司","高雄市三民區民族1路702-15號3樓"
"25017984","茄哩啡有限公司","臺中市西區梅川東路一段46號1樓"
"25018999","臻慧鑽有限公司","臺南市南區仁慈街74號5F"
"25019033","飛騰整合行銷有限公司","新北市新店區安康路2段183巷18號5樓"
"25019060","遠雄海洋公園股份有限公司","花蓮縣壽豐鄉鹽竂村福德189號"
"25019688","良聯有限公司","新北市中和區中原里橋安街6號4樓"
"25020778","阿密斯整合行銷有限公司","臺中市和平區梨山里中正路34之1號１樓"
"25020931","捷群服裝有限公司","臺中市西區台中港路一段156之11號1樓"
"25021707","福爾摩沙製片有限公司","高雄市三民區天津街17號"
"25022298","春成科技有限公司","高雄市大寮區中庄里民安街125號1樓"
"25023352","葛瑞特印刷事業有限公司","新北市新莊區昌平街82巷13弄10號5樓"
"25023705","全球國際網誌有限公司","新北市新莊區中華路2段203號3樓"
"25024774","家昇文化事業有限公司","屏東縣屏東市北勢里廣東路793號"
"25028080","霖峰實業有限公司","嘉義市西區劉厝里8鄰自強街107號2樓"
"25028504","廣濬國際科技股份有限公司","新北市中和區民享街59巷5-2號3樓"
"25029736","頎榮興業有限公司","臺中市中區大誠里成功路306巷10號12樓之9"
"25030966","影動亞洲有限公司","新北市中和區員山路611巷6弄7號"
"25032839","利貫數位科技有限公司","新北市土城區興城路6號4樓"
"25033915","色影企業有限公司","雲林縣北港鎮文化路111號2樓"
"25042317","睿點視覺創意有限公司","新北市中和區員山里4鄰員山路567號2樓"
"25044595","今翔資訊有限公司","臺中市南屯區大英街292號5樓"
"25049677","無有有限公司","臺中市西區忠明里美村路一段36號9樓之1"
"25049867","聯創傳播有限公司","新北市林口區湖南里文化二路1段456號2樓"
"25052068","勤美創意設計有限公司","臺中市西屯區大鵬里文心路三段241號9樓之10"
"25052715","采攝創意整合有限公司","新北市新莊區中信里中榮街9號"
"25053904","傳動數位設計有限公司","臺中市西區台中港路一段152號7樓之3"
"25059920","囍都國際有限公司","臺南市北區勝利路188號1樓"
"25061593","采像影視有限公司","臺北市信義區光復南路547號3樓之4"
"25063467","貝拉美學股份有限公司","臺中市西屯區何明里台中港路二段6號地下一樓"
"25064395","元拓國際工程有限公司","臺中市西區精誠二十二街13號1樓"
"25064515","儷庭國際有限公司","臺北市信義區吳興街68號"
"25066226","步世得整合行銷有限公司","臺中市太平區新興里樹德路212號2樓"
"25066865","清水生命禮儀有限公司","臺中市北區德化街433號1樓"
"25067344","妡羽國際企業有限公司","桃園市平鎮區新富里環南路2段271號13樓之3"
"25067962","昇晉國際有限公司","新北市蘆洲區中華里8鄰正和街72巷22號"
"25068603","翊太國際企業有限公司","桃園市桃園區春日路987-8號"
"25069912","綾川創意行銷有限公司","新北市板橋區茶館街14號"
"25071038","玩味企劃整合行銷有限公司","基隆市七堵區大德路136號9樓"
"25071847","永盟欣業有限公司","臺中市北屯區忠平里雷中街57巷3號1樓"
"25073351","出發文創有限公司","新北市新店區中正路504號(1樓)"
"25074416","鼎昕整合行銷股份有限公司","臺北市信義區光復南路505號12樓之4"
"25077808","璐藝光景設計有限公司","新北市中和區中山路2段2巷13弄13之4號"
"25079995","自然影像有限公司","臺南市東山區科里里枋子林67之9號"
"25080613","銘騰國際開發有限公司","高雄市鳥松區中山西路39號1樓"
"25081697","林波波河娛樂有限公司","臺中市西區忠明里中興街233號9樓之8"
"25082582","泓維行銷有限公司","新北市中和區民享街30巷8弄7之3號"
"25083724","加速影像科技有限公司","桃園市平鎮區莊敬里莊敬街25號"
"25084060","高飛藝文有限公司","新北市蘆洲區中正路101號3樓"
"25085531","極芢整合行銷有限公司","桃園市桃園區朝陽里鎮三街15號"
"25085595","炫嘉影像有限公司","臺南市北區成功里12鄰北成路30號11樓之1"
"25086341","大愛生命藝術有限公司","高雄市仁武區八卦里澄觀路123號2樓"
"25086497","愛的形狀有限公司","桃園市中壢區信義里蘇州一街22號4樓"
"25086905","聯達印刷事業有限公司","南投縣南投市福興里彰南路三段1064號"
"25088283","時光工坊有限公司","基隆市中正區碧砂里環港街5號A棟3樓301室"
"25089115","葳戀創意婚禮有限公司","基隆市中正區環港街5號A棟3樓301室"
"25089494","立達欣業有限公司","桃園市桃園區中興里30鄰中山北路189之1號7樓"
"25096333","精準多媒體科技有限公司","新北市新店區安民街365巷10弄8號"
"25100385","成美健康事業有限公司","新北市淡水區新市一路3段22號7樓"
"25100765","青石創意行銷有限公司","臺北市中山區吉林路200巷13號"
"25100890","舞影帝國有限公司","臺北市信義區信義路6段104號2樓"
"25101407","米翎企業股份有限公司","臺北市松山區南京東路4段130號10樓"
"25101764","戌富股份有限公司","臺北市內湖區瑞湖街178巷21號4樓"
"25101820","販賣基電影事業有限公司","臺北市大安區敦化南路1段302號11樓之1"
"25102399","同心健康事業有限公司","臺北市大安區大安路1段101巷10號4樓"
"25102927","洛郝思時尚股份有限公司","臺北市中山區中山北路2段42巷12號"
"25104002","好撒瑪利亞人有限公司","臺北市松山區南京東路4段133巷4弄28號1樓"
"25104093","點意形象有限公司","臺北市大安區安和路2段120號2樓"
"25104354","駿瑩有限公司","臺北市中山區林森北路67巷59號"
"25104559","大無限創意有限公司","臺北市中正區忠孝東路1段45號12樓之3"
"25104832","日和生活有限公司","新北市五股區成泰路2段11巷2號2樓"
"25105109","宥瑜股份有限公司","臺北市中正區開封街1段11號3樓"
"25107465","騰悅數位科技股份有限公司","臺北市萬華區峨眉街64號6樓"
"25108318","泰坦攝影事業有限公司","臺北市中山區長春路20號3樓"
"25108470","廣畯數位科技有限公司","臺北市內湖區內湖路1段323巷14弄2號1樓"
"25108703","天朝風華專業古裝戲服有限公司","臺北市松山區八德路3段106巷25號1樓"
"25109219","艾度活動整合行銷有限公司","新北市板橋區大同街4號7樓"
"25109576","大麗生物科技有限公司","臺北市大安區敦化南路2段200巷18號6樓"
