id,Address,Response_Address,Response_X,Response_Y
415,臺北市內湖區堤頂大道2段489號2樓,臺北市內湖區西康里26鄰堤頂大道二段489號,306685.173,2775046.694
416,臺北市松山區塔悠路195號,臺北市松山區新東里18鄰塔悠路195號,307469.651,2772254.050
417,臺北市信義區基隆路1段68號2樓,臺北市信義區新仁里19鄰基隆路一段68號,307232.227,2771069.825
418,臺北市松山區寶清街31號9樓,臺北市松山區新聚里5鄰寶清街31號,307392.582,2771491.361
419,臺北市內湖區瑞光路581號,臺北市內湖區西湖里13鄰瑞光路581號,307288.201,2774729.793
420,臺北市大安區忠孝東路4段320號6樓,臺北市大安區正聲里14鄰忠孝東路四段320號,306238.497,2770449.422
421,臺北市信義區福德街113之1號1樓,臺北市信義區中坡里1鄰福德街113之1號,308750.453,2770028.989
422,臺北市信義區松山路132號9樓,臺北市信義區四育里3鄰松山路132號,308281.873,2771164.589
423,臺北市文山區景興路23巷6弄9號1樓,臺北市文山區興福里8鄰景興路23巷6弄9號,305069.787,2765600.952
424,臺北市松山區南京東路5段160號1樓,臺北市松山區吉祥里8鄰南京東路五段160號,306806.407,2771564.165
425,臺北市士林區磺溪街36號7樓,臺北市士林區蘭興里5鄰磺溪街36號,302762.847,2777687.343
426,臺北市內湖區民權東路6段123巷24號5樓之4,臺北市內湖區寶湖里3鄰民權東路六段123巷24號,309804.528,2773652.801
427,臺北市萬華區環河南路2段250巷28弄28號1樓,臺北市萬華區華江里18鄰環河南路二段250巷28弄28號,299687.992,2769614.378
428,臺北市內湖區瑞光路68號6樓,臺北市內湖區湖元里18鄰瑞光路68號,308710.132,2773741.907
429,臺北市大安區仁愛路3段136號5樓,臺北市大安區和安里1鄰仁愛路三段136號,304634.836,2770041.732
430,臺北市中山區建國北路2段33號5樓之8,臺北市中山區朱馥里3鄰建國北路二段33號,304204.491,2771982.163
431,臺北市松山區南京東路4段197號5樓,臺北市松山區東勢里14鄰南京東路四段197號,306196.048,2771626.316
432,臺北市內湖區民權東路6段23號3樓之3,臺北市內湖區湖元里18鄰民權東路六段23號,308791.892,2773499.553
433,臺北市大安區忠孝東路4段166號11樓之2,臺北市大安區建倫里1鄰忠孝東路四段166號,305549.499,2770463.036
434,臺北市內湖區民權東路6段296巷20號,臺北市內湖區葫洲里20鄰民權東路六段296巷20號,311147.248,2773917.442
435,臺北市中山區南京東路3段61號5樓,臺北市中山區復華里14鄰南京東路三段61號,304295.018,2771663.970
436,臺北市中山區松江路125號10樓,臺北市中山區中央里8鄰松江路125號,303804.301,2771756.620
437,臺北市信義區忠孝東路4段500號9樓之4,臺北市信義區興隆里9鄰忠孝東路四段500號,306679.764,2770432.765
438,臺北市松山區南京東路3段287號14樓,臺北市松山區中正里26鄰南京東路三段287號,305105.542,2771648.342
439,臺北市大安區信義路2段88號5樓,臺北市大安區光明里1鄰信義路二段88號,303169.184,2769643.362
440,臺北市大同區重慶北路2段243號8樓,臺北市大同區民權里2鄰重慶北路二段243號,301831.844,2772800.662
441,臺北市南港區八德路4段778號2樓,臺北市南港區玉成里17鄰八德路四段778號,308548.819,2771489.670
442,臺北市中山區民權東路2段166號1樓,臺北市中山區松江里20鄰民權東路二段166號,304019.405,2772777.687
443,臺北市中山區通北街122號4樓,臺北市中山區劍潭里9鄰通北街122號,304255.031,2775169.783
444,臺北市中山區民權東路１段７２號６樓,臺北市中山區聚葉里11鄰民權東路一段72號,302985.564,2772804.822
445,臺北市中正區衡陽路10號9樓,臺北市中正區黎明里9鄰衡陽路10號,301827.786,2770553.203
446,臺北市信義區忠孝東路5段1之5號6樓,臺北市信義區興雅里1鄰忠孝東路五段1之5號,307006.093,2770496.773
447,臺北市中山區(南)長春路三十一號七樓之一,找不到指定的門牌地址。,,
448,臺北市大安區忠孝東路4段142號5樓之5,臺北市大安區建倫里1鄰忠孝東路四段142號,305435.731,2770464.431
449,臺北市中山區南京東路2段100號7樓之4,臺北市中山區興亞里18鄰南京東路二段100號,303664.285,2771626.803
450,臺北市中山區長安東路2段99號3樓,臺北市中山區朱園里12鄰長安東路二段99號,303974.382,2771258.908
451,臺北市松山區八德路3段166號及166-1號,臺北市松山區復建里6鄰八德路三段166號,306037.947,2771202.734
452,臺北市大安區安居街108巷16號1樓,臺北市大安區黎元里12鄰安居街108巷16號,305701.215,2768008.531
453,臺北市信義區林口街38巷6號1樓,臺北市信義區大仁里10鄰林口街38巷6號,308507.780,2770102.168
454,臺北市信義區東興路45號3樓,臺北市信義區新仁里19鄰東興路45號,307147.028,2771183.403
455,臺北市內湖區瑞光路399號7樓,臺北市內湖區港墘里20鄰瑞光路399號,307766.350,2774501.662
456,臺北市南港區南港路3段47巷2號7樓,臺北市南港區西新里10鄰南港路三段47巷2號,309560.536,2771747.011
457,臺北市大安區忠孝東路4段289號7樓,臺北市大安區華聲里11鄰忠孝東路四段289號,305976.888,2770501.153
458,臺北市松山區東興路26、28號16樓,臺北市松山區新聚里17鄰東興路6號,307014.320,2771448.946
459,臺北市松山區南京東路5段356號3樓之1,臺北市松山區新聚里3鄰南京東路五段356號,307481.427,2771554.381
460,臺北市中正區衡陽路10號8樓,臺北市中正區黎明里9鄰衡陽路10號,301827.786,2770553.203
461,臺北市中山區農安街227巷3弄16號7樓,臺北市中山區行政里5鄰農安街227巷3弄16號,303932.205,2773090.253
462,臺北市松山區東興路12號2樓,臺北市松山區新聚里17鄰東興路12號,307017.612,2771426.435
463,臺北市南港區南港路2段20巷5號地下1樓,臺北市南港區東明里16鄰南港路二段20巷5號,311100.834,2771944.478
464,臺北市大安區和平東路2段107巷12之1號1樓,臺北市大安區龍生里12鄰和平東路二段107巷12之1號,304532.177,2768793.657
465,臺北市中山區南京東路3段200號7樓,臺北市中山區力行里17鄰南京東路三段200號,304795.456,2771611.411
466,臺北市中山區松江路152號9樓之11,臺北市中山區中吉里8鄰松江路152號,303762.733,2771885.645
467,臺北市內湖區民權東路6段11巷37之1號4樓,臺北市內湖區湖元里18鄰民權東路六段11巷37之1號,308241.118,2773413.423
468,臺北市內湖區瑞光路192號11樓,臺北市內湖區港墘里20鄰瑞光路192號,308222.119,2774179.017
469,臺北市中山區松江路3號6樓之2,臺北市中山區朱園里21鄰松江路3號,303794.628,2770978.676
470,臺北市南港區南港路2段99之16號,臺北市南港區東明里2鄰南港路二段99之16號,310222.829,2771848.955
471,臺北市大安區信義路4段69號5樓,臺北市大安區仁慈里1鄰信義路四段69號,305059.563,2769602.178
472,臺北市內湖區舊宗路1段288號1樓,臺北市內湖區湖元里18鄰舊宗路一段288號,308017.393,2773139.423
473,臺北市中山區南京東路2段71號3樓,臺北市中山區中吉里1鄰南京東路二段71號,303560.533,2771670.320
474,臺北市內湖區內湖路1段66號10樓,臺北市內湖區西康里26鄰內湖路一段66號,306720.973,2775162.599
475,臺北市松山區南京東路4段126號10樓、10樓之1至之3,臺北市松山區復勢里12鄰南京東路四段126號,306035.887,2771586.209
476,臺北市中山區南京東路2段125號14樓,臺北市中山區中央里8鄰南京東路二段125號,303937.540,2771668.290
477,臺北市信義區松德路131號地下1樓,臺北市信義區國業里2鄰松德路131號,308039.627,2770045.842
478,臺北市大安區忠孝東路4段285號14樓,臺北市大安區車層里5鄰忠孝東路四段285號,305917.747,2770507.591
479,臺北市南港區重陽路524號1樓,臺北市南港區三重里4鄰重陽路524號,311803.454,2772696.646
480,臺北市中山區新生北路1段41號2樓,臺北市中山區興亞里10鄰新生北路一段41號,303529.500,2771161.489
481,臺北市內湖區舊宗路2段189號3樓、3樓之1、3樓之2,臺北市內湖區湖元里18鄰舊宗路二段189號,307967.261,2773878.878
482,臺北市內湖區新湖三路28及36號,臺北市內湖區湖元里18鄰新湖三路36號,308029.232,2772895.369
483,臺北市松山區敦化南路1段2號9樓,臺北市松山區福成里1鄰敦化南路一段2號,305342.194,2771194.241
484,臺北市大安區忠孝東路3段239號4樓,臺北市大安區誠安里1鄰忠孝東路三段239號,304567.390,2770521.947
485,臺北市士林區後港街169號1樓2樓,臺北市士林區前港里3鄰後港街169號,302571.832,2775570.362
486,臺北市信義區松信路１８號１樓,臺北市信義區雅祥里17鄰松信路18號,307723.622,2771275.254
487,臺北市中山區新生北路3段19巷36號1樓,臺北市中山區新福里13鄰新生北路三段19巷36號,303406.656,2772962.698
488,臺北市中山區敬業四路33號8樓,臺北市中山區金泰里14鄰敬業四路33號,306288.398,2774870.314
489,臺北市中山區建國北路2段129號12樓,臺北市中山區江山里7鄰建國北路二段129號,304212.476,2772532.814
490,臺北市中山區民生東路3段75號4樓,臺北市中山區江山里23鄰民生東路三段75號,304867.903,2772315.781
491,臺北市中山區南京東路2段90號20樓,臺北市中山區興亞里18鄰南京東路二段90號,303589.581,2771615.760
492,臺北市大安區臥龍街3號8樓之1,臺北市大安區虎嘯里2鄰臥龍街3號,305181.146,2768592.900
493,臺北市內湖區成功路5段87之2號,臺北市內湖區金湖里7鄰成功路五段87之2號,311052.015,2774098.052
494,臺北市中正區汀州路1段193號2樓,臺北市中正區永功里15鄰汀州路一段193號,301600.552,2768864.576
495,臺北市內湖區瑞光路66巷36號,臺北市內湖區湖元里18鄰瑞光路66巷36號,308643.533,2773660.912
496,臺北市中山區松江路66號8樓,臺北市中山區興亞里14鄰松江路66號,303755.860,2771320.180
497,臺北市南港區園區街3-2號6樓,臺北市南港區三重里25鄰園區街3之2號,311739.337,2772220.871
498,臺北市內湖區堤頂大道2段301號6樓,臺北市內湖區西湖里13鄰堤頂大道二段301號,306984.949,2774624.575
499,臺北市士林區大南路361號地下1樓,臺北市士林區福中里10鄰大南路361號,302096.505,2775723.049
500,臺北市中山區明水路411號7樓,臺北市中山區永安里29鄰明水路411號,305334.815,2774476.401
501,臺北市松山區南京東路3段248號10樓之2,臺北市松山區中正里21鄰南京東路三段248號,304947.513,2771608.137
502,臺北市信義區基隆路2段149之17號10樓,臺北市信義區黎順里8鄰基隆路二段149之17號,306052.884,2768848.930
503,臺北市中山區中山北路2段45巷21之1號3樓,臺北市中山區康樂里5鄰中山北路二段45巷21之1號,302855.656,2771913.856
504,臺北市中山區長安東路1段63之1號5樓,臺北市中山區正義里2鄰長安東路一段63之1號,303209.828,2771266.530
505,臺北市中山區長安東路2段80號2樓之1,臺北市中山區朱園里13鄰長安東路二段80號,303892.138,2771237.566
506,臺北市內湖區西湖里瑞光路502號3樓,臺北市內湖區西湖里13鄰瑞光路502號,307312.720,2774675.549
507,臺北市中山區松江路54號6樓之2,臺北市中山區興亞里13鄰松江路54號,303755.321,2771275.430
508,臺北市大安區忠孝東路4段312號8樓之3,臺北市大安區正聲里14鄰忠孝東路四段312號,306192.509,2770450.142
509,臺北市中正區杭州南路1段15之1號19樓,臺北市中正區幸福里12鄰杭州南路一段15之1號,303163.735,2770617.023
510,臺北市內湖區成功路4段30巷10號11樓之1,臺北市內湖區內湖里11鄰成功路四段30巷10號,309646.957,2774998.077
511,臺北市大安區安和路1段29號15樓,臺北市大安區建倫里3鄰安和路一段29號,305542.774,2770224.585
512,臺北市內湖區瑞光路392號22樓,臺北市內湖區港墘里20鄰瑞光路392號,307627.173,2774516.717
513,臺北市信義區松仁路89號5樓,臺北市信義區安康里8鄰松仁路89號,307392.924,2770021.133
514,臺北市中山區中山北路2段61號9樓,臺北市中山區中山里4鄰中山北路二段61號,302765.038,2772092.580
515,臺北市南港區重陽路522號1樓,臺北市南港區三重里4鄰重陽路522號,311797.845,2772689.665
516,臺北市大安區復興南路１段３５２號５樓之１,臺北市大安區和安里3鄰復興南路一段352號,304829.166,2769825.380
517,臺北市中山區松江路25巷2、4號1樓,臺北市中山區朱園里19鄰松江路25巷2號,303820.624,2771089.086
518,臺北市中山區民權東路1段36號7樓之1,臺北市中山區聚葉里2鄰民權東路一段36號,302851.939,2772805.462
519,臺北市大同區西寧北路62之5號8樓,臺北市大同區玉泉里10鄰西寧北路62之5號,301309.349,2771746.010
520,臺北市中山區中山北路2段129號8樓之3,臺北市中山區聚葉里1鄰中山北路二段129號,302783.595,2772686.469
521,臺北市松山區復興北路363號13樓,臺北市松山區民有里5鄰復興北路363號,304930.074,2772631.337
522,臺北市大安區敦化南路2段97號20、21樓,臺北市大安區義安里16鄰敦化南路二段97號,305422.269,2769092.350
523,臺北市中正區忠孝東路2段88號8樓,臺北市中正區幸福里16鄰忠孝東路二段88號,303424.556,2770649.374
524,臺北市信義區忠孝東路4段560號7樓,臺北市信義區興隆里15鄰忠孝東路四段560號,306900.850,2770435.559
525,臺北市中山區中山北路3段27號3樓之5,臺北市中山區晴光里15鄰中山北路三段27號,302710.087,2773121.740
526,臺北市松山區敦化北路207號4樓之8及10,臺北市松山區精忠里4鄰敦化北路207號,305439.614,2772316.944
527,臺北市萬華區西藏路478號1樓,臺北市萬華區和平里23鄰西藏路478號,299904.639,2769070.034
528,臺北市內湖區文德路208巷62號,臺北市內湖區瑞陽里6鄰文德路208巷62號,308849.343,2774345.447
529,臺北市中正區和平西路1段170號2樓,臺北市中正區螢雪里13鄰和平西路一段170號,301955.836,2768916.869
530,臺北市中山區建國北路2段65號8樓,臺北市中山區朱馥里3鄰建國北路二段65號,304206.808,2772076.825
531,臺北市中山區松江路80號10樓,臺北市中山區興亞里15鄰松江路80號,303756.755,2771406.662
532,臺北市中山區松江路162號3樓,臺北市中山區中吉里10鄰松江路162號,303764.297,2772017.155
533,臺北市松山區八德路4段135號2樓之1,臺北市松山區吉祥里10鄰八德路四段135號,306724.767,2771296.026
534,臺北市中山區民生東路3段77號3樓,臺北市中山區江山里23鄰民生東路三段77號,304874.212,2772322.113
535,臺北市南港區園區街3號13樓,臺北市南港區三重里25鄰園區街3號,311745.412,2772394.440
536,臺北市松山區敦化北路207號4樓之6及9、7樓之2,臺北市松山區精忠里4鄰敦化北路207號,305439.614,2772316.944
537,臺北市內湖區行忠路42號6樓,臺北市內湖區湖元里18鄰行忠路42號,308290.959,2773138.478
538,臺北市中山區復興南路1段36號3樓,臺北市中山區埤頭里17鄰復興南路一段36號,304858.948,2771008.526
539,臺北市信義區光復南路495號3樓、3樓之1,臺北市信義區中興里2鄰光復南路495號,306298.666,2769488.833
540,臺北市松山區復興北路57號15樓之4,臺北市松山區中正里20鄰復興北路57號,304912.496,2771478.752
541,臺北市大安區延吉街239號3樓,臺北市大安區光信里11鄰延吉街239號,306077.009,2769914.060
542,臺北市士林區德行東路190巷1弄8號1樓,臺北市士林區聖山里9鄰德行東路190巷1弄8號,303599.811,2777895.627
543,臺北市內湖區堤頂大道2段477號8樓之1,臺北市內湖區西康里26鄰堤頂大道二段477號,306714.499,2774967.700
544,臺北市中山區中山北路2段129號8樓之2,臺北市中山區聚葉里1鄰中山北路二段129號,302783.595,2772686.469
545,臺北市內湖區新湖一路89號3樓,臺北市內湖區湖元里18鄰新湖一路89號,308100.893,2772380.190
546,臺北市文山區羅斯福路6段142巷82號1樓,臺北市文山區景仁里15鄰羅斯福路六段142巷82號,304371.445,2765592.344
547,臺北市中山區明水路397巷19弄22號(1樓),臺北市中山區永安里25鄰明水路397巷19弄22號,305412.918,2774590.140
548,臺北市中正區桃源街13號6樓之3,臺北市中正區建國里5鄰桃源街13號,301518.907,2770504.789
549,臺北市松山區民生東路5段165號8樓,臺北市松山區富錦里3鄰民生東路五段165號,306917.160,2772453.412
550,臺北市中山區新生北路1段25之2號1樓,臺北市中山區興亞里9鄰新生北路一段25之2號,303612.241,2771107.511
551,臺北市中山區松江路32之1號8樓,臺北市中山區興亞里4鄰松江路32之1號,303753.782,2771127.261
552,臺北市中山區民權西路11號10樓,臺北市中山區集英里18鄰民權西路11號,302649.023,2772855.074
553,臺北市中山區民權東路1段76號13樓,臺北市中山區聚葉里12鄰民權東路一段76號,303003.480,2772802.972
554,臺北市中山區南京東路2段71號6樓,臺北市中山區中吉里1鄰南京東路二段71號,303560.533,2771670.320
555,臺北市信義區信義路5段7號49樓,臺北市信義區西村里8鄰信義路五段7號,306976.247,2769609.563
556,臺北市松山區敦化北路405巷123弄3號,臺北市松山區精忠里11鄰敦化北路405巷123弄7號,306038.328,2772825.990
557,臺北市南港區舊莊街1段64號5樓,臺北市南港區舊莊里3鄰舊莊街一段64號,312421.544,2770464.531
558,臺北市松山區八德路4段106巷4弄10號,臺北市松山區復盛里18鄰八德路四段106巷4弄10號,306548.187,2771162.187
559,臺北市大安區復興南路2段327號7樓之1,臺北市大安區臥龍里8鄰復興南路二段327號,304857.764,2768528.794
560,臺北市中山區長安東路1段63之1號2樓,臺北市中山區正義里2鄰長安東路一段63之1號,303209.828,2771266.530
561,臺北市大安區敦化南路1段205號14樓之3,臺北市大安區建安里15鄰敦化南路一段205號,305423.834,2770542.762
562,臺北市松山區八德路4段699號11樓之1,臺北市松山區慈祐里20鄰八德路四段699號,308183.427,2771462.572
563,臺北市中山區復興南路1段36之1號3樓,臺北市中山區埤頭里17鄰復興南路一段36之1號,304858.771,2771002.359
564,臺北市內湖區行愛路169號2樓,臺北市內湖區湖元里18鄰行愛路169號,308468.982,2773121.677
565,臺北市中山區南京東路2段206號13樓之3,臺北市中山區朱園里1鄰南京東路二段206號,304065.932,2771624.336
566,臺北市南港區昆陽街140巷21號,臺北市南港區新光里2鄰昆陽街140巷21號,309869.162,2771415.840
567,臺北市中山區復興北路488巷1弄3號,臺北市中山區下埤里13鄰復興北路488巷1弄3號,304865.245,2773121.569
568,臺北市松山區塔悠路292號,臺北市松山區新益里12鄰塔悠路292號,307375.968,2772521.826
569,臺北市中正區八德路1段30號3樓,臺北市中正區梅花里15鄰八德路一段30號,303498.847,2770711.795
570,臺北市松山區南京東路4段137號9樓之2,臺北市松山區東勢里1鄰南京東路四段137號,306033.093,2771630.363
571,臺北市信義區基隆路1段143號10樓之2,臺北市信義區興雅里10鄰基隆路一段143號,307092.307,2770648.837
572,臺北市文山區景華街150巷9號,臺北市文山區興安里21鄰景華街150巷9號,305330.412,2765524.011
573,臺北市大安區信義路3段99巷34號,臺北市大安區和安里13鄰信義路三段99巷34號,304327.726,2769746.138
574,臺北市萬華區富民路155巷49號3樓之2,臺北市萬華區興德里15鄰富民路155巷49號,300601.225,2767939.416
575,臺北市大同區太原路117號4樓,臺北市大同區建泰里2鄰太原路117號,302061.497,2771725.894
576,臺北市中山區德惠街79巷2號1樓,臺北市中山區新庄里21鄰德惠街79巷2號,303313.100,2773287.737
577,臺北市大安區信義路4段6號6樓,臺北市大安區住安里3鄰信義路四段6號,304909.961,2769557.308
578,臺北市士林區至誠路2段17號2樓,臺北市士林區名山里4鄰至誠路二段17號,303451.056,2777193.597
579,臺北市中山區民權東路3段58號15樓之2,臺北市中山區江寧里18鄰民權東路三段58號,304709.524,2772772.343
580,臺北市文山區羅斯福路5段35號,臺北市文山區萬盛里1鄰羅斯福路五段35號,304378.108,2766717.708
581,臺北市中山區長安東路2段169號2樓,臺北市中山區力行里4鄰長安東路二段169號,304560.426,2771249.867
582,臺北市中正區忠孝西路1段50號11樓之15,臺北市中正區黎明里11鄰忠孝西路一段50號,302048.097,2771005.519
583,臺北市內湖區堤頂大道2段297號6樓,臺北市內湖區西湖里13鄰堤頂大道二段297號,307011.619,2774614.731
584,臺北市大安區東豐街52號2樓,臺北市大安區德安里10鄰東豐街52號,305183.071,2769869.739
585,臺北市松山區民權東路3段178號14樓,臺北市松山區民有里30鄰民權東路三段178號,305444.359,2772697.768
586,臺北市內湖區民權東路6段180巷6號10樓之23,臺北市內湖區寶湖里13鄰民權東路六段180巷6號,309789.618,2773462.164
587,臺北市信義區忠孝東路5段250號6樓,臺北市信義區廣居里3鄰忠孝東路五段250號,307798.193,2770417.413
588,臺北市中山區復興北路48號3樓,臺北市中山區力行里12鄰復興北路48號,304865.651,2771374.679
589,臺北市中山區通北街124號,臺北市中山區劍潭里9鄰通北街124號,304253.144,2775181.993
590,臺北市中正區忠孝東路2段35號,臺北市中正區梅花里12鄰忠孝東路二段35號,303279.090,2770738.180
591,臺北市中山區復興北路490號2樓,臺北市中山區下埤里13鄰復興北路490號,304894.311,2773110.225
592,臺北市松山區南京東路4段93號9樓之2,臺北市松山區東勢里2鄰南京東路四段93號,305912.330,2771632.428
593,臺北市中山區中山北路3段53之4號3樓之7,臺北市中山區圓山里13鄰中山北路三段53之4號,302758.307,2773399.454
594,臺北市松山區南京東路4段164號6樓之4,臺北市松山區復勢里21鄰南京東路四段164號,306169.585,2771583.521
595,臺北市松山區南京東路4段93號12樓,臺北市松山區東勢里2鄰南京東路四段93號,305912.330,2771632.428
596,臺北市信義區信義路5段8號14樓,臺北市信義區景新里15鄰信義路五段8號,306573.939,2769531.153
597,臺北市大安區安和路2段217巷12號,臺北市大安區全安里8鄰安和路二段217巷12號,305579.274,2768755.663
598,臺北市中山區復興北路48號3樓,臺北市中山區力行里12鄰復興北路48號,304865.651,2771374.679
599,臺北市內湖區成功路4段182巷6弄43號8樓之3,臺北市內湖區內湖里8鄰成功路四段182巷6弄43號,309793.820,2775153.642
600,臺北市士林區劍潭路55巷8號,臺北市士林區前港里5鄰劍潭路55巷8號,302600.108,2775190.098
601,臺北市中山區林森北路487號地下、1樓、2樓,臺北市中山區聚葉里16鄰林森北路487號,303043.910,2772677.396
602,臺北市中山區德惠街92號(1樓),臺北市中山區新庄里10鄰德惠街92號,303351.429,2773247.248
603,臺北市中山區南京東路3段118號11樓,臺北市中山區力行里26鄰南京東路三段118號,304516.250,2771617.160
604,臺北市大安區東豐街7號,臺北市大安區仁慈里14鄰東豐街7號,304910.414,2769892.931
605,臺北市大安區敦化南路1段261號地下1樓,臺北市大安區敦安里19鄰敦化南路一段261號,305422.921,2769938.457
606,臺北市中正區忠孝西路1段50號7樓之3,臺北市中正區黎明里11鄰忠孝西路一段50號,302048.097,2771005.519
607,臺北市中山區明水路413號,臺北市中山區永安里29鄰明水路413號,305349.244,2774476.224
608,臺北市內湖區新湖一路8號4樓,臺北市內湖區湖元里18鄰新湖一路8號,307956.530,2772373.232
609,臺北市中山區林森北路577號9樓之2,臺北市中山區晴光里6鄰林森北路577號,303051.354,2773136.596
610,臺北市中正區公園路26號9樓,臺北市中正區黎明里12鄰公園路26號,302167.588,2770858.317
611,臺北市內湖區康寧路3段189巷21弄1號,臺北市內湖區明湖里13鄰康寧路三段189巷21弄1號,311821.279,2773743.601
612,臺北市南港區成功路1段56號,臺北市南港區西新里8鄰成功路一段56號,309784.580,2772121.622
613,臺北市中山區龍江路415巷48號1樓,臺北市中山區下埤里17鄰龍江路415巷48號,304814.137,2773233.682
614,臺北市中山區北安路549號3樓,臺北市中山區大直里26鄰北安路549號,305246.423,2774778.869
615,臺北市中山區松江路289之908號,臺北市中山區松江里10鄰松江路289之908號,303826.688,2772580.361
616,臺北市內湖區新湖二路19號,臺北市內湖區湖元里18鄰新湖二路19號,307932.750,2772584.794
617,臺北市中正區重慶南路1段57號13樓之1,臺北市中正區黎明里7鄰重慶南路一段57號,301799.252,2770817.981
618,臺北市內湖區瑞光路188巷51號,臺北市內湖區港墘里20鄰瑞光路188巷51號,308125.072,2774078.526
619,臺北市中山區南京東路3段201號3樓,臺北市中山區復華里11鄰南京東路三段201號,304739.508,2771656.976
620,臺北市南港區新民街79號,臺北市南港區南港里10鄰新民街79號,311664.237,2772080.606
621,臺北市松山區三民路166巷9號,臺北市松山區富錦里21鄰三民路166巷9號,306881.668,2772765.996
622,臺北市內湖區堤頂大道2段207號9樓,臺北市內湖區西湖里13鄰堤頂大道二段207號,307290.218,2774530.628
