id,Address,Response_Address,Response_X,Response_Y
12401,臺北市中正區忠孝東路1段138號6樓,臺北市中正區幸福里7鄰忠孝東路一段138號,303017.817,2770765.616
12402,臺北市中正區忠孝東路1段138號6樓,臺北市中正區幸福里7鄰忠孝東路一段138號,303017.817,2770765.616
12403,臺北市中正區重慶南路1段57號11樓之16,臺北市中正區黎明里7鄰重慶南路一段57號,301799.252,2770817.981
12404,臺北市中正區羅斯福路4段68號9樓之7,臺北市中正區水源里3鄰羅斯福路四段68號,303923.793,2767490.321
12405,臺北市大安區忠孝東路3段96號9樓(之2),臺北市大安區民輝里18鄰忠孝東路三段96號,304110.118,2770495.882
12406,臺北市內湖區民權東路6段324號3樓,臺北市內湖區葫洲里18鄰民權東路六段324號,311130.542,2773956.291
12407,臺北市北投區文林北路238號1樓,臺北市北投區文林里15鄰文林北路238號,301816.793,2777912.076
12408,臺北市萬華區和平西路3段109巷11號3樓,臺北市萬華區富民里20鄰和平西路三段109巷11號,300506.462,2769849.091
12409,臺北市中山區南京東路3段118號9樓之4,臺北市中山區力行里26鄰南京東路三段118號,304516.250,2771617.160
12410,臺北市信義區信義路5段150巷11弄1號1樓,臺北市信義區三犁里18鄰信義路五段150巷11弄1號,307406.847,2768983.147
12411,臺北市信義區基隆路1段35巷9弄2號1樓,臺北市信義區雅祥里13鄰基隆路一段35巷9弄2號,307565.320,2771165.819
12412,臺北市內湖區瑞光路583巷31號3樓,臺北市內湖區西湖里13鄰瑞光路583巷31號,307293.747,2774850.379
12413,臺北市松山區敦化北路238巷19號,臺北市松山區民有里21鄰敦化北路238巷19號,305333.487,2772597.951
12414,臺北市中正區詔安街173號,臺北市中正區永昌里1鄰詔安街173號,301336.779,2768999.479
12415,臺北市信義區莊敬路221號1樓,臺北市信義區景新里6鄰莊敬路221號,306708.314,2769233.757
12416,臺北市信義區東興路43號9樓,臺北市信義區新仁里19鄰東興路43號,307189.286,2771231.782
12417,臺北市大安區忠孝東路4段169號12樓之1,臺北市大安區建安里16鄰忠孝東路四段169號,305541.268,2770509.776
12418,臺北市文山區興隆路1段119號,臺北市文山區萬盛里13鄰興隆路一段119號,304697.244,2766152.372
12419,臺北市士林區社正路45巷4弄5號1樓,臺北市士林區社子里18鄰社正路45巷4弄5號,301436.298,2775795.246
12420,臺北市文山區景興路222號5樓之5,臺北市文山區景行里21鄰景興路222號,304843.373,2764901.692
12421,臺北市中正區博愛路52號7樓,臺北市中正區光復里13鄰博愛路52號,301587.149,2770930.447
12422,臺北市中正區重慶南路2段51號1樓,臺北市中正區龍福里21鄰重慶南路二段51號,301964.596,2769334.454
12423,臺北市松山區八德路4段760號7樓,臺北市松山區慈祐里20鄰八德路四段760號,308436.585,2771457.440
12424,臺北市萬華區西園路2段281巷10號2樓,臺北市萬華區錦德里10鄰西園路二段281巷10號,299639.302,2768577.318
12425,臺北市中山區民權東路1段53號8樓,臺北市中山區恆安里7鄰民權東路一段53號,302949.214,2772848.037
12426,臺北市中正區延平南路189號4樓,臺北市中正區南門里7鄰延平南路189號,301212.618,2769615.518
12427,臺北市中正區衡陽路51號6樓之2,臺北市中正區光復里8鄰衡陽路51號,301682.540,2770569.530
12428,臺北市內湖區瑞光路188巷46號7樓,臺北市內湖區港墘里20鄰瑞光路188巷46號,308186.999,2774068.304
12429,臺北市中山區松江路51號8樓之1,臺北市中山區朱園里13鄰松江路51號,303797.103,2771205.134
12430,臺北市北投區行義路140巷9號5樓,臺北市北投區永和里9鄰行義路140巷9號,303270.774,2780220.149
12431,臺北市信義區基隆路1段159號18樓之2,臺北市信義區興雅里6鄰基隆路一段159號,307030.817,2770544.195
12432,臺北市士林區中山北路6段210號2樓,臺北市士林區蘭雅里23鄰中山北路六段210號,302979.502,2777876.637
12433,臺北市中山區龍江路412巷32號1樓,臺北市中山區行仁里28鄰龍江路412巷32號,304426.714,2773363.385
12434,臺北市萬華區成都路81號9樓,臺北市萬華區西門里5鄰成都路81號,300984.810,2770637.235
12435,臺北市南港區研究院路2段61巷2弄47號1樓,臺北市南港區中研里12鄰研究院路二段61巷2弄47號,312407.582,2770720.966
12436,臺北市松山區敦化北路207號10樓之1,臺北市松山區精忠里4鄰敦化北路207號,305439.614,2772316.944
12437,臺北市中山區民權東路3段35號14樓,臺北市中山區下埤里1鄰民權東路三段35號,304702.086,2772815.321
12438,臺北市萬華區廣州街189號4樓,臺北市萬華區富民里18鄰廣州街189號,300530.453,2769938.653
12439,臺北市信義區嘉興街275號,臺北市信義區黎順里11鄰嘉興街275號,306084.352,2768604.804
12440,臺北市信義區基隆路1段163號7樓之3,臺北市信義區興雅里6鄰基隆路一段163號,307035.346,2770521.194
12441,臺北市士林區社中街383號1樓,臺北市士林區永倫里14鄰社中街383號,300760.892,2776068.002
12442,臺北市大同區景化街23號4樓,臺北市大同區隆和里18鄰景化街23號,301652.972,2773094.665
12443,臺北市大安區和平東路2段151號8樓之1,臺北市大安區龍生里7鄰和平東路二段151號,304612.938,2768698.748
12444,臺北市大同區民族西路76巷12弄10號5樓之2,臺北市大同區斯文里10鄰民族西路76巷12弄10號,302158.249,2773364.905
12445,臺北市內湖區內湖路1段91巷17號10樓之2,臺北市內湖區西康里8鄰內湖路一段91巷17號,306685.163,2775404.567
12446,臺北市大安區復興南路1段137號5樓之3,臺北市大安區光武里27鄰復興南路一段137號,304895.124,2770582.685
12447,臺北市中山區敬業一路189號,臺北市中山區成功里18鄰敬業一路189號,305890.664,2775221.115
12448,臺北市內湖區瑞光路132巷73號3樓,臺北市內湖區湖元里20鄰瑞光路132巷73號,308366.781,2773797.769
12449,臺北市中山區復興北路270號1樓,臺北市中山區江山里23鄰復興北路270號,304880.849,2772359.508
12450,臺北市大安區樂利路86巷2號,臺北市大安區全安里7鄰樂利路86巷2號,305689.447,2768693.251
12451,臺北市中山區南京東路2段96號12樓之4,臺北市中山區興亞里18鄰南京東路二段96號,303606.039,2771627.291
12452,臺北市士林區前港街120巷1號1樓,臺北市士林區百齡里18鄰前港街120巷1號,302260.734,2775287.405
12453,臺北市大同區南京西路103號11樓之5,臺北市大同區星明里1鄰南京西路103號,302058.703,2771837.683
12454,臺北市大安區信義路3段106號12樓之9,臺北市大安區龍圖里1鄰信義路三段106號,304322.325,2769571.763
12455,臺北市中正區市民大道3段8號6樓612室,臺北市中正區梅花里14鄰市民大道三段8號,303691.072,2770891.318
12456,臺北市大安區忠孝東路4段162號10樓之2,臺北市大安區建倫里1鄰忠孝東路四段162號,305528.159,2770463.213
12457,臺北市大安區忠孝東路4段285號6樓之2,臺北市大安區車層里5鄰忠孝東路四段285號,305917.747,2770507.591
12458,臺北市南港區南港路3段99號9樓,臺北市南港區玉成里1鄰南港路三段99號,309288.250,2771760.932
12459,臺北市大安區羅斯福路3段253號9樓之2,臺北市大安區大學里21鄰羅斯福路三段253號,303506.713,2768000.368
12460,臺北市內湖區瑞光路578號9樓,臺北市內湖區西湖里13鄰瑞光路578號,307151.454,2774760.372
12461,臺北市南港區南港路3段130巷3弄9號4樓,臺北市南港區玉成里8鄰南港路三段130巷3弄9號,309300.347,2771860.085
12462,臺北市信義區基隆路1段131號6樓之2,臺北市信義區敦厚里22鄰基隆路一段131號,307168.549,2770798.572
12463,臺北市萬華區漢中街131號10樓之3,臺北市萬華區新起里18鄰漢中街131號,301209.433,2770517.966
12464,臺北市大安區光復南路102號9樓,臺北市大安區華聲里1鄰光復南路102號,306252.915,2770707.563
12465,臺北市中山區中山北路2段27巷4號3樓,臺北市中山區康樂里2鄰中山北路二段27巷4號,302825.220,2771766.389
12466,臺北市士林區德行東路228號2樓,臺北市士林區聖山里3鄰德行東路228號,303747.307,2777980.755
12467,臺北市中山區北安路630巷15號地下1樓,臺北市中山區成功里6鄰北安路630巷15號,305463.072,2775089.324
12468,臺北市大安區忠孝東路4段248巷8號2樓,臺北市大安區車層里13鄰忠孝東路四段248巷8號,305905.009,2770374.438
12469,臺北市信義區信義路5段7號37樓,臺北市信義區西村里8鄰信義路五段7號,306976.247,2769609.563
12470,臺北市大安區敦化南路2段65號6樓,臺北市大安區義安里13鄰敦化南路二段65號,305417.417,2769300.352
12471,臺北市信義區忠孝東路5段1之3號10樓,臺北市信義區興雅里1鄰忠孝東路五段1之3號,307003.059,2770491.089
12472,臺北市信義區忠孝東路5段669號2樓之2,臺北市信義區永春里9鄰忠孝東路五段669號,308488.332,2770560.864
12473,臺北市南港區昆陽街156號1樓,臺北市南港區新光里10鄰昆陽街156號,309929.612,2771303.824
12474,臺北市中正區牯嶺街157號1樓,臺北市中正區網溪里7鄰牯嶺街157號,302389.152,2768358.158
12475,臺北市大安區文昌街186號,臺北市大安區通安里5鄰文昌街186號,305905.578,2769481.764
12476,臺北市大安區仁愛路4段68號6樓之1,臺北市大安區德安里20鄰仁愛路四段68號,305291.189,2770040.117
12477,臺北市松山區新東街15巷7號1樓,臺北市松山區富泰里6鄰新東街15巷7號,307070.234,2772377.476
12478,臺北市大安區敦化南路2段267號6樓之3,臺北市大安區全安里2鄰敦化南路二段267號,305414.628,2768692.001
12479,臺北市信義區松隆路102號3樓之1,臺北市信義區五常里15鄰松隆路102號,307619.045,2770981.488
12480,臺北市南港區重陽路316號3樓之3,臺北市南港區南港里19鄰重陽路316號,311112.290,2772313.586
12481,臺北市松山區敦化南路1段80巷22號1樓,臺北市松山區福成里3鄰敦化南路一段80巷22號,305273.378,2771049.175
12482,臺北市內湖區新湖一路155號3樓,臺北市內湖區湖元里18鄰新湖一路155號,308265.569,2772399.700
12483,臺北市中正區廈門街112號,找不到指定的門牌地址。,,
12484,臺北市中山區撫順街23號3樓之2,臺北市中山區集英里21鄰撫順街23號,302504.763,2772925.903
12485,臺北市信義區基隆路1段432號4樓之4,臺北市信義區中興里9鄰基隆路一段432號,306485.246,2769628.588
12486,臺北市松山區長安東路2段294號11樓,臺北市松山區中正里1鄰長安東路二段294號,305029.679,2771218.910
12487,臺北市大安區羅斯福路2段79號7樓之5,臺北市大安區古莊里5鄰羅斯福路二段79號,302812.687,2768783.617
12488,臺北市中山區南京東路3段19號3樓之2,臺北市中山區復華里14鄰南京東路三段19號,304243.347,2771665.092
12489,臺北市松山區民權東路3段142號11樓之4,臺北市松山區民有里32鄰民權東路三段142號,305172.534,2772725.699
12490,臺北市大安區仁愛路3段136號8樓,臺北市大安區和安里1鄰仁愛路三段136號,304634.836,2770041.732
12491,臺北市大安區忠孝東路3段247號4樓,臺北市大安區誠安里1鄰忠孝東路三段247號,304611.106,2770521.581
12492,臺北市內湖區文湖街12號4樓,臺北市內湖區西康里8鄰文湖街12號,306581.475,2775388.949
12493,臺北市信義區基隆路1段432號6樓之6,臺北市信義區中興里9鄰基隆路一段432號,306485.246,2769628.588
12494,臺北市松山區八德路4段44號,臺北市松山區復盛里10鄰八德路四段44號,306434.952,2771236.249
12495,臺北市中山區錦州街46號10樓之3,臺北市中山區聚盛里16鄰錦州街46號,303047.175,2772545.623
12496,臺北市信義區基隆路2段125號8樓之3,臺北市信義區嘉興里3鄰基隆路二段125號,306209.868,2769041.056
12497,臺北市內湖區民權東路6段160號8樓之3,臺北市內湖區寶湖里13鄰民權東路六段160號,309711.229,2773515.268
12498,臺北市信義區富陽街44巷2號,臺北市信義區黎平里9鄰富陽街44巷2號,306120.866,2768372.326
12499,臺北市中正區和平西路2段141號2樓之5(205室),臺北市中正區愛國里5鄰和平西路二段141號,301035.812,2769570.519
12500,臺北市大安區安和路1段137號,臺北市大安區敦煌里10鄰安和路一段137號,305773.408,2769673.745
12501,臺北市內湖區內湖路2段468號11樓之1,臺北市內湖區內湖里23鄰內湖路二段468號,309805.105,2775205.427
12502,臺北市內湖區新湖一路71號5樓,臺北市內湖區湖元里18鄰新湖一路71號,308023.113,2772338.656
12503,臺北市中山區松江路207號9樓,臺北市中山區中央里2鄰松江路207號,303809.816,2772214.975
12504,臺北市士林區天玉街75巷1號3樓,臺北市士林區天母里15鄰天玉街75巷1號,303521.897,2779444.944
12505,臺北市松山區南京東路4段171號6樓之2,臺北市松山區東勢里1鄰南京東路四段171號,306132.026,2771627.386
12506,臺北市中山區林森北路121號14樓之1,臺北市中山區正義里10鄰林森北路121號,302989.583,2771509.617
12507,臺北市中山區復興北路62號3樓之1,臺北市中山區力行里12鄰復興北路62號,304867.862,2771479.218
12508,臺北市北投區溫泉路37巷28號9樓之6,臺北市北投區長安里20鄰溫泉路37巷28號,300776.564,2780860.147
12509,臺北市信義區松德路65號8樓之4,臺北市信義區國業里3鄰松德路65號,308189.417,2770168.963
12510,臺北市南港區重陽路120號,臺北市南港區東新里18鄰重陽路120號,310484.608,2772175.048
12511,臺北市信義區忠孝東路5段1之1號11樓,臺北市信義區興雅里1鄰忠孝東路五段1之1號,306998.790,2770483.453
12512,臺北市內湖區新明路298巷10號8樓,臺北市內湖區週美里7鄰新明路298巷10號,308745.112,2772151.256
12513,臺北市內湖區成功路2段426巷48號,臺北市內湖區湖興里8鄰成功路二段426巷48號,309359.062,2773703.222
12514,臺北市大同區重慶北路2段185號12樓,臺北市大同區民權里12鄰重慶北路二段185號,301831.365,2772520.861
12515,臺北市萬華區開封街2段12號13樓之6,臺北市萬華區福星里3鄰開封街二段12號,301328.694,2770975.378
12516,臺北市內湖區堤頂大道2段407巷32號4樓,臺北市內湖區西康里26鄰堤頂大道二段407巷32號,306910.613,2774918.808
12517,臺北市中山區松江路26巷3號,臺北市中山區興亞里4鄰松江路26巷3號,303713.787,2771114.361
12518,臺北市中山區中山北路2段128巷6弄5號7樓之9,臺北市中山區集英里12鄰中山北路二段128巷6弄5號,302678.476,2772689.706
12519,臺北市信義區莊敬路289巷3弄37號,臺北市信義區景新里9鄰莊敬路289巷3弄37號,306782.692,2769185.104
12520,臺北市信義區基隆路2段77號6樓之5,臺北市信義區景聯里4鄰基隆路二段77號,306325.342,2769253.875
12521,臺北市中山區中山北路1段72號6樓之7,臺北市中山區民安里1鄰中山北路一段72號,302551.868,2771277.181
12522,臺北市中正區忠孝東路2段100號11樓,臺北市中正區幸市里1鄰忠孝東路二段100號,303525.960,2770619.723
12523,臺北市信義區永吉路176號8樓,臺北市信義區六藝里2鄰永吉路176號,307654.866,2770934.153
12524,臺北市中正區三元街170號1樓,臺北市中正區龍興里7鄰三元街170號,301589.171,2768964.292
12525,臺北市內湖區內湖路3段5巷4號1樓,臺北市內湖區內湖里6鄰內湖路三段5巷4號,309776.139,2775272.601
12526,臺北市松山區南京東路4段197號7樓,臺北市松山區東勢里14鄰南京東路四段197號,306196.048,2771626.316
12527,臺北市中正區羅斯福路4段68號12樓之2,臺北市中正區水源里3鄰羅斯福路四段68號,303923.793,2767490.321
12528,臺北市大安區信義路4段134號12樓,臺北市大安區義安里1鄰信義路四段134號,305479.459,2769552.019
12529,臺北市松山區復興北路1號4樓之4,臺北市松山區中正里1鄰復興北路1號,304906.540,2771201.056
12530,臺北市中正區衡陽路108號13樓之2,臺北市中正區建國里6鄰衡陽路108號,301470.445,2770539.360
12531,臺北市內湖區瑞光路517號,臺北市內湖區西湖里13鄰瑞光路517號,307409.491,2774675.116
12532,臺北市大安區忠孝東路3段217巷1弄6號,臺北市大安區昌隆里9鄰忠孝東路三段217巷1弄6號,304424.772,2770583.130
12533,臺北市內湖區內湖路1段591巷8號,臺北市內湖區麗山里7鄰內湖路一段591巷8號,307820.976,2774916.604
12534,臺北市中正區館前路65號7樓,臺北市中正區黎明里11鄰館前路65號,301979.045,2770783.044
12535,臺北市信義區松德路18號5樓,臺北市信義區廣居里29鄰松德路18號,308249.496,2770262.805
12536,臺北市大安區忠孝東路3段136號8樓之3,臺北市大安區義村里16鄰忠孝東路三段136號,304267.084,2770482.318
12537,臺北市士林區社中街313號2樓,臺北市士林區社園里26鄰社中街313號,300960.331,2776080.113
12538,臺北市大安區忠孝東路4段295號3樓,臺北市大安區華聲里11鄰忠孝東路四段295號,306009.965,2770500.942
12539,臺北市內湖區瑞光路358巷38弄36號3樓之5,臺北市內湖區港墘里20鄰瑞光路358巷38弄36號,307796.479,2774311.722
12540,臺北市南港區三重路19之5號2樓,臺北市南港區三重里25鄰三重路19之5號,311911.391,2772235.570
12541,臺北市大安區新生南路3段88號7樓之3,臺北市大安區大學里4鄰新生南路三段88號,303829.479,2767890.810
12542,臺北市文山區景隆街93號1樓,臺北市文山區萬有里9鄰景隆街93號,304808.072,2765804.299
12543,臺北市中正區博愛路25號7樓之16,臺北市中正區光復里3鄰博愛路25號,301609.399,2770909.996
12544,臺北市中正區八德路1段82巷9弄4號2樓,臺北市中正區梅花里15鄰八德路一段82巷9弄4號,303680.742,2770708.976
12545,臺北市中正區重慶南路1段61號11樓,臺北市中正區黎明里7鄰重慶南路一段61號,301798.443,2770807.926
12546,臺北市內湖區安泰街45巷12號4樓,臺北市內湖區安泰里2鄰安泰街45巷12號,312363.755,2774127.888
12547,臺北市士林區延平北路6段219號,臺北市士林區社新里15鄰延平北路六段219號,300974.360,2775767.674
12548,臺北市信義區忠孝東路5段508號3樓之3,臺北市信義區松光里1鄰忠孝東路五段508號,308400.688,2770456.455
12549,臺北市中山區長安東路1段15號4樓,臺北市中山區正得里7鄰長安東路一段15號,302745.439,2771382.440
12550,臺北市大安區仁愛路3段123巷11弄5號之1,臺北市大安區義村里21鄰仁愛路三段123巷11弄5之1號,304723.539,2770267.491
12551,臺北市信義區基隆路2段79巷2號6樓,臺北市信義區景聯里6鄰基隆路二段79巷2號,306331.232,2769230.236
12552,臺北市信義區信義路6段77號2樓,臺北市信義區國業里14鄰信義路六段77號,308243.566,2769852.748
12553,臺北市中山區民生東路2段119號5樓之3,臺北市中山區中庄里17鄰民生東路二段119號,303653.048,2772316.947
12554,臺北市松山區南京東路4段45號3樓,臺北市松山區中華里11鄰南京東路四段45號,305569.753,2771639.044
12555,臺北市萬華區西園路1段41之2號,臺北市萬華區菜園里2鄰西園路一段41之2號,300454.266,2770362.251
12556,臺北市大安區復興南路1段380號12樓之1,臺北市大安區和安里4鄰復興南路一段380號,304836.079,2769668.401
12557,臺北市信義區吳興街156巷41之1號,臺北市信義區景勤里9鄰吳興街156巷41之1號,306511.656,2769003.993
12558,臺北市大安區忠孝東路4段162號8樓之4,臺北市大安區建倫里1鄰忠孝東路四段162號,305528.159,2770463.213
12559,臺北市內湖區基湖路10巷57號3樓之1,臺北市內湖區西康里26鄰基湖路10巷57號,306868.638,2775016.823
12560,臺北市松山區八德路2段346巷5之1號1樓,臺北市松山區中崙里11鄰八德路二段346巷5之1號,304998.107,2771095.805
12561,臺北市中山區林森北路577號10樓之2,臺北市中山區晴光里6鄰林森北路577號,303051.354,2773136.596
12562,臺北市松山區民權東路3段144號7樓之4,臺北市松山區民有里32鄰民權東路三段144號,305211.700,2772740.723
12563,臺北市內湖區湖元里陽光街323號,臺北市內湖區湖元里18鄰陽光街323號,308344.840,2774021.088
12564,臺北市中正區杭州南路1段15之1號14樓之1,臺北市中正區幸福里12鄰杭州南路一段15之1號,303163.735,2770617.023
12565,臺北市內湖區內湖路1段308號5樓之1,臺北市內湖區西湖里13鄰內湖路一段308號,307417.340,2774930.783
12566,臺北市中山區敬業一路128巷26號3樓,臺北市中山區成功里19鄰敬業一路128巷26號,305801.148,2775114.197
12567,臺北市中山區松江路318號11樓之5,臺北市中山區新生里3鄰松江路318號,303763.726,2772603.590
12568,臺北市中山區南京路2段76號4樓,找不到指定的門牌地址。,,
12569,臺北市中山區南京東路2段97號7樓,臺北市中山區中吉里1鄰南京東路二段97號,303711.994,2771669.993
12570,臺北市內湖區洲子街181號2樓,臺北市內湖區西湖里13鄰洲子街181號,307244.531,2774922.986
12571,臺北市士林區中山北路7段14巷17之1號,臺北市士林區天山里7鄰中山北路七段14巷17之1號,303663.788,2779049.243
12572,臺北市中山區民權東路3段37號11樓,臺北市中山區下埤里1鄰民權東路三段37號,304718.480,2772815.321
12573,臺北市大安區敦化南路2段105號26樓,臺北市大安區義安里16鄰敦化南路二段105號,305416.238,2769042.356
12574,臺北市大安區新生南路1段111號10樓,臺北市大安區民輝里10鄰新生南路一段111號,303790.850,2770355.842
12575,臺北市松山區南京東路3段285號8樓,臺北市松山區中正里26鄰南京東路三段285號,305074.282,2771649.160
12576,臺北市中山區復興北路48號6樓,臺北市中山區力行里12鄰復興北路48號,304865.651,2771374.679
12577,臺北市信義區松高路9號27樓,臺北市信義區興雅里2鄰松高路9號,307020.827,2770273.259
12578,臺北市文山區辛亥路4段176號1樓,臺北市文山區興泰里8鄰辛亥路四段176號,306132.264,2766278.794
12579,臺北市內湖區行善路398號,臺北市內湖區湖元里18鄰行善路398號,308977.501,2772891.215
12580,臺北市文山區景仁里景福街39號,臺北市文山區景仁里8鄰景福街39號,304260.288,2765749.492
12581,臺北市松山區南京東路3段261號4樓,臺北市松山區中正里26鄰南京東路三段261號,305005.998,2771650.327
12582,臺北市信義區信義路5段7號37樓,臺北市信義區西村里8鄰信義路五段7號,306976.247,2769609.563
12583,臺北市大安區信義路4段341號3樓之2,臺北市大安區光信里30鄰信義路四段341號,306178.922,2769581.436
12584,臺北市內湖區內湖路1段360巷10號3樓,臺北市內湖區西湖里13鄰內湖路一段360巷10號,307524.848,2774827.830
12585,臺北市松山區八德路4段465號10樓,臺北市松山區慈祐里12鄰八德路四段465號,307608.746,2771442.724
12586,臺北市內湖區民權東路6段16號2樓,臺北市內湖區湖元里18鄰民權東路六段16號,308249.337,2773228.870
12587,臺北市內湖區民權東路6段16號2樓,臺北市內湖區湖元里18鄰民權東路六段16號,308249.337,2773228.870
12588,臺北市大安區敦化南路1段205號6樓之8,臺北市大安區建安里15鄰敦化南路一段205號,305423.834,2770542.762
12589,臺北市內湖區新明路355號地下一層,臺北市內湖區週美里5鄰新明路355號,308795.194,2772077.253
12590,臺北市中山區松江路289之602號,臺北市中山區松江里10鄰松江路289之602號,303821.643,2772586.389
12591,臺北市大安區信義路4段89-1號1樓,臺北市大安區德安里2鄰信義路四段89之1號,305154.517,2769605.219
12592,臺北市內湖區基湖路35巷16號8樓之3,臺北市內湖區西湖里13鄰基湖路35巷16號,307118.106,2774676.914
12593,臺北市松山區復興北路337號2樓,臺北市松山區民有里5鄰復興北路337號,304936.767,2772557.928
12594,臺北市南港區八德路4段768巷5號7樓,臺北市南港區玉成里17鄰八德路四段768巷5號,308583.511,2771438.849
12595,臺北市中山區建國北路1段96號8樓,臺北市中山區朱園里3鄰建國北路一段96號,304112.727,2771462.392
12596,臺北市松山區南京東路5段188號11樓,臺北市松山區吉祥里8鄰南京東路五段188號,306881.609,2771568.489
12597,臺北市內湖區瑞湖街88號7樓,臺北市內湖區湖元里18鄰瑞湖街88號,308110.708,2773911.534
12598,臺北市內湖區內湖路1段68號4樓,臺北市內湖區西康里26鄰內湖路一段68號,306733.885,2775156.989
12599,臺北市中山區中央里松江路129號10樓之3,臺北市中山區中央里5鄰松江路129號,303805.734,2771844.231
12600,臺北市中山區松江路209號6樓,臺北市中山區中央里2鄰松江路209號,303810.082,2772231.826
12601,臺北市大安區敦化南路2段97號21樓,臺北市大安區義安里16鄰敦化南路二段97號,305422.269,2769092.350
12602,臺北市信義區信義路5段7號37樓,臺北市信義區西村里8鄰信義路五段7號,306976.247,2769609.563
12603,臺北市信義區景新里莊敬路278號,臺北市信義區景新里4鄰莊敬路278號,306786.980,2769088.033
12604,臺北市松山區復興北路433號12樓,臺北市松山區民福里3鄰復興北路433號,304927.268,2772938.846
12605,臺北市大同區市民大道1段211號12樓之3,臺北市大同區建明里25鄰市民大道一段211號,302308.118,2771319.973
