id,Address,Response_Address,Response_X,Response_Y
14851,臺北市信義區忠孝東路5段1之5號2樓,臺北市信義區興雅里1鄰忠孝東路五段1之5號,307006.093,2770496.773
14852,臺北市中正區紹興北街31巷6號4樓之4,臺北市中正區梅花里9鄰紹興北街31巷6號,303036.705,2770895.756
14853,臺北市信義區和平東路3段225號3樓之1,臺北市信義區黎平里4鄰和平東路三段225號,305911.773,2768463.106
14854,臺北市萬華區中華路2段598之4號4樓之1,臺北市萬華區騰雲里4鄰中華路二段598之4號,301427.964,2768609.018
14855,臺北市文山區秀明路1段96號1樓,臺北市文山區木柵里18鄰秀明路一段96號,307218.206,2764867.370
14856,臺北市松山區南京東路4段164號8樓,臺北市松山區復勢里21鄰南京東路四段164號,306169.585,2771583.521
14857,臺北市信義區基隆路1段143號7樓,臺北市信義區興雅里10鄰基隆路一段143號,307092.307,2770648.837
14858,臺北市中山區松江路26巷32號2樓,臺北市中山區興亞里2鄰松江路26巷32號,303636.616,2771093.387
14859,臺北市中山區民權東路2段92巷2弄21號1樓,臺北市中山區新生里5鄰民權東路二段92巷2弄21號,303582.078,2772709.190
14860,臺北市文山區羅斯福路5段101號6樓,臺北市文山區萬盛里10鄰羅斯福路五段101號,304424.099,2766470.221
14861,臺北市中山區松江路131之26號13樓,臺北市中山區中央里5鄰松江路131之26號,303821.589,2771891.027
14862,臺北市南港區三重路19-6號10樓,臺北市南港區三重里25鄰三重路19之6號,311842.700,2772245.106
14863,臺北市中山區八德路2段260號4樓,臺北市中山區埤頭里10鄰八德路二段260號,304578.222,2771057.384
14864,臺北市內湖區民權東路6段296巷69號,臺北市內湖區葫洲里11鄰民權東路六段296巷69號,311303.097,2773778.618
14865,臺北市文山區秀明路2段118巷3號6樓,臺北市文山區萬興里1鄰秀明路二段118巷3號,308201.985,2764701.683
14866,臺北市中山區南京西路1-1號11樓,臺北市中山區民安里10鄰南京西路1之1號,302649.929,2771697.985
14867,臺北市中正區濟南路2段33號4樓,臺北市中正區幸市里1鄰濟南路二段33號,303424.710,2770408.360
14868,臺北市信義區吳興街320巷10之1號4樓,臺北市信義區惠安里2鄰吳興街320巷10之1號,307002.974,2768729.693
14869,臺北市文山區辛亥路4段176號,臺北市文山區興泰里8鄰辛亥路四段176號,306132.264,2766278.794
14870,臺北市松山區八德路3段158巷20弄20號,臺北市松山區復源里12鄰八德路三段158巷20弄20號,305955.657,2771137.707
14871,臺北市大安區忠孝東路4段220號13樓,臺北市大安區車層里9鄰忠孝東路四段220號,305839.389,2770456.628
14872,臺北市北投區西安街1段367號2樓,臺北市北投區榮光里21鄰西安街一段367號,301937.648,2778571.850
14873,臺北市中正區新生南路1段58巷10號,臺北市中正區幸市里7鄰新生南路一段58巷10號,303702.158,2770399.242
14874,臺北市信義區文昌街316號11樓之11,臺北市信義區中興里3鄰文昌街316號,306305.935,2769449.916
14875,臺北市松山區復興北路369號7樓之5,臺北市松山區民福里5鄰復興北路369號,304962.101,2772805.164
14876,臺北市內湖區堤頂大道2段483號4樓,臺北市內湖區西康里26鄰堤頂大道二段483號,306699.167,2775012.664
14877,臺北市內湖區成功路4段137號2樓,臺北市內湖區清白里13鄰成功路四段137號,309862.940,2775074.995
14878,臺北市松山區南京東路4段93號3樓、95號3樓,臺北市松山區東勢里2鄰南京東路四段93號,305912.330,2771632.428
14879,臺北市信義區忠孝東路5段790巷86號1樓,臺北市信義區中坡里15鄰忠孝東路五段790巷86號,308938.199,2770297.250
14880,臺北市內湖區民權東路6段15巷16號2樓之5,臺北市內湖區湖元里18鄰民權東路六段15巷16號,308398.855,2773450.595
14881,臺北市松山區南京東路３段１０１號４樓,臺北市松山區中正里26鄰南京東路三段261之1號,305013.670,2771650.075
14882,臺北市信義區基隆路1段155號11樓之5,臺北市信義區興雅里6鄰基隆路一段155號,307046.103,2770572.592
14883,臺北市中正區忠孝東路1段76號4樓之4,臺北市中正區幸福里4鄰忠孝東路一段76號,302871.506,2770803.982
14884,臺北市內湖區舊宗路1段46號5樓,臺北市內湖區週美里20鄰舊宗路一段46號,308554.149,2772371.775
14885,臺北市內湖區瑞光路607號1樓,臺北市內湖區西湖里13鄰瑞光路607號,307180.288,2774778.700
14886,臺北市松山區民生東路4段133號3樓,臺北市松山區精忠里6鄰民生東路四段133號,305938.737,2772371.227
14887,臺北市內湖區瑞光路76巷59號2樓,臺北市內湖區湖元里18鄰瑞光路76巷59號,308543.263,2773673.023
14888,臺北市中正區館前路34號11樓,臺北市中正區黎明里10鄰館前路34號,301956.506,2770823.650
14889,臺北市大安區忠孝東路4段142號4樓之3,臺北市大安區建倫里1鄰忠孝東路四段142號,305435.731,2770464.431
14890,臺北市信義區忠孝東路5段372巷27弄3號1樓,臺北市信義區廣居里15鄰忠孝東路五段372巷27弄3號,307952.548,2770304.799
14891,臺北市松山區復興北路369號3樓之2,臺北市松山區民福里5鄰復興北路369號,304962.101,2772805.164
14892,臺北市信義區松德路161號26樓之1,臺北市信義區安康里20鄰松德路161號,308007.602,2769931.898
14893,臺北市信義區忠孝東路5段1之3號6樓,臺北市信義區興雅里1鄰忠孝東路五段1之3號,307003.059,2770491.089
14894,臺北市萬華區東園街112號2樓,臺北市萬華區保德里1鄰東園街112號,300175.866,2768552.036
14895,臺北市中正區中華路1段59號7樓,臺北市中正區建國里6鄰中華路一段59號,301314.298,2770452.282
14896,臺北市內湖區行善路48巷18號2樓之5,臺北市內湖區湖元里18鄰行善路48巷18號,308045.536,2772200.140
14897,臺北市大安區復興南路1段342號12樓之6,臺北市大安區和安里3鄰復興南路一段342號,304832.317,2769876.147
14898,臺北市大安區忠孝東路4段97號2樓之19,臺北市大安區光武里2鄰忠孝東路四段97號,305292.392,2770514.207
14899,臺北市松山區敦化北路207號8樓之13,臺北市松山區精忠里4鄰敦化北路207號,305439.614,2772316.944
14900,臺北市中正區博愛路76號3樓,臺北市中正區光復里10鄰博愛路76號,301598.461,2770823.043
14901,臺北市南港區忠孝東路5段815號10樓,臺北市南港區合成里14鄰忠孝東路五段815號,308747.663,2770879.019
14902,臺北市大安區信義路4段306號8樓之1,臺北市大安區通化里1鄰信義路四段306號,305993.554,2769541.172
14903,臺北市內湖區洲子街67號5樓,臺北市內湖區港墘里20鄰洲子街67號,307777.555,2774739.171
14904,臺北市大安區忠孝東路4段169號12樓之1,臺北市大安區建安里16鄰忠孝東路四段169號,305541.268,2770509.776
14905,臺北市大安區瑞安街244巷55號1樓,臺北市大安區龍生里20鄰瑞安街244巷55號,304340.776,2769000.925
14906,臺北市南港區忠孝東路5段815號5樓之2、之3,臺北市南港區合成里14鄰忠孝東路五段815號,308747.663,2770879.019
14907,臺北市士林區德行西路36號10樓之2,臺北市士林區德行里16鄰德行西路36號,302765.720,2777539.544
14908,臺北市松山區新東街3巷16號1樓,臺北市松山區富泰里3鄰新東街3巷16號,307011.523,2772261.652
14909,臺北市士林區承德路4段246號3樓,臺北市士林區後港里5鄰承德路四段246號,302527.755,2775740.870
14910,臺北市中山區復興北路50號4樓之1,臺北市中山區力行里12鄰復興北路50號,304866.091,2771397.065
14911,臺北市松山區民生東路3段119號5樓,臺北市松山區民有里2鄰民生東路三段119號,305180.630,2772308.972
14912,臺北市大同區民生西路288號5樓,臺北市大同區朝陽里4鄰民生西路288號,301740.681,2772177.276
14913,臺北市大安區建國南路1段286巷50號,臺北市大安區民炤里14鄰建國南路一段286巷50號,304006.415,2769829.247
14914,臺北市大安區羅斯福路2段93號21樓之3,臺北市大安區古莊里6鄰羅斯福路二段93號,302894.401,2768664.993
14915,臺北市內湖區內湖路1段66號10樓,臺北市內湖區西康里26鄰內湖路一段66號,306720.973,2775162.599
14916,臺北市大安區復興南路1段368號13樓,臺北市大安區和安里4鄰復興南路一段368號,304835.541,2769757.148
14917,臺北市大安區忠孝東路3段205-6號6樓,臺北市大安區昌隆里8鄰忠孝東路三段205之6號,304408.472,2770535.397
14918,臺北市松山區南京東路4段102號5樓,臺北市松山區美仁里4鄰南京東路四段102號,305930.461,2771588.539
14919,臺北市中山區建國北路2段151巷6號13樓,臺北市中山區江寧里7鄰建國北路二段151巷6號,304248.569,2772714.578
14920,臺北市中正區羅斯福路2段56號9樓之6,臺北市中正區南福里2鄰羅斯福路二段56號,302647.904,2768949.789
14921,臺北市中正區漢口街1段80巷6弄7號,臺北市中正區光復里5鄰漢口街一段80巷6弄7號,301661.485,2770821.349
14922,臺北市中山區松江路362巷77號1樓,臺北市中山區新生里2鄰松江路362巷77號,303557.883,2772754.802
14923,臺北市中山區復興南路1段36之10號12樓,臺北市中山區埤頭里17鄰復興南路一段36之10號,304857.405,2770952.825
14924,臺北市中山區松江路237號9樓之1,臺北市中山區松江里5鄰松江路237號,303821.649,2772416.873
14925,臺北市中山區南京西路5-1號12樓之1,臺北市中山區民安里10鄰南京西路5之1號,302605.537,2771705.490
14926,臺北市大安區通化街170巷9號,臺北市大安區法治里10鄰通化街170巷9號,305792.997,2769013.270
14927,臺北市中山區建國北路2段108號8樓,臺北市中山區松江里13鄰建國北路二段108號,304133.405,2772356.262
14928,臺北市大同區酒泉街10巷11號1樓,臺北市大同區至聖里4鄰酒泉街10巷11號,302432.561,2773668.202
14929,臺北市中山區長春路149-2號,臺北市中山區中吉里10鄰長春路149之2號,303732.982,2771966.764
14930,臺北市大安區辛亥路1段90號3樓,臺北市大安區大學里17鄰辛亥路一段90號,303655.518,2768235.370
14931,臺北市大同區民權西路164號12樓之1,臺北市大同區民權里5鄰民權西路164號,302009.366,2772807.705
14932,臺北市北投區中央北路1段173號2樓,臺北市北投區大同里5鄰中央北路一段173號,300221.799,2780888.348
14933,臺北市中正區青島東路5號6樓,臺北市中正區幸福里1鄰青島東路5號,302673.882,2770747.073
14934,臺北市南港區興中路28巷23號1樓,臺北市南港區南港里13鄰興中路28巷23號,311183.994,2772063.142
14935,臺北市松山區南京東路4段197號11樓之1,臺北市松山區東勢里14鄰南京東路四段197號,306196.048,2771626.316
14936,臺北市中山區中山北路3段49號7樓之5,臺北市中山區圓山里13鄰中山北路三段49號,302731.696,2773294.319
14937,臺北市松山區八德路4段106巷6弄1號,臺北市松山區復盛里20鄰八德路四段106巷6弄1號,306608.599,2771131.432
14938,臺北市松山區復興北路57號12樓,臺北市松山區中正里20鄰復興北路57號,304912.496,2771478.752
14939,臺北市士林區大東路86之2號1樓,臺北市士林區仁勇里10鄰大東路86之2號,303025.555,2775983.273
14940,臺北市中正區愛國東路70號2樓,臺北市中正區新營里7鄰愛國東路70號,302423.206,2769598.094
14941,臺北市中山區松江路152號7樓之10,臺北市中山區中吉里8鄰松江路152號,303762.733,2771885.645
14942,臺北市士林區文林路271號1樓,臺北市士林區仁勇里11鄰文林路271號,303112.881,2775997.573
14943,臺北市大安區信義路4段6號15樓之7,臺北市大安區住安里3鄰信義路四段6號,304909.961,2769557.308
14944,臺北市內湖區民權東路6段160號4樓之2,臺北市內湖區寶湖里13鄰民權東路六段160號,309711.229,2773515.268
14945,臺北市大安區忠孝東路4段311號12樓之4,臺北市大安區華聲里10鄰忠孝東路四段311號,306084.014,2770499.659
14946,臺北市士林區後港街143號,臺北市士林區前港里2鄰後港街143號,302611.406,2775512.014
14947,臺北市文山區羅斯福路5段245號13樓之3,臺北市文山區萬祥里4鄰羅斯福路五段245號,304443.570,2766049.250
14948,臺北市中山區民生東路3段25號9樓,臺北市中山區江山里12鄰民生東路三段25號,304356.708,2772316.000
14949,臺北市士林區中山北路6段90號8樓,臺北市士林區忠誠里19鄰中山北路六段90號,302947.459,2777519.782
14950,臺北市內湖區成功路5段420巷7號2樓,臺北市內湖區金湖里14鄰成功路五段420巷7號,311317.520,2774271.869
14951,臺北市信義區東興路69號10樓,臺北市信義區新仁里19鄰東興路69號,307229.648,2771107.386
14952,臺北市大安區敦化南路1段190巷29號3樓,臺北市大安區光武里6鄰敦化南路一段190巷29號,305241.362,2770622.879
14953,臺北市信義區基隆路2段56號3樓之2,臺北市信義區中興里1鄰基隆路二段56號,306345.472,2769361.260
14954,臺北市內湖區成功路4段30巷28弄21號7樓之1,臺北市內湖區內湖里21鄰成功路四段30巷28弄21號,309722.080,2775103.627
14955,臺北市士林區小北街17號,臺北市士林區仁勇里9鄰小北街17號,303074.970,2775893.010
14956,臺北市士林區德行西路40號1樓,臺北市士林區德行里16鄰德行西路40號,302768.260,2777527.161
14957,臺北市大安區樂利路91號6樓,臺北市大安區法治里5鄰樂利路91號,305732.509,2768726.797
14958,臺北市大安區敦化南路1段205號10樓之3,臺北市大安區建安里15鄰敦化南路一段205號,305423.834,2770542.762
14959,臺北市信義區松德路65號11樓之2,臺北市信義區國業里3鄰松德路65號,308189.417,2770168.963
14960,臺北市大安區安和路1段112巷7號4樓,臺北市大安區敦安里2鄰安和路一段112巷7號,305650.945,2769651.825
14961,臺北市松山區八德路2段429號2樓、3樓、4樓,臺北市松山區中正里2鄰八德路二段429號,305156.245,2771240.342
14962,臺北市大安區敦化南路2段76號15樓之1,臺北市大安區龍雲里19鄰敦化南路二段76號,305341.756,2769113.396
14963,臺北市松山區南京東路4段130號3樓之1,臺北市松山區復勢里12鄰南京東路四段130號,306070.374,2771585.330
14964,臺北市大安區光復南路412號11樓之1,臺北市大安區光信里3鄰光復南路412號,306246.413,2769953.053
14965,臺北市內湖區堤頂大道2段483號4樓,臺北市內湖區西康里26鄰堤頂大道二段483號,306699.167,2775012.664
14966,臺北市信義區信義路5段150巷2號15樓之3,臺北市信義區三犁里22鄰信義路五段150巷2號,307616.303,2769018.046
14967,臺北市中山區建國北路2段135號9樓,臺北市中山區江寧里1鄰建國北路二段135號,304231.587,2772580.805
14968,臺北市松山區南京東路4段186號6樓,臺北市松山區復勢里21鄰南京東路四段186號,306249.124,2771582.009
14969,臺北市大同區涼州街92號1樓,臺北市大同區大有里5鄰涼州街92號,301483.607,2772579.501
14970,臺北市大安區復興南路1段203號7樓,臺北市大安區仁愛里2鄰復興南路一段203號,304888.763,2770273.631
14971,臺北市中山區建國北路2段65號3樓,臺北市中山區朱馥里3鄰建國北路二段65號,304206.808,2772076.825
14972,臺北市信義區忠孝東路4段563號8樓,臺北市信義區新仁里1鄰忠孝東路四段563號,306913.569,2770487.759
14973,臺北市大同區大龍街89巷5號,臺北市大同區斯文里6鄰大龍街89巷5號,302136.013,2773275.157
14974,臺北市中正區漢口街1段110號4樓之11,臺北市中正區光復里10鄰漢口街一段110號,301561.948,2770869.376
14975,臺北市中山區松江路206號3樓之3,臺北市中山區中吉里21鄰松江路206號,303767.075,2772256.273
14976,臺北市中山區松江路28號10樓之3,臺北市中山區興亞里4鄰松江路28號,303753.137,2771112.487
14977,臺北市內湖區康樂街227號,臺北市內湖區內溝里17鄰康樂街227號,312738.150,2774365.801
14978,臺北市大安區敦化南路2段182號12樓之1,臺北市大安區虎嘯里4鄰敦化南路二段182號,305336.597,2768499.292
14979,臺北市中正區新生南路1段142號3樓,臺北市中正區三愛里14鄰新生南路一段142號,303734.249,2769857.121
14980,臺北市信義區基隆路1段149號7樓之3,臺北市信義區興雅里6鄰基隆路一段149號,307067.554,2770610.978
14981,臺北市大安區忠孝東路3段136號11樓之5,臺北市大安區義村里16鄰忠孝東路三段136號,304267.084,2770482.318
14982,臺北市中山區中山北路3段25號6樓之5,臺北市中山區晴光里15鄰中山北路三段25號,302710.118,2773101.352
14983,臺北市中正區重慶南路1段57號9樓之8,臺北市中正區黎明里7鄰重慶南路一段57號,301799.252,2770817.981
14984,臺北市內湖區新湖一路73號5樓,臺北市內湖區湖元里18鄰新湖一路73號,308017.027,2772357.442
14985,臺北市內湖區民權東路6段262號3樓,臺北市內湖區葫洲里4鄰民權東路六段262號,311005.362,2773843.710
14986,臺北市中正區漢口街1段110號4樓之7,臺北市中正區光復里10鄰漢口街一段110號,301561.948,2770869.376
14987,臺北市中山區中山北路2段52號9樓之3,臺北市中山區民安里17鄰中山北路二段52號,302722.827,2772111.689
14988,臺北市松山區復興北路73號12樓之1,臺北市松山區中正里20鄰復興北路73號,304913.456,2771541.961
14989,臺北市中正區羅斯福路4段58號8樓,臺北市中正區水源里1鄰羅斯福路四段58號,303887.875,2767527.935
14990,臺北市中山區天祥路59號6樓之2,臺北市中山區集英里20鄰天祥路59號,302550.948,2772887.828
14991,臺北市中山區松江路131之23號12樓,臺北市中山區中央里5鄰松江路131之23號,303821.462,2771900.243
14992,臺北市信義區基隆路1段159號14樓,臺北市信義區興雅里6鄰基隆路一段159號,307030.817,2770544.195
14993,臺北市中正區館前路6號12樓之4,臺北市中正區黎明里10鄰館前路6號,301954.704,2770984.815
14994,臺北市信義區光復南路417巷3號,臺北市信義區正和里5鄰光復南路417巷3號,306301.813,2769981.205
14995,臺北市信義區基隆路1段432號14樓之7,臺北市信義區中興里9鄰基隆路一段432號,306485.246,2769628.588
14996,臺北市中山區民權東路2段26號12樓之6,臺北市中山區新生里13鄰民權東路二段26號,303356.894,2772794.401
14997,臺北市松山區南京東路5段34號8樓之1,臺北市松山區吉祥里18鄰南京東路五段34號,306437.185,2771577.667
14998,臺北市大安區信義路4段6號6樓,臺北市大安區住安里3鄰信義路四段6號,304909.961,2769557.308
14999,臺北市大同區承德路1段46號4樓,臺北市大同區建泰里17鄰承德路一段46號,302161.782,2771572.728
15000,臺北市文山區萬利街2巷7號3樓,臺北市文山區萬美里1鄰萬利街2巷7號,307245.102,2765844.768
15001,臺北市中正區重慶南路1段63號11樓之2,臺北市中正區黎明里7鄰重慶南路一段63號,301798.710,2770798.828
15002,臺北市內湖區瑞光路258巷2號5樓之4,臺北市內湖區港墘里20鄰瑞光路258巷2號,308051.827,2774219.522
15003,臺北市大安區忠孝東路4段142號6樓之2,臺北市大安區建倫里1鄰忠孝東路四段142號,305435.731,2770464.431
15004,臺北市中山區雙城街18巷9號8樓之1,臺北市中山區晴光里11鄰雙城街18巷9號,302821.986,2773136.756
15005,臺北市中山區民權西路79號4樓之9,臺北市中山區集英里19鄰民權西路79號,302426.551,2772862.049
15006,臺北市松山區南京東路5段250巷2弄5之1號2樓,臺北市松山區新聚里18鄰南京東路五段250巷2弄5之1號,307149.739,2771524.459
15007,臺北市北投區致遠一路2段57巷12號1樓,臺北市北投區福興里18鄰致遠一路二段57巷12號,301727.760,2778273.058
15008,臺北市松山區延吉街20號2樓,臺北市松山區吉仁里5鄰延吉街20號,305841.064,2771076.883
15009,臺北市信義區虎林街164巷46號1樓,臺北市信義區安康里3鄰虎林街164巷46號,308046.591,2770142.407
15010,臺北市內湖區成功路4段61巷8弄6號1樓,臺北市內湖區清白里10鄰成功路四段61巷8弄6號,309807.125,2774989.126
15011,臺北市松山區復興北路499巷2弄3號,臺北市松山區民福里16鄰復興北路499巷2弄3號,304995.055,2773144.642
15012,臺北市士林區中山北路6段405巷26號2樓,臺北市士林區天壽里1鄰中山北路六段405巷26號,303022.751,2778554.394
15013,臺北市信義區基隆路2段125號15樓,臺北市信義區嘉興里3鄰基隆路二段125號,306209.868,2769041.056
15014,臺北市南港區東新街10之9號4樓之1,臺北市南港區玉成里20鄰東新街10之9號,308864.387,2771437.780
15015,臺北市萬華區環河南路3段311號2樓,臺北市萬華區華中里19鄰環河南路三段311號,299844.154,2767880.818
15016,臺北市南港區重陽路504巷1弄4號1樓,臺北市南港區三重里5鄰重陽路504巷1弄4號,311793.599,2772620.937
15017,臺北市大安區敦化南路2段182號17樓之1,臺北市大安區虎嘯里4鄰敦化南路二段182號,305336.597,2768499.292
15018,臺北市中山區民生東路3段36號3樓之8,臺北市中山區朱馥里12鄰民生東路三段36號,304531.572,2772265.938
15019,臺北市信義區吳興街7巷3號5樓,臺北市信義區景聯里1鄰吳興街7巷3號,306463.372,2769439.788
15020,臺北市松山區南京東路4段51-2號8樓,臺北市松山區中華里11鄰南京東路四段51之2號,305601.002,2771638.419
15021,臺北市信義區基隆路2段81號4樓,臺北市信義區景聯里6鄰基隆路二段81號,306314.794,2769235.127
15022,臺北市內湖區行愛路77巷59號5樓,臺北市內湖區湖元里18鄰行愛路77巷59號,308797.849,2772930.404
15023,臺北市中山區中山北路1段105巷3號3樓之3,臺北市中山區正得里9鄰中山北路一段105巷3號,302741.451,2771521.117
15024,臺北市信義區基隆路1段420號12樓之4,臺北市信義區中興里9鄰基隆路一段420號,306506.456,2769666.648
15025,臺北市信義區忠孝東路5段291號6樓,臺北市信義區富臺里15鄰忠孝東路五段291號,307683.114,2770456.630
15026,臺北市松山區復興北路167號14樓,臺北市松山區中正里32鄰復興北路167號,304918.794,2771857.892
15027,臺北市大安區和平東路1段177號5樓之2,臺北市大安區龍安里7鄰和平東路一段177號,303706.419,2768817.863
15028,臺北市中山區長安東路2段80號8樓之4,臺北市中山區朱園里13鄰長安東路二段80號,303892.138,2771237.566
15029,臺北市中山區松江路82號11樓,臺北市中山區興亞里15鄰松江路82號,303756.826,2771423.321
15030,臺北市中正區羅斯福路4段68號7樓之10,臺北市中正區水源里3鄰羅斯福路四段68號,303923.793,2767490.321
15031,臺北市中山區中山北路3段27號11樓之7,臺北市中山區晴光里15鄰中山北路三段27號,302710.087,2773121.740
15032,臺北市中山區中山北路2段112號8樓之2,臺北市中山區集英里8鄰中山北路二段112號,302739.992,2772600.476
15033,臺北市松山區南京東路4段93號3樓,臺北市松山區東勢里2鄰南京東路四段93號,305912.330,2771632.428
15034,臺北市北投區致遠二路125巷17號3樓,臺北市北投區吉利里3鄰致遠二路125巷17號,301647.942,2778911.023
15035,臺北市士林區延平北路6段258巷36弄14號4樓,臺北市士林區永倫里8鄰延平北路六段258巷36弄14號,300877.547,2775919.143
15036,臺北市中正區忠孝西路1段41號7樓之14,臺北市中正區黎明里3鄰忠孝西路一段41號,302306.560,2770991.832
15037,臺北市大同區重慶北路3段139號7樓之1,臺北市大同區揚雅里16鄰重慶北路三段139號,301850.678,2773419.928
15038,臺北市中山區錦州街46號8樓之1,臺北市中山區聚盛里16鄰錦州街46號,303047.175,2772545.623
15039,臺北市萬華區成都路81號6樓,臺北市萬華區西門里5鄰成都路81號,300984.810,2770637.235
15040,臺北市中山區南京東路3段118號11樓,臺北市中山區力行里26鄰南京東路三段118號,304516.250,2771617.160
15041,臺北市松山區延壽街402巷2弄15號1樓,臺北市松山區龍田里11鄰延壽街402巷2弄15號,306163.833,2772076.868
15042,臺北市中山區復興北路40號11樓,臺北市中山區力行里12鄰復興北路40號,304865.226,2771353.105
15043,臺北市中正區忠孝東路2段94號5樓,臺北市中正區幸市里1鄰忠孝東路二段94號,303488.987,2770630.228
15044,臺北市中山區林森北路627號2樓之2,臺北市中山區圓山里2鄰林森北路627號,303051.808,2773305.586
15045,臺北市中山區錦州街417號5樓,臺北市中山區江寧里15鄰錦州街417號,304675.305,2772568.930
15046,臺北市中山區松江路146號3樓(D室),臺北市中山區中吉里6鄰松江路146號,303760.544,2771806.584
15047,臺北市信義區信義路5段5號,臺北市信義區西村里8鄰信義路五段5號,306747.914,2769567.385
15048,臺北市內湖區內湖路1段66號10樓,臺北市內湖區西康里26鄰內湖路一段66號,306720.973,2775162.599
15049,臺北市文山區景文街137號,臺北市文山區景華里2鄰景文街13之1號,304654.625,2765144.613
15050,臺北市大安區光復南路556號9樓之2,臺北市大安區光信里7鄰光復南路556號,306242.360,2769715.723
15051,臺北市中正區八德路1段5號3樓之2,臺北市中正區梅花里14鄰八德路一段5號,303520.842,2770743.101
15052,臺北市內湖區新明路330號,臺北市內湖區週美里10鄰新明路330號,308665.889,2772016.137
15053,臺北市文山區辛亥路6段100巷4號,臺北市文山區華興里12鄰辛亥路六段100巷4號,305719.438,2764607.643
