id,Address,Response_Address,Response_X,Response_Y
14841,臺北市松山區民權東路3段112號9樓,臺北市松山區民有里27鄰民權東路三段112號,305009.294,2772742.522
14842,臺北市大安區和平東路3段63號7樓之7,臺北市大安區全安里1鄰和平東路三段63號,305424.484,2768626.223
14843,臺北市南港區永吉路561號2樓,臺北市南港區合成里10鄰永吉路561號,308693.764,2770942.607
14844,臺北市萬華區漢口街2段20巷11號1樓,臺北市萬華區萬壽里2鄰漢口街二段20巷11號,301264.807,2770849.627
14845,臺北市中正區金山南路1段25號,臺北市中正區文北里25鄰金山南路一段25號,303395.185,2770323.564
14846,臺北市大安區敦化南路2段267號4樓之2,臺北市大安區全安里2鄰敦化南路二段267號,305414.628,2768692.001
14847,臺北市萬華區環河南路1段230號1樓,臺北市萬華區福星里18鄰環河南路一段230號,300778.469,2771001.445
14848,臺北市中山區復興北路186號1樓,臺北市中山區龍洲里1鄰復興北路186號,304874.562,2771995.213
14849,臺北市大安區復興南路1段50號12樓,臺北市大安區誠安里16鄰復興南路一段66之1號,304853.027,2770802.900
14850,臺北市大同區太原路11-1號3樓,臺北市大同區建明里14鄰太原路11之1號,301977.437,2771388.892
14851,臺北市文山區萬利街1號1樓,臺北市文山區萬美里6鄰萬利街1號,307210.180,2765824.265
14852,臺北市信義區基隆路1段155號13樓之6,臺北市信義區興雅里6鄰基隆路一段155號,307046.103,2770572.592
14853,臺北市中正區新生南路1段148號8樓,臺北市中正區三愛里17鄰新生南路一段148號,303732.264,2769790.361
14854,臺北市中正區羅斯福路2段100號3樓,臺北市中正區板溪里2鄰羅斯福路二段100號,302713.628,2768852.147
14855,臺北市中山區松江路431巷24號,臺北市中山區行政里4鄰松江路431巷24號,303957.090,2773137.430
14856,臺北市松山區東興路26號5樓,臺北市松山區復盛里26鄰東興路26號,307057.511,2771281.300
14857,臺北市松山區復興北路1號3樓之6,臺北市松山區中正里1鄰復興北路1號,304906.540,2771201.056
14858,臺北市中正區重慶南路1段57號13樓之6,臺北市中正區黎明里7鄰重慶南路一段57號,301799.252,2770817.981
14859,臺北市大同區承德路2段82號2樓,臺北市大同區雙連里16鄰承德路二段82號,302259.664,2772279.243
14860,臺北市大安區仁愛路4段376號6樓之9,臺北市大安區光信里10鄰仁愛路四段376號,306081.862,2770035.792
14861,臺北市內湖區基湖路1號2樓,臺北市內湖區西湖里13鄰基湖路1號,307051.388,2774944.207
14862,臺北市內湖區文德路22巷24號,臺北市內湖區瑞陽里20鄰文德路22巷24號,308505.503,2774454.571
14863,臺北市中山區松江路158號10樓之2,臺北市中山區中吉里10鄰松江路158號,303763.671,2771972.919
14864,臺北市信義區永吉路55號7樓之1,臺北市信義區雅祥里7鄰永吉路55號,307424.502,2770976.275
14865,臺北市中山區八德路2段312巷19號1樓,臺北市中山區埤頭里16鄰八德路二段312巷19號,304800.425,2771013.195
14866,臺北市大安區敦化南路2段92號4樓,臺北市大安區龍雲里19鄰敦化南路二段92號,305342.435,2769033.487
14867,臺北市中山區龍江路108號3樓,臺北市中山區復華里12鄰龍江路108號,304521.153,2771755.189
14868,臺北市中山區伊通街129號3樓之4,臺北市中山區中央里13鄰伊通街129號,303973.238,2771908.615
14869,臺北市大安區延吉街131巷1弄32號,臺北市大安區華聲里13鄰延吉街131巷1弄32號,305960.907,2770707.127
14870,臺北市信義區基隆路1段380號5樓,臺北市信義區西村里9鄰基隆路一段380號,306538.920,2769727.326
14871,臺北市中正區新生南路1段56號11樓,臺北市中正區幸市里7鄰新生南路一段56號,303733.497,2770446.133
14872,臺北市松山區民生東路3段114號8樓,臺北市松山區松基里4鄰民生東路三段114號,304991.912,2772237.326
14873,臺北市內湖區舊宗路2段181巷6號4樓之1,臺北市內湖區湖元里18鄰舊宗路二段181巷6號,307996.303,2773836.071
14874,臺北市內湖區內湖路2段339巷10弄5號1樓,臺北市內湖區內湖里4鄰內湖路二段339巷10弄5號,309650.201,2775163.356
14875,臺北市中山區復興北路48號3樓,臺北市中山區力行里12鄰復興北路48號,304865.651,2771374.679
14876,臺北市大同區承德路1段41巷17號1樓,臺北市大同區建泰里8鄰承德路一段41巷17號,302251.857,2771548.546
14877,臺北市松山區八德路2段400號4樓,臺北市松山區中崙里7鄰八德路二段400號,305149.877,2771210.303
14878,臺北市中山區南京東路1段25號9樓,臺北市中山區康樂里1鄰南京東路一段25號,302895.017,2771679.197
14879,臺北市文山區興隆路2段244巷32號,臺北市文山區興業里10鄰興隆路二段244巷32號,305876.081,2765889.950
14880,臺北市文山區三福街7之1號1樓,臺北市文山區萬有里16鄰三福街7之1號,304660.703,2765524.889
14881,臺北市信義區信義路5段106號10樓,臺北市信義區三張里34鄰信義路五段106號,307198.831,2769506.327
14882,臺北市士林區承德路4段198號10樓,臺北市士林區前港里3鄰承德路四段198號,302657.599,2775579.205
14883,臺北市大安區敦化南路2段40號3樓,臺北市大安區住安里20鄰敦化南路二段40號,305339.657,2769386.339
14884,臺北市中正區泉州街9號,臺北市中正區龍光里6鄰泉州街9號,301881.232,2769244.616
14885,臺北市松山區南京東路5段48號4樓,臺北市松山區吉祥里18鄰南京東路五段48號,306493.465,2771576.478
14886,臺北市中正區金門街34巷4號,臺北市中正區河堤里12鄰金門街34巷4號,302723.763,2768237.843
14887,臺北市中山區長春路328號8樓之1,臺北市中山區復華里7鄰長春路328號,304570.215,2771927.207
14888,臺北市文山區木新路3段184號1樓,臺北市文山區樟樹里1鄰木新路三段184號,306576.211,2763876.724
14889,臺北市內湖區康寧路3段99巷12弄3號2樓,臺北市內湖區明湖里3鄰康寧路三段99巷12弄3號,311614.731,2773949.417
14890,臺北市士林區通河西街2段39號3樓,臺北市士林區社子里3鄰通河西街二段39號,301566.842,2775851.727
14891,臺北市士林區葫東街36號,臺北市士林區福順里16鄰葫東街36號,301576.792,2775138.098
14892,臺北市中山區松江路111號13樓,臺北市中山區朱園里8鄰松江路111號,303802.055,2771575.903
14893,臺北市大同區西寧北路70號8樓,臺北市大同區永樂里25鄰西寧北路70號,301319.717,2771837.434
14894,臺北市南港區重陽路263巷3號3樓,臺北市南港區重陽里1鄰重陽路263巷3號,310866.671,2772355.654
14895,臺北市中山區樂群三路218號5樓,臺北市中山區金泰里14鄰樂群三路218號,306266.370,2775031.361
14896,臺北市信義區光復南路463之1號1樓,臺北市信義區中興里14鄰光復南路463之1號,306275.711,2769676.544
14897,臺北市中正區青島東路5號5樓之2,臺北市中正區幸福里1鄰青島東路5號,302673.882,2770747.073
14898,臺北市大安區忠孝東路4段293號11樓之2,臺北市大安區華聲里11鄰忠孝東路四段293號,306000.947,2770501.035
14899,臺北市文山區久康街169巷2號,臺北市文山區木柵里17鄰久康街169巷2號,307376.764,2764889.629
14900,臺北市信義區嘉興街315號2樓,臺北市信義區黎平里5鄰嘉興街315號,305963.795,2768454.395
14901,臺北市士林區天母東路50巷25號2樓,臺北市士林區天福里6鄰天母東路50巷25號,303771.330,2778818.989
14902,臺北市文山區和平東路4段397號3樓,臺北市文山區博嘉里8鄰和平東路四段397號,307988.638,2765751.654
14903,臺北市松山區興安街157號1樓,臺北市松山區松基里9鄰興安街157號,305032.882,2772109.249
14904,臺北市大同區民生西路425之2號1樓,臺北市大同區大有里16鄰民生西路425之2號,301317.448,2772183.948
14905,臺北市大安區忠孝東路4段312號8樓之2,臺北市大安區正聲里14鄰忠孝東路四段312號,306192.509,2770450.142
14906,臺北市大安區敦化南路1段263號5樓之1,臺北市大安區敦安里19鄰敦化南路一段263號,305422.921,2769935.170
14907,臺北市松山區復興北路33號8樓之3,臺北市松山區中正里16鄰復興北路33號,304918.912,2771431.623
14908,臺北市松山區八德路2段374號7樓,臺北市松山區中崙里6鄰八德路二段374號,305096.515,2771200.543
14909,臺北市文山區萬隆街6-2號,臺北市文山區萬隆里14鄰萬隆街6之2號,304405.183,2765932.715
14910,臺北市中山區長春路78號9樓之5,臺北市中山區康樂里7鄰長春路78號,303138.980,2771952.501
14911,臺北市內湖區行愛路53號7樓,臺北市內湖區湖元里18鄰行愛路53號,308695.426,2772783.118
14912,臺北市中山區長安東路2段81號12樓,臺北市中山區朱園里12鄰長安東路二段81號,303931.594,2771259.349
14913,臺北市信義區松德路171號15樓之6,臺北市信義區安康里21鄰松德路171號,308004.302,2769872.604
14914,臺北市松山區南京東路3段256巷20弄12號地下1層,臺北市松山區中正里19鄰南京東路三段256巷20弄12號,305006.811,2771499.027
14915,臺北市松山區八德路2段441號4樓之1,臺北市松山區中正里2鄰八德路二段441號,305197.637,2771239.969
14916,臺北市大安區敦化南路2段57號9樓,臺北市大安區義安里9鄰敦化南路二段57號,305422.041,2769356.876
14917,臺北市中正區公園路30號8樓之2,臺北市中正區黎明里13鄰公園路30號,302153.160,2770804.111
14918,臺北市松山區民權東路3段106巷3弄34號2樓,臺北市松山區民有里30鄰民權東路三段106巷3弄34號,305302.547,2772678.685
14919,臺北市信義區基隆路1段420號9樓之2,臺北市信義區中興里9鄰基隆路一段420號,306506.456,2769666.648
14920,臺北市中正區紹興北街31巷15弄8號2樓,臺北市中正區梅花里9鄰紹興北街31巷15弄8號,303065.499,2770835.533
14921,臺北市大安區忠孝東路4段311號5樓之3,臺北市大安區華聲里10鄰忠孝東路四段311號,306084.014,2770499.659
14922,臺北市大同區延平北路2段247巷25號,臺北市大同區南芳里2鄰延平北路二段247巷25號,301782.356,2772789.803
14923,臺北市文山區羅斯福路5段129號8樓,臺北市文山區萬盛里10鄰羅斯福路五段129號,304410.391,2766399.031
14924,臺北市大安區大安路1段220巷8號、224巷11號1樓,臺北市大安區仁慈里4鄰大安路一段220巷8號,305038.322,2769682.956
14925,臺北市中山區吉林路298號2樓,臺北市中山區新生里21鄰吉林路298號,303488.019,2772678.330
14926,臺北市中山區八德路2段210巷6號2樓,臺北市中山區埤頭里4鄰八德路二段210巷6號,304404.403,2770977.067
14927,臺北市士林區通河街84號1樓,臺北市士林區明勝里7鄰通河街84號,302476.337,2774850.093
14928,臺北市中山區松江路204巷22號,臺北市中山區中吉里21鄰松江路204巷22號,303682.651,2772240.130
14929,臺北市信義區市民大道6段288號10樓,臺北市信義區永吉里1鄰市民大道六段288號,308435.453,2771353.716
14930,臺北市大安區瑞安街115號,臺北市大安區龍陣里14鄰瑞安街115號,304506.809,2768908.921
14931,臺北市中正區忠孝東路1段76號9樓之3,臺北市中正區幸福里4鄰忠孝東路一段76號,302871.506,2770803.982
14932,臺北市士林區社子街43號1樓,臺北市士林區社新里7鄰社子街43號,301187.112,2775577.390
14933,臺北市大安區光復南路102號3樓,臺北市大安區華聲里1鄰光復南路102號,306252.915,2770707.563
14934,臺北市信義區忠孝東路5段1-1號9樓,臺北市信義區興雅里1鄰忠孝東路五段1之1號,306998.790,2770483.453
14935,臺北市信義區忠孝東路5段412號18樓,臺北市信義區廣居里6鄰忠孝東路五段412號,308038.726,2770410.104
14936,臺北市松山區民生東路3段129號3樓,臺北市松山區民有里12鄰民生東路三段129號,305262.818,2772315.078
14937,臺北市文山區萬慶街49號2樓,臺北市文山區景美里15鄰萬慶街49號,304354.436,2765155.660
14938,臺北市中正區重慶南路1段88號3樓,臺北市中正區光復里6鄰重慶南路一段88號,301774.254,2770638.768
14939,臺北市松山區民權東路3段144號11樓之5,臺北市松山區民有里32鄰民權東路三段144號,305211.700,2772740.723
14940,臺北市松山區南京東路4段51號11樓之2,臺北市松山區中華里11鄰南京東路四段51號,305590.052,2771638.638
14941,臺北市中山區長安東路1段16號10樓之6,臺北市中山區正得里5鄰長安東路一段16號,302811.444,2771341.756
14942,臺北市中山區復興北路92號6樓之1,臺北市中山區力行里14鄰復興北路92號,304869.770,2771576.884
14943,臺北市中山區吉林路464號1樓,臺北市中山區新庄里13鄰吉林路464號,303501.035,2773335.413
14944,臺北市萬華區西藏路125巷13號11樓之3,臺北市萬華區新忠里17鄰西藏路125巷13號,300704.127,2769013.693
14945,臺北市中正區廈門街74巷2號2樓,找不到指定的門牌地址。,,
14946,臺北市大安區光復南路430號5樓,臺北市大安區光信里5鄰光復南路430號,306245.562,2769903.463
14947,臺北市信義區忠孝東路4段553巷16弄2號,臺北市信義區新仁里3鄰忠孝東路四段553巷16弄2號,306814.477,2770618.915
14948,臺北市中正區忠孝西路1段50號13樓之3,臺北市中正區黎明里11鄰忠孝西路一段50號,302048.097,2771005.519
14949,臺北市文山區興隆路2段217巷2弄10號,臺北市文山區興邦里8鄰興隆路二段217巷2弄10號,305549.072,2766074.977
14950,臺北市內湖區基湖路3巷9號4樓之2,臺北市內湖區西湖里13鄰基湖路3巷9號,307118.059,2774879.007
14951,臺北市內湖區瑞光路188巷52號7樓,臺北市內湖區港墘里20鄰瑞光路188巷52號,308180.454,2774046.340
14952,臺北市大安區忠孝東路3段211號9樓,臺北市大安區昌隆里8鄰忠孝東路三段211號,304437.850,2770523.025
14953,臺北市萬華區漢中街133號7樓之1,臺北市萬華區新起里18鄰漢中街133號,301205.076,2770512.569
14954,臺北市大安區麗水街33巷19號之1,臺北市大安區錦安里11鄰麗水街33巷19之1號,303483.897,2768986.509
14955,臺北市北投區中央南路1段138號2樓,臺北市北投區中央里19鄰中央南路一段138號,300514.376,2780264.539
14956,臺北市中山區新生北路2段43號7樓之5,臺北市中山區中原里12鄰新生北路二段43號,303270.745,2772030.895
14957,臺北市松山區民生東路5段151號9樓之2,臺北市松山區三民里20鄰民生東路五段151號,306730.471,2772434.562
14958,臺北市大安區信義路4段296號8樓,臺北市大安區通化里1鄰信義路四段296號,305966.182,2769541.724
14959,臺北市內湖區陽光街345巷6號2樓,臺北市內湖區湖元里18鄰陽光街345巷6號,308274.991,2773955.669
14960,臺北市內湖區港墘路26巷7號,臺北市內湖區港華里23鄰港墘路26巷7號,308253.002,2775118.375
14961,臺北市信義區松德路275號,臺北市信義區松友里20鄰松德路275號,308001.682,2769531.689
14962,臺北市信義區基隆路1段155號5樓之7,臺北市信義區興雅里6鄰基隆路一段155號,307046.103,2770572.592
14963,臺北市中正區許昌街42之1號10樓,臺北市中正區黎明里11鄰許昌街42之1號,302009.227,2770910.734
14964,臺北市大同區承德路3段63號2樓,臺北市大同區蓬萊里2鄰承德路三段63號,302315.490,2773126.323
14965,臺北市中山區復興北路430巷14號1樓,臺北市中山區下埤里3鄰復興北路430巷14號,304806.407,2772896.026
14966,臺北市中山區南京東路2段8號11樓,臺北市中山區興亞里24鄰南京東路二段8號,303311.657,2771629.052
14967,臺北市松山區南京東路5段230號8樓之5,臺北市松山區新聚里25鄰南京東路五段230號,307076.866,2771565.226
14968,臺北市大安區忠孝東路4段285號9樓,臺北市大安區車層里5鄰忠孝東路四段285號,305917.747,2770507.591
14969,臺北市內湖區民權東路6段11巷39之1號,臺北市內湖區湖元里18鄰民權東路六段11巷39之1號,308229.950,2773413.676
14970,臺北市文山區興隆路3段165號,臺北市文山區興光里9鄰興隆路三段165號,306536.910,2765524.115
14971,臺北市萬華區內江街90之1號,臺北市萬華區新起里5鄰內江街90號,300841.881,2770467.985
14972,臺北市中山區長春路366號5樓,臺北市中山區復華里2鄰長春路366號,304747.228,2771920.794
14973,臺北市中山區長春路366號5樓,臺北市中山區復華里2鄰長春路366號,304747.228,2771920.794
14974,臺北市大安區延吉街131巷39號2樓,臺北市大安區華聲里17鄰延吉街131巷39號,306082.245,2770649.951
14975,臺北市內湖區洲子街183號2樓,臺北市內湖區西湖里13鄰洲子街183號,307221.248,2774925.634
14976,臺北市信義區松隆路337號,臺北市信義區永吉里1鄰松隆路337號,308493.826,2771272.869
14977,臺北市中正區羅斯福路2段56號7樓之3,臺北市中正區南福里2鄰羅斯福路二段56號,302647.904,2768949.789
14978,臺北市大安區溫州街48巷22號,臺北市大安區大學里6鄰溫州街48巷22號,303694.383,2768256.843
14979,臺北市大安區新生南路2段2號6樓,臺北市大安區福住里4鄰新生南路二段2號,303737.667,2769570.258
14980,臺北市信義區基隆路1段155號13樓之6,臺北市信義區興雅里6鄰基隆路一段155號,307046.103,2770572.592
14981,臺北市大安區新生南路2段82號2樓之1,臺北市大安區龍安里1鄰新生南路二段82號,303951.664,2768898.432
14982,臺北市松山區復興北路331號6樓,臺北市松山區民有里5鄰復興北路331號,304934.899,2772506.692
14983,臺北市中正區南昌路2段81號9樓,臺北市中正區南福里6鄰南昌路二段81號,302558.246,2768890.656
14984,臺北市大安區復興南路1段237號15樓,臺北市大安區仁慈里16鄰復興南路一段237號,304884.376,2770030.120
14985,臺北市中山區南京東路2段124號8樓,臺北市中山區朱園里8鄰南京東路二段124號,303811.709,2771625.540
14986,臺北市內湖區內湖路1段516號6樓,臺北市內湖區港墘里20鄰內湖路一段516號,307899.071,2774798.995
14987,臺北市萬華區雙和街75號1樓,臺北市萬華區新安里18鄰雙和街75號,300538.091,2768917.941
14988,臺北市松山區敦化南路1段88號9樓之2,臺北市松山區福成里1鄰敦化南路一段88號,305346.438,2771067.913
14989,臺北市大安區敦化南路2段172巷6號1樓,臺北市大安區虎嘯里3鄰敦化南路二段172巷6號,305298.601,2768543.339
14990,臺北市中山區松江路3號7樓之5,臺北市中山區朱園里21鄰松江路3號,303794.628,2770978.676
14991,臺北市內湖區成功路4段168號地下2樓,臺北市內湖區內湖里24鄰成功路四段168號,309820.004,2775126.369
14992,臺北市中正區和平西路1段56號2樓之2,臺北市中正區板溪里14鄰和平西路一段56號,302435.656,2768800.163
14993,臺北市大安區光復南路390號2樓之2,臺北市大安區光信里2鄰光復南路390號,306246.982,2770016.945
14994,臺北市內湖區內湖路1段285巷65弄73號7樓之1,臺北市內湖區西湖里11鄰內湖路一段285巷65弄73號,307489.856,2775233.501
14995,臺北市大安區濟南路3段7之1號5樓,臺北市大安區民輝里10鄰濟南路三段7之1號,303844.205,2770342.369
14996,臺北市大安區師大路80巷10號,臺北市大安區古莊里15鄰師大路80巷10號,303269.320,2768458.134
14997,臺北市大安區敦化南路2段28號2樓之1,臺北市大安區住安里19鄰敦化南路二段28號,305341.756,2769459.411
14998,臺北市大安區敦化南路1段161巷18號,臺北市大安區建安里6鄰敦化南路一段161巷18號,305501.991,2770701.202
14999,臺北市中正區忠孝東路2段33號,臺北市中正區梅花里12鄰忠孝東路二段33號,303276.568,2770738.904
15000,臺北市北投區中央南路2段5號,臺北市北投區八仙里4鄰中央南路二段5號,300475.029,2779829.813
15001,臺北市內湖區瑞光路441號3樓,臺北市內湖區港墘里20鄰瑞光路441號,307603.557,2774632.861
15002,臺北市中山區南京東路2段20號10樓之3,臺北市中山區興亞里24鄰南京東路二段20號,303339.443,2771628.837
15003,臺北市中正區晉江街116號,臺北市中正區頂東里19鄰晉江街116號,302995.273,2768358.148
15004,臺北市松山區東興路8號8樓,臺北市松山區新聚里17鄰東興路8號,307005.589,2771448.087
15005,臺北市松山區光復南路55-2號3樓,臺北市松山區復盛里7鄰光復南路55之2號,306297.393,2770970.223
15006,臺北市大安區臥龍街188巷9號,臺北市大安區黎元里15鄰臥龍街188巷9號,305585.434,2767854.615
15007,臺北市中山區長春路366號5樓,臺北市中山區復華里2鄰長春路366號,304747.228,2771920.794
15008,臺北市中山區民生東路1段20號,臺北市中山區中山里10鄰民生東路一段20號,302829.736,2772291.051
15009,臺北市大安區忠孝東路4段312號9樓之1,臺北市大安區正聲里14鄰忠孝東路四段312號,306192.509,2770450.142
15010,臺北市大安區羅斯福路3段261之1號7樓之1,臺北市大安區大學里21鄰羅斯福路三段261之1號,303527.776,2767976.124
15011,臺北市北投區自強街180巷10號1樓,臺北市北投區石牌里1鄰自強街180巷10號,302161.938,2778147.970
15012,臺北市內湖區瑞光路582號9樓,臺北市內湖區西湖里13鄰瑞光路582號,307133.025,2774769.564
15013,臺北市中正區仁愛路2段15巷16號及地下層,臺北市中正區文北里8鄰仁愛路二段15巷16號,303090.172,2770176.164
15014,臺北市中山區長春路366號5樓,臺北市中山區復華里2鄰長春路366號,304747.228,2771920.794
15015,臺北市信義區虎林街132巷29號,臺北市信義區廣居里13鄰虎林街132巷29號,308100.131,2770357.544
15016,臺北市信義區基隆路1段155號7樓,臺北市信義區興雅里6鄰基隆路一段155號,307046.103,2770572.592
15017,臺北市中正區重慶南路1段88號3樓,臺北市中正區光復里6鄰重慶南路一段88號,301774.254,2770638.768
15018,臺北市南港區忠孝東路7段620號3樓,臺北市南港區新富里17鄰忠孝東路七段620號,312150.373,2771789.591
15019,臺北市松山區敦化北路222巷2號5樓,臺北市松山區民有里12鄰敦化北路222巷2號,305360.702,2772391.907
15020,臺北市中山區長安東路2段50號4樓之2,臺北市中山區興亞里8鄰長安東路二段50號,303703.729,2771240.464
15021,臺北市內湖區金湖路391號,臺北市內湖區金湖里26鄰金湖路391號,310905.239,2774036.295
15022,臺北市內湖區行愛路69號3樓,臺北市內湖區湖元里18鄰行愛路69號,308665.266,2772826.915
15023,臺北市大安區信義路2段104號8樓,臺北市大安區永康里10鄰信義路二段104號,303235.146,2769630.801
15024,臺北市中山區民生東路3段49號11樓,臺北市中山區江山里10鄰民生東路三段49號,304489.825,2772319.942
15025,臺北市士林區天玉街38巷13弄4號1樓,臺北市士林區天玉里15鄰天玉街38巷13弄4號,303346.344,2779149.545
15026,臺北市文山區景興路177巷1弄20號,臺北市文山區景東里4鄰景興路177巷1弄20號,305029.222,2765116.532
15027,臺北市大同區民生西路292號7樓,臺北市大同區朝陽里4鄰民生西路292號,301720.892,2772176.341
15028,臺北市中山區長安東路1段16號10樓之5,臺北市中山區正得里5鄰長安東路一段16號,302811.444,2771341.756
15029,臺北市北投區知行路316巷10號,臺北市北投區關渡里21鄰知行路316巷10號,297164.732,2779420.983
15030,臺北市信義區莊敬路289巷3弄37號,臺北市信義區景新里9鄰莊敬路289巷3弄37號,306782.692,2769185.104
15031,臺北市士林區克強路16號,臺北市士林區蘭興里13鄰克強路16號,302858.330,2777954.387
15032,臺北市內湖區港華街57號1樓,臺北市內湖區港華里13鄰港華街57號,308030.533,2775099.755
15033,臺北市中山區中山北路3段45號6樓,臺北市中山區晴光里15鄰中山北路三段45號,302717.087,2773216.124
15034,臺北市大安區仁愛路4段27巷3號2樓,臺北市大安區仁愛里10鄰仁愛路四段27巷3號,305023.251,2770192.530
15035,臺北市大安區敦化南路1段263號3樓,臺北市大安區敦安里19鄰敦化南路一段263號,305422.921,2769935.170
15036,臺北市文山區興隆路2段244巷39弄8號4樓,臺北市文山區興業里17鄰興隆路二段244巷39弄8號,305807.627,2765822.512
15037,臺北市信義區永吉路200巷11弄6號,臺北市信義區五全里9鄰永吉路200巷11弄6號,307807.634,2770877.909
15038,臺北市信義區松仁路211號,臺北市信義區三犁里17鄰松仁路211號,307373.539,2768878.799
15039,臺北市士林區延平北路5段163巷4號4樓,臺北市士林區葫蘆里1鄰延平北路五段163巷4號,301428.180,2775041.241
15040,臺北市松山區八德路3段225號8樓之7,臺北市松山區復勢里13鄰八德路三段225號,306201.986,2771235.726
15041,臺北市中山區建國北路2段109號,臺北市中山區江山里7鄰建國北路二段109號,304211.582,2772452.651
15042,臺北市北投區石牌路1段160號,臺北市北投區榮光里24鄰石牌路一段160號,301764.954,2778539.814
15043,臺北市北投區泉源路12號3樓,臺北市北投區中心里2鄰泉源路12號,300853.902,2781056.165
15044,臺北市中正區林森南路4之3號2樓,臺北市中正區幸福里1鄰林森南路4之3號,302765.745,2770728.852
15045,臺北市大安區和平東路3段228巷8號1樓,臺北市大安區芳和里13鄰和平東路三段228巷8號,305939.308,2768345.178
15046,臺北市內湖區港墘路30號,臺北市內湖區港華里1鄰港墘路30號,308312.342,2775053.550
15047,臺北市士林區延平北路8段148號,臺北市士林區富洲里6鄰延平北路八段148號,298666.852,2777608.002
