id,Address,Response_Address,Response_X,Response_Y
12398,臺北市中山區中山北路2段128巷7號1樓,臺北市中山區集英里14鄰中山北路二段128巷7號,302633.974,2772727.811
12399,臺北市信義區虎林街119巷14號,臺北市信義區富臺里9鄰虎林街119巷14號,308259.736,2770556.272
12400,臺北市中山區新生北路3段56巷10號1樓,臺北市中山區晴光里3鄰新生北路三段56巷10號,303171.780,2773114.502
12401,臺北市內湖區麗山街348巷22-1號5樓,臺北市內湖區港都里11鄰麗山街348巷22之1號,307916.363,2774978.481
12402,臺北市松山區八德路4段135號7樓之4,臺北市松山區吉祥里10鄰八德路四段135號,306724.767,2771296.026
12403,臺北市松山區塔悠路110巷2號,臺北市松山區鵬程里2鄰塔悠路110巷2號,307457.852,2772010.737
12404,臺北市中正區懷寧街35號6樓,臺北市中正區黎明里10鄰懷寧街35號,301886.174,2770849.395
12405,臺北市中山區民權東路1段76號7樓,臺北市中山區聚葉里12鄰民權東路一段76號,303003.480,2772802.972
12406,臺北市松山區南京東路5段59巷29弄20號,臺北市松山區東光里18鄰南京東路五段59巷29弄20號,306501.498,2771758.366
12407,臺北市大安區復興南路１段２４３號７樓之１,臺北市大安區仁慈里16鄰復興南路一段243號,304883.690,2770009.094
12408,臺北市內湖區堤頂大道2段15號6樓之1,臺北市內湖區港墘里20鄰堤頂大道二段15號,307698.624,2774272.346
12409,臺北市松山區敦化北路222巷6號2樓,臺北市松山區民有里12鄰敦化北路222巷6號,305348.096,2772403.898
12410,臺北市中山區新生北路2段66號6樓之24,臺北市中山區中山里20鄰新生北路二段66號,303192.822,2772096.493
12411,臺北市信義區忠孝東路５段１之１號３樓,臺北市信義區興雅里1鄰忠孝東路五段1之1號,306998.790,2770483.453
12412,臺北市中山區長安東路２段１７１號３樓之７,臺北市中山區力行里3鄰長安東路二段171號,304656.717,2771248.079
12413,臺北市中正區羅斯福路1段10號6樓之1,臺北市中正區龍福里3鄰羅斯福路一段10號,302328.744,2769421.681
12414,臺北市大同區民生西路２８８號２樓,臺北市大同區朝陽里4鄰民生西路288號,301740.681,2772177.276
12415,臺北市內湖區安康路28之1號3樓,臺北市內湖區石潭里4鄰安康路28之1號,309908.237,2772823.953
12416,臺北市中山區復興北路280巷9號1樓,臺北市中山區江山里23鄰復興北路280巷9號,304825.528,2772400.713
12417,臺北市大同區延平北路２段２４８號１樓,臺北市大同區大有里8鄰延平北路二段248號,301584.806,2772537.835
12418,臺北市中山區長安東路１段２１號６樓之２,臺北市中山區正得里10鄰長安東路一段21號,302787.311,2771372.417
12419,臺北市大安區復興南路2段27號9樓之9,臺北市大安區住安里1鄰復興南路二段27號,304879.676,2769419.965
12420,臺北市松山區南京東路４段１３３巷８弄３０號１樓,臺北市松山區東勢里7鄰南京東路四段133巷8弄30號,305884.717,2771784.900
12421,臺北市大安區樂利路91號地下,臺北市大安區法治里5鄰樂利路91號,305732.509,2768726.797
12422,臺北市大安區和平東路3段111號4樓之1,臺北市大安區全安里5鄰和平東路三段111號,305638.391,2768613.889
12423,臺北市內湖區堤頂大道2段497號6樓之5、6,臺北市內湖區西康里26鄰堤頂大道二段497號,306677.595,2775071.327
12424,臺北市中山區南京東路３段１３１號８樓,臺北市中山區復華里12鄰南京東路三段131號,304551.972,2771660.372
12425,臺北市中山區龍江路288之1號,臺北市中山區江寧里12鄰龍江路288之1號,304549.162,2772663.318
12426,臺北市大安區忠孝東路4段250號10樓之2,臺北市大安區車層里10鄰忠孝東路四段250號,305924.448,2770455.741
12427,臺北市大安區敦化南路２段１號９樓,臺北市大安區義安里1鄰敦化南路二段1號,305417.871,2769547.769
12428,臺北市松山區八德路4段28號5樓之2,臺北市松山區復盛里1鄰八德路四段28號,306387.836,2771231.278
12429,臺北市大安區復興南路2段137號地下室,臺北市大安區龍雲里7鄰復興南路二段137號,304869.958,2769072.938
12430,臺北市松山區光復北路11巷74號1樓,臺北市松山區吉祥里21鄰光復北路11巷74號,306566.192,2771436.912
12431,臺北市大安區安和路2段32巷19號,臺北市大安區義安里6鄰安和路二段32巷19號,305592.198,2769415.474
12432,臺北市內湖區堤頂大道2段407巷20弄39號3樓,臺北市內湖區西康里26鄰堤頂大道二段407巷20弄39號,306770.701,2774955.541
12433,臺北市信義區基隆路1段333號11樓,臺北市信義區西村里8鄰基隆路一段333號,306623.479,2769688.933
12434,臺北市大同區民樂街146號2樓,臺北市大同區大有里6鄰民樂街146號,301491.429,2772552.864
12435,臺北市中正區杭州南路1段14之9號,臺北市中正區東門里6鄰杭州南路一段14之9號,303010.137,2770215.582
12436,臺北市大同區迪化街１段４６巷２２號２樓,臺北市大同區永樂里8鄰迪化街一段46巷22號,301395.326,2771957.803
12437,臺北市松山區光復北路95號3樓,臺北市松山區吉祥里19鄰光復北路95號,306306.981,2771521.922
12438,臺北市內湖區環山路2段123號1樓,臺北市內湖區港華里8鄰環山路二段123號,308139.518,2775223.690
12439,臺北市大安區羅斯福路３段１７１號１０樓,臺北市大安區古莊里17鄰羅斯福路三段171號,303255.871,2768252.825
12440,臺北市信義區基隆路2段7號5樓,臺北市信義區景聯里1鄰基隆路二段7號,306451.347,2769484.616
12441,臺北市士林區延平北路5段56號,臺北市士林區福順里8鄰延平北路五段56號,301546.137,2774766.655
12442,臺北市中山區民權東路３段３５號６樓、６樓之１,臺北市中山區下埤里1鄰民權東路三段35號,304702.086,2772815.321
12443,臺北市士林區延平北路５段３０９號１樓,臺北市士林區葫蘆里13鄰延平北路五段309號,301370.543,2775431.404
12444,臺北市南港區三重路19-11號3樓,臺北市南港區三重里25鄰三重路19之11號,311922.558,2772402.483
12445,臺北市士林區忠誠路1段147巷5號,臺北市士林區聖山里20鄰忠誠路一段147巷5號,303468.614,2777626.521
12446,臺北市中山區松江路1號2樓之1,臺北市中山區朱園里21鄰松江路1號,303811.913,2770960.383
12447,臺北市大安區仁愛路4段85號13樓,臺北市大安區仁愛里22鄰仁愛路四段85號,305292.001,2770134.671
12448,臺北市信義區基隆路１段１５９號１４樓,臺北市信義區興雅里6鄰基隆路一段159號,307030.817,2770544.195
12449,臺北市內湖區瑞光路358巷38弄36號3樓之1,臺北市內湖區港墘里20鄰瑞光路358巷38弄36號,307796.479,2774311.722
12450,臺北市中正區羅斯福路３段１００號３樓之９,臺北市中正區頂東里1鄰羅斯福路三段100號,303188.355,2768254.809
12451,臺北市松山區延吉街35號3樓,臺北市松山區吉仁里3鄰延吉街35號,305871.701,2770960.357
12452,臺北市中山區中山北路1段53巷18號,臺北市中山區正得里5鄰中山北路一段53巷18號,302751.326,2771307.467
12453,臺北市中山區中原街11號2樓,臺北市中山區中原里9鄰中原街11號,303365.943,2772039.096
12454,臺北市信義區基隆路2段131之12號3樓,臺北市信義區嘉興里4鄰基隆路二段131之12號,306168.559,2768964.696
12455,臺北市中山區民權西路27號10樓,臺北市中山區集英里18鄰民權西路27號,302608.387,2772856.188
12456,臺北市大同區南京西路410號5樓之2,臺北市大同區玉泉里1鄰南京西路410號,301428.534,2771764.804
12457,臺北市中山區吉林路395號2樓,臺北市中山區新喜里16鄰吉林路395號,303521.053,2773165.966
12458,臺北市中正區重慶南路1段46巷13號2樓之5,臺北市中正區光復里4鄰重慶南路一段46巷13號,301703.359,2770801.173
12459,臺北市大同區昌吉街99巷4號1樓,臺北市大同區國慶里18鄰昌吉街99巷4號,301604.421,2773211.413
12460,臺北市中山區建國北路2段3巷15號2樓之17,臺北市中山區復華里14鄰建國北路二段3巷15號,304249.285,2771709.009
12461,臺北市中正區寧波西街29號1樓,臺北市中正區龍福里2鄰寧波西街29號,302289.975,2769329.347
12462,臺北市中山區松江路369號4樓,臺北市中山區行政里15鄰松江路369號,303823.913,2773068.742
12463,臺北市大安區光復南路420巷10號,臺北市大安區光信里12鄰光復南路420巷10號,306164.518,2769945.407
12464,臺北市中正區重慶南路2段82號6樓,臺北市中正區龍光里6鄰重慶南路二段82號,301954.789,2769253.075
12465,臺北市大安區和平東路３段１３１號５樓,臺北市大安區全安里5鄰和平東路三段131號,305720.552,2768625.944
12466,臺北市中山區四平街15號1樓,臺北市中山區中吉里4鄰四平街15號,303565.305,2771835.727
12467,臺北市松山區八德路3段12巷20弄3號2樓,臺北市松山區敦化里6鄰八德路三段12巷20弄3號,305554.089,2771066.216
12468,臺北市中山區新生北路3段62巷2號1樓,臺北市中山區晴光里4鄰新生北路三段62巷2號,303197.570,2773162.870
12469,臺北市大安區瑞安街135巷18之1號5樓,臺北市大安區龍生里10鄰瑞安街135巷18之1號,304587.414,2768834.079
12470,臺北市內湖區民權東路6段180巷6號5樓之4,臺北市內湖區寶湖里13鄰民權東路六段180巷6號,309789.618,2773462.164
12471,臺北市中山區長春路26號6樓之4,臺北市中山區康樂里6鄰長春路26號,302921.863,2771954.994
12472,臺北市內湖區金龍路67巷5弄4號1樓,臺北市內湖區金龍里11鄰金龍路67巷5弄4號,309817.193,2775405.703
12473,臺北市中山區吉林路２６巷２０號,臺北市中山區興亞里23鄰吉林路26巷20號,303401.857,2771572.684
12474,臺北市大安區光復南路296號7樓之1,臺北市大安區正聲里16鄰光復南路296號,306251.663,2770228.725
12475,臺北市大安區和平東路2段36巷3號1樓,臺北市大安區龍門里6鄰和平東路二段36巷3號,304198.562,2768676.306
12476,臺北市松山區八德路4段72巷16弄5號1樓,臺北市松山區復盛里16鄰八德路四段72巷16弄5號,306511.752,2771030.878
12477,臺北市大安區仁愛路4段312號2樓之7,臺北市大安區光信里18鄰仁愛路四段312號,306012.473,2770021.623
12478,臺北市大安區安和路1段70號5樓,臺北市大安區敦安里5鄰安和路一段70號,305739.225,2769806.773
12479,臺北市內湖區洲子街61號10樓,臺北市內湖區港墘里20鄰洲子街61號,307796.053,2774702.291
12480,臺北市北投區溫泉路11之1號,臺北市北投區長安里13鄰溫泉路11之1號,300700.901,2780697.096
12481,臺北市中山區復興北路５０號１２樓,臺北市中山區力行里12鄰復興北路50號,304866.091,2771397.065
12482,臺北市松山區民族東路689號,臺北市松山區民福里23鄰民族東路689號,305320.459,2772917.732
12483,臺北市中山區中山北路2段65巷2弄62號1樓,臺北市中山區中山里6鄰中山北路二段65巷2弄62號,302961.717,2772148.732
12484,臺北市大安區忠孝東路4段60號12樓,臺北市大安區仁愛里6鄰忠孝東路四段60號,305031.985,2770471.173
12485,臺北市大安區泰順街26巷51號,臺北市大安區龍泉里7鄰泰順街26巷51號,303434.485,2768652.723
12486,臺北市松山區八德路2段374號6樓之3,臺北市松山區中崙里6鄰八德路二段374號,305096.515,2771200.543
12487,臺北市中山區天祥路59號4樓之1,臺北市中山區集英里20鄰天祥路59號,302550.948,2772887.828
12488,臺北市中正區林森南路12號4樓,臺北市中正區幸福里3鄰林森南路12號,302732.850,2770604.363
12489,臺北市大安區忠孝東路3段217巷3弄5號1樓,臺北市大安區昌隆里10鄰忠孝東路三段217巷3弄5號,304426.860,2770622.091
12490,臺北市大安區和平東路3段63號5樓之2,臺北市大安區全安里1鄰和平東路三段63號,305424.484,2768626.223
12491,臺北市大安區忠孝東路4段112號12樓之11,臺北市大安區仁愛里11鄰忠孝東路四段112號,305180.833,2770469.812
12492,臺北市中山區長安東路２段２３０號２樓之５,臺北市中山區朱崙里15鄰長安東路二段230號,304770.304,2771223.878
12493,臺北市中山區建國北路1段80號11樓,臺北市中山區朱園里6鄰建國北路一段80號,304111.108,2771372.125
12494,臺北市松山區復興北路１４５號５樓,臺北市松山區中正里32鄰復興北路145號,304917.610,2771828.959
12495,臺北市中正區忠孝西路１段４１號１５樓之１５,臺北市中正區黎明里3鄰忠孝西路一段41號,302306.560,2770991.832
12496,臺北市中山區長安東路2段81號12樓,臺北市中山區朱園里12鄰長安東路二段81號,303931.594,2771259.349
12497,臺北市信義區忠孝東路5段410號8樓,臺北市信義區廣居里10鄰忠孝東路五段410號,308034.869,2770410.247
12498,臺北市信義區吳興街284巷22弄126號,臺北市信義區雙和里18鄰吳興街284巷22弄126號,306567.081,2768515.029
12499,臺北市中正區重慶南路1段43號9樓之7,臺北市中正區黎明里7鄰重慶南路一段43號,301798.976,2770855.558
12500,臺北市內湖區民權東路6段180巷6號5樓之2,臺北市內湖區寶湖里13鄰民權東路六段180巷6號,309789.618,2773462.164
12501,臺北市信義區基隆路2段51號12樓之1,臺北市信義區景聯里4鄰基隆路二段51號,306364.588,2769325.568
12502,臺北市萬華區德昌街7巷15號(1樓),臺北市萬華區全德里8鄰德昌街7巷15號,300425.798,2768616.581
12503,臺北市文山區木柵路２段１２６號１樓,臺北市文山區明義里5鄰木柵路二段126號,306677.084,2764642.887
12504,臺北市大安區敦化南路1段193號2樓,臺北市大安區建安里15鄰敦化南路一段193號,305439.890,2770586.689
12505,臺北市中山區中山北路2段26巷2號,臺北市中山區民安里12鄰中山北路二段26巷2號,302680.897,2771849.511
12506,臺北市大安區和平東路2段107巷6弄4號,臺北市大安區龍生里12鄰和平東路二段107巷6弄4號,304501.723,2768750.753
12507,臺北市萬華區西園路1段150號3樓,臺北市萬華區青山里12鄰西園路一段150號,300395.666,2770024.015
12508,臺北市大安區復興南路１段１２３號３樓,臺北市大安區光武里25鄰復興南路一段123號,304897.376,2770691.348
12509,臺北市大安區復興南路1段368號13樓,臺北市大安區和安里4鄰復興南路一段368號,304835.541,2769757.148
12510,臺北市士林區環河北路３段１２３號１樓,臺北市士林區葫蘆里24鄰環河北路三段123號,301057.333,2775310.956
12511,臺北市文山區公館街54號,臺北市文山區萬年里9鄰公館街54號,304240.875,2766516.279
12512,臺北市中山區錦州街28號12樓,臺北市中山區聚盛里2鄰錦州街28號,302918.176,2772552.716
12513,臺北市信義區松仁路89號18樓,臺北市信義區安康里8鄰松仁路89號,307392.924,2770021.133
12514,臺北市中山區中山北路2段26巷2號1樓,臺北市中山區民安里12鄰中山北路二段26巷2號,302680.897,2771849.511
12515,臺北市文山區萬利街9號1樓,臺北市文山區萬美里6鄰萬利街9號,307176.723,2765865.414
12516,臺北市中正區博愛路7號,臺北市中正區光復里2鄰博愛路7號,301603.051,2770979.277
12517,臺北市士林區福國路95號3樓之9,臺北市士林區德華里2鄰福國路95號,302662.055,2777110.820
12518,臺北市中山區合江街180巷22號,臺北市中山區江寧里4鄰合江街180巷22號,304287.622,2772641.884
12519,臺北市大安區安和路2段5號9樓,臺北市大安區通安里1鄰安和路二段5號,305768.535,2769529.149
12520,臺北市內湖區新明路353號3樓之1,臺北市內湖區週美里5鄰新明路353號,308821.864,2772069.630
12521,臺北市信義區林口街178號,臺北市信義區大道里10鄰林口街178號,308640.603,2770379.378
12522,臺北市松山區八德路3段225號8樓之7,臺北市松山區復勢里13鄰八德路三段225號,306201.986,2771235.726
12523,臺北市中正區忠孝東路２段１３０號１１樓之３,臺北市中正區幸市里2鄰忠孝東路二段130號,303662.368,2770579.188
12524,臺北市信義區基隆路1段149號5樓之3,臺北市信義區興雅里6鄰基隆路一段149號,307067.554,2770610.978
12525,臺北市大安區和平東路3段123號3樓之1,臺北市大安區全安里5鄰和平東路三段123號,305676.878,2768611.434
12526,臺北市大安區和平東路2段295號10樓,臺北市大安區群賢里6鄰和平東路二段295號,304970.277,2768651.460
12527,臺北市大安區忠孝東路4段299號6樓,臺北市大安區華聲里11鄰忠孝東路四段299號,306037.425,2770500.042
12528,臺北市文山區羅斯福路5段125號6樓之1,臺北市文山區萬盛里10鄰羅斯福路五段125號,304413.664,2766421.296
12529,臺北市中山區長春路348之4號3樓,臺北市中山區復華里7鄰長春路348之4號,304636.003,2771925.742
12530,臺北市松山區南京東路4段171號5樓之3,臺北市松山區東勢里1鄰南京東路四段171號,306132.026,2771627.386
12531,臺北市南港區南港路2段178巷22號4樓,臺北市南港區東明里4鄰南港路二段178巷22號,310553.995,2771929.508
12532,臺北市大安區和平東路2段295號10樓,臺北市大安區群賢里6鄰和平東路二段295號,304970.277,2768651.460
12533,臺北市中山區民族東路512巷13弄3號,臺北市中山區下埤里20鄰民族東路512巷13弄3號,304719.699,2773345.206
12534,臺北市大同區長安西路121號4樓,臺北市大同區建泰里16鄰長安西路121號,302033.388,2771557.435
12535,臺北市中正區忠孝西路1段41號6樓之9,臺北市中正區黎明里3鄰忠孝西路一段41號,302306.560,2770991.832
12536,臺北市大安區忠孝東路4段333號9樓之1,臺北市大安區華聲里9鄰忠孝東路四段333號,306216.199,2770496.712
12537,臺北市大同區赤峰街２２號,臺北市大同區光能里8鄰赤峰街22號,302429.043,2772084.506
12538,臺北市中山區建國北路２段２６２號１樓,臺北市中山區松江里23鄰建國北路二段262號,304141.909,2772746.948
12539,臺北市中山區中山北路2段93巷8號5樓之6,臺北市中山區聚盛里7鄰中山北路二段93巷8號,302832.954,2772443.721
12540,臺北市大安區敦化南路1段344號2樓,臺北市大安區德安里1鄰敦化南路一段344號,305345.085,2769737.464
12541,臺北市大安區敦化南路2段170號4樓,臺北市大安區虎嘯里2鄰敦化南路二段170號,305340.847,2768556.502
12542,臺北市中山區建國北路2段3巷37號3樓,臺北市中山區復華里14鄰建國北路二段3巷37號,304317.887,2771710.151
12543,臺北市中山區南京西路1-1號10樓,臺北市中山區民安里10鄰南京西路1之1號,302649.929,2771697.985
12544,臺北市內湖區內湖路1段285巷65弄13號,臺北市內湖區西湖里23鄰內湖路一段285巷65弄13號,307258.359,2775249.406
12545,臺北市南港區南港路3段99號4樓,臺北市南港區玉成里1鄰南港路三段99號,309288.250,2771760.932
12546,臺北市松山區南京東路5段59巷31弄26號,臺北市松山區東光里16鄰南京東路五段59巷31弄26號,306523.118,2771807.439
12547,臺北市中山區松江路317號10樓,臺北市中山區松江里10鄰松江路317號,303816.398,2772766.605
12548,臺北市中山區松江路220號3樓之1,臺北市中山區中庄里21鄰松江路220號,303767.706,2772327.112
12549,臺北市大同區承德路3段230號7樓,臺北市大同區保安里8鄰承德路三段230號,302306.424,2773894.014
12550,臺北市萬華區昆明街142號5樓之4,臺北市萬華區西門里11鄰昆明街142號,300922.428,2770587.069
12551,臺北市大同區寧夏路58號3樓,臺北市大同區星明里21鄰寧夏路58號,301996.685,2772150.995
12552,臺北市中山區長安東路1段4之1號2樓,臺北市中山區正得里1鄰長安東路一段4之1號,302687.870,2771372.017
12553,臺北市松山區基隆路1段32號6樓,臺北市松山區新聚里3鄰基隆路一段32號,307462.206,2771442.022
12554,臺北市中山區民生東路2段153號6樓,臺北市中山區松江里11鄰民生東路二段153號,304050.153,2772321.776
12555,臺北市信義區東興路41號11樓,臺北市信義區新仁里19鄰東興路41號,307177.456,2771226.758
12556,臺北市大安區忠孝東路4段222號3樓,臺北市大安區車層里9鄰忠孝東路四段222號,305861.022,2770456.574
12557,臺北市松山區寶清街89巷17號,臺北市松山區安平里29鄰寶清街89巷17號,307381.532,2771706.174
12558,臺北市士林區士東路91巷39號2樓,臺北市士林區天祿里6鄰士東路91巷39號,303393.456,2778468.623
12559,臺北市中正區中華路2段459之1號1樓,臺北市中正區永昌里10鄰中華路二段459之1號,301464.569,2768622.528
12560,臺北市信義區基隆路2段151之7號8樓,臺北市信義區黎順里19鄰基隆路二段151之7號,305967.229,2768765.749
12561,臺北市大安區復興南路2段157號12樓之2,臺北市大安區群賢里1鄰復興南路二段157號,304869.226,2769002.617
12562,臺北市內湖區新明路277號1樓,臺北市內湖區週美里1鄰新明路277號,309133.677,2772271.692
12563,臺北市信義區忠孝東路5段1之1號10樓,臺北市信義區興雅里1鄰忠孝東路五段1之1號,306998.790,2770483.453
12564,臺北市松山區光復南路32巷34之4號1樓,臺北市松山區復建里8鄰光復南路32巷34之4號,306040.110,2771024.185
12565,臺北市中正區衡陽路７號１１樓,臺北市中正區黎明里8鄰衡陽路7號,301841.655,2770573.807
12566,臺北市松山區民生東路5段77號,臺北市松山區東榮里7鄰民生東路五段77號,306364.649,2772398.405
12567,臺北市大安區信義路4段58號3樓,臺北市大安區住安里4鄰信義路四段58號,305024.175,2769560.051
12568,臺北市信義區忠孝東路5段552號10樓,臺北市信義區松光里10鄰忠孝東路五段552號,308529.607,2770542.644
12569,臺北市信義區松德路200巷9號1樓,臺北市信義區安康里26鄰松德路200巷9號,307903.864,2769702.811
12570,臺北市大安區復興南路2段78巷76號1樓,臺北市大安區龍圖里9鄰復興南路二段78巷76號,304599.093,2769323.997
12571,臺北市內湖區瑞光路478巷18弄20號7樓,臺北市內湖區西湖里13鄰瑞光路478巷18弄20號,307338.228,2774583.841
12572,臺北市中山區龍江路370巷37號1樓,臺北市中山區行仁里18鄰龍江路370巷37號,304382.409,2773252.580
12573,臺北市松山區敦化南路1段80巷24號,臺北市松山區福成里3鄰敦化南路一段80巷24號,305264.005,2771049.103
12574,臺北市中正區八德路1段23號4樓之2,臺北市中正區梅花里14鄰八德路一段23號,303588.562,2770792.359
12575,臺北市內湖區舊宗路1段159號7樓之4,臺北市內湖區湖元里18鄰舊宗路一段159號,308380.753,2772702.136
12576,臺北市中正區愛國西路48巷2號1樓,臺北市中正區愛國里3鄰愛國西路48巷2號,301224.561,2769932.422
12577,臺北市萬華區富民路155巷29號,臺北市萬華區興德里13鄰富民路155巷29號,300544.531,2767908.500
12578,臺北市內湖區內湖路3段115巷4弄2號1樓,臺北市內湖區金龍里20鄰內湖路三段115巷4弄2號,309548.055,2775457.805
12579,臺北市大安區忠孝東路4段329號5樓,臺北市大安區華聲里9鄰忠孝東路四段329號,306190.014,2770497.753
12580,臺北市中山區民權東路3段17號2樓,臺北市中山區下埤里1鄰民權東路三段17號,304641.440,2772816.016
12581,臺北市士林區重慶北路4段220巷21弄32號1樓,臺北市士林區葫東里9鄰重慶北路四段220巷21弄32號,301625.671,2775470.706
12582,臺北市松山區光復南路1號5樓之2,臺北市松山區復盛里1鄰光復南路1號,306301.459,2771200.832
12583,臺北市中正區衡陽路7號8樓,臺北市中正區黎明里8鄰衡陽路7號,301841.655,2770573.807
12584,臺北市中山區松江路３６９號４樓,臺北市中山區行政里15鄰松江路369號,303823.913,2773068.742
12585,臺北市內湖區內湖路1段409號2樓,臺北市內湖區麗山里15鄰內湖路一段409號,307583.726,2774958.146
12586,臺北市中山區南京東路3段200號7樓,臺北市中山區力行里17鄰南京東路三段200號,304795.456,2771611.411
12587,臺北市松山區民生東路5段69巷4弄1號,臺北市松山區東榮里12鄰民生東路五段69巷4弄1號,306327.128,2772542.870
12588,臺北市信義區松德路171號10樓之1,臺北市信義區安康里21鄰松德路171號,308004.302,2769872.604
12589,臺北市大安區信義路4段306號14樓之2,臺北市大安區通化里1鄰信義路四段306號,305993.554,2769541.172
12590,臺北市中山區龍江路387巷25號1樓,臺北市中山區下埤里9鄰龍江路387巷25號,304715.912,2773113.714
12591,臺北市大安區敦化南路1段376號8樓之2,臺北市大安區德安里1鄰敦化南路一段376號,305345.254,2769611.147
12592,臺北市大安區忠孝東路4段220號13樓,臺北市大安區車層里9鄰忠孝東路四段220號,305839.389,2770456.628
12593,臺北市中山區民權西路38之3號,臺北市中山區集英里15鄰民權西路38之3號,302589.685,2772805.055
12594,臺北市松山區敦化北路4巷31號2樓之5,臺北市松山區中正里17鄰敦化北路4巷31號,305042.699,2771436.218
12595,臺北市中正區忠孝東路2段46號5樓,臺北市中正區幸福里13鄰忠孝東路二段46號,303298.233,2770686.581
12596,臺北市大安區新生南路3段88號6樓之2,臺北市大安區大學里4鄰新生南路三段88號,303829.479,2767890.810
12597,臺北市中正區重慶南路1段57號12樓之5,臺北市中正區黎明里7鄰重慶南路一段57號,301799.252,2770817.981
