id,Address,Response_Address,Response_X,Response_Y
17477,臺北市中山區龍江路415巷48號1樓,臺北市中山區下埤里17鄰龍江路415巷48號,304814.137,2773233.682
17478,臺北市大安區忠孝東路4段112號10樓之6,臺北市大安區仁愛里11鄰忠孝東路四段112號,305180.833,2770469.812
17479,臺北市大安區臥龍街195巷39號3樓,臺北市大安區黎元里1鄰臥龍街195巷39號,305870.439,2767999.810
17480,臺北市大安區瑞安街244巷4號,臺北市大安區龍生里17鄰瑞安街244巷4號,304455.438,2768902.434
17481,臺北市信義區松信路98號1樓,臺北市信義區六藝里7鄰松信路98號,307713.169,2770836.450
17482,臺北市中山區復興北路514巷65號2樓,臺北市中山區下埤里14鄰復興北路514巷65號,304618.336,2773207.355
17483,臺北市信義區東興路63之1號2樓,臺北市信義區新仁里19鄰東興路63之1號,307225.792,2771143.851
17484,臺北市信義區基隆路2段23號9樓之3,臺北市信義區景聯里4鄰基隆路二段23號,306411.616,2769411.744
17485,臺北市內湖區瑞光路66巷23號5樓,臺北市內湖區湖元里18鄰瑞光路66巷23號,308678.055,2773661.246
17486,臺北市松山區南京東路4段45號3樓,臺北市松山區中華里11鄰南京東路四段45號,305569.753,2771639.044
17487,臺北市松山區塔悠路179號1樓,臺北市松山區新東里19鄰塔悠路179號,307486.726,2772137.337
17488,臺北市松山區復興南路1段45號6樓,臺北市松山區中崙里2鄰復興南路一段45號,304900.444,2770935.877
17489,臺北市大安區復興南路1段368號13樓,臺北市大安區和安里4鄰復興南路一段368號,304835.541,2769757.148
17490,臺北市大安區忠孝東路4段60號7樓,臺北市大安區仁愛里6鄰忠孝東路四段60號,305031.985,2770471.173
17491,臺北市中山區德惠街16號8樓之1,臺北市中山區晴光里14鄰德惠街16號,302867.162,2773259.876
17492,臺北市中正區忠孝東路2段33號,臺北市中正區梅花里12鄰忠孝東路二段33號,303276.568,2770738.904
17493,臺北市士林區後港街141號4樓之1,臺北市士林區前港里2鄰後港街141號,302628.336,2775511.485
17494,臺北市中山區中山北路3段27號10樓,臺北市中山區晴光里15鄰中山北路三段27號,302710.087,2773121.740
17495,臺北市中山區吉林路433巷31號1樓,臺北市中山區新喜里6鄰吉林路433巷31號,303698.406,2773306.708
17496,臺北市中山區雙城街49巷9-1號,臺北市中山區圓山里12鄰雙城街49巷9之1號,302942.566,2773412.048
17497,臺北市大同區承德路1段105號5樓,臺北市大同區建泰里14鄰承德路一段105號,302245.769,2771731.094
17498,臺北市士林區大南路419號8樓,臺北市士林區後港里21鄰大南路419號,302061.081,2775875.731
17499,臺北市中山區松江路158號3樓之1及之2,臺北市中山區中吉里10鄰松江路158號,303763.671,2771972.919
17500,臺北市大同區南京西路284之1號,臺北市大同區建功里3鄰南京西路284之1號,301918.401,2771827.513
17501,臺北市中山區林森北路85巷20號1樓,臺北市中山區正義里1鄰林森北路85巷20號,303029.397,2771375.048
17502,臺北市中正區南昌路2段112號6樓之7,臺北市中正區板溪里7鄰南昌路二段112號,302697.723,2768741.563
17503,臺北市中正區重慶南路1段57號13樓之13,臺北市中正區黎明里7鄰重慶南路一段57號,301799.252,2770817.981
17504,臺北市萬華區中華路1段68號2樓,臺北市萬華區福星里3鄰中華路一段68號,301357.233,2770970.952
17505,臺北市大安區光復南路412號2樓之3,臺北市大安區光信里3鄰光復南路412號,306246.413,2769953.053
17506,臺北市文山區汀州路4段57號地下1樓,臺北市文山區萬年里2鄰汀州路四段57號,304225.689,2766854.272
17507,臺北市中山區長安東路2段246號12樓(B室),臺北市中山區朱崙里15鄰長安東路二段246號,304800.834,2771223.557
17508,臺北市萬華區中華路2段336號5樓之34,臺北市萬華區新忠里4鄰中華路二段336號,300898.708,2769140.746
17509,臺北市內湖區陽光街383號6樓,臺北市內湖區湖元里8鄰陽光街383號,308143.365,2773958.801
17510,臺北市中正區水源路49之2號1樓,臺北市中正區林興里13鄰水源路49之2號,302822.510,2768047.827
17511,臺北市大同區南京西路41號,臺北市大同區光能里15鄰南京西路41號,302443.066,2771740.284
17512,臺北市中山區雙城街10巷13號6樓之2,臺北市中山區恆安里4鄰雙城街10巷13號,302868.556,2772992.204
17513,臺北市信義區光復南路495號1樓,臺北市信義區中興里2鄰光復南路495號,306298.666,2769488.833
17514,臺北市大安區延吉街131巷26號地下層,臺北市大安區華聲里16鄰延吉街131巷26號,306051.903,2770621.496
17515,臺北市大同區南京西路155巷9號4樓之1,臺北市大同區朝陽里12鄰南京西路155巷9號,301812.091,2771906.018
17516,臺北市大安區通化街165巷29號,臺北市大安區臨江里9鄰通化街165巷29號,305978.575,2769027.432
17517,臺北市南港區三重路19-13號3樓,臺北市南港區三重里25鄰三重路19之13號,311870.691,2772403.115
17518,臺北市大安區復興南路2段160巷4號1樓,臺北市大安區龍陣里10鄰復興南路二段160巷4號,304813.305,2768964.092
17519,臺北市中正區衡陽路51號14樓,臺北市中正區光復里8鄰衡陽路51號,301682.540,2770569.530
17520,臺北市大安區敦化南路2段59號8樓之2,臺北市大安區義安里9鄰敦化南路二段59號,305422.206,2769345.322
17521,臺北市信義區基隆路1段149號2樓之1,臺北市信義區興雅里6鄰基隆路一段149號,307067.554,2770610.978
17522,臺北市大安區仁愛路3段31巷11-10號6樓,臺北市大安區民輝里6鄰仁愛路三段31巷11之10號,303982.052,2770299.889
17523,臺北市中正區重慶南路1段13號8樓,臺北市中正區黎明里5鄰重慶南路一段13號,301800.851,2770982.241
17524,臺北市中山區明水路575號地下1層之2,臺北市中山區永安里16鄰明水路575號,305674.489,2774737.857
17525,臺北市大安區復興南路1段303號7樓,臺北市大安區仁慈里7鄰復興南路一段303號,304889.577,2769725.460
17526,臺北市內湖區成功路3段187巷3弄15號1樓,臺北市內湖區紫星里26鄰成功路三段187巷3弄15號,309598.290,2774760.403
17527,臺北市內湖區瑞光路550號7樓,臺北市內湖區西湖里13鄰瑞光路550號,307209.086,2774726.113
17528,臺北市南港區三重路19-11號5樓(南港軟體園區E棟),臺北市南港區三重里25鄰三重路19之11號,311922.558,2772402.483
17529,臺北市信義區松德路26號7樓,臺北市信義區廣居里29鄰松德路26號,308230.866,2770247.643
17530,臺北市信義區忠孝東路5段1-1號8樓,臺北市信義區興雅里1鄰忠孝東路五段1之1號,306998.790,2770483.453
17531,臺北市北投區懷德街105巷2號1樓,臺北市北投區振華里5鄰懷德街105巷2號,302424.002,2778651.752
17532,臺北市大安區和平東路3段63號4樓之5,臺北市大安區全安里1鄰和平東路三段63號,305424.484,2768626.223
17533,臺北市松山區南京東路3段305號6樓,臺北市松山區中正里24鄰南京東路三段305號,305171.906,2771646.720
17534,臺北市中山區新生北路2段108號8樓之10,臺北市中山區聚盛里15鄰新生北路二段108號,303196.635,2772534.781
17535,臺北市南港區三重路19之3號11樓,臺北市南港區三重里25鄰三重路19之3號,311835.501,2772182.452
17536,臺北市中正區寧波西街228號,臺北市中正區永功里8鄰寧波西街228號,301559.038,2768843.380
17537,臺北市中山區松江路512號5樓,臺北市中山區新喜里13鄰松江路512號,303777.603,2773196.834
17538,臺北市信義區松隆路314號,臺北市信義區四育里3鄰松隆路314號,308223.512,2771213.175
17539,臺北市中山區農安街8號6樓之11,臺北市中山區恆安里7鄰農安街8號,302798.152,2773061.402
17540,臺北市大安區信義路3段31巷26號,臺北市大安區民炤里5鄰信義路三段31巷26號,303953.798,2769874.470
17541,臺北市中山區吉林路315巷36號,臺北市中山區新福里7鄰吉林路315巷36號,303616.338,2772908.263
17542,臺北市松山區復興北路181號5樓之4,臺北市松山區松基里1鄰復興北路181號,304920.001,2771951.884
17543,臺北市信義區永吉路443巷9弄26號,臺北市信義區永吉里9鄰永吉路443巷9弄26號,308395.402,2771060.300
17544,臺北市中山區林森北路100號7樓之5,臺北市中山區正得里16鄰林森北路100號,302954.233,2771471.952
17545,臺北市中山區松江路122號7樓,臺北市中山區中吉里1鄰松江路122號,303759.904,2771679.162
17546,臺北市信義區信義路5段16號14樓之3,臺北市信義區景新里17鄰信義路五段16號,306810.381,2769517.205
17547,臺北市中山區南京東路2段28號3樓,臺北市中山區興亞里23鄰南京東路二段28號,303384.379,2771628.535
17548,臺北市中山區八德路2段260號9樓,臺北市中山區埤頭里10鄰八德路二段260號,304578.222,2771057.384
17549,臺北市萬華區環河南路3段325號6樓,臺北市萬華區華中里19鄰環河南路三段325號,299865.777,2767843.557
17550,臺北市士林區福志路14巷7弄5號4樓,臺北市士林區福志里17鄰福志路14巷7弄5號,303596.062,2776836.464
17551,臺北市大安區敦化南路2段164號10樓之3,臺北市大安區虎嘯里2鄰敦化南路二段164號,305338.795,2768595.280
17552,臺北市中山區松江路439號2樓,臺北市中山區行政里1鄰松江路439號,303825.458,2773217.023
17553,臺北市大安區忠孝東路3段303號6樓之9,臺北市大安區誠安里10鄰忠孝東路三段303號,304822.992,2770540.520
17554,臺北市大安區復興南路2段237號12樓之10,臺北市大安區群賢里2鄰復興南路二段237號,304871.110,2768750.522
17555,臺北市大同區南京西路344巷23號3樓之3,臺北市大同區朝陽里2鄰南京西路344巷23號,301680.179,2771763.721
17556,臺北市中山區松江路206號11樓之2,臺北市中山區中吉里21鄰松江路206號,303767.075,2772256.273
17557,臺北市南港區忠孝東路6段6號6樓之2,臺北市南港區萬福里5鄰忠孝東路六段6號,308858.018,2770917.087
17558,臺北市內湖區星雲街88巷9號,臺北市內湖區紫星里18鄰星雲街88巷9號,309819.196,2774611.788
17559,臺北市中山區龍江路394巷4號1樓,臺北市中山區行仁里23鄰龍江路394巷4號,304559.413,2773321.329
17560,臺北市大安區忠孝東路4段170巷6弄10號地下層,臺北市大安區建倫里20鄰忠孝東路四段170巷6弄10號,305527.512,2770404.133
17561,臺北市大安區復興南路1段135巷27號4樓之2,臺北市大安區光武里24鄰復興南路一段135巷27號,305043.769,2770626.107
17562,臺北市大同區重慶北路3段136巷17號5樓,臺北市大同區國慶里6鄰重慶北路三段136巷17號,301748.525,2773378.951
17563,臺北市內湖區文湖街60巷6號1樓,臺北市內湖區西康里17鄰文湖街60巷6號,306900.804,2775450.335
17564,臺北市北投區崇仁路1段176號3樓之3,臺北市北投區八仙里15鄰崇仁路一段176號,300677.580,2779464.851
17565,臺北市中山區建國北路2段9-2號3樓之6,臺北市中山區復華里16鄰建國北路二段9之2號,304207.977,2771804.596
17566,臺北市信義區大道路42巷20號1樓,臺北市信義區大道里9鄰大道路42巷20號,308648.336,2770488.249
17567,臺北市萬華區萬大路486巷3號,臺北市萬華區華中里9鄰萬大路486巷3號,300162.456,2768061.179
17568,臺北市文山區木柵路1段59巷11弄29號,臺北市文山區試院里21鄰木柵路一段59巷11弄29號,305256.179,2764614.222
17569,臺北市中山區松江路206號5樓,臺北市中山區中吉里21鄰松江路206號,303767.075,2772256.273
17570,臺北市中正區青島東路5號3樓之4,臺北市中正區幸福里1鄰青島東路5號,302673.882,2770747.073
17571,臺北市中山區松江路2號2樓之3,臺北市中山區興亞里1鄰松江路2號,303752.460,2771010.833
17572,臺北市松山區八德路3段155巷20弄15號1樓,臺北市松山區復勢里7鄰八德路三段155巷20弄15號,306123.028,2771347.423
17573,臺北市北投區知行路336號8樓之5,臺北市北投區關渡里24鄰知行路336號,297098.019,2779472.181
17574,臺北市中正區羅斯福路3段210巷8弄8號1樓,臺北市中正區文盛里3鄰羅斯福路三段210巷8弄8號,303407.858,2767890.214
17575,臺北市信義區基隆路1段159號18樓,臺北市信義區興雅里6鄰基隆路一段159號,307030.817,2770544.195
17576,臺北市中山區復興北路48號3樓,臺北市中山區力行里12鄰復興北路48號,304865.651,2771374.679
17577,臺北市大安區安和路1段70號5樓,臺北市大安區敦安里5鄰安和路一段70號,305739.225,2769806.773
17578,臺北市信義區松隆路69號4樓,臺北市信義區敦厚里13鄰松隆路69號,307447.497,2770881.616
17579,臺北市松山區民權東路3段142號8樓之1,臺北市松山區民有里32鄰民權東路三段142號,305172.534,2772725.699
17580,臺北市中正區中華路2段75巷8號,臺北市中正區愛國里10鄰中華路二段75巷8號,301093.776,2769597.680
17581,臺北市中山區長安東路2段81號12樓之3,臺北市中山區朱園里12鄰長安東路二段81號,303931.594,2771259.349
17582,臺北市中正區牯嶺街93號12樓,臺北市中正區板溪里14鄰牯嶺街93號,302382.423,2768777.820
17583,臺北市信義區東興路51號9樓,臺北市信義區新仁里19鄰東興路51號,307150.815,2771175.103
17584,臺北市大安區敦化南路2段57號6樓,臺北市大安區義安里9鄰敦化南路二段57號,305422.041,2769356.876
17585,臺北市中山區民生東路1段25號4樓之5,臺北市中山區聚盛里9鄰民生東路一段25號,302900.044,2772326.414
17586,臺北市中山區伊通街127-4號(1樓),臺北市中山區中央里13鄰伊通街127之4號,303972.264,2771892.651
17587,臺北市萬華區萬大路322巷28號,臺北市萬華區全德里7鄰萬大路322巷28號,300404.695,2768604.139
17588,臺北市松山區南京東路5段250巷36弄12號,臺北市松山區新聚里23鄰南京東路五段250巷36弄12號,307170.572,2771382.718
17589,臺北市信義區基隆路1段400號8樓之3,臺北市信義區中興里9鄰基隆路一段400號,306513.075,2769679.331
17590,臺北市中山區民權西路70號10樓之1,臺北市中山區集英里16鄰民權西路70號,302447.430,2772818.476
17591,臺北市南港區研究院路1段49號6樓之1,臺北市南港區新富里7鄰研究院路一段49號,312216.805,2771818.733
17592,臺北市大安區忠孝東路4段220號13樓,臺北市大安區車層里9鄰忠孝東路四段220號,305839.389,2770456.628
17593,臺北市中山區新生北路3段56巷1號5樓之13,臺北市中山區晴光里3鄰新生北路三段56巷1號,303197.778,2773123.700
17594,臺北市信義區松山路465巷27弄20號4樓,臺北市信義區松光里6鄰松山路465巷27弄20號,308423.521,2770412.781
17595,臺北市中山區松江路8號9樓之6,臺北市中山區興亞里1鄰松江路8號,303752.243,2771032.689
17596,臺北市松山區東興路26號14樓,臺北市松山區復盛里26鄰東興路26號,307057.511,2771281.300
17597,臺北市松山區市民大道4段151號3樓,臺北市松山區敦化里28鄰市民大道四段151號,305593.182,2770861.596
17598,臺北市大安區辛亥路2段171巷6弄8號1樓,臺北市大安區龍淵里22鄰辛亥路二段171巷6弄8號,304574.300,2768318.500
17599,臺北市士林區大東路90之2號3樓,臺北市士林區仁勇里12鄰大東路90之2號,303016.813,2776015.278
17600,臺北市文山區景福街123號,臺北市文山區景慶里13鄰景福街123號,304133.272,2765521.767
17601,臺北市內湖區文德路101巷3弄12號,臺北市內湖區紫陽里9鄰文德路101巷3弄12號,308893.297,2774668.248
17602,臺北市中山區南京西路1-1號10樓,臺北市中山區民安里10鄰南京西路1之1號,302649.929,2771697.985
17603,臺北市內湖區港墘路183號9樓,臺北市內湖區港墘里20鄰港墘路183號,308001.126,2774317.897
17604,臺北市中山區錦州街105號1樓,臺北市中山區新生里20鄰錦州街105號,303305.302,2772579.664
17605,臺北市中山區林森北路472號2樓之3,臺北市中山區聚葉里14鄰林森北路472號,303015.512,2772654.274
17606,臺北市信義區林口街54-4號1樓,臺北市信義區大仁里6鄰林口街54之4號,308481.655,2770164.041
17607,臺北市中山區南京東路2段97號6樓,臺北市中山區中吉里1鄰南京東路二段97號,303711.994,2771669.993
17608,臺北市松山區南京東路5段315號8樓之4,臺北市松山區安平里22鄰南京東路五段315號,307184.952,2771607.327
17609,臺北市文山區羅斯福路6段238號4樓,臺北市文山區景慶里3鄰羅斯福路六段238號,304548.190,2765032.153
17610,臺北市信義區忠孝東路5段552號10樓,臺北市信義區松光里10鄰忠孝東路五段552號,308529.607,2770542.644
17611,臺北市中山區長安東路2段77號7樓之1,臺北市中山區朱園里12鄰長安東路二段77號,303918.032,2771259.481
17612,臺北市中山區明水路413號1樓,臺北市中山區永安里29鄰明水路413號,305349.244,2774476.224
17613,臺北市中正區寧波西街82號,臺北市中正區南福里18鄰寧波西街82號,302078.666,2769188.863
17614,臺北市松山區三民路107巷12號4樓,臺北市松山區三民里7鄰三民路107巷12號,306794.273,2772288.525
17615,臺北市中山區錦州街194號1樓,臺北市中山區中庄里11鄰錦州街194號,303546.201,2772563.960
17616,臺北市中山區復興北路48號3樓,臺北市中山區力行里12鄰復興北路48號,304865.651,2771374.679
17617,臺北市中山區松江路70巷3號1樓,臺北市中山區興亞里14鄰松江路70巷3號,303735.278,2771362.850
17618,臺北市文山區樟新街32巷3號15樓,臺北市文山區樟新里8鄰樟新街32巷3號,306011.073,2763510.631
17619,臺北市大安區忠孝東路4段278號4樓,臺北市大安區正聲里1鄰忠孝東路四段278號,306024.772,2770453.860
17620,臺北市信義區吳興街281巷53號2樓,臺北市信義區三張里17鄰吳興街281巷53號,307080.545,2768838.899
17621,臺北市中山區德惠街153號1樓,臺北市中山區新喜里10鄰德惠街153號,303558.687,2773267.082
17622,臺北市中山區長安東路2段106號10樓之1,臺北市中山區朱園里7鄰長安東路二段106號,303998.878,2771236.174
17623,臺北市萬華區峨眉街100號5樓之14,臺北市萬華區西門里1鄰峨眉街100號,300796.105,2770775.144
17624,臺北市大安區復興南路2段151巷8號2樓之2,臺北市大安區群賢里3鄰復興南路二段151巷8號,304933.142,2769023.103
17625,臺北市大安區安和路1段35號2樓之2,臺北市大安區建倫里7鄰安和路一段35號,305585.512,2770189.781
17626,臺北市大安區敦化南路2段172巷5弄2號,臺北市大安區虎嘯里2鄰敦化南路二段172巷5弄2號,305279.481,2768562.176
17627,臺北市中山區長安東路2段81號12樓,臺北市中山區朱園里12鄰長安東路二段81號,303931.594,2771259.349
17628,臺北市信義區虎林街66巷12號1樓,臺北市信義區四維里3鄰虎林街66巷12號,308148.623,2770879.576
17629,臺北市中山區長安東路2段81號3樓之1,臺北市中山區朱園里12鄰長安東路二段81號,303931.594,2771259.349
17630,臺北市信義區基隆路1段141號12樓之4,臺北市信義區興雅里10鄰基隆路一段141號,307096.949,2770657.785
17631,臺北市萬華區萬大路277巷22弄20號,臺北市萬華區壽德里14鄰萬大路277巷22弄20號,300615.042,2768648.231
17632,臺北市大安區辛亥路2段43號18樓之1,臺北市大安區龍門里1鄰辛亥路二段43號,304134.493,2768412.403
17633,臺北市中山區南京東路3段189號8樓,臺北市中山區復華里11鄰南京東路三段189號,304710.237,2771656.457
17634,臺北市文山區木柵路1段191巷23號1樓,臺北市文山區華興里10鄰木柵路一段191巷23號,305638.712,2764701.982
17635,臺北市大安區安居街98巷4號,臺北市大安區黎元里11鄰安居街98巷4號,305770.090,2768012.961
17636,臺北市信義區基隆路2段51號14樓,臺北市信義區景聯里4鄰基隆路二段51號,306364.588,2769325.568
17637,臺北市中山區中山北路3段49號7樓之5,臺北市中山區圓山里13鄰中山北路三段49號,302731.696,2773294.319
17638,臺北市南港區三重路19之11號3樓,臺北市南港區三重里25鄰三重路19之11號,311922.558,2772402.483
17639,臺北市內湖區瑞光路468號12樓,臺北市內湖區港墘里20鄰瑞光路468號,307494.080,2774576.076
17640,臺北市中山區中山北路1段82號7樓,臺北市中山區民安里1鄰中山北路一段82號,302569.130,2771313.097
17641,臺北市中山區長安西路19巷2弄5號2樓,臺北市中山區民安里6鄰長安西路19巷2弄5號,302506.260,2771494.042
17642,臺北市松山區民生東路5段69巷21弄18之1號1樓,臺北市松山區東榮里23鄰民生東路五段69巷21弄18之1號,306223.947,2772537.310
17643,臺北市中正區忠孝東路2段80號12樓之3及12樓之5,臺北市中正區幸福里16鄰忠孝東路二段80號,303380.159,2770661.913
17644,臺北市大安區和平東路3段416巷28號1樓,臺北市大安區黎和里8鄰和平東路三段416巷28號,306327.616,2767879.909
17645,臺北市信義區忠孝東路5段510之2號,臺北市信義區松光里1鄰忠孝東路五段510之2號,308453.535,2770449.096
17646,臺北市信義區基隆路1段180號7樓,臺北市信義區新仁里18鄰基隆路一段180號,307005.454,2770586.763
17647,臺北市大同區重慶北路2段89號,臺北市大同區星明里16鄰重慶北路二段89號,301860.725,2772122.064
17648,臺北市北投區文林北路80巷59弄12號3樓之3,臺北市北投區建民里18鄰文林北路80巷59弄12號,302364.720,2777708.346
17649,臺北市信義區松德路65號11樓之1,臺北市信義區國業里3鄰松德路65號,308189.417,2770168.963
17650,臺北市大安區忠孝東路4段231號11樓之1,臺北市大安區車層里6鄰忠孝東路四段231號,305813.464,2770504.149
17651,臺北市士林區忠誠路2段140巷18弄2號2樓,臺北市士林區天福里3鄰忠誠路二段140巷18弄2號,303625.746,2778616.978
17652,臺北市中正區重慶南路1段57號13樓之4,臺北市中正區黎明里7鄰重慶南路一段57號,301799.252,2770817.981
17653,臺北市北投區公館路113號,找不到指定的門牌地址。,,
17654,臺北市大安區大安路1段176巷15號1樓,臺北市大安區仁慈里13鄰大安路一段176巷15號,304996.008,2769935.755
17655,臺北市中山區長安西路6號3樓,臺北市中山區民安里4鄰長安西路6號,302594.270,2771397.467
17656,臺北市松山區南京東路5段50號2樓之2,臺北市松山區吉祥里17鄰南京東路五段50號,306509.272,2771576.062
17657,臺北市大安區安東街45號9樓之7,臺北市大安區誠安里11鄰安東街45號,304749.817,2770709.630
17658,臺北市信義區基隆路1段159號13樓,臺北市信義區興雅里6鄰基隆路一段159號,307030.817,2770544.195
17659,臺北市北投區文林北路94巷34號,臺北市北投區建民里14鄰文林北路94巷34號,302295.105,2777660.674
17660,臺北市中山區新生北路3段7號12樓之5,臺北市中山區新福里20鄰新生北路三段7號,303268.244,2772902.627
17661,臺北市松山區復興北路191號16樓之6,臺北市松山區松基里1鄰復興北路191號,304920.364,2772007.103
17662,臺北市大安區和平東路1段177-4號7樓,臺北市大安區龍安里7鄰和平東路一段177之4號,303725.591,2768816.460
17663,臺北市內湖區金龍路19號1樓,臺北市內湖區金龍里5鄰金龍路19號,309977.863,2775297.353
17664,臺北市內湖區民權東路6段180巷6號8樓之2,臺北市內湖區寶湖里13鄰民權東路六段180巷6號,309789.618,2773462.164
17665,臺北市中正區南昌路2段206號8樓之3,臺北市中正區頂東里7鄰南昌路二段206號,302913.990,2768542.318
17666,臺北市松山區南京東路4段186號13樓之9,臺北市松山區復勢里21鄰南京東路四段186號,306249.124,2771582.009
17667,臺北市南港區三重路66號15樓,臺北市南港區三重里13鄰三重路66號,311989.734,2772260.389
17668,臺北市大同區延平北路1段51號10樓之27,臺北市大同區建功里8鄰延平北路一段51號,301667.733,2771516.245
17669,臺北市士林區劍潭路55巷20號,臺北市士林區前港里4鄰劍潭路55巷20號,302597.385,2775237.143
17670,臺北市內湖區港墘路127巷20號,臺北市內湖區港墘里2鄰港墘路127巷20號,308230.259,2774508.019
17671,臺北市大安區新生南路3段8號2樓,臺北市大安區龍坡里2鄰新生南路三段8號,303944.850,2768678.839
17672,臺北市大安區新生南路3段11巷7之1號,臺北市大安區龍門里7鄰新生南路三段11巷7之1號,304103.801,2768694.537
17673,臺北市中正區羅斯福路3段92號3樓,臺北市中正區頂東里2鄰羅斯福路三段92號,303157.972,2768278.767
17674,臺北市大安區和平東路2段50、52號,臺北市大安區龍門里7鄰和平東路二段18之1號,304097.058,2768729.866
17675,臺北市士林區重慶北路4段56號2樓,臺北市士林區福順里4鄰重慶北路四段56號,301774.548,2774905.786
17676,臺北市大安區敦化南路2段81巷20號,臺北市大安區義安里16鄰敦化南路二段81巷20號,305513.490,2769198.128
17677,臺北市大安區忠孝東路3段136號4樓之5,臺北市大安區義村里16鄰忠孝東路三段136號,304267.084,2770482.318
17678,臺北市中正區北平東路16號7樓之2,臺北市中正區梅花里4鄰北平東路16號,302936.563,2770976.051
17679,臺北市大安區復興南路1段76號8樓之2,臺北市大安區誠安里16鄰復興南路一段76號,304852.104,2770749.672
17680,臺北市大安區忠孝東路4段325號12樓之1,臺北市大安區華聲里10鄰忠孝東路四段325號,306137.331,2770499.177
