"id","Address","Response_Address","Response_X","Response_Y"
"2486","臺北市中山區雙城街19巷8號",,,
"2487","臺北市中山區雙城街28巷12號",,,
"2488","臺北市中山區雙城街2之1號",,,
"2489","臺北市中正區?門街81巷15號",,,
"2490","臺北市中正區?門街89之2號",,,
"2491","臺北市中正區中山北路一段2號",,,
"2492","臺北市中正區中華路一段29之1號",,,
"2493","臺北市中正區中華路二段111之1號",,,
"2494","臺北市中正區中華路二段311巷31號",,,
"2495","臺北市中正區中華路二段313巷16號",,,
"2496","臺北市中正區中華路二段315巷1號",,,
"2497","臺北市中正區中華路二段337號",,,
"2498","臺北市中正區中華路二段415號",,,
"2499","臺北市中正區中華路二段451號",,,
"2500","臺北市中正區仁愛路一段6號",,,
"2501","臺北市中正區公園路32號",,,
"2502","臺北市中正區公園路38號",,,
"2503","臺北市中正區水源路49號",,,
"2504","臺北市中正區汀州路一段205號",,,
"2505","臺北市中正區汀州路一段226巷12號",,,
"2506","臺北市中正區汀州路一段252巷9號",,,
"2507","臺北市中正區汀州路一段306巷14號",,,
"2508","臺北市中正區汀州路二段38號",,,
"2509","臺北市中正區汀州路三段113號",,,
"2510","臺北市中正區汀州路三段116號",,,
"2511","臺北市中正區汀州路三段124號",,,
"2512","臺北市中正區汀州路三段146號",,,
"2513","臺北市中正區汀州路三段162號",,,
"2514","臺北市中正區汀州路三段188號",,,
"2515","臺北市中正區汀州路三段249號",,,
"2516","臺北市中正區汀洲路一段92巷37號",,,
"2517","臺北市中正區沅陵街15號",,,
"2518","臺北市中正區辛亥路一段5號",,,
"2519","臺北市中正區和平西路一段142號",,,
"2520","臺北市中正區和平西路二段58之1號",,,
"2521","臺北市中正區延平南路12號",,,
"2522","臺北市中正區延平南路60號",,,
"2523","臺北市中正區延平南路83號",,,
"2524","臺北市中正區延平南路97號",,,
"2525","臺北市中正區忠孝西路一段23號",,,
"2526","臺北市中正區忠孝西路一段29巷3號",,,
"2527","臺北市中正區忠孝西路一段29巷9號",,,
"2528","臺北市中正區忠孝西路一段50號",,,
"2529","臺北市中正區忠孝東路一段15號",,,
"2530","臺北市中正區忠孝東路二段52號",,,
"2531","臺北市中正區杭州南路一段63之21號",,,
"2532","臺北市中正區武昌街一段16巷14號",,,
"2533","臺北市中正區武昌街一段16巷17號",,,
"2534","臺北市中正區金山南路一段102號",,,
"2535","臺北市中正區金華街24之1號",,,
"2536","臺北市中正區金華街43巷7號",,,
"2537","臺北市中正區青島東路4之7號",,,
"2538","臺北市中正區青島東路5號",,,
"2539","臺北市中正區信陽街11號",,,
"2540","臺北市中正區信陽街31號",,,
"2541","臺北市中正區信陽街5之1號",,,
"2542","臺北市中正區信陽街9號",,,
"2543","臺北市中正區信義路二段257號",,,
"2544","臺北市中正區信義路二段59號",,,
"2545","臺北市中正區信義路二段85號",,,
"2546","臺北市中正區信義路二段91號",,,
"2547","臺北市中正區南昌路一段163號",,,
"2548","臺北市中正區南昌路一段20號",,,
"2549","臺北市中正區南昌路一段31巷18號",,,
"2550","臺北市中正區南昌路一段65號",,,
"2551","臺北市中正區南昌路一段66之1號",,,
"2552","臺北市中正區南昌路一段67號",,,
"2553","臺北市中正區南昌路二段207之1號",,,
"2554","臺北市中正區南昌路二段26號",,,
"2555","臺北市中正區南昌路二段70號",,,
"2556","臺北市中正區牯嶺街40號",,,
"2557","臺北市中正區牯嶺街50號",,,
"2558","臺北市中正區重慶南路1段13號1樓、開封街一段13號",,,
"2559","臺北市中正區重慶南路一段57號",,,
"2560","臺北市中正區重慶南路一段61號",,,
"2561","臺北市中正區重慶南路一段83號",,,
"2562","臺北市中正區重慶南路一段88號",,,
"2563","臺北市中正區重慶南路一段99號",,,
"2564","臺北市中正區重慶南路二段73號",,,
"2565","臺北市中正區重慶南路二段82號",,,
"2566","臺北市中正區師大路166號",,,
"2567","臺北市中正區師大路210號",,,
"2568","臺北市中正區師大路212號",,,
"2569","臺北市中正區晉江街46之3號",,,
"2570","臺北市中正區紹興北街31巷6號",,,
"2571","臺北市中正區許昌街12號",,,
"2572","臺北市中正區許昌街17之1號",,,
"2573","臺北市中正區連雲街75號",,,
"2574","臺北市中正區博愛路122號",,,
"2575","臺北市中正區博愛路130號",,,
"2576","臺北市中正區博愛路1巷1號",,,
"2577","臺北市中正區博愛路9號",,,
"2578","臺北市中正區詔安街50巷1弄7號",,,
"2579","臺北市中正區詔安街73號",,,
"2580","臺北市中正區開封街一段27號",,,
"2581","臺北市中正區廈門街113巷10之5號",,,
"2582","臺北市中正區新生南路一段56巷8號",,,
"2583","臺北市中正區新生南路一段6號",,,
"2584","臺北市中正區寧波西街14號",,,
"2585","臺北市中正區寧波西街21號",,,
"2586","臺北市中正區寧波東街24巷8號",,,
"2587","臺北市中正區漢口街一段103號",,,
"2588","臺北市中正區漢口街一段12號",,,
"2589","臺北市中正區漢口街一段132號",,,
"2590","臺北市中正區衡陽路112號",,,
"2591","臺北市中正區衡陽路25號",,,
"2592","臺北市中正區衡陽路84號",,,
"2593","臺北市中正區館前路18號",,,
"2594","臺北市中正區館前路6號",,,
"2595","臺北市中正區濟南路二段65號",,,
"2596","臺北市中正區臨沂街3巷15號",,,
"2597","臺北市中正區臨沂街57巷44號",,,
"2598","臺北市中正區襄陽路3號",,,
"2599","臺北市中正區鎮江街3號",,,
"2600","臺北市中正區懷寧街16號",,,
"2601","臺北市中正區羅斯福路一段30號",,,
"2602","臺北市中正區羅斯福路一段57號",,,
"2603","臺北市中正區羅斯福路一段66號",,,
"2604","臺北市中正區羅斯福路一段85號",,,
"2605","臺北市中正區羅斯福路二段120號",,,
"2606","臺北市中正區羅斯福路二段126號",,,
"2607","臺北市中正區羅斯福路二段56號",,,
"2608","臺北市中正區羅斯福路二段66巷2號",,,
"2609","臺北市中正區羅斯福路二段7之2號",,,
"2610","臺北市中正區羅斯福路三段14號",,,
"2611","臺北市中正區羅斯福路三段244巷10弄16號",,,
"2612","臺北市中正區羅斯福路三段284巷9號",,,
"2613","臺北市中正區羅斯福路三段316巷16號",,,
"2614","臺北市中正區羅斯福路四段126號",,,
"2615","臺北市中正區羅斯福路四段136巷1弄5號",,,
"2616","臺北市中正區羅斯福路四段44號",,,
"2617","臺北市中正區羅斯福路四段48號",,,
"2618","臺北市中正區羅斯福路四段50號",,,
"2619","臺北市中正區羅斯福路四段68號",,,
"2620","臺北市中正區羅斯福路四段72之1號",,,
"2621","臺北市中正區羅斯褔路三段316巷7之1號",,,
"2622","臺北市內湖區大湖山莊街176巷18號",,,
"2623","臺北市內湖區大湖山莊街219巷34弄1號",,,
"2624","臺北市內湖區大湖山莊街223號",,,
"2625","臺北市內湖區大湖街131巷57號",,,
"2626","臺北市內湖區大湖街160巷32號",,,
"2627","臺北市內湖區五分街23號",,,
"2628","臺北市內湖區五分街37號",,,
"2629","臺北市內湖區五分街97號",,,
"2630","臺北市內湖區內湖路一段285巷31號",,,
"2631","臺北市內湖區內湖路一段285巷65弄14號",,,
"2632","臺北市內湖區內湖路一段285號",,,
"2633","臺北市內湖區內湖路一段323巷15弄1號",,,
"2634","臺北市內湖區內湖路一段323巷4弄13號",,,
"2635","臺北市內湖區內湖路一段411巷12之3號",,,
"2636","臺北市內湖區內湖路一段47巷2號",,,
"2637","臺北市內湖區內湖路一段591巷10弄2號",,,
"2638","臺北市內湖區內湖路一段591巷16弄1號",,,
"2639","臺北市內湖區內湖路一段629巷33弄1號",,,
"2640","臺北市內湖區內湖路一段699號",,,
"2641","臺北市內湖區內湖路一段705號",,,
"2642","臺北市內湖區內湖路一段737巷25號",,,
"2643","臺北市內湖區內湖路一段737巷4號",,,
"2644","臺北市內湖區內湖路一段737巷51弄18號",,,
"2645","臺北市內湖區內湖路一段737巷78號",,,
"2646","臺北市內湖區內湖路一段737巷90號",,,
"2647","臺北市內湖區內湖路一段737巷91號",,,
"2648","臺北市內湖區內湖路二段150之1號",,,
"2649","臺北市內湖區內湖路二段179巷48弄42號",,,
"2650","臺北市內湖區內湖路二段263巷9弄7號",,,
"2651","臺北市內湖區內湖路二段309號",,,
"2652","臺北市內湖區內湖路二段322號",,,
"2653","臺北市內湖區內湖路二段376巷12號",,,
"2654","臺北市內湖區內湖路二段462號",,,
"2655","臺北市內湖區內湖路二段484號",,,
"2656","臺北市內湖區內湖路三段143巷27號",,,
"2657","臺北市內湖區內湖路三段343巷3弄1號",,,
"2658","臺北市內湖區文德街157號",,,
"2659","臺北市內湖區文德路10號",,,
"2660","臺北市內湖區文德路12號",,,
"2661","臺北市內湖區文德路210巷30弄6號",,,
"2662","臺北市內湖區文德路210巷30弄94號",,,
"2663","臺北市內湖區文德路22巷27弄4號",,,
"2664","臺北市內湖區文德路22巷27弄5號",,,
"2665","臺北市內湖區文德路22巷53弄25號",,,
"2666","臺北市內湖區文德路22巷9弄72號",,,
"2667","臺北市內湖區文德路6號",,,
"2668","臺北市內湖區民權東路六段123巷34弄7號",,,
"2669","臺北市內湖區民權東路六段132號",,,
"2670","臺北市內湖區民權東路六段296巷109之1號",,,
"2671","臺北市內湖區民權東路六段296巷48號",,,
"2672","臺北市內湖區民權東路六段296巷67號",,,
"2673","臺北市內湖區民權東路六段326號",,,
"2674","臺北市內湖區石潭路27號",,,
"2675","臺北市內湖區安康路263號",,,
"2676","臺北市內湖區安康路468號",,,
"2677","臺北市內湖區成功路二段426巷3號",,,
"2678","臺北市內湖區成功路三段127號",,,
"2679","臺北市內湖區成功路三段166號",,,
"2680","臺北市內湖區成功路三段172之2號",,,
"2681","臺北市內湖區成功路三段81號",,,
"2682","臺北市內湖區成功路五段420巷3號",,,
"2683","臺北市內湖區成功路五段442之1號",,,
"2684","臺北市內湖區成功路五段460號",,,
"2685","臺北市內湖區成功路五段59號",,,
"2686","臺北市內湖區成功路四段12號",,,
"2687","臺北市內湖區成功路四段145號",,,
"2688","臺北市內湖區成功路四段167巷16號",,,
"2689","臺北市內湖區成功路四段182巷6弄33號",,,
"2690","臺北市內湖區成功路四段182巷6弄37號",,,
"2691","臺北市內湖區成功路四段182巷6弄39號",,,
"2692","臺北市內湖區成功路四段214巷3弄1號",,,
"2693","臺北市內湖區成功路四段30巷14號",,,
"2694","臺北市內湖區成功路四段30巷16號",,,
"2695","臺北市內湖區成功路四段30巷21號",,,
"2696","臺北市內湖區成功路四段30巷24號",,,
"2697","臺北市內湖區成功路四段30巷34號",,,
"2698","臺北市內湖區成功路四段30巷38號",,,
"2699","臺北市內湖區成功路四段30巷7號",,,
"2700","臺北市內湖區成功路四段323巷14弄5號",,,
"2701","臺北市內湖區成功路四段325號",,,
"2702","臺北市內湖區成功路四段328號",,,
"2703","臺北市內湖區成功路四段330號",,,
"2704","臺北市內湖區成功路四段34號",,,
"2705","臺北市內湖區成功路四段41巷2號",,,
"2706","臺北市內湖區成功路四段53號",,,
"2707","臺北市內湖區成功路四段56號",,,
"2708","臺北市內湖區成功路四段61巷22號",,,
"2709","臺北市內湖區成功路四段61巷25弄2號",,,
"2710","臺北市內湖區成功路四段61巷26號",,,
"2711","臺北市內湖區成功路四段65號",,,
"2712","臺北市內湖區成功路四段68號",,,
"2713","臺北市內湖區江南街10號",,,
"2714","臺北市內湖區江南街117巷8弄19號",,,
"2715","臺北市內湖區江南街65巷12號",,,
"2716","臺北市內湖區江南街65巷33號",,,
"2717","臺北市內湖區江南街71巷16弄48號",,,
"2718","臺北市內湖區江南街71巷47號",,,
"2719","臺北市內湖區江南街85號",,,
"2720","臺北市內湖區行善路25巷8弄8號",,,
"2721","臺北市內湖區行善路45號",,,
"2722","臺北市內湖區東湖里康樂街72巷17弄8號",,,
"2723","臺北市內湖區東湖路106巷7弄42號",,,
"2724","臺北市內湖區東湖路106巷8號",,,
"2725","臺北市內湖區東湖路113巷95弄135號",,,
"2726","臺北市內湖區東湖路119巷49弄16號",,,
"2727","臺北市內湖區東湖路142號",,,
"2728","臺北市內湖區東湖路16巷6之1號",,,
"2729","臺北市內湖區東湖路94巷4號",,,
"2730","臺北市內湖區金湖路31號",,,
"2731","臺北市內湖區金湖路328之6號",,,
"2732","臺北市內湖區金湖路352之1號",,,
"2733","臺北市內湖區金湖路352號",,,
"2734","臺北市內湖區金湖路363巷67弄21號",,,
"2735","臺北市內湖區金龍路118號",,,
"2736","臺北市內湖區金龍路11號",,,
"2737","臺北市內湖區金龍路13巷8弄3號",,,
"2738","臺北市內湖區金龍路61之1號",,,
"2739","臺北市內湖區金龍路81號",,,
"2740","臺北市內湖區南京東路六段350之2號",,,
"2741","臺北市內湖區星雲街138巷20號",,,
"2742","臺北市內湖區星雲街150巷22號",,,
"2743","臺北市內湖區星雲街168巷35號",,,
"2744","臺北市內湖區星雲街55號",,,
"2745","臺北市內湖區洲子街181號",,,
"2746","臺北市內湖區康寧路一段139號",,,
"2747","臺北市內湖區康寧路一段157號",,,
"2748","臺北市內湖區康寧路一段174號",,,
"2749","臺北市內湖區康寧路一段214巷12號",,,
"2750","臺北市內湖區康寧路一段47巷1號",,,
"2751","臺北市內湖區康寧路三段165巷30號",,,
"2752","臺北市內湖區康寧路三段16巷130號",,,
"2753","臺北市內湖區康寧路三段189巷11弄12號",,,
"2754","臺北市內湖區康寧路三段189巷11弄5號",,,
"2755","臺北市內湖區康寧路三段189巷21弄2之1號",,,
"2756","臺北市內湖區康寧路三段189巷73弄1號",,,
"2757","臺北市內湖區康寧路三段189巷77號",,,
"2758","臺北市內湖區康寧路三段56巷17號",,,
"2759","臺北市內湖區康寧路三段72號",,,
"2760","臺北市內湖區康寧路三段75巷114號",,,
"2761","臺北市內湖區康寧路三段75巷175弄2之7號",,,
"2762","臺北市內湖區康寧路三段99巷2號",,,
"2763","臺北市內湖區康樂街48巷31號",,,
"2764","臺北市內湖區康樂街76巷1號",,,
"2765","臺北市內湖區康樂街88號",,,
"2766","臺北市內湖區港墘路17號",,,
"2767","臺北市內湖區港墘路36號",,,
"2768","臺北市內湖區港墘路37巷7號",,,
"2769","臺北市內湖區港墘路82巷3號",,,
"2770","臺北市內湖區陽光街285巷3號",,,
"2771","臺北市內湖區陽光街92巷24弄17號",,,
"2772","臺北市內湖區新明路445號",,,
"2773","臺北市內湖區新明路460巷30號",,,
"2774","臺北市內湖區新明路498巷14弄11號",,,
"2775","臺北市內湖區新湖二路19號",,,
"2776","臺北市內湖區瑞光路106號",,,
"2777","臺北市內湖區瑞光路76巷65號",,,
"2778","臺北市內湖區環山路一段41號",,,
"2779","臺北市內湖區環山路一段67號",,,
"2780","臺北市內湖區環山路二段109巷6弄7號",,,
"2781","臺北市內湖區環山路二段97號",,,
"2782","臺北市內湖區舊宗路一段128號",,,
"2783","臺北市內湖區麗山里內湖路一段387巷3弄2之2號",,,
"2784","臺北市內湖區麗山街348巷6號",,,
"2785","臺北市內湖區麗山街67號",,,
"2786","臺北市文山區下崙路11巷20號",,,
"2787","臺北市文山區下崙路28巷5號",,,
"2788","臺北市文山區久康街72巷3號",,,
"2789","臺北市文山區木柵路一段35號",,,
"2790","臺北市文山區木柵路一段59巷11弄5號",,,
"2791","臺北市文山區木柵路二段172號",,,
"2792","臺北市文山區木柵路三段116號",,,
"2793","臺北市文山區木柵路三段140號",,,
"2794","臺北市文山區木柵路三段14號",,,
"2795","臺北市文山區木柵路三段65號",,,
"2796","臺北市文山區木柵路四段25號",,,
"2797","臺北市文山區木新路二段190號",,,
"2798","臺北市文山區木新路二段193號",,,
"2799","臺北市文山區木新路三段111號",,,
"2800","臺北市文山區木新路三段188號",,,
"2801","臺北市文山區木新路三段195號",,,
"2802","臺北市文山區木新路三段210號",,,
"2803","臺北市文山區木新路三段306號",,,
"2804","臺北市文山區木新路三段328號",,,
"2805","臺北市文山區仙岩路66號",,,
"2806","臺北市文山區汀州路四段140巷2弄2號",,,
"2807","臺北市文山區光輝路112巷18號",,,
"2808","臺北市文山區光輝路71巷5弄5號",,,
"2809","臺北市文山區秀明路二段92巷10號",,,
"2810","臺北市文山區育英街11之6號",,,
"2811","臺北市文山區車前路8號",,,
"2812","臺北市文山區辛亥路七段65巷7號",,,
"2813","臺北市文山區辛亥路五段110號",,,
"2814","臺北市文山區辛亥路五段124巷12號",,,
"2815","臺北市文山區辛亥路五段33號",,,
"2816","臺北市文山區忠順街一段131號",,,
"2817","臺北市文山區忠順街一段26巷26弄1號",,,
"2818","臺北市文山區忠順街一段26巷34號",,,
"2819","臺北市文山區忠順街一段26巷3弄6號",,,
"2820","臺北市文山區忠順街二段25號",,,
"2821","臺北市文山區忠順街二段30號",,,
"2822","臺北市文山區指南路一段42之1號",,,
"2823","臺北市文山區指南路三段71號",,,
"2824","臺北市文山區政大三街117號",,,
"2825","臺北市文山區景文街42號",,,
"2826","臺北市文山區景文街54號",,,
"2827","臺北市文山區景文街64號",,,
"2828","臺北市文山區景文街90巷3號",,,
"2829","臺北市文山區景文街92號",,,
"2830","臺北市文山區景美街28號",,,
"2831","臺北市文山區景美街57之2號",,,
"2832","臺北市文山區景美街97號",,,
"2833","臺北市文山區景華街102號",,,
"2834","臺北市文山區景華街128巷3弄5號",,,
"2835","臺北市文山區景華街172號",,,
"2836","臺北市文山區景華街94之2號",,,
"2837","臺北市文山區景福街3巷15號",,,
"2838","臺北市文山區景興路181號",,,
"2839","臺北市文山區景興路21號",,,
"2840","臺北市文山區景興路23巷6弄14號",,,
"2841","臺北市文山區景興路262號",,,
"2842","臺北市文山區景興路282巷9號",,,
"2843","臺北市文山區景興路39之2號",,,
"2844","臺北市文山區景興路42巷4之8號",,,
"2845","臺北市文山區景興路71號",,,
"2846","臺北市文山區開元街30號",,,
"2847","臺北市文山區新光路一段152號",,,
"2848","臺北市文山區萬盛街124號",,,
"2849","臺北市文山區萬寧街129號",,,
"2850","臺北市文山區福興路63巷4弄16號",,,
"2851","臺北市文山區福興路78巷1弄12號",,,
"2852","臺北市文山區樟新街32巷6號",,,
"2853","臺北市文山區興隆路一段142號",,,
"2854","臺北市文山區興隆路一段145號",,,
"2855","臺北市文山區興隆路一段251巷6號",,,
"2856","臺北市文山區興隆路二段149號",,,
"2857","臺北市文山區興隆路二段14號",,,
"2858","臺北市文山區興隆路二段193號",,,
"2859","臺北市文山區興隆路二段196號",,,
"2860","臺北市文山區興隆路二段293號",,,
"2861","臺北市文山區興隆路二段297號",,,
"2862","臺北市文山區興隆路二段309號",,,
"2863","臺北市文山區興隆路二段331號",,,
"2864","臺北市文山區興隆路三段207巷5弄1號",,,
"2865","臺北市文山區興隆路三段7號",,,
"2866","臺北市文山區興隆路三段81號",,,
"2867","臺北市文山區興隆路三段84號",,,
"2868","臺北市文山區興隆路四段105巷27號",,,
"2869","臺北市文山區興隆路四段105巷29號",,,
"2870","臺北市文山區興隆路四段106號",,,
"2871","臺北市文山區興隆路四段132號",,,
"2872","臺北市文山區興隆路四段157之1號",,,
"2873","臺北市文山區興隆路四段165巷39號",,,
"2874","臺北市文山區興隆路四段213巷1號",,,
"2875","臺北市文山區興隆路四段29巷3弄9之1號",,,
"2876","臺北市文山區興隆路四段60號",,,
"2877","臺北市文山區興隆路四段8巷5號",,,
"2878","臺北市文山區羅斯福路五段181號",,,
"2879","臺北市文山區羅斯福路五段190之3號",,,
"2880","臺北市文山區羅斯福路五段214號",,,
"2881","臺北市文山區羅斯福路五段216之1號",,,
"2882","臺北市文山區羅斯福路五段218巷34號",,,
"2883","臺北市文山區羅斯福路五段228號",,,
"2884","臺北市文山區羅斯福路五段269巷15號",,,
"2885","臺北市文山區羅斯福路六段106號",,,
"2886","臺北市文山區羅斯福路六段190號",,,
"2887","臺北市文山區羅斯福路六段242號",,,
"2888","臺北市文山區羅斯福路六段247號",,,
"2889","臺北市文山區羅斯福路六段266號",,,
"2890","臺北市文山區羅斯福路六段274號",,,
"2891","臺北市文山區羅斯福路六段315號",,,
"2892","臺北市文山區羅斯福路六段403號",,,
"2893","臺北市北投區三合街二段434號",,,
"2894","臺北市北投區三合街二段440號",,,
"2895","臺北市北投區大度路三段211號",,,
"2896","臺北市北投區大業路280巷9弄9之1號",,,
"2897","臺北市北投區大業路529之1號",,,
"2898","臺北市北投區大業路572號",,,
"2899","臺北市北投區大興街137號",,,
"2900","臺北市北投區大興街23巷17號",,,
"2901","臺北市北投區中央北路一段133號",,,
"2902","臺北市北投區中央北路二段39號",,,
"2903","臺北市北投區中央北路三段17之1號",,,
"2904","臺北市北投區中央北路三段40巷34弄1號",,,
"2905","臺北市北投區中央北路三段40巷40號",,,
"2906","臺北市北投區中央北路三段40巷4號",,,
"2907","臺北市北投區中央北路四段473號",,,
"2908","臺北市北投區中央南路一段139號",,,
"2909","臺北市北投區中央南路一段16號",,,
"2910","臺北市北投區中央南路一段190號",,,
"2911","臺北市北投區中央南路一段25巷4號",,,
"2912","臺北市北投區中正街6號",,,
"2913","臺北市北投區中正街71號",,,
"2914","臺北市北投區中和街226號",,,
"2915","臺北市北投區中和街234巷1號",,,
"2916","臺北市北投區中和街253號",,,
"2917","臺北市北投區中和街267號",,,
"2918","臺北市北投區中和街273號",,,
"2919","臺北市北投區中和街278號",,,
"2920","臺北市北投區中和街28號",,,
"2921","臺北市北投區中和街310號",,,
"2922","臺北市北投區中和街35號",,,
"2923","臺北市北投區中和街365號",,,
"2924","臺北市北投區公館路249號",,,
"2925","臺北市北投區公館路340巷8號",,,
"2926","臺北市北投區天母西路132之3號",,,
"2927","臺北市北投區天母西路132之6號",,,
"2928","臺北市北投區文林北路276號",,,
"2929","臺北市北投區文林北路50號",,,
"2930","臺北市北投區北投路一段47號",,,
"2931","臺北市北投區石牌路一段166巷100號",,,
"2932","臺北市北投區石牌路一段29號",,,
"2933","臺北市北投區石牌路一段39巷80弄41號",,,
"2934","臺北市北投區石牌路二段122號",,,
"2935","臺北市北投區石牌路二段48號",,,
"2936","臺北市北投區石牌路二段68巷14號",,,
"2937","臺北市北投區石牌路二段68巷1號",,,
"2938","臺北市北投區石牌路二段8號",,,
"2939","臺北市北投區石牌路二段99巷7號",,,
"2940","臺北市北投區立農街一段279巷5號",,,
"2941","臺北市北投區光明路116號",,,
"2942","臺北市北投區光明路170號",,,
"2943","臺北市北投區光明路26號",,,
"2944","臺北市北投區光明路2巷13之5號",,,
"2945","臺北市北投區光明路84號",,,
"2946","臺北市北投區光明路新生巷14號",,,
"2947","臺北市北投區光明路新生巷20號",,,
"2948","臺北市北投區吉利街106巷1號",,,
"2949","臺北市北投區竹子湖路55之15號",,,
"2950","臺北市北投區自強街125號",,,
"2951","臺北市北投區自強街85號",,,
"2952","臺北市北投區自強街87號",,,
"2953","臺北市北投區西安街二段225號",,,
"2954","臺北市北投區西安街二段237號",,,
"2955","臺北市北投區承德路七段292號",,,
"2956","臺北市北投區承德路七段342巷14號",,,
"2957","臺北市北投區明德路116號",,,
"2958","臺北市北投區明德路157之2號",,,
"2959","臺北市北投區明德路335巷5號",,,
"2960","臺北市北投區東華街一段392號",,,
"2961","臺北市北投區東華街一段52號",,,
"2962","臺北市北投區東華街二段166號",,,
"2963","臺北市北投區知行路216號",,,
"2964","臺北市北投區知行路273之1號",,,
"2965","臺北市北投區知行路277號",,,
"2966","臺北市北投區知行路293巷9弄17號",,,
"2967","臺北市北投區長壽路19號",,,
"2968","臺北市北投區泉源路12號",,,
"2969","臺北市北投區致遠一路一段137號",,,
"2970","臺北市北投區致遠二路102號",,,
"2971","臺北市北投區致遠二路93號",,,
"2972","臺北市北投區振興街31號",,,
"2973","臺北市北投區崗山路18號",,,
"2974","臺北市北投區清江路14號",,,
"2975","臺北市北投區清江路68號",,,
"2976","臺北市北投區富貴一路1號",,,
"2977","臺北市北投區富貴一路5巷12號",,,
"2978","臺北市北投區尊賢街230巷12號",,,
"2979","臺北市北投區尊賢街247之6號",,,
"2980","臺北市北投區尊賢街264巷16之1號",,,
"2981","臺北市北投區尊賢街302巷11號",,,
