"id","Address","Response_Address","Response_X","Response_Y"
"4980","臺北市大同區承德路一段77巷17號",,,
"4981","臺北市大同區承德路二段173號",,,
"4982","臺北市大同區承德路二段175巷3號",,,
"4983","臺北市大同區承德路二段1巷27號",,,
"4984","臺北市大同區承德路二段38號",,,
"4985","臺北市大同區承德路二段81號",,,
"4986","臺北市大同區承德路三段122巷15號",,,
"4987","臺北市大同區承德路三段172號",,,
"4988","臺北市大同區承德路三段191巷9號",,,
"4989","臺北市大同區承德路三段230號",,,
"4990","臺北市大同區承德路三段31號",,,
"4991","臺北市大同區承德路三段51巷7號",,,
"4992","臺北市大同區昌吉街36號",,,
"4993","臺北市大同區昌吉街39號",,,
"4994","臺北市大同區昌吉街61巷27號",,,
"4995","臺北市大同區長安西路101號",,,
"4996","臺北市大同區長安西路140之2號",,,
"4997","臺北市大同區長安西路220巷24號",,,
"4998","臺北市大同區長安西路238號",,,
"4999","臺北市大同區長安西路247號",,,
"5000","臺北市大同區長安西路254號",,,
"5001","臺北市大同區長安西路303之1號",,,
"5002","臺北市大同區長安西路338之3號",,,
"5003","臺北市大同區保安街36號",,,
"5004","臺北市大同區南京西路103之1號",,,
"5005","臺北市大同區南京西路103號",,,
"5006","臺北市大同區南京西路153號",,,
"5007","臺北市大同區南京西路155巷22號",,,
"5008","臺北市大同區南京西路155巷26號",,,
"5009","臺北市大同區南京西路155巷9號",,,
"5010","臺北市大同區南京西路163之10號",,,
"5011","臺北市大同區南京西路167巷11號",,,
"5012","臺北市大同區南京西路185巷30號",,,
"5013","臺北市大同區南京西路18巷24之1號",,,
"5014","臺北市大同區南京西路18巷4弄6-2號",,,
"5015","臺北市大同區南京西路18巷6弄6之2號",,,
"5016","臺北市大同區南京西路231號",,,
"5017","臺北市大同區南京西路25巷46號",,,
"5018","臺北市大同區南京西路278號",,,
"5019","臺北市大同區南京西路344巷15號",,,
"5020","臺北市大同區南京西路360之3號",,,
"5021","臺北市大同區南京西路360之4號",,,
"5022","臺北市大同區南京西路378號",,,
"5023","臺北市大同區南京西路394號",,,
"5024","臺北市大同區南京西路434巷7之1號",,,
"5025","臺北市大同區南京西路95號",,,
"5026","臺北市大同區哈密街59巷18弄34號",,,
"5027","臺北市大同區迪化街21號",,,
"5028","臺北市大同區迪化街一段14巷22號",,,
"5029","臺北市大同區迪化街一段26號",,,
"5030","臺北市大同區迪化街一段32巷5之1號",,,
"5031","臺北市大同區迪化街一段63號",,,
"5032","臺北市大同區迪化街二段149巷2之2號",,,
"5033","臺北市大同區重慶北路一段14號",,,
"5034","臺北市大同區重慶北路一段17之1號",,,
"5035","臺北市大同區重慶北路一段22之19號",,,
"5036","臺北市大同區重慶北路一段22之5號",,,
"5037","臺北市大同區重慶北路一段24號",,,
"5038","臺北市大同區重慶北路一段26巷21號",,,
"5039","臺北市大同區重慶北路一段26巷50號",,,
"5040","臺北市大同區重慶北路一段26巷64號",,,
"5041","臺北市大同區重慶北路一段26巷9弄10號",,,
"5042","臺北市大同區重慶北路一段26巷9弄1號",,,
"5043","臺北市大同區重慶北路一段26巷9弄28號",,,
"5044","臺北市大同區重慶北路一段26巷9弄2之1號",,,
"5045","臺北市大同區重慶北路一段26巷9弄34號",,,
"5046","臺北市大同區重慶北路一段26巷9弄3之3號",,,
"5047","臺北市大同區重慶北路一段26巷9弄3號",,,
"5048","臺北市大同區重慶北路一段26巷9弄8號",,,
"5049","臺北市大同區重慶北路一段27巷10號",,,
"5050","臺北市大同區重慶北路一段27巷15號",,,
"5051","臺北市大同區重慶北路一段27巷3號",,,
"5052","臺北市大同區重慶北路一段29號",,,
"5053","臺北市大同區重慶北路一段30之1號",,,
"5054","臺北市大同區重慶北路一段3之1號",,,
"5055","臺北市大同區重慶北路一段41號",,,
"5056","臺北市大同區重慶北路一段47號",,,
"5057","臺北市大同區重慶北路一段49巷21號",,,
"5058","臺北市大同區重慶北路一段55號",,,
"5059","臺北市大同區重慶北路一段83巷37號",,,
"5060","臺北市大同區重慶北路一段86、88號",,,
"5061","臺北市大同區重慶北路二段235之4號",,,
"5062","臺北市大同區重慶北路二段46巷32號",,,
"5063","臺北市大同區重慶北路二段46巷38號",,,
"5064","臺北市大同區重慶北路二段64巷38號",,,
"5065","臺北市大同區重慶北路二段70巷15號",,,
"5066","臺北市大同區重慶北路二段70巷17號",,,
"5067","臺北市大同區重慶北路二段70巷29號",,,
"5068","臺北市大同區重慶北路二段70巷9號",,,
"5069","臺北市大同區重慶北路三段120巷53號",,,
"5070","臺北市大同區重慶北路三段122號",,,
"5071","臺北市大同區重慶北路三段137巷28號",,,
"5072","臺北市大同區重慶北路三段138號",,,
"5073","臺北市大同區重慶北路三段165號",,,
"5074","臺北市大同區重慶北路三段293之4號",,,
"5075","臺北市大同區重慶北路三段335巷28號",,,
"5076","臺北市大同區重慶北路三段335巷49號",,,
"5077","臺北市大同區重慶北路三段7號",,,
"5078","臺北市大同區庫倫街13巷4弄1號",,,
"5079","臺北市大同區庫倫街42號",,,
"5080","臺北市大同區酒泉街120號",,,
"5081","臺北市大同區酒泉街176號",,,
"5082","臺北市大同區酒泉街178號",,,
"5083","臺北市大同區酒泉街191號",,,
"5084","臺北市大同區酒泉街210號",,,
"5085","臺北市大同區酒泉街68號",,,
"5086","臺北市大同區涼州街1號",,,
"5087","臺北市大同區敦煌路22號",,,
"5088","臺北市大同區華亭街45號",,,
"5089","臺北市大同區華陰街106號、重慶北路一段29號",,,
"5090","臺北市大同區華陰街215號",,,
"5091","臺北市大同區華陰街231號",,,
"5092","臺北市大同區華陰街37之1號",,,
"5093","臺北市大同區華陰街42之15號",,,
"5094","臺北市大同區華陰街72巷12號",,,
"5095","臺北市大同區華陰街72巷8號",,,
"5096","臺北市大同區華陰街76號",,,
"5097","臺北市大同區華陰街80號",,,
"5098","臺北市大同區華陰街86號",,,
"5099","臺北市大同區華陰街94號",,,
"5100","臺北市大同區貴德街42之2號",,,
"5101","臺北市大同區貴德街44巷4號",,,
"5102","臺北市大同區塔城街33號",,,
"5103","臺北市大同區塔城街52號",,,
"5104","臺北市大同區塔城街62號",,,
"5105","臺北市大同區萬全街18號",,,
"5106","臺北市大同區萬全街28之1號",,,
"5107","臺北市大同區寧夏路22之6號",,,
"5108","臺北市大同區寧夏路5號",,,
"5109","臺北市大同區臺北市大同區永樂市場2之13號號",,,
"5110","臺北市大同區臺北市大同區永樂市場本?邊27號號",,,
"5111","臺北市大同區臺北市大同區永樂市場第1賣店25號號",,,
"5112","臺北市大同區臺北市大同區永樂市場第1賣店28號號",,,
"5113","臺北市大同區臺北市大同區永樂市場第1賣店弄18號號",,,
"5114","臺北市大同區臺北市大同區永樂市場第1賣店攤位第26號號",,,
"5115","臺北市大同區臺北市大同區永樂市場第2賣店23號號",,,
"5116","臺北市大同區臺北市大同區永樂市場第2賣店2號號",,,
"5117","臺北市大同區臺北市大同區永樂市場第2賣店號",,,
"5118","臺北市大同區臺北市大同區永樂市場第3賣店6號號",,,
"5119","臺北市大同區臺北市大同區永樂市場第4賣店4號號",,,
"5120","臺北市大同區臺北市大同區永樂市場第4賣店攤位59號號",,,
"5121","臺北市大同區臺北市大同區永樂市場第4賣店攤位61號號",,,
"5122","臺北市大同區臺北市大同區永樂市場第5賣店4號攤位號",,,
"5123","臺北市大同區臺北市大同區永樂市場第6賣店第7號號",,,
"5124","臺北市大同區臺北市大同區永樂市場第6賣店攤位號",,,
"5125","臺北市大同區臺北市大同區永樂市場第四賣店11號號",,,
"5126","臺北市大同區臺北市大同區永樂市場臨固32號號",,,
"5127","臺北市大同區臺北市大同區永樂市場臨固44號號",,,
"5128","臺北市大同區臺北市大同區永樂市場臨固攤位第44號號",,,
"5129","臺北市大同區鄭州路21巷4號",,,
"5130","臺北市大同區鄭州路29巷13號",,,
"5131","臺北市大同區鄭州路29巷14號",,,
"5132","臺北市大同區鄭州路29巷16號",,,
"5133","臺北市大同區鄭州路29巷1之1號",,,
"5134","臺北市大同區鄭州路29巷4之1號",,,
"5135","臺北市大同區鄭州路79之1號",,,
"5136","臺北市大同區鄭州路83巷27號",,,
"5137","臺北市大同區鄭州路83巷4號",,,
"5138","臺北市大同區鄭州路83巷8號",,,
"5139","臺北市大同區錦西街38巷32之1號",,,
"5140","臺北市大同區環河北路一段85號",,,
"5141","臺北市大同區環河北路二段269號",,,
"5142","臺北市大同區歸綏街160巷1號",,,
"5143","臺北市大同區蘭州街123之3號",,,
"5144","臺北市大安區大安路1段77號地下街一段77號",,,
"5145","臺北市大安區大安路一段105號",,,
"5146","臺北市大安區大安路一段194號",,,
"5147","臺北市大安區大安路一段196巷2號",,,
"5148","臺北市大安區大安路一段197號",,,
"5149","臺北市大安區大安路一段19巷39號",,,
"5150","臺北市大安區大安路一段202號",,,
"5151","臺北市大安區大安路一段208號",,,
"5152","臺北市大安區大安路一段21號",,,
"5153","臺北市大安區大安路一段225之1號",,,
"5154","臺北市大安區大安路一段31巷13號",,,
"5155","臺北市大安區大安路一段31巷15號",,,
"5156","臺北市大安區大安路一段31巷24號",,,
"5157","臺北市大安區大安路一段31巷26號",,,
"5158","臺北市大安區大安路一段41號",,,
"5159","臺北市大安區大安路一段42號",,,
"5160","臺北市大安區大安路一段47號",,,
"5161","臺北市大安區大安路一段49號",,,
"5162","臺北市大安區大安路一段51巷13號",,,
"5163","臺北市大安區大安路一段51巷21號",,,
"5164","臺北市大安區大安路一段51巷23號",,,
"5165","臺北市大安區大安路一段51巷28之1號",,,
"5166","臺北市大安區大安路一段51巷36之1號",,,
"5167","臺北市大安區大安路一段51巷37號",,,
"5168","臺北市大安區大安路一段51巷49之3號",,,
"5169","臺北市大安區大安路一段53號",,,
"5170","臺北市大安區大安路一段59號",,,
"5171","臺北市大安區大安路一段71號",,,
"5172","臺北市大安區大安路一段75巷1號",,,
"5173","臺北市大安區大安路二段156號",,,
"5174","臺北市大安區大安路二段170號",,,
"5175","臺北市大安區仁愛路三段127號",,,
"5176","臺北市大安區仁愛路三段24巷8號",,,
"5177","臺北市大安區仁愛路三段26之3號",,,
"5178","臺北市大安區仁愛路四段107號",,,
"5179","臺北市大安區仁愛路四段117號",,,
"5180","臺北市大安區仁愛路四段125號",,,
"5181","臺北市大安區仁愛路四段151巷10號",,,
"5182","臺北市大安區仁愛路四段151巷11號",,,
"5183","臺北市大安區仁愛路四段151巷13號",,,
"5184","臺北市大安區仁愛路四段151巷20號",,,
"5185","臺北市大安區仁愛路四段27巷4弄8號",,,
"5186","臺北市大安區仁愛路四段300巷25弄1號",,,
"5187","臺北市大安區仁愛路四段300巷26弄21號",,,
"5188","臺北市大安區仁愛路四段300巷26弄29號",,,
"5189","臺北市大安區仁愛路四段314號",,,
"5190","臺北市大安區仁愛路四段345巷15弄17號",,,
"5191","臺北市大安區仁愛路四段345巷15弄2號",,,
"5192","臺北市大安區仁愛路四段345巷15弄4號",,,
"5193","臺北市大安區仁愛路四段345巷4弄11號",,,
"5194","臺北市大安區仁愛路四段345巷4弄16號",,,
"5195","臺北市大安區仁愛路四段345巷4弄36號",,,
"5196","臺北市大安區仁愛路四段345巷5弄15號",,,
"5197","臺北市大安區仁愛路四段385號",,,
"5198","臺北市大安區仁愛路四段423號",,,
"5199","臺北市大安區仁愛路四段425之1號",,,
"5200","臺北市大安區仁愛路四段48巷12號",,,
"5201","臺北市大安區仁愛路四段48巷30號",,,
"5202","臺北市大安區仁愛路四段68號",,,
"5203","臺北市大安區仁愛路四段71巷28號",,,
"5204","臺北市大安區仁愛路四段79號",,,
"5205","臺北市大安區文昌街183號",,,
"5206","臺北市大安區文昌街250巷1號",,,
"5207","臺北市大安區四維路14巷2號",,,
"5208","臺北市大安區四維路170巷32號",,,
"5209","臺北市大安區四維路170巷38號",,,
"5210","臺北市大安區四維路19號",,,
"5211","臺北市大安區四維路22巷18號",,,
"5212","臺北市大安區四維路76巷3號",,,
"5213","臺北市大安區市民大道三段132號",,,
"5214","臺北市大安區市民大道四段138之3號",,,
"5215","臺北市大安區市民大道四段218號",,,
"5216","臺北市大安區市民大道四段8號",,,
"5217","臺北市大安區永康街11之3號",,,
"5218","臺北市大安區永康街12巷3號",,,
"5219","臺北市大安區永康街１２巷８號",,,
"5220","臺北市大安區永康街13巷2之1號",,,
"5221","臺北市大安區永康街16之1號",,,
"5222","臺北市大安區永康街30之1號",,,
"5223","臺北市大安區永康街30號",,,
"5224","臺北市大安區永康街31之1號",,,
"5225","臺北市大安區永康街31之4號",,,
"5226","臺北市大安區永康街31巷12號",,,
"5227","臺北市大安區永康街31巷8號",,,
"5228","臺北市大安區永康街41巷19號",,,
"5229","臺北市大安區永康街41巷3號",,,
"5230","臺北市大安區永康街42之1號",,,
"5231","臺北市大安區永康街4巷16號",,,
"5232","臺北市大安區永康街4巷18號",,,
"5233","臺北市大安區永康街4巷22號",,,
"5234","臺北市大安區永康街4巷24號",,,
"5235","臺北市大安區永康街6巷11號",,,
"5236","臺北市大安區永康街6巷16號",,,
"5237","臺北市大安區永康街75巷10號",,,
"5238","臺北市大安區永康街8巷11號",,,
"5239","臺北市大安區永康街8巷6號",,,
"5240","臺北市大安區光復南路180巷5號",,,
"5241","臺北市大安區光復南路200巷36號",,,
"5242","臺北市大安區光復南路240巷41號",,,
"5243","臺北市大安區光復南路240巷45號",,,
"5244","臺北市大安區光復南路260巷1號",,,
"5245","臺北市大安區光復南路260巷42號",,,
"5246","臺北市大安區光復南路290巷43號",,,
"5247","臺北市大安區光復南路290巷60號",,,
"5248","臺北市大安區光復南路80號",,,
"5249","臺北市大安區安和路一段117巷18號",,,
"5250","臺北市大安區安和路一段127巷29弄11號",,,
"5251","臺北市大安區安和路一段127巷29弄5號",,,
"5252","臺北市大安區安和路一段127巷5號",,,
"5253","臺北市大安區安和路一段29之2號",,,
"5254","臺北市大安區安和路一段84號",,,
"5255","臺北市大安區安和路二段129號",,,
"5256","臺北市大安區安和路二段189巷13號",,,
"5257","臺北市大安區安和路二段241號",,,
"5258","臺北市大安區安和路二段31號",,,
"5259","臺北市大安區安和路二段51之1號",,,
"5260","臺北市大安區安和路二段59巷11號",,,
"5261","臺北市大安區安和路二段59巷7號",,,
"5262","臺北市大安區安東街31號",,,
"5263","臺北市大安區安東街臨57之9號",,,
"5264","臺北市大安區辛亥路一段38號",,,
"5265","臺北市大安區和平東路一段198號",,,
"5266","臺北市大安區和平東路一段19號",,,
"5267","臺北市大安區和平東路一段210號",,,
"5268","臺北市大安區和平東路一段216號",,,
"5269","臺北市大安區和平東路一段234號",,,
"5270","臺北市大安區和平東路一段58號",,,
"5271","臺北市大安區和平東路二段118巷52弄16號",,,
"5272","臺北市大安區和平東路二段118巷71號",,,
"5273","臺北市大安區和平東路二段157之1號",,,
"5274","臺北市大安區和平東路二段269號",,,
"5275","臺北市大安區和平東路二段315號",,,
"5276","臺北市大安區和平東路二段42號",,,
"5277","臺北市大安區和平東路二段96巷3號",,,
"5278","臺北市大安區和平東路三段20號",,,
"5279","臺北市大安區和平東路三段28號",,,
"5280","臺北市大安區和平東路三段48號",,,
"5281","臺北市大安區和平東路三段5號",,,
"5282","臺北市大安區和平東路三段68之1號",,,
"5283","臺北市大安區和平東路三段70之2號",,,
"5284","臺北市大安區延吉街112號",,,
"5285","臺北市大安區延吉街119號",,,
"5286","臺北市大安區延吉街122號",,,
"5287","臺北市大安區延吉街128號",,,
"5288","臺北市大安區延吉街133號",,,
"5289","臺北市大安區延吉街135之2號",,,
"5290","臺北市大安區延吉街138巷6號",,,
"5291","臺北市大安區延吉街153之7號",,,
"5292","臺北市大安區延吉街160巷5之3號",,,
"5293","臺北市大安區延吉街160巷5號",,,
"5294","臺北市大安區延吉街164之2號",,,
"5295","臺北市大安區延吉街233之1號",,,
"5296","臺北市大安區延吉街233巷5號",,,
"5297","臺北市大安區延吉街235巷1號",,,
"5298","臺北市大安區延吉街238之1號",,,
"5299","臺北市大安區延吉街246巷2號",,,
"5300","臺北市大安區延吉街70巷2弄5號",,,
"5301","臺北市大安區延吉街70巷5弄10號",,,
"5302","臺北市大安區忠孝東路三段210號",,,
"5303","臺北市大安區忠孝東路三段216巷3弄15號",,,
"5304","臺北市大安區忠孝東路三段216巷3弄4號",,,
"5305","臺北市大安區忠孝東路三段217巷5弄2號",,,
"5306","臺北市大安區忠孝東路三段248巷63號",,,
"5307","臺北市大安區忠孝東路三段248巷7弄12號",,,
"5308","臺北市大安區忠孝東路三段251巷11弄10號",,,
"5309","臺北市大安區忠孝東路三段251巷4弄2號",,,
"5310","臺北市大安區忠孝東路三段263號",,,
"5311","臺北市大安區忠孝東路四段101巷31號",,,
"5312","臺北市大安區忠孝東路四段101巷45號",,,
"5313","臺北市大安區忠孝東路四段102號",,,
"5314","臺北市大安區忠孝東路四段142號",,,
"5315","臺北市大安區忠孝東路四段146巷21號",,,
"5316","臺北市大安區忠孝東路四段146巷23號",,,
"5317","臺北市大安區忠孝東路四段147巷10號",,,
"5318","臺北市大安區忠孝東路四段170巷17弄9號",,,
"5319","臺北市大安區忠孝東路四段181巷22號",,,
"5320","臺北市大安區忠孝東路四段181巷6號",,,
"5321","臺北市大安區忠孝東路四段181巷7弄21號",,,
"5322","臺北市大安區忠孝東路四段197號",,,
"5323","臺北市大安區忠孝東路四段205巷14號",,,
"5324","臺北市大安區忠孝東路四段205巷26弄5號",,,
"5325","臺北市大安區忠孝東路四段205巷26弄6號",,,
"5326","臺北市大安區忠孝東路四段205巷29弄3號",,,
"5327","臺北市大安區忠孝東路四段205巷29弄6號",,,
"5328","臺北市大安區忠孝東路四段205巷29弄7號",,,
"5329","臺北市大安區忠孝東路四段205巷3號",,,
"5330","臺北市大安區忠孝東路四段216巷11弄14號",,,
"5331","臺北市大安區忠孝東路四段216巷11弄20號",,,
"5332","臺北市大安區忠孝東路四段216巷15號",,,
"5333","臺北市大安區忠孝東路四段216巷18號",,,
"5334","臺北市大安區忠孝東路四段216巷19弄21號",,,
"5335","臺北市大安區忠孝東路四段216巷23號",,,
"5336","臺北市大安區忠孝東路四段216巷27弄12號",,,
"5337","臺北市大安區忠孝東路四段216巷29號",,,
"5338","臺北市大安區忠孝東路四段216巷30號",,,
"5339","臺北市大安區忠孝東路四段216巷32弄20號",,,
"5340","臺北市大安區忠孝東路四段216巷32弄2號",,,
"5341","臺北市大安區忠孝東路四段216巷33弄18號",,,
"5342","臺北市大安區忠孝東路四段216巷37號",,,
"5343","臺北市大安區忠孝東路四段216巷40弄16號",,,
"5344","臺北市大安區忠孝東路四段216巷40弄9號",,,
"5345","臺北市大安區忠孝東路四段216巷8弄18號",,,
"5346","臺北市大安區忠孝東路四段223巷49弄7號",,,
"5347","臺北市大安區忠孝東路四段248巷29號",,,
"5348","臺北市大安區忠孝東路四段49巷4弄2號",,,
"5349","臺北市大安區忠孝東路四段53之10號",,,
"5350","臺北市大安區忠孝東路四段53之11號",,,
"5351","臺北市大安區忠孝東路四段77巷35號",,,
"5352","臺北市大安區忠孝東路四段79號",,,
"5353","臺北市大安區忠孝東路四段85號",,,
"5354","臺北市大安區忠孝東路四段87之16號",,,
"5355","臺北市大安區忠孝東路四段87之20號",,,
"5356","臺北市大安區忠孝東路四段87之6號",,,
"5357","臺北市大安區昌隆里忠孝東路三段217巷2弄9號",,,
"5358","臺北市大安區東豐街35號",,,
"5359","臺北市大安區臥龍街151巷72號",,,
"5360","臺北市大安區臥龍街188巷13號",,,
"5361","臺北市大安區臥龍街195巷26號",,,
"5362","臺北市大安區臥龍街84號",,,
"5363","臺北市大安區金山南路二段33號",,,
"5364","臺北市大安區金華街148號",,,
"5365","臺北市大安區金華街156號",,,
"5366","臺北市大安區金華街243巷17號",,,
"5367","臺北市大安區金華街243巷3號",,,
"5368","臺北市大安區金華街243巷42號",,,
"5369","臺北市大安區金華街243巷46號",,,
"5370","臺北市大安區金華街245之2號",,,
"5371","臺北市大安區青田街6巷7號",,,
"5372","臺北市大安區信義路二段188號",,,
"5373","臺北市大安區信義路二段44巷10弄1號",,,
"5374","臺北市大安區信義路二段86巷10號",,,
"5375","臺北市大安區信義路三段147巷36弄22號",,,
"5376","臺北市大安區信義路三段156號",,,
"5377","臺北市大安區信義路三段174號",,,
"5378","臺北市大安區信義路三段192號",,,
"5379","臺北市大安區信義路四段187號",,,
"5380","臺北市大安區信義路四段1之15號",,,
"5381","臺北市大安區信義路四段208號",,,
"5382","臺北市大安區信義路四段265巷13號",,,
"5383","臺北市大安區信義路四段265巷17之1號",,,
"5384","臺北市大安區信義路四段265巷27號",,,
"5385","臺北市大安區信義路四段30巷52號",,,
"5386","臺北市大安區信義路四段400巷1號",,,
"5387","臺北市大安區信義路四段49號",,,
"5388","臺北市大安區信義路四段60之30號",,,
"5389","臺北市大安區信義路四段6號",,,
"5390","臺北市大安區信義路四段71號",,,
"5391","臺北市大安區建國南路一段304巷3號",,,
"5392","臺北市大安區師大路103號",,,
"5393","臺北市大安區師大路117巷6號",,,
"5394","臺北市大安區師大路119之1號",,,
"5395","臺北市大安區師大路133號",,,
"5396","臺北市大安區師大路135巷10號",,,
"5397","臺北市大安區師大路139號",,,
"5398","臺北市大安區師大路141號",,,
"5399","臺北市大安區師大路39巷24號",,,
"5400","臺北市大安區師大路45之2號",,,
"5401","臺北市大安區師大路49巷5號",,,
"5402","臺北市大安區師大路59巷10號",,,
"5403","臺北市大安區師大路59巷11號",,,
"5404","臺北市大安區師大路59巷1之1號",,,
"5405","臺北市大安區師大路59巷3號",,,
"5406","臺北市大安區師大路59巷6號",,,
"5407","臺北市大安區師大路59巷7號",,,
"5408","臺北市大安區師大路59巷9之5號",,,
"5409","臺北市大安區師大路59巷9號",,,
"5410","臺北市大安區師大路83巷6號",,,
"5411","臺北市大安區師大路83巷8號",,,
"5412","臺北市大安區師大路87號",,,
"5413","臺北市大安區泰順街16巷36號",,,
"5414","臺北市大安區泰順街38巷23號",,,
"5415","臺北市大安區泰順街40巷15號",,,
"5416","臺北市大安區泰順街40巷30號",,,
"5417","臺北市大安區泰順街44巷15之1號",,,
"5418","臺北市大安區泰順街44巷20號",,,
"5419","臺北市大安區泰順街44巷21之1號",,,
"5420","臺北市大安區泰順街44巷23號",,,
"5421","臺北市大安區泰順街44巷30號",,,
"5422","臺北市大安區泰順街44巷31號",,,
"5423","臺北市大安區泰順街4號",,,
"5424","臺北市大安區泰順街60巷20號",,,
"5425","臺北市大安區泰順街60巷27號",,,
"5426","臺北市大安區泰順街9號",,,
"5427","臺北市大安區基隆路二段206號",,,
"5428","臺北市大安區基隆路二段254號",,,
"5429","臺北市大安區通化街13號",,,
"5430","臺北市大安區通化街141號",,,
"5431","臺北市大安區通化街149號",,,
"5432","臺北市大安區通化街160號",,,
"5433","臺北市大安區通化街171巷25號",,,
"5434","臺北市大安區通化街39巷50弄88之1號",,,
"5435","臺北市大安區通化街39巷62弄16號",,,
"5436","臺北市大安區通化街39巷62弄53之1號",,,
"5437","臺北市大安區通化街69號",,,
"5438","臺北市大安區富陽街157巷7號",,,
"5439","臺北市大安區復興南路一段107巷23之1號",,,
"5440","臺北市大安區復興南路一段107巷47號",,,
"5441","臺北市大安區復興南路一段107巷5弄11號",,,
"5442","臺北市大安區復興南路一段107巷5弄2號",,,
"5443","臺北市大安區復興南路一段107巷5弄8號",,,
"5444","臺北市大安區復興南路一段126巷1號",,,
"5445","臺北市大安區復興南路一段135巷17號",,,
"5446","臺北市大安區復興南路一段135巷19號",,,
"5447","臺北市大安區復興南路一段135巷31號",,,
"5448","臺北市大安區復興南路一段251號",,,
"5449","臺北市大安區復興南路一段91號",,,
