"id","Address","Response_Address","Response_X","Response_Y"
"7442","臺北市內湖區麗山街393巷10號",,,
"7443","臺北市內湖區麗山街76號",,,
"7444","臺北市文山區下崙路9之1號",,,
"7445","臺北市文山區木柵路一段180號",,,
"7446","臺北市文山區木柵路一段204號",,,
"7447","臺北市文山區木柵路一段254號",,,
"7448","臺北市文山區木柵路一段310號",,,
"7449","臺北市文山區木柵路一段318號",,,
"7450","臺北市文山區木柵路一段331之1號",,,
"7451","臺北市文山區木柵路一段331之9號",,,
"7452","臺北市文山區木柵路一段3號",,,
"7453","臺北市文山區木柵路一段49號",,,
"7454","臺北市文山區木柵路一段59巷11弄19號",,,
"7455","臺北市文山區木柵路二段128號",,,
"7456","臺北市文山區木柵路二段16號",,,
"7457","臺北市文山區木柵路三段102巷7號",,,
"7458","臺北市文山區木柵路四段35之2號",,,
"7459","臺北市文山區木柵路四段35之4號",,,
"7460","臺北市文山區木新路二段123號",,,
"7461","臺北市文山區木新路二段12號",,,
"7462","臺北市文山區木新路二段14號",,,
"7463","臺北市文山區木新路二段174號",,,
"7464","臺北市文山區木新路二段195號",,,
"7465","臺北市文山區木新路二段272號",,,
"7466","臺北市文山區木新路二段8號",,,
"7467","臺北市文山區木新路二段93號",,,
"7468","臺北市文山區木新路三段251號",,,
"7469","臺北市文山區木新路三段253號",,,
"7470","臺北市文山區木新路三段367號",,,
"7471","臺北市文山區木新路三段72號",,,
"7472","臺北市文山區永安街22巷19號",,,
"7473","臺北市文山區永安街27號",,,
"7474","臺北市文山區光輝路4號",,,
"7475","臺北市文山區辛亥路七段50號",,,
"7476","臺北市文山區辛亥路七段62號",,,
"7477","臺北市文山區辛亥路七段71號",,,
"7478","臺北市文山區辛亥路五段82號",,,
"7479","臺北市文山區辛亥路五段87號",,,
"7480","臺北市文山區辛亥路五段95號",,,
"7481","臺北市文山區辛亥路六段86巷6弄3號",,,
"7482","臺北市文山區和平東路四段71號",,,
"7483","臺北市文山區保儀路161號",,,
"7484","臺北市文山區恆光街19號",,,
"7485","臺北市文山區指南路一段4號",,,
"7486","臺北市文山區景隆街52號",,,
"7487","臺北市文山區景福街199號",,,
"7488","臺北市文山區景福街230巷4號",,,
"7489","臺北市文山區景福街25號",,,
"7490","臺北市文山區景興路13號",,,
"7491","臺北市文山區景興路28之1號",,,
"7492","臺北市文山區景興路65號",,,
"7493","臺北市文山區新光路一段117號",,,
"7494","臺北市文山區新光路一段120號",,,
"7495","臺北市文山區新光路一段132號",,,
"7496","臺北市文山區萬隆街36號",,,
"7497","臺北市文山區福興路108之6號",,,
"7498","臺北市文山區興隆路一段139號",,,
"7499","臺北市文山區興隆路一段175號",,,
"7500","臺北市文山區興隆路一段204號",,,
"7501","臺北市文山區興隆路一段206號",,,
"7502","臺北市文山區興隆路一段212號",,,
"7503","臺北市文山區興隆路一段214號",,,
"7504","臺北市文山區興隆路一段263號",,,
"7505","臺北市文山區興隆路一段3號",,,
"7506","臺北市文山區興隆路二段125號",,,
"7507","臺北市文山區興隆路二段243號",,,
"7508","臺北市文山區興隆路二段244巷34號",,,
"7509","臺北市文山區興隆路二段275巷2號",,,
"7510","臺北市文山區興隆路三段192巷8弄7號",,,
"7511","臺北市文山區興隆路三段207巷6弄2號",,,
"7512","臺北市文山區興隆路三段229巷6弄8號",,,
"7513","臺北市文山區興隆路三段265號",,,
"7514","臺北市文山區興隆路三段267號",,,
"7515","臺北市文山區興隆路四段112號",,,
"7516","臺北市文山區興隆路四段215號",,,
"7517","臺北市文山區興隆路四段49之5號",,,
"7518","臺北市文山區興隆路四段54之1號",,,
"7519","臺北市文山區羅斯福路五段141之1號",,,
"7520","臺北市文山區羅斯福路五段173號",,,
"7521","臺北市文山區羅斯福路五段8號",,,
"7522","臺北市文山區羅斯福路五段95之4號",,,
"7523","臺北市文山區羅斯福路六段116號",,,
"7524","臺北市文山區羅斯福路六段145號",,,
"7525","臺北市文山區羅斯福路六段161號",,,
"7526","臺北市文山區羅斯福路六段164號",,,
"7527","臺北市文山區羅斯福路六段165號",,,
"7528","臺北市文山區羅斯福路六段186號",,,
"7529","臺北市文山區羅斯福路六段269號",,,
"7530","臺北市文山區羅斯福路六段451號",,,
"7531","臺北市文山區羅斯福路六段73號",,,
"7532","臺北市文山區羅斯福路四段210號",,,
"7533","臺北市文山區羅斯福路四段216號",,,
"7534","臺北市北投區三合街二段458號",,,
"7535","臺北市北投區大同街202之2號",,,
"7536","臺北市北投區大同街206號",,,
"7537","臺北市北投區大度路三段159號",,,
"7538","臺北市北投區大業路263號",,,
"7539","臺北市北投區大業路286號",,,
"7540","臺北市北投區大業路292號",,,
"7541","臺北市北投區大業路35巷2號",,,
"7542","臺北市北投區大業路35號",,,
"7543","臺北市北投區大業路440號",,,
"7544","臺北市北投區大業路492號",,,
"7545","臺北市北投區大業路496號",,,
"7546","臺北市北投區大業路545號",,,
"7547","臺北市北投區大業路663號",,,
"7548","臺北市北投區大興街23巷35號",,,
"7549","臺北市北投區中央北路二段105號",,,
"7550","臺北市北投區中央北路二段284號",,,
"7551","臺北市北投區中央北路二段287號",,,
"7552","臺北市北投區中央北路二段289號",,,
"7553","臺北市北投區中央北路二段305號",,,
"7554","臺北市北投區中央北路二段310號",,,
"7555","臺北市北投區中央北路二段325號",,,
"7556","臺北市北投區中央北路二段95巷4弄12號",,,
"7557","臺北市北投區中央北路三段11號",,,
"7558","臺北市北投區中央北路三段15號",,,
"7559","臺北市北投區中央北路三段224號",,,
"7560","臺北市北投區中央北路三段238號",,,
"7561","臺北市北投區中央北路三段23號",,,
"7562","臺北市北投區中央北路三段3號",,,
"7563","臺北市北投區中央北路三段40巷20弄9號",,,
"7564","臺北市北投區中央北路四段132號",,,
"7565","臺北市北投區中央北路四段146號",,,
"7566","臺北市北投區中央北路四段202號",,,
"7567","臺北市北投區中央北路四段208號",,,
"7568","臺北市北投區中央北路四段346號",,,
"7569","臺北市北投區中央北路四段378號",,,
"7570","臺北市北投區中央北路四段382號",,,
"7571","臺北市北投區中央北路四段398號",,,
"7572","臺北市北投區中央北路四段412號",,,
"7573","臺北市北投區中央北路四段418號",,,
"7574","臺北市北投區中央北路四段465號",,,
"7575","臺北市北投區中央北路四段545號",,,
"7576","臺北市北投區中央南路一段225巷2號",,,
"7577","臺北市北投區中央南路二段33之2號",,,
"7578","臺北市北投區中和街239號",,,
"7579","臺北市北投區中和街373號",,,
"7580","臺北市北投區中和街380之4號",,,
"7581","臺北市北投區中和街407號",,,
"7582","臺北市北投區中和街496號",,,
"7583","臺北市北投區公館路336號",,,
"7584","臺北市北投區文林北路170號",,,
"7585","臺北市北投區文林北路182號",,,
"7586","臺北市北投區文林北路200號",,,
"7587","臺北市北投區文林北路234號",,,
"7588","臺北市北投區文林北路252號",,,
"7589","臺北市北投區文林北路264號",,,
"7590","臺北市北投區文林北路272巷3號",,,
"7591","臺北市北投區文林北路74號",,,
"7592","臺北市北投區文林北路80巷60弄22號",,,
"7593","臺北市北投區文林北路94巷133號",,,
"7594","臺北市北投區文林北路94巷15號",,,
"7595","臺北市北投區北投路一段89巷1號",,,
"7596","臺北市北投區北投路一段89巷2號",,,
"7597","臺北市北投區永興路一段4號",,,
"7598","臺北市北投區石牌路一段39巷36弄4號",,,
"7599","臺北市北投區立功街165巷15號",,,
"7600","臺北市北投區立農街一段251號",,,
"7601","臺北市北投區立農街一段357巷13號",,,
"7602","臺北市北投區立農街二段268號",,,
"7603","臺北市北投區吉利街101號",,,
"7604","臺北市北投區吉利街148號",,,
"7605","臺北市北投區自強街141巷2之1號",,,
"7606","臺北市北投區自強街23號",,,
"7607","臺北市北投區自強街25號",,,
"7608","臺北市北投區自強街52號",,,
"7609","臺北市北投區行義路7號",,,
"7610","臺北市北投區西安街一段179號",,,
"7611","臺北市北投區西安街一段183號",,,
"7612","臺北市北投區西安街一段313巷6弄16號",,,
"7613","臺北市北投區西安街二段107號",,,
"7614","臺北市北投區西安街二段253號",,,
"7615","臺北市北投區承德路七段168巷2號",,,
"7616","臺北市北投區承德路七段204號",,,
"7617","臺北市北投區承德路七段302號",,,
"7618","臺北市北投區承德路七段344巷8號",,,
"7619","臺北市北投區承德路七段34號",,,
"7620","臺北市北投區承德路七段401巷617號",,,
"7621","臺北市北投區承德路六段449之5號",,,
"7622","臺北市北投區承德路六段483號",,,
"7623","臺北市北投區明德路135之1號",,,
"7624","臺北市北投區明德路150巷8號",,,
"7625","臺北市北投區明德路225號",,,
"7626","臺北市北投區明德路272號",,,
"7627","臺北市北投區東華街426號",,,
"7628","臺北市北投區東華街一段386號",,,
"7629","臺北市北投區東華街一段436號",,,
"7630","臺北市北投區東華街二段10號",,,
"7631","臺北市北投區東華街二段14號",,,
"7632","臺北市北投區東華街二段182號",,,
"7633","臺北市北投區東華街二段330號",,,
"7634","臺北市北投區東華街二段86號",,,
"7635","臺北市北投區東陽街425號",,,
"7636","臺北市北投區東陽街470號",,,
"7637","臺北市北投區知行路316巷20弄19號",,,
"7638","臺北市北投區知行路336號",,,
"7639","臺北市北投區知行路4之4號",,,
"7640","臺北市北投區泉源路39之48號",,,
"7641","臺北市北投區致遠一路一段82號",,,
"7642","臺北市北投區致遠一路二段47號",,,
"7643","臺北市北投區致遠一路二段88號",,,
"7644","臺北市北投區致遠二路89號",,,
"7645","臺北市北投區崇仁路一段25號",,,
"7646","臺北市北投區崇仁路一段31號",,,
"7647","臺北市北投區崇仁路一段40號",,,
"7648","臺北市北投區崇仁路一段60號",,,
"7649","臺北市北投區崇仁路一段8號",,,
"7650","臺北市北投區清江路132號",,,
"7651","臺北市北投區尊賢街302巷1號",,,
"7652","臺北市北投區尊賢街302巷24號",,,
"7653","臺北市北投區義理街66號",,,
"7654","臺北市北投區裕民六路114巷16號",,,
"7655","臺北市北投區裕民四路10號",,,
"7656","臺北市北投區實踐街16號",,,
"7657","臺北市北投區懷德街30號",,,
"7658","臺北市北投區懷德街56巷8號",,,
"7659","臺北市北投區懷德街9號",,,
"7660","臺北市松山區八德路三段12巷60號",,,
"7661","臺北市松山區八德路三段155巷3號",,,
"7662","臺北市松山區八德路三段198號",,,
"7663","臺北市松山區八德路三段199巷5號",,,
"7664","臺北市松山區八德路四段181巷29號",,,
"7665","臺北市松山區八德路四段204巷7弄23號",,,
"7666","臺北市松山區八德路四段245巷16號",,,
"7667","臺北市松山區八德路四段245巷27號",,,
"7668","臺北市松山區八德路四段307號",,,
"7669","臺北市松山區八德路四段313號",,,
"7670","臺北市松山區八德路四段318號",,,
"7671","臺北市松山區八德路四段328號",,,
"7672","臺北市松山區八德路四段332號",,,
"7673","臺北市松山區八德路四段334號",,,
"7674","臺北市松山區八德路四段338號",,,
"7675","臺北市松山區八德路四段351號",,,
"7676","臺北市松山區八德路四段357號",,,
"7677","臺北市松山區八德路四段361號",,,
"7678","臺北市松山區八德路四段395號",,,
"7679","臺北市松山區八德路四段453巷12號",,,
"7680","臺北市松山區八德路四段498之2號",,,
"7681","臺北市松山區八德路四段508號",,,
"7682","臺北市松山區三民路113巷4號",,,
"7683","臺北市松山區三民路135號",,,
"7684","臺北市松山區三民路142號",,,
"7685","臺北市松山區市民大道四段241號",,,
"7686","臺北市松山區市民大道四段291號",,,
"7687","臺北市松山區市民大道四段99號",,,
"7688","臺北市松山區民生東路五段69巷21號",,,
"7689","臺北市松山區民生東路四段97巷4弄16號",,,
"7690","臺北市松山區民族東路670號",,,
"7691","臺北市松山區民權東路三段103巷33號",,,
"7692","臺北市松山區民權東路三段154號",,,
"7693","臺北市松山區民權東路五段18號",,,
"7694","臺北市松山區民權東路五段19號",,,
"7695","臺北市松山區民權東路五段2號",,,
"7696","臺北市松山區民權東路五段7號",,,
"7697","臺北市松山區光復北路159號",,,
"7698","臺北市松山區光復南路22巷20號",,,
"7699","臺北市松山區光復南路44號",,,
"7700","臺北市松山區光復南路66巷81號",,,
"7701","臺北市松山區延吉街7之3號",,,
"7702","臺北市松山區延壽街161號",,,
"7703","臺北市松山區延壽街362號",,,
"7704","臺北市松山區忠孝東路五段489號",,,
"7705","臺北市松山區松仁路167號",,,
"7706","臺北市松山區松隆路292號",,,
"7707","臺北市松山區虎林街23號",,,
"7708","臺北市松山區南京東路五段250巷18弄2號",,,
"7709","臺北市松山區南京東路五段251巷22弄37號",,,
"7710","臺北市松山區南京東路五段291巷47弄43號",,,
"7711","臺北市松山區南京東路五段337號",,,
"7712","臺北市松山區南京東路五段357號",,,
"7713","臺北市松山區健康路133號",,,
"7714","臺北市松山區健康路15巷11號",,,
"7715","臺北市松山區健康路182號",,,
"7716","臺北市松山區健康路190號",,,
"7717","臺北市松山區健康路192、194號",,,
"7718","臺北市松山區健康路216號",,,
"7719","臺北市松山區健康路232號",,,
"7720","臺北市松山區健康路246號",,,
"7721","臺北市松山區健康路272號",,,
"7722","臺北市松山區健康路286號",,,
"7723","臺北市松山區健康路302號",,,
"7724","臺北市松山區健康路308號",,,
"7725","臺北市松山區健康路408號",,,
"7726","臺北市松山區健康路436號",,,
"7727","臺北市松山區健康路438號",,,
"7728","臺北市松山區健康路50號",,,
"7729","臺北市松山區基隆路二段131號",,,
"7730","臺北市松山區復興北路431號",,,
"7731","臺北市松山區復興北路527號",,,
"7732","臺北市松山區敦化北路222巷23號",,,
"7733","臺北市松山區塔悠路193號",,,
"7734","臺北市松山區塔悠路212號",,,
"7735","臺北市松山區塔悠路233號",,,
"7736","臺北市松山區塔悠路313號",,,
"7737","臺北市松山區塔悠路62號",,,
"7738","臺北市松山區塔悠路98號",,,
"7739","臺北市松山區新東街30巷32號",,,
"7740","臺北市松山區撫遠街380巷5號",,,
"7741","臺北市松山區寶清街111巷22號",,,
"7742","臺北市松山區寶清街11號",,,
"7743","臺北市松山區寶清街18之2號",,,
"7744","臺北市松山區寶清街30號",,,
"7745","臺北市松山區寶清街3號",,,
"7746","臺北市松山區寶清街63號",,,
"7747","臺北市信義區大仁里福德街64號",,,
"7748","臺北市信義區中坡南路201巷8號",,,
"7749","臺北市信義區中坡南路227號",,,
"7750","臺北市信義區永吉路120巷47號",,,
"7751","臺北市信義區永吉路120巷59號",,,
"7752","臺北市信義區永吉路202號",,,
"7753","臺北市信義區永吉路205號",,,
"7754","臺北市信義區永吉路27號",,,
"7755","臺北市信義區永吉路30巷119弄45號",,,
"7756","臺北市信義區永吉路30巷25號",,,
"7757","臺北市信義區永吉路491巷7弄10號",,,
"7758","臺北市信義區吳興街281巷62號",,,
"7759","臺北市信義區吳興街378號",,,
"7760","臺北市信義區吳興街474號",,,
"7761","臺北市信義區吳興街512巷12號",,,
"7762","臺北市信義區吳興街600巷78號",,,
"7763","臺北市信義區和平東路三段289號",,,
"7764","臺北市信義區和平東路三段341巷55號",,,
"7765","臺北市信義區和平東路三段455號",,,
"7766","臺北市信義區忠孝東路五段147號",,,
"7767","臺北市信義區忠孝東路五段15巷12號",,,
"7768","臺北市信義區忠孝東路五段185號",,,
"7769","臺北市信義區忠孝東路五段733號",,,
"7770","臺北市信義區忠孝東路五段790巷59弄35號",,,
"7771","臺北市信義區松山路417號",,,
"7772","臺北市信義區松仁路165號",,,
"7773","臺北市信義區松仁路170號",,,
"7774","臺北市信義區松仁路172號",,,
"7775","臺北市信義區松仁路182號",,,
"7776","臺北市信義區松仁路196號",,,
"7777","臺北市信義區松仁路208號",,,
"7778","臺北市信義區松仁路281巷10號",,,
"7779","臺北市信義區松信路102號",,,
"7780","臺北市信義區松信路23號",,,
"7781","臺北市信義區松信路32號",,,
"7782","臺北市信義區松信路45號",,,
"7783","臺北市信義區松信路61號",,,
"7784","臺北市信義區松信路91號",,,
"7785","臺北市信義區松隆路111號",,,
"7786","臺北市信義區松隆路11號",,,
"7787","臺北市信義區松隆路171號",,,
"7788","臺北市信義區松隆路198號",,,
"7789","臺北市信義區松隆路219號",,,
"7790","臺北市信義區松隆路21號",,,
"7791","臺北市信義區松隆路337號",,,
"7792","臺北市信義區松隆路48號",,,
"7793","臺北市信義區松德路257號",,,
"7794","臺北市信義區松德路263號",,,
"7795","臺北市信義區松德路88號",,,
"7796","臺北市信義區松德路90號",,,
"7797","臺北市信義區林口街110號",,,
"7798","臺北市信義區林口街226號",,,
"7799","臺北市信義區林口街24巷2號",,,
"7800","臺北市信義區林口街38巷36號",,,
"7801","臺北市信義區林口街85號",,,
"7802","臺北市信義區虎林街164巷60弄20號",,,
"7803","臺北市信義區虎林街164巷60弄22號",,,
"7804","臺北市信義區虎林街30巷10號",,,
"7805","臺北市信義區虎林街56巷1號",,,
"7806","臺北市信義區虎林街67號",,,
"7807","臺北市信義區信安街52號",,,
"7808","臺北市信義區信安街80號",,,
"7809","臺北市信義區信義路五段150巷401弄5號",,,
"7810","臺北市信義區信義路五段150巷485之2號",,,
"7811","臺北市信義區基隆路一段147巷5弄16號",,,
"7812","臺北市信義區基隆路一段163號",,,
"7813","臺北市信義區基隆路一段350之1號",,,
"7814","臺北市信義區莊敬路214號",,,
"7815","臺北市信義區莊敬路325巷33號",,,
"7816","臺北市信義區莊敬路325巷38號",,,
"7817","臺北市信義區富陽街27號",,,
"7818","臺北市信義區富陽街52號",,,
"7819","臺北市信義區富陽街63號",,,
"7820","臺北市信義區嘉興街155之8號",,,
"7821","臺北市信義區嘉興街175巷5號",,,
"7822","臺北市信義區嘉興街181巷6號",,,
"7823","臺北市信義區嘉興街216之1號",,,
"7824","臺北市信義區嘉興街216巷7號",,,
"7825","臺北市信義區嘉興街251號",,,
"7826","臺北市信義區嘉興街308巷13號",,,
"7827","臺北市信義區福德街268巷29弄6號",,,
"7828","臺北市信義區福德街30號",,,
"7829","臺北市信義區福德街95號",,,
"7830","臺北市信義區福德街99號",,,
"7831","臺北市南港區中坡北路100號",,,
"7832","臺北市南港區中坡北路30巷1號",,,
"7833","臺北市南港區市民大道七段22號",,,
"7834","臺北市南港區永吉路548號",,,
"7835","臺北市南港區永吉路559號",,,
"7836","臺北市南港區玉成街181巷8號",,,
"7837","臺北市南港區玉成街28號",,,
"7838","臺北市南港區玉成街34號",,,
"7839","臺北市南港區同德路92號",,,
"7840","臺北市南港區向陽路88號",,,
"7841","臺北市南港區成功路一段90號",,,
"7842","臺北市南港區成福路178巷8號",,,
"7843","臺北市南港區成福路47號",,,
"7844","臺北市南港區成福路56號",,,
"7845","臺北市南港區成福路80號",,,
"7846","臺北市南港區忠孝東路七段549號",,,
"7847","臺北市南港區忠孝東路七段566號",,,
"7848","臺北市南港區忠孝東路七段588號",,,
"7849","臺北市南港區忠孝東路七段605號",,,
"7850","臺北市南港區忠孝東路六段13號",,,
"7851","臺北市南港區忠孝東路六段148號",,,
"7852","臺北市南港區忠孝東路六段152號",,,
"7853","臺北市南港區忠孝東路六段156號",,,
"7854","臺北市南港區忠孝東路六段192號",,,
"7855","臺北市南港區忠孝東路六段210號",,,
"7856","臺北市南港區忠孝東路六段223號",,,
"7857","臺北市南港區忠孝東路六段26號",,,
"7858","臺北市南港區忠孝東路六段278巷1號",,,
"7859","臺北市南港區忠孝東路六段278巷30號",,,
"7860","臺北市南港區忠孝東路六段298號",,,
"7861","臺北市南港區忠孝東路六段302號",,,
"7862","臺北市南港區忠孝東路六段316號",,,
"7863","臺北市南港區忠孝東路六段370巷3號",,,
"7864","臺北市南港區昆陽街95號",,,
"7865","臺北市南港區東新街10之7號",,,
"7866","臺北市南港區東新街201號",,,
"7867","臺北市南港區東新街87號",,,
"7868","臺北市南港區東新街89巷7弄3號",,,
"7869","臺北市南港區松河街624號",,,
"7870","臺北市南港區南港路一段199號",,,
"7871","臺北市南港區南港路一段251號",,,
"7872","臺北市南港區南港路一段285號",,,
"7873","臺北市南港區南港路一段30巷2號",,,
"7874","臺北市南港區南港路一段30巷30之4號",,,
"7875","臺北市南港區南港路二段264號",,,
"7876","臺北市南港區南港路二段290號",,,
"7877","臺北市南港區南港路二段292號",,,
"7878","臺北市南港區南港路二段296號",,,
"7879","臺北市南港區南港路二段326號",,,
"7880","臺北市南港區南港路三段108號",,,
"7881","臺北市南港區南港路三段120號",,,
"7882","臺北市南港區南港路三段145號",,,
"7883","臺北市南港區南港路三段196號",,,
"7884","臺北市南港區南港路三段21號",,,
"7885","臺北市南港區南港路三段236號",,,
"7886","臺北市南港區南港路三段318號",,,
"7887","臺北市南港區南港路三段80巷13號",,,
"7888","臺北市南港區研究院路一段167號",,,
"7889","臺北市南港區研究院路一段38號",,,
"7890","臺北市南港區研究院路二段197巷1之3號",,,
"7891","臺北市南港區研究院路二段3之5號",,,
"7892","臺北市南港區研究院路二段3之8號",,,
"7893","臺北市南港區重陽路134號",,,
"7894","臺北市南港區重陽路140號",,,
"7895","臺北市南港區重陽路142號",,,
"7896","臺北市南港區重陽路14號",,,
"7897","臺北市南港區重陽路20號",,,
"7898","臺北市南港區重陽路28號",,,
"7899","臺北市南港區重陽路321號",,,
"7900","臺北市南港區重陽路433號",,,
"7901","臺北市南港區重陽路487之2號",,,
"7902","臺北市南港區富康街13號",,,
"7903","臺北市南港區富康街2號",,,
"7904","臺北市南港區福德街339巷3弄18號",,,
"7905","臺北市南港區興中路32號",,,
"7906","臺北市南港區興中路44巷12號",,,
"7907","臺北市南港區興中路80巷23號",,,
"7908","臺北市南港區興中路80巷24號",,,
"7909","臺北市南港區興南街25號",,,
"7910","臺北市南港區興南街60巷19號",,,
"7911","臺北市南港區興南街60巷27號",,,
"7912","臺北市南港區興華路85號",,,
"7913","臺北市南港區舊莊街一段84號",,,
"7914","臺北市萬華區大埔街2號",,,
"7915","臺北市萬華區中華路二段40號",,,
"7916","臺北市萬華區內江街111之2號",,,
"7917","臺北市萬華區內江街127號",,,
"7918","臺北市萬華區民和街70號",,,
"7919","臺北市萬華區汀州路一段6號",,,
"7920","臺北市萬華區西昌街207之2號",,,
"7921","臺北市萬華區西園路2段153之1號1樓及西藏路二段153之1號",,,
"7922","臺北市萬華區西園路二段132號",,,
"7923","臺北市萬華區西園路二段153之1號",,,
"7924","臺北市萬華區西園路二段247號",,,
"7925","臺北市萬華區西園路二段251號",,,
"7926","臺北市萬華區西園路二段292號",,,
"7927","臺北市萬華區西園路二段332號",,,
"7928","臺北市萬華區西園路二段42之5號",,,
"7929","臺北市萬華區西園路二段67之2號",,,
"7930","臺北市萬華區西園路二段96巷11號",,,
"7931","臺北市萬華區西寧南路122號",,,
"7932","臺北市萬華區西寧南路185之2號",,,
"7933","臺北市萬華區西寧南路273號",,,
"7934","臺北市萬華區西藏路191號",,,
"7935","臺北市萬華區西藏路232號",,,
"7936","臺北市萬華區西藏路234號",,,
"7937","臺北市萬華區西藏路249號",,,
"7938","臺北市萬華區西藏路254號",,,
"7939","臺北市萬華區西藏路261之1號",,,
"7940","臺北市萬華區西藏路269巷14號",,,
"7941","臺北市萬華區西藏路270號",,,
"7942","臺北市萬華區西藏路436號",,,
"7943","臺北市萬華區西藏路474號",,,
"7944","臺北市萬華區和平西路三段347號",,,
"7945","臺北市萬華區和平西路三段3之1號",,,
"7946","臺北市萬華區東園街203號",,,
"7947","臺北市萬華區東園街73巷56弄11號",,,
"7948","臺北市萬華區長泰街77號",,,
"7949","臺北市萬華區長順街14巷1弄12號",,,
