id,Address,Response_Address,Response_X,Response_Y
418,臺北市大安區光復南路102號8樓,臺北市大安區華聲里1鄰光復南路102號,306252.915,2770707.563
419,臺北市松山區南京東路4段197號7樓,臺北市松山區東勢里14鄰南京東路四段197號,306196.048,2771626.316
420,臺北市大安區信義路4段208號9樓,臺北市大安區義安里2鄰信義路四段208號,305690.919,2769546.688
421,臺北市文山區羅斯福路5段35號,臺北市文山區萬盛里1鄰羅斯福路五段35號,304378.108,2766717.708
422,臺北市松山區復興北路477號2樓,臺北市松山區民福里3鄰復興北路477號,304931.073,2773059.011
423,臺北市內湖區瑞光路413號9樓之1,臺北市內湖區港墘里20鄰瑞光路413號,307648.254,2774593.145
424,臺北市松山區八德路3段212號8樓,臺北市松山區復建里11鄰八德路三段212號,306178.304,2771207.077
425,臺北市內湖區堤頂大道2段285號10樓,臺北市內湖區西湖里13鄰堤頂大道二段285號,307049.212,2774599.006
426,臺北市中山區長安東路1段18號7樓,臺北市中山區正得里5鄰長安東路一段18號,302839.112,2771334.405
427,臺北市萬華區西寧南路36號7樓之32,臺北市萬華區萬壽里6鄰西寧南路36號,301121.797,2770923.03
428,臺北市松山區八德路4段678號12樓,臺北市松山區慈祐里18鄰八德路四段678號,308160.906,2771425.329
429,臺北市內湖區民權東路6段296巷20號4樓之11,臺北市內湖區葫洲里20鄰民權東路六段296巷20號,311147.248,2773917.442
430,臺北市內湖區內湖路1段360巷15號4樓之3,臺北市內湖區港墘里20鄰內湖路一段360巷15號,307573.523,2774862.505
431,臺北市信義區基隆路1段159號11樓之1,臺北市信義區興雅里6鄰基隆路一段159號,307030.817,2770544.195
432,臺北市大安區信義路4段265巷21弄28號2樓,臺北市大安區敦煌里6鄰信義路四段265巷21弄28號,306101.32,2769616.66
433,臺北市松山區民生東路3段130巷5弄2號2樓,臺北市松山區松基里12鄰民生東路三段130巷5弄2號,305130.793,2772206.132
434,臺北市北投區文林北路80巷59弄9號2樓,臺北市北投區建民里14鄰文林北路80巷59弄9號,302367.095,2777679.651
435,臺北市內湖區港墘路99號5樓,臺北市內湖區港富里2鄰港墘路99號,308273.18,2774794.903
436,臺北市北投區明德路219號1樓,臺北市北投區振華里12鄰明德路219號,302608.806,2778359.643
437,臺北市南港區三重路19之9號3樓,臺北市南港區三重里25鄰三重路19之9號,311854.975,2772300.139
438,臺北市大同區南京西路163之62號,臺北市大同區朝陽里8鄰南京西路163之71號,301772.656,2771877.552
439,臺北市士林區中山北路7段82巷31號2樓,臺北市士林區天山里16鄰中山北路七段82巷31號,303766.947,2779386.052
440,臺北市松山區南京東路4段11號4樓,臺北市松山區中華里11鄰南京東路四段11號,305473.963,2771640.896
441,臺北市萬華區漢中街131號7樓之1,臺北市萬華區新起里18鄰漢中街131號,301209.433,2770517.966
442,臺北市松山區塔悠路81號1樓,臺北市松山區新東里19鄰塔悠路81號,307565.417,2771653.336
443,臺北市萬華區柳州街90號4樓,臺北市萬華區仁德里15鄰柳州街90號,300952.052,2769967.321
444,臺北市中山區吉林路343巷15號1樓,臺北市中山區新福里10鄰吉林路343巷15號,303584.595,2773016.515
445,臺北市文山區福興路82巷6弄2號5樓,臺北市文山區興旺里18鄰福興路82巷6弄2號,305622.221,2766545.538
446,臺北市中山區復興北路60號3樓,臺北市中山區力行里12鄰復興北路60號,304867.372,2771458.728
447,臺北市大安區復興南路2段237號13樓,臺北市大安區群賢里2鄰復興南路二段237號,304871.11,2768750.522
448,臺北市大安區敦化南路2段170號4樓,臺北市大安區虎嘯里2鄰敦化南路二段170號,305340.847,2768556.502
449,臺北市內湖區新湖一路157號,臺北市內湖區湖元里18鄰新湖一路157號,308274.035,2772402.98
450,臺北市中山區松江路297巷19號1樓,臺北市中山區松江里7鄰松江路297巷19號,303947.84,2772651.875
451,臺北市松山區復興南路1段27號9樓,臺北市松山區中崙里2鄰復興南路一段27號,304902.754,2771040.713
452,臺北市中山區林森北路575號6樓之13,臺北市中山區晴光里6鄰林森北路575號,303046.383,2773090.231
453,臺北市信義區基隆路1段155號13樓之6,臺北市信義區興雅里6鄰基隆路一段155號,307046.103,2770572.592
454,臺北市松山區八德路3段212號8樓,臺北市松山區復建里11鄰八德路三段212號,306178.304,2771207.077
455,臺北市松山區光復南路65號12樓,臺北市松山區復盛里9鄰光復南路65號,306297.394,2770943.665
456,臺北市信義區基隆路1段155號10樓,臺北市信義區興雅里6鄰基隆路一段155號,307046.103,2770572.592
457,臺北市信義區基隆路1段380號3樓,臺北市信義區西村里9鄰基隆路一段380號,306538.92,2769727.326
458,臺北市大同區南京西路163號2樓之33,臺北市大同區朝陽里8鄰南京西路163號,301772.788,2771873.054
459,臺北市信義區信義路4段456號11樓,臺北市信義區中興里2鄰信義路四段456號,306337.517,2769530.103
460,臺北市南港區南港路3段80巷32號3樓,臺北市南港區西新里12鄰南港路三段80巷32號,309592.716,2772010.815
461,臺北市北投區中和街507巷6弄8號1樓,臺北市北投區智仁里19鄰中和街507巷6弄8號,299773.911,2781926.136
462,臺北市信義區信義路4段460號18樓,臺北市信義區中興里2鄰信義路四段460號,306390.512,2769529.448
463,臺北市內湖區民權東路6段123巷14號6樓之1,臺北市內湖區寶湖里5鄰民權東路六段123巷14號,309799.05,2773593.099
464,臺北市南港區重陽路592號5樓,臺北市南港區三重里21鄰重陽路592號,312024.271,2772891.974
465,臺北市大安區忠孝東路4段221號8樓,臺北市大安區建安里20鄰忠孝東路四段221號,305758.828,2770505.971
466,臺北市信義區松高路9號27樓,臺北市信義區興雅里2鄰松高路9號,307020.827,2770273.259
467,臺北市信義區忠孝東路5段453號11樓之1,臺北市信義區富臺里17鄰忠孝東路五段453號,308158.881,2770448.486
468,臺北市士林區社子街4號1樓,臺北市士林區社新里1鄰社子街4號,301311.999,2775575.462
469,臺北市中正區開封街1段20之3號3樓,臺北市中正區黎明里6鄰開封街一段20之3號,301829.492,2770953.824
470,臺北市內湖區康寧路3段159號3樓,臺北市內湖區明湖里9鄰康寧路三段159號,311702.033,2773709.254
471,臺北市信義區基隆路1段163號8樓之2,臺北市信義區興雅里6鄰基隆路一段163號,307035.346,2770521.194
472,臺北市大同區市民大道1段209號11樓,臺北市大同區建明里25鄰市民大道一段209號,302301.98,2771293.2
473,臺北市信義區忠孝東路5段510號15樓,臺北市信義區松光里1鄰忠孝東路五段510號,308407.231,2770460.427
474,臺北市中正區開封街1段11號3樓,臺北市中正區黎明里5鄰開封街一段11號,301852.184,2770978.107
475,臺北市中正區衡陽路51號7樓之6,臺北市中正區光復里8鄰衡陽路51號,301682.54,2770569.53
476,臺北市信義區忠孝東路5段412號18樓之1,臺北市信義區廣居里6鄰忠孝東路五段412號,308038.726,2770410.104
477,臺北市信義區忠孝東路5段524巷4號3樓,臺北市信義區松光里7鄰忠孝東路五段524巷4號,308468.881,2770438.101
478,臺北市信義區永吉路491巷5弄32號,臺北市信義區永吉里13鄰永吉路491巷5弄32號,308498.465,2771012.455
479,臺北市大安區敦化南路2段105號14樓,臺北市大安區義安里16鄰敦化南路二段105號,305416.238,2769042.356
480,臺北市中山區新生北路3段26號8樓之11,臺北市中山區恆安里14鄰新生北路三段26號,303208.512,2772939.316
481,臺北市南港區三重路19之11號3樓,臺北市南港區三重里25鄰三重路19之11號,311922.558,2772402.483
482,臺北市中正區羅斯福路2段126號2樓之1,臺北市中正區板溪里3鄰羅斯福路二段126號,302760.716,2768784.353
483,臺北市大安區市民大道4段100號4樓,臺北市大安區建安里2鄰市民大道四段100號,305484.984,2770811.988
484,臺北市松山區復興北路369號4樓,臺北市松山區民福里5鄰復興北路369號,304962.101,2772805.164
485,臺北市中山區松江路182號11樓之1,臺北市中山區中吉里14鄰松江路182號,303765.082,2772119.178
486,臺北市中山區長安東路2段178號7樓之4,臺北市中山區朱崙里9鄰長安東路二段178號,304545.844,2771227.181
487,臺北市松山區民生東路4段97巷7弄1號1樓,臺北市松山區精忠里5鄰民生東路四段97巷7弄1號,305668.076,2772409.61
488,臺北市南港區三重路66號14樓,臺北市南港區三重里13鄰三重路66號,311989.734,2772260.389
489,臺北市松山區敦化北路56號3樓,臺北市松山區中正里11鄰敦化北路56號,305348.241,2771515.391
490,臺北市內湖區康寧路3段189巷93弄2號,臺北市內湖區康寧里19鄰康寧路三段189巷93弄2號,311770.912,2774029.85
491,臺北市信義區光復南路495號,臺北市信義區中興里2鄰光復南路495號,306298.666,2769488.833
492,臺北市信義區基隆路1段149號3樓之8,臺北市信義區興雅里6鄰基隆路一段149號,307067.554,2770610.978
493,臺北市大安區龍泉街5巷16之1號,臺北市大安區龍泉里5鄰龍泉街5巷16之1號,303496.478,2768767.081
494,臺北市內湖區民權東路6段160號5樓之4,臺北市內湖區寶湖里13鄰民權東路六段160號,309711.229,2773515.268
495,臺北市中正區紹興北街35號2樓之5,臺北市中正區梅花里10鄰紹興北街35號,303027.854,2770908.964
496,臺北市南港區三重路19之11號E棟5樓545室,臺北市南港區三重里25鄰三重路19之11號,311922.558,2772402.483
497,臺北市大安區忠孝東路4段270號7樓之1,臺北市大安區正聲里1鄰忠孝東路四段270號,305988.184,2770454.124
498,臺北市大安區忠孝東路4段295號3樓,臺北市大安區華聲里11鄰忠孝東路四段295號,306009.965,2770500.942
499,臺北市信義區信義路5段7號38樓之1,臺北市信義區西村里8鄰信義路五段7號,306976.247,2769609.563
500,臺北市大安區安和路2段5號9樓之3,臺北市大安區通安里1鄰安和路二段5號,305768.535,2769529.149
501,臺北市中山區松江路67號4樓,臺北市中山區朱園里11鄰松江路67號,303798.737,2771336.96
502,臺北市中山區中山北路2段115巷3弄19號1樓,臺北市中山區聚葉里6鄰中山北路二段115巷3弄19號,302873.947,2772667.627
503,臺北市萬華區武昌街2段89號4樓,臺北市萬華區萬壽里11鄰武昌街二段89號,300858.243,2770906.711
504,臺北市松山區南京東路5段89號3樓,臺北市松山區東光里24鄰南京東路五段89號,306524.716,2771621.179
505,臺北市大安區信義路2段72號地下,臺北市大安區光明里3鄰信義路二段72號,303118.082,2769672.07
506,臺北市信義區忠孝東路5段1號13樓,臺北市信義區興雅里1鄰忠孝東路五段1號,306998.263,2770475.191
507,臺北市南港區成功路1段32號4樓之7,臺北市南港區西新里9鄰成功路一段32號,309789.02,2772061.448
508,臺北市士林區忠誠路1段16巷34號,臺北市士林區忠誠里20鄰忠誠路一段16巷34號,303070.139,2777587.815
509,臺北市中山區撫順街23號3樓之2,臺北市中山區集英里21鄰撫順街23號,302504.763,2772925.903
510,臺北市中山區松江路207號9樓,臺北市中山區中央里2鄰松江路207號,303809.816,2772214.975
511,臺北市松山區八德路2段346巷5之1號1樓,臺北市松山區中崙里11鄰八德路二段346巷5之1號,304998.107,2771095.805
512,臺北市萬華區中華路1段216號2樓之1,臺北市萬華區仁德里16鄰中華路一段216號,301090.813,2770008.536
513,臺北市內湖區瑞光路258巷35號9樓,臺北市內湖區港墘里20鄰瑞光路258巷35號,307999.864,2774214.275
514,臺北市士林區重慶北路4段248號1樓,臺北市士林區葫東里10鄰重慶北路四段248號,301580.175,2775470.655
515,臺北市中山區林森北路112號9樓,臺北市中山區正得里16鄰林森北路112號,302970.891,2771534.857
516,臺北市松山區敦化南路1段3號3樓,臺北市松山區敦化里1鄰敦化南路一段3號,305424.853,2771139.369
517,臺北市大同區長安西路150號6樓之1,臺北市大同區建明里11鄰長安西路150號,302126.212,2771514.992
518,臺北市松山區南京東路4段100號10樓之1,臺北市松山區美仁里4鄰南京東路四段100號,305924.078,2771588.693
519,臺北市中山區龍江路147號7樓之2,臺北市中山區復華里9鄰龍江路147號,304547.193,2771847.14
520,臺北市信義區基隆路2段77號8樓之3,臺北市信義區景聯里4鄰基隆路二段77號,306325.342,2769253.875
521,臺北市大安區信義路4段168號3樓之1,臺北市大安區義安里2鄰信義路四段168號,305582.643,2769550.447
522,臺北市內湖區金豐街70號10樓,臺北市內湖區石潭里13鄰金豐街70號,309223.363,2773150.692
523,臺北市大安區敦化南路1段245號5樓,臺北市大安區建倫里4鄰敦化南路一段245號,305426.602,2770223.598
524,臺北市松山區八德路4段760號6樓,臺北市松山區慈祐里20鄰八德路四段760號,308436.585,2771457.44
525,臺北市中正區忠孝東路2段60號1樓,臺北市中正區幸福里13鄰忠孝東路二段60號,303330.485,2770677.476
526,臺北市中山區林森北路651號1樓,臺北市中山區圓山里5鄰林森北路651號,303053.467,2773369.603
527,臺北市大安區忠孝東路4段221號10樓,臺北市大安區建安里20鄰忠孝東路四段221號,305758.828,2770505.971
528,臺北市大安區忠孝東路4段59號10樓之2,臺北市大安區光武里28鄰忠孝東路四段59號,305075.584,2770517.585
529,臺北市大安區忠孝東路3段305號6樓之1,臺北市大安區誠安里10鄰忠孝東路三段305號,304847.059,2770527.145
530,臺北市中山區民生東路3段49號11樓,臺北市中山區江山里10鄰民生東路三段49號,304489.825,2772319.942
531,臺北市松山區八德路4段678號12樓,臺北市松山區慈祐里18鄰八德路四段678號,308160.906,2771425.329
532,臺北市松山區南京東路5段239號6樓之20,臺北市松山區安平里33鄰南京東路五段239號,307005.055,2771613.722
533,臺北市內湖區瑞光路362號8樓,臺北市內湖區港墘里20鄰瑞光路362號,307737.173,2774459.756
534,臺北市大安區復興南路1段107巷5弄8號,臺北市大安區光武里22鄰復興南路一段107巷5弄8號,304955.125,2770774.935
535,臺北市大安區復興南路1段209號6樓,臺北市大安區仁愛里2鄰復興南路一段209號,304889.198,2770256.78
536,臺北市大安區復興南路1段287號8樓,臺北市大安區仁慈里11鄰復興南路一段287號,304881.966,2769810.225
537,臺北市文山區和平東路4段88巷5號,臺北市文山區萬美里29鄰和平東路四段88巷5號,307258.229,2766445.783
538,臺北市信義區基隆路1段333號21樓,臺北市信義區西村里8鄰基隆路一段333號,306623.479,2769688.933
539,臺北市大同區蘭州街48號2樓,臺北市大同區隆和里7鄰蘭州街48號,301961.199,2772959.105
540,臺北市中正區重慶南路2段51號10樓,臺北市中正區龍福里21鄰重慶南路二段51號,301964.596,2769334.454
541,臺北市中正區重慶南路1段10號8樓,臺北市中正區光復里2鄰重慶南路一段10號,301776.839,2771035.918
542,臺北市內湖區陽光街321巷12號7樓,臺北市內湖區湖元里18鄰陽光街321巷12號,308364.508,2773959.169
543,臺北市大安區安居街108巷13號2樓,臺北市大安區黎元里11鄰安居街108巷13號,305725.389,2768015.061
544,臺北市大安區光復南路420巷1弄12號,臺北市大安區光信里14鄰光復南路420巷1弄12號,306190.57,2769889.241
545,臺北市中山區南京西路1之1號10樓,臺北市中山區民安里10鄰南京西路1之1號,302649.929,2771697.985
546,臺北市大安區忠孝東路4段285號5樓,臺北市大安區車層里5鄰忠孝東路四段285號,305917.747,2770507.591
547,臺北市萬華區中華路1段170號12樓之2,臺北市萬華區新起里18鄰中華路一段170號,301215.463,2770420.431
548,臺北市松山區敦化北路145巷9號2樓,臺北市松山區中華里16鄰敦化北路145巷9號,305464.894,2771840.424
549,臺北市中正區重慶南路1段83號6樓,臺北市中正區黎明里8鄰重慶南路一段83號,301797.912,2770715.362
550,臺北市中山區長春路172號5樓之5,臺北市中山區中央里4鄰長春路172號,303863.454,2771941.618
551,臺北市信義區忠孝東路5段1之3號10樓,臺北市信義區興雅里1鄰忠孝東路五段1之3號,307003.059,2770491.089
552,臺北市大安區敦化南路2段1號12樓,臺北市大安區義安里1鄰敦化南路二段1號,305417.871,2769547.769
553,臺北市士林區德行西路36號3樓之14,臺北市士林區德行里16鄰德行西路36號,302765.72,2777539.544
554,臺北市大安區永康街23巷3之2號,臺北市大安區福住里11鄰永康街23巷3之2號,303487.024,2769418.747
555,臺北市中山區南京東路2段111號9樓,臺北市中山區中央里8鄰南京東路二段111號,303821.781,2771674.461
556,臺北市信義區基隆路2段33號12樓之2,臺北市信義區景聯里4鄰基隆路二段33號,306396.777,2769364.63
557,臺北市士林區德行西路36號3樓之13,臺北市士林區德行里16鄰德行西路36號,302765.72,2777539.544
558,臺北市信義區松山路130號9樓,臺北市信義區四育里3鄰松山路130號,308282.203,2771184.34
559,臺北市中山區民權西路79號2樓之3,臺北市中山區集英里19鄰民權西路79號,302426.551,2772862.049
560,臺北市大安區大安路1段52巷3號2樓,臺北市大安區光武里24鄰大安路一段52巷3號,305090.861,2770677.665
561,臺北市大安區敦化南路1段187巷66號,臺北市大安區建安里19鄰敦化南路一段187巷66號,305748.54,2770591.052
562,臺北市松山區民權東路3段102號8樓,臺北市松山區民有里5鄰民權東路三段102號,304957.059,2772744.757
563,臺北市信義區忠孝東路5段1之8號5樓,臺北市信義區興雅里1鄰忠孝東路五段1之8號,307030.406,2770470.373
564,臺北市內湖區大湖山莊街166號1樓,臺北市內湖區大湖里9鄰大湖山莊街166號,310661.473,2775529.21
565,臺北市中山區松江路8號9樓之8,臺北市中山區興亞里1鄰松江路8號,303752.243,2771032.689
566,臺北市內湖區堤頂大道2段477號2樓,臺北市內湖區西康里26鄰堤頂大道二段477號,306714.499,2774967.7
567,臺北市中山區南京東路2段101號11樓,臺北市中山區中吉里1鄰南京東路二段101號,303742.122,2771669.712
568,臺北市松山區南京東路5段343號5樓,臺北市松山區安平里23鄰南京東路五段343號,307274.939,2771608.233
569,臺北市士林區文林路404巷8號2樓,臺北市士林區福德里1鄰文林路404巷8號,303017.62,2776293.615
570,臺北市信義區基隆路1段180號3樓,臺北市信義區新仁里18鄰基隆路一段180號,307005.454,2770586.763
571,臺北市大安區光復南路102號地下1樓,臺北市大安區華聲里1鄰光復南路102號,306252.915,2770707.563
572,臺北市大安區延吉街133號,臺北市大安區華聲里15鄰延吉街133號,305934.936,2770600.826
573,臺北市大安區忠孝東路4段221號10樓,臺北市大安區建安里20鄰忠孝東路四段221號,305758.828,2770505.971
574,臺北市內湖區洲子街181號3樓,臺北市內湖區西湖里13鄰洲子街181號,307244.531,2774922.986
575,臺北市中山區中山北路2段96號10樓,臺北市中山區集英里7鄰中山北路二段96號,302732.634,2772468.427
576,臺北市中山區民權東路2段9號5樓之1,臺北市中山區新福里15鄰民權東路二段9號,303325.256,2772838.148
577,臺北市中正區重慶南路1段121號8樓之14,臺北市中正區黎明里9鄰重慶南路一段121號,301802.599,2770552.616
578,臺北市中山區明水路397巷9號,臺北市中山區永安里26鄰明水路397巷9號,305262.991,2774546.192
579,臺北市松山區八德路4段656號4樓,臺北市松山區慈祐里22鄰八德路四段656號,308059.862,2771422.659
580,臺北市萬華區漢中街147巷5號9樓之9,臺北市萬華區新起里19鄰漢中街147巷5號,301167.637,2770391.199
581,臺北市中山區吉林路393巷23號3樓,臺北市中山區新喜里17鄰吉林路393巷23號,303604.815,2773163.894
582,臺北市大同區民權西路104號12樓之2,臺北市大同區民權里21鄰民權西路104號,302212.378,2772822.792
583,臺北市萬華區漢中街147巷5號9樓之9,臺北市萬華區新起里19鄰漢中街147巷5號,301167.637,2770391.199
584,臺北市松山區南京東路4段11號4樓,臺北市松山區中華里11鄰南京東路四段11號,305473.963,2771640.896
585,臺北市中山區新生北路3段7號12樓之2,臺北市中山區新福里20鄰新生北路三段7號,303268.244,2772902.627
586,臺北市文山區興隆路4段135號,臺北市文山區忠順里2鄰興隆路四段135號,306691.662,2764272.876
587,臺北市內湖區文湖街21巷86號2樓,臺北市內湖區西康里3鄰文湖街21巷86號,306507.692,2775777.255
588,臺北市大安區忠孝東路4段221號10樓,臺北市大安區建安里20鄰忠孝東路四段221號,305758.828,2770505.971
589,臺北市信義區吳興街320巷8之13號地下室,臺北市信義區惠安里2鄰吳興街320巷8之13號,307014.985,2768708.581
590,臺北市大安區忠孝東路4段221號10樓,臺北市大安區建安里20鄰忠孝東路四段221號,305758.828,2770505.971
591,臺北市信義區永吉路187巷7號,臺北市信義區五常里12鄰永吉路187巷7號,307775.488,2771002.339
592,臺北市士林區福國路19之3號1樓,臺北市士林區德行里8鄰福國路19之3號,302903.839,2777153.797
593,臺北市大安區復興南路1段133之1號5樓,臺北市大安區光武里27鄰復興南路一段133之1號,304910.383,2770624.527
594,臺北市內湖區民權東路6段123巷18號2樓,臺北市內湖區寶湖里5鄰民權東路六段123巷18號,309799.58,2773610.826
595,臺北市中山區民生東路1段70號5樓,臺北市中山區中山里14鄰民生東路一段70號,303103.828,2772296.4
596,臺北市信義區信義路4段415號4樓之4,臺北市信義區中興里9鄰信義路四段415號,306434.582,2769582.96
597,臺北市內湖區堤頂大道2段301號7樓,臺北市內湖區西湖里13鄰堤頂大道二段301號,306984.949,2774624.575
598,臺北市松山區南京東路3段248號11樓之2,臺北市松山區中正里21鄰南京東路三段248號,304947.513,2771608.137
599,臺北市中山區民權東路3段37號2樓之1,臺北市中山區下埤里1鄰民權東路三段37號,304718.48,2772815.321
600,臺北市大安區忠孝東路4段221號10樓,臺北市大安區建安里20鄰忠孝東路四段221號,305758.828,2770505.971
601,臺北市大安區杭州南路2段65巷26號6樓,臺北市大安區錦泰里8鄰杭州南路二段65巷26號,302811.873,2769163.983
602,臺北市信義區忠孝東路5段510號15樓,臺北市信義區松光里1鄰忠孝東路五段510號,308407.231,2770460.427
603,臺北市大安區建國南路1段356號,臺北市大安區民炤里16鄰建國南路一段356號,304233.966,2769648.74
604,臺北市中正區中山北路1段2號11樓之11,臺北市中正區黎明里1鄰中山北路一段2號,302416.104,2770978.338
605,臺北市松山區八德路4段604號2樓之17,臺北市松山區慈祐里15鄰八德路四段604號,307788.146,2771416.168
606,臺北市信義區松德路171號13樓之1,臺北市信義區安康里21鄰松德路171號,308004.302,2769872.604
607,臺北市中正區寧波西街78號2樓之1,臺北市中正區南福里18鄰寧波西街78號,302109.052,2769196.541
608,臺北市中山區農安街6號8樓之5,臺北市中山區恆安里7鄰農安街6號,302791.273,2773055.383
609,臺北市大同區南京西路163號2樓之52,臺北市大同區朝陽里8鄰南京西路163號,301772.788,2771873.054
610,臺北市松山區南京東路5段251巷32弄9號2樓,臺北市松山區安平里4鄰南京東路五段251巷32弄9號,306964.21,2771751.703
611,臺北市松山區八德路3段164號3樓之7,臺北市松山區復建里6鄰八德路三段164號,306030.752,2771203.219
612,臺北市內湖區民權東路6段180巷6號11樓之12,臺北市內湖區寶湖里13鄰民權東路六段180巷6號,309789.618,2773462.164
613,臺北市信義區莊敬路325巷56號9樓之1,臺北市信義區三張里33鄰莊敬路325巷56號,307004.065,2769100.851
614,臺北市大安區仁愛路3段127號4樓,臺北市大安區義村里19鄰仁愛路三段127號,304717.974,2770128.002
615,臺北市松山區民生東路3段128號3樓,臺北市松山區松基里5鄰民生東路三段128號,305087.742,2772259.992
616,臺北市萬華區萬大路277巷48號9樓之3,臺北市萬華區忠貞里5鄰萬大路277巷48號,300753.406,2768690.296
617,臺北市大安區羅斯福路2段91號4樓,臺北市大安區古莊里6鄰羅斯福路二段91號,302889.439,2768672.211
618,臺北市內湖區安泰街45巷12號4樓,臺北市內湖區安泰里2鄰安泰街45巷12號,312363.755,2774127.888
619,臺北市大安區忠孝東路4段59號10樓之2,臺北市大安區光武里28鄰忠孝東路四段59號,305075.584,2770517.585
620,臺北市松山區敦化北路153之21號,臺北市松山區中華里16鄰敦化北路153之21號,305446.651,2771896.92
621,臺北市大安區敦化南路2段5號4樓之3,臺北市大安區義安里3鄰敦化南路二段5號,305417.315,2769525.759
622,臺北市內湖區堤頂大道2段477號2樓,臺北市內湖區西康里26鄰堤頂大道二段477號,306714.499,2774967.7
623,臺北市信義區松隆路102號17樓之1,臺北市信義區五常里15鄰松隆路102號,307619.045,2770981.488
624,臺北市內湖區瑞光路192號4樓之1,臺北市內湖區港墘里20鄰瑞光路192號,308222.119,2774179.017
