id,Address,Response_Address,Response_X,Response_Y
831,臺北市大安區忠孝東路4段221號12樓,臺北市大安區建安里20鄰忠孝東路四段221號,305758.828,2770505.971
832,臺北市大安區忠孝東路4段221號12樓,臺北市大安區建安里20鄰忠孝東路四段221號,305758.828,2770505.971
833,臺北市信義區忠孝東路5段1之10號3樓,臺北市信義區興雅里1鄰忠孝東路五段1之10號,307037.031,2770470.219
834,臺北市中正區重慶南路1段57號5樓之1,臺北市中正區黎明里7鄰重慶南路一段57號,301799.252,2770817.981
835,臺北市中正區忠孝西路1段7號9樓之2,臺北市中正區黎明里2鄰忠孝西路一段7號,302388.467,2770969.899
836,臺北市松山區八德路4段245巷18之2號,臺北市松山區吉祥里3鄰八德路四段245巷18之2號,306959.48,2771397.271
837,臺北市北投區致遠一路2段57巷6號5樓,臺北市北投區福興里18鄰致遠一路二段57巷6號,301751.777,2778289.395
838,臺北市松山區八德路3段212號12樓,臺北市松山區復建里11鄰八德路三段212號,306178.304,2771207.077
839,臺北市中山區復興北路66號10樓,臺北市中山區力行里12鄰復興北路66號,304868.143,2771490.999
840,臺北市信義區信義路4段413號10樓,臺北市信義區中興里11鄰信義路四段413號,306420.685,2769594.072
841,臺北市士林區承德路4段130號12樓,臺北市士林區承德里4鄰承德路四段130號,302771.544,2775166.093
842,臺北市內湖區行善路58號5樓之1,臺北市內湖區湖元里18鄰行善路58號,308108.144,2772203.377
843,臺北市信義區基隆路2段81號4樓,臺北市信義區景聯里6鄰基隆路二段81號,306314.794,2769235.127
844,臺北市內湖區大湖山莊街224號地下,臺北市內湖區大湖里12鄰大湖山莊街224號,310367.181,2775706.871
845,臺北市大同區重慶北路3段115之1號1樓,臺北市大同區揚雅里13鄰重慶北路三段115之1號,301868.186,2773332.563
846,臺北市大安區光復南路102號4樓,臺北市大安區華聲里1鄰光復南路102號,306252.915,2770707.563
847,臺北市文山區萬隆街62巷4號地下,臺北市文山區萬隆里13鄰萬隆街62巷4號,304236.802,2766010.737
848,臺北市大安區敦化南路2段218號5樓,臺北市大安區虎嘯里6鄰敦化南路二段218號,305335.416,2768312.096
849,臺北市大安區通化街120巷11號,臺北市大安區通安里13鄰通化街120巷11號,305859.109,2769155.875
850,臺北市信義區松德路12號6樓,臺北市信義區廣居里29鄰松德路12號,308262.283,2770302.757
851,臺北市大安區忠孝東路4段220號13樓,臺北市大安區車層里9鄰忠孝東路四段220號,305839.389,2770456.628
852,臺北市信義區松仁路281巷20號3樓,臺北市信義區泰和里2鄰松仁路281巷20號,307585.686,2768507.224
853,臺北市大安區復興南路2段160巷26號7樓之3,臺北市大安區龍陣里11鄰復興南路二段160巷26號,304662.86,2768965.639
854,臺北市松山區南京東路3段189號8樓,臺北市松山區中正里26鄰南京東路三段261之1號,305013.67,2771650.075
855,臺北市松山區民生東路3段100號5樓,臺北市松山區松基里3鄰民生東路三段100號,304936.874,2772257.581
856,臺北市大安區忠孝東路4段221號9樓,臺北市大安區建安里20鄰忠孝東路四段221號,305758.828,2770505.971
857,臺北市內湖區港墘路16號5樓,臺北市內湖區港華里1鄰港墘路16號,308310.208,2775106.619
858,臺北市中正區重慶南路1段43號6樓之4,臺北市中正區黎明里7鄰重慶南路一段43號,301798.976,2770855.558
859,臺北市萬華區東園街28巷50號2樓之18,臺北市萬華區忠德里2鄰東園街28巷50號,299933.353,2768803.475
860,臺北市松山區南京東路5段250巷36弄4號1樓,臺北市松山區新聚里23鄰南京東路五段250巷36弄4號,307143.154,2771379.336
861,臺北市中山區南京東路3段201號3樓,臺北市中山區復華里11鄰南京東路三段201號,304739.508,2771656.976
862,臺北市大安區仁愛路4段345巷2弄11號1樓,臺北市大安區車層里8鄰仁愛路四段345巷2弄11號,305858.466,2770166.397
863,臺北市中山區松江路129號7樓,臺北市中山區中央里5鄰松江路129號,303805.734,2771844.231
864,臺北市南港區南港路2段99之10號2樓,臺北市南港區東明里2鄰南港路二段99之10號,310252.269,2771843.423
865,臺北市中山區南京東路2段95號11樓,臺北市中山區中吉里1鄰南京東路二段95號,303703.569,2771670.072
866,臺北市中正區莒光路109號1樓,臺北市中正區廈安里11鄰莒光路109號,300916.975,2769321.77
867,臺北市中山區復興北路320巷11號1樓,臺北市中山區江山里24鄰復興北路320巷11號,304788.815,2772478.566
868,臺北市南港區三重路66號9樓,臺北市南港區三重里13鄰三重路66號,311989.734,2772260.389
869,臺北市大安區敦化南路2段164號10樓之3,臺北市大安區虎嘯里2鄰敦化南路二段164號,305338.795,2768595.28
870,臺北市松山區敦化北路303號11樓之1,臺北市松山區精忠里14鄰敦化北路303號,305453.531,2772356.539
871,臺北市大安區復興南路1段352號4樓,臺北市大安區和安里3鄰復興南路一段352號,304829.166,2769825.38
872,臺北市中正區博愛路136號5樓,臺北市中正區光復里9鄰博愛路136號,301604.727,2770626.793
873,臺北市松山區敦化北路205號6樓(610室),臺北市松山區精忠里4鄰敦化北路205號,305441.934,2772260
874,臺北市中正區北平東路20之4號,臺北市中正區梅花里4鄰北平東路20之4號,302969.008,2770971.438
875,臺北市大安區忠孝東路4段312號11樓,臺北市大安區正聲里14鄰忠孝東路四段312號,306192.509,2770450.142
876,臺北市信義區基隆路1段420號9樓之1,臺北市信義區中興里9鄰基隆路一段420號,306506.456,2769666.648
877,臺北市萬華區昆明街23號,臺北市萬華區萬壽里5鄰昆明街23號,301015.191,2770895.981
878,臺北市中山區松江路139號7樓之2,臺北市中山區中央里2鄰松江路139號,303806.672,2771985.756
879,臺北市中山區松江路131號4樓之2,臺北市中山區中央里5鄰松江路131號,303806.046,2771882.193
880,臺北市中山區復興北路168號5樓,臺北市中山區復華里1鄰復興北路168號,304874.286,2771831.931
881,臺北市中山區南京東路2段100號7樓之1,臺北市中山區興亞里18鄰南京東路二段100號,303664.285,2771626.803
882,臺北市文山區羅斯福路5段218巷38弄21號9樓,臺北市文山區萬隆里5鄰羅斯福路五段218巷38弄21號,304223.15,2766194.377
883,臺北市南港區八德路4段768巷5號6樓,臺北市南港區玉成里17鄰八德路四段768巷5號,308583.511,2771438.849
884,臺北市中山區吉林路24號11樓之1,臺北市中山區興亞里23鄰吉林路24號,303471.752,2771567.795
885,臺北市中正區金山北路1號5樓之6,臺北市中正區梅花里14鄰金山北路1號,303514.811,2770748.729
886,臺北市中山區農安街227巷3弄16號7樓,臺北市中山區行政里5鄰農安街227巷3弄16號,303932.205,2773090.253
887,臺北市內湖區瑞光路26巷36弄2號5樓,臺北市內湖區湖元里18鄰瑞光路26巷36弄2號,308736.571,2773545.047
888,臺北市中山區民權東路2段26號7樓之3,臺北市中山區新生里13鄰民權東路二段26號,303356.894,2772794.401
889,臺北市內湖區內湖路1段1巷9弄12號3樓,臺北市內湖區西康里27鄰內湖路一段1巷9弄12號,306251.869,2775426.07
890,臺北市松山區敦化北路170號3樓,臺北市松山區松基里13鄰敦化北路170號,305342.773,2772169.925
891,臺北市大安區羅斯福路3段77號6樓,臺北市大安區古莊里11鄰羅斯福路三段77號,303099.222,2768400.368
892,臺北市大安區光復南路102號14樓,臺北市大安區華聲里1鄰光復南路102號,306252.915,2770707.563
893,臺北市松山區復興北路201號7樓之3,臺北市松山區松基里1鄰復興北路201號,304920.793,2772055.974
894,臺北市信義區基隆路2段39巷22號,臺北市信義區景聯里17鄰基隆路二段39巷22號,306455.154,2769285.776
895,臺北市中山區長安東路2段171號4樓之1,臺北市中山區力行里3鄰長安東路二段171號,304656.717,2771248.079
896,臺北市信義區松隆路102號16樓之1,臺北市信義區五常里15鄰松隆路102號,307619.045,2770981.488
897,臺北市松山區復興北路367號8樓,臺北市松山區民有里5鄰復興北路367號,304934.345,2772721.338
898,臺北市松山區南京東路5段188號11樓,臺北市松山區吉祥里8鄰南京東路五段188號,306881.609,2771568.489
899,臺北市松山區南京東路4段197號9樓之1,臺北市松山區東勢里14鄰南京東路四段197號,306196.048,2771626.316
900,臺北市大安區忠孝東路4段146巷1號5樓,臺北市大安區建倫里20鄰忠孝東路四段146巷1號,305471.619,2770442.188
901,臺北市大安區忠孝東路4段285號5樓,臺北市大安區車層里5鄰忠孝東路四段285號,305917.747,2770507.591
902,臺北市中正區中華路1段59號7樓,臺北市中正區建國里6鄰中華路一段59號,301314.298,2770452.282
903,臺北市松山區南京東路5段251巷24弄22號2樓之1,臺北市松山區安平里5鄰南京東路五段251巷24弄22號,306924.822,2771717.907
904,臺北市中正區羅斯福路2段9號11樓之1,臺北市中正區新營里15鄰羅斯福路二段9號,302612.008,2769080.007
905,臺北市內湖區西湖里洲子街181號3樓,臺北市內湖區西湖里13鄰洲子街181號,307244.531,2774922.986
906,臺北市信義區忠孝東路5段1-8號5樓,臺北市信義區興雅里1鄰忠孝東路五段1之8號,307030.406,2770470.373
907,臺北市內湖區瑞光路26巷36弄2號5樓,臺北市內湖區湖元里18鄰瑞光路26巷36弄2號,308736.571,2773545.047
908,臺北市中山區民權東路3段37號2樓之1,臺北市中山區下埤里1鄰民權東路三段37號,304718.48,2772815.321
909,臺北市大安區忠孝東路4段146巷1號5樓,臺北市大安區建倫里20鄰忠孝東路四段146巷1號,305471.619,2770442.188
910,臺北市信義區國業里松德路65號11樓之1,臺北市信義區國業里3鄰松德路65號,308189.417,2770168.963
911,臺北市信義區西村里信義路5段7號37樓,臺北市信義區西村里8鄰信義路五段7號,306976.247,2769609.563
912,臺北市信義區松智路1號11樓,臺北市信義區西村里8鄰松智路1號,307122.957,2770191.765
913,臺北市信義區基隆路1段149號11樓,臺北市信義區興雅里6鄰基隆路一段149號,307067.554,2770610.978
914,臺北市南港區三重路19-3號,臺北市南港區三重里25鄰三重路19之3號,311835.501,2772182.452
915,臺北市中正區衡陽路51號11樓之1,臺北市中正區光復里8鄰衡陽路51號,301682.54,2770569.53
916,臺北市松山區民權東路3段104號3樓,臺北市松山區民有里5鄰民權東路三段104號,304969.046,2772742.603
917,臺北市大安區信義路4段6號11樓之3,臺北市大安區住安里3鄰信義路四段6號,304909.961,2769557.308
918,臺北市中山區建國北路2段76號2樓,臺北市中山區中央里1鄰建國北路二段76號,304129.374,2771985.916
919,臺北市信義區基隆路1段68號9樓,臺北市信義區新仁里19鄰基隆路一段68號,307232.227,2771069.825
920,臺北市大同區民權西路106號12樓之1,臺北市大同區民權里21鄰民權西路106號,302192.097,2772824.578
921,臺北市內湖區洲子街81號5樓,臺北市內湖區港墘里20鄰洲子街81號,307594.951,2774792.738
922,臺北市文山區辛亥路4段130巷9號,臺北市文山區興泰里12鄰辛亥路四段130巷9號,306173.024,2766439.912
923,臺北市松山區復興北路57號3樓之5,臺北市松山區中正里20鄰復興北路57號,304912.496,2771478.752
924,臺北市內湖區東湖路7巷19號3樓,臺北市內湖區安湖里2鄰東湖路7巷19號,311794.816,2773619.465
925,臺北市松山區南京東路4段164號12樓,臺北市松山區復勢里21鄰南京東路四段164號,306169.585,2771583.521
926,臺北市士林區德行西路36號3樓之12,臺北市士林區德行里16鄰德行西路36號,302765.72,2777539.544
927,臺北市大安區復興南路2段237號13樓,臺北市大安區群賢里2鄰復興南路二段237號,304871.11,2768750.522
928,臺北市內湖區新明路460巷12號1樓,臺北市內湖區行善里7鄰新明路460巷12號,308370.479,2771883.467
929,臺北市南港區三重路19之5號2樓,臺北市南港區三重里25鄰三重路19之5號,311911.391,2772235.57
930,臺北市大安區信義路3段106號3樓之4,臺北市大安區龍圖里1鄰信義路三段106號,304322.325,2769571.763
931,臺北市文山區政大二街96號2樓,臺北市文山區政大里9鄰政大二街96號,308983.373,2764493.624
932,臺北市中山區林森北路259巷17號5樓之2,臺北市中山區康樂里13鄰林森北路259巷17號,303133.086,2771908.108
933,臺北市松山區八德路3段182號3樓之10,臺北市松山區復建里6鄰八德路三段182號,306084.965,2771200.146
934,臺北市信義區信義路4段415號14樓之1,臺北市信義區中興里9鄰信義路四段415號,306434.582,2769582.96
935,臺北市大安區敦化南路1段188號7樓,臺北市大安區光武里5鄰敦化南路一段188號,305346.295,2770617.423
936,臺北市中正區延平南路3之2號1樓,臺北市中正區光復里2鄰延平南路3之2號,301555.88,2771024.242
937,臺北市中山區復興北路66號9樓,臺北市中山區力行里12鄰復興北路66號,304868.143,2771490.999
938,臺北市大安區復興南路1段368號8樓,臺北市大安區和安里4鄰復興南路一段368號,304835.541,2769757.148
939,臺北市內湖區星雲街15巷11號,臺北市內湖區紫星里30鄰星雲街15巷11號,309546.268,2774566.409
940,臺北市大安區忠孝東路4段169號6樓之1,臺北市大安區建安里16鄰忠孝東路四段169號,305541.268,2770509.776
941,臺北市內湖區洲子街62號5樓,臺北市內湖區港墘里20鄰洲子街62號,307753.145,2774685.461
942,臺北市信義區菸廠路88號6樓,臺北市信義區新仁里21鄰菸廠路88號,306618.553,2770850.1
943,臺北市大安區忠孝東路3段217巷4弄11號1樓,臺北市大安區昌隆里4鄰忠孝東路三段217巷4弄11號,304517.749,2770639.359
944,臺北市松山區復興北路99號4樓之5,臺北市松山區中正里31鄰復興北路99號,304916.628,2771741.723
945,臺北市士林區忠誠路1段173巷38號9樓,臺北市士林區聖山里4鄰忠誠路一段173巷38號,303696.268,2777882.681
946,臺北市信義區和平東路3段169號5樓之3,臺北市信義區黎平里1鄰和平東路三段169號,305831.315,2768557.603
947,臺北市大安區忠孝東路3段217巷4弄11號1樓,臺北市大安區昌隆里4鄰忠孝東路三段217巷4弄11號,304517.749,2770639.359
948,臺北市中山區安東街16巷13弄14號2樓,臺北市中山區埤頭里9鄰安東街16巷13弄14號,304599.106,2770955.028
949,臺北市中正區懷寧街112號4樓之2,臺北市中正區黎明里9鄰懷寧街112號,301855.94,2770490.589
950,臺北市中正區忠孝西路1段33號7樓,臺北市中正區黎明里3鄰忠孝西路一段33號,302344.777,2770981.636
951,臺北市中山區松江路100巷27號2樓,臺北市中山區興亞里17鄰松江路100巷27號,303522.543,2771539.97
952,臺北市大安區信義路4段279號8樓,臺北市大安區敦煌里7鄰信義路四段279號,305978.319,2769585.439
953,臺北市松山區民生東路5段69巷21弄12號1樓,臺北市松山區東榮里23鄰民生東路五段69巷21弄12號,306256.573,2772514.265
954,臺北市大安區敦化南路1段283號2樓,臺北市大安區敦安里19鄰敦化南路一段283號,305435.151,2769858.313
955,臺北市松山區八德路4段626號6樓,臺北市松山區慈祐里16鄰八德路四段626號,307937.266,2771420.458
956,臺北市信義區永吉路491巷5弄32號,臺北市信義區永吉里13鄰永吉路491巷5弄32號,308498.465,2771012.455
957,臺北市中正區青島東路5號7樓,臺北市中正區幸福里1鄰青島東路5號,302673.882,2770747.073
958,臺北市文山區羅斯福路5段257號2樓,臺北市文山區萬祥里4鄰羅斯福路五段257號,304454.284,2766021.616
959,臺北市南港區忠孝東路5段815號10樓之3,臺北市南港區合成里14鄰忠孝東路五段815號,308747.663,2770879.019
960,臺北市松山區南京東路5段202號2樓,臺北市松山區新聚里29鄰南京東路五段202號,306975.835,2771566.467
961,臺北市信義區松德路12號6樓,臺北市信義區廣居里29鄰松德路12號,308262.283,2770302.757
962,臺北市大安區仁愛路3段123巷11之2號,臺北市大安區義村里21鄰仁愛路三段123巷11之2號,304700.781,2770264.277
963,臺北市中山區南京東路2段95號11樓,臺北市中山區中吉里1鄰南京東路二段95號,303703.569,2771670.072
964,臺北市內湖區江南街85號3樓,臺北市內湖區港墘里6鄰江南街85號,308217.648,2774422.619
965,臺北市信義區松德路12號6樓,臺北市信義區廣居里29鄰松德路12號,308262.283,2770302.757
966,臺北市大安區和平東路3段49號9樓之6,臺北市大安區群賢里11鄰和平東路三段49號,305297.538,2768632.76
967,臺北市大安區敦化南路2段267號3樓之1,臺北市大安區全安里2鄰敦化南路二段267號,305414.628,2768692.001
968,臺北市松山區復興北路1號4樓、4樓之1,臺北市松山區中正里1鄰復興北路1號,304906.54,2771201.056
969,臺北市大安區仁愛路4段122巷63號4樓,臺北市大安區敦安里13鄰仁愛路四段122巷63號,305553.427,2769611.601
970,臺北市中正區八德路1段5號3樓之2,臺北市中正區梅花里14鄰八德路一段5號,303520.842,2770743.101
971,臺北市南港區重陽路120號3樓,臺北市南港區東新里18鄰重陽路120號,310484.608,2772175.048
972,臺北市萬華區環河南路1段23號12樓之3,臺北市萬華區福星里19鄰環河南路一段23號,300873.156,2771063.004
973,臺北市松山區敦化南路1段25號9樓之1,臺北市松山區敦化里1鄰敦化南路一段25號,305425.04,2771021.684
974,臺北市中正區重慶南路1段83號6樓,臺北市中正區黎明里8鄰重慶南路一段83號,301797.912,2770715.362
975,臺北市中山區松江路42號5樓之8,臺北市中山區興亞里6鄰松江路42號,303754,2771170.826
976,臺北市信義區光復南路495號,臺北市信義區中興里2鄰光復南路495號,306298.666,2769488.833
977,臺北市信義區和平東路3段225號9樓,臺北市信義區黎平里4鄰和平東路三段225號,305911.773,2768463.106
978,臺北市士林區後街16之1號3樓,臺北市士林區舊佳里17鄰後街16之1號,302936.593,2776726.16
979,臺北市內湖區陽光街321巷26號2樓之7,臺北市內湖區湖元里18鄰陽光街321巷26號,308371.606,2773917.507
980,臺北市內湖區舊宗路2段121巷9號3樓,臺北市內湖區湖元里18鄰舊宗路二段121巷9號,308047.124,2773582.377
981,臺北市中正區忠孝西路1段7號11樓之4,臺北市中正區黎明里2鄰忠孝西路一段7號,302388.467,2770969.899
982,臺北市中山區八德路2段232號10樓,臺北市中山區埤頭里10鄰八德路二段232號,304521.175,2771027.715
983,臺北市大安區復興南路1段352號4樓,臺北市大安區和安里3鄰復興南路一段352號,304829.166,2769825.38
984,臺北市信義區忠孝東路5段1-1號10樓,臺北市信義區興雅里1鄰忠孝東路五段1之1號,306998.79,2770483.453
985,臺北市中正區汀洲路1段328號3樓,找不到指定的門牌地址。,,
986,臺北市文山區景華街33號5樓,臺北市文山區景華里15鄰景華街33號,304742.088,2765342.526
987,臺北市松山區光復南路65號12樓,臺北市松山區復盛里9鄰光復南路65號,306297.394,2770943.665
988,臺北市中正區忠孝西路1段7號5樓之2,臺北市中正區黎明里2鄰忠孝西路一段7號,302388.467,2770969.899
989,臺北市萬華區西藏路172號1樓,臺北市萬華區頂碩里20鄰西藏路172號,300795.585,2769201.076
990,臺北市士林區基河路192號4樓,臺北市士林區福德里20鄰基河路192號,302638.407,2775910.832
991,臺北市內湖區文湖街12號4樓,臺北市內湖區西康里8鄰文湖街12號,306581.475,2775388.949
992,臺北市中山區民權西路66號,臺北市中山區集英里16鄰民權西路66號,302465.16,2772817.939
993,臺北市大安區忠孝東路4段224號10樓,臺北市大安區車層里9鄰忠孝東路四段224號,305865.339,2770456.574
994,臺北市大安區安和路2段5號10樓之4,臺北市大安區通安里1鄰安和路二段5號,305768.535,2769529.149
995,臺北市大同區迪化街1段48號3樓,臺北市大同區永樂里2鄰迪化街一段48號,301434.417,2771971.518
996,臺北市中正區博愛路38號3樓,臺北市中正區光復里13鄰博愛路38號,301584.422,2770957.229
997,臺北市內湖區堤頂大道1段331號6樓,臺北市內湖區湖元里18鄰堤頂大道一段331號,307804.776,2772854.031
998,臺北市內湖區新湖一路151號6樓,臺北市內湖區湖元里18鄰新湖一路151號,308248.849,2772391.87
999,臺北市內湖區康寧路3段189巷21弄27號2樓,臺北市內湖區明湖里13鄰康寧路三段189巷21弄27號,311767.47,2773813.136
1000,臺北市中正區羅斯福路3段84巷12弄8號,臺北市中正區頂東里21鄰羅斯福路三段84巷12弄8號,303019.513,2768270.307
1001,臺北市中正區忠孝西路1段66號28樓,臺北市中正區黎明里11鄰忠孝西路一段66號,301995.555,2770996.623
1002,臺北市松山區敦化北路155巷66弄24號（1樓）,臺北市松山區中華里5鄰敦化北路155巷66弄24號,305582.622,2772011.649
1003,臺北市內湖區南京東路6段461號2樓之2,臺北市內湖區石潭里11鄰南京東路六段461號,309262.089,2772647.827
1004,臺北市文山區辛亥路6段100巷4號,臺北市文山區華興里12鄰辛亥路六段100巷4號,305719.438,2764607.643
1005,臺北市信義區忠孝東路5段508之8號1樓,臺北市信義區松光里1鄰忠孝東路五段508之8號,308375.469,2770403.836
1006,臺北市中正區忠孝西路1段50號17樓之22,臺北市中正區黎明里11鄰忠孝西路一段50號,302048.097,2771005.519
1007,臺北市大安區復興南路1段390號11樓,臺北市大安區和安里4鄰復興南路一段390號,304834.488,2769622.85
1008,臺北市萬華區武昌街2段124之2號5樓之3,臺北市萬華區萬壽里10鄰武昌街二段124之2號,300823.465,2770899.012
1009,臺北市內湖區康寧路3段99巷17弄95號6樓,臺北市內湖區康寧里15鄰康寧路三段99巷17弄95號,311743.612,2774391.249
1010,臺北市中山區復興北路168號5樓,臺北市中山區復華里1鄰復興北路168號,304874.286,2771831.931
1011,臺北市中正區八德路1段5號7樓,臺北市中正區梅花里14鄰八德路一段5號,303520.842,2770743.101
1012,臺北市內湖區港墘路200號7樓,臺北市內湖區港墘里20鄰港墘路200號,308081.425,2774537.48
1013,臺北市松山區八德路4段678號12樓,臺北市松山區慈祐里18鄰八德路四段678號,308160.906,2771425.329
1014,臺北市中正區仁愛路1段4號6樓之2,臺北市中正區東門里10鄰仁愛路一段4號,302642.816,2770151.582
1015,臺北市士林區德行西路50號1樓,臺北市士林區德行里16鄰德行西路50號,302786.674,2777476.995
1016,臺北市信義區松德路65號11樓之1,臺北市信義區國業里3鄰松德路65號,308189.417,2770168.963
1017,臺北市大同區錦西街74之1號1樓,臺北市大同區雙連里3鄰錦西街74之1號,302390.146,2772544.602
1018,臺北市中山區南京東路2段216號2樓,臺北市中山區朱園里1鄰南京東路二段216號,304094.516,2771624.123
1019,臺北市松山區八德路4段656號4樓,臺北市松山區慈祐里22鄰八德路四段656號,308059.862,2771422.659
1020,臺北市文山區光輝路17號,臺北市文山區樟林里31鄰光輝路17號,306029.832,2764349.732
1021,臺北市信義區基隆路1段155號10樓,臺北市信義區興雅里6鄰基隆路一段155號,307046.103,2770572.592
1022,臺北市大安區信義路2段72號地下,臺北市大安區光明里3鄰信義路二段72號,303118.082,2769672.07
1023,臺北市大安區復興南路1段253巷32號,臺北市大安區仁慈里13鄰復興南路一段253巷32號,305003.78,2769953.328
1024,臺北市信義區基隆路2段81之1號11樓,臺北市信義區景聯里6鄰基隆路二段81之1號,306329.469,2769231.936
1025,臺北市信義區基隆路2段15號12樓,臺北市信義區景聯里1鄰基隆路二段15號,306435.482,2769454.909
1026,臺北市萬華區長沙街2段91號6樓之10,臺北市萬華區新起里12鄰長沙街二段91號,300931.459,2770364.205
1027,臺北市松山區敦化北路167號12樓,臺北市松山區中華里4鄰敦化北路167號,305435.826,2771949.804
1028,臺北市內湖區瑞光路235巷15號,臺北市內湖區瑞光里4鄰瑞光路235巷15號,308357.241,2774181.312
1029,臺北市內湖區瑞光路66巷36號3樓,臺北市內湖區湖元里18鄰瑞光路66巷36號,308643.533,2773660.912
1030,臺北市大安區信義路4段6號17樓之8,臺北市大安區住安里3鄰信義路四段6號,304909.961,2769557.308
1031,臺北市中山區建國北路1段26號5樓,臺北市中山區朱園里7鄰建國北路一段26號,304116.09,2771099.059
1032,臺北市士林區士商路70號1樓,臺北市士林區後港里2鄰士商路70號,302426.867,2775947.203
1033,臺北市內湖區瑞光路318號11樓之1,臺北市內湖區港墘里20鄰瑞光路318號,307869.301,2774398.775
1034,臺北市士林區東山路25巷46弄1號1樓,臺北市士林區東山里4鄰東山路25巷46弄1號,304606.999,2779001.32
1035,臺北市士林區中山北路7段150號1樓,臺北市士林區天山里19鄰中山北路七段150號,303713.052,2779562.366
1036,臺北市大安區安和路1段27號2樓,臺北市大安區建倫里3鄰安和路一段27號,305537.524,2770228.974
1037,臺北市中正區博愛路38號4樓,臺北市中正區光復里13鄰博愛路38號,301584.422,2770957.229
1038,臺北市中正區博愛路60號3樓,臺北市中正區光復里13鄰博愛路60號,301587.945,2770922.252
